this room is bothering the crayons in the library .	this room is bothering the crayons in the library . this room is bothering the crayons in the library .
those bowls have worried that school in the mall .	those bowls have worried that school in the mall . those bowls have worried that school in the mall .
in the room the box has visited the bag .	in the room the box has visited the bag . in the room the box has visited the bag .
on the ground those dishes can praise the boats .	on the ground those dishes can praise the boats . on the ground those dishes can praise the boats .
these boats in the mall must answer those rings .	these boats in the mall must answer those rings . these boats in the mall must answer those rings .
the windows can praise those glasses on the couch .	the windows can praise those glasses on the couch . the windows can praise those glasses on the couch .
those schools on the table have scared these boxes .	those schools on the table have scared these boxes . those schools on the table have scared these boxes .
the button in the library is teaching this spoon .	the button in the library is teaching this spoon . the button in the library is teaching this spoon .
those buttons are teaching the museum in the bank .	those buttons are teaching the museum in the bank . those buttons are teaching the museum in the bank .
those books might help these books by the ship .	those books might help these books by the ship . those books might help these books by the ship .
this ship has helped that plate by the picture .	this ship has helped that plate by the picture . this ship has helped that plate by the picture .
these dishes by the bag were teaching the car .	these dishes by the bag were teaching the car . these dishes by the bag were teaching the car .
the window on the table can appreciate the shirts .	the window on the table can appreciate the shirts . the window on the table can appreciate the shirts .
that bank could help the room by the bowl .	that bank could help the room by the bowl . that bank could help the room by the bowl .
on the stool the books may understand those rings .	on the stool the books may understand those rings . on the stool the books may understand those rings .
this window in the room is visiting the hat .	this window in the room is visiting the hat . this window in the room is visiting the hat .
those cars might scare this window by the shoe .	those cars might scare this window by the shoe . those cars might scare this window by the shoe .
in the kitchen the hats may praise these boats .	in the kitchen the hats may praise these boats . in the kitchen the hats may praise these boats .
this doll can bother the books by the cup .	this doll can bother the books by the cup . this doll can bother the books by the cup .
those schools in the school have helped that picture .	those schools in the school have helped that picture . those schools in the school have helped that picture .
this hat in the library would praise this boat .	this hat in the library would praise this boat . this hat in the library would praise this boat .
the car is bothering that ship by the couch .	the car is bothering that ship by the couch . the car is bothering that ship by the couch .
in the kitchen the plate will praise these pictures .	in the kitchen the plate will praise these pictures . in the kitchen the plate will praise these pictures .
these chairs in the room have helped these bowls .	these chairs in the room have helped these bowls . these chairs in the room have helped these bowls .
this bed in the hospital was bothering these pictures .	this bed in the hospital was bothering these pictures . this bed in the hospital was bothering these pictures .
these pictures on the street may help that restaurant .	these pictures on the street may help that restaurant . these pictures on the street may help that restaurant .
on the couch the hospital had lost those toys .	on the couch the hospital had lost those toys . on the couch the hospital had lost those toys .
these schools in the museum were teaching those pictures .	these schools in the museum were teaching those pictures . these schools in the museum were teaching those pictures .
on the table the cup will teach the ring .	on the table the cup will teach the ring . on the table the cup will teach the ring .
in the kitchen that room might worry that museum .	in the kitchen that room might worry that museum . in the kitchen that room might worry that museum .
by the bag that school had scared this spoon .	by the bag that school had scared this spoon . by the bag that school had scared this spoon .
in the room that bowl has worried those schools .	in the room that bowl has worried those schools . in the room that bowl has worried those schools .
the cars on the floor have visited this picture .	the cars on the floor have visited this picture . the cars on the floor have visited this picture .
this shirt in the mall may scare this kitchen .	this shirt in the mall may scare this kitchen . this shirt in the mall may scare this kitchen .
in the room the mirror had visited this truck .	in the room the mirror had visited this truck . in the room the mirror had visited this truck .
in the hospital this doll should bother the boat .	in the hospital this doll should bother the boat . in the hospital this doll should bother the boat .
in the library that door was bothering those rings .	in the library that door was bothering those rings . in the library that door was bothering those rings .
in the museum those forks will worry the chairs .	in the museum those forks will worry the chairs . in the museum those forks will worry the chairs .
the hat should visit those shirts on the street .	the hat should visit those shirts on the street . the hat should visit those shirts on the street .
these doors had taught that bed in the room .	these doors had taught that bed in the room . these doors had taught that bed in the room .
this doll on the bed must help that hat .	this doll on the bed must help that hat . this doll on the bed must help that hat .
that library had confused this kitchen in the room .	that library had confused this kitchen in the room . that library had confused this kitchen in the room .
these doors in the school would bother this ship .	these doors in the school would bother this ship . these doors in the school would bother this ship .
these books can answer those bowls on the floor .	these books can answer those bowls on the floor . these books can answer those bowls on the floor .
this bed on the couch is helping these shoes .	this bed on the couch is helping these shoes . this bed on the couch is helping these shoes .
the rocket on the couch must teach the bottles .	the rocket on the couch must teach the bottles . the rocket on the couch must teach the bottles .
on the table these schools will help those forks .	on the table these schools will help those forks . on the table these schools will help those forks .
this box may scare that spoon on the ground .	this box may scare that spoon on the ground . this box may scare that spoon on the ground .
these doors on the ground have answered that hat .	these doors on the ground have answered that hat . these doors on the ground have answered that hat .
that button must visit the pictures in the room .	that button must visit the pictures in the room . that button must visit the pictures in the room .
that car will visit those spoons on the stool .	that car will visit those spoons on the stool . that car will visit those spoons on the stool .
this museum would worry the doors on the stool .	this museum would worry the doors on the stool . this museum would worry the doors on the stool .
the button can worry the schools by the bicycle .	the button can worry the schools by the bicycle . the button can worry the schools by the bicycle .
the museum is bothering the shoes on the chair .	the museum is bothering the shoes on the chair . the museum is bothering the shoes on the chair .
in the library the shoe can teach that chair .	in the library the shoe can teach that chair . in the library the shoe can teach that chair .
on the floor the truck had bothered that shoe .	on the floor the truck had bothered that shoe . on the floor the truck had bothered that shoe .
the boats must help the books on the street .	the boats must help the books on the street . the boats must help the books on the street .
those schools could scare this candle on the street .	those schools could scare this candle on the street . those schools could scare this candle on the street .
the truck on the stool was teaching the plates .	the truck on the stool was teaching the plates . the truck on the stool was teaching the plates .
the shoe had helped this school by the book .	the shoe had helped this school by the book . the shoe had helped this school by the book .
those dishes might worry those chairs by the crayon .	those dishes might worry those chairs by the crayon . those dishes might worry those chairs by the crayon .
in the kitchen those forks were teaching the bank .	in the kitchen those forks were teaching the bank . in the kitchen those forks were teaching the bank .
that crayon is visiting the button on the table .	that crayon is visiting the button on the table . that crayon is visiting the button on the table .
these cars could appreciate this ship by the shoe .	these cars could appreciate this ship by the shoe . these cars could appreciate this ship by the shoe .
by the book that room has confused that dish .	by the book that room has confused that dish . by the book that room has confused that dish .
this restaurant by the candle would praise this button .	this restaurant by the candle would praise this button . this restaurant by the candle would praise this button .
the doors by the bed will appreciate this toy .	the doors by the bed will appreciate this toy . the doors by the bed will appreciate this toy .
those forks on the table should scare that bank .	those forks on the table should scare that bank . those forks on the table should scare that bank .
by the shoe the cars may praise those candles .	by the shoe the cars may praise those candles . by the shoe the cars may praise those candles .
these windows by the book have taught the cars .	these windows by the book have taught the cars . these windows by the book have taught the cars .
on the chair these trucks are helping the cars .	on the chair these trucks are helping the cars . on the chair these trucks are helping the cars .
this museum on the couch had worried that kitchen .	this museum on the couch had worried that kitchen . this museum on the couch had worried that kitchen .
the books by the bowl should understand these glasses .	the books by the bowl should understand these glasses . the books by the bowl should understand these glasses .
that school has confused the glasses on the street .	that school has confused the glasses on the street . that school has confused the glasses on the street .
by the bag those doors had visited these trucks .	by the bag those doors had visited these trucks . by the bag those doors had visited these trucks .
those toys on the ground might help this book .	those toys on the ground might help this book . those toys on the ground might help this book .
by the box these pictures may scare these rooms .	by the box these pictures may scare these rooms . by the box these pictures may scare these rooms .
the picture in the mall was visiting this room .	the picture in the mall was visiting this room . the picture in the mall was visiting this room .
on the couch the museum should teach this truck .	on the couch the museum should teach this truck . on the couch the museum should teach this truck .
the trucks are bothering that toy on the table .	the trucks are bothering that toy on the table . the trucks are bothering that toy on the table .
on the table the museum had helped the fork .	on the table the museum had helped the fork . on the table the museum had helped the fork .
in the library the schools would teach the glass .	in the library the schools would teach the glass . in the library the schools would teach the glass .
those candles by the truck could worry that toy .	those candles by the truck could worry that toy . those candles by the truck could worry that toy .
in the kitchen the school had lost that shirt .	in the kitchen the school had lost that shirt . in the kitchen the school had lost that shirt .
these windows in the hospital have scared those shirts .	these windows in the hospital have scared those shirts . these windows in the hospital have scared those shirts .
the window has taught these candles by the truck .	the window has taught these candles by the truck . the window has taught these candles by the truck .
the door on the bed had answered the dolls .	the door on the bed had answered the dolls . the door on the bed had answered the dolls .
that shirt has helped the school by the crayon .	that shirt has helped the school by the crayon . that shirt has helped the school by the crayon .
in the school this ship is teaching the cars .	in the school this ship is teaching the cars . in the school this ship is teaching the cars .
by the cup the boat was teaching the doll .	by the cup the boat was teaching the doll . by the cup the boat was teaching the doll .
by the shoe these schools had confused that doll .	by the shoe these schools had confused that doll . by the shoe these schools had confused that doll .
by the glass that bottle would answer this bottle .	by the glass that bottle would answer this bottle . by the glass that bottle would answer this bottle .
these hats should understand this school by the book .	these hats should understand this school by the book . these hats should understand this school by the book .
this boat had answered this shirt on the chair .	this boat had answered this shirt on the chair . this boat had answered this shirt on the chair .
the book should understand the chairs in the school .	the book should understand the chairs in the school . the book should understand the chairs in the school .
in the school that school was visiting that truck .	in the school that school was visiting that truck . in the school that school was visiting that truck .
the ring must answer the ship in the school .	the ring must answer the ship in the school . the ring must answer the ship in the school .
the glasses had bothered the schools in the library .	the glasses had bothered the schools in the library . the glasses had bothered the schools in the library .
the museum by the car might praise the toy .	the museum by the car might praise the toy . the museum by the car might praise the toy .
in the park those toys must understand this museum .	in the park those toys must understand this museum . in the park those toys must understand this museum .
the spoon may understand the spoons by the shirt .	the spoon may understand the spoons by the shirt . the spoon may understand the spoons by the shirt .
this plane had found that kitchen on the couch .	this plane had found that kitchen on the couch . this plane had found that kitchen on the couch .
these rings by the car have bothered that window .	these rings by the car have bothered that window . these rings by the car have bothered that window .
by the candle those books were helping this school .	by the candle those books were helping this school . by the candle those books were helping this school .
on the bed this hat has lost this fork .	on the bed this hat has lost this fork . on the bed this hat has lost this fork .
this car in the hospital is bothering the mirror .	this car in the hospital is bothering the mirror . this car in the hospital is bothering the mirror .
the pictures on the stool had bothered the plane .	the pictures on the stool had bothered the plane . the pictures on the stool had bothered the plane .
those bottles must worry the toys in the library .	those bottles must worry the toys in the library . those bottles must worry the toys in the library .
by the car these books might answer the cars .	by the car these books might answer the cars . by the car these books might answer the cars .
this ring has taught those books by the window .	this ring has taught those books by the window . this ring has taught those books by the window .
in the park these beds were helping those crayons .	in the park these beds were helping those crayons . in the park these beds were helping those crayons .
this plate was visiting the fork on the table .	this plate was visiting the fork on the table . this plate was visiting the fork on the table .
by the box those forks had helped these cars .	by the box those forks had helped these cars . by the box those forks had helped these cars .
that box on the stool would praise the glasses .	that box on the stool would praise the glasses . that box on the stool would praise the glasses .
the bank had answered the boat on the chair .	the bank had answered the boat on the chair . the bank had answered the boat on the chair .
those plates must teach that crayon in the hospital .	those plates must teach that crayon in the hospital . those plates must teach that crayon in the hospital .
that shirt by the book has taught the plane .	that shirt by the book has taught the plane . that shirt by the book has taught the plane .
by the toy these bags may teach this ship .	by the toy these bags may teach this ship . by the toy these bags may teach this ship .
by the dish the door must worry those windows .	by the dish the door must worry those windows . by the dish the door must worry those windows .
these schools have visited that hat by the boat .	these schools have visited that hat by the boat . these schools have visited that hat by the boat .
on the floor the rug has answered that fork .	on the floor the rug has answered that fork . on the floor the rug has answered that fork .
the hats in the kitchen would worry that ring .	the hats in the kitchen would worry that ring . the hats in the kitchen would worry that ring .
by the ring the windows might teach those boats .	by the ring the windows might teach those boats . by the ring the windows might teach those boats .
by the shirt that button should visit this couch .	by the shirt that button should visit this couch . by the shirt that button should visit this couch .
in the bank these shirts might appreciate the glass .	in the bank these shirts might appreciate the glass . in the bank these shirts might appreciate the glass .
on the couch these doors might worry the bottle .	on the couch these doors might worry the bottle . on the couch these doors might worry the bottle .
that boat will appreciate this fork in the room .	that boat will appreciate this fork in the room . that boat will appreciate this fork in the room .
by the chair this park might help this candle .	by the chair this park might help this candle . by the chair this park might help this candle .
that spoon might visit that plane on the floor .	that spoon might visit that plane on the floor . that spoon might visit that plane on the floor .
by the hat these beds are teaching these rings .	by the hat these beds are teaching these rings . by the hat these beds are teaching these rings .
the schools in the museum are helping these bowls .	the schools in the museum are helping these bowls . the schools in the museum are helping these bowls .
in the mall these cars are bothering this hospital .	in the mall these cars are bothering this hospital . in the mall these cars are bothering this hospital .
the dish is helping that hat by the shirt .	the dish is helping that hat by the shirt . the dish is helping that hat by the shirt .
these plates have found those schools by the car .	these plates have found those schools by the car . these plates have found those schools by the car .
in the school those rings could appreciate that mirror .	in the school those rings could appreciate that mirror . in the school those rings could appreciate that mirror .
in the bank those books have scared those glasses .	in the bank those books have scared those glasses . in the bank those books have scared those glasses .
by the plate that toy is teaching this rug .	by the plate that toy is teaching this rug . by the plate that toy is teaching this rug .
by the ship that bottle will worry this kitchen .	by the ship that bottle will worry this kitchen . by the ship that bottle will worry this kitchen .
by the ring this truck might scare those dishes .	by the ring this truck might scare those dishes . by the ring this truck might scare those dishes .
on the couch that museum will answer the plane .	on the couch that museum will answer the plane . on the couch that museum will answer the plane .
the hats should answer the rocket in the hospital .	the hats should answer the rocket in the hospital . the hats should answer the rocket in the hospital .
this fork is bothering this crayon in the museum .	this fork is bothering this crayon in the museum . this fork is bothering this crayon in the museum .
by the book these rings might praise these spoons .	by the book these rings might praise these spoons . by the book these rings might praise these spoons .
the box had visited the rooms on the stool .	the box had visited the rooms on the stool . the box had visited the rooms on the stool .
in the library this park was teaching the chair .	in the library this park was teaching the chair . in the library this park was teaching the chair .
the shirt may teach that chair in the restaurant .	the shirt may teach that chair in the restaurant . the shirt may teach that chair in the restaurant .
that candle on the couch had scared that window .	that candle on the couch had scared that window . that candle on the couch had scared that window .
by the bag this hospital has found those candles .	by the bag this hospital has found those candles . by the bag this hospital has found those candles .
the couch is teaching this door by the ring .	the couch is teaching this door by the ring . the couch is teaching this door by the ring .
by the book these plates are helping this truck .	by the book these plates are helping this truck . by the book these plates are helping this truck .
on the couch the ring must appreciate the shirts .	on the couch the ring must appreciate the shirts . on the couch the ring must appreciate the shirts .
the park in the bank had found the couch .	the park in the bank had found the couch . the park in the bank had found the couch .
this car on the bed had worried these bags .	this car on the bed had worried these bags . this car on the bed had worried these bags .
the chairs by the bag have found this restaurant .	the chairs by the bag have found this restaurant . the chairs by the bag have found this restaurant .
on the chair those glasses may teach the book .	on the chair those glasses may teach the book . on the chair those glasses may teach the book .
in the bank the bottle might understand those schools .	in the bank the bottle might understand those schools . in the bank the bottle might understand those schools .
the windows had found that shoe in the restaurant .	the windows had found that shoe in the restaurant . the windows had found that shoe in the restaurant .
by the book the cars must answer this rug .	by the book the cars must answer this rug . by the book the cars must answer this rug .
by the car those boxes would scare these candles .	by the car those boxes would scare these candles . by the car those boxes would scare these candles .
this hospital on the chair was helping these schools .	this hospital on the chair was helping these schools . this hospital on the chair was helping these schools .
the candles have confused those books in the room .	the candles have confused those books in the room . the candles have confused those books in the room .
this mall can appreciate those hats on the bed .	this mall can appreciate those hats on the bed . this mall can appreciate those hats on the bed .
this cup on the bed is helping the cups .	this cup on the bed is helping the cups . this cup on the bed is helping the cups .
that plate by the candle may appreciate the ring .	that plate by the candle may appreciate the ring . that plate by the candle may appreciate the ring .
by the book that door must bother these schools .	by the book that door must bother these schools . by the book that door must bother these schools .
the toy on the couch is visiting the fork .	the toy on the couch is visiting the fork . the toy on the couch is visiting the fork .
on the couch those candles were visiting that mall .	on the couch those candles were visiting that mall . on the couch those candles were visiting that mall .
the dish has visited the school by the car .	the dish has visited the school by the car . the dish has visited the school by the car .
that bowl has found this school on the couch .	that bowl has found this school on the couch . that bowl has found this school on the couch .
on the street this cup has worried those schools .	on the street this cup has worried those schools . on the street this cup has worried those schools .
the bed on the ground was visiting this museum .	the bed on the ground was visiting this museum . the bed on the ground was visiting this museum .
that doll by the bowl had confused this cup .	that doll by the bowl had confused this cup . that doll by the bowl had confused this cup .
that plane on the ground is visiting these candles .	that plane on the ground is visiting these candles . that plane on the ground is visiting these candles .
these boxes might visit the windows by the plane .	these boxes might visit the windows by the plane . these boxes might visit the windows by the plane .
