that truck will understand the car by the crayon .	that truck will understand the car by the crayon . that truck will understand the car by the crayon .
in the hospital the rocket has helped this ship .	in the hospital the rocket has helped this ship . in the hospital the rocket has helped this ship .
that library on the chair will bother that school .	that library on the chair will bother that school . that library on the chair will bother that school .
this museum by the car could visit that mirror .	this museum by the car could visit that mirror . this museum by the car could visit that mirror .
those forks are helping these cups by the couch .	those forks are helping these cups by the couch . those forks are helping these cups by the couch .
this hat on the bed must worry this car .	this hat on the bed must worry this car . this hat on the bed must worry this car .
by the bicycle the forks had scared those doors .	by the bicycle the forks had scared those doors . by the bicycle the forks had scared those doors .
that toy had worried the chairs in the bank .	that toy had worried the chairs in the bank . that toy had worried the chairs in the bank .
those glasses on the stool have answered this crayon .	those glasses on the stool have answered this crayon . those glasses on the stool have answered this crayon .
the buttons on the floor had helped these dishes .	the buttons on the floor had helped these dishes . the buttons on the floor had helped these dishes .
by the bed this cup may visit these plates .	by the bed this cup may visit these plates . by the bed this cup may visit these plates .
that bag on the street had helped the hat .	that bag on the street had helped the hat . that bag on the street had helped the hat .
the bag should scare those shoes in the bank .	the bag should scare those shoes in the bank . the bag should scare those shoes in the bank .
by the couch the rings must bother these beds .	by the couch the rings must bother these beds . by the couch the rings must bother these beds .
the bed in the bank will understand the doll .	the bed in the bank will understand the doll . the bed in the bank will understand the doll .
the toys in the hospital had bothered this ship .	the toys in the hospital had bothered this ship . the toys in the hospital had bothered this ship .
those buttons by the crayon have scared the fork .	those buttons by the crayon have scared the fork . those buttons by the crayon have scared the fork .
this fork was teaching this bag on the stool .	this fork was teaching this bag on the stool . this fork was teaching this bag on the stool .
in the school this kitchen has visited that crayon .	in the school this kitchen has visited that crayon . in the school this kitchen has visited that crayon .
these trucks would worry this park in the school .	these trucks would worry this park in the school . these trucks would worry this park in the school .
those chairs in the school had worried the books .	those chairs in the school had worried the books . those chairs in the school had worried the books .
by the bed these doors would praise these toys .	by the bed these doors would praise these toys . by the bed these doors would praise these toys .
on the floor the ship must help the dish .	on the floor the ship must help the dish . on the floor the ship must help the dish .
these beds in the restaurant had lost that school .	these beds in the restaurant had lost that school . these beds in the restaurant had lost that school .
by the glass that bottle would visit that car .	by the glass that bottle would visit that car . by the glass that bottle would visit that car .
by the window that plane is visiting that doll .	by the window that plane is visiting that doll . by the window that plane is visiting that doll .
by the shirt the rooms have helped those shirts .	by the shirt the rooms have helped those shirts . by the shirt the rooms have helped those shirts .
on the ground that doll has lost the pictures .	on the ground that doll has lost the pictures . on the ground that doll has lost the pictures .
this ring had found that bottle in the museum .	this ring had found that bottle in the museum . this ring had found that bottle in the museum .
these bottles might help this button by the window .	these bottles might help this button by the window . these bottles might help this button by the window .
those hats by the car should scare the restaurant .	those hats by the car should scare the restaurant . those hats by the car should scare the restaurant .
in the park this cup was teaching those glasses .	in the park this cup was teaching those glasses . in the park this cup was teaching those glasses .
those pictures on the stool could appreciate these cars .	those pictures on the stool could appreciate these cars . those pictures on the stool could appreciate these cars .
the rooms in the library have taught the cups .	the rooms in the library have taught the cups . the rooms in the library have taught the cups .
that door has found those boxes in the park .	that door has found those boxes in the park . that door has found those boxes in the park .
the dish in the school was helping that bottle .	the dish in the school was helping that bottle . the dish in the school was helping that bottle .
this couch on the table may scare the rocket .	this couch on the table may scare the rocket . this couch on the table may scare the rocket .
this doll is visiting this picture by the hat .	this doll is visiting this picture by the hat . this doll is visiting this picture by the hat .
by the ring that bicycle would praise the crayon .	by the ring that bicycle would praise the crayon . by the ring that bicycle would praise the crayon .
this car is helping the rooms in the bank .	this car is helping the rooms in the bank . this car is helping the rooms in the bank .
those trucks by the toy are bothering that dish .	those trucks by the toy are bothering that dish . those trucks by the toy are bothering that dish .
the cars were helping this plate in the mall .	the cars were helping this plate in the mall . the cars were helping this plate in the mall .
the room on the chair has helped that bottle .	the room on the chair has helped that bottle . the room on the chair has helped that bottle .
in the mall the crayons can understand this bottle .	in the mall the crayons can understand this bottle . in the mall the crayons can understand this bottle .
those shirts by the picture must praise these books .	those shirts by the picture must praise these books . those shirts by the picture must praise these books .
the library in the restaurant had answered the schools .	the library in the restaurant had answered the schools . the library in the restaurant had answered the schools .
on the chair this rocket has lost the shoes .	on the chair this rocket has lost the shoes . on the chair this rocket has lost the shoes .
those shoes in the library were teaching this school .	those shoes in the library were teaching this school . those shoes in the library were teaching this school .
that car has answered those shoes in the room .	that car has answered those shoes in the room . that car has answered those shoes in the room .
the crayons could worry these cars on the bed .	the crayons could worry these cars on the bed . the crayons could worry these cars on the bed .
by the toy these pictures are helping the windows .	by the toy these pictures are helping the windows . by the toy these pictures are helping the windows .
this school was teaching the boat on the table .	this school was teaching the boat on the table . this school was teaching the boat on the table .
those forks have found those rooms by the cup .	those forks have found those rooms by the cup . those forks have found those rooms by the cup .
this mirror should help these candles on the floor .	this mirror should help these candles on the floor . this mirror should help these candles on the floor .
in the room these schools are teaching the door .	in the room these schools are teaching the door . in the room these schools are teaching the door .
on the bed these forks had helped this bed .	on the bed these forks had helped this bed . on the bed these forks had helped this bed .
this glass by the window could answer that ship .	this glass by the window could answer that ship . this glass by the window could answer that ship .
the bicycle on the couch has confused these books .	the bicycle on the couch has confused these books . the bicycle on the couch has confused these books .
in the bank the books would bother that fork .	in the bank the books would bother that fork . in the bank the books would bother that fork .
these beds will praise this button on the couch .	these beds will praise this button on the couch . these beds will praise this button on the couch .
these windows in the mall may scare the hat .	these windows in the mall may scare the hat . these windows in the mall may scare the hat .
these boxes on the street have confused those boxes .	these boxes on the street have confused those boxes . these boxes on the street have confused those boxes .
on the chair those cups have taught these bags .	on the chair those cups have taught these bags . on the chair those cups have taught these bags .
on the stool the books should answer that shoe .	on the stool the books should answer that shoe . on the stool the books should answer that shoe .
this museum had taught the toy by the bottle .	this museum had taught the toy by the bottle . this museum had taught the toy by the bottle .
that cup on the couch is teaching this rug .	that cup on the couch is teaching this rug . that cup on the couch is teaching this rug .
by the rug that couch has lost this door .	by the rug that couch has lost this door . by the rug that couch has lost this door .
these crayons by the book may answer the picture .	these crayons by the book may answer the picture . these crayons by the book may answer the picture .
those glasses on the table had confused the rings .	those glasses on the table had confused the rings . those glasses on the table had confused the rings .
this window in the library had lost the boat .	this window in the library had lost the boat . this window in the library had lost the boat .
that truck must help these schools on the floor .	that truck must help these schools on the floor . that truck must help these schools on the floor .
those glasses can appreciate the fork by the ship .	those glasses can appreciate the fork by the ship . those glasses can appreciate the fork by the ship .
the pictures on the street may understand the rocket .	the pictures on the street may understand the rocket . the pictures on the street may understand the rocket .
these boats had lost those glasses in the room .	these boats had lost those glasses in the room . these boats had lost those glasses in the room .
that book is helping that dish by the button .	that book is helping that dish by the button . that book is helping that dish by the button .
the candles in the mall had taught the bed .	the candles in the mall had taught the bed . the candles in the mall had taught the bed .
the door on the chair can worry this candle .	the door on the chair can worry this candle . the door on the chair can worry this candle .
this door will appreciate that spoon on the table .	this door will appreciate that spoon on the table . this door will appreciate that spoon on the table .
that truck could appreciate that mall by the shoe .	that truck could appreciate that mall by the shoe . that truck could appreciate that mall by the shoe .
on the floor the hats may understand this mall .	on the floor the hats may understand this mall . on the floor the hats may understand this mall .
those crayons by the candle might answer that glass .	those crayons by the candle might answer that glass . those crayons by the candle might answer that glass .
on the street this mirror had worried this bowl .	on the street this mirror had worried this bowl . on the street this mirror had worried this bowl .
this school will praise these schools on the table .	this school will praise these schools on the table . this school will praise these schools on the table .
these beds were helping the library by the car .	these beds were helping the library by the car . these beds were helping the library by the car .
the bicycle is helping the picture by the cup .	the bicycle is helping the picture by the cup . the bicycle is helping the picture by the cup .
those cars by the boat have answered that chair .	those cars by the boat have answered that chair . those cars by the boat have answered that chair .
in the kitchen the buttons will scare these boats .	in the kitchen the buttons will scare these boats . in the kitchen the buttons will scare these boats .
by the book this hat is visiting those books .	by the book this hat is visiting those books . by the book this hat is visiting those books .
that shirt on the floor has worried the boxes .	that shirt on the floor has worried the boxes . that shirt on the floor has worried the boxes .
this button was teaching that ship on the bed .	this button was teaching that ship on the bed . this button was teaching that ship on the bed .
in the library the room has found this fork .	in the library the room has found this fork . in the library the room has found this fork .
this rocket had confused the mall on the couch .	this rocket had confused the mall on the couch . this rocket had confused the mall on the couch .
in the hospital this bank had helped that ship .	in the hospital this bank had helped that ship . in the hospital this bank had helped that ship .
on the stool that rug must help the crayon .	on the stool that rug must help the crayon . on the stool that rug must help the crayon .
the dishes are visiting these bottles in the kitchen .	the dishes are visiting these bottles in the kitchen . the dishes are visiting these bottles in the kitchen .
the book has taught the rug on the stool .	the book has taught the rug on the stool . the book has taught the rug on the stool .
this door by the shirt may appreciate those toys .	this door by the shirt may appreciate those toys . this door by the shirt may appreciate those toys .
on the bed the book can praise the hat .	on the bed the book can praise the hat . on the bed the book can praise the hat .
this bed by the doll would bother that dish .	this bed by the doll would bother that dish . this bed by the doll would bother that dish .
the buttons on the stool have confused the crayon .	the buttons on the stool have confused the crayon . the buttons on the stool have confused the crayon .
the books had lost the pictures on the stool .	the books had lost the pictures on the stool . the books had lost the pictures on the stool .
this plate by the box should teach that chair .	this plate by the box should teach that chair . this plate by the box should teach that chair .
by the rug the dishes have worried this button .	by the rug the dishes have worried this button . by the rug the dishes have worried this button .
by the mirror these shoes will scare the boat .	by the mirror these shoes will scare the boat . by the mirror these shoes will scare the boat .
those buttons by the bed were visiting the chairs .	those buttons by the bed were visiting the chairs . those buttons by the bed were visiting the chairs .
these crayons had confused that toy on the stool .	these crayons had confused that toy on the stool . these crayons had confused that toy on the stool .
the bag on the ground has answered these doors .	the bag on the ground has answered these doors . the bag on the ground has answered these doors .
those dishes in the library might praise these plates .	those dishes in the library might praise these plates . those dishes in the library might praise these plates .
the room has visited the ring by the hat .	the room has visited the ring by the hat . the room has visited the ring by the hat .
in the school these shirts can teach that glass .	in the school these shirts can teach that glass . in the school these shirts can teach that glass .
that rug on the stool had scared those trucks .	that rug on the stool had scared those trucks . that rug on the stool had scared those trucks .
on the couch the hat has confused these trucks .	on the couch the hat has confused these trucks . on the couch the hat has confused these trucks .
that plane was teaching the plane in the park .	that plane was teaching the plane in the park . that plane was teaching the plane in the park .
the toys can answer this bowl in the museum .	the toys can answer this bowl in the museum . the toys can answer this bowl in the museum .
the bottles on the stool should teach the candles .	the bottles on the stool should teach the candles . the bottles on the stool should teach the candles .
this rocket had lost those toys on the chair .	this rocket had lost those toys on the chair . this rocket had lost those toys on the chair .
these books had found these doors by the ring .	these books had found these doors by the ring . these books had found these doors by the ring .
the rooms have confused the book on the ground .	the rooms have confused the book on the ground . the rooms have confused the book on the ground .
the car on the floor is teaching the doors .	the car on the floor is teaching the doors . the car on the floor is teaching the doors .
this couch in the school has bothered the kitchen .	this couch in the school has bothered the kitchen . this couch in the school has bothered the kitchen .
on the street the schools must understand those schools .	on the street the schools must understand those schools . on the street the schools must understand those schools .
these beds in the park are visiting those windows .	these beds in the park are visiting those windows . these beds in the park are visiting those windows .
those rings by the bag have found those books .	those rings by the bag have found those books . those rings by the bag have found those books .
by the cup the box would praise these rings .	by the cup the box would praise these rings . by the cup the box would praise these rings .
that bag must understand these toys by the dish .	that bag must understand these toys by the dish . that bag must understand these toys by the dish .
these trucks on the bed might scare the bicycle .	these trucks on the bed might scare the bicycle . these trucks on the bed might scare the bicycle .
the doll by the ring could worry those trucks .	the doll by the ring could worry those trucks . the doll by the ring could worry those trucks .
that school by the button has bothered that dish .	that school by the button has bothered that dish . that school by the button has bothered that dish .
these plates on the street were bothering the shoes .	these plates on the street were bothering the shoes . these plates on the street were bothering the shoes .
by the toy that museum would teach this library .	by the toy that museum would teach this library . by the toy that museum would teach this library .
those cups are teaching this ring on the ground .	those cups are teaching this ring on the ground . those cups are teaching this ring on the ground .
by the spoon those glasses could bother the windows .	by the spoon those glasses could bother the windows . by the spoon those glasses could bother the windows .
on the stool that button should help the park .	on the stool that button should help the park . on the stool that button should help the park .
the room in the bank was teaching the rug .	the room in the bank was teaching the rug . the room in the bank was teaching the rug .
the crayon on the table has taught this glass .	the crayon on the table has taught this glass . the crayon on the table has taught this glass .
those cars on the couch had visited these shoes .	those cars on the couch had visited these shoes . those cars on the couch had visited these shoes .
those candles by the shoe were bothering the car .	those candles by the shoe were bothering the car . those candles by the shoe were bothering the car .
that door on the couch has lost those shoes .	that door on the couch has lost those shoes . that door on the couch has lost those shoes .
this restaurant can bother this couch on the stool .	this restaurant can bother this couch on the stool . this restaurant can bother this couch on the stool .
that dish by the plate was bothering the restaurant .	that dish by the plate was bothering the restaurant . that dish by the plate was bothering the restaurant .
these chairs by the window have lost the car .	these chairs by the window have lost the car . these chairs by the window have lost the car .
the doll in the museum had answered these hats .	the doll in the museum had answered these hats . the doll in the museum had answered these hats .
the doll on the couch has confused the glass .	the doll on the couch has confused the glass . the doll on the couch has confused the glass .
the rug has confused those books in the school .	the rug has confused those books in the school . the rug has confused those books in the school .
that room could teach the toys by the boat .	that room could teach the toys by the boat . that room could teach the toys by the boat .
in the bank these books were visiting those beds .	in the bank these books were visiting those beds . in the bank these books were visiting those beds .
on the ground this plate had taught that shoe .	on the ground this plate had taught that shoe . on the ground this plate had taught that shoe .
in the restaurant these cups should teach that car .	in the restaurant these cups should teach that car . in the restaurant these cups should teach that car .
that mall on the table has found those bags .	that mall on the table has found those bags . that mall on the table has found those bags .
on the ground these books will teach this cup .	on the ground these books will teach this cup . on the ground these books will teach this cup .
this doll by the crayon had answered the pictures .	this doll by the crayon had answered the pictures . this doll by the crayon had answered the pictures .
the park had lost this library in the museum .	the park had lost this library in the museum . the park had lost this library in the museum .
by the cup that toy can visit this bowl .	by the cup that toy can visit this bowl . by the cup that toy can visit this bowl .
these chairs in the bank had helped that shirt .	these chairs in the bank had helped that shirt . these chairs in the bank had helped that shirt .
this bowl on the floor is bothering this chair .	this bowl on the floor is bothering this chair . this bowl on the floor is bothering this chair .
these books can visit this car on the table .	these books can visit this car on the table . these books can visit this car on the table .
that museum will bother those spoons on the bed .	that museum will bother those spoons on the bed . that museum will bother those spoons on the bed .
this bowl should answer the mall by the rug .	this bowl should answer the mall by the rug . this bowl should answer the mall by the rug .
the room must appreciate these buttons on the bed .	the room must appreciate these buttons on the bed . the room must appreciate these buttons on the bed .
that book by the window is bothering the books .	that book by the window is bothering the books . that book by the window is bothering the books .
by the chair the chairs were bothering these cups .	by the chair the chairs were bothering these cups . by the chair the chairs were bothering these cups .
those rooms by the dish will help the glasses .	those rooms by the dish will help the glasses . those rooms by the dish will help the glasses .
in the school those dishes had scared that truck .	in the school those dishes had scared that truck . in the school those dishes had scared that truck .
in the restaurant the box had confused this hospital .	in the restaurant the box had confused this hospital . in the restaurant the box had confused this hospital .
by the doll this rug must help this museum .	by the doll this rug must help this museum . by the doll this rug must help this museum .
by the truck the dish has answered that fork .	by the truck the dish has answered that fork . by the truck the dish has answered that fork .
that boat had taught the spoon on the table .	that boat had taught the spoon on the table . that boat had taught the spoon on the table .
this school would scare that kitchen in the school .	this school would scare that kitchen in the school . this school would scare that kitchen in the school .
on the couch this school has answered that hat .	on the couch this school has answered that hat . on the couch this school has answered that hat .
that school had confused this ship by the plane .	that school had confused this ship by the plane . that school had confused this ship by the plane .
the mall will appreciate this mirror by the button .	the mall will appreciate this mirror by the button . the mall will appreciate this mirror by the button .
on the bed these books have bothered that rug .	on the bed these books have bothered that rug . on the bed these books have bothered that rug .
that mirror in the kitchen must answer the chairs .	that mirror in the kitchen must answer the chairs . that mirror in the kitchen must answer the chairs .
by the fork the shoes had helped those schools .	by the fork the shoes had helped those schools . by the fork the shoes had helped those schools .
that doll by the bed is visiting these cups .	that doll by the bed is visiting these cups . that doll by the bed is visiting these cups .
that bag can teach these cars on the ground .	that bag can teach these cars on the ground . that bag can teach these cars on the ground .
