these dishes were bothering that hat in the restaurant .	these dishes were bothering that hat in the restaurant . these dishes were bothering that hat in the restaurant .
the rooms by the hat may visit that bank .	the rooms by the hat may visit that bank . the rooms by the hat may visit that bank .
the bank on the floor had confused the picture .	the bank on the floor had confused the picture . the bank on the floor had confused the picture .
the boat is visiting the bottles by the cup .	the boat is visiting the bottles by the cup . the boat is visiting the bottles by the cup .
on the ground this school will help this mall .	on the ground this school will help this mall . on the ground this school will help this mall .
on the table the bag is helping those cups .	on the table the bag is helping those cups . on the table the bag is helping those cups .
on the ground this spoon has answered this school .	on the ground this spoon has answered this school . on the ground this spoon has answered this school .
the candle on the street had scared these rings .	the candle on the street had scared these rings . the candle on the street had scared these rings .
by the hat the schools are bothering these pictures .	by the hat the schools are bothering these pictures . by the hat the schools are bothering these pictures .
this plane by the ship has lost this bottle .	this plane by the ship has lost this bottle . this plane by the ship has lost this bottle .
on the street the car has taught that bag .	on the street the car has taught that bag . on the street the car has taught that bag .
this spoon in the school was teaching this restaurant .	this spoon in the school was teaching this restaurant . this spoon in the school was teaching this restaurant .
this car on the floor had found the books .	this car on the floor had found the books . this car on the floor had found the books .
that shirt by the doll had helped that hospital .	that shirt by the doll had helped that hospital . that shirt by the doll had helped that hospital .
by the ring these bottles will praise those dishes .	by the ring these bottles will praise those dishes . by the ring these bottles will praise those dishes .
this window by the rug had lost that restaurant .	this window by the rug had lost that restaurant . this window by the rug had lost that restaurant .
that truck by the window must visit that ring .	that truck by the window must visit that ring . that truck by the window must visit that ring .
those plates by the boat have scared the cup .	those plates by the boat have scared the cup . those plates by the boat have scared the cup .
the bowls will help those boats by the crayon .	the bowls will help those boats by the crayon . the bowls will help those boats by the crayon .
this ship in the restaurant can bother this restaurant .	this ship in the restaurant can bother this restaurant . this ship in the restaurant can bother this restaurant .
these candles have answered that car on the floor .	these candles have answered that car on the floor . these candles have answered that car on the floor .
the button was teaching these rings on the table .	the button was teaching these rings on the table . the button was teaching these rings on the table .
on the street the glass has found the rocket .	on the street the glass has found the rocket . on the street the glass has found the rocket .
the bed by the shirt can help that hospital .	the bed by the shirt can help that hospital . the bed by the shirt can help that hospital .
this mall is helping the cars by the bottle .	this mall is helping the cars by the bottle . this mall is helping the cars by the bottle .
by the book that room has confused the chair .	by the book that room has confused the chair . by the book that room has confused the chair .
that window had taught the mall in the library .	that window had taught the mall in the library . that window had taught the mall in the library .
those shoes by the cup were visiting this museum .	those shoes by the cup were visiting this museum . those shoes by the cup were visiting this museum .
on the chair those toys are bothering the candles .	on the chair those toys are bothering the candles . on the chair those toys are bothering the candles .
this bottle is visiting the ring in the room .	this bottle is visiting the ring in the room . this bottle is visiting the ring in the room .
in the restaurant these plates were bothering that dish .	in the restaurant these plates were bothering that dish . in the restaurant these plates were bothering that dish .
in the kitchen these dolls will bother the bag .	in the kitchen these dolls will bother the bag . in the kitchen these dolls will bother the bag .
on the couch this bed was bothering these dolls .	on the couch this bed was bothering these dolls . on the couch this bed was bothering these dolls .
those plates had found this bag in the school .	those plates had found this bag in the school . those plates had found this bag in the school .
this book had found the books on the stool .	this book had found the books on the stool . this book had found the books on the stool .
the hats have taught the rings in the library .	the hats have taught the rings in the library . the hats have taught the rings in the library .
these windows had answered the plane by the window .	these windows had answered the plane by the window . these windows had answered the plane by the window .
the museum in the park is visiting these windows .	the museum in the park is visiting these windows . the museum in the park is visiting these windows .
this crayon would help those schools by the bowl .	this crayon would help those schools by the bowl . this crayon would help those schools by the bowl .
these rings must appreciate these books by the door .	these rings must appreciate these books by the door . these rings must appreciate these books by the door .
that school is bothering that button in the park .	that school is bothering that button in the park . that school is bothering that button in the park .
on the chair the rug may teach that park .	on the chair the rug may teach that park . on the chair the rug may teach that park .
the hospital has answered these boxes in the park .	the hospital has answered these boxes in the park . the hospital has answered these boxes in the park .
that dish by the ring might praise the boats .	that dish by the ring might praise the boats . that dish by the ring might praise the boats .
this library was bothering the candle in the mall .	this library was bothering the candle in the mall . this library was bothering the candle in the mall .
that plane in the hospital should scare that cup .	that plane in the hospital should scare that cup . that plane in the hospital should scare that cup .
that ship in the room has taught the mirror .	that ship in the room has taught the mirror . that ship in the room has taught the mirror .
by the bicycle that school is helping that glass .	by the bicycle that school is helping that glass . by the bicycle that school is helping that glass .
the beds by the boat have lost this shirt .	the beds by the boat have lost this shirt . the beds by the boat have lost this shirt .
that couch in the room has scared the forks .	that couch in the room has scared the forks . that couch in the room has scared the forks .
those boats on the couch are bothering those schools .	those boats on the couch are bothering those schools . those boats on the couch are bothering those schools .
by the hat the park may visit that kitchen .	by the hat the park may visit that kitchen . by the hat the park may visit that kitchen .
by the car those shoes may worry these plates .	by the car those shoes may worry these plates . by the car those shoes may worry these plates .
those doors in the bank can teach the shirts .	those doors in the bank can teach the shirts . those doors in the bank can teach the shirts .
by the picture those schools might answer the park .	by the picture those schools might answer the park . by the picture those schools might answer the park .
on the floor this shirt will worry that book .	on the floor this shirt will worry that book . on the floor this shirt will worry that book .
in the mall these shoes were bothering this truck .	in the mall these shoes were bothering this truck . in the mall these shoes were bothering this truck .
those boats would visit these shirts in the park .	those boats would visit these shirts in the park . those boats would visit these shirts in the park .
on the couch this hat must understand that car .	on the couch this hat must understand that car . on the couch this hat must understand that car .
in the bank this ring can praise the boat .	in the bank this ring can praise the boat . in the bank this ring can praise the boat .
those rooms have bothered the plate by the car .	those rooms have bothered the plate by the car . those rooms have bothered the plate by the car .
these beds might answer the bank on the table .	these beds might answer the bank on the table . these beds might answer the bank on the table .
the book on the ground had taught those rings .	the book on the ground had taught those rings . the book on the ground had taught those rings .
by the picture the bags could understand these forks .	by the picture the bags could understand these forks . by the picture the bags could understand these forks .
those cars are visiting that library on the street .	those cars are visiting that library on the street . those cars are visiting that library on the street .
those glasses could appreciate this dish in the restaurant .	those glasses could appreciate this dish in the restaurant . those glasses could appreciate this dish in the restaurant .
that bag in the room has answered the school .	that bag in the room has answered the school . that bag in the room has answered the school .
the cup had answered that couch on the street .	the cup had answered that couch on the street . the cup had answered that couch on the street .
these bags will bother the door by the ship .	these bags will bother the door by the ship . these bags will bother the door by the ship .
by the rocket these doors are teaching the restaurant .	by the rocket these doors are teaching the restaurant . by the rocket these doors are teaching the restaurant .
those beds should scare the park in the park .	those beds should scare the park in the park . those beds should scare the park in the park .
this book in the bank has taught this book .	this book in the bank has taught this book . this book in the bank has taught this book .
that park may understand these glasses on the chair .	that park may understand these glasses on the chair . that park may understand these glasses on the chair .
the shoe in the mall has answered that candle .	the shoe in the mall has answered that candle . the shoe in the mall has answered that candle .
by the picture that button has helped this ring .	by the picture that button has helped this ring . by the picture that button has helped this ring .
this book in the library could understand that rug .	this book in the library could understand that rug . this book in the library could understand that rug .
that ring has found the car on the chair .	that ring has found the car on the chair . that ring has found the car on the chair .
these pictures by the book are helping the door .	these pictures by the book are helping the door . these pictures by the book are helping the door .
this hat was visiting the school on the street .	this hat was visiting the school on the street . this hat was visiting the school on the street .
in the mall this dish had helped that school .	in the mall this dish had helped that school . in the mall this dish had helped that school .
this box in the school is visiting the hats .	this box in the school is visiting the hats . this box in the school is visiting the hats .
that toy may appreciate the toys in the park .	that toy may appreciate the toys in the park . that toy may appreciate the toys in the park .
by the crayon the mirror will worry the dolls .	by the crayon the mirror will worry the dolls . by the crayon the mirror will worry the dolls .
those beds in the restaurant might teach that dish .	those beds in the restaurant might teach that dish . those beds in the restaurant might teach that dish .
that park can scare that restaurant in the restaurant .	that park can scare that restaurant in the restaurant . that park can scare that restaurant in the restaurant .
on the street the fork was visiting this box .	on the street the fork was visiting this box . on the street the fork was visiting this box .
by the book the doors were bothering this kitchen .	by the book the doors were bothering this kitchen . by the book the doors were bothering this kitchen .
by the box that window is visiting the mirror .	by the box that window is visiting the mirror . by the box that window is visiting the mirror .
the library in the restaurant could teach the candles .	the library in the restaurant could teach the candles . the library in the restaurant could teach the candles .
on the chair those spoons had answered this glass .	on the chair those spoons had answered this glass . on the chair those spoons had answered this glass .
the picture by the shirt could help that library .	the picture by the shirt could help that library . the picture by the shirt could help that library .
those chairs have scared this library on the stool .	those chairs have scared this library on the stool . those chairs have scared this library on the stool .
the fork had scared the mirror on the ground .	the fork had scared the mirror on the ground . the fork had scared the mirror on the ground .
on the bed that hat may bother that school .	on the bed that hat may bother that school . on the bed that hat may bother that school .
by the car these shoes had taught this museum .	by the car these shoes had taught this museum . by the car these shoes had taught this museum .
this bed by the ring may help that school .	this bed by the ring may help that school . this bed by the ring may help that school .
this chair on the couch is teaching the toy .	this chair on the couch is teaching the toy . this chair on the couch is teaching the toy .
that fork was helping those books on the table .	that fork was helping those books on the table . that fork was helping those books on the table .
that ring may understand the button in the library .	that ring may understand the button in the library . that ring may understand the button in the library .
these cups on the table had scared that window .	these cups on the table had scared that window . these cups on the table had scared that window .
by the picture this school had bothered the rooms .	by the picture this school had bothered the rooms . by the picture this school had bothered the rooms .
this car would bother those toys in the kitchen .	this car would bother those toys in the kitchen . this car would bother those toys in the kitchen .
the door by the bowl would scare this museum .	the door by the bowl would scare this museum . the door by the bowl would scare this museum .
the restaurant had found those schools in the park .	the restaurant had found those schools in the park . the restaurant had found those schools in the park .
those rooms in the bank are teaching this kitchen .	those rooms in the bank are teaching this kitchen . those rooms in the bank are teaching this kitchen .
this dish by the truck should praise that rocket .	this dish by the truck should praise that rocket . this dish by the truck should praise that rocket .
that mirror was helping this glass in the kitchen .	that mirror was helping this glass in the kitchen . that mirror was helping this glass in the kitchen .
that crayon may worry those shoes by the bed .	that crayon may worry those shoes by the bed . that crayon may worry those shoes by the bed .
those boats have taught the crayon by the picture .	those boats have taught the crayon by the picture . those boats have taught the crayon by the picture .
those dolls have found the door on the street .	those dolls have found the door on the street . those dolls have found the door on the street .
in the hospital that hospital has bothered these chairs .	in the hospital that hospital has bothered these chairs . in the hospital that hospital has bothered these chairs .
on the floor these windows should answer the crayon .	on the floor these windows should answer the crayon . on the floor these windows should answer the crayon .
on the table the bowls may worry these windows .	on the table the bowls may worry these windows . on the table the bowls may worry these windows .
these spoons might teach that car on the ground .	these spoons might teach that car on the ground . these spoons might teach that car on the ground .
by the bag this hat might scare these schools .	by the bag this hat might scare these schools . by the bag this hat might scare these schools .
those dolls have bothered the books on the table .	those dolls have bothered the books on the table . those dolls have bothered the books on the table .
the crayon had visited that plate by the door .	the crayon had visited that plate by the door . the crayon had visited that plate by the door .
in the mall the cup must scare these boxes .	in the mall the cup must scare these boxes . in the mall the cup must scare these boxes .
the rooms by the button will worry these books .	the rooms by the button will worry these books . the rooms by the button will worry these books .
this spoon will understand those shirts on the bed .	this spoon will understand those shirts on the bed . this spoon will understand those shirts on the bed .
by the mirror that chair has answered this car .	by the mirror that chair has answered this car . by the mirror that chair has answered this car .
the trucks by the box must praise the school .	the trucks by the box must praise the school . the trucks by the box must praise the school .
the chairs must visit this doll by the box .	the chairs must visit this doll by the box . the chairs must visit this doll by the box .
that spoon by the book would understand this book .	that spoon by the book would understand this book . that spoon by the book would understand this book .
the crayons by the button are helping this hat .	the crayons by the button are helping this hat . the crayons by the button are helping this hat .
the shoes by the crayon might scare the candles .	the shoes by the crayon might scare the candles . the shoes by the crayon might scare the candles .
the boat on the bed has visited the rug .	the boat on the bed has visited the rug . the boat on the bed has visited the rug .
this couch would visit those plates on the chair .	this couch would visit those plates on the chair . this couch would visit those plates on the chair .
the trucks should appreciate the truck on the stool .	the trucks should appreciate the truck on the stool . the trucks should appreciate the truck on the stool .
that bowl may help this spoon on the street .	that bowl may help this spoon on the street . that bowl may help this spoon on the street .
that plate may teach these beds in the kitchen .	that plate may teach these beds in the kitchen . that plate may teach these beds in the kitchen .
the hats by the dish were teaching those beds .	the hats by the dish were teaching those beds . the hats by the dish were teaching those beds .
on the table that hospital had taught those cups .	on the table that hospital had taught those cups . on the table that hospital had taught those cups .
this room on the ground can answer that book .	this room on the ground can answer that book . this room on the ground can answer that book .
the picture could scare those cars in the park .	the picture could scare those cars in the park . the picture could scare those cars in the park .
those hats by the shirt were teaching that dish .	those hats by the shirt were teaching that dish . those hats by the shirt were teaching that dish .
the fork should teach the car on the ground .	the fork should teach the car on the ground . the fork should teach the car on the ground .
on the couch these dishes were teaching the mall .	on the couch these dishes were teaching the mall . on the couch these dishes were teaching the mall .
this car has confused these candles on the ground .	this car has confused these candles on the ground . this car has confused these candles on the ground .
on the table the books were teaching the bottles .	on the table the books were teaching the bottles . on the table the books were teaching the bottles .
in the mall that park would bother that doll .	in the mall that park would bother that doll . in the mall that park would bother that doll .
that room on the couch has scared the candle .	that room on the couch has scared the candle . that room on the couch has scared the candle .
on the couch these crayons have taught this picture .	on the couch these crayons have taught this picture . on the couch these crayons have taught this picture .
this kitchen by the hat must appreciate this fork .	this kitchen by the hat must appreciate this fork . this kitchen by the hat must appreciate this fork .
on the bed this mall would worry those windows .	on the bed this mall would worry those windows . on the bed this mall would worry those windows .
in the kitchen these pictures had helped the spoon .	in the kitchen these pictures had helped the spoon . in the kitchen these pictures had helped the spoon .
this dish on the stool had scared those toys .	this dish on the stool had scared those toys . this dish on the stool had scared those toys .
by the plate the bottle must worry those pictures .	by the plate the bottle must worry those pictures . by the plate the bottle must worry those pictures .
that couch on the stool was bothering those shoes .	that couch on the stool was bothering those shoes . that couch on the stool was bothering those shoes .
by the rug the spoon should bother those pictures .	by the rug the spoon should bother those pictures . by the rug the spoon should bother those pictures .
the bank on the table was helping these dishes .	the bank on the table was helping these dishes . the bank on the table was helping these dishes .
these dishes have lost those crayons in the mall .	these dishes have lost those crayons in the mall . these dishes have lost those crayons in the mall .
on the ground those shoes were teaching the rooms .	on the ground those shoes were teaching the rooms . on the ground those shoes were teaching the rooms .
the boats in the school are bothering these bottles .	the boats in the school are bothering these bottles . the boats in the school are bothering these bottles .
the buttons by the glass had found these books .	the buttons by the glass had found these books . the buttons by the glass had found these books .
that book in the bank may scare the toys .	that book in the bank may scare the toys . that book in the bank may scare the toys .
on the ground the chairs will scare this book .	on the ground the chairs will scare this book . on the ground the chairs will scare this book .
on the street that book must bother the plate .	on the street that book must bother the plate . on the street that book must bother the plate .
the picture has visited those beds on the ground .	the picture has visited those beds on the ground . the picture has visited those beds on the ground .
this restaurant was teaching this button in the bank .	this restaurant was teaching this button in the bank . this restaurant was teaching this button in the bank .
these buttons in the hospital had answered that book .	these buttons in the hospital had answered that book . these buttons in the hospital had answered that book .
by the dish these rooms should praise the window .	by the dish these rooms should praise the window . by the dish these rooms should praise the window .
the spoon has taught that dish by the car .	the spoon has taught that dish by the car . the spoon has taught that dish by the car .
the boats by the book are teaching the toys .	the boats by the book are teaching the toys . the boats by the book are teaching the toys .
these glasses had helped that book on the couch .	these glasses had helped that book on the couch . these glasses had helped that book on the couch .
the chairs by the boat have lost the rug .	the chairs by the boat have lost the rug . the chairs by the boat have lost the rug .
those glasses would understand the beds in the bank .	those glasses would understand the beds in the bank . those glasses would understand the beds in the bank .
these plates by the glass are visiting this bowl .	these plates by the glass are visiting this bowl . these plates by the glass are visiting this bowl .
these doors in the park have worried that school .	these doors in the park have worried that school . these doors in the park have worried that school .
that toy on the couch could visit this rug .	that toy on the couch could visit this rug . that toy on the couch could visit this rug .
that bottle has worried the bowls in the mall .	that bottle has worried the bowls in the mall . that bottle has worried the bowls in the mall .
on the couch that candle would understand the beds .	on the couch that candle would understand the beds . on the couch that candle would understand the beds .
these dishes in the bank can bother that museum .	these dishes in the bank can bother that museum . these dishes in the bank can bother that museum .
by the car these forks have bothered this picture .	by the car these forks have bothered this picture . by the car these forks have bothered this picture .
