on the floor this dish had scared the chairs .	on the floor this dish had scared the chairs . on the floor this dish had scared the chairs .
these spoons on the table might scare the fork .	these spoons on the table might scare the fork . these spoons on the table might scare the fork .
by the bottle the couch must worry the mirror .	by the bottle the couch must worry the mirror . by the bottle the couch must worry the mirror .
on the stool those windows had scared the hat .	on the stool those windows had scared the hat . on the stool those windows had scared the hat .
the shirt should scare those boats on the bed .	the shirt should scare those boats on the bed . the shirt should scare those boats on the bed .
by the toy these windows must scare that cup .	by the toy these windows must scare that cup . by the toy these windows must scare that cup .
those glasses are visiting these chairs in the library .	those glasses are visiting these chairs in the library . those glasses are visiting these chairs in the library .
by the fork that toy was visiting that bank .	by the fork that toy was visiting that bank . by the fork that toy was visiting that bank .
the mall can bother the forks in the bank .	the mall can bother the forks in the bank . the mall can bother the forks in the bank .
the fork on the table was visiting those schools .	the fork on the table was visiting those schools . the fork on the table was visiting those schools .
in the room these toys have worried this ship .	in the room these toys have worried this ship . in the room these toys have worried this ship .
in the park this plate is bothering those buttons .	in the park this plate is bothering those buttons . in the park this plate is bothering those buttons .
this box on the table has worried this window .	this box on the table has worried this window . this box on the table has worried this window .
on the bed those spoons were bothering this shoe .	on the bed those spoons were bothering this shoe . on the bed those spoons were bothering this shoe .
those schools in the room are bothering these cups .	those schools in the room are bothering these cups . those schools in the room are bothering these cups .
the rooms in the park have bothered that plane .	the rooms in the park have bothered that plane . the rooms in the park have bothered that plane .
the restaurant was bothering this chair on the bed .	the restaurant was bothering this chair on the bed . the restaurant was bothering this chair on the bed .
those schools on the stool have visited that ship .	those schools on the stool have visited that ship . those schools on the stool have visited that ship .
that book might teach that dish on the table .	that book might teach that dish on the table . that book might teach that dish on the table .
by the mirror that doll was teaching the books .	by the mirror that doll was teaching the books . by the mirror that doll was teaching the books .
on the street the rug may answer the schools .	on the street the rug may answer the schools . on the street the rug may answer the schools .
on the stool the doors have confused the candles .	on the stool the doors have confused the candles . on the stool the doors have confused the candles .
this hat may understand those boxes by the fork .	this hat may understand those boxes by the fork . this hat may understand those boxes by the fork .
that plate must appreciate that door by the window .	that plate must appreciate that door by the window . that plate must appreciate that door by the window .
that room on the stool had helped this picture .	that room on the stool had helped this picture . that room on the stool had helped this picture .
on the table the glass is visiting those plates .	on the table the glass is visiting those plates . on the table the glass is visiting those plates .
by the bag the books have found these crayons .	by the bag the books have found these crayons . by the bag the books have found these crayons .
this ship was visiting those plates by the rocket .	this ship was visiting those plates by the rocket . this ship was visiting those plates by the rocket .
these rings were bothering this shoe on the bed .	these rings were bothering this shoe on the bed . these rings were bothering this shoe on the bed .
the box is teaching the restaurant by the spoon .	the box is teaching the restaurant by the spoon . the box is teaching the restaurant by the spoon .
by the rocket the hat was helping the button .	by the rocket the hat was helping the button . by the rocket the hat was helping the button .
those bottles on the ground have found that shirt .	those bottles on the ground have found that shirt . those bottles on the ground have found that shirt .
that glass in the kitchen has visited that candle .	that glass in the kitchen has visited that candle . that glass in the kitchen has visited that candle .
this door by the car may understand the boat .	this door by the car may understand the boat . this door by the car may understand the boat .
by the door those cars can bother this truck .	by the door those cars can bother this truck . by the door those cars can bother this truck .
on the stool those shoes had found this mirror .	on the stool those shoes had found this mirror . on the stool those shoes had found this mirror .
that rocket by the spoon will answer the rings .	that rocket by the spoon will answer the rings . that rocket by the spoon will answer the rings .
this car is bothering that plane in the school .	this car is bothering that plane in the school . this car is bothering that plane in the school .
that button by the couch has helped the ship .	that button by the couch has helped the ship . that button by the couch has helped the ship .
that bed in the park has visited the boxes .	that bed in the park has visited the boxes . that bed in the park has visited the boxes .
the kitchen in the mall is visiting these shirts .	the kitchen in the mall is visiting these shirts . the kitchen in the mall is visiting these shirts .
on the stool this plane can appreciate the car .	on the stool this plane can appreciate the car . on the stool this plane can appreciate the car .
the rug is visiting these spoons by the chair .	the rug is visiting these spoons by the chair . the rug is visiting these spoons by the chair .
the mirror is bothering the hat by the button .	the mirror is bothering the hat by the button . the mirror is bothering the hat by the button .
the books in the mall had taught this mirror .	the books in the mall had taught this mirror . the books in the mall had taught this mirror .
by the car the shoes had lost that museum .	by the car the shoes had lost that museum . by the car the shoes had lost that museum .
this shoe would appreciate this bicycle by the glass .	this shoe would appreciate this bicycle by the glass . this shoe would appreciate this bicycle by the glass .
in the restaurant the restaurant should visit the box .	in the restaurant the restaurant should visit the box . in the restaurant the restaurant should visit the box .
this bicycle by the toy is visiting the windows .	this bicycle by the toy is visiting the windows . this bicycle by the toy is visiting the windows .
the plane by the doll is teaching those dishes .	the plane by the doll is teaching those dishes . the plane by the doll is teaching those dishes .
the plate by the book would scare this truck .	the plate by the book would scare this truck . the plate by the book would scare this truck .
these doors have bothered those buttons in the hospital .	these doors have bothered those buttons in the hospital . these doors have bothered those buttons in the hospital .
on the couch the bank could answer that bag .	on the couch the bank could answer that bag . on the couch the bank could answer that bag .
that doll might appreciate these forks on the floor .	that doll might appreciate these forks on the floor . that doll might appreciate these forks on the floor .
these hats were visiting that hospital on the street .	these hats were visiting that hospital on the street . these hats were visiting that hospital on the street .
that door can answer the car by the cup .	that door can answer the car by the cup . that door can answer the car by the cup .
in the restaurant these shoes have helped these buttons .	in the restaurant these shoes have helped these buttons . in the restaurant these shoes have helped these buttons .
the spoons on the street are bothering the rug .	the spoons on the street are bothering the rug . the spoons on the street are bothering the rug .
on the ground these schools were helping the kitchen .	on the ground these schools were helping the kitchen . on the ground these schools were helping the kitchen .
these shoes should worry the school in the hospital .	these shoes should worry the school in the hospital . these shoes should worry the school in the hospital .
by the spoon these books had confused those buttons .	by the spoon these books had confused those buttons . by the spoon these books had confused those buttons .
on the bed this candle is visiting these forks .	on the bed this candle is visiting these forks . on the bed this candle is visiting these forks .
in the park the glass has taught that spoon .	in the park the glass has taught that spoon . in the park the glass has taught that spoon .
in the restaurant these cars had scared that window .	in the restaurant these cars had scared that window . in the restaurant these cars had scared that window .
on the street the bowls are visiting that glass .	on the street the bowls are visiting that glass . on the street the bowls are visiting that glass .
this room had worried the candle by the shoe .	this room had worried the candle by the shoe . this room had worried the candle by the shoe .
on the floor these bottles can help the plane .	on the floor these bottles can help the plane . on the floor these bottles can help the plane .
that plate in the restaurant had bothered that library .	that plate in the restaurant had bothered that library . that plate in the restaurant had bothered that library .
on the floor these dolls had scared that bicycle .	on the floor these dolls had scared that bicycle . on the floor these dolls had scared that bicycle .
this rug by the plate would praise those rings .	this rug by the plate would praise those rings . this rug by the plate would praise those rings .
by the dish these boats will worry this doll .	by the dish these boats will worry this doll . by the dish these boats will worry this doll .
these books by the spoon would worry this couch .	these books by the spoon would worry this couch . these books by the spoon would worry this couch .
on the bed that crayon is teaching the couch .	on the bed that crayon is teaching the couch . on the bed that crayon is teaching the couch .
that spoon in the mall has worried that restaurant .	that spoon in the mall has worried that restaurant . that spoon in the mall has worried that restaurant .
the spoons are helping the room by the shoe .	the spoons are helping the room by the shoe . the spoons are helping the room by the shoe .
this bowl is helping the boats in the park .	this bowl is helping the boats in the park . this bowl is helping the boats in the park .
the rings have found the school in the museum .	the rings have found the school in the museum . the rings have found the school in the museum .
in the library this truck could help these rings .	in the library this truck could help these rings . in the library this truck could help these rings .
the spoons on the bed may help the hospital .	the spoons on the bed may help the hospital . the spoons on the bed may help the hospital .
on the floor that shoe has found these windows .	on the floor that shoe has found these windows . on the floor that shoe has found these windows .
on the bed this bottle had answered this glass .	on the bed this bottle had answered this glass . on the bed this bottle had answered this glass .
the bank is bothering that room on the couch .	the bank is bothering that room on the couch . the bank is bothering that room on the couch .
that school had worried this button on the stool .	that school had worried this button on the stool . that school had worried this button on the stool .
on the street that bowl can praise the glass .	on the street that bowl can praise the glass . on the street that bowl can praise the glass .
by the bag those books are bothering these boats .	by the bag those books are bothering these boats . by the bag those books are bothering these boats .
the windows on the floor will help that mirror .	the windows on the floor will help that mirror . the windows on the floor will help that mirror .
by the button the shoe may bother the room .	by the button the shoe may bother the room . by the button the shoe may bother the room .
this room should help that toy by the bicycle .	this room should help that toy by the bicycle . this room should help that toy by the bicycle .
the cars on the table may visit the bank .	the cars on the table may visit the bank . the cars on the table may visit the bank .
these toys were visiting that school by the box .	these toys were visiting that school by the box . these toys were visiting that school by the box .
this dish by the shoe would understand the shirts .	this dish by the shoe would understand the shirts . this dish by the shoe would understand the shirts .
by the mirror these schools will bother this book .	by the mirror these schools will bother this book . by the mirror these schools will bother this book .
those cars had confused those windows by the doll .	those cars had confused those windows by the doll . those cars had confused those windows by the doll .
that school in the room was visiting the car .	that school in the room was visiting the car . that school in the room was visiting the car .
those schools should help the cars on the street .	those schools should help the cars on the street . those schools should help the cars on the street .
on the table this bag must worry the candles .	on the table this bag must worry the candles . on the table this bag must worry the candles .
those chairs in the library could teach those windows .	those chairs in the library could teach those windows . those chairs in the library could teach those windows .
the books should worry that museum in the room .	the books should worry that museum in the room . the books should worry that museum in the room .
on the stool that glass might visit this candle .	on the stool that glass might visit this candle . on the stool that glass might visit this candle .
those chairs by the toy should teach the bowl .	those chairs by the toy should teach the bowl . those chairs by the toy should teach the bowl .
by the ship that crayon might worry these candles .	by the ship that crayon might worry these candles . by the ship that crayon might worry these candles .
this bicycle can appreciate this shoe on the couch .	this bicycle can appreciate this shoe on the couch . this bicycle can appreciate this shoe on the couch .
these glasses are teaching the button by the toy .	these glasses are teaching the button by the toy . these glasses are teaching the button by the toy .
these spoons have found the spoons by the spoon .	these spoons have found the spoons by the spoon . these spoons have found the spoons by the spoon .
in the library the bag will scare this ship .	in the library the bag will scare this ship . in the library the bag will scare this ship .
those glasses could answer that mall in the kitchen .	those glasses could answer that mall in the kitchen . those glasses could answer that mall in the kitchen .
the bowls in the museum may answer these schools .	the bowls in the museum may answer these schools . the bowls in the museum may answer these schools .
these cars by the rocket could worry the car .	these cars by the rocket could worry the car . these cars by the rocket could worry the car .
those trucks by the window will appreciate this shirt .	those trucks by the window will appreciate this shirt . those trucks by the window will appreciate this shirt .
the bowls had bothered the buttons on the couch .	the bowls had bothered the buttons on the couch . the bowls had bothered the buttons on the couch .
the rug will answer the spoons by the rocket .	the rug will answer the spoons by the rocket . the rug will answer the spoons by the rocket .
this spoon by the bed had scared the plate .	this spoon by the bed had scared the plate . this spoon by the bed had scared the plate .
on the ground these spoons had taught that book .	on the ground these spoons had taught that book . on the ground these spoons had taught that book .
that mall has lost the doors on the stool .	that mall has lost the doors on the stool . that mall has lost the doors on the stool .
in the room the chair had bothered those books .	in the room the chair had bothered those books . in the room the chair had bothered those books .
that shirt was visiting the glasses by the ship .	that shirt was visiting the glasses by the ship . that shirt was visiting the glasses by the ship .
in the kitchen this crayon was bothering these doors .	in the kitchen this crayon was bothering these doors . in the kitchen this crayon was bothering these doors .
the truck could bother these spoons by the dish .	the truck could bother these spoons by the dish . the truck could bother these spoons by the dish .
on the floor that library has taught this rocket .	on the floor that library has taught this rocket . on the floor that library has taught this rocket .
in the restaurant the rooms can worry this ring .	in the restaurant the rooms can worry this ring . in the restaurant the rooms can worry this ring .
the spoons had taught the car by the book .	the spoons had taught the car by the book . the spoons had taught the car by the book .
that bag will visit the hat by the shoe .	that bag will visit the hat by the shoe . that bag will visit the hat by the shoe .
those dishes in the room would praise that book .	those dishes in the room would praise that book . those dishes in the room would praise that book .
this box on the chair might scare this hospital .	this box on the chair might scare this hospital . this box on the chair might scare this hospital .
that ship in the library could worry the mall .	that ship in the library could worry the mall . that ship in the library could worry the mall .
the rocket must appreciate those buttons in the restaurant .	the rocket must appreciate those buttons in the restaurant . the rocket must appreciate those buttons in the restaurant .
the rooms in the museum might praise the dishes .	the rooms in the museum might praise the dishes . the rooms in the museum might praise the dishes .
on the street the plane is helping this door .	on the street the plane is helping this door . on the street the plane is helping this door .
by the couch the couch would appreciate that hospital .	by the couch the couch would appreciate that hospital . by the couch the couch would appreciate that hospital .
this shirt by the glass had confused this hat .	this shirt by the glass had confused this hat . this shirt by the glass had confused this hat .
in the bank that fork had visited the library .	in the bank that fork had visited the library . in the bank that fork had visited the library .
by the ring that rug had scared these hats .	by the ring that rug had scared these hats . by the ring that rug had scared these hats .
those doors by the bottle were helping the library .	those doors by the bottle were helping the library . those doors by the bottle were helping the library .
this hospital by the spoon will scare that car .	this hospital by the spoon will scare that car . this hospital by the spoon will scare that car .
on the table that plane was helping the hat .	on the table that plane was helping the hat . on the table that plane was helping the hat .
these cars have worried this car in the park .	these cars have worried this car in the park . these cars have worried this car in the park .
this school has worried these dishes on the ground .	this school has worried these dishes on the ground . this school has worried these dishes on the ground .
this ring is teaching the couch in the school .	this ring is teaching the couch in the school . this ring is teaching the couch in the school .
this school will praise that bowl in the park .	this school will praise that bowl in the park . this school will praise that bowl in the park .
in the park that library is visiting the picture .	in the park that library is visiting the picture . in the park that library is visiting the picture .
in the mall this rocket was visiting that book .	in the mall this rocket was visiting that book . in the mall this rocket was visiting that book .
the mall by the picture has found the dish .	the mall by the picture has found the dish . the mall by the picture has found the dish .
this plane should answer those rings on the bed .	this plane should answer those rings on the bed . this plane should answer those rings on the bed .
in the park this fork can teach these crayons .	in the park this fork can teach these crayons . in the park this fork can teach these crayons .
the bicycle in the bank has scared those plates .	the bicycle in the bank has scared those plates . the bicycle in the bank has scared those plates .
on the floor those beds are bothering the bag .	on the floor those beds are bothering the bag . on the floor those beds are bothering the bag .
this chair was bothering these glasses in the museum .	this chair was bothering these glasses in the museum . this chair was bothering these glasses in the museum .
on the stool this rocket must scare this hospital .	on the stool this rocket must scare this hospital . on the stool this rocket must scare this hospital .
on the ground that mall may understand these forks .	on the ground that mall may understand these forks . on the ground that mall may understand these forks .
by the crayon that window had answered those rings .	by the crayon that window had answered those rings . by the crayon that window had answered those rings .
the plates in the kitchen have lost those boxes .	the plates in the kitchen have lost those boxes . the plates in the kitchen have lost those boxes .
those boats by the bicycle must understand these windows .	those boats by the bicycle must understand these windows . those boats by the bicycle must understand these windows .
that ship has lost this plate in the library .	that ship has lost this plate in the library . that ship has lost this plate in the library .
this car by the bottle would praise this fork .	this car by the bottle would praise this fork . this car by the bottle would praise this fork .
that bowl could bother those schools on the chair .	that bowl could bother those schools on the chair . that bowl could bother those schools on the chair .
those boxes in the library can help this box .	those boxes in the library can help this box . those boxes in the library can help this box .
the window was bothering that hat on the table .	the window was bothering that hat on the table . the window was bothering that hat on the table .
that bottle in the kitchen has bothered those chairs .	that bottle in the kitchen has bothered those chairs . that bottle in the kitchen has bothered those chairs .
those shoes would praise these shoes in the hospital .	those shoes would praise these shoes in the hospital . those shoes would praise these shoes in the hospital .
this shirt by the toy had bothered these boats .	this shirt by the toy had bothered these boats . this shirt by the toy had bothered these boats .
in the park this spoon has helped that hat .	in the park this spoon has helped that hat . in the park this spoon has helped that hat .
on the chair this bicycle had found these plates .	on the chair this bicycle had found these plates . on the chair this bicycle had found these plates .
these plates in the restaurant were visiting those plates .	these plates in the restaurant were visiting those plates . these plates in the restaurant were visiting those plates .
those boxes on the table were bothering the spoons .	those boxes on the table were bothering the spoons . those boxes on the table were bothering the spoons .
on the ground these buttons had helped the shirts .	on the ground these buttons had helped the shirts . on the ground these buttons had helped the shirts .
in the school the boat should answer the crayons .	in the school the boat should answer the crayons . in the school the boat should answer the crayons .
that bottle had bothered this window on the table .	that bottle had bothered this window on the table . that bottle had bothered this window on the table .
by the bowl the kitchen was bothering this plane .	by the bowl the kitchen was bothering this plane . by the bowl the kitchen was bothering this plane .
in the restaurant those bags should visit the door .	in the restaurant those bags should visit the door . in the restaurant those bags should visit the door .
on the couch these boxes will worry the book .	on the couch these boxes will worry the book . on the couch these boxes will worry the book .
that book has helped the schools by the couch .	that book has helped the schools by the couch . that book has helped the schools by the couch .
this truck has confused the bed by the shoe .	this truck has confused the bed by the shoe . this truck has confused the bed by the shoe .
in the bank that bed must bother the couch .	in the bank that bed must bother the couch . in the bank that bed must bother the couch .
on the bed that picture has confused those doors .	on the bed that picture has confused those doors . on the bed that picture has confused those doors .
