the car had talked to these tall shirts .	the car had talked to these tall shirt .
the toys understand those surprised chairs .	the toys understand those surprised chair .
the schools visit that healthy book .	the schools visit that healthy books .
the pictures were fixing these dry girls .	the pictures were fixing these dry girl .
the plate was n't losing these cool children .	the plate was n't losing these cool child .
the cars find those small people .	the cars find those small person .
the books answer these quiet cups .	the books answer these quiet cup .
the chair knew these boring shirts .	the chair knew these boring shirt .
the bowls do n't hear this angry book .	the bowls do n't hear this angry books .
the cars dropped this cute doctor .	the cars dropped this cute doctors .
the chair does n't find these hot teachers .	the chair does n't find these hot teacher .
the books were bringing that old lady .	the books were bringing that old ladies .
the cups were talking to this tired book .	the cups were talking to this tired books .
the kitchen could make those new people .	the kitchen could make those new person .
the bicycle moves these yellow teachers .	the bicycle moves these yellow teacher .
the books have n't thrown those cute ladies .	the books have n't thrown those cute lady .
the rocket is cleaning these red people .	the rocket is cleaning these red person .
the room was holding that yellow doctor .	the room was holding that yellow doctors .
the shirt would teach that happy bowl .	the shirt would teach that happy bowls .
the picture shook those gray doctors .	the picture shook those gray doctor .
the doll did n't visit this curious spoon .	the doll did n't visit this curious spoons .
the shirts should n't keep these gray women .	the shirts should n't keep these gray woman .
the cups knew those busy toys .	the cups knew those busy toy .
the crayon would bother this lucky toy .	the crayon would bother this lucky toys .
the bank can n't keep these orange teachers .	the bank can n't keep these orange teacher .
the rocket did n't talk to that wrong room .	the rocket did n't talk to that wrong rooms .
the books must shake these great children .	the books must shake these great child .
the candles have these amazing boys .	the candles have these amazing boy .
the cars could steal those cool women .	the cars could steal those cool woman .
the truck heard that happy crayon .	the truck heard that happy crayons .
the dishes were bothering these happy glasses .	the dishes were bothering these happy glass .
the kitchen answered those careful boats .	the kitchen answered those careful boat .
the glasses were n't helping this boring car .	the glasses were n't helping this boring cars .
the forks worry that excited crayon .	the forks worry that excited crayons .
the bicycle would teach this healthy crayon .	the bicycle would teach this healthy crayons .
the doors understand those important cars .	the doors understand those important car .
the button had heard those curious candles .	the button had heard those curious candle .
the forks help these healthy shirts .	the forks help these healthy shirt .
the dishes dropped that yellow guy .	the dishes dropped that yellow guys .
the doors had n't heard this curious box .	the doors had n't heard this curious boxes .
the books should n't fix that red person .	the books should n't fix that red people .
the spoon hears those careful plates .	the spoon hears those careful plate .
the pictures had heard these busy boxes .	the pictures had heard these busy box .
the bags hear these important plates .	the bags hear these important plate .
the kitchen can talk to that angry spoon .	the kitchen can talk to that angry spoons .
the rug is bothering those tall boxes .	the rug is bothering those tall box .
the book knows this angry doll .	the book knows this angry dolls .
the mall had n't confused this sleepy car .	the mall had n't confused this sleepy cars .
the hospital wo n't teach this upset bottle .	the hospital wo n't teach this upset bottles .
the rings hear this careful button .	the rings hear this careful buttons .
the plates found those excited bottles .	the plates found those excited bottle .
the windows help those gentle bowls .	the windows help those gentle bowl .
the bed might throw those black people .	the bed might throw those black person .
the windows understand these healthy bags .	the windows understand these healthy bag .
the candles held this broken woman .	the candles held this broken women .
the shoes have scared those gentle dolls .	the shoes have scared those gentle doll .
the spoons were bothering this curious bag .	the spoons were bothering this curious bags .
the books fixed that black teacher .	the books fixed that black teachers .
the boats knew these angry books .	the boats knew these angry book .
the bowl is n't teaching that curious truck .	the bowl is n't teaching that curious trucks .
the windows had n't scared this friendly toy .	the windows had n't scared this friendly toys .
the shirt has heard that lucky crayon .	the shirt has heard that lucky crayons .
the kitchen lost that nice window .	the kitchen lost that nice windows .
the windows heard this young doll .	the windows heard this young dolls .
the boat took that cold woman .	the boat took that cold women .
the trucks praise this confused dish .	the trucks praise this confused dishes .
the hats are n't visiting this angry ring .	the hats are n't visiting this angry rings .
the books found this friendly hat .	the books found this friendly hats .
the library has n't answered that friendly plate .	the library has n't answered that friendly plates .
the hats knew this busy window .	the hats knew this busy windows .
the museum has taken these awesome children .	the museum has taken these awesome child .
the book would worry that nice toy .	the book would worry that nice toys .
the buttons hear that healthy room .	the buttons hear that healthy rooms .
the library confused those happy schools .	the library confused those happy school .
the chairs lose this brown doctor .	the chairs lose this brown doctors .
the shirt has n't talked to these strong trucks .	the shirt has n't talked to these strong truck .
the door hears that helpful shoe .	the door hears that helpful shoes .
the buttons have n't talked to that nice fork .	the buttons have n't talked to that nice forks .
the beds were listening to those surprised bowls .	the beds were listening to those surprised bowl .
the window had n't heard this boring hat .	the window had n't heard this boring hats .
the box is bringing that old doctor .	the box is bringing that old doctors .
the ship did n't clean these purple women .	the ship did n't clean these purple woman .
the plate held those great people .	the plate held those great person .
the shoe was n't fixing this gray teacher .	the shoe was n't fixing this gray teachers .
the crayons wo n't buy that big guy .	the crayons wo n't buy that big guys .
the rocket is shaking those green ladies .	the rocket is shaking those green lady .
the bed worked with this surprised window .	the bed worked with this surprised windows .
the schools move this green lady .	the schools move this green ladies .
the rug makes these yellow girls .	the rug makes these yellow girl .
the boxes had n't lost those new people .	the boxes had n't lost those new person .
the books can help those angry cars .	the books can help those angry car .
the spoon brought these small teachers .	the spoon brought these small teacher .
the museum would shake those fine teachers .	the museum would shake those fine teacher .
the hospital holds those dry women .	the hospital holds those dry woman .
the bed should take this cool guy .	the bed should take this cool guys .
the trucks move that big lady .	the trucks move that big ladies .
the boxes heard those bored buttons .	the boxes heard those bored button .
the books do n't teach those tall toys .	the books do n't teach those tall toy .
the rooms bought these cool boys .	the rooms bought these cool boy .
the park had n't heard this boring car .	the park had n't heard this boring cars .
the shirts worried those gentle pictures .	the shirts worried those gentle picture .
the buttons did n't praise that surprised fork .	the buttons did n't praise that surprised forks .
the box has found that helpful school .	the box has found that helpful schools .
the museum wo n't scare these surprised cars .	the museum wo n't scare these surprised car .
the crayon might move that cold girl .	the crayon might move that cold girls .
the shirts were helping that boring fork .	the shirts were helping that boring forks .
the toys found these kind dishes .	the toys found these kind dish .
the bottle had n't dropped these broken children .	the bottle had n't dropped these broken child .
the doll knows this tired book .	the doll knows this tired books .
the rug has n't lost those kind trucks .	the rug has n't lost those kind truck .
the bicycle has n't cleaned those gray people .	the bicycle has n't cleaned those gray person .
the school has lost those quiet bottles .	the school has lost those quiet bottle .
the bank was helping this young car .	the bank was helping this young cars .
the shirts were helping those busy plates .	the shirts were helping those busy plate .
the rings helped these sleepy pictures .	the rings helped these sleepy picture .
the hospital would n't scare this surprised ring .	the hospital would n't scare this surprised rings .
the restaurant is n't helping this healthy fork .	the restaurant is n't helping this healthy forks .
the schools would listen to this smart spoon .	the schools would listen to this smart spoons .
the spoons were n't talking to these clever trucks .	the spoons were n't talking to these clever truck .
the beds were n't teaching this tired crayon .	the beds were n't teaching this tired crayons .
the dish talked to this clever car .	the dish talked to this clever cars .
the spoons teach this confused hat .	the spoons teach this confused hats .
the chair could know that boring dish .	the chair could know that boring dishes .
the hat was n't visiting that hungry car .	the hat was n't visiting that hungry cars .
the restaurant understands this upset glass .	the restaurant understands this upset glasses .
the rooms confused that bored candle .	the rooms confused that bored candles .
the door has brought that green lady .	the door has brought that green ladies .
the doll bothered that happy truck .	the doll bothered that happy trucks .
the schools worry this wrong shoe .	the schools worry this wrong shoes .
the couch is n't bothering those confused spoons .	the couch is n't bothering those confused spoon .
the book would n't work with those happy dishes .	the book would n't work with those happy dish .
the boats made this white lady .	the boats made this white ladies .
the bag knows this happy bowl .	the bag knows this happy bowls .
the bottles have worked with that hungry chair .	the bottles have worked with that hungry chairs .
the buttons will lift those white ladies .	the buttons will lift those white lady .
the glasses are n't dropping those blue guys .	the glasses are n't dropping those blue guy .
the trucks scared those nice forks .	the trucks scared those nice fork .
the kitchen kept this purple girl .	the kitchen kept this purple girls .
the bag is n't cleaning those green boys .	the bag is n't cleaning those green boy .
the book has lost that gentle car .	the book has lost that gentle cars .
the dolls drop this cold doctor .	the dolls drop this cold doctors .
the shirt wo n't sell those orange girls .	the shirt wo n't sell those orange girl .
the bed took this white girl .	the bed took this white girls .
the candle threw this old child .	the candle threw this old children .
the doors bother these healthy shoes .	the doors bother these healthy shoe .
the window answered this angry book .	the window answered this angry books .
the doll answered this boring fork .	the doll answered this boring forks .
the forks bought these cool men .	the forks bought these cool man .
the buttons do n't steal this blue woman .	the buttons do n't steal this blue women .
the hat taught that bored book .	the hat taught that bored books .
the museum is n't teaching that surprised car .	the museum is n't teaching that surprised cars .
the bag knows this important book .	the bag knows this important books .
the books care for those surprised rings .	the books care for those surprised ring .
the shoe knew those happy beds .	the shoe knew those happy bed .
the window talks to these excited dolls .	the window talks to these excited doll .
the boat was n't cleaning that purple man .	the boat was n't cleaning that purple men .
the car must buy these blue guys .	the car must buy these blue guy .
the bottles can take these cool women .	the bottles can take these cool woman .
the cars have lost that surprised glass .	the cars have lost that surprised glasses .
the doll holds those awesome men .	the doll holds those awesome man .
the cup did n't bring this great doctor .	the cup did n't bring this great doctors .
the fork is visiting that clever room .	the fork is visiting that clever rooms .
the bed visited these nice trucks .	the bed visited these nice truck .
the bottle might sell that cute lady .	the bottle might sell that cute ladies .
the plates understand those helpful books .	the plates understand those helpful book .
the doll made that red child .	the doll made that red children .
the library worked with this young ring .	the library worked with this young rings .
the car could appreciate these careful shirts .	the car could appreciate these careful shirt .
the rocket cleaned this great boy .	the rocket cleaned this great boys .
the bank brought those purple teachers .	the bank brought those purple teacher .
the boxes answered these quiet bags .	the boxes answered these quiet bag .
the dish worked with those angry rings .	the dish worked with those angry ring .
the shirt worked with these friendly cups .	the shirt worked with these friendly cup .
the book knew these friendly hats .	the book knew these friendly hat .
the glasses might answer that lucky window .	the glasses might answer that lucky windows .
the crayons had scared that confused car .	the crayons had scared that confused cars .
the bowl does n't hear this upset fork .	the bowl does n't hear this upset forks .
the bowls will move this new girl .	the bowls will move this new girls .
the boat held those small teachers .	the boat held those small teacher .
the museum may move this big guy .	the museum may move this big guys .
the kitchen heard that confused bowl .	the kitchen heard that confused bowls .
the trucks took those amazing children .	the trucks took those amazing child .
the shirts should listen to those confused boxes .	the shirts should listen to those confused box .
the cup talked to this upset book .	the cup talked to this upset books .
the ship does n't find these orange boys .	the ship does n't find these orange boy .
the dolls might praise this careful school .	the dolls might praise this careful schools .
the cars could listen to those important pictures .	the cars could listen to those important picture .
the car had lost this kind boat .	the car had lost this kind boats .
the rooms would know those tired crayons .	the rooms would know those tired crayon .
the truck would n't make these new people .	the truck would n't make these new person .
the bank has n't fixed that big doctor .	the bank has n't fixed that big doctors .
the candles confused those lucky forks .	the candles confused those lucky fork .
the candle took those dry doctors .	the candle took those dry doctor .
the shirt wo n't bring that dry person .	the shirt wo n't bring that dry people .
the museum had n't worried those strong shirts .	the museum had n't worried those strong shirt .
the buttons are n't cleaning this fine teacher .	the buttons are n't cleaning this fine teachers .
the dolls could hold this small teacher .	the dolls could hold this small teachers .
the plane has taken that yellow teacher .	the plane has taken that yellow teachers .
the bags were n't helping this kind ring .	the bags were n't helping this kind rings .
the doors are working with these confused cars .	the doors are working with these confused car .
the picture could hear those sleepy dolls .	the picture could hear those sleepy doll .
the window is n't visiting these boring books .	the window is n't visiting these boring book .
the crayon should know this careful crayon .	the crayon should know this careful crayons .
the crayons have visited this boring book .	the crayons have visited this boring books .
the candle understands that surprised toy .	the candle understands that surprised toys .
the bowls care for these happy cars .	the bowls care for these happy car .
the schools work with these surprised rings .	the schools work with these surprised ring .
the candles buy this green child .	the candles buy this green children .
the doll dropped those old boys .	the doll dropped those old boy .
the spoon was helping that quiet bed .	the spoon was helping that quiet beds .
the doors visited these smart cars .	the doors visited these smart car .
the plates have taken those old people .	the plates have taken those old person .
the boats have found that gentle picture .	the boats have found that gentle pictures .
the dolls can n't work with that excited car .	the dolls can n't work with that excited cars .
the boxes are n't dropping those yellow ladies .	the boxes are n't dropping those yellow lady .
the cup heard this nice candle .	the cup heard this nice candles .
the bank answered these curious spoons .	the bank answered these curious spoon .
the buttons have fixed this hot teacher .	the buttons have fixed this hot teachers .
the shirt confused that confused book .	the shirt confused that confused books .
the glass has n't answered that important spoon .	the glass has n't answered that important spoons .
the restaurant has n't heard these nice trucks .	the restaurant has n't heard these nice truck .
the spoon is n't losing this fine guy .	the spoon is n't losing this fine guys .
the window was working with that sleepy car .	the window was working with that sleepy cars .
the car might steal this blue doctor .	the car might steal this blue doctors .
the picture cleaned this cool doctor .	the picture cleaned this cool doctors .
the bowls made these orange men .	the bowls made these orange man .
the bottles have n't found those boring women .	the bottles have n't found those boring woman .
the box was talking to these quiet boxes .	the box was talking to these quiet box .
the boat can n't work with these happy beds .	the boat can n't work with these happy bed .
the bed is visiting that tired car .	the bed is visiting that tired cars .
the box does n't find this big lady .	the box does n't find this big ladies .
the candles brought that fine person .	the candles brought that fine people .
the school heard those kind dolls .	the school heard those kind doll .
the rooms talked to those helpful trucks .	the rooms talked to those helpful truck .
the door confused these strong glasses .	the door confused these strong glass .
the buttons are talking to these young glasses .	the buttons are talking to these young glass .
the mirror would n't throw that cool lady .	the mirror would n't throw that cool ladies .
the window was bothering these excited beds .	the window was bothering these excited bed .
the candle wo n't answer this busy ring .	the candle wo n't answer this busy rings .
the book wo n't steal those black girls .	the book wo n't steal those black girl .
the plane has found this quiet chair .	the plane has found this quiet chairs .
the forks have n't brought this brown guy .	the forks have n't brought this brown guys .
the cars lost these big doctors .	the cars lost these big doctor .
the cups will answer that kind bag .	the cups will answer that kind bags .
the box would care for that young box .	the box would care for that young boxes .
the truck held these hot girls .	the truck held these hot girl .
the dish knows that tired toy .	the dish knows that tired toys .
the couch had thrown those cute guys .	the couch had thrown those cute guy .
the bottle wo n't find those green men .	the bottle wo n't find those green man .
the bags should keep this expensive guy .	the bags should keep this expensive guys .
the beds have worked with those surprised rings .	the beds have worked with those surprised ring .
the forks hear these bored shoes .	the forks hear these bored shoe .
the shoes visit this tired bottle .	the shoes visit this tired bottles .
the cars have n't found this expensive boy .	the cars have n't found this expensive boys .
the shirts can work with that busy plate .	the shirts can work with that busy plates .
the plates appreciate this hungry door .	the plates appreciate this hungry doors .
the cars hear this bored school .	the cars hear this bored schools .
the plate had lost this curious dish .	the plate had lost this curious dishes .
the bowls do n't scare this quiet button .	the bowls do n't scare this quiet buttons .
the picture must bring these dry teachers .	the picture must bring these dry teacher .
the spoon was n't working with those young chairs .	the spoon was n't working with those young chair .
the glasses know that bored candle .	the glasses know that bored candles .
the spoons would lose this cool lady .	the spoons would lose this cool ladies .
the room has confused this kind car .	the room has confused this kind cars .
the toy drops this new doctor .	the toy drops this new doctors .
the forks should bring that expensive person .	the forks should bring that expensive people .
the shirts would throw those white boys .	the shirts would throw those white boy .
the shirt must worry this bored bed .	the shirt must worry this bored beds .
the candles might keep this brown lady .	the candles might keep this brown ladies .
the glasses were n't bringing that boring boy .	the glasses were n't bringing that boring boys .
the park is n't visiting this hungry toy .	the park is n't visiting this hungry toys .
the bed is making those orange girls .	the bed is making those orange girl .
the books were teaching these young bottles .	the books were teaching these young bottle .
the plate helped this wrong dish .	the plate helped this wrong dishes .
the picture taught those hungry beds .	the picture taught those hungry bed .
the windows stole those big children .	the windows stole those big child .
the boats had talked to that kind school .	the boats had talked to that kind schools .
the box should visit these important toys .	the box should visit these important toy .
the buttons have talked to that excited school .	the buttons have talked to that excited schools .
the hat heard that clever cup .	the hat heard that clever cups .
the chairs have n't worked with these smart toys .	the chairs have n't worked with these smart toy .
the ship is n't working with that upset cup .	the ship is n't working with that upset cups .
the schools cleaned that purple woman .	the schools cleaned that purple women .
the rings lift these hot ladies .	the rings lift these hot lady .
the school understands these curious trucks .	the school understands these curious truck .
the bicycle might praise this young school .	the bicycle might praise this young schools .
the buttons threw those hot people .	the buttons threw those hot person .
the glass held those black girls .	the glass held those black girl .
the bank is n't taking those cute boys .	the bank is n't taking those cute boy .
the schools shook those brown girls .	the schools shook those brown girl .
the chairs were working with these tired rooms .	the chairs were working with these tired room .
the hats are n't holding those big boys .	the hats are n't holding those big boy .
the box had n't fixed these black men .	the box had n't fixed these black man .
the plates are n't visiting these healthy plates .	the plates are n't visiting these healthy plate .
the rug is helping that tall shoe .	the rug is helping that tall shoes .
the kitchen has n't found these lucky schools .	the kitchen has n't found these lucky school .
the restaurant is cleaning that dry doctor .	the restaurant is cleaning that dry doctors .
the ring can n't talk to this sleepy school .	the ring can n't talk to this sleepy schools .
the chair keeps those small women .	the chair keeps those small woman .
the museum must visit this clever bag .	the museum must visit this clever bags .
the mall was teaching this young candle .	the mall was teaching this young candles .
the shirts teach those tired shirts .	the shirts teach those tired shirt .
the schools had dropped these hot ladies .	the schools had dropped these hot lady .
the pictures do n't drop these cold ladies .	the pictures do n't drop these cold lady .
the bicycle had answered that friendly car .	the bicycle had answered that friendly cars .
the rings are throwing those green men .	the rings are throwing those green man .
the hospital found that boring cup .	the hospital found that boring cups .
the picture helps those friendly spoons .	the picture helps those friendly spoon .
the candle had bothered this bored school .	the candle had bothered this bored schools .
the windows could n't make that green child .	the windows could n't make that green children .
the schools heard those busy schools .	the schools heard those busy school .
the dishes know that tall bed .	the dishes know that tall beds .
the schools are shaking these boring women .	the schools are shaking these boring woman .
the boats did n't appreciate those quiet cups .	the boats did n't appreciate those quiet cup .
the boxes would n't shake this orange person .	the boxes would n't shake this orange people .
