the chairs helped these nice boats .	the chairs helped these nice boat .
the bottles must answer these friendly buttons .	the bottles must answer these friendly button .
the picture wo n't listen to those confused bottles .	the picture wo n't listen to those confused bottle .
the book knew that nice doll .	the book knew that nice dolls .
the museum fixed those fine people .	the museum fixed those fine person .
the spoons must clean these dry doctors .	the spoons must clean these dry doctor .
the schools had those cold girls .	the schools had those cold girl .
the cars are n't listening to this excited school .	the cars are n't listening to this excited schools .
the couch scared these upset bags .	the couch scared these upset bag .
the rocket will listen to that boring cup .	the rocket will listen to that boring cups .
the hat brought that blue teacher .	the hat brought that blue teachers .
the book talked to this boring window .	the book talked to this boring windows .
the schools answer these helpful beds .	the schools answer these helpful bed .
the dishes must talk to this boring boat .	the dishes must talk to this boring boats .
the library works with that tall bag .	the library works with that tall bags .
the toys helped this helpful book .	the toys helped this helpful books .
the bottle will fix this black lady .	the bottle will fix this black ladies .
the bottle answered this lucky hat .	the bottle answered this lucky hats .
the book has heard that important shoe .	the book has heard that important shoes .
the school should listen to these sleepy shirts .	the school should listen to these sleepy shirt .
the school can n't work with that curious picture .	the school can n't work with that curious pictures .
the bed kept these great ladies .	the bed kept these great lady .
the plates praise this busy candle .	the plates praise this busy candles .
the bicycle wo n't have those blue doctors .	the bicycle wo n't have those blue doctor .
the shirt worked with that young hat .	the shirt worked with that young hats .
the shoes have scared those hungry glasses .	the shoes have scared those hungry glass .
the bottle knew these confused forks .	the bottle knew these confused fork .
the windows lost those surprised spoons .	the windows lost those surprised spoon .
the dish had scared this confused doll .	the dish had scared this confused dolls .
the trucks know that wrong car .	the trucks know that wrong cars .
the book had n't bought this whole doctor .	the book had n't bought this whole doctors .
the cups must clean those gray women .	the cups must clean those gray woman .
the forks bothered this young bowl .	the forks bothered this young bowls .
the candles have fixed that red child .	the candles have fixed that red children .
the doll had lost this awesome boy .	the doll had lost this awesome boys .
the dolls are listening to these careful rooms .	the dolls are listening to these careful room .
the buttons have confused that happy car .	the buttons have confused that happy cars .
the books do n't help those surprised dolls .	the books do n't help those surprised doll .
the window may bother this busy car .	the window may bother this busy cars .
the candle may teach this tall chair .	the candle may teach this tall chairs .
the bottles wo n't talk to that boring boat .	the bottles wo n't talk to that boring boats .
the mirror might move this white girl .	the mirror might move this white girls .
the dishes are n't shaking those orange women .	the dishes are n't shaking those orange woman .
the bowl is n't helping this confused fork .	the bowl is n't helping this confused forks .
the library would n't praise that clever chair .	the library would n't praise that clever chairs .
the chairs threw those yellow women .	the chairs threw those yellow woman .
the bottles appreciate those helpful trucks .	the bottles appreciate those helpful truck .
the spoons might understand those bored cars .	the spoons might understand those bored car .
the couch was n't fixing those purple people .	the couch was n't fixing those purple person .
the plates teach these lucky dolls .	the plates teach these lucky doll .
the cups worry that confused picture .	the cups worry that confused pictures .
the chair knew these surprised boxes .	the chair knew these surprised box .
the rooms were keeping this boring man .	the rooms were keeping this boring men .
the room has n't heard those quiet glasses .	the room has n't heard those quiet glass .
the doll hears those healthy hats .	the doll hears those healthy hat .
the shoes brought these blue teachers .	the shoes brought these blue teacher .
the cups have heard those helpful cups .	the cups have heard those helpful cup .
the shoe confused this healthy fork .	the shoe confused this healthy forks .
the chair stole this cute child .	the chair stole this cute children .
the book has n't taken this white guy .	the book has n't taken this white guys .
the cars scare this boring door .	the cars scare this boring doors .
the plane could visit these hungry trucks .	the plane could visit these hungry truck .
the window talks to that angry book .	the window talks to that angry books .
the truck heard these healthy rooms .	the truck heard these healthy room .
the window had confused those tall boats .	the window had confused those tall boat .
the bicycle bothered these sleepy dolls .	the bicycle bothered these sleepy doll .
the candle confused those confused books .	the candle confused those confused book .
the rings heard this boring window .	the rings heard this boring windows .
the bowl is n't making that broken child .	the bowl is n't making that broken children .
the dishes hold this awesome guy .	the dishes hold this awesome guys .
the rug takes this great woman .	the rug takes this great women .
the forks are n't cleaning this whole doctor .	the forks are n't cleaning this whole doctors .
the cars visited this nice truck .	the cars visited this nice trucks .
the book talks to these gentle shoes .	the book talks to these gentle shoe .
the schools answer these boring boxes .	the schools answer these boring box .
the boat fixed that new person .	the boat fixed that new people .
the rocket may appreciate that smart doll .	the rocket may appreciate that smart dolls .
the trucks fixed this big teacher .	the trucks fixed this big teachers .
the truck knew this sleepy doll .	the truck knew this sleepy dolls .
the hospital knows that bored car .	the hospital knows that bored cars .
the beds bought that expensive person .	the beds bought that expensive people .
the school has n't taught this young picture .	the school has n't taught this young pictures .
the boat bought these hot doctors .	the boat bought these hot doctor .
the hospital could n't bother those gentle crayons .	the hospital could n't bother those gentle crayon .
the cups made these whole ladies .	the cups made these whole lady .
the crayons may throw that yellow lady .	the crayons may throw that yellow ladies .
the bottle was n't losing those broken girls .	the bottle was n't losing those broken girl .
the bag took those small girls .	the bag took those small girl .
the picture had n't made these whole people .	the picture had n't made these whole person .
the dolls teach these curious dolls .	the dolls teach these curious doll .
the toy is teaching this gentle car .	the toy is teaching this gentle cars .
the bicycle knows those excited chairs .	the bicycle knows those excited chair .
the cars teach those upset bowls .	the cars teach those upset bowl .
the bags had n't held these brown doctors .	the bags had n't held these brown doctor .
the chairs will teach that upset shoe .	the chairs will teach that upset shoes .
the bowl would care for that nice room .	the bowl would care for that nice rooms .
the shirt knows that surprised toy .	the shirt knows that surprised toys .
the hospital held this green teacher .	the hospital held this green teachers .
the rooms may work with those wrong pictures .	the rooms may work with those wrong picture .
the beds talked to these clever toys .	the beds talked to these clever toy .
the chairs are bringing this new man .	the chairs are bringing this new men .
the cup can n't listen to that surprised box .	the cup can n't listen to that surprised boxes .
the shirts could n't care for these boring doors .	the shirts could n't care for these boring door .
the museum had n't heard those busy shirts .	the museum had n't heard those busy shirt .
the dishes have bothered that boring bed .	the dishes have bothered that boring beds .
the couch has dropped those fine children .	the couch has dropped those fine child .
the fork makes those purple women .	the fork makes those purple woman .
the chair did n't listen to that smart glass .	the chair did n't listen to that smart glasses .
the windows will work with these bored boxes .	the windows will work with these bored box .
the bottle is n't helping those smart forks .	the bottle is n't helping those smart fork .
the restaurant did n't scare this nice dish .	the restaurant did n't scare this nice dishes .
the library knew those smart schools .	the library knew those smart school .
the buttons listen to that upset book .	the buttons listen to that upset books .
the library can n't lose this boring boy .	the library can n't lose this boring boys .
the bowls work with these excited bowls .	the bowls work with these excited bowl .
the rooms can n't understand that friendly glass .	the rooms can n't understand that friendly glasses .
the doors are n't teaching those wrong pictures .	the doors are n't teaching those wrong picture .
the cup should n't talk to those helpful shoes .	the cup should n't talk to those helpful shoe .
the schools are n't helping that bored ring .	the schools are n't helping that bored rings .
the boats heard that lucky school .	the boats heard that lucky schools .
the bags care for that careful car .	the bags care for that careful cars .
the car does n't bother this helpful picture .	the car does n't bother this helpful pictures .
the cars were n't bothering this excited button .	the cars were n't bothering this excited buttons .
the beds were listening to that excited button .	the beds were listening to that excited buttons .
the dolls would n't bother those careful hats .	the dolls would n't bother those careful hat .
the shoes shook that white woman .	the shoes shook that white women .
the room had n't thrown these white ladies .	the room had n't thrown these white lady .
the bowls worry that surprised chair .	the bowls worry that surprised chairs .
the box has n't heard this important dish .	the box has n't heard this important dishes .
the school understands those tall bottles .	the school understands those tall bottle .
the kitchen had helped those tall hats .	the kitchen had helped those tall hat .
the school has moved this new person .	the school has moved this new people .
the plate has n't made those missing people .	the plate has n't made those missing person .
the books have n't confused that important room .	the books have n't confused that important rooms .
the bowl could move these red children .	the bowl could move these red child .
the doors did n't lose this boring man .	the doors did n't lose this boring men .
the candle could sell this cool person .	the candle could sell this cool people .
the picture hears that healthy shirt .	the picture hears that healthy shirts .
the candles have worked with these bored cars .	the candles have worked with these bored car .
the shoes might bring these broken girls .	the shoes might bring these broken girl .
the spoon would work with those happy crayons .	the spoon would work with those happy crayon .
the plane wo n't have this big woman .	the plane wo n't have this big women .
the plane was bringing those black guys .	the plane was bringing those black guy .
the car had n't answered these surprised spoons .	the car had n't answered these surprised spoon .
the door did n't understand those smart dolls .	the door did n't understand those smart doll .
the dolls help these important schools .	the dolls help these important school .
the dolls visit these boring shoes .	the dolls visit these boring shoe .
the hat should n't take these big doctors .	the hat should n't take these big doctor .
the rocket had n't answered these helpful boxes .	the rocket had n't answered these helpful box .
the dish is n't helping that young book .	the dish is n't helping that young books .
the mall could n't work with these confused rooms .	the mall could n't work with these confused room .
the windows have n't heard this wrong car .	the windows have n't heard this wrong cars .
the glass moved these whole children .	the glass moved these whole child .
the forks could bother that happy school .	the forks could bother that happy schools .
the hats did n't hear those wrong doors .	the hats did n't hear those wrong door .
the bicycle has heard that strong car .	the bicycle has heard that strong cars .
the pictures do n't praise these busy cars .	the pictures do n't praise these busy car .
the cars answer these friendly pictures .	the cars answer these friendly picture .
the mirror knows those nice glasses .	the mirror knows those nice glass .
the candle fixed this black child .	the candle fixed this black children .
the schools did n't hear these sleepy boxes .	the schools did n't hear these sleepy box .
the button has worried that young book .	the button has worried that young books .
the picture had n't lost these friendly doors .	the picture had n't lost these friendly door .
the bed was n't holding these important children .	the bed was n't holding these important child .
the car can work with this hungry bowl .	the car can work with this hungry bowls .
the restaurant answered those surprised buttons .	the restaurant answered those surprised button .
the crayon moved that orange woman .	the crayon moved that orange women .
the dishes had n't found these strong trucks .	the dishes had n't found these strong truck .
the glass scared that happy chair .	the glass scared that happy chairs .
the beds heard that quiet bowl .	the beds heard that quiet bowls .
the rug scares these strong cups .	the rug scares these strong cup .
the schools had n't made these missing people .	the schools had n't made these missing person .
the ship was n't visiting these important shoes .	the ship was n't visiting these important shoe .
the window hears this quiet bowl .	the window hears this quiet bowls .
the kitchen answered these clever rooms .	the kitchen answered these clever room .
the bags are talking to that angry bag .	the bags are talking to that angry bags .
the museum had found that angry car .	the museum had found that angry cars .
the hats might bother this smart crayon .	the hats might bother this smart crayons .
the cup knows that strong boat .	the cup knows that strong boats .
the bottles have n't found these clever forks .	the bottles have n't found these clever fork .
the boat must appreciate those nice chairs .	the boat must appreciate those nice chair .
the bicycle does n't answer this bored fork .	the bicycle does n't answer this bored forks .
the bags would sell that brown person .	the bags would sell that brown people .
the rings dropped that boring woman .	the rings dropped that boring women .
the boat should n't listen to those confused windows .	the boat should n't listen to those confused window .
the plane scares these busy cars .	the plane scares these busy car .
the box would n't throw that big guy .	the box would n't throw that big guys .
the button lost this busy button .	the button lost this busy buttons .
the mall had n't taught those angry buttons .	the mall had n't taught those angry button .
the school has taken this black guy .	the school has taken this black guys .
the bowl is holding those purple boys .	the bowl is holding those purple boy .
the couch threw those important girls .	the couch threw those important girl .
the room has n't helped those lucky shoes .	the room has n't helped those lucky shoe .
the boat could n't bother this clever book .	the boat could n't bother this clever books .
the boats scared that upset spoon .	the boats scared that upset spoons .
the doors shook that broken child .	the doors shook that broken children .
the cup has n't bothered that quiet glass .	the cup has n't bothered that quiet glasses .
the plates fixed those purple doctors .	the plates fixed those purple doctor .
the picture is n't holding those amazing teachers .	the picture is n't holding those amazing teacher .
the library has brought this dry girl .	the library has brought this dry girls .
the button should n't buy these broken boys .	the button should n't buy these broken boy .
the restaurant has n't held this whole child .	the restaurant has n't held this whole children .
the cup could n't know these tall toys .	the cup could n't know these tall toy .
the bag worked with that bored shoe .	the bag worked with that bored shoes .
the cars may talk to that hungry doll .	the cars may talk to that hungry dolls .
the boxes find those missing women .	the boxes find those missing woman .
the kitchen has n't scared those nice windows .	the kitchen has n't scared those nice window .
the candles would hear that healthy room .	the candles would hear that healthy rooms .
the chair confused these kind shirts .	the chair confused these kind shirt .
the glass would n't teach these healthy forks .	the glass would n't teach these healthy fork .
the couch was teaching these tall books .	the couch was teaching these tall book .
the bicycle will sell those gray ladies .	the bicycle will sell those gray lady .
the box was n't holding that great boy .	the box was n't holding that great boys .
the dishes heard this excited glass .	the dishes heard this excited glasses .
the doors clean this gray boy .	the doors clean this gray boys .
the dolls appreciate that healthy hat .	the dolls appreciate that healthy hats .
the cars made those yellow women .	the cars made those yellow woman .
the book visited this careful plate .	the book visited this careful plates .
the window cleaned those brown men .	the window cleaned those brown man .
the glass is n't bringing those cute doctors .	the glass is n't bringing those cute doctor .
the rings lost that upset candle .	the rings lost that upset candles .
the windows took that red woman .	the windows took that red women .
the boxes were listening to that nice bowl .	the boxes were listening to that nice bowls .
the boats had brought that broken girl .	the boats had brought that broken girls .
the hat shakes these amazing guys .	the hat shakes these amazing guy .
the chair had worried those quiet dolls .	the chair had worried those quiet doll .
the bottle is making those purple ladies .	the bottle is making those purple lady .
the candles hear these boring shoes .	the candles hear these boring shoe .
the hats were n't bothering this excited truck .	the hats were n't bothering this excited trucks .
the school scared this bored book .	the school scared this bored books .
the car is visiting that bored candle .	the car is visiting that bored candles .
the toys helped these curious cars .	the toys helped these curious car .
the school should n't steal those hot girls .	the school should n't steal those hot girl .
the rooms lost those small men .	the rooms lost those small man .
the window knew this tired cup .	the window knew this tired cups .
the bag knows that kind toy .	the bag knows that kind toys .
the ship has n't lost those whole boys .	the ship has n't lost those whole boy .
the box is n't taking that expensive guy .	the box is n't taking that expensive guys .
the plates would n't sell this cute girl .	the plates would n't sell this cute girls .
the chairs were working with these careful boxes .	the chairs were working with these careful box .
the buttons know those busy pictures .	the buttons know those busy picture .
the truck is visiting that strong crayon .	the truck is visiting that strong crayons .
the beds fixed those whole guys .	the beds fixed those whole guy .
the window should help these friendly doors .	the window should help these friendly door .
the bottle did n't clean those important ladies .	the bottle did n't clean those important lady .
the shirt talked to these nice chairs .	the shirt talked to these nice chair .
the schools had n't kept this important boy .	the schools had n't kept this important boys .
the toys worked with this strong doll .	the toys worked with this strong dolls .
the buttons had n't lost those fine men .	the buttons had n't lost those fine man .
the schools are visiting that excited candle .	the schools are visiting that excited candles .
the room did n't lose these whole doctors .	the room did n't lose these whole doctor .
the trucks took those purple girls .	the trucks took those purple girl .
the truck could hold those broken women .	the truck could hold those broken woman .
the shirts were n't losing these fine girls .	the shirts were n't losing these fine girl .
the mirror kept those big guys .	the mirror kept those big guy .
the spoons take this blue guy .	the spoons take this blue guys .
the buttons stole those big children .	the buttons stole those big child .
the doll heard this boring truck .	the doll heard this boring trucks .
the shirt does n't understand this boring room .	the shirt does n't understand this boring rooms .
the hospital does n't drop those missing women .	the hospital does n't drop those missing woman .
the bowl has n't heard that wrong hat .	the bowl has n't heard that wrong hats .
the ring was n't shaking those cool teachers .	the ring was n't shaking those cool teacher .
the schools were teaching that busy fork .	the schools were teaching that busy forks .
the plane can n't throw this awesome doctor .	the plane can n't throw this awesome doctors .
the schools may praise those smart beds .	the schools may praise those smart bed .
the crayon will buy that awesome person .	the crayon will buy that awesome people .
the shirt could scare these surprised hats .	the shirt could scare these surprised hat .
the doors should care for these clever dolls .	the doors should care for these clever doll .
the chairs could n't bother this careful cup .	the chairs could n't bother this careful cups .
the picture might teach this careful hat .	the picture might teach this careful hats .
the schools are working with those tall shirts .	the schools are working with those tall shirt .
the rug knew that surprised school .	the rug knew that surprised schools .
the hat talked to this friendly truck .	the hat talked to this friendly trucks .
the couch could n't move this blue teacher .	the couch could n't move this blue teachers .
the books wo n't help these tall rooms .	the books wo n't help these tall room .
the dolls could n't sell that orange child .	the dolls could n't sell that orange children .
the school had n't made those big ladies .	the school had n't made those big lady .
the shirt wo n't steal those boring men .	the shirt wo n't steal those boring man .
the dolls bother this friendly doll .	the dolls bother this friendly dolls .
the buttons dropped these purple girls .	the buttons dropped these purple girl .
the school knew these surprised hats .	the school knew these surprised hat .
the dolls will listen to this healthy window .	the dolls will listen to this healthy windows .
the forks had n't answered this strong ring .	the forks had n't answered this strong rings .
the hats appreciate that gentle crayon .	the hats appreciate that gentle crayons .
the candles found that broken man .	the candles found that broken men .
the kitchen has n't lost these kind schools .	the kitchen has n't lost these kind school .
the rug did n't know that healthy car .	the rug did n't know that healthy cars .
the buttons had lost this young candle .	the buttons had lost this young candles .
the rooms have n't taught those tired dishes .	the rooms have n't taught those tired dish .
the mall is n't visiting those smart cars .	the mall is n't visiting those smart car .
the library visited that curious book .	the library visited that curious books .
the fork wo n't work with that helpful car .	the fork wo n't work with that helpful cars .
the schools have kept this broken lady .	the schools have kept this broken ladies .
the bicycle visited these wrong boats .	the bicycle visited these wrong boat .
the rug must bother these helpful boats .	the rug must bother these helpful boat .
the bowls were n't talking to that excited hat .	the bowls were n't talking to that excited hats .
the chairs have n't bought this yellow man .	the chairs have n't bought this yellow men .
the shirt has talked to these excited plates .	the shirt has talked to these excited plate .
the bag had lost those gentle pictures .	the bag had lost those gentle picture .
the candle taught that smart toy .	the candle taught that smart toys .
the crayons have talked to these gentle cars .	the crayons have talked to these gentle car .
the plane is n't talking to this strong shoe .	the plane is n't talking to this strong shoes .
the library could fix this yellow guy .	the library could fix this yellow guys .
the room works with this quiet toy .	the room works with this quiet toys .
the bowls had n't worried this strong dish .	the bowls had n't worried this strong dishes .
the bags wo n't bother that surprised room .	the bags wo n't bother that surprised rooms .
the ship may hold those red doctors .	the ship may hold those red doctor .
the windows hear those careful toys .	the windows hear those careful toy .
the schools were n't bothering this upset ring .	the schools were n't bothering this upset rings .
the dishes were listening to these happy dishes .	the dishes were listening to these happy dish .
the hats might answer this healthy shoe .	the hats might answer this healthy shoes .
