the mall has held that awesome doctor .	the mall has held that awesome doctors .
the library did n't answer those quiet chairs .	the library did n't answer those quiet chair .
the bags have n't made this purple lady .	the bags have n't made this purple ladies .
the box can n't talk to these important spoons .	the box can n't talk to these important spoon .
the bank must hear this hungry window .	the bank must hear this hungry windows .
the toys were n't bothering these surprised bottles .	the toys were n't bothering these surprised bottle .
the toys did n't understand this friendly door .	the toys did n't understand this friendly doors .
the doll knows this upset ring .	the doll knows this upset rings .
the beds do n't shake that fine woman .	the beds do n't shake that fine women .
the rings talk to that angry candle .	the rings talk to that angry candles .
the mall knows those bored doors .	the mall knows those bored door .
the chair must steal this old teacher .	the chair must steal this old teachers .
the crayon works with those sleepy toys .	the crayon works with those sleepy toy .
the trucks could care for those smart bags .	the trucks could care for those smart bag .
the box knows that nice box .	the box knows that nice boxes .
the bank had worked with these helpful rings .	the bank had worked with these helpful ring .
the room had heard those angry dolls .	the room had heard those angry doll .
the car cleaned this red guy .	the car cleaned this red guys .
the plate might answer that excited bag .	the plate might answer that excited bags .
the rings should n't throw those awesome teachers .	the rings should n't throw those awesome teacher .
the cup held these green teachers .	the cup held these green teacher .
the crayon confused this quiet doll .	the crayon confused this quiet dolls .
the window had dropped that broken man .	the window had dropped that broken men .
the cups hear those surprised glasses .	the cups hear those surprised glass .
the boats threw this missing man .	the boats threw this missing men .
the boat has n't found these wrong boats .	the boat has n't found these wrong boat .
the dolls knew that tall book .	the dolls knew that tall books .
the bicycle wo n't fix those big people .	the bicycle wo n't fix those big person .
the shoes wo n't know those important pictures .	the shoes wo n't know those important picture .
the museum would talk to that wrong shoe .	the museum would talk to that wrong shoes .
the shoe knows those curious books .	the shoe knows those curious book .
the buttons sell these small doctors .	the buttons sell these small doctor .
the hats made that expensive guy .	the hats made that expensive guys .
the pictures have those old boys .	the pictures have those old boy .
the chairs were bothering those upset cars .	the chairs were bothering those upset car .
the beds were teaching these curious forks .	the beds were teaching these curious fork .
the schools would n't take these small ladies .	the schools would n't take these small lady .
the books visited these upset candles .	the books visited these upset candle .
the bank has n't heard those healthy schools .	the bank has n't heard those healthy school .
the rocket would n't understand that hungry car .	the rocket would n't understand that hungry cars .
the schools understand those surprised trucks .	the schools understand those surprised truck .
the room was n't visiting these important glasses .	the room was n't visiting these important glass .
the plates moved those big girls .	the plates moved those big girl .
the beds do n't bother this curious button .	the beds do n't bother this curious buttons .
the book has answered those clever forks .	the book has answered those clever fork .
the crayon might steal those cold ladies .	the crayon might steal those cold lady .
the glass does n't talk to those boring forks .	the glass does n't talk to those boring fork .
the shoe had n't helped those boring books .	the shoe had n't helped those boring book .
the rocket was n't moving these cold teachers .	the rocket was n't moving these cold teacher .
the plates made this old woman .	the plates made this old women .
the buttons shake this orange man .	the buttons shake this orange men .
the plates moved these blue boys .	the plates moved these blue boy .
the spoon had n't brought that big doctor .	the spoon had n't brought that big doctors .
the cup has n't heard those young rooms .	the cup has n't heard those young room .
the pictures know this strong bottle .	the pictures know this strong bottles .
the picture talked to those excited cars .	the picture talked to those excited car .
