the fork lost those hot guys .	the fork lost those hot guy .
the plate was n't fixing this cute teacher .	the plate was n't fixing this cute teachers .
the ring had helped this surprised cup .	the ring had helped this surprised cups .
the pictures keep those missing men .	the pictures keep those missing man .
the car is n't buying these expensive children .	the car is n't buying these expensive child .
the rings have n't lost these boring girls .	the rings have n't lost these boring girl .
the school cleaned that big man .	the school cleaned that big men .
the truck was taking those dry people .	the truck was taking those dry person .
the dishes wo n't praise that tall shoe .	the dishes wo n't praise that tall shoes .
the shoes were n't listening to these angry hats .	the shoes were n't listening to these angry hat .
the bowl must visit that friendly school .	the bowl must visit that friendly schools .
the bicycle is helping this tired picture .	the bicycle is helping this tired pictures .
the doll hears those strong cars .	the doll hears those strong car .
the rocket scared this sleepy window .	the rocket scared this sleepy windows .
the cup has answered those nice doors .	the cup has answered those nice door .
the bowls answer those young bowls .	the bowls answer those young bowl .
the mirror works with that happy toy .	the mirror works with that happy toys .
the hats are n't helping those clever candles .	the hats are n't helping those clever candle .
the toys answer that hungry toy .	the toys answer that hungry toys .
the door was n't bothering that friendly plate .	the door was n't bothering that friendly plates .
the school can n't hear those careful beds .	the school can n't hear those careful bed .
the fork heard this hungry car .	the fork heard this hungry cars .
the toy should n't bother that gentle book .	the toy should n't bother that gentle books .
the schools had n't fixed these dry doctors .	the schools had n't fixed these dry doctor .
the schools helped those strong cups .	the schools helped those strong cup .
the spoon wo n't talk to this hungry button .	the spoon wo n't talk to this hungry buttons .
the spoon would n't know that healthy toy .	the spoon would n't know that healthy toys .
the library worked with this healthy plate .	the library worked with this healthy plates .
the doll knows this hungry boat .	the doll knows this hungry boats .
the box makes that cute boy .	the box makes that cute boys .
the shirts work with those lucky cars .	the shirts work with those lucky car .
the spoon must bring those missing people .	the spoon must bring those missing person .
the button is helping that helpful car .	the button is helping that helpful cars .
the cup can know this kind book .	the cup can know this kind books .
the boat has n't heard that kind boat .	the boat has n't heard that kind boats .
the mall taught this gentle box .	the mall taught this gentle boxes .
the bowls had bothered this young bed .	the bowls had bothered this young beds .
the park had dropped these boring teachers .	the park had dropped these boring teacher .
the cars have talked to those happy dishes .	the cars have talked to those happy dish .
the hats have n't answered these quiet forks .	the hats have n't answered these quiet fork .
the rocket has scared those nice books .	the rocket has scared those nice book .
the crayon had n't answered those gentle bags .	the crayon had n't answered those gentle bag .
the rocket had n't scared these smart bottles .	the rocket had n't scared these smart bottle .
the book scared these clever bowls .	the book scared these clever bowl .
the school has confused this helpful candle .	the school has confused this helpful candles .
the cup heard these wrong shoes .	the cup heard these wrong shoe .
the hat understands these helpful trucks .	the hat understands these helpful truck .
the museum may bring these hot doctors .	the museum may bring these hot doctor .
the spoons had heard this curious box .	the spoons had heard this curious boxes .
the mall makes that blue lady .	the mall makes that blue ladies .
the trucks understand this boring book .	the trucks understand this boring books .
the shirt helped that important room .	the shirt helped that important rooms .
the boat keeps those expensive doctors .	the boat keeps those expensive doctor .
the doll had confused those upset rooms .	the doll had confused those upset room .
the dishes confused these young trucks .	the dishes confused these young truck .
the book would n't hear that bored door .	the book would n't hear that bored doors .
the mall was n't teaching that healthy book .	the mall was n't teaching that healthy books .
the rocket scared those kind buttons .	the rocket scared those kind button .
the couch lost those upset boxes .	the couch lost those upset box .
the room might shake those great men .	the room might shake those great man .
the box moves these purple children .	the box moves these purple child .
the buttons keep this cool child .	the buttons keep this cool children .
the crayons may hear that wrong window .	the crayons may hear that wrong windows .
the cars wo n't care for those confused rooms .	the cars wo n't care for those confused room .
the toys visit this smart door .	the toys visit this smart doors .
the pictures answer those friendly boats .	the pictures answer those friendly boat .
the chair cleaned these orange ladies .	the chair cleaned these orange lady .
the bicycle threw that expensive girl .	the bicycle threw that expensive girls .
the rings can n't hear these busy beds .	the rings can n't hear these busy bed .
the crayon had that awesome girl .	the crayon had that awesome girls .
the crayon can move that white guy .	the crayon can move that white guys .
the plane moved this orange lady .	the plane moved this orange ladies .
the cups were n't fixing that cute boy .	the cups were n't fixing that cute boys .
the truck scares this sleepy school .	the truck scares this sleepy schools .
the hats did n't listen to that quiet box .	the hats did n't listen to that quiet boxes .
the pictures have talked to these curious shoes .	the pictures have talked to these curious shoe .
the boats buy these new ladies .	the boats buy these new lady .
the doll talks to that angry dish .	the doll talks to that angry dishes .
the cars hear those lucky dishes .	the cars hear those lucky dish .
the bags visited these boring boats .	the bags visited these boring boat .
the car takes that boring guy .	the car takes that boring guys .
the boats could n't bring this new guy .	the boats could n't bring this new guys .
the car heard those excited cups .	the car heard those excited cup .
the cars wo n't have these great people .	the cars wo n't have these great person .
the bags had n't brought those cool teachers .	the bags had n't brought those cool teacher .
the candles worked with that important candle .	the candles worked with that important candles .
the park threw these red women .	the park threw these red woman .
the bottles may move this yellow man .	the bottles may move this yellow men .
the car might work with that kind shoe .	the car might work with that kind shoes .
the candle bothered these bored schools .	the candle bothered these bored school .
the cars throw these dry women .	the cars throw these dry woman .
the bag hears this friendly bowl .	the bag hears this friendly bowls .
the buttons may help these clever bags .	the buttons may help these clever bag .
the schools teach those angry buttons .	the schools teach those angry button .
the mall has n't dropped those missing women .	the mall has n't dropped those missing woman .
the spoon was shaking that red woman .	the spoon was shaking that red women .
the button helps that clever school .	the button helps that clever schools .
the bottles wo n't steal this boring child .	the bottles wo n't steal this boring children .
the beds lose this important guy .	the beds lose this important guys .
the boxes can fix these dry boys .	the boxes can fix these dry boy .
the candles had n't kept that hot woman .	the candles had n't kept that hot women .
the bag has scared these important dolls .	the bag has scared these important doll .
the chairs scared those helpful boats .	the chairs scared those helpful boat .
the boxes were keeping that small lady .	the boxes were keeping that small ladies .
the toys had n't kept this green guy .	the toys had n't kept this green guys .
the glass kept these important guys .	the glass kept these important guy .
the spoon scared those careful spoons .	the spoon scared those careful spoon .
the truck works with those helpful boxes .	the truck works with those helpful box .
the bicycle had fixed these new teachers .	the bicycle had fixed these new teacher .
the toys will scare that healthy dish .	the toys will scare that healthy dishes .
the books should n't scare that tired bottle .	the books should n't scare that tired bottles .
the window keeps those boring teachers .	the window keeps those boring teacher .
the crayon has that big doctor .	the crayon has that big doctors .
the toy has scared that surprised bed .	the toy has scared that surprised beds .
the schools help this excited plate .	the schools help this excited plates .
the crayons had held this new guy .	the crayons had held this new guys .
the shirt has n't scared those clever beds .	the shirt has n't scared those clever bed .
the cars understand these tired spoons .	the cars understand these tired spoon .
the boats sell that amazing guy .	the boats sell that amazing guys .
the spoon would throw that great man .	the spoon would throw that great men .
the car took that broken lady .	the car took that broken ladies .
the shoe has n't scared those upset glasses .	the shoe has n't scared those upset glass .
the books knew those friendly glasses .	the books knew those friendly glass .
the rings must lose these small girls .	the rings must lose these small girl .
the ring confused those helpful chairs .	the ring confused those helpful chair .
the spoon is fixing those cold women .	the spoon is fixing those cold woman .
the door helps those excited hats .	the door helps those excited hat .
the boxes may answer those happy schools .	the boxes may answer those happy school .
the plate could bring these important girls .	the plate could bring these important girl .
the kitchen brought that purple teacher .	the kitchen brought that purple teachers .
the ring worked with these nice shirts .	the ring worked with these nice shirt .
the car could n't hear those angry buttons .	the car could n't hear those angry button .
the schools lost these whole women .	the schools lost these whole woman .
the chairs have worried those young dolls .	the chairs have worried those young doll .
the door kept those cold women .	the door kept those cold woman .
the chair knew that tall cup .	the chair knew that tall cups .
the bank lost these nice bowls .	the bank lost these nice bowl .
the bank has scared these happy bags .	the bank has scared these happy bag .
the dish does n't bring those old women .	the dish does n't bring those old woman .
the boxes answer these smart boxes .	the boxes answer these smart box .
the chair visited that busy glass .	the chair visited that busy glasses .
the library knew these busy bottles .	the library knew these busy bottle .
the bag understands these healthy bags .	the bag understands these healthy bag .
the museum was n't listening to those tired dolls .	the museum was n't listening to those tired doll .
the shoes have n't heard those tired bowls .	the shoes have n't heard those tired bowl .
the plane has n't confused those excited spoons .	the plane has n't confused those excited spoon .
the shoes were talking to this young boat .	the shoes were talking to this young boats .
the forks were taking this small teacher .	the forks were taking this small teachers .
the plate is n't bringing this green doctor .	the plate is n't bringing this green doctors .
the cars are visiting those tired hats .	the cars are visiting those tired hat .
the hospital wo n't hear this excited crayon .	the hospital wo n't hear this excited crayons .
the cars answer this hungry door .	the cars answer this hungry doors .
the park talks to this boring door .	the park talks to this boring doors .
the dish can bother these helpful shoes .	the dish can bother these helpful shoe .
the toys were helping this careful school .	the toys were helping this careful schools .
the window is helping that excited spoon .	the window is helping that excited spoons .
the room has n't talked to that busy truck .	the room has n't talked to that busy trucks .
the schools understand that surprised dish .	the schools understand that surprised dishes .
the books had n't bothered those clever dishes .	the books had n't bothered those clever dish .
the bed may make that cool teacher .	the bed may make that cool teachers .
the toy must clean this gray lady .	the toy must clean this gray ladies .
the shirt had n't held this green girl .	the shirt had n't held this green girls .
the books have heard this surprised boat .	the books have heard this surprised boats .
the spoons found that friendly shoe .	the spoons found that friendly shoes .
the toy had confused this quiet toy .	the toy had confused this quiet toys .
the trucks have confused these hungry bags .	the trucks have confused these hungry bag .
the rooms did n't throw this hot guy .	the rooms did n't throw this hot guys .
the crayons scare that helpful boat .	the crayons scare that helpful boats .
the library has n't fixed this white lady .	the library has n't fixed this white ladies .
the dolls were n't finding this amazing man .	the dolls were n't finding this amazing men .
the room has n't heard that careful plate .	the room has n't heard that careful plates .
the shoe found these helpful schools .	the shoe found these helpful school .
the hats find that small man .	the hats find that small men .
the park lost these excited dolls .	the park lost these excited doll .
the shirts may have those cold people .	the shirts may have those cold person .
the book had heard those healthy windows .	the book had heard those healthy window .
the rug knew that young car .	the rug knew that young cars .
the restaurant was n't dropping that fine guy .	the restaurant was n't dropping that fine guys .
the window is n't fixing these cool ladies .	the window is n't fixing these cool lady .
the bicycle was n't making these great women .	the bicycle was n't making these great woman .
the school was n't helping this lucky cup .	the school was n't helping this lucky cups .
the windows bother that wrong car .	the windows bother that wrong cars .
the school makes those cold teachers .	the school makes those cold teacher .
the picture has bothered those angry plates .	the picture has bothered those angry plate .
the cars know that clever truck .	the cars know that clever trucks .
the spoons are shaking these gray guys .	the spoons are shaking these gray guy .
the rocket kept these fine boys .	the rocket kept these fine boy .
the cars are n't losing these black guys .	the cars are n't losing these black guy .
the pictures can visit these curious schools .	the pictures can visit these curious school .
the park shakes those dry men .	the park shakes those dry man .
the windows are losing this expensive doctor .	the windows are losing this expensive doctors .
the buttons are helping this friendly crayon .	the buttons are helping this friendly crayons .
the picture is fixing this purple child .	the picture is fixing this purple children .
the cars are working with that bored school .	the cars are working with that bored schools .
the windows do n't scare those smart candles .	the windows do n't scare those smart candle .
the ship made that white woman .	the ship made that white women .
the fork scared this important candle .	the fork scared this important candles .
the schools hear these wrong books .	the schools hear these wrong book .
the shirts are n't finding these dry children .	the shirts are n't finding these dry child .
the bicycle had talked to these happy books .	the bicycle had talked to these happy book .
the car cleaned those purple girls .	the car cleaned those purple girl .
the rocket knew those careful crayons .	the rocket knew those careful crayon .
the car was bothering those kind glasses .	the car was bothering those kind glass .
the schools can n't answer this helpful school .	the schools can n't answer this helpful schools .
the school worried those kind buttons .	the school worried those kind button .
the spoons scared that confused toy .	the spoons scared that confused toys .
the chairs clean this big teacher .	the chairs clean this big teachers .
the bottles make that broken boy .	the bottles make that broken boys .
the crayon worried that angry plate .	the crayon worried that angry plates .
the door knows these friendly bowls .	the door knows these friendly bowl .
the glasses might teach these smart dolls .	the glasses might teach these smart doll .
the dishes wo n't hear this gentle car .	the dishes wo n't hear this gentle cars .
the forks know those confused hats .	the forks know those confused hat .
the windows do n't hear that tired car .	the windows do n't hear that tired cars .
the pictures did n't help that busy book .	the pictures did n't help that busy books .
the fork can n't answer these quiet forks .	the fork can n't answer these quiet fork .
the cars confused that gentle box .	the cars confused that gentle boxes .
the dolls bother that smart car .	the dolls bother that smart cars .
the cups answered those gentle books .	the cups answered those gentle book .
the spoons have n't found those young pictures .	the spoons have n't found those young picture .
the rug can n't take that dry boy .	the rug can n't take that dry boys .
the forks heard that careful picture .	the forks heard that careful pictures .
the bag has n't made that amazing person .	the bag has n't made that amazing people .
the dish is dropping those big women .	the dish is dropping those big woman .
the bag brings those cute men .	the bag brings those cute man .
the restaurant was working with those tall books .	the restaurant was working with those tall book .
the kitchen can bother this gentle window .	the kitchen can bother this gentle windows .
the museum bothered those excited pictures .	the museum bothered those excited picture .
the boxes will clean that important doctor .	the boxes will clean that important doctors .
the rug has found this young toy .	the rug has found this young toys .
the hat was n't cleaning those missing ladies .	the hat was n't cleaning those missing lady .
the cars had talked to that smart shirt .	the cars had talked to that smart shirts .
the car would hear these strong schools .	the car would hear these strong school .
the restaurant knows those excited bowls .	the restaurant knows those excited bowl .
the plate has bothered this helpful shirt .	the plate has bothered this helpful shirts .
the windows had n't worked with that clever window .	the windows had n't worked with that clever windows .
the cups heard those surprised buttons .	the cups heard those surprised button .
the bag bought those broken people .	the bag bought those broken person .
the spoons are dropping these gray teachers .	the spoons are dropping these gray teacher .
the mirror worked with these upset beds .	the mirror worked with these upset bed .
the schools are n't finding those cool boys .	the schools are n't finding those cool boy .
the cars buy those purple girls .	the cars buy those purple girl .
the couch may drop those blue women .	the couch may drop those blue woman .
the doll is n't bothering these surprised doors .	the doll is n't bothering these surprised door .
the car helped this tall shirt .	the car helped this tall shirts .
the books had bought those yellow ladies .	the books had bought those yellow lady .
the bottles know those wrong dishes .	the bottles know those wrong dish .
the forks fix this dry teacher .	the forks fix this dry teachers .
the hats bother that healthy room .	the hats bother that healthy rooms .
the room had n't worried those wrong bags .	the room had n't worried those wrong bag .
the hats will buy this awesome boy .	the hats will buy this awesome boys .
the buttons move this great doctor .	the buttons move this great doctors .
the books would n't help those angry crayons .	the books would n't help those angry crayon .
the rings had n't held that awesome guy .	the rings had n't held that awesome guys .
the dish is n't buying this red boy .	the dish is n't buying this red boys .
the candle lost that gentle shirt .	the candle lost that gentle shirts .
the cars had n't worked with this young crayon .	the cars had n't worked with this young crayons .
the museum would hold that white girl .	the museum would hold that white girls .
the windows may hear those healthy plates .	the windows may hear those healthy plate .
the chair knows that surprised doll .	the chair knows that surprised dolls .
the forks had bothered those upset toys .	the forks had bothered those upset toy .
the cup worked with this young book .	the cup worked with this young books .
the cups worried this young ring .	the cups worried this young rings .
the chair has n't heard these busy hats .	the chair has n't heard these busy hat .
the boats will take these dry boys .	the boats will take these dry boy .
the bag had taught those sleepy boats .	the bag had taught those sleepy boat .
the hats drop those awesome teachers .	the hats drop those awesome teacher .
the candles were n't shaking this brown man .	the candles were n't shaking this brown men .
the crayons would work with these excited boats .	the crayons would work with these excited boat .
the rooms know those strong plates .	the rooms know those strong plate .
the dish fixed this gray teacher .	the dish fixed this gray teachers .
the candle is listening to these angry trucks .	the candle is listening to these angry truck .
the spoon was n't helping that gentle book .	the spoon was n't helping that gentle books .
the rings had bothered those healthy candles .	the rings had bothered those healthy candle .
the schools listen to that young fork .	the schools listen to that young forks .
the books can move that cold guy .	the books can move that cold guys .
the hat can sell that amazing person .	the hat can sell that amazing people .
the crayons move these green girls .	the crayons move these green girl .
the beds make these fine doctors .	the beds make these fine doctor .
the chair should n't know these tall books .	the chair should n't know these tall book .
the fork lost these tired buttons .	the fork lost these tired button .
the dishes fixed these awesome girls .	the dishes fixed these awesome girl .
the cars would n't work with that wrong doll .	the cars would n't work with that wrong dolls .
the car might shake this old man .	the car might shake this old men .
the cup throws this cute boy .	the cup throws this cute boys .
the couch had n't lost that hot child .	the couch had n't lost that hot children .
the shirt should n't understand that boring window .	the shirt should n't understand that boring windows .
the couch lost these broken teachers .	the couch lost these broken teacher .
the shirts are helping those careful dolls .	the shirts are helping those careful doll .
the cars worried those boring rings .	the cars worried those boring ring .
the cars knew this boring spoon .	the cars knew this boring spoons .
the library was working with those healthy books .	the library was working with those healthy book .
the toy may know those gentle rings .	the toy may know those gentle ring .
the window had held that whole boy .	the window had held that whole boys .
the rings can n't buy those big women .	the rings can n't buy those big woman .
the schools are bringing that orange teacher .	the schools are bringing that orange teachers .
the school had n't lost this quiet bed .	the school had n't lost this quiet beds .
the forks have n't scared this curious button .	the forks have n't scared this curious buttons .
the candles hear that smart book .	the candles hear that smart books .
the buttons can lose these boring girls .	the buttons can lose these boring girl .
the chairs have n't confused these surprised hats .	the chairs have n't confused these surprised hat .
the button was n't cleaning those yellow guys .	the button was n't cleaning those yellow guy .
the buttons have n't lost this cold child .	the buttons have n't lost this cold children .
the doors have worked with those excited spoons .	the doors have worked with those excited spoon .
the pictures had moved these amazing teachers .	the pictures had moved these amazing teacher .
the boxes hear this upset shoe .	the boxes hear this upset shoes .
the cup might hear this nice school .	the cup might hear this nice schools .
the book was n't making this brown guy .	the book was n't making this brown guys .
the buttons may bother those upset crayons .	the buttons may bother those upset crayon .
the forks had n't scared these kind spoons .	the forks had n't scared these kind spoon .
the boat is bothering these kind shirts .	the boat is bothering these kind shirt .
the hat is shaking those big guys .	the hat is shaking those big guy .
the dish might take this new teacher .	the dish might take this new teachers .
the toy should hear that friendly box .	the toy should hear that friendly boxes .
the hats found that excited hat .	the hats found that excited hats .
the candles had n't worked with those boring crayons .	the candles had n't worked with those boring crayon .
the room had answered these clever glasses .	the room had answered these clever glass .
the book works with these gentle trucks .	the book works with these gentle truck .
