happy cars win quickly .	quickly win happy cars .
excited cars whisper quietly .	excited whisper cars quietly .
tired spoons win quickly .	spoons win tired quickly .
helpful forks talk carefully .	carefully talk helpful forks .
upset bowls practice perfectly .	bowls perfectly upset practice .
upset pictures practice slowly .	pictures slowly practice upset .
surprised buttons cry quietly .	cry quietly surprised buttons .
sleepy pictures cry perfectly .	perfectly cry sleepy pictures .
nice plates win carefully .	nice carefully win plates .
nice dolls exercise carefully .	exercise dolls carefully nice .
hungry spoons laugh quietly .	quietly laugh hungry spoons .
upset chairs cough slowly .	chairs cough slowly upset .
careful cars sing carefully .	carefully sing careful cars .
helpful shoes cough quickly .	helpful quickly cough shoes .
angry shoes cry quickly .	cry quickly angry shoes .
bored cars cry slowly .	slowly cars cry bored .
tired trucks smile quietly .	quietly trucks tired smile .
important candles smile perfectly .	perfectly candles smile important .
nice boats read carefully .	nice carefully boats read .
strong dolls practice perfectly .	dolls perfectly practice strong .
wrong rings wave carefully .	rings wrong carefully wave .
wrong boxes exercise quietly .	wrong quietly exercise boxes .
lucky boxes sing slowly .	lucky slowly boxes sing .
tired trucks lose quickly .	lose trucks quickly tired .
boring hats sing quickly .	hats quickly sing boring .
tired buttons cry carefully .	carefully buttons cry tired .
important boats cry quietly .	boats cry quietly important .
smart hats talk slowly .	slowly talk smart hats .
tall books wave perfectly .	perfectly books tall wave .
quiet boxes wave slowly .	quiet wave slowly boxes .
friendly cars stretch perfectly .	friendly stretch perfectly cars .
tired crayons laugh perfectly .	perfectly laugh tired crayons .
young cars stretch quietly .	stretch quietly young cars .
careful hats win carefully .	hats win careful carefully .
surprised spoons scream quickly .	surprised scream spoons quickly .
wrong hats lose quickly .	quickly wrong lose hats .
excited chairs sing quietly .	quietly chairs excited sing .
healthy forks yell quickly .	yell quickly forks healthy .
bored spoons yell slowly .	bored slowly yell spoons .
upset shoes sing perfectly .	upset sing perfectly shoes .
tired cars sing slowly .	slowly cars sing tired .
sleepy hats cry perfectly .	cry perfectly hats sleepy .
careful trucks sing quietly .	trucks quietly careful sing .
busy boats practice perfectly .	perfectly practice busy boats .
happy trucks practice quickly .	happy practice trucks quickly .
helpful spoons sneeze quickly .	sneeze helpful quickly spoons .
young candles talk slowly .	young talk slowly candles .
gentle beds practice carefully .	practice carefully beds gentle .
confused spoons exercise quietly .	quietly spoons exercise confused .
surprised plates sing carefully .	plates sing carefully surprised .
nice boats sing quietly .	quietly boats nice sing .
busy rings whisper slowly .	whisper slowly busy rings .
important buttons read quickly .	read important buttons quickly .
smart shoes cry slowly .	shoes smart slowly cry .
lucky toys lose quietly .	lucky lose quietly toys .
tired dolls cough quickly .	cough tired dolls quickly .
quiet beds laugh carefully .	quiet laugh carefully beds .
tired cups sing quickly .	cups quickly sing tired .
helpful cars lose carefully .	lose helpful cars carefully .
careful windows exercise slowly .	windows slowly careful exercise .
young bowls stretch perfectly .	bowls perfectly stretch young .
curious chairs cry quietly .	cry curious quietly chairs .
angry boats exercise quickly .	exercise boats angry quickly .
smart cars yell perfectly .	smart yell cars perfectly .
kind boxes sing carefully .	carefully sing kind boxes .
tired cars cry perfectly .	cry cars perfectly tired .
boring books talk perfectly .	boring talk perfectly books .
confused cars practice slowly .	cars practice slowly confused .
tired hats exercise quickly .	quickly exercise hats tired .
tired toys exercise slowly .	tired exercise slowly toys .
busy buttons smile quietly .	quietly smile buttons busy .
careful spoons lose quietly .	lose spoons quietly careful .
lucky buttons talk quickly .	quickly buttons talk lucky .
busy books whisper perfectly .	books perfectly busy whisper .
healthy buttons stretch quietly .	quietly healthy stretch buttons .
surprised cars whisper quickly .	cars whisper surprised quickly .
tall candles yell carefully .	carefully yell candles tall .
kind glasses wave perfectly .	wave glasses kind perfectly .
confused toys lie carefully .	toys carefully lie confused .
quiet hats lose perfectly .	quiet perfectly hats lose .
wrong books paint quickly .	books paint quickly wrong .
angry bags lose quickly .	lose bags quickly angry .
helpful candles stretch perfectly .	helpful stretch perfectly candles .
angry doors paint carefully .	paint doors angry carefully .
surprised crayons practice quickly .	practice crayons quickly surprised .
surprised rings stretch carefully .	rings carefully stretch surprised .
smart dolls lie perfectly .	lie dolls perfectly smart .
quiet shirts yell quickly .	shirts quickly yell quiet .
boring spoons whisper quietly .	whisper boring spoons quietly .
tired boats talk slowly .	talk boats slowly tired .
boring buttons win quickly .	win quickly boring buttons .
nice cars lose slowly .	lose cars slowly nice .
careful books yell quickly .	books quickly yell careful .
helpful cars cough quickly .	cough quickly cars helpful .
excited boats whisper carefully .	carefully boats excited whisper .
tall books wave carefully .	wave books carefully tall .
healthy books wave quietly .	quietly books healthy wave .
quiet spoons scream quietly .	quietly spoons scream quiet .
confused cars win perfectly .	perfectly cars win confused .
angry beds lie quietly .	quietly beds lie angry .
busy glasses lose quietly .	busy quietly glasses lose .
gentle shoes paint quickly .	paint gentle shoes quickly .
curious bottles sing slowly .	sing slowly bottles curious .
clever shirts smile quietly .	quietly shirts clever smile .
clever cars whisper slowly .	slowly cars whisper clever .
smart crayons win quietly .	win quietly crayons smart .
healthy doors sneeze quickly .	healthy quickly doors sneeze .
bored hats laugh quickly .	bored quickly hats laugh .
healthy bags lie quickly .	healthy lie bags quickly .
nice bags lose quickly .	nice lose bags quickly .
tired bags scream perfectly .	bags tired perfectly scream .
angry hats wave perfectly .	hats angry perfectly wave .
curious candles cry perfectly .	curious perfectly cry candles .
friendly pictures lose carefully .	friendly carefully lose pictures .
important buttons cry perfectly .	perfectly buttons important cry .
wrong dolls sneeze quietly .	dolls wrong quietly sneeze .
nice boats sing slowly .	slowly sing nice boats .
sleepy shoes exercise slowly .	exercise shoes sleepy slowly .
careful beds scream perfectly .	beds perfectly scream careful .
busy dishes lose perfectly .	lose busy perfectly dishes .
nice plates wave quietly .	quietly wave nice plates .
lucky forks talk slowly .	forks slowly lucky talk .
smart cars read carefully .	smart read cars carefully .
curious spoons whisper quietly .	curious whisper spoons quietly .
quiet dolls lose quietly .	quiet quietly dolls lose .
kind cars talk perfectly .	kind perfectly cars talk .
angry hats wave slowly .	wave slowly hats angry .
happy books exercise quickly .	exercise books quickly happy .
wrong pictures practice quickly .	wrong practice pictures quickly .
careful dolls practice quietly .	careful quietly practice dolls .
lucky windows sing carefully .	carefully lucky sing windows .
surprised candles talk quickly .	talk surprised quickly candles .
upset cars wave quickly .	cars wave upset quickly .
young dishes lose perfectly .	young lose perfectly dishes .
busy doors cry quickly .	busy cry quickly doors .
curious cars stretch slowly .	stretch cars curious slowly .
wrong boats exercise perfectly .	boats wrong perfectly exercise .
young books read quietly .	quietly read young books .
busy hats whisper quickly .	busy quickly whisper hats .
young books cough carefully .	cough books young carefully .
young chairs paint slowly .	young paint slowly chairs .
important candles win slowly .	win candles slowly important .
busy doors sing slowly .	sing slowly busy doors .
excited boats wave slowly .	excited wave boats slowly .
surprised dolls talk quickly .	dolls surprised quickly talk .
healthy shoes sing perfectly .	shoes sing healthy perfectly .
gentle dishes yell carefully .	dishes gentle carefully yell .
healthy bottles paint carefully .	paint healthy bottles carefully .
angry cups talk quietly .	quietly talk angry cups .
sleepy bowls yell quickly .	quickly bowls yell sleepy .
busy boxes yell perfectly .	perfectly boxes busy yell .
healthy plates whisper slowly .	whisper slowly healthy plates .
quiet forks win slowly .	forks slowly win quiet .
lucky bowls paint quietly .	paint quietly lucky bowls .
careful books cry carefully .	careful cry carefully books .
bored bottles sing carefully .	bored carefully sing bottles .
surprised boats sing carefully .	carefully boats sing surprised .
bored boxes cry perfectly .	perfectly cry boxes bored .
curious bowls talk carefully .	bowls talk carefully curious .
gentle cups cough quickly .	quickly cough cups gentle .
smart plates exercise carefully .	plates carefully smart exercise .
clever beds lose quickly .	clever lose beds quickly .
upset buttons lose perfectly .	buttons lose perfectly upset .
important shirts cough perfectly .	important perfectly cough shirts .
friendly toys scream quietly .	quietly toys friendly scream .
careful beds lose slowly .	slowly beds careful lose .
tall windows practice quickly .	quickly windows practice tall .
bored rings sing perfectly .	perfectly rings sing bored .
tall shirts cry quietly .	cry quietly tall shirts .
friendly chairs sing quietly .	chairs friendly quietly sing .
tired books practice perfectly .	practice books perfectly tired .
boring glasses lie slowly .	glasses lie boring slowly .
curious glasses scream quickly .	scream quickly glasses curious .
bored doors stretch quickly .	quickly bored stretch doors .
helpful candles scream quickly .	candles scream helpful quickly .
careful beds cough quietly .	cough beds quietly careful .
careful doors smile quietly .	quietly smile careful doors .
young plates whisper carefully .	plates carefully whisper young .
confused bowls lose quietly .	confused quietly bowls lose .
nice books practice perfectly .	books perfectly nice practice .
curious forks read perfectly .	curious read perfectly forks .
helpful windows sneeze slowly .	sneeze helpful windows slowly .
curious spoons exercise quietly .	curious quietly exercise spoons .
important shirts practice perfectly .	practice shirts perfectly important .
boring glasses wave quickly .	glasses boring quickly wave .
busy dolls sing quickly .	busy quickly sing dolls .
confused toys smile slowly .	smile slowly confused toys .
wrong forks talk carefully .	forks carefully talk wrong .
smart dolls sneeze quickly .	quickly sneeze smart dolls .
lucky beds win carefully .	carefully beds win lucky .
curious pictures talk perfectly .	perfectly pictures curious talk .
healthy bags win slowly .	win healthy slowly bags .
smart rings talk slowly .	rings smart talk slowly .
strong forks exercise slowly .	exercise strong forks slowly .
kind shoes talk quietly .	kind talk quietly shoes .
tired cars smile quietly .	smile quietly cars tired .
smart buttons scream perfectly .	scream perfectly smart buttons .
wrong toys sneeze quickly .	toys sneeze quickly wrong .
nice buttons talk carefully .	buttons nice talk carefully .
upset rings cry perfectly .	upset cry perfectly rings .
kind dolls exercise quickly .	dolls quickly exercise kind .
quiet bowls exercise quickly .	exercise quickly bowls quiet .
lucky beds exercise slowly .	lucky slowly exercise beds .
tired books sing perfectly .	perfectly sing tired books .
hungry crayons whisper slowly .	hungry whisper slowly crayons .
happy candles smile slowly .	happy smile candles slowly .
young shirts wave carefully .	young wave shirts carefully .
healthy forks paint quickly .	paint quickly forks healthy .
careful beds paint perfectly .	perfectly beds careful paint .
important rings lie slowly .	slowly lie rings important .
healthy books sneeze quietly .	sneeze books quietly healthy .
quiet windows sing quickly .	windows quiet sing quickly .
happy buttons cry quickly .	cry buttons quickly happy .
helpful pictures yell quietly .	helpful yell quietly pictures .
young boats laugh quietly .	quietly young laugh boats .
young shirts yell quickly .	shirts quickly yell young .
young windows laugh carefully .	carefully windows young laugh .
important dishes sneeze quickly .	quickly dishes sneeze important .
quiet bowls lie slowly .	bowls slowly lie quiet .
happy bags win slowly .	bags slowly happy win .
healthy trucks smile perfectly .	healthy perfectly smile trucks .
clever crayons cough perfectly .	crayons perfectly cough clever .
helpful cups stretch quickly .	quickly stretch cups helpful .
boring bags scream quietly .	boring quietly scream bags .
excited cars talk quietly .	excited talk cars quietly .
upset crayons cry slowly .	slowly upset cry crayons .
kind doors sing quietly .	kind quietly sing doors .
wrong dolls laugh slowly .	slowly wrong laugh dolls .
busy beds sneeze carefully .	busy carefully beds sneeze .
boring cups laugh slowly .	slowly laugh cups boring .
confused rings scream carefully .	carefully confused scream rings .
young bowls wave carefully .	carefully wave young bowls .
quiet candles yell carefully .	quiet yell carefully candles .
young trucks exercise quietly .	trucks quietly exercise young .
young forks practice slowly .	slowly practice forks young .
tall plates read carefully .	read plates carefully tall .
hungry windows sneeze slowly .	slowly hungry sneeze windows .
quiet spoons laugh perfectly .	perfectly quiet laugh spoons .
excited boxes cry quietly .	excited cry quietly boxes .
wrong glasses cough quietly .	quietly cough glasses wrong .
confused books smile quietly .	quietly books confused smile .
tall boats lose quietly .	lose quietly tall boats .
confused chairs smile quietly .	confused quietly chairs smile .
friendly toys lie perfectly .	perfectly toys friendly lie .
smart buttons sneeze carefully .	buttons carefully sneeze smart .
smart bottles exercise quietly .	bottles exercise quietly smart .
kind doors exercise carefully .	kind carefully exercise doors .
strong books cry perfectly .	books perfectly cry strong .
healthy crayons practice quietly .	practice crayons quietly healthy .
hungry books paint quickly .	paint quickly books hungry .
nice dishes lose slowly .	slowly lose dishes nice .
healthy books wave perfectly .	wave books perfectly healthy .
busy shirts lie quickly .	shirts quickly lie busy .
confused shoes sing carefully .	sing confused carefully shoes .
helpful candles cough slowly .	cough candles helpful slowly .
surprised candles lie perfectly .	candles surprised perfectly lie .
nice boxes smile slowly .	slowly smile boxes nice .
tall toys practice carefully .	practice carefully tall toys .
tall books lie quickly .	books tall lie quickly .
sleepy cars practice quickly .	sleepy practice cars quickly .
young doors sneeze quickly .	sneeze quickly young doors .
tall crayons smile carefully .	tall carefully crayons smile .
busy cars lie quietly .	busy quietly lie cars .
important dolls stretch perfectly .	perfectly dolls stretch important .
smart glasses stretch carefully .	carefully glasses stretch smart .
upset rings practice quietly .	quietly practice rings upset .
upset hats stretch slowly .	slowly hats upset stretch .
boring beds lose quickly .	boring quickly beds lose .
clever pictures sneeze carefully .	pictures carefully sneeze clever .
wrong pictures laugh quietly .	wrong laugh pictures quietly .
confused boxes read slowly .	boxes confused slowly read .
tired rings wave quickly .	rings tired quickly wave .
helpful crayons cry perfectly .	crayons cry helpful perfectly .
quiet windows laugh carefully .	carefully windows laugh quiet .
tired cars win quietly .	quietly win cars tired .
bored forks stretch carefully .	forks carefully bored stretch .
careful glasses sing quickly .	quickly glasses careful sing .
hungry cars stretch quietly .	cars hungry stretch quietly .
tall bowls read quickly .	bowls tall read quickly .
nice trucks cry perfectly .	trucks cry nice perfectly .
tired cups sing quietly .	sing quietly cups tired .
curious cups win carefully .	cups carefully win curious .
lucky plates wave slowly .	plates lucky wave slowly .
hungry toys lose slowly .	hungry lose toys slowly .
wrong beds sing quickly .	sing quickly beds wrong .
careful bowls smile perfectly .	smile careful perfectly bowls .
helpful bags smile slowly .	helpful slowly smile bags .
hungry cars win perfectly .	win perfectly cars hungry .
helpful doors practice slowly .	practice slowly helpful doors .
upset hats smile perfectly .	perfectly hats smile upset .
bored bowls smile quietly .	quietly bowls bored smile .
important hats lie slowly .	slowly lie hats important .
hungry windows wave slowly .	hungry wave windows slowly .
busy hats exercise carefully .	exercise busy carefully hats .
hungry crayons lie carefully .	crayons lie carefully hungry .
kind cars stretch quickly .	stretch kind cars quickly .
lucky books cough slowly .	cough books lucky slowly .
hungry doors yell carefully .	doors carefully yell hungry .
hungry plates whisper slowly .	slowly plates hungry whisper .
smart toys lose quietly .	toys lose smart quietly .
healthy shoes read quietly .	shoes quietly healthy read .
healthy shirts stretch slowly .	stretch slowly healthy shirts .
important cars stretch perfectly .	cars stretch perfectly important .
confused cups read perfectly .	read perfectly confused cups .
angry dolls read quickly .	quickly dolls read angry .
lucky buttons smile quietly .	quietly smile lucky buttons .
helpful dolls lie perfectly .	perfectly helpful lie dolls .
surprised boats smile slowly .	boats surprised slowly smile .
strong bottles stretch carefully .	carefully stretch strong bottles .
confused shirts win quietly .	shirts confused quietly win .
friendly cars whisper quickly .	friendly quickly whisper cars .
wrong cups yell carefully .	carefully wrong yell cups .
tired chairs lie slowly .	chairs lie slowly tired .
strong cups whisper perfectly .	cups perfectly strong whisper .
wrong beds laugh slowly .	beds laugh wrong slowly .
lucky spoons laugh quietly .	quietly laugh lucky spoons .
kind windows smile perfectly .	perfectly smile kind windows .
happy chairs scream carefully .	scream happy carefully chairs .
confused trucks laugh quickly .	confused quickly laugh trucks .
curious buttons read perfectly .	buttons perfectly curious read .
bored candles whisper quickly .	candles quickly whisper bored .
smart spoons sneeze quietly .	sneeze smart spoons quietly .
bored books practice carefully .	books carefully practice bored .
angry doors sneeze quickly .	doors angry quickly sneeze .
excited buttons wave slowly .	wave excited buttons slowly .
upset candles stretch quietly .	quietly stretch upset candles .
tall shoes cough perfectly .	shoes cough tall perfectly .
quiet spoons read quietly .	read quietly quiet spoons .
nice beds paint carefully .	carefully beds paint nice .
excited plates lie quietly .	quietly lie excited plates .
healthy windows talk quickly .	healthy talk quickly windows .
upset doors exercise perfectly .	exercise upset doors perfectly .
clever boats read quietly .	read quietly clever boats .
important trucks scream quickly .	trucks important scream quickly .
busy bottles practice quickly .	quickly bottles busy practice .
hungry glasses sing carefully .	carefully glasses hungry sing .
friendly dolls practice carefully .	dolls practice carefully friendly .
bored crayons cry quickly .	crayons cry bored quickly .
upset rings yell slowly .	upset yell rings slowly .
quiet books lose slowly .	lose quiet books slowly .
kind cars talk quickly .	quickly cars talk kind .
boring trucks wave quickly .	trucks boring wave quickly .
quiet toys smile quickly .	smile quiet quickly toys .
smart crayons cry carefully .	carefully cry crayons smart .
curious cars cry slowly .	cars cry slowly curious .
happy books stretch slowly .	stretch slowly happy books .
nice glasses wave quietly .	glasses wave quietly nice .
quiet trucks whisper quickly .	quiet whisper trucks quickly .
careful crayons whisper carefully .	whisper careful carefully crayons .
surprised boats stretch carefully .	carefully surprised stretch boats .
smart crayons yell quietly .	crayons quietly yell smart .
upset beds read slowly .	slowly beds read upset .
boring forks exercise quickly .	quickly boring exercise forks .
excited dolls sneeze carefully .	dolls excited sneeze carefully .
healthy cups talk perfectly .	talk healthy cups perfectly .
important boxes exercise quickly .	quickly exercise important boxes .
quiet trucks stretch perfectly .	stretch trucks quiet perfectly .
confused rings wave quietly .	quietly rings confused wave .
confused bottles whisper perfectly .	perfectly whisper bottles confused .
kind shoes talk carefully .	carefully shoes talk kind .
excited pictures talk carefully .	excited carefully talk pictures .
hungry shirts scream quietly .	scream hungry quietly shirts .
important books win quickly .	win important books quickly .
sleepy dishes yell perfectly .	sleepy yell perfectly dishes .
kind books lose quietly .	lose kind books quietly .
angry doors scream slowly .	scream slowly angry doors .
friendly cups yell quickly .	yell friendly cups quickly .
surprised doors lose quietly .	doors lose quietly surprised .
nice cars read perfectly .	read perfectly cars nice .
curious boxes cough quickly .	curious cough boxes quickly .
strong cars stretch carefully .	stretch cars carefully strong .
wrong boxes sing carefully .	boxes wrong sing carefully .
helpful books practice slowly .	practice books helpful slowly .
clever shirts practice quickly .	clever practice quickly shirts .
bored pictures lose carefully .	pictures bored carefully lose .
happy doors smile quickly .	smile quickly happy doors .
important shirts practice carefully .	important practice carefully shirts .
strong buttons cry slowly .	slowly cry buttons strong .
kind shoes yell perfectly .	shoes perfectly yell kind .
confused glasses lie quickly .	quickly glasses confused lie .
boring books win quietly .	quietly win boring books .
excited windows exercise quickly .	excited quickly windows exercise .
clever books sing quietly .	sing books clever quietly .
confused crayons wave quietly .	crayons wave confused quietly .
angry bottles sneeze perfectly .	angry sneeze perfectly bottles .
sleepy windows lie perfectly .	windows sleepy perfectly lie .
angry toys yell perfectly .	toys yell perfectly angry .
boring rings sing quickly .	rings sing boring quickly .
curious glasses cry quickly .	quickly glasses curious cry .
quiet bowls win slowly .	quiet slowly bowls win .
clever boxes sneeze carefully .	sneeze boxes clever carefully .
surprised hats scream perfectly .	scream perfectly hats surprised .
upset rings sing perfectly .	rings sing upset perfectly .
happy beds laugh carefully .	beds laugh happy carefully .
happy rings lie slowly .	lie slowly happy rings .
friendly buttons win slowly .	buttons win friendly slowly .
clever rings whisper quickly .	whisper clever rings quickly .
boring books read perfectly .	perfectly read books boring .
surprised chairs exercise quietly .	exercise surprised quietly chairs .
quiet shirts read slowly .	quiet read shirts slowly .
tall boxes stretch perfectly .	boxes tall perfectly stretch .
busy boxes wave carefully .	boxes wave carefully busy .
tired chairs cough slowly .	chairs tired slowly cough .
smart cars laugh carefully .	cars carefully laugh smart .
healthy books practice slowly .	books healthy slowly practice .
busy dolls yell slowly .	dolls busy slowly yell .
quiet bottles yell carefully .	bottles carefully yell quiet .
strong shirts whisper carefully .	whisper strong shirts carefully .
tired trucks yell carefully .	trucks yell carefully tired .
happy buttons sing quickly .	sing happy buttons quickly .
nice books read slowly .	books read slowly nice .
important shirts talk carefully .	shirts talk carefully important .
tired bags wave quietly .	quietly wave tired bags .
clever plates wave quickly .	plates quickly clever wave .
friendly dolls laugh quickly .	friendly laugh quickly dolls .
angry dishes wave quickly .	quickly dishes angry wave .
helpful boats smile quietly .	smile helpful boats quietly .
surprised doors win quietly .	doors surprised quietly win .
confused toys whisper quietly .	whisper confused quietly toys .
clever shirts whisper quietly .	clever whisper shirts quietly .
quiet boxes lose perfectly .	quiet perfectly boxes lose .
happy spoons stretch perfectly .	spoons perfectly happy stretch .
confused books sneeze slowly .	slowly sneeze confused books .
sleepy cars cry perfectly .	perfectly cry sleepy cars .
friendly books paint carefully .	friendly paint books carefully .
busy plates win quickly .	win quickly plates busy .
gentle chairs talk perfectly .	talk gentle perfectly chairs .
nice boxes exercise carefully .	carefully nice exercise boxes .
clever bags smile slowly .	smile slowly clever bags .
clever books cry quietly .	clever quietly books cry .
helpful dolls read quickly .	quickly read dolls helpful .
quiet shirts cough slowly .	slowly cough shirts quiet .
upset beds cough quietly .	cough upset beds quietly .
careful pictures cough quietly .	pictures careful cough quietly .
sleepy crayons stretch perfectly .	stretch sleepy perfectly crayons .
upset cars lose quietly .	upset lose cars quietly .
