kind cars stretch carefully .	stretch kind carefully cars .
tired spoons wave quietly .	wave quietly spoons tired .
clever spoons sing carefully .	clever carefully sing spoons .
smart forks yell perfectly .	smart perfectly yell forks .
clever dolls read perfectly .	dolls read clever perfectly .
strong books yell carefully .	books carefully strong yell .
hungry bowls lie carefully .	lie carefully bowls hungry .
bored shirts cough slowly .	slowly shirts bored cough .
hungry bags lose carefully .	bags carefully hungry lose .
wrong forks sing quickly .	forks quickly sing wrong .
busy forks smile quickly .	forks smile busy quickly .
healthy shirts exercise quickly .	quickly exercise shirts healthy .
tall bags practice slowly .	slowly tall practice bags .
helpful crayons sneeze perfectly .	crayons sneeze perfectly helpful .
strong doors stretch slowly .	slowly stretch doors strong .
strong bottles wave perfectly .	bottles perfectly strong wave .
clever dishes sing quietly .	quietly clever sing dishes .
tired windows wave quietly .	wave quietly windows tired .
wrong glasses stretch quietly .	quietly glasses stretch wrong .
tired trucks cough quietly .	quietly trucks cough tired .
smart trucks lose slowly .	smart lose slowly trucks .
clever pictures lie carefully .	lie clever pictures carefully .
kind beds win quietly .	beds win kind quietly .
angry rings smile carefully .	smile carefully angry rings .
excited cups wave slowly .	wave excited slowly cups .
confused rings sing slowly .	slowly rings sing confused .
careful windows stretch quickly .	careful stretch quickly windows .
kind bags laugh carefully .	kind carefully bags laugh .
wrong bowls laugh slowly .	slowly laugh bowls wrong .
clever buttons laugh quietly .	quietly laugh buttons clever .
boring books talk quickly .	boring talk books quickly .
helpful crayons practice quickly .	helpful quickly practice crayons .
busy bags wave quickly .	bags wave quickly busy .
curious bottles wave quickly .	quickly bottles wave curious .
strong toys cough quickly .	cough quickly strong toys .
important candles cough perfectly .	important perfectly cough candles .
bored plates paint quickly .	quickly plates paint bored .
tired bags smile perfectly .	smile bags tired perfectly .
excited books practice quietly .	practice books quietly excited .
hungry trucks cry quietly .	trucks hungry quietly cry .
angry books yell perfectly .	perfectly angry yell books .
confused cars exercise carefully .	confused carefully exercise cars .
surprised trucks whisper quickly .	whisper trucks quickly surprised .
surprised dolls lie perfectly .	lie perfectly surprised dolls .
wrong beds yell slowly .	beds yell slowly wrong .
tired candles lose quickly .	candles quickly tired lose .
wrong trucks scream slowly .	scream wrong trucks slowly .
busy books sing quickly .	quickly sing busy books .
happy bottles cough carefully .	bottles happy carefully cough .
nice shoes read quickly .	read nice quickly shoes .
careful plates win quietly .	careful win quietly plates .
wrong shoes lose quietly .	quietly lose shoes wrong .
hungry shirts talk perfectly .	shirts perfectly hungry talk .
kind buttons stretch slowly .	slowly buttons stretch kind .
confused crayons sneeze carefully .	confused carefully sneeze crayons .
young forks exercise slowly .	slowly exercise young forks .
busy cars stretch carefully .	busy carefully cars stretch .
hungry dishes scream carefully .	carefully hungry scream dishes .
tall candles sing carefully .	sing candles carefully tall .
lucky beds yell quickly .	quickly yell beds lucky .
hungry bowls sing carefully .	hungry carefully sing bowls .
healthy cars paint perfectly .	paint cars perfectly healthy .
gentle rings laugh quickly .	quickly rings gentle laugh .
healthy buttons laugh slowly .	buttons healthy slowly laugh .
curious boxes smile slowly .	boxes curious smile slowly .
lucky windows cough perfectly .	perfectly lucky cough windows .
confused toys wave quickly .	toys quickly confused wave .
gentle shoes smile quickly .	smile shoes quickly gentle .
surprised spoons whisper quickly .	whisper surprised spoons quickly .
excited pictures yell quietly .	quietly pictures yell excited .
upset cars paint perfectly .	paint perfectly cars upset .
quiet plates sing slowly .	slowly plates sing quiet .
important spoons lie carefully .	lie important spoons carefully .
excited books smile slowly .	excited slowly books smile .
healthy hats talk quickly .	healthy talk quickly hats .
nice books exercise perfectly .	exercise nice perfectly books .
surprised dishes cry slowly .	dishes cry surprised slowly .
tall cars whisper quietly .	quietly cars whisper tall .
friendly glasses cry quietly .	friendly cry quietly glasses .
curious bottles win slowly .	win curious slowly bottles .
angry bottles cry slowly .	bottles cry slowly angry .
tired boxes yell carefully .	boxes tired yell carefully .
sleepy glasses sing quickly .	quickly sing sleepy glasses .
kind windows lose carefully .	lose kind carefully windows .
happy bowls sneeze carefully .	bowls happy sneeze carefully .
careful books sneeze perfectly .	perfectly books careful sneeze .
boring toys practice quickly .	toys quickly practice boring .
nice glasses whisper quickly .	quickly whisper nice glasses .
gentle doors win slowly .	doors win slowly gentle .
confused windows talk carefully .	windows confused carefully talk .
upset forks stretch quickly .	stretch forks quickly upset .
angry hats lie slowly .	slowly hats angry lie .
young crayons smile quickly .	smile young quickly crayons .
careful toys wave quickly .	quickly careful wave toys .
careful plates sneeze perfectly .	careful perfectly plates sneeze .
young books lie slowly .	young slowly lie books .
wrong dishes scream carefully .	carefully wrong scream dishes .
quiet shoes lose quietly .	lose shoes quietly quiet .
friendly bowls talk slowly .	friendly talk bowls slowly .
young chairs wave perfectly .	young wave chairs perfectly .
busy cups talk slowly .	talk cups busy slowly .
helpful bags scream quietly .	quietly bags helpful scream .
smart bottles yell slowly .	yell slowly smart bottles .
surprised boxes wave carefully .	surprised wave boxes carefully .
busy candles scream quietly .	scream busy quietly candles .
kind buttons win slowly .	kind slowly buttons win .
sleepy forks laugh carefully .	sleepy laugh forks carefully .
clever trucks paint carefully .	carefully paint clever trucks .
bored hats whisper quietly .	hats whisper bored quietly .
bored hats lose perfectly .	bored perfectly hats lose .
important cars sneeze carefully .	cars important carefully sneeze .
helpful cars cough slowly .	cough cars helpful slowly .
healthy chairs cough perfectly .	perfectly cough healthy chairs .
helpful pictures paint perfectly .	perfectly paint pictures helpful .
bored spoons talk perfectly .	spoons talk perfectly bored .
important trucks cry quietly .	cry trucks quietly important .
happy beds stretch slowly .	beds stretch happy slowly .
happy bottles cry perfectly .	bottles cry perfectly happy .
healthy crayons paint quietly .	paint quietly healthy crayons .
busy chairs wave quickly .	wave chairs quickly busy .
nice chairs lie quietly .	chairs quietly nice lie .
tired pictures wave quietly .	pictures tired wave quietly .
lucky boxes cry quickly .	quickly boxes lucky cry .
confused beds win perfectly .	confused win beds perfectly .
wrong doors win perfectly .	perfectly wrong win doors .
smart dishes practice carefully .	practice smart dishes carefully .
friendly windows paint quickly .	windows paint friendly quickly .
surprised cups whisper slowly .	cups surprised whisper slowly .
sleepy windows talk slowly .	windows talk slowly sleepy .
busy trucks practice slowly .	trucks busy practice slowly .
tired buttons smile quietly .	buttons smile quietly tired .
confused plates talk perfectly .	talk plates confused perfectly .
angry cups paint quietly .	paint cups quietly angry .
healthy cars whisper slowly .	cars whisper healthy slowly .
healthy cups laugh quickly .	cups laugh quickly healthy .
smart crayons cry carefully .	cry smart carefully crayons .
upset glasses read quickly .	quickly read glasses upset .
confused books cry quickly .	confused quickly books cry .
confused shirts cry carefully .	cry carefully confused shirts .
angry rings laugh perfectly .	angry perfectly laugh rings .
tired crayons laugh carefully .	tired carefully laugh crayons .
happy plates laugh slowly .	laugh plates happy slowly .
helpful boats talk perfectly .	talk perfectly boats helpful .
busy trucks stretch quietly .	busy stretch quietly trucks .
confused bags laugh quickly .	confused laugh bags quickly .
quiet shoes lie slowly .	shoes slowly lie quiet .
helpful cars read slowly .	cars slowly read helpful .
angry candles sing carefully .	angry sing candles carefully .
smart bags wave slowly .	slowly wave smart bags .
confused glasses practice perfectly .	confused practice perfectly glasses .
smart crayons laugh carefully .	crayons smart carefully laugh .
healthy shoes cough slowly .	slowly cough shoes healthy .
nice crayons exercise perfectly .	nice exercise crayons perfectly .
busy books laugh quietly .	books quietly laugh busy .
surprised windows yell quickly .	surprised quickly windows yell .
curious glasses read quietly .	curious read quietly glasses .
hungry hats lose carefully .	hats hungry lose carefully .
bored chairs cough perfectly .	cough chairs bored perfectly .
happy crayons lose perfectly .	crayons perfectly happy lose .
kind dishes talk slowly .	kind slowly talk dishes .
tired cars scream quickly .	quickly scream cars tired .
confused windows stretch carefully .	stretch carefully confused windows .
clever boxes paint slowly .	boxes paint clever slowly .
gentle shirts lose quietly .	gentle quietly shirts lose .
young cars scream carefully .	young scream carefully cars .
wrong doors practice quietly .	practice doors wrong quietly .
strong dishes talk perfectly .	perfectly dishes talk strong .
friendly hats sing perfectly .	sing hats perfectly friendly .
busy glasses whisper perfectly .	whisper busy glasses perfectly .
quiet shirts talk quickly .	talk quickly shirts quiet .
friendly doors lie carefully .	friendly carefully lie doors .
important toys practice quickly .	practice quickly important toys .
bored rings cry quietly .	cry rings bored quietly .
boring books cry perfectly .	books boring cry perfectly .
tired bags read perfectly .	bags perfectly tired read .
young beds lose quietly .	young lose quietly beds .
angry crayons smile quietly .	angry smile crayons quietly .
gentle bowls laugh carefully .	carefully laugh gentle bowls .
quiet candles win quickly .	win candles quiet quickly .
angry boats lie slowly .	angry lie slowly boats .
helpful crayons whisper slowly .	slowly whisper crayons helpful .
confused boxes practice slowly .	slowly boxes practice confused .
curious windows laugh slowly .	curious slowly laugh windows .
tired shoes laugh perfectly .	laugh shoes tired perfectly .
boring windows win carefully .	carefully boring win windows .
helpful trucks read perfectly .	helpful read trucks perfectly .
busy toys paint slowly .	toys busy paint slowly .
angry boats practice quickly .	practice boats angry quickly .
sleepy boats cough quietly .	quietly boats sleepy cough .
quiet dolls win quietly .	win quietly dolls quiet .
busy cars exercise quietly .	exercise cars busy quietly .
smart boxes sneeze perfectly .	smart perfectly boxes sneeze .
surprised chairs talk quietly .	talk surprised chairs quietly .
strong dolls paint perfectly .	dolls strong perfectly paint .
tall doors scream perfectly .	perfectly scream tall doors .
busy shoes lie carefully .	carefully shoes busy lie .
angry hats laugh perfectly .	angry laugh hats perfectly .
gentle bags yell perfectly .	yell gentle bags perfectly .
boring glasses yell slowly .	boring slowly glasses yell .
busy bags sing carefully .	carefully sing busy bags .
nice chairs cry carefully .	nice cry carefully chairs .
bored chairs exercise carefully .	chairs carefully bored exercise .
smart hats paint perfectly .	perfectly smart paint hats .
confused boxes sneeze perfectly .	boxes perfectly sneeze confused .
tall cars whisper perfectly .	cars tall whisper perfectly .
lucky chairs talk quietly .	talk quietly chairs lucky .
clever boats sneeze perfectly .	perfectly sneeze boats clever .
quiet plates exercise carefully .	exercise carefully plates quiet .
upset doors talk quickly .	upset quickly talk doors .
wrong crayons sneeze quickly .	sneeze quickly crayons wrong .
boring dishes stretch quietly .	quietly stretch dishes boring .
kind cars cough slowly .	cars kind slowly cough .
friendly buttons sing quietly .	friendly sing buttons quietly .
careful books sing perfectly .	sing perfectly careful books .
kind rings whisper perfectly .	rings perfectly kind whisper .
boring boxes cry quietly .	cry quietly boxes boring .
careful doors read quickly .	quickly careful read doors .
wrong rings cry quietly .	rings quietly cry wrong .
gentle doors sneeze slowly .	gentle sneeze doors slowly .
upset toys yell quickly .	upset yell toys quickly .
strong chairs stretch quietly .	quietly chairs stretch strong .
kind bowls yell slowly .	slowly yell kind bowls .
nice chairs stretch carefully .	stretch carefully chairs nice .
careful dolls lie quickly .	quickly lie careful dolls .
careful hats whisper carefully .	hats whisper careful carefully .
nice buttons smile carefully .	carefully buttons nice smile .
curious trucks read carefully .	read trucks carefully curious .
busy spoons stretch slowly .	spoons busy slowly stretch .
hungry dolls wave quickly .	quickly hungry wave dolls .
important books yell quietly .	quietly important yell books .
careful dolls win carefully .	dolls carefully win careful .
clever forks read perfectly .	perfectly clever read forks .
clever books smile slowly .	clever smile books slowly .
friendly forks read carefully .	forks friendly carefully read .
tall hats practice quickly .	quickly practice hats tall .
smart spoons paint carefully .	paint smart carefully spoons .
wrong doors paint quietly .	quietly doors wrong paint .
excited boats practice perfectly .	practice excited perfectly boats .
helpful beds lose perfectly .	lose helpful beds perfectly .
surprised boats sneeze quickly .	boats sneeze surprised quickly .
helpful spoons laugh slowly .	slowly spoons helpful laugh .
curious hats lose quickly .	curious lose hats quickly .
surprised bottles cough quietly .	cough bottles surprised quietly .
bored dolls win carefully .	win carefully dolls bored .
busy beds whisper carefully .	busy carefully whisper beds .
busy pictures smile carefully .	smile carefully busy pictures .
tall candles cry quickly .	tall cry quickly candles .
sleepy trucks talk slowly .	trucks slowly sleepy talk .
friendly bags exercise carefully .	bags carefully exercise friendly .
confused hats practice quickly .	practice confused hats quickly .
friendly boxes laugh quickly .	quickly laugh friendly boxes .
excited windows exercise quickly .	quickly windows excited exercise .
excited candles lose perfectly .	perfectly lose excited candles .
confused pictures paint quickly .	pictures paint confused quickly .
excited beds lose perfectly .	beds excited lose perfectly .
clever cups win carefully .	clever win carefully cups .
helpful chairs win slowly .	win helpful chairs slowly .
tired candles smile perfectly .	tired smile perfectly candles .
busy forks paint carefully .	busy paint carefully forks .
kind hats exercise quietly .	kind exercise hats quietly .
friendly books cough slowly .	friendly slowly books cough .
tall boxes scream slowly .	tall slowly scream boxes .
curious books read quickly .	read curious quickly books .
sleepy plates lie carefully .	lie carefully sleepy plates .
kind hats cry quickly .	quickly cry kind hats .
tired windows sing quietly .	windows tired quietly sing .
tired dolls sing quickly .	tired quickly dolls sing .
confused dolls scream carefully .	scream confused dolls carefully .
confused plates win quietly .	win confused plates quietly .
excited beds talk quietly .	beds talk excited quietly .
confused bowls sneeze slowly .	sneeze bowls confused slowly .
gentle crayons smile slowly .	crayons gentle slowly smile .
gentle rings sing quietly .	quietly rings sing gentle .
happy rings yell slowly .	rings happy yell slowly .
careful doors laugh perfectly .	perfectly careful laugh doors .
confused books paint slowly .	books slowly confused paint .
happy cars wave carefully .	cars carefully wave happy .
hungry cups laugh quickly .	hungry quickly laugh cups .
curious bowls stretch carefully .	carefully bowls curious stretch .
busy bottles lose perfectly .	busy perfectly lose bottles .
young boats lose slowly .	lose boats young slowly .
hungry buttons lose carefully .	lose hungry buttons carefully .
clever plates sneeze slowly .	slowly plates clever sneeze .
smart shirts sing perfectly .	shirts perfectly sing smart .
healthy dolls sneeze perfectly .	perfectly healthy sneeze dolls .
boring dolls lie carefully .	carefully lie dolls boring .
friendly chairs lose perfectly .	chairs perfectly lose friendly .
hungry cups practice perfectly .	perfectly practice cups hungry .
kind books cry carefully .	kind carefully books cry .
kind books lie quickly .	lie kind books quickly .
tired doors smile perfectly .	tired smile doors perfectly .
angry cups exercise perfectly .	angry perfectly exercise cups .
boring forks laugh carefully .	boring laugh forks carefully .
kind bowls practice perfectly .	perfectly bowls practice kind .
bored glasses paint carefully .	bored carefully paint glasses .
sleepy cars cry slowly .	cry slowly cars sleepy .
bored crayons cry perfectly .	perfectly crayons cry bored .
important glasses paint quietly .	glasses important quietly paint .
busy forks practice slowly .	practice slowly busy forks .
surprised crayons cry carefully .	crayons cry surprised carefully .
clever plates lose quietly .	plates quietly lose clever .
gentle crayons talk quickly .	crayons gentle quickly talk .
careful beds lie slowly .	beds careful slowly lie .
angry dolls exercise slowly .	angry slowly dolls exercise .
kind spoons cough carefully .	kind cough carefully spoons .
happy cars wave quickly .	cars quickly wave happy .
sleepy boxes wave perfectly .	wave perfectly boxes sleepy .
quiet cars laugh quickly .	cars quickly laugh quiet .
sleepy shirts yell slowly .	yell sleepy shirts slowly .
sleepy beds lose perfectly .	lose sleepy beds perfectly .
happy cars yell quickly .	yell cars happy quickly .
gentle dolls paint perfectly .	dolls gentle perfectly paint .
tired cars wave quickly .	wave cars quickly tired .
smart shoes read quickly .	shoes smart quickly read .
gentle books yell perfectly .	perfectly books yell gentle .
young bottles read perfectly .	perfectly bottles young read .
important plates exercise slowly .	plates slowly exercise important .
important shirts stretch quickly .	quickly shirts important stretch .
important books stretch carefully .	books stretch important carefully .
helpful buttons read slowly .	read slowly buttons helpful .
boring forks yell quickly .	forks yell boring quickly .
careful bags cry carefully .	carefully cry bags careful .
tired cars sing perfectly .	cars tired perfectly sing .
helpful toys stretch carefully .	carefully stretch toys helpful .
helpful bowls paint quickly .	bowls quickly helpful paint .
strong books sing slowly .	books sing slowly strong .
friendly dishes read carefully .	carefully dishes friendly read .
curious boxes exercise perfectly .	curious exercise boxes perfectly .
sleepy spoons stretch quietly .	sleepy quietly spoons stretch .
important chairs stretch slowly .	slowly stretch chairs important .
tired crayons lose quickly .	lose quickly crayons tired .
strong glasses talk quietly .	talk glasses strong quietly .
surprised books wave carefully .	books carefully wave surprised .
lucky bowls lose quietly .	quietly lose lucky bowls .
tired trucks read quietly .	trucks tired read quietly .
boring toys laugh quickly .	boring laugh toys quickly .
confused cars wave perfectly .	cars perfectly confused wave .
young chairs yell slowly .	slowly chairs young yell .
tired beds read quickly .	read quickly tired beds .
quiet doors cough perfectly .	doors quiet perfectly cough .
clever forks practice quietly .	clever practice quietly forks .
important shoes scream quietly .	important scream quietly shoes .
friendly toys lose slowly .	lose friendly slowly toys .
boring doors yell perfectly .	doors boring yell perfectly .
curious rings cry carefully .	curious carefully cry rings .
tall books sing perfectly .	books sing perfectly tall .
hungry hats read quickly .	quickly hungry read hats .
nice chairs practice quickly .	practice chairs quickly nice .
friendly cars lose quickly .	lose cars friendly quickly .
wrong books sing quietly .	sing quietly wrong books .
helpful plates read carefully .	carefully helpful read plates .
curious bowls sneeze perfectly .	curious sneeze bowls perfectly .
friendly beds exercise carefully .	exercise friendly beds carefully .
important chairs wave quickly .	chairs quickly important wave .
gentle chairs read quickly .	gentle read quickly chairs .
nice crayons lie slowly .	slowly lie nice crayons .
excited books yell carefully .	carefully excited yell books .
busy books sing carefully .	carefully busy sing books .
clever spoons cough perfectly .	perfectly spoons clever cough .
hungry candles read quietly .	candles hungry read quietly .
bored bags paint quickly .	bored quickly bags paint .
smart books read slowly .	books smart slowly read .
quiet cars lie slowly .	lie quiet cars slowly .
busy bottles sing quietly .	sing busy bottles quietly .
sleepy bowls laugh perfectly .	perfectly bowls laugh sleepy .
busy bags exercise carefully .	carefully exercise busy bags .
friendly plates cry slowly .	friendly slowly plates cry .
friendly books lie perfectly .	books perfectly lie friendly .
angry bags practice quietly .	quietly bags angry practice .
sleepy books sing carefully .	sleepy carefully sing books .
happy spoons lose carefully .	lose carefully happy spoons .
tired cars smile perfectly .	tired smile perfectly cars .
lucky forks paint slowly .	lucky slowly paint forks .
busy bowls yell perfectly .	bowls busy perfectly yell .
important plates smile perfectly .	perfectly smile important plates .
angry bottles stretch carefully .	angry carefully stretch bottles .
happy books lose quickly .	books happy quickly lose .
friendly windows cough perfectly .	cough windows friendly perfectly .
helpful dishes cough quickly .	cough dishes helpful quickly .
angry candles scream carefully .	candles carefully scream angry .
hungry forks lie slowly .	forks slowly lie hungry .
upset pictures cry quietly .	upset quietly cry pictures .
sleepy shoes yell quickly .	yell sleepy shoes quickly .
young crayons win perfectly .	perfectly win young crayons .
angry books laugh quietly .	quietly books laugh angry .
clever glasses exercise quietly .	exercise clever quietly glasses .
happy shoes read slowly .	slowly read shoes happy .
strong cars exercise perfectly .	strong perfectly cars exercise .
bored forks cough carefully .	bored carefully cough forks .
upset cars wave quickly .	wave upset quickly cars .
important doors lose slowly .	slowly doors lose important .
happy windows yell quietly .	windows quietly yell happy .
happy crayons whisper quietly .	happy quietly whisper crayons .
smart toys yell slowly .	smart slowly yell toys .
clever boxes practice quickly .	boxes practice clever quickly .
clever bottles scream quietly .	quietly clever scream bottles .
wrong bags wave quickly .	bags quickly wrong wave .
kind cars laugh perfectly .	perfectly laugh kind cars .
surprised forks wave perfectly .	perfectly surprised wave forks .
curious books cough slowly .	books slowly curious cough .
surprised boxes whisper carefully .	carefully whisper surprised boxes .
busy crayons cry perfectly .	crayons cry perfectly busy .
upset trucks practice perfectly .	trucks practice perfectly upset .
tall books yell quietly .	yell tall books quietly .
tired glasses wave quickly .	tired quickly glasses wave .
smart candles lie carefully .	lie smart carefully candles .
healthy beds wave carefully .	beds healthy wave carefully .
strong bottles paint quietly .	strong quietly bottles paint .
busy cups paint carefully .	carefully cups busy paint .
excited pictures sing quickly .	sing quickly excited pictures .
quiet shoes wave perfectly .	shoes perfectly wave quiet .
nice rings paint slowly .	slowly rings nice paint .
gentle cars exercise quickly .	quickly gentle exercise cars .
lucky dishes sneeze quickly .	dishes quickly sneeze lucky .
wrong crayons smile perfectly .	crayons wrong smile perfectly .
hungry shirts yell carefully .	hungry carefully yell shirts .
kind buttons scream quickly .	scream kind buttons quickly .
surprised plates paint quickly .	plates surprised quickly paint .
wrong chairs wave quickly .	wave chairs wrong quickly .
nice cars practice quietly .	practice quietly cars nice .
hungry trucks lose quietly .	trucks lose quietly hungry .
young hats lose carefully .	young lose carefully hats .
busy candles wave quietly .	quietly candles busy wave .
hungry candles cough quietly .	hungry quietly cough candles .
kind books wave slowly .	kind slowly books wave .
smart hats win quickly .	hats quickly win smart .
gentle windows sing perfectly .	perfectly sing gentle windows .
boring spoons cough carefully .	cough spoons boring carefully .
smart shirts paint perfectly .	smart paint shirts perfectly .
boring plates laugh quietly .	laugh boring quietly plates .
bored boxes whisper slowly .	slowly boxes whisper bored .
angry shirts whisper perfectly .	angry perfectly shirts whisper .
tired chairs exercise slowly .	slowly exercise chairs tired .
hungry cars win perfectly .	perfectly cars win hungry .
important dolls scream carefully .	dolls scream carefully important .
