quiet toys paint quietly .	toys quietly quiet paint .
boring spoons talk quickly .	quickly spoons talk boring .
helpful rings lie carefully .	carefully lie helpful rings .
surprised boats talk perfectly .	boats surprised perfectly talk .
angry doors practice slowly .	slowly doors angry practice .
tall cars wave slowly .	wave slowly cars tall .
boring shoes paint carefully .	paint boring carefully shoes .
excited rings smile slowly .	excited slowly rings smile .
careful hats win quietly .	win quietly hats careful .
strong dishes paint slowly .	slowly strong paint dishes .
kind bowls lie carefully .	kind carefully lie bowls .
healthy cars win perfectly .	perfectly healthy win cars .
tired candles cry carefully .	cry candles tired carefully .
helpful books wave quietly .	wave quietly books helpful .
busy dolls smile slowly .	busy slowly smile dolls .
surprised dolls practice carefully .	dolls practice surprised carefully .
busy toys scream quietly .	scream toys quietly busy .
excited rings smile carefully .	smile rings carefully excited .
busy crayons practice perfectly .	practice busy crayons perfectly .
important bags lie quietly .	quietly important lie bags .
tall forks stretch slowly .	stretch slowly forks tall .
hungry candles stretch slowly .	hungry slowly candles stretch .
young windows yell carefully .	yell carefully windows young .
strong dishes lose slowly .	dishes strong lose slowly .
confused candles exercise quickly .	exercise candles quickly confused .
sleepy trucks exercise perfectly .	sleepy perfectly trucks exercise .
quiet dolls sing quietly .	sing quietly quiet dolls .
gentle buttons cry quietly .	buttons cry gentle quietly .
happy shoes sing quickly .	shoes sing happy quickly .
friendly books lose quietly .	books lose quietly friendly .
clever rings sneeze perfectly .	rings sneeze perfectly clever .
smart dolls win carefully .	carefully dolls win smart .
gentle chairs stretch quietly .	chairs stretch gentle quietly .
sleepy cups lie quickly .	lie sleepy cups quickly .
excited cars sneeze carefully .	carefully excited sneeze cars .
busy shoes sneeze slowly .	shoes slowly sneeze busy .
excited bags wave quietly .	quietly bags excited wave .
bored boats talk quickly .	talk quickly boats bored .
smart cups cry perfectly .	perfectly cups smart cry .
tired books read perfectly .	books perfectly read tired .
busy forks lose carefully .	carefully forks lose busy .
quiet shirts cry carefully .	shirts carefully cry quiet .
important boats lie perfectly .	perfectly boats lie important .
hungry dolls cry slowly .	dolls cry hungry slowly .
tall rings yell perfectly .	yell tall perfectly rings .
wrong windows lie perfectly .	perfectly lie wrong windows .
lucky boxes scream quietly .	quietly boxes scream lucky .
excited plates talk slowly .	talk plates excited slowly .
smart bottles sing perfectly .	perfectly smart sing bottles .
excited books smile quickly .	quickly smile excited books .
tired crayons paint perfectly .	perfectly crayons tired paint .
clever shoes read quietly .	shoes read clever quietly .
healthy windows scream carefully .	windows carefully scream healthy .
hungry buttons read quickly .	read buttons hungry quickly .
hungry windows win carefully .	windows hungry carefully win .
bored shirts wave perfectly .	bored wave shirts perfectly .
busy candles smile quickly .	smile candles busy quickly .
curious spoons smile quickly .	spoons smile curious quickly .
hungry forks lose quietly .	forks quietly hungry lose .
tall bottles sing quickly .	sing bottles tall quickly .
healthy books lose carefully .	carefully lose healthy books .
excited hats wave perfectly .	perfectly wave hats excited .
quiet doors win perfectly .	quiet perfectly win doors .
careful chairs talk carefully .	chairs talk careful carefully .
confused doors lose perfectly .	lose confused perfectly doors .
boring pictures lose slowly .	boring slowly lose pictures .
strong boats stretch carefully .	boats carefully strong stretch .
wrong dolls laugh carefully .	dolls carefully wrong laugh .
bored trucks exercise slowly .	slowly bored exercise trucks .
gentle bags lie slowly .	gentle lie slowly bags .
surprised dishes lose slowly .	lose surprised dishes slowly .
clever boats scream quickly .	quickly scream clever boats .
important books whisper quickly .	books important whisper quickly .
quiet forks laugh slowly .	slowly quiet laugh forks .
nice boats wave quietly .	boats wave nice quietly .
strong spoons win quietly .	win strong quietly spoons .
wrong cups laugh quietly .	laugh wrong cups quietly .
lucky doors exercise quickly .	exercise quickly lucky doors .
quiet bottles sneeze perfectly .	sneeze perfectly quiet bottles .
tired doors exercise carefully .	exercise doors carefully tired .
tired buttons sneeze quietly .	buttons tired sneeze quietly .
kind pictures smile quickly .	kind smile quickly pictures .
nice candles win quietly .	quietly win nice candles .
smart books cough quietly .	smart quietly books cough .
strong dolls yell perfectly .	perfectly strong yell dolls .
nice windows cough carefully .	windows nice cough carefully .
hungry cars wave carefully .	wave hungry carefully cars .
bored crayons wave quickly .	crayons bored wave quickly .
smart dolls win slowly .	smart slowly dolls win .
upset buttons talk carefully .	buttons talk carefully upset .
lucky chairs read quickly .	read quickly lucky chairs .
tired windows yell carefully .	carefully tired yell windows .
hungry boxes laugh quickly .	boxes hungry quickly laugh .
nice doors smile perfectly .	smile perfectly nice doors .
lucky books talk quickly .	quickly lucky talk books .
friendly dolls cough perfectly .	cough friendly dolls perfectly .
important hats yell quietly .	quietly yell hats important .
quiet toys talk quietly .	quiet talk toys quietly .
tall trucks cough perfectly .	cough perfectly trucks tall .
angry doors read perfectly .	angry read doors perfectly .
boring bottles cry carefully .	cry carefully bottles boring .
friendly cars win perfectly .	friendly win perfectly cars .
tired toys cough slowly .	slowly cough tired toys .
curious hats read carefully .	carefully read curious hats .
excited dishes read carefully .	excited carefully read dishes .
lucky toys sing slowly .	lucky sing slowly toys .
tired rings whisper quickly .	rings quickly whisper tired .
lucky hats laugh slowly .	slowly hats lucky laugh .
kind pictures exercise quietly .	pictures exercise quietly kind .
tall dishes sneeze slowly .	dishes slowly tall sneeze .
bored cars smile carefully .	cars carefully smile bored .
young doors exercise carefully .	doors young carefully exercise .
busy hats practice quietly .	quietly practice hats busy .
surprised crayons exercise quietly .	exercise crayons quietly surprised .
gentle hats cry carefully .	gentle carefully cry hats .
strong bowls lie quietly .	lie bowls quietly strong .
nice bowls scream quickly .	quickly scream bowls nice .
tired pictures stretch slowly .	pictures tired stretch slowly .
friendly forks sing quickly .	sing friendly quickly forks .
wrong beds sneeze perfectly .	beds wrong sneeze perfectly .
important shoes cry carefully .	cry shoes carefully important .
sleepy trucks yell slowly .	sleepy slowly yell trucks .
sleepy boxes lie quickly .	lie quickly boxes sleepy .
kind beds cough quietly .	cough beds kind quietly .
excited bags sing quietly .	quietly excited sing bags .
strong glasses win slowly .	slowly glasses strong win .
smart spoons scream perfectly .	perfectly spoons smart scream .
tired toys wave carefully .	carefully toys tired wave .
tired bowls smile slowly .	tired slowly bowls smile .
