the button is really really really really curious .	the button sings really really really really curious .
the spoon is really really really busy .	the spoon sings really really really busy .
the box is very very very very tall .	the box talks very very very very tall .
the crayon is very very very very very surprised .	the crayon cries very very very very very surprised .
the truck was really really really smart .	the truck cries really really really smart .
the fork was very very very very very very kind .	the fork sings very very very very very very kind .
the car is really really really really sleepy .	the car reads really really really really sleepy .
the hat was very very very very very angry .	the hat waves very very very very very angry .
the glass was very very very very very quiet .	the glass sings very very very very very quiet .
the ring is really really really careful .	the ring reads really really really careful .
the ship is very very very very very very important .	the ship paints very very very very very very important .
the toy was really really really really wrong .	the toy waves really really really really wrong .
the window is very very very very very very friendly .	the window exercises very very very very very very friendly .
the window is very very very very very careful .	the window exercises very very very very very careful .
the doll is really really really friendly .	the doll cries really really really friendly .
the fork was very very very lucky .	the fork talks very very very lucky .
the bicycle is really really really really really angry .	the bicycle waves really really really really really angry .
the shoe was very very very very tall .	the shoe cries very very very very tall .
the fork was very very very lucky .	the fork cries very very very lucky .
the car was very very very healthy .	the car reads very very very healthy .
the button was really really really really really tired .	the button reads really really really really really tired .
the shoe was very very very very boring .	the shoe waves very very very very boring .
the book was very very very kind .	the book exercises very very very kind .
the couch is very very very excited .	the couch cries very very very excited .
the bowl is really really really really busy .	the bowl sings really really really really busy .
the doll was very very very very very gentle .	the doll waves very very very very very gentle .
the chair is really really really healthy .	the chair waves really really really healthy .
the dish was very very very boring .	the dish sings very very very boring .
the hat is really really really really healthy .	the hat paints really really really really healthy .
the shirt was really really really really really really happy .	the shirt talks really really really really really really happy .
the dish is very very very very very sleepy .	the dish paints very very very very very sleepy .
the door was really really really really nice .	the door reads really really really really nice .
the bed was very very very young .	the bed waves very very very young .
the chair is very very very very very happy .	the chair cries very very very very very happy .
the ship was really really really upset .	the ship sings really really really upset .
the ship was really really really really really happy .	the ship waves really really really really really happy .
the book was very very very very very important .	the book cries very very very very very important .
the couch was very very very very very very boring .	the couch paints very very very very very very boring .
the bottle is really really really wrong .	the bottle waves really really really wrong .
the bed was really really really really nice .	the bed exercises really really really really nice .
the car is really really really smart .	the car exercises really really really smart .
the box is very very very very very confused .	the box sings very very very very very confused .
the bowl was really really really really healthy .	the bowl waves really really really really healthy .
the rocket is really really really really really really friendly .	the rocket waves really really really really really really friendly .
the spoon is very very very very very very smart .	the spoon reads very very very very very very smart .
the car is really really really really really busy .	the car paints really really really really really busy .
the car was very very very very very tired .	the car reads very very very very very tired .
the plane was really really really really really really tall .	the plane talks really really really really really really tall .
the cup is very very very very very gentle .	the cup cries very very very very very gentle .
the book is really really really really really really wrong .	the book waves really really really really really really wrong .
the rug is really really really really really really strong .	the rug paints really really really really really really strong .
the plate is very very very excited .	the plate paints very very very excited .
the book is very very very very kind .	the book cries very very very very kind .
the cup is really really really really really really helpful .	the cup paints really really really really really really helpful .
the box is really really really really really young .	the box talks really really really really really young .
the cup was really really really really really hungry .	the cup exercises really really really really really hungry .
the plate is very very very very upset .	the plate cries very very very very upset .
the candle was really really really really really really bored .	the candle talks really really really really really really bored .
the hat was very very very very very very gentle .	the hat cries very very very very very very gentle .
the box is really really really confused .	the box cries really really really confused .
the book was very very very very very lucky .	the book sings very very very very very lucky .
the dish was very very very very very helpful .	the dish waves very very very very very helpful .
the fork was really really really really really quiet .	the fork reads really really really really really quiet .
the bag is very very very very bored .	the bag reads very very very very bored .
the rug was really really really curious .	the rug talks really really really curious .
the rocket was very very very lucky .	the rocket reads very very very lucky .
the chair is very very very very very very wrong .	the chair exercises very very very very very very wrong .
the chair is very very very very very careful .	the chair sings very very very very very careful .
the car was very very very very very very tall .	the car sings very very very very very very tall .
the picture was very very very curious .	the picture sings very very very curious .
the shoe is really really really really really excited .	the shoe talks really really really really really excited .
the bag is very very very boring .	the bag cries very very very boring .
the spoon was very very very very very helpful .	the spoon waves very very very very very helpful .
the shirt was really really really surprised .	the shirt talks really really really surprised .
the book is very very very very very very confused .	the book sings very very very very very very confused .
the truck is really really really really helpful .	the truck reads really really really really helpful .
the bottle is very very very very very very quiet .	the bottle reads very very very very very very quiet .
the doll is really really really really really lucky .	the doll paints really really really really really lucky .
the spoon is very very very confused .	the spoon reads very very very confused .
the car is very very very very lucky .	the car exercises very very very very lucky .
the truck was very very very quiet .	the truck talks very very very quiet .
the book was really really really really really really lucky .	the book waves really really really really really really lucky .
the bed is very very very very very very smart .	the bed waves very very very very very very smart .
the bowl is really really really really tall .	the bowl exercises really really really really tall .
the plane was really really really angry .	the plane waves really really really angry .
the doll is really really really really really quiet .	the doll paints really really really really really quiet .
the bowl is very very very very wrong .	the bowl exercises very very very very wrong .
the door was really really really really really really happy .	the door reads really really really really really really happy .
the chair is really really really really really really lucky .	the chair sings really really really really really really lucky .
the couch was really really really smart .	the couch talks really really really smart .
the rug was very very very very very helpful .	the rug waves very very very very very helpful .
the candle is really really really angry .	the candle talks really really really angry .
the couch was really really really really really really healthy .	the couch waves really really really really really really healthy .
the bicycle was really really really tall .	the bicycle cries really really really tall .
the button was really really really really really really busy .	the button exercises really really really really really really busy .
the bicycle was very very very very very very clever .	the bicycle cries very very very very very very clever .
the window was very very very very very important .	the window cries very very very very very important .
the truck is really really really really kind .	the truck talks really really really really kind .
the ring was very very very very tired .	the ring talks very very very very tired .
the spoon is very very very lucky .	the spoon sings very very very lucky .
the spoon was really really really really curious .	the spoon paints really really really really curious .
the doll was really really really really really really tall .	the doll cries really really really really really really tall .
the bag was really really really really really really clever .	the bag talks really really really really really really clever .
the rug is really really really really really really surprised .	the rug cries really really really really really really surprised .
the window is really really really really really boring .	the window talks really really really really really boring .
the couch is very very very very very nice .	the couch paints very very very very very nice .
the bag was really really really really really really friendly .	the bag paints really really really really really really friendly .
the car was very very very very kind .	the car waves very very very very kind .
the bicycle was very very very very tall .	the bicycle waves very very very very tall .
the crayon is really really really really nice .	the crayon waves really really really really nice .
the hat was really really really really bored .	the hat exercises really really really really bored .
the truck was very very very busy .	the truck reads very very very busy .
the crayon is very very very important .	the crayon waves very very very important .
the spoon is really really really angry .	the spoon reads really really really angry .
the boat is really really really really really bored .	the boat sings really really really really really bored .
the book was very very very very very very hungry .	the book cries very very very very very very hungry .
the shoe was really really really upset .	the shoe sings really really really upset .
the plane is really really really really confused .	the plane waves really really really really confused .
the bottle was really really really really lucky .	the bottle reads really really really really lucky .
the window was very very very very very very friendly .	the window waves very very very very very very friendly .
the picture is very very very very very very lucky .	the picture sings very very very very very very lucky .
the spoon was really really really friendly .	the spoon exercises really really really friendly .
the chair is really really really bored .	the chair reads really really really bored .
the fork was really really really really really busy .	the fork talks really really really really really busy .
the shoe is very very very excited .	the shoe waves very very very excited .
the rocket was really really really really really smart .	the rocket cries really really really really really smart .
the dish is very very very clever .	the dish sings very very very clever .
the ring was really really really really really excited .	the ring paints really really really really really excited .
the button was very very very very happy .	the button talks very very very very happy .
the dish was really really really really really really bored .	the dish waves really really really really really really bored .
the door was really really really really really really confused .	the door cries really really really really really really confused .
the book is really really really really upset .	the book paints really really really really upset .
the boat was really really really really really really nice .	the boat waves really really really really really really nice .
the shirt was really really really really really really tall .	the shirt sings really really really really really really tall .
the candle is really really really really really really confused .	the candle reads really really really really really really confused .
the bag was really really really really really lucky .	the bag sings really really really really really lucky .
the rocket is very very very very very very smart .	the rocket cries very very very very very very smart .
the dish was really really really upset .	the dish talks really really really upset .
the toy is really really really really confused .	the toy sings really really really really confused .
the mirror is really really really surprised .	the mirror cries really really really surprised .
the book was very very very very very very strong .	the book cries very very very very very very strong .
the book is really really really really really young .	the book talks really really really really really young .
the bottle was very very very very very very tired .	the bottle waves very very very very very very tired .
the bed is very very very very very confused .	the bed paints very very very very very confused .
the ship is very very very very very kind .	the ship exercises very very very very very kind .
the boat was very very very gentle .	the boat waves very very very gentle .
the toy is really really really really really careful .	the toy sings really really really really really careful .
the rocket was very very very very nice .	the rocket sings very very very very nice .
the candle was very very very gentle .	the candle sings very very very gentle .
the bowl was very very very very very lucky .	the bowl paints very very very very very lucky .
the glass is really really really really really clever .	the glass reads really really really really really clever .
the plate was really really really really really really helpful .	the plate talks really really really really really really helpful .
the rug was very very very very very excited .	the rug reads very very very very very excited .
the door was very very very very very happy .	the door exercises very very very very very happy .
the dish was very very very very very very hungry .	the dish reads very very very very very very hungry .
the mirror was very very very busy .	the mirror exercises very very very busy .
the ring is very very very very very very hungry .	the ring exercises very very very very very very hungry .
the chair is very very very very very very sleepy .	the chair reads very very very very very very sleepy .
the glass is very very very very very very angry .	the glass talks very very very very very very angry .
the mirror was really really really really really really lucky .	the mirror reads really really really really really really lucky .
the picture was very very very very boring .	the picture talks very very very very boring .
the spoon is very very very gentle .	the spoon waves very very very gentle .
the ring is really really really really really really quiet .	the ring waves really really really really really really quiet .
the hat is really really really really sleepy .	the hat exercises really really really really sleepy .
the dish was very very very very very helpful .	the dish exercises very very very very very helpful .
the couch is very very very very very healthy .	the couch paints very very very very very healthy .
the bottle was very very very excited .	the bottle waves very very very excited .
the fork is very very very very hungry .	the fork talks very very very very hungry .
the mirror is really really really confused .	the mirror waves really really really confused .
the ship is really really really really lucky .	the ship exercises really really really really lucky .
the toy was very very very kind .	the toy waves very very very kind .
the cup was very very very very lucky .	the cup sings very very very very lucky .
the car is very very very curious .	the car reads very very very curious .
the spoon is very very very very very very smart .	the spoon exercises very very very very very very smart .
the spoon is really really really really really really friendly .	the spoon sings really really really really really really friendly .
the book is really really really really tired .	the book sings really really really really tired .
the door is really really really really really angry .	the door exercises really really really really really angry .
the bowl was very very very very very very boring .	the bowl sings very very very very very very boring .
the window is really really really really kind .	the window paints really really really really kind .
the mirror was really really really really really really tall .	the mirror paints really really really really really really tall .
the box was really really really really really bored .	the box exercises really really really really really bored .
the car was very very very very very careful .	the car talks very very very very very careful .
the ring was really really really clever .	the ring cries really really really clever .
the button was really really really really really really quiet .	the button sings really really really really really really quiet .
the ring is very very very very excited .	the ring waves very very very very excited .
the box is really really really young .	the box waves really really really young .
the couch is really really really sleepy .	the couch cries really really really sleepy .
the couch was very very very bored .	the couch cries very very very bored .
the rocket is very very very very very very sleepy .	the rocket talks very very very very very very sleepy .
the plate was very very very very nice .	the plate waves very very very very nice .
the doll was very very very very very boring .	the doll exercises very very very very very boring .
the truck is really really really really really upset .	the truck reads really really really really really upset .
the hat is really really really really really really tired .	the hat cries really really really really really really tired .
the cup is really really really happy .	the cup waves really really really happy .
the window is very very very very very very smart .	the window sings very very very very very very smart .
the car is very very very very very surprised .	the car waves very very very very very surprised .
the dish is really really really really really strong .	the dish exercises really really really really really strong .
the bag is really really really really busy .	the bag exercises really really really really busy .
the bag is very very very careful .	the bag talks very very very careful .
the glass is very very very very very very gentle .	the glass exercises very very very very very very gentle .
the mirror was very very very very very boring .	the mirror exercises very very very very very boring .
the mirror was really really really curious .	the mirror cries really really really curious .
the glass was very very very very very angry .	the glass reads very very very very very angry .
the bowl was really really really really really really boring .	the bowl exercises really really really really really really boring .
the window is very very very very very very gentle .	the window exercises very very very very very very gentle .
the book was really really really helpful .	the book sings really really really helpful .
the fork is really really really really upset .	the fork paints really really really really upset .
the toy is really really really wrong .	the toy sings really really really wrong .
the bicycle is really really really confused .	the bicycle sings really really really confused .
the box was really really really hungry .	the box waves really really really hungry .
the window was very very very wrong .	the window reads very very very wrong .
the bottle is very very very very sleepy .	the bottle waves very very very very sleepy .
the chair was really really really quiet .	the chair waves really really really quiet .
the box is very very very very careful .	the box reads very very very very careful .
the bag was very very very very angry .	the bag waves very very very very angry .
the shoe is really really really really really really sleepy .	the shoe reads really really really really really really sleepy .
the toy is very very very kind .	the toy reads very very very kind .
the cup was really really really really confused .	the cup reads really really really really confused .
the ship was really really really really really quiet .	the ship sings really really really really really quiet .
the shoe is really really really really really really bored .	the shoe paints really really really really really really bored .
the ring was really really really excited .	the ring talks really really really excited .
the window was really really really really careful .	the window exercises really really really really careful .
the shirt was very very very very very smart .	the shirt sings very very very very very smart .
the plate was very very very gentle .	the plate exercises very very very gentle .
the book is very very very gentle .	the book cries very very very gentle .
the rocket was very very very clever .	the rocket talks very very very clever .
the cup was very very very helpful .	the cup exercises very very very helpful .
the mirror is really really really really surprised .	the mirror reads really really really really surprised .
the cup is really really really really really really young .	the cup talks really really really really really really young .
the door is very very very quiet .	the door talks very very very quiet .
the car was very very very very very young .	the car exercises very very very very very young .
the rocket was really really really really really excited .	the rocket reads really really really really really excited .
the plane is really really really really really really tired .	the plane talks really really really really really really tired .
the crayon was really really really really really really tall .	the crayon waves really really really really really really tall .
the button was really really really really nice .	the button reads really really really really nice .
the dish was really really really really really really gentle .	the dish talks really really really really really really gentle .
the bottle was really really really really really friendly .	the bottle talks really really really really really friendly .
the car was really really really lucky .	the car paints really really really lucky .
the chair is really really really really really busy .	the chair exercises really really really really really busy .
the bed is very very very very smart .	the bed cries very very very very smart .
the bottle was really really really really important .	the bottle cries really really really really important .
the couch was really really really really really really hungry .	the couch exercises really really really really really really hungry .
the dish was very very very very angry .	the dish cries very very very very angry .
the crayon is very very very very very clever .	the crayon exercises very very very very very clever .
the bed is really really really helpful .	the bed sings really really really helpful .
the shoe was really really really really really really busy .	the shoe sings really really really really really really busy .
the toy was really really really really really really tired .	the toy cries really really really really really really tired .
the shirt was really really really tall .	the shirt waves really really really tall .
the bowl is really really really really young .	the bowl waves really really really really young .
the bottle is very very very upset .	the bottle talks very very very upset .
the plane was really really really really really boring .	the plane cries really really really really really boring .
the box is really really really really careful .	the box cries really really really really careful .
the plane was very very very very very helpful .	the plane cries very very very very very helpful .
the dish was very very very very very very helpful .	the dish reads very very very very very very helpful .
the button is very very very clever .	the button waves very very very clever .
the shirt is very very very very bored .	the shirt reads very very very very bored .
the fork is very very very very very important .	the fork sings very very very very very important .
