the truck sent my father 's dish the cup .	the truck dropped my father 's dish the cup .
the spoon showed my friend 's toy the bottle .	the spoon cleaned my friend 's toy the bottle .
the truck showed my father 's chair the rug .	the truck moved my father 's chair the rug .
the bicycle gave my doctor 's crayon the dish .	the bicycle dropped my doctor 's crayon the dish .
the couch gave your friend 's dad 's toy the bag .	the couch dropped your friend 's dad 's toy the bag .
the hat bought your dad 's candle the mirror .	the hat shook your dad 's candle the mirror .
the plate sent your brother 's ship the mirror .	the plate lost your brother 's ship the mirror .
the crayon bought your friend 's bicycle the box .	the crayon moved your friend 's bicycle the box .
the book showed your chair the car .	the book kept your chair the car .
the bed gave your boss 's picture the door .	the bed cleaned your boss 's picture the door .
the dish gave my brother 's rug the couch .	the dish kept my brother 's rug the couch .
the shirt sent my boss 's son 's window the doll .	the shirt dropped my boss 's son 's window the doll .
the ring bought your husband 's husband 's dish the plane .	the ring cleaned your husband 's husband 's dish the plane .
the rocket sent my book the shirt .	the rocket held my book the shirt .
the button gave your son 's hat the plate .	the button lost your son 's hat the plate .
the spoon showed your car the car .	the spoon kept your car the car .
the bowl gave my shirt the candle .	the bowl lost my shirt the candle .
the dish bought your rug the boat .	the dish kept your rug the boat .
the rug sent my mom 's brother 's ring the doll .	the rug shook my mom 's brother 's ring the doll .
the bottle bought my grandmother 's bag the chair .	the bottle kept my grandmother 's bag the chair .
the dish gave your father 's cousin 's box the chair .	the dish cleaned your father 's cousin 's box the chair .
the bowl bought my teacher 's boat the chair .	the bowl held my teacher 's boat the chair .
the doll sent my dentist 's father 's picture the chair .	the doll lost my dentist 's father 's picture the chair .
the door gave your rocket the door .	the door shook your rocket the door .
the couch showed your bowl the button .	the couch held your bowl the button .
the spoon bought your cousin 's mother 's car the couch .	the spoon kept your cousin 's mother 's car the couch .
the bag gave my picture the fork .	the bag cleaned my picture the fork .
the box bought my dentist 's sister 's car the fork .	the box held my dentist 's sister 's car the fork .
the shirt showed your daughter 's sister 's rug the bowl .	the shirt dropped your daughter 's sister 's rug the bowl .
the door bought my sister 's bicycle the toy .	the door cleaned my sister 's bicycle the toy .
the couch bought your boat the fork .	the couch moved your boat the fork .
the box sent your mom 's fork the bowl .	the box dropped your mom 's fork the bowl .
the bicycle bought my teacher 's bag the bottle .	the bicycle held my teacher 's bag the bottle .
the shirt bought your doctor 's cousin 's rocket the ship .	the shirt kept your doctor 's cousin 's rocket the ship .
the candle bought your wife 's daughter 's shirt the ring .	the candle cleaned your wife 's daughter 's shirt the ring .
the ring sent your father 's dad 's crayon the rocket .	the ring cleaned your father 's dad 's crayon the rocket .
the car bought your rocket the car .	the car moved your rocket the car .
the cup showed your dad 's bed the dish .	the cup shook your dad 's bed the dish .
the chair sent my sister 's doctor 's shirt the doll .	the chair dropped my sister 's doctor 's shirt the doll .
the shoe sent my dentist 's son 's bicycle the chair .	the shoe kept my dentist 's son 's bicycle the chair .
the couch showed your mother 's bicycle the crayon .	the couch dropped your mother 's bicycle the crayon .
the mirror showed your father 's father 's shirt the rocket .	the mirror shook your father 's father 's shirt the rocket .
the glass bought your grandmother 's bicycle the cup .	the glass kept your grandmother 's bicycle the cup .
the toy sent your dad 's mirror the candle .	the toy lost your dad 's mirror the candle .
the picture sent my cousin 's candle the rocket .	the picture moved my cousin 's candle the rocket .
the shirt showed my car the picture .	the shirt dropped my car the picture .
the book bought my bag the spoon .	the book held my bag the spoon .
the car showed my box the plate .	the car dropped my box the plate .
the picture showed my dad 's ring the book .	the picture held my dad 's ring the book .
the door showed my boss 's dad 's truck the car .	the door shook my boss 's dad 's truck the car .
the button sent my glass the door .	the button kept my glass the door .
the hat showed my mother 's glass the boat .	the hat lost my mother 's glass the boat .
the bag sent your brother 's son 's box the car .	the bag lost your brother 's son 's box the car .
the candle sent my wife 's toy the couch .	the candle lost my wife 's toy the couch .
the truck bought your teacher 's mom 's picture the bag .	the truck kept your teacher 's mom 's picture the bag .
the door showed my doctor 's doctor 's bicycle the button .	the door dropped my doctor 's doctor 's bicycle the button .
the box bought my father 's husband 's toy the box .	the box cleaned my father 's husband 's toy the box .
the doll sent your button the book .	the doll lost your button the book .
the crayon gave your box the door .	the crayon dropped your box the door .
the book showed my mother 's son 's window the chair .	the book moved my mother 's son 's window the chair .
the crayon sent my sister 's rug the bowl .	the crayon held my sister 's rug the bowl .
the dish gave my grandmother 's sister 's fork the rug .	the dish lost my grandmother 's sister 's fork the rug .
the picture sent my door the bed .	the picture kept my door the bed .
the button gave my truck the window .	the button cleaned my truck the window .
the cup sent your sister 's father 's car the book .	the cup moved your sister 's father 's car the book .
the door bought my cousin 's fork the book .	the door shook my cousin 's fork the book .
the book bought your plane the box .	the book shook your plane the box .
the plate sent my shirt the ring .	the plate held my shirt the ring .
the ship gave my truck the rug .	the ship kept my truck the rug .
the box gave my dad 's hat the toy .	the box cleaned my dad 's hat the toy .
the window gave my wife 's dentist 's ring the car .	the window moved my wife 's dentist 's ring the car .
the mirror gave my cousin 's bowl the rug .	the mirror held my cousin 's bowl the rug .
the boat bought my plane the bed .	the boat kept my plane the bed .
the rocket bought your friend 's mirror the cup .	the rocket held your friend 's mirror the cup .
the bed showed my teacher 's father 's shoe the car .	the bed shook my teacher 's father 's shoe the car .
the bowl sent my father 's plane the mirror .	the bowl shook my father 's plane the mirror .
the rug sent your daughter 's daughter 's bottle the shoe .	the rug kept your daughter 's daughter 's bottle the shoe .
the hat bought my plane the couch .	the hat cleaned my plane the couch .
the bottle showed my father 's chair the rocket .	the bottle cleaned my father 's chair the rocket .
the bowl showed your book the ship .	the bowl moved your book the ship .
the rug sent my dad 's son 's plate the cup .	the rug lost my dad 's son 's plate the cup .
the dish sent my car the truck .	the dish shook my car the truck .
the truck bought your daughter 's shoe the box .	the truck kept your daughter 's shoe the box .
the fork showed my bowl the bed .	the fork shook my bowl the bed .
the book bought your father 's boss 's car the truck .	the book kept your father 's boss 's car the truck .
the ship bought my shirt the crayon .	the ship held my shirt the crayon .
the box gave my teacher 's father 's bowl the couch .	the box lost my teacher 's father 's bowl the couch .
the shirt gave your window the mirror .	the shirt moved your window the mirror .
the cup bought your cousin 's picture the crayon .	the cup kept your cousin 's picture the crayon .
the book gave my wife 's mirror the rug .	the book moved my wife 's mirror the rug .
the bowl sent my plate the book .	the bowl moved my plate the book .
the bed bought your mother 's bag the car .	the bed shook your mother 's bag the car .
the shoe gave your mother 's car the car .	the shoe lost your mother 's car the car .
the candle sent my son 's rocket the car .	the candle kept my son 's rocket the car .
the plane bought your teacher 's couch the plate .	the plane moved your teacher 's couch the plate .
the truck showed your daughter 's dentist 's shoe the plane .	the truck dropped your daughter 's dentist 's shoe the plane .
the button showed your mother 's box the dish .	the button kept your mother 's box the dish .
the fork sent my teacher 's shirt the bicycle .	the fork shook my teacher 's shirt the bicycle .
the book bought your daughter 's mother 's hat the bottle .	the book dropped your daughter 's mother 's hat the bottle .
the button bought my door the crayon .	the button kept my door the crayon .
the car gave my rocket the window .	the car kept my rocket the window .
the bicycle sent my cousin 's bicycle the dish .	the bicycle held my cousin 's bicycle the dish .
the door bought your teacher 's ring the bowl .	the door cleaned your teacher 's ring the bowl .
the shirt bought my ring the toy .	the shirt moved my ring the toy .
the bicycle sent your mother 's dish the fork .	the bicycle moved your mother 's dish the fork .
the couch sent my boss 's plane the car .	the couch moved my boss 's plane the car .
the door showed my doll the boat .	the door kept my doll the boat .
the ring showed my plate the plane .	the ring moved my plate the plane .
the plane showed my book the couch .	the plane lost my book the couch .
the book sent your wife 's doctor 's rug the book .	the book lost your wife 's doctor 's rug the book .
the toy bought your doctor 's dish the crayon .	the toy cleaned your doctor 's dish the crayon .
the bicycle gave my boat the dish .	the bicycle lost my boat the dish .
the ring sent my brother 's bed the toy .	the ring dropped my brother 's bed the toy .
the car gave your shoe the rocket .	the car held your shoe the rocket .
the bicycle showed my button the dish .	the bicycle held my button the dish .
the bicycle gave my doctor 's mother 's car the car .	the bicycle cleaned my doctor 's mother 's car the car .
the car gave my shoe the picture .	the car shook my shoe the picture .
the fork gave my husband 's door the ship .	the fork held my husband 's door the ship .
the fork showed your box the candle .	the fork lost your box the candle .
the rug gave your brother 's bowl the dish .	the rug kept your brother 's bowl the dish .
the boat showed my mother 's mom 's bowl the candle .	the boat dropped my mother 's mom 's bowl the candle .
the rug gave my father 's spoon the spoon .	the rug lost my father 's spoon the spoon .
the toy showed my daughter 's mom 's crayon the ring .	the toy cleaned my daughter 's mom 's crayon the ring .
the door sent my mom 's daughter 's spoon the mirror .	the door dropped my mom 's daughter 's spoon the mirror .
the truck sent your brother 's couch the couch .	the truck lost your brother 's couch the couch .
the fork bought your car the button .	the fork moved your car the button .
the mirror gave my brother 's bed the window .	the mirror lost my brother 's bed the window .
the picture bought your wife 's dad 's car the bag .	the picture kept your wife 's dad 's car the bag .
the glass bought my friend 's cousin 's book the door .	the glass shook my friend 's cousin 's book the door .
the hat showed my shirt the window .	the hat held my shirt the window .
the rug gave my father 's book the box .	the rug dropped my father 's book the box .
the bottle showed my friend 's brother 's door the couch .	the bottle shook my friend 's brother 's door the couch .
the car sent my teacher 's daughter 's door the shoe .	the car held my teacher 's daughter 's door the shoe .
the door sent my bottle the book .	the door lost my bottle the book .
the boat gave your grandmother 's shoe the car .	the boat dropped your grandmother 's shoe the car .
the couch showed your doctor 's cousin 's toy the shoe .	the couch moved your doctor 's cousin 's toy the shoe .
the toy showed my grandmother 's plane the spoon .	the toy kept my grandmother 's plane the spoon .
the ring gave your father 's doctor 's book the mirror .	the ring shook your father 's doctor 's book the mirror .
the ring showed your shoe the shirt .	the ring moved your shoe the shirt .
the couch sent your bed the door .	the couch shook your bed the door .
the door bought my doctor 's husband 's plane the candle .	the door moved my doctor 's husband 's plane the candle .
the door sent your husband 's father 's candle the mirror .	the door held your husband 's father 's candle the mirror .
the couch sent your sister 's shoe the button .	the couch moved your sister 's shoe the button .
the fork bought your father 's wife 's truck the button .	the fork kept your father 's wife 's truck the button .
the rug sent my book the chair .	the rug lost my book the chair .
the book gave my doctor 's dish the bed .	the book shook my doctor 's dish the bed .
the book gave your sister 's father 's book the truck .	the book kept your sister 's father 's book the truck .
the rocket bought your grandmother 's teacher 's dish the dish .	the rocket held your grandmother 's teacher 's dish the dish .
the ship gave my dentist 's boss 's crayon the bicycle .	the ship moved my dentist 's boss 's crayon the bicycle .
the rug sent your friend 's son 's bottle the button .	the rug dropped your friend 's son 's bottle the button .
the fork showed my sister 's dentist 's bag the rocket .	the fork moved my sister 's dentist 's bag the rocket .
the door sent my son 's mom 's plane the bottle .	the door moved my son 's mom 's plane the bottle .
the dish bought your father 's glass the rug .	the dish dropped your father 's glass the rug .
the plate bought your door the candle .	the plate shook your door the candle .
the truck bought your picture the window .	the truck held your picture the window .
the bottle showed my bag the toy .	the bottle dropped my bag the toy .
the spoon sent your husband 's mirror the car .	the spoon dropped your husband 's mirror the car .
the boat sent your cousin 's teacher 's mirror the truck .	the boat cleaned your cousin 's teacher 's mirror the truck .
the bottle sent my dish the book .	the bottle kept my dish the book .
the spoon showed my daughter 's toy the window .	the spoon held my daughter 's toy the window .
the plate sent my daughter 's shoe the chair .	the plate kept my daughter 's shoe the chair .
the bowl showed my boss 's ring the chair .	the bowl cleaned my boss 's ring the chair .
the box showed my boss 's bicycle the shirt .	the box cleaned my boss 's bicycle the shirt .
