the fork bought your son 's grandmother 's ship the rug .	the fork dropped your son 's grandmother 's ship the rug .
the bottle showed your brother 's car the mirror .	the bottle cleaned your brother 's car the mirror .
the glass showed your husband 's daughter 's spoon the boat .	the glass moved your husband 's daughter 's spoon the boat .
the window showed my ship the rocket .	the window kept my ship the rocket .
the glass sent my spoon the ship .	the glass held my spoon the ship .
the dish gave your teacher 's brother 's truck the cup .	the dish moved your teacher 's brother 's truck the cup .
the bowl showed my father 's sister 's cup the glass .	the bowl kept my father 's sister 's cup the glass .
the box bought your door the rug .	the box lost your door the rug .
the boat bought my son 's ring the book .	the boat lost my son 's ring the book .
the spoon sent your wife 's friend 's fork the mirror .	the spoon moved your wife 's friend 's fork the mirror .
the truck gave my dad 's boss 's truck the window .	the truck held my dad 's boss 's truck the window .
the candle sent your mirror the ring .	the candle lost your mirror the ring .
the rug sent your bottle the toy .	the rug moved your bottle the toy .
the car gave my dentist 's daughter 's dish the mirror .	the car moved my dentist 's daughter 's dish the mirror .
the box gave my brother 's window the mirror .	the box shook my brother 's window the mirror .
the glass gave my book the bottle .	the glass shook my book the bottle .
the rocket sent my book the door .	the rocket shook my book the door .
the book sent my shoe the ring .	the book cleaned my shoe the ring .
the boat gave my chair the ship .	the boat cleaned my chair the ship .
the bowl bought my dad 's cup the ring .	the bowl moved my dad 's cup the ring .
the rug gave my daughter 's ship the picture .	the rug dropped my daughter 's ship the picture .
the couch sent my spoon the fork .	the couch shook my spoon the fork .
the rocket bought your father 's mom 's picture the book .	the rocket moved your father 's mom 's picture the book .
the spoon gave your mom 's book the cup .	the spoon held your mom 's book the cup .
the button bought your father 's crayon the candle .	the button cleaned your father 's crayon the candle .
the couch gave your brother 's teacher 's bag the car .	the couch moved your brother 's teacher 's bag the car .
the shirt gave your hat the truck .	the shirt lost your hat the truck .
the plane bought your wife 's mother 's book the book .	the plane moved your wife 's mother 's book the book .
the book bought your mother 's bed the fork .	the book held your mother 's bed the fork .
the truck gave my dentist 's husband 's rocket the box .	the truck lost my dentist 's husband 's rocket the box .
the doll sent my cousin 's grandmother 's car the crayon .	the doll held my cousin 's grandmother 's car the crayon .
the rocket sent my teacher 's doll the door .	the rocket cleaned my teacher 's doll the door .
the ring sent my husband 's son 's bottle the plate .	the ring lost my husband 's son 's bottle the plate .
the book gave my daughter 's dad 's hat the ring .	the book cleaned my daughter 's dad 's hat the ring .
the book gave your book the plane .	the book lost your book the plane .
the rug gave my mom 's dentist 's car the book .	the rug kept my mom 's dentist 's car the book .
the plane sent my book the bag .	the plane moved my book the bag .
the rocket sent my cup the crayon .	the rocket dropped my cup the crayon .
the rug bought my plane the book .	the rug moved my plane the book .
the box gave my sister 's button the button .	the box held my sister 's button the button .
the plane gave your doctor 's fork the crayon .	the plane shook your doctor 's fork the crayon .
the mirror gave my book the spoon .	the mirror moved my book the spoon .
the bicycle bought my door the fork .	the bicycle moved my door the fork .
the car bought my button the door .	the car lost my button the door .
the door showed my boss 's dentist 's mirror the couch .	the door moved my boss 's dentist 's mirror the couch .
the car bought my wife 's friend 's window the cup .	the car lost my wife 's friend 's window the cup .
the doll gave your husband 's cousin 's picture the bowl .	the doll dropped your husband 's cousin 's picture the bowl .
the toy gave my window the candle .	the toy kept my window the candle .
the truck sent my son 's window the dish .	the truck held my son 's window the dish .
the shoe sent my friend 's mom 's doll the box .	the shoe cleaned my friend 's mom 's doll the box .
the car bought my brother 's bowl the plate .	the car cleaned my brother 's bowl the plate .
the couch gave your hat the boat .	the couch shook your hat the boat .
the truck bought your grandmother 's bag the candle .	the truck lost your grandmother 's bag the candle .
the car gave my grandmother 's sister 's plate the car .	the car moved my grandmother 's sister 's plate the car .
the ship showed my brother 's car the spoon .	the ship dropped my brother 's car the spoon .
the ring showed your father 's wife 's cup the shoe .	the ring moved your father 's wife 's cup the shoe .
the truck showed my grandmother 's boss 's car the box .	the truck kept my grandmother 's boss 's car the box .
the bicycle bought your crayon the book .	the bicycle cleaned your crayon the book .
the bottle showed my brother 's boss 's picture the ring .	the bottle lost my brother 's boss 's picture the ring .
the plate bought my ring the fork .	the plate lost my ring the fork .
the doll bought your friend 's glass the toy .	the doll dropped your friend 's glass the toy .
the toy sent your father 's sister 's window the bag .	the toy dropped your father 's sister 's window the bag .
the ship bought my friend 's shoe the fork .	the ship cleaned my friend 's shoe the fork .
the car sent your boss 's cup the doll .	the car lost your boss 's cup the doll .
the shirt gave your cousin 's glass the car .	the shirt moved your cousin 's glass the car .
the shoe sent your mother 's cousin 's bag the shoe .	the shoe moved your mother 's cousin 's bag the shoe .
the shirt sent your mom 's grandmother 's toy the mirror .	the shirt dropped your mom 's grandmother 's toy the mirror .
the car bought my toy the dish .	the car lost my toy the dish .
the ring gave your sister 's rug the car .	the ring kept your sister 's rug the car .
the button sent my sister 's mom 's window the cup .	the button kept my sister 's mom 's window the cup .
the crayon sent your dentist 's button the rug .	the crayon cleaned your dentist 's button the rug .
the shoe showed my boat the bottle .	the shoe dropped my boat the bottle .
the spoon sent your husband 's candle the car .	the spoon cleaned your husband 's candle the car .
the bowl sent your son 's sister 's car the bag .	the bowl kept your son 's sister 's car the bag .
the cup sent my friend 's dentist 's crayon the door .	the cup cleaned my friend 's dentist 's crayon the door .
the button bought my friend 's mother 's rug the bicycle .	the button dropped my friend 's mother 's rug the bicycle .
the door showed your friend 's father 's toy the cup .	the door shook your friend 's father 's toy the cup .
the glass bought your son 's husband 's shirt the crayon .	the glass dropped your son 's husband 's shirt the crayon .
the box sent your doctor 's daughter 's bowl the rocket .	the box moved your doctor 's daughter 's bowl the rocket .
the car bought my dentist 's doctor 's hat the box .	the car shook my dentist 's doctor 's hat the box .
the toy showed your daughter 's ring the dish .	the toy moved your daughter 's ring the dish .
the bicycle gave your doctor 's bowl the book .	the bicycle moved your doctor 's bowl the book .
the book sent your father 's mom 's rug the chair .	the book cleaned your father 's mom 's rug the chair .
the window bought your brother 's teacher 's book the car .	the window lost your brother 's teacher 's book the car .
the window sent your doctor 's plate the bowl .	the window lost your doctor 's plate the bowl .
the bed sent my picture the bicycle .	the bed cleaned my picture the bicycle .
the shoe bought your cousin 's son 's hat the car .	the shoe moved your cousin 's son 's hat the car .
the mirror showed your cousin 's glass the bag .	the mirror dropped your cousin 's glass the bag .
the shirt sent my boss 's chair the shirt .	the shirt moved my boss 's chair the shirt .
the bowl gave my mother 's son 's chair the fork .	the bowl dropped my mother 's son 's chair the fork .
the bag showed my mom 's wife 's bag the chair .	the bag held my mom 's wife 's bag the chair .
the button showed my dentist 's toy the rocket .	the button cleaned my dentist 's toy the rocket .
the dish showed my friend 's window the crayon .	the dish moved my friend 's window the crayon .
the ship showed my plate the book .	the ship held my plate the book .
the book bought my dad 's toy the truck .	the book moved my dad 's toy the truck .
the book bought my cup the plate .	the book shook my cup the plate .
the window bought my cup the doll .	the window cleaned my cup the doll .
the box sent my mom 's toy the book .	the box kept my mom 's toy the book .
the bed sent your boss 's car the book .	the bed cleaned your boss 's car the book .
the book sent my father 's car the bottle .	the book lost my father 's car the bottle .
the hat showed my sister 's boss 's shoe the book .	the hat kept my sister 's boss 's shoe the book .
the button sent your doll the shoe .	the button moved your doll the shoe .
the ring bought my mother 's mom 's crayon the ring .	the ring shook my mother 's mom 's crayon the ring .
the chair bought my glass the shirt .	the chair dropped my glass the shirt .
the fork bought my daughter 's boat the glass .	the fork shook my daughter 's boat the glass .
the doll sent your friend 's wife 's button the bowl .	the doll dropped your friend 's wife 's button the bowl .
the book showed your chair the rug .	the book kept your chair the rug .
the bowl gave your grandmother 's brother 's plane the candle .	the bowl lost your grandmother 's brother 's plane the candle .
the dish sent my book the hat .	the dish moved my book the hat .
the shirt sent my book the candle .	the shirt cleaned my book the candle .
the plate sent your dentist 's box the plane .	the plate held your dentist 's box the plane .
the bicycle gave your mom 's dish the door .	the bicycle moved your mom 's dish the door .
the bicycle bought your sister 's mom 's bowl the truck .	the bicycle held your sister 's mom 's bowl the truck .
the mirror bought your mom 's teacher 's ship the crayon .	the mirror lost your mom 's teacher 's ship the crayon .
the box bought your plate the spoon .	the box lost your plate the spoon .
the car bought my grandmother 's doctor 's ship the chair .	the car shook my grandmother 's doctor 's ship the chair .
the window gave my daughter 's daughter 's cup the bowl .	the window kept my daughter 's daughter 's cup the bowl .
the mirror gave my grandmother 's door the bowl .	the mirror cleaned my grandmother 's door the bowl .
the book sent your doctor 's bed the plane .	the book moved your doctor 's bed the plane .
the book bought my father 's rug the bag .	the book shook my father 's rug the bag .
the dish bought your doctor 's teacher 's car the crayon .	the dish dropped your doctor 's teacher 's car the crayon .
the fork bought your dad 's toy the rug .	the fork held your dad 's toy the rug .
the plane gave my teacher 's book the bed .	the plane kept my teacher 's book the bed .
the hat bought your plane the book .	the hat held your plane the book .
the window bought my grandmother 's glass the shoe .	the window moved my grandmother 's glass the shoe .
the spoon gave your son 's door the rug .	the spoon lost your son 's door the rug .
the glass showed my chair the window .	the glass held my chair the window .
the bed bought my dentist 's car the picture .	the bed dropped my dentist 's car the picture .
the window showed my fork the plane .	the window cleaned my fork the plane .
the button showed my teacher 's fork the truck .	the button kept my teacher 's fork the truck .
the bag gave my grandmother 's door the window .	the bag cleaned my grandmother 's door the window .
the truck sent your dentist 's teacher 's bag the bottle .	the truck held your dentist 's teacher 's bag the bottle .
the shirt showed your friend 's sister 's candle the spoon .	the shirt held your friend 's sister 's candle the spoon .
the chair gave your mom 's sister 's ring the glass .	the chair cleaned your mom 's sister 's ring the glass .
the bicycle showed your window the bowl .	the bicycle shook your window the bowl .
the bottle showed my husband 's candle the car .	the bottle held my husband 's candle the car .
the candle showed my door the glass .	the candle shook my door the glass .
the window bought your doctor 's wife 's bag the shirt .	the window shook your doctor 's wife 's bag the shirt .
the mirror sent my dad 's glass the bag .	the mirror shook my dad 's glass the bag .
the cup gave my bowl the dish .	the cup dropped my bowl the dish .
the couch gave your fork the ship .	the couch shook your fork the ship .
the bowl sent your doll the ship .	the bowl shook your doll the ship .
the picture bought my husband 's glass the chair .	the picture lost my husband 's glass the chair .
the door sent your daughter 's glass the book .	the door shook your daughter 's glass the book .
the picture sent my son 's book the bottle .	the picture lost my son 's book the bottle .
the door sent your cup the picture .	the door kept your cup the picture .
the bed gave your father 's dentist 's window the book .	the bed dropped your father 's dentist 's window the book .
the toy showed your friend 's plate the hat .	the toy dropped your friend 's plate the hat .
the bag sent your truck the shirt .	the bag cleaned your truck the shirt .
the glass gave your dad 's cousin 's hat the glass .	the glass shook your dad 's cousin 's hat the glass .
the book gave your son 's doll the bag .	the book held your son 's doll the bag .
the truck sent your daughter 's shirt the shirt .	the truck cleaned your daughter 's shirt the shirt .
the crayon gave your rug the mirror .	the crayon dropped your rug the mirror .
the spoon bought my mom 's bicycle the truck .	the spoon kept my mom 's bicycle the truck .
the rug bought my spoon the chair .	the rug kept my spoon the chair .
the box showed your cousin 's bag the shoe .	the box held your cousin 's bag the shoe .
the boat bought your father 's truck the window .	the boat dropped your father 's truck the window .
the glass bought my candle the book .	the glass moved my candle the book .
the picture sent my father 's mother 's shoe the bed .	the picture cleaned my father 's mother 's shoe the bed .
the book gave my toy the shirt .	the book cleaned my toy the shirt .
the book sent my dad 's picture the couch .	the book moved my dad 's picture the couch .
the spoon showed my mom 's husband 's bicycle the truck .	the spoon kept my mom 's husband 's bicycle the truck .
the bag gave my sister 's chair the crayon .	the bag held my sister 's chair the crayon .
the candle gave my shoe the box .	the candle cleaned my shoe the box .
the bed gave my wife 's window the bowl .	the bed lost my wife 's window the bowl .
the box bought my grandmother 's truck the hat .	the box cleaned my grandmother 's truck the hat .
the toy showed your brother 's glass the picture .	the toy shook your brother 's glass the picture .
the toy showed your car the crayon .	the toy dropped your car the crayon .
the ship sent my dad 's dad 's boat the doll .	the ship shook my dad 's dad 's boat the doll .
the bed bought my husband 's cousin 's plane the car .	the bed kept my husband 's cousin 's plane the car .
the chair sent your toy the toy .	the chair shook your toy the toy .
the fork bought your picture the dish .	the fork held your picture the dish .
the bed bought your cousin 's shirt the spoon .	the bed moved your cousin 's shirt the spoon .
the box showed my father 's doll the button .	the box dropped my father 's doll the button .
the crayon bought your mom 's boat the couch .	the crayon moved your mom 's boat the couch .
the boat bought your sister 's rug the ring .	the boat lost your sister 's rug the ring .
the book gave your truck the ship .	the book lost your truck the ship .
the spoon sent your daughter 's spoon the boat .	the spoon held your daughter 's spoon the boat .
the car sent your teacher 's toy the shoe .	the car moved your teacher 's toy the shoe .
the spoon showed your button the picture .	the spoon held your button the picture .
the book showed my bowl the bowl .	the book lost my bowl the bowl .
the plate showed your book the book .	the plate kept your book the book .
the toy showed your wife 's daughter 's bicycle the crayon .	the toy cleaned your wife 's daughter 's bicycle the crayon .
the rug bought your truck the mirror .	the rug kept your truck the mirror .
the book sent your dish the plate .	the book shook your dish the plate .
the ring sent your window the button .	the ring held your window the button .
the doll showed your spoon the cup .	the doll moved your spoon the cup .
the chair bought your brother 's brother 's ring the picture .	the chair held your brother 's brother 's ring the picture .
the bowl showed your rocket the truck .	the bowl held your rocket the truck .
the bottle sent my glass the rocket .	the bottle dropped my glass the rocket .
the bed gave your rug the book .	the bed dropped your rug the book .
the ring gave my plane the doll .	the ring held my plane the doll .
the shoe showed my doctor 's mirror the fork .	the shoe dropped my doctor 's mirror the fork .
the cup showed your picture the ship .	the cup lost your picture the ship .
the doll sent my cup the mirror .	the doll moved my cup the mirror .
the spoon gave your boss 's bottle the book .	the spoon dropped your boss 's bottle the book .
the dish gave your daughter 's sister 's chair the shoe .	the dish dropped your daughter 's sister 's chair the shoe .
the dish sent your father 's shirt the couch .	the dish shook your father 's shirt the couch .
the mirror showed my son 's mother 's bicycle the cup .	the mirror dropped my son 's mother 's bicycle the cup .
the plate bought my spoon the picture .	the plate shook my spoon the picture .
the crayon sent my teacher 's picture the book .	the crayon kept my teacher 's picture the book .
the button bought your sister 's ship the shoe .	the button held your sister 's ship the shoe .
the bottle sent my boat the fork .	the bottle shook my boat the fork .
the button gave your bed the hat .	the button cleaned your bed the hat .
the glass bought your doctor 's mom 's door the button .	the glass kept your doctor 's mom 's door the button .
the hat sent my mom 's brother 's spoon the bed .	the hat cleaned my mom 's brother 's spoon the bed .
the shirt gave your dentist 's button the ring .	the shirt shook your dentist 's button the ring .
the car showed my cousin 's brother 's button the shirt .	the car moved my cousin 's brother 's button the shirt .
the shirt bought your friend 's crayon the truck .	the shirt moved your friend 's crayon the truck .
the couch showed my toy the cup .	the couch lost my toy the cup .
the dish sent your bowl the toy .	the dish shook your bowl the toy .
the ring gave your friend 's ship the bed .	the ring moved your friend 's ship the bed .
the fork gave your daughter 's couch the book .	the fork moved your daughter 's couch the book .
the couch bought my mom 's daughter 's bottle the mirror .	the couch dropped my mom 's daughter 's bottle the mirror .
the hat gave my window the car .	the hat dropped my window the car .
the bowl showed my shoe the door .	the bowl dropped my shoe the door .
the bottle bought your dentist 's picture the chair .	the bottle dropped your dentist 's picture the chair .
the book gave my father 's husband 's car the button .	the book shook my father 's husband 's car the button .
the crayon sent my bag the glass .	the crayon moved my bag the glass .
the glass sent your teacher 's glass the bottle .	the glass shook your teacher 's glass the bottle .
the spoon gave my dad 's grandmother 's button the chair .	the spoon held my dad 's grandmother 's button the chair .
the bowl showed your mom 's son 's chair the fork .	the bowl lost your mom 's son 's chair the fork .
the ring showed my son 's cup the doll .	the ring kept my son 's cup the doll .
the hat bought my boss 's bag the bicycle .	the hat moved my boss 's bag the bicycle .
the shirt showed my sister 's ring the book .	the shirt kept my sister 's ring the book .
the door bought my daughter 's bottle the bowl .	the door lost my daughter 's bottle the bowl .
the bottle gave your mom 's son 's dish the shirt .	the bottle dropped your mom 's son 's dish the shirt .
the chair bought my mother 's dish the bicycle .	the chair lost my mother 's dish the bicycle .
the couch gave your button the shoe .	the couch kept your button the shoe .
the bottle sent my spoon the bed .	the bottle dropped my spoon the bed .
the mirror showed your husband 's dish the bowl .	the mirror lost your husband 's dish the bowl .
the glass bought my boat the button .	the glass cleaned my boat the button .
the shoe showed my grandmother 's husband 's doll the shoe .	the shoe kept my grandmother 's husband 's doll the shoe .
the bag gave my sister 's window the cup .	the bag dropped my sister 's window the cup .
the ship sent my doctor 's boss 's dish the car .	the ship shook my doctor 's boss 's dish the car .
the candle bought my daughter 's son 's couch the toy .	the candle dropped my daughter 's son 's couch the toy .
the fork sent my daughter 's dad 's cup the car .	the fork held my daughter 's dad 's cup the car .
the car gave my plate the ship .	the car cleaned my plate the ship .
the button bought my dentist 's daughter 's chair the candle .	the button held my dentist 's daughter 's chair the candle .
the ship bought your car the rocket .	the ship kept your car the rocket .
the car bought your dad 's rug the door .	the car shook your dad 's rug the door .
the rug showed your father 's book the bowl .	the rug kept your father 's book the bowl .
the spoon showed my friend 's grandmother 's shoe the rocket .	the spoon kept my friend 's grandmother 's shoe the rocket .
the bicycle sent my mother 's fork the plane .	the bicycle shook my mother 's fork the plane .
the ship bought your friend 's bicycle the book .	the ship lost your friend 's bicycle the book .
the truck showed your wife 's shoe the door .	the truck shook your wife 's shoe the door .
the glass sent your mother 's chair the crayon .	the glass kept your mother 's chair the crayon .
the book gave your picture the cup .	the book moved your picture the cup .
the glass gave your dad 's friend 's door the cup .	the glass moved your dad 's friend 's door the cup .
the glass sent your rug the glass .	the glass kept your rug the glass .
the hat gave your mother 's husband 's bed the car .	the hat lost your mother 's husband 's bed the car .
the bowl bought my sister 's bag the ship .	the bowl dropped my sister 's bag the ship .
the door sent your boss 's cup the rocket .	the door kept your boss 's cup the rocket .
the rocket showed your doctor 's rocket the door .	the rocket cleaned your doctor 's rocket the door .
the book sent my boss 's glass the book .	the book kept my boss 's glass the book .
the rug bought your dentist 's daughter 's mirror the truck .	the rug dropped your dentist 's daughter 's mirror the truck .
the mirror sent my husband 's button the bottle .	the mirror shook my husband 's button the bottle .
the chair gave your sister 's brother 's button the plate .	the chair shook your sister 's brother 's button the plate .
the shoe showed my son 's plate the spoon .	the shoe lost my son 's plate the spoon .
the book bought your ring the glass .	the book held your ring the glass .
the crayon sent my brother 's bed the boat .	the crayon held my brother 's bed the boat .
the doll showed my cup the book .	the doll lost my cup the book .
the glass sent my hat the cup .	the glass dropped my hat the cup .
the picture gave your son 's wife 's door the doll .	the picture kept your son 's wife 's door the doll .
the ship gave my friend 's brother 's shoe the bowl .	the ship held my friend 's brother 's shoe the bowl .
the doll sent my cousin 's doctor 's box the couch .	the doll cleaned my cousin 's doctor 's box the couch .
the rug bought my friend 's son 's bicycle the car .	the rug shook my friend 's son 's bicycle the car .
the ship bought my shoe the crayon .	the ship shook my shoe the crayon .
the hat showed my bed the box .	the hat dropped my bed the box .
the picture showed my wife 's brother 's dish the bicycle .	the picture moved my wife 's brother 's dish the bicycle .
the ship showed your wife 's husband 's picture the car .	the ship moved your wife 's husband 's picture the car .
the chair bought my bicycle the picture .	the chair held my bicycle the picture .
the rocket bought your sister 's book the boat .	the rocket shook your sister 's book the boat .
the cup sent my brother 's ship the rocket .	the cup kept my brother 's ship the rocket .
the couch showed my sister 's mother 's dish the bottle .	the couch kept my sister 's mother 's dish the bottle .
the shoe gave your doctor 's grandmother 's hat the bag .	the shoe cleaned your doctor 's grandmother 's hat the bag .
the bottle sent my mother 's rocket the picture .	the bottle moved my mother 's rocket the picture .
the car gave your dish the ship .	the car kept your dish the ship .
the crayon sent your cup the truck .	the crayon lost your cup the truck .
the dish sent your brother 's cousin 's hat the bottle .	the dish moved your brother 's cousin 's hat the bottle .
