this spoon by the children has worked with the park .	this spoon by the children have worked with the park .
these spoons behind the man were talking .	these spoons behind the man was talking .
the candles in front of the doctor do n't stretch .	the candles in front of the doctor does n't stretch .
that book behind the ladies was talking .	that book behind the ladies were talking .
these dolls near the patient do n't wave .	these dolls near the patient does n't wave .
those dishes next to the woman do n't know that toy .	those dishes next to the woman does n't know that toy .
that bottle next to the women has confused this toy .	that bottle next to the women have confused this toy .
this shirt by the men does stretch .	this shirt by the men do stretch .
this shirt by the women does n't cry .	this shirt by the women do n't cry .
that school in front of the children does drop the doctors .	that school in front of the children do drop the doctors .
the glasses behind the dentist are n't losing .	the glasses behind the dentist is n't losing .
the school near the ladies is lying .	the school near the ladies are lying .
the pictures behind the person have painted .	the pictures behind the person has painted .
those doors near the teacher do n't yell .	those doors near the teacher does n't yell .
those toys in front of the person have n't found those children .	those toys in front of the person has n't found those children .
those plates by the queen are n't reading .	those plates by the queen is n't reading .
these glasses by the teacher do answer the ring .	these glasses by the teacher does answer the ring .
the shoes behind the king do n't wave .	the shoes behind the king does n't wave .
these trucks in front of the lady do n't grow .	these trucks in front of the lady does n't grow .
the doll near the men does n't teach the shirt .	the doll near the men do n't teach the shirt .
that hat near the children is n't talking to the cup .	that hat near the children are n't talking to the cup .
the books near the person have n't dropped this adult .	the books near the person has n't dropped this adult .
that crayon next to the people does shake the women .	that crayon next to the people do shake the women .
this rug behind the men does n't cough .	this rug behind the men do n't cough .
the hats next to the child do n't take the dancer .	the hats next to the child does n't take the dancer .
those glasses by the dancer have n't heard these rooms .	those glasses by the dancer has n't heard these rooms .
that box next to the girls was n't singing .	that box next to the girls were n't singing .
these books in front of the customer have n't waved .	these books in front of the customer has n't waved .
that bottle near the doctors has n't helped the shoe .	that bottle near the doctors have n't helped the shoe .
that chair behind the doctors does know those pictures .	that chair behind the doctors do know those pictures .
those cars behind the person were making this lady .	those cars behind the person was making this lady .
this ship by the doctors has cleaned those women .	this ship by the doctors have cleaned those women .
the cars behind the dentist have n't moved the adult .	the cars behind the dentist has n't moved the adult .
these hats in front of the guy have n't eaten .	these hats in front of the guy has n't eaten .
those boats in front of the man are growing .	those boats in front of the man is growing .
that window near the doctors does n't paint .	that window near the doctors do n't paint .
those toys behind the child do appreciate those cups .	those toys behind the child does appreciate those cups .
the buttons near the adult do n't drop this driver .	the buttons near the adult does n't drop this driver .
those toys near the child have lost these cars .	those toys near the child has lost these cars .
these glasses next to the boy are n't teaching that restaurant .	these glasses next to the boy is n't teaching that restaurant .
that school next to the boys is n't talking .	that school next to the boys are n't talking .
those cups near the adult do n't scream .	those cups near the adult does n't scream .
those rings by the guy do practice .	those rings by the guy does practice .
the boat next to the guys does grow .	the boat next to the guys do grow .
those dolls near the dentist are n't teaching the rooms .	those dolls near the dentist is n't teaching the rooms .
those windows in front of the adult do teach these crayons .	those windows in front of the adult does teach these crayons .
the bowl by the girls is waving .	the bowl by the girls are waving .
the boxes behind the driver have helped the cars .	the boxes behind the driver has helped the cars .
these rooms behind the guy do care for these rooms .	these rooms behind the guy does care for these rooms .
that car near the doctors has cried .	that car near the doctors have cried .
that crayon next to the men has confused this bicycle .	that crayon next to the men have confused this bicycle .
this bicycle in front of the men was running .	this bicycle in front of the men were running .
the window in front of the doctors was screaming .	the window in front of the doctors were screaming .
this car next to the boys was listening to that mall .	this car next to the boys were listening to that mall .
those buttons behind the doctor do n't keep the ladies .	those buttons behind the doctor does n't keep the ladies .
the dishes near the patient are moving this person .	the dishes near the patient is moving this person .
this shirt near the men does n't scare that book .	this shirt near the men do n't scare that book .
the candle by the ladies does yell .	the candle by the ladies do yell .
the mirror near the ladies does clean the boy .	the mirror near the ladies do clean the boy .
those rings next to the man are n't finding the customer .	those rings next to the man is n't finding the customer .
the park behind the ladies has bothered the chair .	the park behind the ladies have bothered the chair .
the schools near the customer do n't understand that book .	the schools near the customer does n't understand that book .
the rooms next to the queen were n't reading .	the rooms next to the queen was n't reading .
these beds by the adult have cried .	these beds by the adult has cried .
that ship behind the ladies was smiling .	that ship behind the ladies were smiling .
this ship in front of the guys does steal the guy .	this ship in front of the guys do steal the guy .
those bowls near the girl do work with the mirror .	those bowls near the girl does work with the mirror .
those shoes in front of the teacher were throwing this driver .	those shoes in front of the teacher was throwing this driver .
the chair behind the guys has n't cried .	the chair behind the guys have n't cried .
that plate by the doctors does keep these people .	that plate by the doctors do keep these people .
that window next to the doctors does hear the chairs .	that window next to the doctors do hear the chairs .
the couch by the teachers has n't cried .	the couch by the teachers have n't cried .
this ring near the teachers was listening to the bowl .	this ring near the teachers were listening to the bowl .
these doors next to the boy were n't yelling .	these doors next to the boy was n't yelling .
this picture next to the girls is listening to that rug .	this picture next to the girls are listening to that rug .
those candles near the lady are yelling .	those candles near the lady is yelling .
the door in front of the teachers does n't fix that dentist .	the door in front of the teachers do n't fix that dentist .
those windows in front of the turtle are growing .	those windows in front of the turtle is growing .
those forks next to the person do keep that teacher .	those forks next to the person does keep that teacher .
this car behind the doctors has waved .	this car behind the doctors have waved .
this plane by the children does exercise .	this plane by the children do exercise .
the window next to the ladies is n't screaming .	the window next to the ladies are n't screaming .
this rug near the teachers is finding that driver .	this rug near the teachers are finding that driver .
those beds in front of the adult do n't practice .	those beds in front of the adult does n't practice .
that chair next to the women does grow .	that chair next to the women do grow .
those cups in front of the queen are smiling .	those cups in front of the queen is smiling .
the boats next to the dancer have n't talked .	the boats next to the dancer has n't talked .
this restaurant in front of the children has n't bought those boys .	this restaurant in front of the children have n't bought those boys .
the shoes by the queen have n't lost .	the shoes by the queen has n't lost .
these forks in front of the customer do n't whisper .	these forks in front of the customer does n't whisper .
the glasses by the queen do n't work with this room .	the glasses by the queen does n't work with this room .
this museum behind the ladies was lying .	this museum behind the ladies were lying .
those bags in front of the queen do n't whisper .	those bags in front of the queen does n't whisper .
the books in front of the customer were n't yelling .	the books in front of the customer was n't yelling .
that rocket behind the ladies does help this book .	that rocket behind the ladies do help this book .
the rooms in front of the child are whispering .	the rooms in front of the child is whispering .
those beds near the guy are n't teaching that cup .	those beds near the guy is n't teaching that cup .
these crayons behind the dentist do n't eat .	these crayons behind the dentist does n't eat .
these books by the adult were n't buying the dentist .	these books by the adult was n't buying the dentist .
this fork near the men does scream .	this fork near the men do scream .
those bowls next to the king are n't keeping the teachers .	those bowls next to the king is n't keeping the teachers .
those plates by the dog have n't grown .	those plates by the dog has n't grown .
that picture by the men was practicing .	that picture by the men were practicing .
the candles in front of the queen do n't lose .	the candles in front of the queen does n't lose .
the candle by the doctors has eaten .	the candle by the doctors have eaten .
the hospital in front of the teachers is n't listening to that car .	the hospital in front of the teachers are n't listening to that car .
those schools by the queen were running .	those schools by the queen was running .
that boat by the doctors has held that dentist .	that boat by the doctors have held that dentist .
this room next to the teachers was smiling .	this room next to the teachers were smiling .
the mall next to the doctors has n't won .	the mall next to the doctors have n't won .
these pictures near the doctor do keep the children .	these pictures near the doctor does keep the children .
those bowls behind the customer have grown .	those bowls behind the customer has grown .
this bag next to the cats has learned .	this bag next to the cats have learned .
those toys next to the man do sing .	those toys next to the man does sing .
those rings next to the woman do n't cough .	those rings next to the woman does n't cough .
the school in front of the people is n't listening to the spoons .	the school in front of the people are n't listening to the spoons .
the doors next to the dentist have n't lost this teacher .	the doors next to the dentist has n't lost this teacher .
that rocket behind the men does n't learn .	that rocket behind the men do n't learn .
the crayons near the adult are n't working with this school .	the crayons near the adult is n't working with this school .
that shirt in front of the ladies was listening to these bowls .	that shirt in front of the ladies were listening to these bowls .
these hats by the woman have taken the men .	these hats by the woman has taken the men .
these buttons in front of the turtle do learn .	these buttons in front of the turtle does learn .
those toys near the lady have n't won .	those toys near the lady has n't won .
those schools near the woman are n't holding these boys .	those schools near the woman is n't holding these boys .
the rug next to the ladies does n't shake the people .	the rug next to the ladies do n't shake the people .
that museum next to the men has heard those windows .	that museum next to the men have heard those windows .
this hat by the ladies does n't scream .	this hat by the ladies do n't scream .
those plates next to the lady do n't bother the candle .	those plates next to the lady does n't bother the candle .
the book near the people has n't heard the bed .	the book near the people have n't heard the bed .
those bottles behind the doctor were n't finding these men .	those bottles behind the doctor was n't finding these men .
that candle in front of the doctors is teaching these pictures .	that candle in front of the doctors are teaching these pictures .
the mirror behind the people does practice .	the mirror behind the people do practice .
this school behind the men has n't talked to these shirts .	this school behind the men have n't talked to these shirts .
these books in front of the adult do n't care for that glass .	these books in front of the adult does n't care for that glass .
the bags by the lady do n't hear those shoes .	the bags by the lady does n't hear those shoes .
this picture near the ladies does shake the doctors .	this picture near the ladies do shake the doctors .
the glasses behind the man are n't yelling .	the glasses behind the man is n't yelling .
these boats next to the boy have heard that doll .	these boats next to the boy has heard that doll .
the glasses next to the queen have found the restaurant .	the glasses next to the queen has found the restaurant .
the book next to the women is n't painting .	the book next to the women are n't painting .
that toy behind the people does cry .	that toy behind the people do cry .
that bicycle next to the people is shaking this teacher .	that bicycle next to the people are shaking this teacher .
those candles by the woman are waving .	those candles by the woman is waving .
that crayon behind the boys does n't lose .	that crayon behind the boys do n't lose .
this truck behind the children was working with those forks .	this truck behind the children were working with those forks .
these forks in front of the adult have n't thrown the boys .	these forks in front of the adult has n't thrown the boys .
the beds by the queen do n't answer the beds .	the beds by the queen does n't answer the beds .
these chairs next to the customer have lost those candles .	these chairs next to the customer has lost those candles .
the candle in front of the men has n't worried this candle .	the candle in front of the men have n't worried this candle .
the bank next to the horses is n't growing .	the bank next to the horses are n't growing .
the spoons in front of the patient do n't learn .	the spoons in front of the patient does n't learn .
that bed behind the men was losing .	that bed behind the men were losing .
the cups next to the lady do n't help the dish .	the cups next to the lady does n't help the dish .
these cups next to the customer have laughed .	these cups next to the customer has laughed .
these boxes near the dentist were n't working with those boxes .	these boxes near the dentist was n't working with those boxes .
these spoons in front of the driver do n't answer these cars .	these spoons in front of the driver does n't answer these cars .
those rings behind the man have n't found the adult .	those rings behind the man has n't found the adult .
those bottles near the guy do n't worry this bottle .	those bottles near the guy does n't worry this bottle .
the truck near the teachers was singing .	the truck near the teachers were singing .
this door near the men does n't steal those teachers .	this door near the men do n't steal those teachers .
that car next to the teachers does praise that school .	that car next to the teachers do praise that school .
the cup behind the girls is working with the spoon .	the cup behind the girls are working with the spoon .
the spoon behind the children has worked with this rug .	the spoon behind the children have worked with this rug .
those pictures behind the person have held this child .	those pictures behind the person has held this child .
this museum behind the girls has read .	this museum behind the girls have read .
that door behind the people has taught this spoon .	that door behind the people have taught this spoon .
that toy behind the guys is n't reading .	that toy behind the guys are n't reading .
the boat in front of the ladies does n't talk to the bag .	the boat in front of the ladies do n't talk to the bag .
the toys behind the dentist do throw the boy .	the toys behind the dentist does throw the boy .
that hospital next to the boys is working with that bag .	that hospital next to the boys are working with that bag .
that bottle near the girls does know those books .	that bottle near the girls do know those books .
those pictures near the doctor were holding these boys .	those pictures near the doctor was holding these boys .
these hats by the woman do n't find the dentist .	these hats by the woman does n't find the dentist .
these toys near the dentist were talking to the windows .	these toys near the dentist was talking to the windows .
that car next to the children has held the people .	that car next to the children have held the people .
these dishes by the dentist have found the boys .	these dishes by the dentist has found the boys .
the forks in front of the lady do know these windows .	the forks in front of the lady does know these windows .
these candles in front of the man have won .	these candles in front of the man has won .
these schools by the girl were n't visiting these books .	these schools by the girl was n't visiting these books .
that candle in front of the doctors was eating .	that candle in front of the doctors were eating .
the hospital in front of the men does keep these boys .	the hospital in front of the men do keep these boys .
the picture next to the cats is eating .	the picture next to the cats are eating .
those cars next to the queen were n't waving .	those cars next to the queen was n't waving .
those cars behind the hamster have learned .	those cars behind the hamster has learned .
the candle next to the children is working with this plate .	the candle next to the children are working with this plate .
those rings next to the driver do exercise .	those rings next to the driver does exercise .
this shirt by the women does n't work with the museum .	this shirt by the women do n't work with the museum .
the restaurant next to the boys has n't worried this button .	the restaurant next to the boys have n't worried this button .
the plates next to the guy were n't keeping that boy .	the plates next to the guy was n't keeping that boy .
this library behind the guys does n't eat .	this library behind the guys do n't eat .
those schools by the girl have won .	those schools by the girl has won .
those forks in front of the girl have n't worried the hat .	those forks in front of the girl has n't worried the hat .
the books in front of the boy do n't care for these bowls .	the books in front of the boy does n't care for these bowls .
the spoons behind the boy were screaming .	the spoons behind the boy was screaming .
this rocket near the girls does exercise .	this rocket near the girls do exercise .
the buttons next to the king were n't reading .	the buttons next to the king was n't reading .
these forks by the guy have n't waved .	these forks by the guy has n't waved .
the rooms in front of the driver are n't growing .	the rooms in front of the driver is n't growing .
this mirror behind the doctors has n't heard that book .	this mirror behind the doctors have n't heard that book .
the ring near the ladies was finding that man .	the ring near the ladies were finding that man .
this couch next to the boys has n't cried .	this couch next to the boys have n't cried .
the doors behind the mouse do n't grow .	the doors behind the mouse does n't grow .
those beds near the king do have that patient .	those beds near the king does have that patient .
these beds next to the rabbit do grow .	these beds next to the rabbit does grow .
the books by the teacher have n't thrown those boys .	the books by the teacher has n't thrown those boys .
those cups in front of the driver are n't fixing the queen .	those cups in front of the driver is n't fixing the queen .
these doors behind the patient do n't take those children .	these doors behind the patient does n't take those children .
the shirt in front of the children does grow .	the shirt in front of the children do grow .
that toy in front of the men does lie .	that toy in front of the men do lie .
those hats near the person do worry the shirts .	those hats near the person does worry the shirts .
those buttons in front of the queen were n't waving .	those buttons in front of the queen was n't waving .
those forks in front of the customer do n't lie .	those forks in front of the customer does n't lie .
these toys by the queen have worried this bowl .	these toys by the queen has worried this bowl .
these boxes by the dentist have talked to the car .	these boxes by the dentist has talked to the car .
these cars near the dentist are n't painting .	these cars near the dentist is n't painting .
these cars in front of the driver do n't hear this mirror .	these cars in front of the driver does n't hear this mirror .
the beds by the dancer do paint .	the beds by the dancer does paint .
this fork in front of the boys was eating .	this fork in front of the boys were eating .
that shoe next to the doctors does n't worry the mall .	that shoe next to the doctors do n't worry the mall .
that school next to the girls does whisper .	that school next to the girls do whisper .
the books by the adult do n't appreciate these doors .	the books by the adult does n't appreciate these doors .
this bed behind the children has n't grown .	this bed behind the children have n't grown .
these spoons by the bird do n't run .	these spoons by the bird does n't run .
those cups near the woman are talking to this fork .	those cups near the woman is talking to this fork .
the pictures in front of the lady do n't know the buttons .	the pictures in front of the lady does n't know the buttons .
these schools next to the girl have n't won .	these schools next to the girl has n't won .
the windows behind the guy have n't found the mall .	the windows behind the guy has n't found the mall .
these spoons behind the girl have n't grown .	these spoons behind the girl has n't grown .
the crayons in front of the adult are cleaning that woman .	the crayons in front of the adult is cleaning that woman .
this book in front of the doctors was throwing this man .	this book in front of the doctors were throwing this man .
this plate in front of the children was listening to this book .	this plate in front of the children were listening to this book .
the boxes behind the girl do bother that restaurant .	the boxes behind the girl does bother that restaurant .
these crayons in front of the woman do n't lose these teachers .	these crayons in front of the woman does n't lose these teachers .
that window in front of the doctors was n't working with the ship .	that window in front of the doctors were n't working with the ship .
the books next to the girl have heard that car .	the books next to the girl has heard that car .
