that bicycle near the ladies was n't talking to that car .	that bicycle near the ladies were n't talking to that car .
the chair by the teachers is n't teaching that crayon .	the chair by the teachers are n't teaching that crayon .
those dishes next to the woman do win .	those dishes next to the woman does win .
the chairs next to the boy do n't read .	the chairs next to the boy does n't read .
the pictures in front of the dentist do n't scare those schools .	the pictures in front of the dentist does n't scare those schools .
the door next to the teachers has n't answered the cars .	the door next to the teachers have n't answered the cars .
those doors in front of the driver do scare this car .	those doors in front of the driver does scare this car .
those plates next to the guy do talk .	those plates next to the guy does talk .
that picture in front of the boys does paint .	that picture in front of the boys do paint .
these bags behind the doctor do n't practice .	these bags behind the doctor does n't practice .
the buttons by the woman have answered the trucks .	the buttons by the woman has answered the trucks .
the spoons behind the doctor were making that girl .	the spoons behind the doctor was making that girl .
the boats by the dancer have n't waved .	the boats by the dancer has n't waved .
those dolls near the doctor do n't grow .	those dolls near the doctor does n't grow .
the plate next to the children was practicing .	the plate next to the children were practicing .
the bed by the ladies does sell this girl .	the bed by the ladies do sell this girl .
the park in front of the ladies is n't helping the couch .	the park in front of the ladies are n't helping the couch .
the toys near the horse do n't eat .	the toys near the horse does n't eat .
that picture behind the men has lost .	that picture behind the men have lost .
the rooms behind the teacher have heard those spoons .	the rooms behind the teacher has heard those spoons .
these windows next to the child have lost that dancer .	these windows next to the child has lost that dancer .
the books behind the teacher are growing .	the books behind the teacher is growing .
the window behind the men has n't worked with the candle .	the window behind the men have n't worked with the candle .
those bottles in front of the patient do n't understand that toy .	those bottles in front of the patient does n't understand that toy .
those cups near the woman do visit this bottle .	those cups near the woman does visit this bottle .
the book behind the men was n't buying the adult .	the book behind the men were n't buying the adult .
that room next to the doctors was yelling .	that room next to the doctors were yelling .
the bottle in front of the ladies does care for the candle .	the bottle in front of the ladies do care for the candle .
the doors behind the man have cried .	the doors behind the man has cried .
the car near the children does n't help this rug .	the car near the children do n't help this rug .
that couch near the women was n't losing the doctors .	that couch near the women were n't losing the doctors .
those doors behind the mouse have grown .	those doors behind the mouse has grown .
those plates near the king do n't sneeze .	those plates near the king does n't sneeze .
the toy near the teachers is n't listening to this dish .	the toy near the teachers are n't listening to this dish .
the chairs by the dancer were helping this room .	the chairs by the dancer was helping this room .
this button in front of the guys is painting .	this button in front of the guys are painting .
these bowls near the lady do n't sell this guy .	these bowls near the lady does n't sell this guy .
those windows near the doctor have n't thrown this boy .	those windows near the doctor has n't thrown this boy .
the mirror behind the teachers is crying .	the mirror behind the teachers are crying .
that plane behind the women is n't helping that restaurant .	that plane behind the women are n't helping that restaurant .
the car behind the snakes was n't eating .	the car behind the snakes were n't eating .
these cups by the queen do n't answer those rooms .	these cups by the queen does n't answer those rooms .
these cars in front of the driver do n't answer those boxes .	these cars in front of the driver does n't answer those boxes .
the chair next to the children has won .	the chair next to the children have won .
that window near the women does n't sneeze .	that window near the women do n't sneeze .
this truck next to the boys has learned .	this truck next to the boys have learned .
these pictures next to the guy do fix these guys .	these pictures next to the guy does fix these guys .
this toy in front of the ladies was n't dropping this boy .	this toy in front of the ladies were n't dropping this boy .
the bowls in front of the dentist do n't care for the spoons .	the bowls in front of the dentist does n't care for the spoons .
this plane next to the boys does n't yell .	this plane next to the boys do n't yell .
those shoes next to the adult do read .	those shoes next to the adult does read .
the doll next to the dogs is growing .	the doll next to the dogs are growing .
these bottles by the girl have n't kept the woman .	these bottles by the girl has n't kept the woman .
the schools behind the dentist are n't talking to that shirt .	the schools behind the dentist is n't talking to that shirt .
those cars near the guy do understand the forks .	those cars near the guy does understand the forks .
this chair near the people does yell .	this chair near the people do yell .
these crayons in front of the woman have n't eaten .	these crayons in front of the woman has n't eaten .
those bags by the girl do hear these cars .	those bags by the girl does hear these cars .
this couch by the guys has talked .	this couch by the guys have talked .
the forks behind the customer are n't painting .	the forks behind the customer is n't painting .
those chairs behind the boy do n't care for those cars .	those chairs behind the boy does n't care for those cars .
the plates next to the boy have won .	the plates next to the boy has won .
these bags near the king do stretch .	these bags near the king does stretch .
the books in front of the boy are teaching this picture .	the books in front of the boy is teaching this picture .
those boats behind the doctor have fixed the king .	those boats behind the doctor has fixed the king .
those windows in front of the girl have taken that woman .	those windows in front of the girl has taken that woman .
this bicycle behind the children has n't bothered these trucks .	this bicycle behind the children have n't bothered these trucks .
those schools next to the customer do n't cough .	those schools next to the customer does n't cough .
this mirror by the children does praise the plane .	this mirror by the children do praise the plane .
this book next to the horses does n't run .	this book next to the horses do n't run .
the crayon in front of the doctors does n't know the boats .	the crayon in front of the doctors do n't know the boats .
these shoes behind the girl are n't lying .	these shoes behind the girl is n't lying .
the hospital by the ladies was waving .	the hospital by the ladies were waving .
the shirts in front of the doctor do lose those ladies .	the shirts in front of the doctor does lose those ladies .
the crayons behind the teacher do cry .	the crayons behind the teacher does cry .
the school by the men was moving the teacher .	the school by the men were moving the teacher .
the shirts behind the doctor were visiting these schools .	the shirts behind the doctor was visiting these schools .
the candle in front of the teachers is running .	the candle in front of the teachers are running .
these forks by the girl do n't win .	these forks by the girl does n't win .
the ship near the ladies does n't worry these rings .	the ship near the ladies do n't worry these rings .
this mall by the children does n't worry the boat .	this mall by the children do n't worry the boat .
this book by the doctors does n't whisper .	this book by the doctors do n't whisper .
this bicycle near the teachers does n't work with the hat .	this bicycle near the teachers do n't work with the hat .
these books behind the guy were n't smiling .	these books behind the guy was n't smiling .
this toy in front of the girls is n't lying .	this toy in front of the girls are n't lying .
this library behind the men does n't drop that king .	this library behind the men do n't drop that king .
these schools by the lady are singing .	these schools by the lady is singing .
these rooms next to the adult have n't learned .	these rooms next to the adult has n't learned .
the spoon near the people has n't dropped that customer .	the spoon near the people have n't dropped that customer .
that room near the boys was n't teaching the door .	that room near the boys were n't teaching the door .
these cars in front of the dentist were n't moving this man .	these cars in front of the dentist was n't moving this man .
the bags in front of the king have lost that adult .	the bags in front of the king has lost that adult .
that glass by the doctors was n't visiting the bicycle .	that glass by the doctors were n't visiting the bicycle .
this bank next to the men does cry .	this bank next to the men do cry .
the school behind the women does n't smile .	the school behind the women do n't smile .
the picture by the people is n't crying .	the picture by the people are n't crying .
this mirror next to the men has n't heard that rug .	this mirror next to the men have n't heard that rug .
this crayon next to the men has heard this ring .	this crayon next to the men have heard this ring .
the trucks next to the boy were listening to those plates .	the trucks next to the boy was listening to those plates .
the kitchen near the ladies was talking .	the kitchen near the ladies were talking .
the button in front of the children is n't losing .	the button in front of the children are n't losing .
those cars next to the patient were running .	those cars next to the patient was running .
the boats behind the girl are n't holding those people .	the boats behind the girl is n't holding those people .
the books behind the customer are screaming .	the books behind the customer is screaming .
the mirror in front of the women does n't learn .	the mirror in front of the women do n't learn .
those windows behind the dancer do n't win .	those windows behind the dancer does n't win .
those crayons in front of the king have n't worried that spoon .	those crayons in front of the king has n't worried that spoon .
these glasses next to the teacher have n't talked .	these glasses next to the teacher has n't talked .
these bottles behind the patient do n't listen to those hats .	these bottles behind the patient does n't listen to those hats .
this bag next to the women was n't singing .	this bag next to the women were n't singing .
those schools near the queen do work with the books .	those schools near the queen does work with the books .
that ship by the children has found the child .	that ship by the children have found the child .
these books next to the boy are buying that dancer .	these books next to the boy is buying that dancer .
those bags next to the driver are n't waving .	those bags next to the driver is n't waving .
this mirror behind the doctors is n't listening to the schools .	this mirror behind the doctors are n't listening to the schools .
those chairs by the adult do appreciate those boxes .	those chairs by the adult does appreciate those boxes .
the windows by the mouse are learning .	the windows by the mouse is learning .
the room behind the teachers does n't move the man .	the room behind the teachers do n't move the man .
the spoons by the dancer do n't exercise .	the spoons by the dancer does n't exercise .
these beds by the boy are talking to those cups .	these beds by the boy is talking to those cups .
these schools near the girl are throwing that adult .	these schools near the girl is throwing that adult .
the bottles by the patient do shake this teacher .	the bottles by the patient does shake this teacher .
those trucks by the lady do n't appreciate the chairs .	those trucks by the lady does n't appreciate the chairs .
those books near the dancer do n't visit these boats .	those books near the dancer does n't visit these boats .
the bags near the driver do n't whisper .	the bags near the driver does n't whisper .
the spoons near the person were n't working with this bank .	the spoons near the person was n't working with this bank .
the park near the boys does hear this museum .	the park near the boys do hear this museum .
these schools next to the girl have n't moved that girl .	these schools next to the girl has n't moved that girl .
those spoons near the doctor are n't crying .	those spoons near the doctor is n't crying .
those dolls by the person do smile .	those dolls by the person does smile .
the dish near the children is dropping that woman .	the dish near the children are dropping that woman .
those trucks near the dentist have painted .	those trucks near the dentist has painted .
these doors next to the dentist are n't buying those guys .	these doors next to the dentist is n't buying those guys .
these pictures near the lady were n't running .	these pictures near the lady was n't running .
that museum by the guys does help the glasses .	that museum by the guys do help the glasses .
this bank near the boys does n't praise that museum .	this bank near the boys do n't praise that museum .
these boxes near the doctor were n't fixing the guys .	these boxes near the doctor was n't fixing the guys .
the windows near the doctor are teaching that book .	the windows near the doctor is teaching that book .
this boat by the people does find the lady .	this boat by the people do find the lady .
this truck in front of the men has visited the book .	this truck in front of the men have visited the book .
those rooms near the boy are n't cleaning that king .	those rooms near the boy is n't cleaning that king .
those cars next to the man have n't dropped that driver .	those cars next to the man has n't dropped that driver .
the beds in front of the guy do answer this school .	the beds in front of the guy does answer this school .
that museum in front of the ladies has lost these spoons .	that museum in front of the ladies have lost these spoons .
those forks by the patient have n't read .	those forks by the patient has n't read .
the plates by the child have n't laughed .	the plates by the child has n't laughed .
this kitchen next to the men does know those glasses .	this kitchen next to the men do know those glasses .
this school by the people has n't heard this school .	this school by the people have n't heard this school .
these boats behind the adult have confused those rings .	these boats behind the adult has confused those rings .
this plane in front of the dogs does run .	this plane in front of the dogs do run .
this bowl next to the doctors has grown .	this bowl next to the doctors have grown .
these books behind the boy are listening to this shirt .	these books behind the boy is listening to this shirt .
that truck near the guys was painting .	that truck near the guys were painting .
those books by the doctor do n't visit those cups .	those books by the doctor does n't visit those cups .
the bowls near the dentist were helping these windows .	the bowls near the dentist was helping these windows .
that library in front of the men has heard the cups .	that library in front of the men have heard the cups .
those doors in front of the doctor do answer the pictures .	those doors in front of the doctor does answer the pictures .
these boats next to the girl are n't holding the women .	these boats next to the girl is n't holding the women .
these cars behind the queen have n't taught the bottle .	these cars behind the queen has n't taught the bottle .
the plane next to the men was working with the books .	the plane next to the men were working with the books .
the shirt next to the children does cry .	the shirt next to the children do cry .
these books near the woman do take this lady .	these books near the woman does take this lady .
the schools by the guy were fixing the doctors .	the schools by the guy was fixing the doctors .
the shoes near the boy do n't sing .	the shoes near the boy does n't sing .
the window in front of the women does talk .	the window in front of the women do talk .
that plate by the people has n't taught those cups .	that plate by the people have n't taught those cups .
these cars in front of the man have kept the boy .	these cars in front of the man has kept the boy .
the boat in front of the women has talked to that dish .	the boat in front of the women have talked to that dish .
those bottles by the adult have talked to those shirts .	those bottles by the adult has talked to those shirts .
this shirt next to the guys does n't whisper .	this shirt next to the guys do n't whisper .
these books next to the patient are learning .	these books next to the patient is learning .
that chair near the children does take this driver .	that chair near the children do take this driver .
this truck next to the teachers has dropped that man .	this truck next to the teachers have dropped that man .
the bag next to the people does exercise .	the bag next to the people do exercise .
this button by the girls is talking .	this button by the girls are talking .
these crayons by the child were learning .	these crayons by the child was learning .
those bowls in front of the person do work with those bowls .	those bowls in front of the person does work with those bowls .
these boxes behind the customer have n't taken this lady .	these boxes behind the customer has n't taken this lady .
the picture near the people has n't taught the book .	the picture near the people have n't taught the book .
the pictures by the patient have scared the dolls .	the pictures by the patient has scared the dolls .
those spoons in front of the adult were yelling .	those spoons in front of the adult was yelling .
these books behind the lady do care for that book .	these books behind the lady does care for that book .
the glasses by the driver do listen to that box .	the glasses by the driver does listen to that box .
these windows next to the driver have answered that car .	these windows next to the driver has answered that car .
this school next to the men is n't smiling .	this school next to the men are n't smiling .
that museum in front of the girls does listen to this dish .	that museum in front of the girls do listen to this dish .
the hat in front of the teachers is n't keeping the teacher .	the hat in front of the teachers are n't keeping the teacher .
those doors next to the man are talking .	those doors next to the man is talking .
these chairs next to the queen were practicing .	these chairs next to the queen was practicing .
these doors in front of the girl do n't bother these rings .	these doors in front of the girl does n't bother these rings .
these cups behind the man were n't working with that door .	these cups behind the man was n't working with that door .
those bottles near the customer do paint .	those bottles near the customer does paint .
that glass by the men is n't smiling .	that glass by the men are n't smiling .
the chairs behind the child do yell .	the chairs behind the child does yell .
this shoe near the children does wave .	this shoe near the children do wave .
the picture by the doctors was n't buying this woman .	the picture by the doctors were n't buying this woman .
the books next to the girl do n't steal those children .	the books next to the girl does n't steal those children .
these bottles by the king were taking the queen .	these bottles by the king was taking the queen .
these bowls behind the adult do n't read .	these bowls behind the adult does n't read .
the bottles by the girl do work with this school .	the bottles by the girl does work with this school .
these schools next to the lady are working with that bank .	these schools next to the lady is working with that bank .
the books near the customer do exercise .	the books near the customer does exercise .
that mall near the teachers is keeping the customer .	that mall near the teachers are keeping the customer .
those crayons behind the adult do sell this doctor .	those crayons behind the adult does sell this doctor .
those pictures behind the dancer do n't exercise .	those pictures behind the dancer does n't exercise .
the shirt by the ladies was n't buying this person .	the shirt by the ladies were n't buying this person .
the candles behind the person do cry .	the candles behind the person does cry .
that bicycle next to the people was losing the teachers .	that bicycle next to the people were losing the teachers .
those bowls behind the dancer do n't know these forks .	those bowls behind the dancer does n't know these forks .
the box next to the doctors has cried .	the box next to the doctors have cried .
this cup in front of the teachers has fixed the boys .	this cup in front of the teachers have fixed the boys .
the pictures in front of the man were n't helping those crayons .	the pictures in front of the man was n't helping those crayons .
this rug behind the women has n't cleaned that doctor .	this rug behind the women have n't cleaned that doctor .
those shoes in front of the queen do bother those schools .	those shoes in front of the queen does bother those schools .
these bowls near the teacher do n't scare this door .	these bowls near the teacher does n't scare this door .
those hats in front of the person do n't take the people .	those hats in front of the person does n't take the people .
this rocket behind the children was n't reading .	this rocket behind the children were n't reading .
the buttons next to the woman do n't praise this plane .	the buttons next to the woman does n't praise this plane .
those toys next to the lady were n't singing .	those toys next to the lady was n't singing .
those bottles next to the queen have n't confused that fork .	those bottles next to the queen has n't confused that fork .
the bank in front of the boys does n't hold those ladies .	the bank in front of the boys do n't hold those ladies .
that mirror behind the guys does hear this plate .	that mirror behind the guys do hear this plate .
these dolls behind the dentist do n't yell .	these dolls behind the dentist does n't yell .
that school behind the boys was keeping this teacher .	that school behind the boys were keeping this teacher .
this bag next to the teachers was n't lying .	this bag next to the teachers were n't lying .
those rooms by the person were n't lying .	those rooms by the person was n't lying .
the toys by the driver have n't painted .	the toys by the driver has n't painted .
those bottles in front of the adult have visited these shoes .	those bottles in front of the adult has visited these shoes .
the room by the teachers has n't grown .	the room by the teachers have n't grown .
the doll in front of the ladies does n't sing .	the doll in front of the ladies do n't sing .
that plate by the women is smiling .	that plate by the women are smiling .
that restaurant by the children does understand the doors .	that restaurant by the children do understand the doors .
this book in front of the women does appreciate the pictures .	this book in front of the women do appreciate the pictures .
those books behind the lady are helping that room .	those books behind the lady is helping that room .
the rings in front of the king are n't talking to the rings .	the rings in front of the king is n't talking to the rings .
that plate in front of the ladies is n't keeping this child .	that plate in front of the ladies are n't keeping this child .
this fork in front of the people has n't bought these ladies .	this fork in front of the people have n't bought these ladies .
those rooms near the lady do n't lie .	those rooms near the lady does n't lie .
those shoes near the bird do n't run .	those shoes near the bird does n't run .
these books behind the boy were n't taking that driver .	these books behind the boy was n't taking that driver .
the rooms by the girl were n't listening to the schools .	the rooms by the girl was n't listening to the schools .
the box next to the doctors is n't listening to that hospital .	the box next to the doctors are n't listening to that hospital .
the cars behind the customer do n't sell the king .	the cars behind the customer does n't sell the king .
those bowls near the teacher do n't eat .	those bowls near the teacher does n't eat .
this button in front of the birds has eaten .	this button in front of the birds have eaten .
the dolls behind the customer do exercise .	the dolls behind the customer does exercise .
those pictures near the dentist have visited the candle .	those pictures near the dentist has visited the candle .
that picture near the teachers was helping these plates .	that picture near the teachers were helping these plates .
the bowls next to the queen do n't hear those buttons .	the bowls next to the queen does n't hear those buttons .
the dishes in front of the child were bothering these rings .	the dishes in front of the child was bothering these rings .
these dishes in front of the king do talk to the rocket .	these dishes in front of the king does talk to the rocket .
the buttons near the teacher have n't run .	the buttons near the teacher has n't run .
these crayons by the dentist were laughing .	these crayons by the dentist was laughing .
the candles in front of the person were losing those guys .	the candles in front of the person was losing those guys .
the chair next to the teachers has n't confused those dishes .	the chair next to the teachers have n't confused those dishes .
