the bowls in front of the king have read .	the bowls in front of the king has read .
the shoes in front of the bird are n't running .	the shoes in front of the bird is n't running .
those glasses near the dancer were n't talking .	those glasses near the dancer was n't talking .
that hospital next to the guys does throw the man .	that hospital next to the guys do throw the man .
these chairs near the king do shake the driver .	these chairs near the king does shake the driver .
these glasses behind the queen have n't worried those rings .	these glasses behind the queen has n't worried those rings .
the shoe in front of the men has painted .	the shoe in front of the men have painted .
these windows next to the man are n't visiting the mall .	these windows next to the man is n't visiting the mall .
the ring near the guys has n't yelled .	the ring near the guys have n't yelled .
these boats behind the boy do n't bother the shoe .	these boats behind the boy does n't bother the shoe .
these dolls behind the customer have heard the glass .	these dolls behind the customer has heard the glass .
those pictures next to the boy do keep the person .	those pictures next to the boy does keep the person .
those shoes behind the dentist have n't talked to that spoon .	those shoes behind the dentist has n't talked to that spoon .
those boats by the driver do n't teach this spoon .	those boats by the driver does n't teach this spoon .
that box next to the children does appreciate these buttons .	that box next to the children do appreciate these buttons .
the bag next to the children has taught the door .	the bag next to the children have taught the door .
the car by the boys does hear the school .	the car by the boys do hear the school .
the cup in front of the guys does praise the windows .	the cup in front of the guys do praise the windows .
the dolls by the boy do n't sing .	the dolls by the boy does n't sing .
the restaurant by the boys was n't smiling .	the restaurant by the boys were n't smiling .
the beds in front of the customer are n't crying .	the beds in front of the customer is n't crying .
that ship behind the women does n't practice .	that ship behind the women do n't practice .
this car by the boys has n't won .	this car by the boys have n't won .
those trucks next to the doctor have n't taught the dishes .	those trucks next to the doctor has n't taught the dishes .
these chairs in front of the king were n't working with these cars .	these chairs in front of the king was n't working with these cars .
these boats by the boy were n't whispering .	these boats by the boy was n't whispering .
those forks behind the person do n't move the children .	those forks behind the person does n't move the children .
this book by the ladies has found these beds .	this book by the ladies have found these beds .
this school behind the women was working with those crayons .	this school behind the women were working with those crayons .
the hats behind the rabbit do n't run .	the hats behind the rabbit does n't run .
that restaurant next to the guys is n't screaming .	that restaurant next to the guys are n't screaming .
these boats behind the driver do know the chairs .	these boats behind the driver does know the chairs .
these boats near the dentist do n't laugh .	these boats near the dentist does n't laugh .
these crayons near the snake are running .	these crayons near the snake is running .
those bowls in front of the girl do help that bank .	those bowls in front of the girl does help that bank .
this toy by the women does help those spoons .	this toy by the women do help those spoons .
the doors in front of the driver were teaching that button .	the doors in front of the driver was teaching that button .
those hats by the dentist have n't eaten .	those hats by the dentist has n't eaten .
these buttons in front of the woman are painting .	these buttons in front of the woman is painting .
the hospital by the women has bothered the fork .	the hospital by the women have bothered the fork .
the rooms near the person do n't lose that customer .	the rooms near the person does n't lose that customer .
the boats behind the king do laugh .	the boats behind the king does laugh .
the boats behind the dentist do smile .	the boats behind the dentist does smile .
that car behind the people has made the boy .	that car behind the people have made the boy .
the rooms in front of the boy were teaching this couch .	the rooms in front of the boy was teaching this couch .
those cars next to the doctor do n't know the shoe .	those cars next to the doctor does n't know the shoe .
that shoe behind the girls does n't bother the toys .	that shoe behind the girls do n't bother the toys .
these toys in front of the person have n't eaten .	these toys in front of the person has n't eaten .
that mall by the snakes has n't run .	that mall by the snakes have n't run .
these books in front of the girl were n't singing .	these books in front of the girl was n't singing .
the windows near the driver were crying .	the windows near the driver was crying .
that cup near the ladies does n't scream .	that cup near the ladies do n't scream .
the beds in front of the teacher do n't sneeze .	the beds in front of the teacher does n't sneeze .
those boxes in front of the child do n't lose .	those boxes in front of the child does n't lose .
those windows behind the dancer have n't helped this doll .	those windows behind the dancer has n't helped this doll .
that candle next to the doctors has helped this picture .	that candle next to the doctors have helped this picture .
this bowl behind the women is n't bringing this man .	this bowl behind the women are n't bringing this man .
that candle near the boys is whispering .	that candle near the boys are whispering .
the mirror by the boys does help that hat .	the mirror by the boys do help that hat .
those buttons by the teacher were talking to the bowl .	those buttons by the teacher was talking to the bowl .
the doors next to the queen are waving .	the doors next to the queen is waving .
the museum by the people does n't stretch .	the museum by the people do n't stretch .
the books in front of the dentist were n't laughing .	the books in front of the dentist was n't laughing .
the bags next to the king do answer the forks .	the bags next to the king does answer the forks .
these cups next to the doctor are talking to the library .	these cups next to the doctor is talking to the library .
the pictures by the dancer do run .	the pictures by the dancer does run .
the mirror in front of the people does stretch .	the mirror in front of the people do stretch .
that car near the people has taken this dentist .	that car near the people have taken this dentist .
this shirt in front of the guys was fixing these people .	this shirt in front of the guys were fixing these people .
the boats near the girl do n't laugh .	the boats near the girl does n't laugh .
the books near the woman do n't help the candles .	the books near the woman does n't help the candles .
this ring next to the children is n't talking to the truck .	this ring next to the children are n't talking to the truck .
those dolls in front of the teacher were running .	those dolls in front of the teacher was running .
those schools near the person do n't lift this patient .	those schools near the person does n't lift this patient .
the ship in front of the teachers does talk .	the ship in front of the teachers do talk .
these forks by the man do n't paint .	these forks by the man does n't paint .
that box in front of the girls has n't talked to that boat .	that box in front of the girls have n't talked to that boat .
this museum behind the children does grow .	this museum behind the children do grow .
those forks behind the patient do appreciate the fork .	those forks behind the patient does appreciate the fork .
the shirts behind the boy do cough .	the shirts behind the boy does cough .
this plane behind the ladies does n't sneeze .	this plane behind the ladies do n't sneeze .
that shoe near the children does n't help this boat .	that shoe near the children do n't help this boat .
this shirt behind the ladies does find these people .	this shirt behind the ladies do find these people .
these chairs near the patient were learning .	these chairs near the patient was learning .
those dishes behind the man do smile .	those dishes behind the man does smile .
this rug in front of the doctors does n't find these children .	this rug in front of the doctors do n't find these children .
those boxes next to the guy are n't reading .	those boxes next to the guy is n't reading .
that box behind the girls is n't teaching the dish .	that box behind the girls are n't teaching the dish .
this chair in front of the cats does n't run .	this chair in front of the cats do n't run .
those trucks near the woman have read .	those trucks near the woman has read .
these shoes near the dancer do steal these guys .	these shoes near the dancer does steal these guys .
these spoons near the girl were crying .	these spoons near the girl was crying .
these beds next to the dancer have n't lost .	these beds next to the dancer has n't lost .
these windows in front of the patient are finding the children .	these windows in front of the patient is finding the children .
those books next to the person were cleaning this queen .	those books next to the person was cleaning this queen .
the dishes behind the driver have read .	the dishes behind the driver has read .
this library next to the children does lose .	this library next to the children do lose .
that mirror behind the children does n't find this dentist .	that mirror behind the children do n't find this dentist .
these buttons next to the king have n't moved these ladies .	these buttons next to the king has n't moved these ladies .
that museum by the people does n't lose those children .	that museum by the people do n't lose those children .
the shirts behind the patient were n't helping those glasses .	the shirts behind the patient was n't helping those glasses .
that museum near the people was taking this king .	that museum near the people were taking this king .
the cup in front of the boys is n't bringing the children .	the cup in front of the boys are n't bringing the children .
the dish near the boys does n't understand the museum .	the dish near the boys do n't understand the museum .
those bags next to the driver do know the picture .	those bags next to the driver does know the picture .
those rooms in front of the child are working with that plate .	those rooms in front of the child is working with that plate .
those chairs in front of the person were n't buying that teacher .	those chairs in front of the person was n't buying that teacher .
those cars by the customer do n't cry .	those cars by the customer does n't cry .
the door behind the girls has thrown those girls .	the door behind the girls have thrown those girls .
these cars by the dentist do have that king .	these cars by the dentist does have that king .
those doors by the doctor are n't holding that dentist .	those doors by the doctor is n't holding that dentist .
the museum behind the people has scared those cars .	the museum behind the people have scared those cars .
those cups in front of the snake have run .	those cups in front of the snake has run .
that mall behind the cats has n't grown .	that mall behind the cats have n't grown .
this doll behind the girls does n't sell those people .	this doll behind the girls do n't sell those people .
these buttons behind the child do smile .	these buttons behind the child does smile .
these rooms behind the person have n't visited this hat .	these rooms behind the person has n't visited this hat .
the books next to the teacher are n't buying these boys .	the books next to the teacher is n't buying these boys .
these bottles near the woman were losing this guy .	these bottles near the woman was losing this guy .
the bowl next to the ladies has worked with this candle .	the bowl next to the ladies have worked with this candle .
these windows near the teacher have n't yelled .	these windows near the teacher has n't yelled .
those plates by the woman do have the boys .	those plates by the woman does have the boys .
those shirts next to the dancer have n't talked .	those shirts next to the dancer has n't talked .
the hats behind the doctor were n't throwing the woman .	the hats behind the doctor was n't throwing the woman .
these schools in front of the dog have n't eaten .	these schools in front of the dog has n't eaten .
those schools behind the driver have n't visited those hats .	those schools behind the driver has n't visited those hats .
that kitchen in front of the men was helping that boat .	that kitchen in front of the men were helping that boat .
those boxes next to the person have lost .	those boxes next to the person has lost .
those boats behind the boy do talk to that boat .	those boats behind the boy does talk to that boat .
this rug by the girls does n't care for this candle .	this rug by the girls do n't care for this candle .
that mall behind the women does n't practice .	that mall behind the women do n't practice .
this spoon behind the guys does n't fix the people .	this spoon behind the guys do n't fix the people .
that car in front of the girls has n't worked with that museum .	that car in front of the girls have n't worked with that museum .
the crayons behind the child do n't lose .	the crayons behind the child does n't lose .
those candles in front of the king are n't eating .	those candles in front of the king is n't eating .
these candles in front of the guy have taught that candle .	these candles in front of the guy has taught that candle .
the boat near the guys has won .	the boat near the guys have won .
that school next to the turtles does grow .	that school next to the turtles do grow .
these boats near the king do help these dolls .	these boats near the king does help these dolls .
this mall by the men does n't listen to the kitchen .	this mall by the men do n't listen to the kitchen .
these trucks near the girl have n't thrown the girls .	these trucks near the girl has n't thrown the girls .
the fork by the men is n't losing those girls .	the fork by the men are n't losing those girls .
those books behind the boy do scream .	those books behind the boy does scream .
the car next to the ladies was n't listening to the bank .	the car next to the ladies were n't listening to the bank .
these bowls by the girl do worry this shoe .	these bowls by the girl does worry this shoe .
those cars next to the customer have n't grown .	those cars next to the customer has n't grown .
the bags near the cat are eating .	the bags near the cat is eating .
these beds by the adult do scare those rings .	these beds by the adult does scare those rings .
the museum next to the rabbits does learn .	the museum next to the rabbits do learn .
those crayons in front of the guy are n't working with these doors .	those crayons in front of the guy is n't working with these doors .
this box near the ladies does n't win .	this box near the ladies do n't win .
these plates by the dentist were n't buying the king .	these plates by the dentist was n't buying the king .
these chairs next to the dancer do lose .	these chairs next to the dancer does lose .
that button in front of the teachers was n't losing .	that button in front of the teachers were n't losing .
the chair in front of the girls does n't care for that museum .	the chair in front of the girls do n't care for that museum .
this book in front of the boys does n't work with the truck .	this book in front of the boys do n't work with the truck .
these boxes next to the teacher have n't yelled .	these boxes next to the teacher has n't yelled .
these crayons in front of the queen are talking to the bowls .	these crayons in front of the queen is talking to the bowls .
those beds in front of the girl have n't fixed the child .	those beds in front of the girl has n't fixed the child .
the school by the people has painted .	the school by the people have painted .
those cars in front of the adult do praise those forks .	those cars in front of the adult does praise those forks .
this ship by the ladies does visit this plate .	this ship by the ladies do visit this plate .
that car by the boys is waving .	that car by the boys are waving .
the cars by the dentist were n't bringing the dentist .	the cars by the dentist was n't bringing the dentist .
those buttons in front of the boy were n't listening to the windows .	those buttons in front of the boy was n't listening to the windows .
that rocket near the men has n't made the doctor .	that rocket near the men have n't made the doctor .
that chair in front of the teachers does cry .	that chair in front of the teachers do cry .
the doll in front of the horses does learn .	the doll in front of the horses do learn .
the crayon behind the children is crying .	the crayon behind the children are crying .
that toy next to the teachers has learned .	that toy next to the teachers have learned .
that toy behind the girls does n't bother this plate .	that toy behind the girls do n't bother this plate .
the cups by the person have read .	the cups by the person has read .
these doors near the doctor were n't buying these people .	these doors near the doctor was n't buying these people .
those dolls in front of the teacher do understand the picture .	those dolls in front of the teacher does understand the picture .
this bowl by the ladies does help the toy .	this bowl by the ladies do help the toy .
this button near the women was n't talking .	this button near the women were n't talking .
that shirt next to the teachers has worked with these cars .	that shirt next to the teachers have worked with these cars .
this candle next to the girls has n't worried those bags .	this candle next to the girls have n't worried those bags .
the dish next to the guys was n't listening to the door .	the dish next to the guys were n't listening to the door .
this book near the children was n't making the adult .	this book near the children were n't making the adult .
this park near the guys is learning .	this park near the guys are learning .
these shoes near the dancer were n't buying those guys .	these shoes near the dancer was n't buying those guys .
the glasses next to the doctor were n't cleaning the child .	the glasses next to the doctor was n't cleaning the child .
those boats in front of the adult were n't talking to this restaurant .	those boats in front of the adult was n't talking to this restaurant .
those plates in front of the dentist do n't know these beds .	those plates in front of the dentist does n't know these beds .
those rings next to the driver were bringing the ladies .	those rings next to the driver was bringing the ladies .
the truck behind the doctors has n't thrown the doctors .	the truck behind the doctors have n't thrown the doctors .
that hospital next to the women does read .	that hospital next to the women do read .
this school next to the ladies does read .	this school next to the ladies do read .
these bottles next to the mouse are learning .	these bottles next to the mouse is learning .
the dish behind the girls has yelled .	the dish behind the girls have yelled .
these shirts by the dancer were waving .	these shirts by the dancer was waving .
that rocket by the teachers has n't lost .	that rocket by the teachers have n't lost .
the spoon next to the girls does n't keep the women .	the spoon next to the girls do n't keep the women .
the books in front of the adult have bothered this bicycle .	the books in front of the adult has bothered this bicycle .
the shoe near the men is buying these women .	the shoe near the men are buying these women .
the window behind the birds is n't eating .	the window behind the birds are n't eating .
those rings next to the driver do n't praise this book .	those rings next to the driver does n't praise this book .
this ring near the ladies does lose .	this ring near the ladies do lose .
the rings next to the dancer do worry the bed .	the rings next to the dancer does worry the bed .
that boat next to the ladies does n't laugh .	that boat next to the ladies do n't laugh .
the candles near the man do care for those cups .	the candles near the man does care for those cups .
that spoon in front of the boys does appreciate that book .	that spoon in front of the boys do appreciate that book .
those spoons next to the guy do n't hear those windows .	those spoons next to the guy does n't hear those windows .
that window by the children was n't keeping the children .	that window by the children were n't keeping the children .
the candles in front of the adult are yelling .	the candles in front of the adult is yelling .
those bottles by the turtle do n't eat .	those bottles by the turtle does n't eat .
these pictures next to the king are listening to the hat .	these pictures next to the king is listening to the hat .
that bottle by the dogs has n't run .	that bottle by the dogs have n't run .
these cars behind the woman have n't lost these doors .	these cars behind the woman has n't lost these doors .
that bowl by the guys is n't keeping the people .	that bowl by the guys are n't keeping the people .
these schools next to the lady were finding that dancer .	these schools next to the lady was finding that dancer .
the windows by the doctor were n't listening to the bag .	the windows by the doctor was n't listening to the bag .
that book by the teachers does stretch .	that book by the teachers do stretch .
this school behind the women does move this customer .	this school behind the women do move this customer .
the dishes in front of the man have n't confused these rooms .	the dishes in front of the man has n't confused these rooms .
these rooms in front of the person do win .	these rooms in front of the person does win .
these pictures behind the person are n't fixing this girl .	these pictures behind the person is n't fixing this girl .
the spoon by the women has cried .	the spoon by the women have cried .
the museum by the dogs was growing .	the museum by the dogs were growing .
the toys by the person are n't growing .	the toys by the person is n't growing .
these buttons by the queen do n't praise the mirror .	these buttons by the queen does n't praise the mirror .
the shirts by the teacher are n't bothering those cups .	the shirts by the teacher is n't bothering those cups .
those cars by the king are smiling .	those cars by the king is smiling .
these cars behind the guy do sell this patient .	these cars behind the guy does sell this patient .
those toys by the lady do n't praise the books .	those toys by the lady does n't praise the books .
those beds next to the patient are listening to the crayons .	those beds next to the patient is listening to the crayons .
that crayon near the guys has painted .	that crayon near the guys have painted .
that park behind the ladies was n't keeping the dancer .	that park behind the ladies were n't keeping the dancer .
that book behind the doctors does hear those trucks .	that book behind the doctors do hear those trucks .
this spoon by the teachers is n't throwing the guys .	this spoon by the teachers are n't throwing the guys .
those buttons in front of the dancer are bringing the driver .	those buttons in front of the dancer is bringing the driver .
that shoe behind the children does n't steal that teacher .	that shoe behind the children do n't steal that teacher .
those spoons near the man do cough .	those spoons near the man does cough .
the cars near the queen have n't cried .	the cars near the queen has n't cried .
the boxes by the person are n't lying .	the boxes by the person is n't lying .
the dolls by the doctor have found these books .	the dolls by the doctor has found these books .
those dolls behind the customer do n't bother this button .	those dolls behind the customer does n't bother this button .
the pictures in front of the customer were visiting the crayons .	the pictures in front of the customer was visiting the crayons .
that dish next to the doctors has n't lost .	that dish next to the doctors have n't lost .
this couch by the doctors is making these doctors .	this couch by the doctors are making these doctors .
these schools by the lady do n't grow .	these schools by the lady does n't grow .
the picture behind the people has brought the adult .	the picture behind the people have brought the adult .
these buttons near the man do n't answer these dolls .	these buttons near the man does n't answer these dolls .
this museum behind the people does work with the glasses .	this museum behind the people do work with the glasses .
those chairs in front of the child do n't lose this driver .	those chairs in front of the child does n't lose this driver .
this window by the people does n't bother the plates .	this window by the people do n't bother the plates .
these cars in front of the queen do find these teachers .	these cars in front of the queen does find these teachers .
those crayons next to the mouse have n't grown .	those crayons next to the mouse has n't grown .
these cups behind the queen are n't eating .	these cups behind the queen is n't eating .
the spoons behind the doctor were cleaning this customer .	the spoons behind the doctor was cleaning this customer .
this toy behind the ladies does lose .	this toy behind the ladies do lose .
these bowls behind the king have cleaned that person .	these bowls behind the king has cleaned that person .
the doors in front of the patient do n't scare these cars .	the doors in front of the patient does n't scare these cars .
this mirror by the people does n't listen to this ship .	this mirror by the people do n't listen to this ship .
