those trucks by the person were n't laughing .	those trucks by the person was n't laughing .
the button next to the people has taught that room .	the button next to the people have taught that room .
the plates near the teacher were n't moving that king .	the plates near the teacher was n't moving that king .
the bowls behind the adult have n't answered that school .	the bowls behind the adult has n't answered that school .
the bags near the queen do understand the kitchen .	the bags near the queen does understand the kitchen .
the dishes behind the driver are talking to this rug .	the dishes behind the driver is talking to this rug .
that crayon next to the guys has read .	that crayon next to the guys have read .
that bottle by the guys was n't cleaning that driver .	that bottle by the guys were n't cleaning that driver .
those forks in front of the patient have helped these dishes .	those forks in front of the patient has helped these dishes .
those books by the king do n't appreciate the park .	those books by the king does n't appreciate the park .
the ring next to the people has yelled .	the ring next to the people have yelled .
this hat next to the children does n't steal those men .	this hat next to the children do n't steal those men .
these shirts near the patient are n't keeping that girl .	these shirts near the patient is n't keeping that girl .
this crayon behind the boys does n't laugh .	this crayon behind the boys do n't laugh .
these rings behind the child do whisper .	these rings behind the child does whisper .
the rocket next to the women is keeping the boys .	the rocket next to the women are keeping the boys .
the schools behind the child have lost this button .	the schools behind the child has lost this button .
these books behind the mouse have n't learned .	these books behind the mouse has n't learned .
those chairs near the dentist were listening to that truck .	those chairs near the dentist was listening to that truck .
those bottles behind the child were shaking those teachers .	those bottles behind the child was shaking those teachers .
those dishes by the adult do n't praise that plane .	those dishes by the adult does n't praise that plane .
this shoe behind the doctors is n't moving the men .	this shoe behind the doctors are n't moving the men .
that crayon next to the people does n't throw that man .	that crayon next to the people do n't throw that man .
the crayons next to the queen do n't throw those people .	the crayons next to the queen does n't throw those people .
these hats next to the teacher have n't cried .	these hats next to the teacher has n't cried .
the chair next to the doctors is n't crying .	the chair next to the doctors are n't crying .
the doors near the person have n't grown .	the doors near the person has n't grown .
the picture behind the men does n't wave .	the picture behind the men do n't wave .
the door in front of the women does sell this queen .	the door in front of the women do sell this queen .
this plane in front of the doctors has n't thrown that adult .	this plane in front of the doctors have n't thrown that adult .
the truck in front of the guys does buy those people .	the truck in front of the guys do buy those people .
that school in front of the ladies does exercise .	that school in front of the ladies do exercise .
the ship next to the girls has made those ladies .	the ship next to the girls have made those ladies .
those schools near the dentist do n't appreciate those bags .	those schools near the dentist does n't appreciate those bags .
these buttons by the guy do n't hear this car .	these buttons by the guy does n't hear this car .
those glasses near the teacher do n't move the men .	those glasses near the teacher does n't move the men .
the hats in front of the person have n't answered those schools .	the hats in front of the person has n't answered those schools .
that book behind the men has n't read .	that book behind the men have n't read .
those pictures in front of the guy do lie .	those pictures in front of the guy does lie .
the trucks next to the dancer were visiting the glasses .	the trucks next to the dancer was visiting the glasses .
these bowls behind the adult were yelling .	these bowls behind the adult was yelling .
those trucks behind the child do laugh .	those trucks behind the child does laugh .
the shirts in front of the guy are running .	the shirts in front of the guy is running .
this button by the people was crying .	this button by the people were crying .
those dishes near the girl do n't cough .	those dishes near the girl does n't cough .
those books near the woman have run .	those books near the woman has run .
the plates behind the doctor do grow .	the plates behind the doctor does grow .
those boats near the queen do n't care for those chairs .	those boats near the queen does n't care for those chairs .
the shoes in front of the dentist have n't learned .	the shoes in front of the dentist has n't learned .
these shoes in front of the girl do laugh .	these shoes in front of the girl does laugh .
this couch behind the teachers has talked to the glass .	this couch behind the teachers have talked to the glass .
those hats by the driver are bringing the doctor .	those hats by the driver is bringing the doctor .
these plates near the patient do n't read .	these plates near the patient does n't read .
this window near the people does n't cough .	this window near the people do n't cough .
these plates by the customer were n't eating .	these plates by the customer was n't eating .
the spoon near the girls was n't yelling .	the spoon near the girls were n't yelling .
this box next to the women was n't helping this candle .	this box next to the women were n't helping this candle .
these books by the king do talk .	these books by the king does talk .
this ring next to the ladies is listening to these chairs .	this ring next to the ladies are listening to these chairs .
these bottles near the person were screaming .	these bottles near the person was screaming .
this window in front of the teachers does whisper .	this window in front of the teachers do whisper .
that door in front of the teachers is screaming .	that door in front of the teachers are screaming .
these rings near the adult have n't talked .	these rings near the adult has n't talked .
this doll near the teachers does hold that queen .	this doll near the teachers do hold that queen .
that truck in front of the children does steal the woman .	that truck in front of the children do steal the woman .
the couch in front of the teachers does sell these children .	the couch in front of the teachers do sell these children .
that box by the people is finding this girl .	that box by the people are finding this girl .
these bowls in front of the guy do n't smile .	these bowls in front of the guy does n't smile .
this bicycle next to the guys has made the queen .	this bicycle next to the guys have made the queen .
those schools next to the child have brought that adult .	those schools next to the child has brought that adult .
that shoe near the girls is n't finding the doctors .	that shoe near the girls are n't finding the doctors .
these pictures next to the woman do n't work with this bed .	these pictures next to the woman does n't work with this bed .
this hat by the teachers was n't buying that king .	this hat by the teachers were n't buying that king .
that plane near the boys does n't throw these doctors .	that plane near the boys do n't throw these doctors .
the car near the girls has confused the mall .	the car near the girls have confused the mall .
these schools by the teacher were n't finding the teachers .	these schools by the teacher was n't finding the teachers .
this plane in front of the people does sneeze .	this plane in front of the people do sneeze .
the glasses next to the teacher have worked with this car .	the glasses next to the teacher has worked with this car .
the spoons near the boy have cleaned the teacher .	the spoons near the boy has cleaned the teacher .
these shoes in front of the dentist have answered those schools .	these shoes in front of the dentist has answered those schools .
the books near the lady have painted .	the books near the lady has painted .
the beds by the turtle do n't grow .	the beds by the turtle does n't grow .
these beds in front of the dentist have n't waved .	these beds in front of the dentist has n't waved .
these schools near the queen were n't working with the ring .	these schools near the queen was n't working with the ring .
these shoes by the person do praise this couch .	these shoes by the person does praise this couch .
these schools near the person are helping the hospital .	these schools near the person is helping the hospital .
the books near the lady do paint .	the books near the lady does paint .
this window by the women does n't lift this man .	this window by the women do n't lift this man .
those cars next to the dentist are n't losing this dancer .	those cars next to the dentist is n't losing this dancer .
the box near the girls does bring the queen .	the box near the girls do bring the queen .
those plates near the child have n't lost this chair .	those plates near the child has n't lost this chair .
that spoon in front of the ladies was n't running .	that spoon in front of the ladies were n't running .
these boats near the child do n't lie .	these boats near the child does n't lie .
these schools behind the dentist were n't whispering .	these schools behind the dentist was n't whispering .
the car by the teachers is talking to that book .	the car by the teachers are talking to that book .
that book next to the dogs was n't learning .	that book next to the dogs were n't learning .
that kitchen near the boys is making that adult .	that kitchen near the boys are making that adult .
that hospital in front of the men does lose .	that hospital in front of the men do lose .
the rings next to the woman have confused these rings .	the rings next to the woman has confused these rings .
the chairs in front of the woman are crying .	the chairs in front of the woman is crying .
the windows near the man were n't losing .	the windows near the man was n't losing .
this boat in front of the ladies is n't reading .	this boat in front of the ladies are n't reading .
that shirt behind the doctors has n't helped that rug .	that shirt behind the doctors have n't helped that rug .
this button next to the boys does understand the trucks .	this button next to the boys do understand the trucks .
these chairs next to the driver were shaking that man .	these chairs next to the driver was shaking that man .
those cars next to the doctor do grow .	those cars next to the doctor does grow .
the restaurant next to the people does stretch .	the restaurant next to the people do stretch .
these trucks next to the rabbit do n't eat .	these trucks next to the rabbit does n't eat .
those doors next to the driver have n't fixed the child .	those doors next to the driver has n't fixed the child .
those schools next to the lady are n't moving the dentist .	those schools next to the lady is n't moving the dentist .
those dishes by the queen are n't lying .	those dishes by the queen is n't lying .
these shoes by the doctor have n't heard the couch .	these shoes by the doctor has n't heard the couch .
the boat next to the boys does teach the hat .	the boat next to the boys do teach the hat .
these schools near the teacher are yelling .	these schools near the teacher is yelling .
these cups near the cat have eaten .	these cups near the cat has eaten .
the beds behind the dentist do buy that lady .	the beds behind the dentist does buy that lady .
that spoon in front of the teachers does n't grow .	that spoon in front of the teachers do n't grow .
the cars next to the dancer do talk to those rings .	the cars next to the dancer does talk to those rings .
this ring behind the teachers does n't bother that museum .	this ring behind the teachers do n't bother that museum .
the kitchen next to the ladies has helped the dolls .	the kitchen next to the ladies have helped the dolls .
the crayons in front of the queen do exercise .	the crayons in front of the queen does exercise .
these spoons in front of the lady do bother this mirror .	these spoons in front of the lady does bother this mirror .
the windows by the patient have n't made that girl .	the windows by the patient has n't made that girl .
those rings behind the person do n't scare the bed .	those rings behind the person does n't scare the bed .
the bank behind the children has n't grown .	the bank behind the children have n't grown .
the doors behind the man do n't lose those doctors .	the doors behind the man does n't lose those doctors .
those plates behind the adult have n't worked with the box .	those plates behind the adult has n't worked with the box .
the car in front of the guys was visiting the fork .	the car in front of the guys were visiting the fork .
this plane next to the doctors does fix the guys .	this plane next to the doctors do fix the guys .
that car next to the girls does n't make this customer .	that car next to the girls do n't make this customer .
these bags next to the woman are n't teaching that car .	these bags next to the woman is n't teaching that car .
the boat by the doctors does n't worry this bicycle .	the boat by the doctors do n't worry this bicycle .
these crayons behind the driver do lose .	these crayons behind the driver does lose .
that picture next to the people was n't lying .	that picture next to the people were n't lying .
that book by the birds was n't growing .	that book by the birds were n't growing .
the bed in front of the doctors does n't know those dolls .	the bed in front of the doctors do n't know those dolls .
the toys next to the queen have found these schools .	the toys next to the queen has found these schools .
the bowl next to the children has n't lost .	the bowl next to the children have n't lost .
that hat near the girls does n't cough .	that hat near the girls do n't cough .
the pictures next to the customer do n't run .	the pictures next to the customer does n't run .
this couch near the ladies has n't answered these cups .	this couch near the ladies have n't answered these cups .
those crayons by the woman do n't hold these guys .	those crayons by the woman does n't hold these guys .
these forks in front of the man were dropping the children .	these forks in front of the man was dropping the children .
those books behind the adult do teach the cars .	those books behind the adult does teach the cars .
the door behind the men was n't visiting this door .	the door behind the men were n't visiting this door .
the shirts behind the guy do n't know the glass .	the shirts behind the guy does n't know the glass .
these cars in front of the lady do n't lift the child .	these cars in front of the lady does n't lift the child .
the schools next to the man have n't talked to those crayons .	the schools next to the man has n't talked to those crayons .
the books near the queen are n't singing .	the books near the queen is n't singing .
those toys near the guy have found that book .	those toys near the guy has found that book .
those spoons in front of the driver do drop those men .	those spoons in front of the driver does drop those men .
these rooms next to the man do praise that doll .	these rooms next to the man does praise that doll .
this ship next to the people has n't kept the boys .	this ship next to the people have n't kept the boys .
that doll behind the snakes does n't run .	that doll behind the snakes do n't run .
that restaurant near the guys is n't painting .	that restaurant near the guys are n't painting .
those beds near the guy were n't painting .	those beds near the guy was n't painting .
these toys in front of the boy have n't bought that doctor .	these toys in front of the boy has n't bought that doctor .
the chairs next to the queen have moved the man .	the chairs next to the queen has moved the man .
that school next to the children does clean that adult .	that school next to the children do clean that adult .
these trucks next to the driver have worked with the candles .	these trucks next to the driver has worked with the candles .
this museum near the boys is n't moving the boy .	this museum near the boys are n't moving the boy .
the shirt in front of the women does n't find this dancer .	the shirt in front of the women do n't find this dancer .
that school by the teachers does n't work with this shirt .	that school by the teachers do n't work with this shirt .
the toys next to the customer were n't learning .	the toys next to the customer was n't learning .
these cars by the rabbit have n't eaten .	these cars by the rabbit has n't eaten .
that hat next to the women has won .	that hat next to the women have won .
the bowls near the queen do n't know the book .	the bowls near the queen does n't know the book .
the bottles behind the dancer do n't know the ring .	the bottles behind the dancer does n't know the ring .
that picture behind the men is bothering the library .	that picture behind the men are bothering the library .
the spoon in front of the people has n't talked .	the spoon in front of the people have n't talked .
that library next to the guys has heard the shoes .	that library next to the guys have heard the shoes .
the forks behind the dancer have n't made the girls .	the forks behind the dancer has n't made the girls .
this bed next to the teachers is n't helping the mirror .	this bed next to the teachers are n't helping the mirror .
the trucks in front of the child do worry the mall .	the trucks in front of the child does worry the mall .
the pictures next to the teacher do visit this picture .	the pictures next to the teacher does visit this picture .
these chairs near the guy do fix those doctors .	these chairs near the guy does fix those doctors .
the chairs in front of the girl do buy that girl .	the chairs in front of the girl does buy that girl .
the book next to the rabbits does grow .	the book next to the rabbits do grow .
these glasses behind the child do n't paint .	these glasses behind the child does n't paint .
these bags next to the adult have read .	these bags next to the adult has read .
this car in front of the snakes does eat .	this car in front of the snakes do eat .
that park by the teachers has n't dropped the guys .	that park by the teachers have n't dropped the guys .
that bank behind the teachers has n't heard that box .	that bank behind the teachers have n't heard that box .
these pictures behind the doctor do steal this dentist .	these pictures behind the doctor does steal this dentist .
those books in front of the guy do n't listen to that book .	those books in front of the guy does n't listen to that book .
the boxes by the queen do n't hear these pictures .	the boxes by the queen does n't hear these pictures .
those boats by the dancer do yell .	those boats by the dancer does yell .
these shoes in front of the dancer do n't paint .	these shoes in front of the dancer does n't paint .
that hospital in front of the children was n't laughing .	that hospital in front of the children were n't laughing .
the plates near the driver do care for this box .	the plates near the driver does care for this box .
the truck behind the doctors was finding that man .	the truck behind the doctors were finding that man .
the spoons in front of the dancer do throw this king .	the spoons in front of the dancer does throw this king .
that door near the guys was n't screaming .	that door near the guys were n't screaming .
those crayons by the doctor were n't whispering .	those crayons by the doctor was n't whispering .
those schools by the doctor do paint .	those schools by the doctor does paint .
the shoes behind the driver are n't making the lady .	the shoes behind the driver is n't making the lady .
the chair behind the children is listening to the doors .	the chair behind the children are listening to the doors .
that bicycle near the guys was screaming .	that bicycle near the guys were screaming .
those windows by the patient have n't bothered these glasses .	those windows by the patient has n't bothered these glasses .
that bank in front of the doctors does laugh .	that bank in front of the doctors do laugh .
the windows in front of the customer have n't lost the teacher .	the windows in front of the customer has n't lost the teacher .
the mirror behind the children does n't talk .	the mirror behind the children do n't talk .
the car in front of the ladies was growing .	the car in front of the ladies were growing .
that doll by the people was losing .	that doll by the people were losing .
the forks next to the girl do bother the books .	the forks next to the girl does bother the books .
this spoon behind the doctors does care for the windows .	this spoon behind the doctors do care for the windows .
those buttons in front of the child have n't found the ladies .	those buttons in front of the child has n't found the ladies .
the cups behind the customer do n't eat .	the cups behind the customer does n't eat .
those hats near the man have answered the schools .	those hats near the man has answered the schools .
those cars next to the mouse have n't grown .	those cars next to the mouse has n't grown .
this fork next to the teachers does n't lose .	this fork next to the teachers do n't lose .
those windows near the king do n't teach that ring .	those windows near the king does n't teach that ring .
these rings near the boy do drop these ladies .	these rings near the boy does drop these ladies .
those spoons next to the horse were eating .	those spoons next to the horse was eating .
these forks by the guy have n't fixed this dancer .	these forks by the guy has n't fixed this dancer .
that bank in front of the men does n't talk .	that bank in front of the men do n't talk .
those bowls next to the man do make those people .	those bowls next to the man does make those people .
this button next to the doctors does n't worry that doll .	this button next to the doctors do n't worry that doll .
the forks next to the driver do talk to that library .	the forks next to the driver does talk to that library .
the glasses next to the lady do n't talk to that book .	the glasses next to the lady does n't talk to that book .
these bags behind the patient do n't hold this doctor .	these bags behind the patient does n't hold this doctor .
those bowls by the mouse have learned .	those bowls by the mouse has learned .
those cars near the boy have n't talked to those doors .	those cars near the boy has n't talked to those doors .
that hat by the men does know this fork .	that hat by the men do know this fork .
these chairs in front of the child do n't visit this park .	these chairs in front of the child does n't visit this park .
these plates behind the queen do keep those ladies .	these plates behind the queen does keep those ladies .
those crayons near the person do n't read .	those crayons near the person does n't read .
the door behind the ladies has n't talked .	the door behind the ladies have n't talked .
these schools next to the queen do yell .	these schools next to the queen does yell .
those rooms by the customer do eat .	those rooms by the customer does eat .
the schools near the dentist have n't painted .	the schools near the dentist has n't painted .
this book near the ladies does talk .	this book near the ladies do talk .
these beds by the driver have n't read .	these beds by the driver has n't read .
these shoes next to the man have n't lost that patient .	these shoes next to the man has n't lost that patient .
the trucks behind the lady do hear that box .	the trucks behind the lady does hear that box .
these buttons near the patient do understand this cup .	these buttons near the patient does understand this cup .
these forks near the child do n't bring these teachers .	these forks near the child does n't bring these teachers .
this mirror by the women has scared this boat .	this mirror by the women have scared this boat .
the rocket near the boys does lift the ladies .	the rocket near the boys do lift the ladies .
the bowls by the king do n't sing .	the bowls by the king does n't sing .
that rug in front of the guys is n't talking to those trucks .	that rug in front of the guys are n't talking to those trucks .
that rocket in front of the men is listening to the candles .	that rocket in front of the men are listening to the candles .
these shoes next to the guy do n't practice .	these shoes next to the guy does n't practice .
the bed behind the people does n't whisper .	the bed behind the people do n't whisper .
those doors behind the man do n't throw those guys .	those doors behind the man does n't throw those guys .
the park in front of the doctors does take this guy .	the park in front of the doctors do take this guy .
that door next to the men does answer this crayon .	that door next to the men do answer this crayon .
the windows behind the teacher have n't read .	the windows behind the teacher has n't read .
those dishes in front of the customer have n't read .	those dishes in front of the customer has n't read .
the box in front of the guys was n't crying .	the box in front of the guys were n't crying .
that hospital next to the children is teaching the plane .	that hospital next to the children are teaching the plane .
the candles by the child have n't bothered these bowls .	the candles by the child has n't bothered these bowls .
the buttons by the woman have yelled .	the buttons by the woman has yelled .
that room near the doctors does stretch .	that room near the doctors do stretch .
the schools behind the child have heard these beds .	the schools behind the child has heard these beds .
