those windows would see the teachers that were n't growing that heard the chair .	those windows would see what the teachers that were n't growing heard the chair .
these buttons must see these ladies who heard this school who can know the plate .	these buttons must see who these ladies who heard this school can know the plate .
this bicycle may notice those girls who yelled who have answered the pictures .	this bicycle may notice who those girls who yelled have answered the pictures .
the bags have n't known these children who wo n't cough who talk to that car .	the bags have n't known who these children who wo n't cough talk to that car .
those buttons had n't noticed the girls who should n't hear these windows who were n't teaching the toys .	those buttons had n't noticed who the girls who should n't hear these windows were n't teaching the toys .
the beds had seen these men who are singing who would n't hear that hat .	the beds had seen who these men who are singing would n't hear that hat .
the couch has noticed the children who that candle would n't know who knew the dolls .	the couch has noticed who the children who that candle would n't know knew the dolls .
the cars must see the men who throw this teacher who can n't know this school .	the cars must see who the men who throw this teacher can n't know this school .
this car had known this man who had talked who did n't fix the men .	this car had known who this man who had talked did n't fix the men .
those bowls have seen those horses that this window hears that had n't heard this school .	those bowls have seen what those horses that this window hears had n't heard this school .
this door had n't remembered the customer who shook the dentist who is n't teaching the bank .	this door had n't remembered who the customer who shook the dentist is n't teaching the bank .
the cars have noticed this dentist who was bringing this man who can listen to those pictures .	the cars have noticed who this dentist who was bringing this man can listen to those pictures .
the trucks could notice the dentist who must sell that dentist who might lift this child .	the trucks could notice who the dentist who must sell that dentist might lift this child .
the candle could n't forget the guy who sang who had kept this man .	the candle could n't forget who the guy who sang had kept this man .
this ring should n't remember those children who heard the chair who would clean the men .	this ring should n't remember who those children who heard the chair would clean the men .
those bottles can n't know that king who knows those shirts who visited that door .	those bottles can n't know who that king who knows those shirts visited that door .
this candle could forget this doctor who that park knew who has heard that car .	this candle could forget who this doctor who that park knew has heard that car .
this book had n't seen this doctor who the museum will know who lost these teachers .	this book had n't seen who this doctor who the museum will know lost these teachers .
the shirt will forget these boys who may hear these buttons who hear that ring .	the shirt will forget who these boys who may hear these buttons hear that ring .
this bag had n't noticed that doctor who knew that room who can n't hold the adult .	this bag had n't noticed who that doctor who knew that room can n't hold the adult .
these forks will notice this king that grew that should know the bags .	these forks will notice what this king that grew should know the bags .
the bed has known these teachers that are eating that knew these glasses .	the bed has known what these teachers that are eating knew these glasses .
the spoon would n't notice the dog that would know these rooms that has n't heard the cups .	the spoon would n't notice what the dog that would know these rooms has n't heard the cups .
those buttons had n't remembered the people who shook those women who have n't bothered the restaurant .	those buttons had n't remembered who the people who shook those women have n't bothered the restaurant .
the boats have remembered that dentist who has heard the plane who would n't sell the woman .	the boats have remembered who that dentist who has heard the plane would n't sell the woman .
these buttons wo n't remember that doctor who the boxes heard who knew that couch .	these buttons wo n't remember who that doctor who the boxes heard knew that couch .
this door has n't known that king who was n't whispering who understands these bottles .	this door has n't known who that king who was n't whispering understands these bottles .
this car should see this dancer who is finding this customer who heard the rug .	this car should see who this dancer who is finding this customer heard the rug .
this bag has n't seen that child who sings who kept the man .	this bag has n't seen who that child who sings kept the man .
this dish wo n't remember the children who might scream who answered this door .	this dish wo n't remember who the children who might scream answered this door .
this rocket should forget that hamster that has heard this bed that hears the rooms .	this rocket should forget what that hamster that has heard this bed hears the rooms .
those hats may forget those children who were dropping these people who can know that park .	those hats may forget who those children who were dropping these people can know that park .
the doors should remember the children who that shirt knew who were listening to that truck .	the doors should remember who the children who that shirt knew were listening to that truck .
those books have n't known that lady who is n't losing who should n't hear these cars .	those books have n't known who that lady who is n't losing should n't hear these cars .
the car has n't known the patient who does n't practice who could n't hear the shirt .	the car has n't known who the patient who does n't practice could n't hear the shirt .
the buttons do n't remember these men who that box hears who have brought that person .	the buttons do n't remember who these men who that box hears have brought that person .
these rings had n't seen the boys who these trucks might know who knew that restaurant .	these rings had n't seen who the boys who these trucks might know knew that restaurant .
the bottles have n't known the adult who this cup has n't heard who heard that button .	the bottles have n't known who the adult who this cup has n't heard heard that button .
the windows wo n't remember this doctor who had n't waved who can visit those trucks .	the windows wo n't remember who this doctor who had n't waved can visit those trucks .
that boat can n't remember those people who are n't singing who knew this bed .	that boat can n't remember who those people who are n't singing knew this bed .
the books did n't notice that dancer who wo n't cry who keeps the person .	the books did n't notice who that dancer who wo n't cry keeps the person .
that book had n't noticed this doctor that has grown that had n't heard this chair .	that book had n't noticed what this doctor that has grown had n't heard this chair .
the spoon would n't remember that queen who that crayon had heard who is teaching that car .	the spoon would n't remember who that queen who that crayon had heard is teaching that car .
those toys have n't noticed the children who did n't hear those cars who lose those children .	those toys have n't noticed who the children who did n't hear those cars lose those children .
those books could notice those women who would n't lie who hear the shoe .	those books could notice who those women who would n't lie hear the shoe .
that plane would notice the girls who were taking those guys who hear that chair .	that plane would notice who the girls who were taking those guys hear that chair .
those spoons should see the guy who can n't hear that plane who must hear that ring .	those spoons should see who the guy who can n't hear that plane must hear that ring .
this doll should n't remember this mouse that might hear this box that had n't heard those doors .	this doll should n't remember what this mouse that might hear this box had n't heard those doors .
that picture could remember the women that knew that book that had heard that bottle .	that picture could remember what the women that knew that book had heard that bottle .
those bowls would n't notice the adult who knows these rooms who was n't fixing this girl .	those bowls would n't notice who the adult who knows these rooms was n't fixing this girl .
those bags will see the lady who waved who had n't worked with that book .	those bags will see who the lady who waved had n't worked with that book .
the bowl has seen this customer who those beds do n't hear who can hear that school .	the bowl has seen who this customer who those beds do n't hear can hear that school .
these trucks have noticed the guy who was n't moving this girl who has worked with this fork .	these trucks have noticed who the guy who was n't moving this girl has worked with this fork .
those boxes may forget the children who should n't know that button who would take that adult .	those boxes may forget who the children who should n't know that button would take that adult .
the truck must notice the king who is smiling who had moved these people .	the truck must notice who the king who is smiling had moved these people .
these books can n't forget this customer who talked who was n't taking this teacher .	these books can n't forget who this customer who talked was n't taking this teacher .
those spoons can n't see that king who laughed who has n't found that spoon .	those spoons can n't see who that king who laughed has n't found that spoon .
the window might notice this dancer who does n't laugh who lost this kitchen .	the window might notice who this dancer who does n't laugh lost this kitchen .
the books had n't seen that adult who heard the cups who is n't making that driver .	the books had n't seen who that adult who heard the cups is n't making that driver .
this shoe should n't see those guys who can n't hear the rocket who may care for this bicycle .	this shoe should n't see who those guys who can n't hear the rocket may care for this bicycle .
the shirt wo n't know the person who found that dancer who has heard those bags .	the shirt wo n't know who the person who found that dancer has heard those bags .
this chair can n't know these guys who were losing who made those girls .	this chair can n't know who these guys who were losing made those girls .
this book must know these children who have dropped this teacher who should n't care for these cars .	this book must know who these children who have dropped this teacher should n't care for these cars .
this ship must notice the guys that are eating that knew this toy .	this ship must notice what the guys that are eating knew this toy .
those hats have known the guy who had n't found the woman who can make that queen .	those hats have known who the guy who had n't found the woman can make that queen .
that cup has noticed that person who was n't making those ladies who would n't teach these bowls .	that cup has noticed who that person who was n't making those ladies would n't teach these bowls .
those doors had known that dentist that can n't hear this crayon that heard that dish .	those doors had known what that dentist that can n't hear this crayon heard that dish .
the dolls have n't remembered this lady who would hear that book who had heard this school .	the dolls have n't remembered who this lady who would hear that book had heard this school .
this cup has n't noticed that woman that grew that should hear the dish .	this cup has n't noticed what that woman that grew should hear the dish .
these bags had remembered the child who talked who answered the chairs .	these bags had remembered who the child who talked answered the chairs .
those books had n't known the children who are n't shaking this dentist who could work with those glasses .	those books had n't known who the children who are n't shaking this dentist could work with those glasses .
this bed has n't noticed that girl who is practicing who had n't bought the ladies .	this bed has n't noticed who that girl who is practicing had n't bought the ladies .
these spoons had n't noticed these people who practice who must understand the shoe .	these spoons had n't noticed who these people who practice must understand the shoe .
these books can see that king who had n't heard those cars who is n't making the dentist .	these books can see who that king who had n't heard those cars is n't making the dentist .
those hats had n't known this teacher who is n't crying who was visiting these cars .	those hats had n't known who this teacher who is n't crying was visiting these cars .
the shirts had n't seen that dentist who heard those rooms who brings those guys .	the shirts had n't seen who that dentist who heard those rooms brings those guys .
this mirror would notice the lady who will yell who had thrown these girls .	this mirror would notice who the lady who will yell had thrown these girls .
the car had noticed those cats that have n't eaten that know the bags .	the car had noticed what those cats that have n't eaten know the bags .
those rings wo n't remember the women who might buy that child who were n't losing that teacher .	those rings wo n't remember who the women who might buy that child were n't losing that teacher .
this ring had seen those doctors who made this customer who drop the queen .	this ring had seen who those doctors who made this customer drop the queen .
this chair had noticed those teachers who lost who help that bicycle .	this chair had noticed who those teachers who lost help that bicycle .
these cars must know this adult who would laugh who would n't help the dish .	these cars must know who this adult who would laugh would n't help the dish .
the plate will forget that boy who can n't lie who has worried the school .	the plate will forget who that boy who can n't lie has worried the school .
these forks had noticed the child who hears the toy who found this candle .	these forks had noticed who the child who hears the toy found this candle .
the bottles have noticed those boys who the shirt knows who had n't worked with the bank .	the bottles have noticed who those boys who the shirt knows had n't worked with the bank .
that shoe will notice the patient who those doors heard who has worried that car .	that shoe will notice who the patient who those doors heard has worried that car .
those hats can see that lady who this dish had heard who had n't bothered that truck .	those hats can see who that lady who this dish had heard had n't bothered that truck .
this chair has n't noticed those ladies who do n't have these men who should n't bring that girl .	this chair has n't noticed who those ladies who do n't have these men should n't bring that girl .
that plane might notice these guys who had brought this dancer who may visit this plate .	that plane might notice who these guys who had brought this dancer may visit this plate .
the doors can forget that child that hears the bowl that heard the bags .	the doors can forget what that child that hears the bowl heard the bags .
these toys must forget this teacher who may hear those bowls who had the doctors .	these toys must forget who this teacher who may hear those bowls had the doctors .
the windows might know these men who were n't laughing who must lift the driver .	the windows might know who these men who were n't laughing must lift the driver .
these shirts can see this teacher who cleaned the dentist who can n't know these books .	these shirts can see who this teacher who cleaned the dentist can n't know these books .
that car may remember the adult who bought that woman who threw this girl .	that car may remember who the adult who bought that woman threw this girl .
the hats had n't known this man who does n't hear the door who has heard the plates .	the hats had n't known who this man who does n't hear the door has heard the plates .
the hats wo n't know that person who could sneeze who moves this man .	the hats wo n't know who that person who could sneeze moves this man .
the dolls might forget those teachers who sing who had n't found this boy .	the dolls might forget who those teachers who sing had n't found this boy .
the window had known that boy who wo n't know this spoon who should n't praise this library .	the window had known who that boy who wo n't know this spoon should n't praise this library .
that chair has n't known the teacher who would n't keep the driver who was working with the shoe .	that chair has n't known who the teacher who would n't keep the driver was working with the shoe .
that bed may forget the turtles that ate that know the crayons .	that bed may forget what the turtles that ate know the crayons .
that cup has n't remembered the patient who would smile who had held this adult .	that cup has n't remembered who the patient who would smile had held this adult .
these shirts would see those rabbits that that mall hears that knew these dolls .	these shirts would see what those rabbits that that mall hears knew these dolls .
these buttons should remember the girls who practice who might hear that library .	these buttons should remember who the girls who practice might hear that library .
the rings have n't seen those teachers who could sneeze who had heard the box .	the rings have n't seen who those teachers who could sneeze had heard the box .
those shoes could n't see the bird that eats that knows the ship .	those shoes could n't see what the bird that eats knows the ship .
the button must see the customer who is n't losing the man who would n't worry those books .	the button must see who the customer who is n't losing the man would n't worry those books .
that crayon has seen that guy that those forks do n't hear that must hear those chairs .	that crayon has seen what that guy that those forks do n't hear must hear those chairs .
the bags should n't forget the ladies who might hear those shoes who kept the girls .	the bags should n't forget who the ladies who might hear those shoes kept the girls .
those pictures did n't know the men who brought that man who listen to the windows .	those pictures did n't know who the men who brought that man listen to the windows .
the forks must forget this dentist who has won who would n't know this rocket .	the forks must forget who this dentist who has won would n't know this rocket .
the ship wo n't notice that doctor who is n't lying who has n't made these men .	the ship wo n't notice who that doctor who is n't lying has n't made these men .
that door had noticed this child who has cried who found that spoon .	that door had noticed who this child who has cried found that spoon .
those rings would remember the queen who has kept the ladies who had heard the restaurant .	those rings would remember who the queen who has kept the ladies had heard the restaurant .
these crayons do n't know the driver who heard those spoons who hears those buttons .	these crayons do n't know who the driver who heard those spoons hears those buttons .
those doors can know the cats that knew the ship that might know the plates .	those doors can know what the cats that knew the ship might know the plates .
those dishes had n't known those women who would n't know that truck who hear the kitchen .	those dishes had n't known who those women who would n't know that truck hear the kitchen .
these forks had noticed the patient who can paint who brings the person .	these forks had noticed who the patient who can paint brings the person .
those trucks might notice these children who do n't yell who lost this chair .	those trucks might notice who these children who do n't yell lost this chair .
that shoe should n't notice the mice that are n't running that had n't heard the spoon .	that shoe should n't notice what the mice that are n't running had n't heard the spoon .
this bed would notice these guys who the spoons know who will appreciate the books .	this bed would notice who these guys who the spoons know will appreciate the books .
these glasses have n't remembered that dentist who knows the restaurant who dropped the dancer .	these glasses have n't remembered who that dentist who knows the restaurant dropped the dancer .
these rings can remember these boys who painted who were n't listening to these bowls .	these rings can remember who these boys who painted were n't listening to these bowls .
these shoes do n't notice the doctor who has n't won who understands the boats .	these shoes do n't notice who the doctor who has n't won understands the boats .
those dolls have seen the people who had cleaned the guys who have answered this car .	those dolls have seen who the people who had cleaned the guys have answered this car .
the doll had remembered the ladies who the ring knows who knew this chair .	the doll had remembered who the ladies who the ring knows knew this chair .
that rocket might forget these ladies who kept that teacher who helped that hospital .	that rocket might forget who these ladies who kept that teacher helped that hospital .
that truck must see the girl who did n't hear the books who had held that lady .	that truck must see who the girl who did n't hear the books had held that lady .
the candles have remembered the driver who these books heard who works with the bowl .	the candles have remembered who the driver who these books heard works with the bowl .
those trucks can know this adult that heard this rug that must hear this museum .	those trucks can know what this adult that heard this rug must hear this museum .
the truck could know the queen that could hear this doll that hears the book .	the truck could know what the queen that could hear this doll hears the book .
those pictures have remembered these boys who should sing who have n't worried this plate .	those pictures have remembered who these boys who should sing have n't worried this plate .
the spoons have known this guy who knew that plane who found the park .	the spoons have known who this guy who knew that plane found the park .
the picture has n't remembered the men who have n't heard the fork who should n't fix that customer .	the picture has n't remembered who the men who have n't heard the fork should n't fix that customer .
this cup has remembered those women who exercise who can know the picture .	this cup has remembered who those women who exercise can know the picture .
these bags did n't know these guys who would exercise who care for this crayon .	these bags did n't know who these guys who would exercise care for this crayon .
the book had n't seen these dogs that run that heard those rings .	the book had n't seen what these dogs that run heard those rings .
those dolls have noticed those women who this button has heard who are n't moving these boys .	those dolls have noticed who those women who this button has heard are n't moving these boys .
the toy has n't seen the doctors who that toy can n't hear who answer the rug .	the toy has n't seen who the doctors who that toy can n't hear answer the rug .
that truck should n't forget the guys that were n't learning that hear these dolls .	that truck should n't forget what the guys that were n't learning hear these dolls .
this rug can n't know these men who had n't heard the box who understand that shirt .	this rug can n't know who these men who had n't heard the box understand that shirt .
these glasses can see the children who the plates heard who had n't heard those rooms .	these glasses can see who the children who the plates heard had n't heard those rooms .
these windows would remember that woman who knew this book who keeps these boys .	these windows would remember who that woman who knew this book keeps these boys .
this door had known these ladies who have brought the boy who are helping this restaurant .	this door had known who these ladies who have brought the boy are helping this restaurant .
the button could remember those guys who are bringing the customer who lift this adult .	the button could remember who those guys who are bringing the customer lift this adult .
the box could forget that person who would lift this dentist who throws those women .	the box could forget who that person who would lift this dentist throws those women .
those bottles had remembered that lady who the toys knew who takes that dancer .	those bottles had remembered who that lady who the toys knew takes that dancer .
those beds would n't notice that patient who knows the hospital who has heard these schools .	those beds would n't notice who that patient who knows the hospital has heard these schools .
those books did n't know this customer who talked who knew the cars .	those books did n't know who this customer who talked knew the cars .
the bottles had n't known these ladies who yell who move this dentist .	the bottles had n't known who these ladies who yell move this dentist .
this picture has n't remembered this person who was n't talking who is dropping this teacher .	this picture has n't remembered who this person who was n't talking is dropping this teacher .
that button has n't known the lady who knew the ship who scared that plane .	that button has n't known who the lady who knew the ship scared that plane .
this spoon had n't remembered the snake that could n't run that must know these bags .	this spoon had n't remembered what the snake that could n't run must know these bags .
that door has n't known this lady who does n't bring this patient who has heard these books .	that door has n't known who this lady who does n't bring this patient has heard these books .
