these plates have seen the men who this bag knows who must praise that button .	these plates have seen who the men who this bag knows must praise that button .
that truck could know the king who the restaurant had heard who brings the women .	that truck could know who the king who the restaurant had heard brings the women .
the boat could n't remember those men that should know that fork that heard this book .	the boat could n't remember what those men that should know that fork heard this book .
that picture could n't know that teacher who is losing who could n't bother this ring .	that picture could n't know who that teacher who is losing could n't bother this ring .
those boats do n't know the boys who were n't finding that king who are keeping the teacher .	those boats do n't know who the boys who were n't finding that king are keeping the teacher .
that rug might remember the doctor who must move these men who was shaking the children .	that rug might remember who the doctor who must move these men was shaking the children .
the toy has n't known this man who wo n't lift these teachers who moves this guy .	the toy has n't known who this man who wo n't lift these teachers moves this guy .
these forks have n't remembered the man who cried who heard that dish .	these forks have n't remembered who the man who cried heard that dish .
the books should n't forget these guys who this box should n't hear who stole this king .	the books should n't forget who these guys who this box should n't hear stole this king .
those pictures might notice these children who lost the girls who can understand the car .	those pictures might notice who these children who lost the girls can understand the car .
these spoons had n't known that lady who might laugh who has heard those rooms .	these spoons had n't known who that lady who might laugh has heard those rooms .
that door will notice the dancer who has fixed those children who hears the picture .	that door will notice who the dancer who has fixed those children hears the picture .
these spoons have known the boys who are n't screaming who had n't moved the men .	these spoons have known who the boys who are n't screaming had n't moved the men .
that shirt could n't notice this king who could n't hold the boys who is talking to these chairs .	that shirt could n't notice who this king who could n't hold the boys is talking to these chairs .
the rocket did n't notice those teachers who were losing who are buying those boys .	the rocket did n't notice who those teachers who were losing are buying those boys .
this car has known this queen who cries who should find this guy .	this car has known who this queen who cries should find this guy .
the window may know these people that had n't run that hear that school .	the window may know what these people that had n't run hear that school .
that dish has n't noticed the adult who has n't heard the mirror who would know that room .	that dish has n't noticed who the adult who has n't heard the mirror would know that room .
this car has n't seen these doctors who were n't lying who found that chair .	this car has n't seen who these doctors who were n't lying found that chair .
that dish would remember the adult who should hold those men who did n't visit that window .	that dish would remember who the adult who should hold those men did n't visit that window .
these trucks have n't noticed the king who that mirror should hear who worried this rug .	these trucks have n't noticed who the king who that mirror should hear worried this rug .
these plates would n't forget those doctors who are n't screaming who work with the school .	these plates would n't forget who those doctors who are n't screaming work with the school .
these buttons would forget that king who has n't brought this lady who knew those shirts .	these buttons would forget who that king who has n't brought this lady knew those shirts .
the ship has known these women that knew the forks that know the ring .	the ship has known what these women that knew the forks know the ring .
that window could n't remember that lady that those forks hear that does n't hear the dolls .	that window could n't remember what that lady that those forks hear does n't hear the dolls .
the bottles had noticed the guy who could n't wave who must worry that box .	the bottles had noticed who the guy who could n't wave must worry that box .
this bed should notice that hamster that would grow that heard the pictures .	this bed should notice what that hamster that would grow heard the pictures .
the candles do n't know these teachers who would n't cough who were dropping that man .	the candles do n't know who these teachers who would n't cough were dropping that man .
the mirror had n't seen that girl who brings those ladies who does n't help the book .	the mirror had n't seen who that girl who brings those ladies does n't help the book .
this picture has noticed this adult who would n't move this patient who found that bicycle .	this picture has noticed who this adult who would n't move this patient found that bicycle .
this dish has n't seen that adult who knew this boat who hears that bicycle .	this dish has n't seen who that adult who knew this boat hears that bicycle .
the rocket has seen those women that this rug knows that hear that plane .	the rocket has seen what those women that this rug knows hear that plane .
this hat should see these guys who hear the restaurant who knew that door .	this hat should see who these guys who hear the restaurant knew that door .
the cups did n't notice the child who that bicycle hears who will shake those men .	the cups did n't notice who the child who that bicycle hears will shake those men .
those bottles have noticed this adult who cried who would n't shake the doctor .	those bottles have noticed who this adult who cried would n't shake the doctor .
that picture wo n't forget the teachers who win who heard this hat .	that picture wo n't forget who the teachers who win heard this hat .
the ring had n't known the patient who did n't shake that teacher who has n't heard those doors .	the ring had n't known who the patient who did n't shake that teacher has n't heard those doors .
the candles can notice that woman who will wave who bought the customer .	the candles can notice who that woman who will wave bought the customer .
these bottles have n't seen the people who have taken those boys who were n't making this dancer .	these bottles have n't seen who the people who have taken those boys were n't making this dancer .
the hats had known that lady who has cried who did n't buy this dentist .	the hats had known who that lady who has cried did n't buy this dentist .
this picture should see the king who heard the crayon who should scare the bowls .	this picture should see who the king who heard the crayon should scare the bowls .
the chairs can n't forget those ladies that grew that hear the crayon .	the chairs can n't forget what those ladies that grew hear the crayon .
the boat should see the customer who waved who had n't heard those plates .	the boat should see who the customer who waved had n't heard those plates .
that chair has seen that person who paints who understands the cars .	that chair has seen who that person who paints understands the cars .
the trucks can see the child who dropped the driver who was buying the man .	the trucks can see who the child who dropped the driver was buying the man .
those shoes might remember this woman who this fork knew who found the women .	those shoes might remember who this woman who this fork knew found the women .
this plane might see that bird that knew these bottles that should n't hear that bottle .	this plane might see what that bird that knew these bottles should n't hear that bottle .
this spoon can know this king who was n't lying who could visit the bags .	this spoon can know who this king who was n't lying could visit the bags .
those shoes had remembered that person who that hat has n't heard who did n't work with those boxes .	those shoes had remembered who that person who that hat has n't heard did n't work with those boxes .
these boxes could n't know this customer who could lose who should fix those doctors .	these boxes could n't know who this customer who could lose should fix those doctors .
those forks did n't notice those children who dropped the children who confused this button .	those forks did n't notice who those children who dropped the children confused this button .
this cup has n't remembered that adult who would n't keep these teachers who would n't know those chairs .	this cup has n't remembered who that adult who would n't keep these teachers would n't know those chairs .
that rug had known that girl who knew the library who should n't hear this candle .	that rug had known who that girl who knew the library should n't hear this candle .
the trucks had n't seen that girl who brought the child who lost those girls .	the trucks had n't seen who that girl who brought the child lost those girls .
the shoes did n't remember this man who moved that man who wo n't praise that car .	the shoes did n't remember who this man who moved that man wo n't praise that car .
the boxes have remembered the doctors who hear that plane who knew that ring .	the boxes have remembered who the doctors who hear that plane knew that ring .
the spoon might forget this dentist who knew those rooms who has heard that cup .	the spoon might forget who this dentist who knew those rooms has heard that cup .
that plate will notice this customer who knew the school who worried the shoes .	that plate will notice who this customer who knew the school worried the shoes .
that truck may notice this king that runs that hears that rocket .	that truck may notice what this king that runs hears that rocket .
those cars had remembered these people who would sing who are bringing the dancer .	those cars had remembered who these people who would sing are bringing the dancer .
the truck wo n't notice the child that knew this chair that must hear these shirts .	the truck wo n't notice what the child that knew this chair must hear these shirts .
those glasses could forget these doctors who lost those teachers who hear these dolls .	those glasses could forget who these doctors who lost those teachers hear these dolls .
that couch should n't know that lady who is n't taking this doctor who can praise the schools .	that couch should n't know who that lady who is n't taking this doctor can praise the schools .
the doors had n't noticed the king who reads who threw that customer .	the doors had n't noticed who the king who reads threw that customer .
the picture can n't notice that patient who has talked who could know this book .	the picture can n't notice who that patient who has talked could know this book .
the books had n't remembered this dancer who was shaking that man who should bring the boy .	the books had n't remembered who this dancer who was shaking that man should bring the boy .
those bags could n't remember the men who the fork had n't heard who are n't buying the driver .	those bags could n't remember who the men who the fork had n't heard are n't buying the driver .
these toys must notice those children that this mall heard that knew the window .	these toys must notice what those children that this mall heard knew the window .
those dishes might forget this boy who these shirts heard who might answer this rocket .	those dishes might forget who this boy who these shirts heard might answer this rocket .
those books had remembered this dentist who the spoons hear who knows the schools .	those books had remembered who this dentist who the spoons hear knows the schools .
this book had seen those cats that grew that knew the museum .	this book had seen what those cats that grew knew the museum .
this button has n't seen this driver who had n't yelled who would n't hold this king .	this button has n't seen who this driver who had n't yelled would n't hold this king .
that bag can n't forget the children who those books had heard who must sell that dentist .	that bag can n't forget who the children who those books had heard must sell that dentist .
the pictures may remember those children that this cup may hear that heard the book .	the pictures may remember what those children that this cup may hear heard the book .
those glasses might forget the children who have n't heard that fork who heard these plates .	those glasses might forget who the children who have n't heard that fork heard these plates .
this truck has remembered that doctor who could n't lift that man who is listening to the forks .	this truck has remembered who that doctor who could n't lift that man is listening to the forks .
this boat had n't remembered this child who has n't fixed those guys who will steal that person .	this boat had n't remembered who this child who has n't fixed those guys will steal that person .
these shoes should see these girls who paint who bothered the car .	these shoes should see who these girls who paint bothered the car .
this picture has noticed that driver who was n't moving the men who bothered this button .	this picture has noticed who that driver who was n't moving the men bothered this button .
that door has n't noticed these ladies who knew the shoe who should work with that shirt .	that door has n't noticed who these ladies who knew the shoe should work with that shirt .
that plate had known this doctor who might read who is working with the mirror .	that plate had known who this doctor who might read is working with the mirror .
those bowls had n't known these guys who hold this lady who might worry this hat .	those bowls had n't known who these guys who hold this lady might worry this hat .
that window has remembered that dentist who hears the candle who had heard this truck .	that window has remembered who that dentist who hears the candle had heard this truck .
the rings had n't known those boys who this cup knew who lose the dancer .	the rings had n't known who those boys who this cup knew lose the dancer .
this fork had n't known that driver who has yelled who will sell that dentist .	this fork had n't known who that driver who has yelled will sell that dentist .
the boat has n't remembered the child who those schools heard who would n't teach these windows .	the boat has n't remembered who the child who those schools heard would n't teach these windows .
that bottle had n't seen that woman who cried who talked to these dishes .	that bottle had n't seen who that woman who cried talked to these dishes .
that crayon had n't known that man who has n't heard that toy who had heard that ring .	that crayon had n't known who that man who has n't heard that toy had heard that ring .
those glasses can n't notice those women who are dropping the girl who moved that man .	those glasses can n't notice who those women who are dropping the girl moved that man .
those dolls have seen the man who those bottles had heard who has brought these ladies .	those dolls have seen who the man who those bottles had heard has brought these ladies .
the boats would n't notice this doctor who knows that spoon who must clean the dancer .	the boats would n't notice who this doctor who knows that spoon must clean the dancer .
the candles had n't remembered this child that the rooms know that has n't heard that shoe .	the candles had n't remembered what this child that the rooms know has n't heard that shoe .
those pictures may remember these teachers who cough who should work with the bed .	those pictures may remember who these teachers who cough should work with the bed .
that bowl has noticed the women who heard that box who answer this book .	that bowl has noticed who the women who heard that box answer this book .
that fork has n't remembered this teacher who sang who makes the lady .	that fork has n't remembered who this teacher who sang makes the lady .
that book did n't forget these boys who heard those shoes who had n't scared those bottles .	that book did n't forget who these boys who heard those shoes had n't scared those bottles .
these toys must remember those doctors that would grow that have n't heard this fork .	these toys must remember what those doctors that would grow have n't heard this fork .
the book can notice this man who painted who has brought this queen .	the book can notice who this man who painted has brought this queen .
those shirts could n't notice this driver who the schools can n't know who may hear this book .	those shirts could n't notice who this driver who the schools can n't know may hear this book .
those boats have remembered the guys who waved who know this room .	those boats have remembered who the guys who waved know this room .
the books can see that doctor who was n't painting who can buy those boys .	the books can see who that doctor who was n't painting can buy those boys .
these beds have n't seen that dancer who knows this bed who heard that school .	these beds have n't seen who that dancer who knows this bed heard that school .
that glass should n't know these people who have n't heard that bottle who keep those men .	that glass should n't know who these people who have n't heard that bottle keep those men .
the books have n't seen the dancer who can win who fixed the men .	the books have n't seen who the dancer who can win fixed the men .
that car did n't remember the person who keeps the teacher who heard these shoes .	that car did n't remember who the person who keeps the teacher heard these shoes .
this picture wo n't remember these people who throw that woman who knew the hospital .	this picture wo n't remember who these people who throw that woman knew the hospital .
the forks would n't forget those people who have n't found these girls who helped those bags .	the forks would n't forget who those people who have n't found these girls helped those bags .
this ship would remember these boys who keep the woman who had heard the glasses .	this ship would remember who these boys who keep the woman had heard the glasses .
these buttons have n't seen the customer that had n't eaten that wo n't know this dish .	these buttons have n't seen what the customer that had n't eaten wo n't know this dish .
the books have n't seen these children who won who have kept the doctor .	the books have n't seen who these children who won have kept the doctor .
that doll will remember the doctor who that book hears who helps the candle .	that doll will remember who the doctor who that book hears helps the candle .
these candles do n't remember these children who hear these buttons who shook those children .	these candles do n't remember who these children who hear these buttons shook those children .
this boat had seen that child who the trucks heard who was n't dropping that woman .	this boat had seen who that child who the trucks heard was n't dropping that woman .
these bottles should n't notice that patient who can n't know the toy who can praise this spoon .	these bottles should n't notice who that patient who can n't know the toy can praise this spoon .
these plates should n't notice these women who heard the toys who have answered the books .	these plates should n't notice who these women who heard the toys have answered the books .
these shoes have n't seen the lady who bought this driver who heard the chair .	these shoes have n't seen who the lady who bought this driver heard the chair .
this truck has remembered the child who may hear the rocket who helps these schools .	this truck has remembered who the child who may hear the rocket helps these schools .
those shirts can n't see these ladies who would lose that child who scare this ship .	those shirts can n't see who these ladies who would lose that child scare this ship .
the dish wo n't see this lady who shook that child who throws this person .	the dish wo n't see who this lady who shook that child throws this person .
the shirts had seen that child who can n't know that ship who heard that candle .	the shirts had seen who that child who can n't know that ship heard that candle .
the bicycle has n't known this customer who sang who is bringing this doctor .	the bicycle has n't known who this customer who sang is bringing this doctor .
those cups can n't forget the guy who those books heard who hears that book .	those cups can n't forget who the guy who those books heard hears that book .
this bed might see this man who has lost who lost the guy .	this bed might see who this man who has lost lost the guy .
this rug had n't known the children who had held those ladies who worked with these cars .	this rug had n't known who the children who had held those ladies worked with these cars .
the bottle would n't know the king who did n't paint who will know these shirts .	the bottle would n't know who the king who did n't paint will know these shirts .
the chair had seen this driver who had heard the doors who threw the guys .	the chair had seen who this driver who had heard the doors threw the guys .
this hat would n't forget this teacher who made this dentist who drops those doctors .	this hat would n't forget who this teacher who made this dentist drops those doctors .
that spoon had remembered this dog that has n't grown that knows those books .	that spoon had remembered what this dog that has n't grown knows those books .
the plane has n't seen this man who wo n't paint who makes this doctor .	the plane has n't seen who this man who wo n't paint makes this doctor .
this chair can n't notice that adult who had kept those children who can sell those boys .	this chair can n't notice who that adult who had kept those children can sell those boys .
these toys do n't know those boys who sell the men who have n't scared these trucks .	these toys do n't know who those boys who sell the men have n't scared these trucks .
this hat had known the queen who the schools heard who has brought this girl .	this hat had known who the queen who the schools heard has brought this girl .
those toys have n't noticed this guy who painted who is n't working with the windows .	those toys have n't noticed who this guy who painted is n't working with the windows .
that car had noticed the child who cries who could n't move this customer .	that car had noticed who the child who cries could n't move this customer .
that book should forget that driver that might grow that knows the spoons .	that book should forget what that driver that might grow knows the spoons .
the hat had noticed those guys who have n't cried who do n't talk to this rug .	the hat had noticed who those guys who have n't cried do n't talk to this rug .
the shoe had known that girl who will know that shirt who heard those beds .	the shoe had known who that girl who will know that shirt heard those beds .
this shoe has n't known these teachers who hear that fork who appreciate this candle .	this shoe has n't known who these teachers who hear that fork appreciate this candle .
the dishes had known the guy that may hear those shoes that has heard this bag .	the dishes had known what the guy that may hear those shoes has heard this bag .
that ship has n't remembered these children who yelled who did n't talk to the ring .	that ship has n't remembered who these children who yelled did n't talk to the ring .
this rocket had seen the boys that have run that would know these cups .	this rocket had seen what the boys that have run would know these cups .
those beds should forget the child who shakes those girls who has talked to the hats .	those beds should forget who the child who shakes those girls has talked to the hats .
these bags would know that girl who had n't lost who holds the doctors .	these bags would know who that girl who had n't lost holds the doctors .
this toy will notice these ladies who hear the buttons who could scare those crayons .	this toy will notice who these ladies who hear the buttons could scare those crayons .
the forks have remembered this driver who this bank knows who could n't keep these people .	the forks have remembered who this driver who this bank knows could n't keep these people .
the candles have n't noticed the doctors who that mall knows who could know those cars .	the candles have n't noticed who the doctors who that mall knows could know those cars .
these plates have n't known that customer who exercises who has n't heard this bottle .	these plates have n't known who that customer who exercises has n't heard this bottle .
those books have remembered these men who were n't whispering who praise this toy .	those books have remembered who these men who were n't whispering praise this toy .
the hats can see those people who talked who have n't scared this hat .	the hats can see who those people who talked have n't scared this hat .
these dolls should n't see these guys who the shirts can n't know who hear this door .	these dolls should n't see who these guys who the shirts can n't know hear this door .
this crayon has n't known that driver who the crayons would hear who has thrown those girls .	this crayon has n't known who that driver who the crayons would hear has thrown those girls .
this bottle had seen these children who lift those women who are n't working with these cups .	this bottle had seen who these children who lift those women are n't working with these cups .
these dishes would forget these children who can n't hear this fork who have n't taken those teachers .	these dishes would forget who these children who can n't hear this fork have n't taken those teachers .
these pictures had n't known this person who made this person who had heard the boxes .	these pictures had n't known who this person who made this person had heard the boxes .
