the dish did n't see this doctor who makes this dentist who is working with that rug .	the dish did n't see who this doctor who makes this dentist is working with that rug .
those pictures do n't forget this dancer who was n't fixing that patient who was n't buying the guys .	those pictures do n't forget who this dancer who was n't fixing that patient was n't buying the guys .
this box has n't known this man that can n't grow that heard the schools .	this box has n't known what this man that can n't grow heard the schools .
these trucks had known this child who could buy those women who should hear the candles .	these trucks had known who this child who could buy those women should hear the candles .
the ship can n't see these men who have n't dropped these guys who were n't teaching that shoe .	the ship can n't see who these men who have n't dropped these guys were n't teaching that shoe .
that bottle should n't forget this man who is whispering who could n't lift the boys .	that bottle should n't forget who this man who is whispering could n't lift the boys .
these windows can n't know that doctor who would n't hold that king who can drop the teachers .	these windows can n't know who that doctor who would n't hold that king can drop the teachers .
that couch could n't know those ladies who heard these beds who praise this fork .	that couch could n't know who those ladies who heard these beds praise this fork .
the bags had known those guys who made this woman who heard that bowl .	the bags had known who those guys who made this woman heard that bowl .
the spoons would n't remember that dancer who hears this window who should n't know those forks .	the spoons would n't remember who that dancer who hears this window should n't know those forks .
these crayons might see these people that those shirts heard that hear that car .	these crayons might see what these people that those shirts heard hear that car .
that bag has n't noticed the boys who can n't exercise who sell the ladies .	that bag has n't noticed who the boys who can n't exercise sell the ladies .
the bowl will forget this patient who those shoes hear who knows these forks .	the bowl will forget who this patient who those shoes hear knows these forks .
that truck can notice this person who those toys did n't hear who has worried those rooms .	that truck can notice who this person who those toys did n't hear has worried those rooms .
the rings have n't remembered those women who yell who helped this bank .	the rings have n't remembered who those women who yell helped this bank .
those boats have n't noticed that girl who the schools heard who knows the books .	those boats have n't noticed who that girl who the schools heard knows the books .
those buttons would see those people who are n't losing who may help this bank .	those buttons would see who those people who are n't losing may help this bank .
the dishes had remembered those children who are n't yelling who should know that hospital .	the dishes had remembered who those children who are n't yelling should know that hospital .
the bowls had n't known that adult who should lose the person who has n't found that dentist .	the bowls had n't known who that adult who should lose the person has n't found that dentist .
these shoes have n't known this lady who may hear that mirror who should keep that guy .	these shoes have n't known who this lady who may hear that mirror should keep that guy .
this window could n't know that doctor that had grown that knew the box .	this window could n't know what that doctor that had grown knew the box .
these bags could n't see the customer who would make the patient who heard those hats .	these bags could n't see who the customer who would make the patient heard those hats .
those windows had noticed the women who win who are finding this queen .	those windows had noticed who the women who win are finding this queen .
the fork can n't notice the guy who was buying these girls who does n't understand that rocket .	the fork can n't notice who the guy who was buying these girls does n't understand that rocket .
the hat would n't know that customer who had found this child who knew that ship .	the hat would n't know who that customer who had found this child knew that ship .
the shoe had n't noticed that queen who had n't cleaned the boy who has found this car .	the shoe had n't noticed who that queen who had n't cleaned the boy has found this car .
these bowls have seen these doctors who smile who have answered this crayon .	these bowls have seen who these doctors who smile have answered this crayon .
these pictures have n't noticed the guy who won who worked with this shirt .	these pictures have n't noticed who the guy who won worked with this shirt .
the bags do n't remember this boy who did n't wave who has cleaned that dentist .	the bags do n't remember who this boy who did n't wave has cleaned that dentist .
the bowls had n't known that queen who may know those crayons who scared those boats .	the bowls had n't known who that queen who may know those crayons scared those boats .
these windows did n't notice this boy who these beds have n't heard who is finding these children .	these windows did n't notice who this boy who these beds have n't heard is finding these children .
these bowls have remembered these guys who take that boy who would bring the doctor .	these bowls have remembered who these guys who take that boy would bring the doctor .
those dishes would forget this turtle that must hear that rocket that knew the shoes .	those dishes would forget what this turtle that must hear that rocket knew the shoes .
these shirts had known the guys who heard those dishes who worry that button .	these shirts had known who the guys who heard those dishes worry that button .
the shirts had seen that driver who threw the king who understands these rings .	the shirts had seen who that driver who threw the king understands these rings .
those candles should know those people who have the boy who had n't cleaned the man .	those candles should know who those people who have the boy had n't cleaned the man .
the bicycle could n't forget the man who those bags heard who helps this hospital .	the bicycle could n't forget who the man who those bags heard helps this hospital .
the rug does n't know these boys that know this rug that knew the library .	the rug does n't know what these boys that know this rug knew the library .
these bowls would see this dentist who knows these schools who does n't hear these bags .	these bowls would see who this dentist who knows these schools does n't hear these bags .
the cars have remembered the guy who that plate could know who would n't lift those children .	the cars have remembered who the guy who that plate could know would n't lift those children .
the button had seen those girls who found this woman who stole that adult .	the button had seen who those girls who found this woman stole that adult .
the plates had seen the snake that had eaten that has n't heard this plate .	the plates had seen what the snake that had eaten has n't heard this plate .
the toys wo n't remember this teacher who would n't shake the lady who has n't heard that room .	the toys wo n't remember who this teacher who would n't shake the lady has n't heard that room .
these glasses had n't known that adult who cries who was bothering the hat .	these glasses had n't known who that adult who cries was bothering the hat .
this plane did n't notice those girls who do n't sell this woman who are working with the cups .	this plane did n't notice who those girls who do n't sell this woman are working with the cups .
this chair could remember the woman who can n't win who had bothered the park .	this chair could remember who the woman who can n't win had bothered the park .
these dishes should n't remember the guy who has n't heard this shirt who knows that toy .	these dishes should n't remember who the guy who has n't heard this shirt knows that toy .
the crayon could n't forget that queen that those shoes knew that hears these shoes .	the crayon could n't forget what that queen that those shoes knew hears these shoes .
that bowl had n't noticed that man who could n't move the ladies who was n't making those girls .	that bowl had n't noticed who that man who could n't move the ladies was n't making those girls .
these dolls have known the child who should stretch who hears the cars .	these dolls have known who the child who should stretch hears the cars .
that mirror might forget those ladies who the chair knows who knew this bowl .	that mirror might forget who those ladies who the chair knows knew this bowl .
the crayons must see the children who can n't sneeze who had helped the couch .	the crayons must see who the children who can n't sneeze had helped the couch .
these hats had n't known those doctors who have n't heard this room who scared the beds .	these hats had n't known who those doctors who have n't heard this room scared the beds .
the books have known these men who lose who knew the plates .	the books have known who these men who lose knew the plates .
this plane has noticed the guy who that hat can know who was listening to the crayon .	this plane has noticed who the guy who that hat can know was listening to the crayon .
those forks could remember those teachers who that fork must know who are n't bothering that book .	those forks could remember who those teachers who that fork must know are n't bothering that book .
those bottles had n't remembered the king who would lie who was bothering those rings .	those bottles had n't remembered who the king who would lie was bothering those rings .
this ring will notice those women who that bed had heard who should n't visit these hats .	this ring will notice who those women who that bed had heard should n't visit these hats .
the chair may know the patient that learned that might know the trucks .	the chair may know what the patient that learned might know the trucks .
those bags would forget this person who was cleaning the doctors who has n't talked to these forks .	those bags would forget who this person who was cleaning the doctors has n't talked to these forks .
that dish has n't remembered these women who know this bottle who found that car .	that dish has n't remembered who these women who know this bottle found that car .
these dolls had n't seen the child that those books did n't know that could n't know this picture .	these dolls had n't seen what the child that those books did n't know could n't know this picture .
these dolls had n't noticed these boys who can win who answer these windows .	these dolls had n't noticed who these boys who can win answer these windows .
the window would see this person who has n't made this person who kept the girls .	the window would see who this person who has n't made this person kept the girls .
that cup had n't remembered the lady who has n't dropped that girl who has found that shoe .	that cup had n't remembered who the lady who has n't dropped that girl has found that shoe .
this chair may notice those ladies who those shirts should n't know who would n't help these boats .	this chair may notice who those ladies who those shirts should n't know would n't help these boats .
those dolls had n't noticed the girls who those books hear who bought this dentist .	those dolls had n't noticed who the girls who those books hear bought this dentist .
the hats did n't know these children who smile who have answered that car .	the hats did n't know who these children who smile have answered that car .
that bottle could know these people who this picture knew who should n't listen to the bank .	that bottle could know who these people who this picture knew should n't listen to the bank .
that couch had noticed the adult who threw the person who does n't lose those girls .	that couch had noticed who the adult who threw the person does n't lose those girls .
this button would know the dentist who this shoe had heard who knows those cars .	this button would know who the dentist who this shoe had heard knows those cars .
this glass has remembered this dentist who was cleaning this boy who has helped this door .	this glass has remembered who this dentist who was cleaning this boy has helped this door .
this toy can n't forget the girls who heard the candle who are teaching those crayons .	this toy can n't forget who the girls who heard the candle are teaching those crayons .
the bags could n't notice those people who brought these children who bother those shirts .	the bags could n't notice who those people who brought these children bother those shirts .
that boat should n't know the doctors who were talking who are n't fixing the dancer .	that boat should n't know who the doctors who were talking are n't fixing the dancer .
that shirt has n't noticed the adult who has kept this woman who has n't found that bowl .	that shirt has n't noticed who the adult who has kept this woman has n't found that bowl .
the plane had n't remembered this teacher who should n't win who would n't care for that museum .	the plane had n't remembered who this teacher who should n't win would n't care for that museum .
those pictures have seen those boys who practice who should bother the window .	those pictures have seen who those boys who practice should bother the window .
that hat has n't seen those women who must have that adult who did n't keep this girl .	that hat has n't seen who those women who must have that adult did n't keep this girl .
these hats will remember that guy who had n't found this boy who is n't throwing these teachers .	these hats will remember who that guy who had n't found this boy is n't throwing these teachers .
this bag had seen this woman who the spoons can hear who should hear this fork .	this bag had seen who this woman who the spoons can hear should hear this fork .
these dolls had n't known the child who can have these children who can hear these books .	these dolls had n't known who the child who can have these children can hear these books .
these hats will notice that queen who waved who hears this bottle .	these hats will notice who that queen who waved hears this bottle .
the cars do n't forget these people who have read who help these cars .	the cars do n't forget who these people who have read help these cars .
those cups had noticed these children who wo n't buy this dentist who could n't hear these spoons .	those cups had noticed who these children who wo n't buy this dentist could n't hear these spoons .
the chairs may know that child who may know those forks who had n't lost these windows .	the chairs may know who that child who may know those forks had n't lost these windows .
that window does n't remember this guy who was n't reading who wo n't praise this museum .	that window does n't remember who this guy who was n't reading wo n't praise this museum .
this picture has n't known that customer who heard this bank who heard that room .	this picture has n't known who that customer who heard this bank heard that room .
these trucks should n't remember these guys who this park knew who had that lady .	these trucks should n't remember who these guys who this park knew had that lady .
this doll has remembered that patient who reads who throws those women .	this doll has remembered who that patient who reads throws those women .
those forks might notice that customer who holds the teachers who had worked with this couch .	those forks might notice who that customer who holds the teachers had worked with this couch .
those doors have noticed the boy that has eaten that hears that bowl .	those doors have noticed what the boy that has eaten hears that bowl .
this crayon has n't known that doctor who is n't fixing this customer who threw those teachers .	this crayon has n't known who that doctor who is n't fixing this customer threw those teachers .
this bottle has n't noticed this teacher who knew those chairs who is bringing those ladies .	this bottle has n't noticed who this teacher who knew those chairs is bringing those ladies .
those hats might know this boy who had n't moved these boys who should n't understand the school .	those hats might know who this boy who had n't moved these boys should n't understand the school .
this button has n't noticed these girls who heard this plate who wo n't answer this rug .	this button has n't noticed who these girls who heard this plate wo n't answer this rug .
these beds should n't know that guy who is n't lying who brought that queen .	these beds should n't know who that guy who is n't lying brought that queen .
the plates do n't notice this customer who has n't heard the doll who was n't finding that customer .	the plates do n't notice who this customer who has n't heard the doll was n't finding that customer .
the fork must forget this rabbit that has heard the schools that knew this rocket .	the fork must forget what this rabbit that has heard the schools knew this rocket .
those buttons will know those teachers who had this child who have lost that mall .	those buttons will know who those teachers who had this child have lost that mall .
these shoes have n't noticed that adult who knows the spoon who might hear those plates .	these shoes have n't noticed who that adult who knows the spoon might hear those plates .
those bowls should see those women who have laughed who do n't fix the dentist .	those bowls should see who those women who have laughed do n't fix the dentist .
the toys will know the children who those boxes know who worry these boxes .	the toys will know who the children who those boxes know worry these boxes .
the crayons had n't known this king who should hear these dolls who hears this candle .	the crayons had n't known who this king who should hear these dolls hears this candle .
that bicycle can know this girl that was n't growing that knows these cars .	that bicycle can know what this girl that was n't growing knows these cars .
this rug should n't remember the guy who should n't know that bed who has n't taught the toys .	this rug should n't remember who the guy who should n't know that bed has n't taught the toys .
this car can n't remember the people who heard that plane who fix that girl .	this car can n't remember who the people who heard that plane fix that girl .
this ring had n't noticed those guys who shake that patient who have n't talked to these chairs .	this ring had n't noticed who those guys who shake that patient have n't talked to these chairs .
these books have n't remembered the boys that have grown that did n't hear those chairs .	these books have n't remembered what the boys that have grown did n't hear those chairs .
these doors would n't remember those women who stole these ladies who should n't visit this dish .	these doors would n't remember who those women who stole these ladies should n't visit this dish .
those forks would forget the patient who is n't painting who would throw the doctors .	those forks would forget who the patient who is n't painting would throw the doctors .
the doors will know that rabbit that knew that restaurant that can n't know those schools .	the doors will know what that rabbit that knew that restaurant can n't know those schools .
those cars had n't seen that driver who has thrown this child who helps this bicycle .	those cars had n't seen who that driver who has thrown this child helps this bicycle .
this ring did n't forget those teachers who can hold this man who scared that library .	this ring did n't forget who those teachers who can hold this man scared that library .
these chairs have n't known these children who lost this dancer who know these trucks .	these chairs have n't known who these children who lost this dancer know these trucks .
the doll might see the teacher who was n't throwing this patient who had found this bed .	the doll might see who the teacher who was n't throwing this patient had found this bed .
this shirt will forget this queen who knew the window who talked to that bank .	this shirt will forget who this queen who knew the window talked to that bank .
the spoons do n't remember those men who laughed who bothered this rug .	the spoons do n't remember who those men who laughed bothered this rug .
that doll could forget that king who had made this customer who brings that child .	that doll could forget who that king who had made this customer brings that child .
these forks wo n't remember the girls who were n't smiling who knew that school .	these forks wo n't remember who the girls who were n't smiling knew that school .
the cups may remember this girl who had kept the patient who could n't find the patient .	the cups may remember who this girl who had kept the patient could n't find the patient .
the ship should n't see this dentist who reads who hears the cup .	the ship should n't see who this dentist who reads hears the cup .
that rug had seen the man who is n't painting who can make that man .	that rug had seen who the man who is n't painting can make that man .
that dish had n't noticed these doctors who knew this shoe who do n't appreciate the rooms .	that dish had n't noticed who these doctors who knew this shoe do n't appreciate the rooms .
the bags will notice the child who shakes this child who heard this doll .	the bags will notice who the child who shakes this child heard this doll .
these books did n't see the doctor who should n't lose the guys who may work with the kitchen .	these books did n't see who the doctor who should n't lose the guys may work with the kitchen .
those books had n't noticed the people who hear that car who taught the hat .	those books had n't noticed who the people who hear that car taught the hat .
the spoon had n't known this customer who was practicing who found that school .	the spoon had n't known who this customer who was practicing found that school .
the car had remembered those ladies who will hear this mirror who bring the girl .	the car had remembered who those ladies who will hear this mirror bring the girl .
the dolls did n't notice the girl that learned that knows that bank .	the dolls did n't notice what the girl that learned knows that bank .
this mirror does n't remember these ladies who found these boys who must work with that school .	this mirror does n't remember who these ladies who found these boys must work with that school .
the door can n't notice those girls who sang who do n't listen to those bowls .	the door can n't notice who those girls who sang do n't listen to those bowls .
those candles have remembered the queen who is making the boy who talked to the mirror .	those candles have remembered who the queen who is making the boy talked to the mirror .
those cars had n't seen that adult who had n't cleaned that person who works with those doors .	those cars had n't seen who that adult who had n't cleaned that person works with those doors .
the window might forget the man who this shirt had n't heard who visited the bicycle .	the window might forget who the man who this shirt had n't heard visited the bicycle .
these glasses have known the guys who should n't buy this woman who dropped those girls .	these glasses have known who the guys who should n't buy this woman dropped those girls .
that hat has n't known the girl who knows that bottle who shakes those girls .	that hat has n't known who the girl who knows that bottle shakes those girls .
that boat has n't known those ladies who do n't hear the cups who could praise the couch .	that boat has n't known who those ladies who do n't hear the cups could praise the couch .
those bowls had remembered the girl who has bought these guys who must care for those bottles .	those bowls had remembered who the girl who has bought these guys must care for those bottles .
the car will know those girls who this mall knows who were n't shaking this girl .	the car will know who those girls who this mall knows were n't shaking this girl .
this shirt has n't seen this man who might paint who scares these bowls .	this shirt has n't seen who this man who might paint scares these bowls .
the cars did n't forget the ladies who were n't laughing who are n't dropping that queen .	the cars did n't forget who the ladies who were n't laughing are n't dropping that queen .
these shoes may know this woman that might eat that heard that room .	these shoes may know what this woman that might eat heard that room .
the bowls had noticed the men who those dishes knew who were n't teaching that button .	the bowls had noticed who the men who those dishes knew were n't teaching that button .
that window has remembered the doctors who are n't throwing the patient who should know the buttons .	that window has remembered who the doctors who are n't throwing the patient should know the buttons .
this crayon has seen those doctors who have n't heard these toys who are n't dropping these men .	this crayon has seen who those doctors who have n't heard these toys are n't dropping these men .
these dishes had n't known those doctors who this couch did n't know who had heard that book .	these dishes had n't known who those doctors who this couch did n't know had heard that book .
these rings had seen this queen who the bag hears who had n't helped that boat .	these rings had seen who this queen who the bag hears had n't helped that boat .
the rug has n't remembered that queen that those toys have heard that knew that car .	the rug has n't remembered what that queen that those toys have heard knew that car .
this rocket has n't seen those ladies who can take these doctors who should teach those books .	this rocket has n't seen who those ladies who can take these doctors should teach those books .
the candles had n't known the people who practice who heard the book .	the candles had n't known who the people who practice heard the book .
