the books had n't remembered that driver who has heard that window who is making the people .	the books had n't remembered who that driver who has heard that window is making the people .
the bags had n't known the dancer who sings who scares that spoon .	the bags had n't known who the dancer who sings scares that spoon .
the crayon did n't remember that girl who could paint who knows these forks .	the crayon did n't remember who that girl who could paint knows these forks .
this toy had known the boy who was n't whispering who hears this hospital .	this toy had known who the boy who was n't whispering hears this hospital .
the hats had n't seen this dentist who reads who taught the cars .	the hats had n't seen who this dentist who reads taught the cars .
those books did n't remember these girls who were n't crying who fixed that king .	those books did n't remember who these girls who were n't crying fixed that king .
this glass has n't noticed the child who lost who should n't hear the picture .	this glass has n't noticed who the child who lost should n't hear the picture .
the bed has n't noticed this boy who should n't keep the child who was dropping that patient .	the bed has n't noticed who this boy who should n't keep the child was dropping that patient .
those candles had seen that dancer who kept the king who knew that couch .	those candles had seen who that dancer who kept the king knew that couch .
those hats might see that person who these boxes have heard who had lost these boys .	those hats might see who that person who these boxes have heard had lost these boys .
the cups have n't noticed that boy who these windows must hear who was talking to that spoon .	the cups have n't noticed who that boy who these windows must hear was talking to that spoon .
these books do n't know the horse that is learning that has heard these windows .	these books do n't know what the horse that is learning has heard these windows .
that plate should n't know the guys who buy the doctors who are n't making the child .	that plate should n't know who the guys who buy the doctors are n't making the child .
the glasses may notice this woman that that hat heard that hears the boats .	the glasses may notice what this woman that that hat heard hears the boats .
that button should n't forget the people who those forks know who could n't know these books .	that button should n't forget who the people who those forks know could n't know these books .
the bottles have known the dentist who talked who found these shirts .	the bottles have known who the dentist who talked found these shirts .
these rings had remembered that woman who that hat hears who keeps that child .	these rings had remembered who that woman who that hat hears keeps that child .
that truck has n't known the lady who is n't losing who made those girls .	that truck has n't known who the lady who is n't losing made those girls .
those glasses would n't see the dentist who that ship would n't know who took that dancer .	those glasses would n't see who the dentist who that ship would n't know took that dancer .
this car has n't remembered this child who laughed who heard those chairs .	this car has n't remembered who this child who laughed heard those chairs .
those crayons must see the boys who this bag knew who can understand that candle .	those crayons must see who the boys who this bag knew can understand that candle .
this boat has n't known that customer who was keeping the men who can know the trucks .	this boat has n't known who that customer who was keeping the men can know the trucks .
the windows may see that doctor who has n't yelled who is n't working with that couch .	the windows may see who that doctor who has n't yelled is n't working with that couch .
that bag would n't know that doctor that might grow that hears the spoon .	that bag would n't know what that doctor that might grow hears the spoon .
the spoon wo n't see the boys who lose the driver who would n't work with the glass .	the spoon wo n't see who the boys who lose the driver would n't work with the glass .
that glass has n't seen this woman who may stretch who has n't heard the plane .	that glass has n't seen who this woman who may stretch has n't heard the plane .
the bicycle had n't remembered these guys who wave who should find the guy .	the bicycle had n't remembered who these guys who wave should find the guy .
the candle had known the doctors who had n't painted who should talk to this cup .	the candle had known who the doctors who had n't painted should talk to this cup .
that hat has n't noticed these mice that eat that knew that button .	that hat has n't noticed what these mice that eat knew that button .
the boxes can know those guys who were n't talking who would n't help that restaurant .	the boxes can know who those guys who were n't talking would n't help that restaurant .
those trucks can n't remember the doctors who had n't heard the car who are fixing this king .	those trucks can n't remember who the doctors who had n't heard the car are fixing this king .
those windows can n't forget the king who those rings know who would answer these trucks .	those windows can n't forget who the king who those rings know would answer these trucks .
the cars have noticed those girls who should n't cough who had n't talked to the spoons .	the cars have noticed who those girls who should n't cough had n't talked to the spoons .
that ring must forget those people who were screaming who had n't visited the hospital .	that ring must forget who those people who were screaming had n't visited the hospital .
these candles have seen those women who could n't know that plate who were teaching this bag .	these candles have seen who those women who could n't know that plate were teaching this bag .
that bottle can forget this boy who waves who would help the rings .	that bottle can forget who this boy who waves would help the rings .
these dolls did n't remember that woman who had that doctor who works with these doors .	these dolls did n't remember who that woman who had that doctor works with these doors .
this car should n't remember these girls that had learned that knew that library .	this car should n't remember what these girls that had learned knew that library .
these hats had known the queen who wo n't wave who found this king .	these hats had known who the queen who wo n't wave found this king .
that bowl may forget the boys who have waved who have lost that dentist .	that bowl may forget who the boys who have waved have lost that dentist .
the truck must notice these children who were crying who have n't taught that door .	the truck must notice who these children who were crying have n't taught that door .
the glasses must notice those people who won who have n't talked to this bag .	the glasses must notice who those people who won have n't talked to this bag .
those boxes had seen the men who should yell who did n't throw that boy .	those boxes had seen who the men who should yell did n't throw that boy .
those shirts had n't noticed these snakes that the mirror heard that hear the rings .	those shirts had n't noticed what these snakes that the mirror heard hear the rings .
this ring had seen the child who wo n't hear that hat who holds the teacher .	this ring had seen who the child who wo n't hear that hat holds the teacher .
this bed had n't remembered the guys who read who lost these children .	this bed had n't remembered who the guys who read lost these children .
the boats could see those boys who had n't moved that lady who did n't appreciate the glasses .	the boats could see who those boys who had n't moved that lady did n't appreciate the glasses .
the cars had seen the girls who heard that bottle who answered this hat .	the cars had seen who the girls who heard that bottle answered this hat .
these shoes have n't seen that teacher who makes that girl who can talk to the spoon .	these shoes have n't seen who that teacher who makes that girl can talk to the spoon .
that car had noticed that patient who can n't lose those boys who hears these dishes .	that car had noticed who that patient who can n't lose those boys hears these dishes .
the crayons had n't noticed this boy who knew those chairs who was n't moving the driver .	the crayons had n't noticed who this boy who knew those chairs was n't moving the driver .
the boat will remember the boys who find the driver who teach those forks .	the boat will remember who the boys who find the driver teach those forks .
the buttons should notice those doctors who knew the mirror who work with that door .	the buttons should notice who those doctors who knew the mirror work with that door .
that rug had n't remembered that doctor who knew those bowls who was n't listening to the toys .	that rug had n't remembered who that doctor who knew those bowls was n't listening to the toys .
that plate had noticed this girl who that restaurant has n't heard who stole the patient .	that plate had noticed who this girl who that restaurant has n't heard stole the patient .
that ring does n't know these women who lose those men who have lost that dentist .	that ring does n't know who these women who lose those men have lost that dentist .
these glasses could know this doctor who should lose who can n't hear the shirts .	these glasses could know who this doctor who should lose can n't hear the shirts .
this shoe has seen these people who know those shoes who had n't confused this rug .	this shoe has seen who these people who know those shoes had n't confused this rug .
this door had n't seen those people who would n't talk who confused this library .	this door had n't seen who those people who would n't talk confused this library .
the dishes have remembered this customer who will lift the guy who wo n't drop these women .	the dishes have remembered who this customer who will lift the guy wo n't drop these women .
the button can know this customer who was shaking that doctor who had worried the school .	the button can know who this customer who was shaking that doctor had worried the school .
the forks have n't noticed this dancer who has cried who did n't hear the car .	the forks have n't noticed who this dancer who has cried did n't hear the car .
that truck had noticed the customer who those trucks knew who had n't lost this boy .	that truck had noticed who the customer who those trucks knew had n't lost this boy .
those cars do n't see these girls who hear the crayons who wo n't care for this rocket .	those cars do n't see who these girls who hear the crayons wo n't care for this rocket .
the books had known those doctors who fixed the boys who are helping the car .	the books had known who those doctors who fixed the boys are helping the car .
the shoe had n't noticed the customer who this chair must hear who was n't losing the girls .	the shoe had n't noticed who the customer who this chair must hear was n't losing the girls .
the dish could forget these boys who have n't heard these bags who appreciate that shoe .	the dish could forget who these boys who have n't heard these bags appreciate that shoe .
the boxes have n't remembered the woman who waved who scared the plate .	the boxes have n't remembered who the woman who waved scared the plate .
the dolls could notice those children who those chairs knew who were n't helping this book .	the dolls could notice who those children who those chairs knew were n't helping this book .
the bed has n't seen that man who has kept the boy who could n't bother those trucks .	the bed has n't seen who that man who has kept the boy could n't bother those trucks .
that mirror can remember the queen that had n't learned that should know this mall .	that mirror can remember what the queen that had n't learned should know this mall .
those bags have n't noticed that dentist who threw this girl who shook this teacher .	those bags have n't noticed who that dentist who threw this girl shook this teacher .
these pictures have known those boys who cough who have fixed the adult .	these pictures have known who those boys who cough have fixed the adult .
these pictures should n't forget these girls who wo n't yell who took the girls .	these pictures should n't forget who these girls who wo n't yell took the girls .
those dishes may notice these men who stole those doctors who fix the queen .	those dishes may notice who these men who stole those doctors fix the queen .
those toys had seen these men who might laugh who were taking the lady .	those toys had seen who these men who might laugh were taking the lady .
these books will remember the women who move those guys who were n't cleaning the person .	these books will remember who the women who move those guys were n't cleaning the person .
the boats wo n't see that boy that grows that knew these spoons .	the boats wo n't see what that boy that grows knew these spoons .
the box has n't remembered these doctors who wave who are n't helping this candle .	the box has n't remembered who these doctors who wave are n't helping this candle .
this car should see that driver who is reading who might buy the people .	this car should see who that driver who is reading might buy the people .
these pictures might see this doctor who can lose who is n't bothering that bowl .	these pictures might see who this doctor who can lose is n't bothering that bowl .
the boxes could n't notice those guys who should whisper who teach those rings .	the boxes could n't notice who those guys who should whisper teach those rings .
these dolls may notice those doctors that may hear those rooms that can n't hear that car .	these dolls may notice what those doctors that may hear those rooms can n't hear that car .
the car does n't remember the women who lose who threw the dancer .	the car does n't remember who the women who lose threw the dancer .
those bottles had n't remembered the man who knows these books who was n't shaking this customer .	those bottles had n't remembered who the man who knows these books was n't shaking this customer .
the spoon had seen the men who were smiling who kept the patient .	the spoon had seen who the men who were smiling kept the patient .
the couch had n't known this person who was n't lying who could buy the king .	the couch had n't known who this person who was n't lying could buy the king .
that ship has noticed the lady who may paint who could n't hear the shirts .	that ship has noticed who the lady who may paint could n't hear the shirts .
the forks did n't remember the adult who the chairs hear who confused the plate .	the forks did n't remember who the adult who the chairs hear confused the plate .
the spoon wo n't forget that guy who lost who had n't bought those boys .	the spoon wo n't forget who that guy who lost had n't bought those boys .
the crayons will forget this child who might wave who would find the driver .	the crayons will forget who this child who might wave would find the driver .
this fork had noticed the guy who would yell who will hear this doll .	this fork had noticed who the guy who would yell will hear this doll .
the cars had n't seen the boy who this boat had heard who bought the women .	the cars had n't seen who the boy who this boat had heard bought the women .
these beds had remembered this driver who keeps that guy who dropped this dancer .	these beds had remembered who this driver who keeps that guy dropped this dancer .
the boats have noticed the child who heard this bed who knows that truck .	the boats have noticed who the child who heard this bed knows that truck .
that hat had noticed the driver who may practice who knows the schools .	that hat had noticed who the driver who may practice knows the schools .
those boats could see these women who hear these cars who heard the shirts .	those boats could see who these women who hear these cars heard the shirts .
these dishes have remembered those ladies who know those bottles who are helping that glass .	these dishes have remembered who those ladies who know those bottles are helping that glass .
those crayons had remembered the customer who has n't thrown these doctors who heard this restaurant .	those crayons had remembered who the customer who has n't thrown these doctors heard this restaurant .
that chair did n't see that man who drops the people who is n't losing the guy .	that chair did n't see who that man who drops the people is n't losing the guy .
this plane had n't known this driver who drops that dentist who was n't dropping these teachers .	this plane had n't known who this driver who drops that dentist was n't dropping these teachers .
those crayons could notice these mice that can n't eat that could know the forks .	those crayons could notice what these mice that can n't eat could know the forks .
these dolls would n't notice these teachers who could n't stretch who had the women .	these dolls would n't notice who these teachers who could n't stretch had the women .
those cups had known those birds that grew that must hear the books .	those cups had known what those birds that grew must hear the books .
that chair can remember the child who has n't held that girl who wo n't worry the bowl .	that chair can remember who the child who has n't held that girl wo n't worry the bowl .
those hats have remembered the guy who painted who is buying these women .	those hats have remembered who the guy who painted is buying these women .
the cars have noticed those men who know these plates who would teach that library .	the cars have noticed who those men who know these plates would teach that library .
this truck had seen these women who have n't held the ladies who visited the trucks .	this truck had seen who these women who have n't held the ladies visited the trucks .
these boats had seen that doctor who those plates hear who has n't worried the cup .	these boats had seen who that doctor who those plates hear has n't worried the cup .
the chair has n't known the girls who move these children who were cleaning that dentist .	the chair has n't known who the girls who move these children were cleaning that dentist .
that candle should n't know the guys who wo n't yell who fix this adult .	that candle should n't know who the guys who wo n't yell fix this adult .
those buttons would see the man who the cups may know who takes that dentist .	those buttons would see who the man who the cups may know takes that dentist .
this bottle had n't known this driver who knows the bag who could n't know that crayon .	this bottle had n't known who this driver who knows the bag could n't know that crayon .
these glasses do n't forget this person who this dish knows who found that rocket .	these glasses do n't forget who this person who this dish knows found that rocket .
the bag had n't remembered that girl that was n't eating that knew the plates .	the bag had n't remembered what that girl that was n't eating knew the plates .
those dishes should forget the women who that cup can know who should hear that plane .	those dishes should forget who the women who that cup can know should hear that plane .
this bottle can n't see those doctors who would n't read who knew these cars .	this bottle can n't see who those doctors who would n't read knew these cars .
the bed will remember those boys who whisper who hear these glasses .	the bed will remember who those boys who whisper hear these glasses .
those bottles have n't seen these ladies who have n't heard those bottles who had n't bothered that boat .	those bottles have n't seen who these ladies who have n't heard those bottles had n't bothered that boat .
this shirt could n't know the child who heard that bowl who could hear the doll .	this shirt could n't know who the child who heard that bowl could hear the doll .
the windows will notice these cats that ate that know the rocket .	the windows will notice what these cats that ate know the rocket .
the dolls had n't remembered those girls who that fork knew who had n't found the woman .	the dolls had n't remembered who those girls who that fork knew had n't found the woman .
this couch must forget that patient that this rug heard that knows that boat .	this couch must forget what that patient that this rug heard knows that boat .
this box has n't noticed this woman who wo n't hear that room who had this queen .	this box has n't noticed who this woman who wo n't hear that room had this queen .
that glass wo n't remember those teachers who have heard that boat who heard those bottles .	that glass wo n't remember who those teachers who have heard that boat heard those bottles .
that crayon can see these ladies who should yell who do n't scare that ship .	that crayon can see who these ladies who should yell do n't scare that ship .
the button could remember this child that was n't learning that hears the couch .	the button could remember what this child that was n't learning hears the couch .
this glass has n't noticed these boys who may bring the people who have heard those chairs .	this glass has n't noticed who these boys who may bring the people have heard those chairs .
those dishes can see the birds that eat that had n't heard those schools .	those dishes can see what the birds that eat had n't heard those schools .
the shirts wo n't notice this teacher who holds the customer who was making the teacher .	the shirts wo n't notice who this teacher who holds the customer was making the teacher .
those chairs have n't seen those ladies who would wave who will hear the bottles .	those chairs have n't seen who those ladies who would wave will hear the bottles .
these trucks can see those teachers that ate that heard this car .	these trucks can see what those teachers that ate heard this car .
the dolls had n't remembered those rabbits that can n't grow that knew the rooms .	the dolls had n't remembered what those rabbits that can n't grow knew the rooms .
this glass has seen these boys who would paint who dropped these ladies .	this glass has seen who these boys who would paint dropped these ladies .
the plates had n't seen the teachers who would n't hear those schools who are n't bothering these dishes .	the plates had n't seen who the teachers who would n't hear those schools are n't bothering these dishes .
the dish has n't known that boy who sang who had answered these beds .	the dish has n't known who that boy who sang had answered these beds .
these cups should n't know those ladies who that fork knows who were bothering the candles .	these cups should n't know who those ladies who that fork knows were bothering the candles .
those cars have n't noticed the doctors who the spoon might know who throw the guy .	those cars have n't noticed who the doctors who the spoon might know throw the guy .
the shirt has seen these women who the bags heard who would know these dolls .	the shirt has seen who these women who the bags heard would know these dolls .
that crayon had n't remembered these children who were whispering who could bother the bag .	that crayon had n't remembered who these children who were whispering could bother the bag .
those cars could see the children who those plates heard who had n't taught that mirror .	those cars could see who the children who those plates heard had n't taught that mirror .
those windows have n't noticed this child who sings who throws that child .	those windows have n't noticed who this child who sings throws that child .
this car can see the customer who had n't talked who can n't know the bowls .	this car can see who the customer who had n't talked can n't know the bowls .
that toy could know the teachers who lie who can talk to those hats .	that toy could know who the teachers who lie can talk to those hats .
the books have n't seen that boy who has n't moved the dentist who must fix that king .	the books have n't seen who that boy who has n't moved the dentist must fix that king .
the ship has remembered the driver who knew those boxes who makes this teacher .	the ship has remembered who the driver who knew those boxes makes this teacher .
that car did n't see the boys who that car heard who had lost those doors .	that car did n't see who the boys who that car heard had lost those doors .
those beds have n't noticed this man who can know the bags who was teaching these boats .	those beds have n't noticed who this man who can know the bags was teaching these boats .
the hats have noticed the boys who whisper who worked with the schools .	the hats have noticed who the boys who whisper worked with the schools .
these cups did n't know this doctor who that hospital had n't heard who lost those rings .	these cups did n't know who this doctor who that hospital had n't heard lost those rings .
the bowls had n't seen the doctor that knows the spoon that hears those toys .	the bowls had n't seen what the doctor that knows the spoon hears those toys .
those pictures have seen the women who talked who will have this dentist .	those pictures have seen who the women who talked will have this dentist .
the doors should see the girls that that candle has heard that could hear these schools .	the doors should see what the girls that that candle has heard could hear these schools .
that couch may forget those women who can n't hear that glass who will know the trucks .	that couch may forget who those women who can n't hear that glass will know the trucks .
those books might know that hamster that heard the boat that heard the car .	those books might know what that hamster that heard the boat heard the car .
those cups have n't remembered the lady who had yelled who was bothering that chair .	those cups have n't remembered who the lady who had yelled was bothering that chair .
