these books might know what this park was keeping .	these books might know that this park was keeping .
the pictures must notice who the fork wo n't scare .	the pictures must notice that the fork wo n't scare .
these dishes did n't know who that rocket could n't bother .	these dishes did n't know that that rocket could n't bother .
these shoes realize what those bowls were bringing .	these shoes realize that those bowls were bringing .
these chairs remembered what the bottle could steal .	these chairs remembered that the bottle could steal .
these shirts can n't forget what this bed had found .	these shirts can n't forget that this bed had found .
this shoe knows what these cups kept .	this shoe knows that these cups kept .
these buttons forget who these boxes would n't appreciate .	these buttons forget that these boxes would n't appreciate .
the books must forget what the book must bring .	the books must forget that the book must bring .
that couch did n't remember who this restaurant can appreciate .	that couch did n't remember that this restaurant can appreciate .
the bags realized who those books bothered .	the bags realized that those books bothered .
the hats saw what these cars were fixing .	the hats saw that these cars were fixing .
those cars forgot who the rings have n't liked .	those cars forgot that the rings have n't liked .
the books forgot what this door can sell .	the books forgot that this door can sell .
those beds have n't seen what the fork kept .	those beds have n't seen that the fork kept .
the toys learn what that bed keeps .	the toys learn that that bed keeps .
this bag knows what these spoons steal .	this bag knows that these spoons steal .
the pictures remember what these bowls fix .	the pictures remember that these bowls fix .
these cups must see what this bicycle can n't make .	these cups must see that this bicycle can n't make .
the couch has remembered what the boats bring .	the couch has remembered that the boats bring .
those shoes have n't noticed who the trucks liked .	those shoes have n't noticed that the trucks liked .
this picture can realize what the crayons may take .	this picture can realize that the crayons may take .
the crayon wo n't learn what these rings should sell .	the crayon wo n't learn that these rings should sell .
the car knew what that box does n't sell .	the car knew that that box does n't sell .
these books had n't seen what those chairs fix .	these books had n't seen that those chairs fix .
the chairs could learn who this ring was n't bothering .	the chairs could learn that this ring was n't bothering .
the dolls had seen what the plates were n't taking .	the dolls had seen that the plates were n't taking .
these forks realized who these bowls had confused .	these forks realized that these bowls had confused .
the bowls realized who the doors bother .	the bowls realized that the doors bother .
that plane noticed what this bank held .	that plane noticed that this bank held .
those plates will notice what the chair was fixing .	those plates will notice that the chair was fixing .
that spoon could notice who these schools like .	that spoon could notice that these schools like .
that shoe should realize what the door found .	that shoe should realize that the door found .
the rug can know what the schools are n't holding .	the rug can know that the schools are n't holding .
these bowls realized what this park kept .	these bowls realized that this park kept .
these cups saw what the book was n't making .	these cups saw that the book was n't making .
this box realized what those boats make .	this box realized that those boats make .
the candle has realized what that bag could n't steal .	the candle has realized that that bag could n't steal .
the ring may remember who these forks can n't like .	the ring may remember that these forks can n't like .
those rings would n't forget what those shirts had made .	those rings would n't forget that those shirts had made .
those cars learned what this room should n't fix .	those cars learned that this room should n't fix .
the buttons could n't know who this room does n't hate .	the buttons could n't know that this room does n't hate .
the shoe knew what those rings were buying .	the shoe knew that those rings were buying .
those bags realized who the ship has scared .	those bags realized that the ship has scared .
those plates learned what this dish made .	those plates learned that this dish made .
this toy has n't remembered what the shoe has n't fixed .	this toy has n't remembered that the shoe has n't fixed .
that ring could n't remember what this bank stole .	that ring could n't remember that this bank stole .
these books should n't notice who these trucks do n't hate .	these books should n't notice that these trucks do n't hate .
this ship has n't remembered what these rings could n't keep .	this ship has n't remembered that these rings could n't keep .
this toy may realize what those candles would bring .	this toy may realize that those candles would bring .
that toy has realized what the museum had n't fixed .	that toy has realized that the museum had n't fixed .
the spoons knew what the cups find .	the spoons knew that the cups find .
those dishes forget what this shoe would n't steal .	those dishes forget that this shoe would n't steal .
these boxes should notice what the windows stole .	these boxes should notice that the windows stole .
that ship should remember what the bank can n't make .	that ship should remember that the bank can n't make .
that ship sees what the boat would n't sell .	that ship sees that the boat would n't sell .
the shirts know what this mirror found .	the shirts know that this mirror found .
this toy remembered what the bottles were holding .	this toy remembered that the bottles were holding .
the couch forgot what the window holds .	the couch forgot that the window holds .
those glasses forget who these beds confused .	those glasses forget that these beds confused .
the forks noticed who this rug liked .	the forks noticed that this rug liked .
those trucks learn what the truck kept .	those trucks learn that the truck kept .
the plate had n't realized what this shirt bought .	the plate had n't realized that this shirt bought .
those plates should n't know who those pictures have liked .	those plates should n't know that those pictures have liked .
those pictures knew what the forks stole .	those pictures knew that the forks stole .
those trucks can n't remember what these trucks find .	those trucks can n't remember that these trucks find .
that plate forgot what the schools have fixed .	that plate forgot that the schools have fixed .
that bicycle has n't known what these cars had n't held .	that bicycle has n't known that these cars had n't held .
this box knew what the plates held .	this box knew that the plates held .
this bed must remember what that park kept .	this bed must remember that that park kept .
this ship would n't learn what that shoe might sell .	this ship would n't learn that that shoe might sell .
that bag could n't remember what those toys were making .	that bag could n't remember that those toys were making .
the car had noticed who the cars must praise .	the car had noticed that the cars must praise .
those shoes forgot what this shirt holds .	those shoes forgot that this shirt holds .
those cars forgot what these beds have n't found .	those cars forgot that these beds have n't found .
the bag learned who those glasses have n't confused .	the bag learned that those glasses have n't confused .
the boats had n't known who that restaurant had liked .	the boats had n't known that that restaurant had liked .
these rings had n't realized what those cups were keeping .	these rings had n't realized that those cups were keeping .
the boxes learned what that museum had held .	the boxes learned that that museum had held .
that mirror has n't learned who this dish likes .	that mirror has n't learned that this dish likes .
these books had learned what those rooms had fixed .	these books had learned that those rooms had fixed .
these beds remember what that hat is making .	these beds remember that that hat is making .
these doors realized what these forks have n't taken .	these doors realized that these forks have n't taken .
the dolls remembered who this picture confused .	the dolls remembered that this picture confused .
these spoons should n't remember what this button is making .	these spoons should n't remember that this button is making .
this shoe had n't remembered what these dishes have found .	this shoe had n't remembered that these dishes have found .
this bag must remember who that glass will appreciate .	this bag must remember that that glass will appreciate .
the books forget what these hats may find .	the books forget that these hats may find .
these glasses learn what the car has n't fixed .	these glasses learn that the car has n't fixed .
the glass could n't realize what the book was bringing .	the glass could n't realize that the book was bringing .
that fork knew what the shirts kept .	that fork knew that the shirts kept .
this bag can see who the car bothered .	this bag can see that the car bothered .
the forks noticed who the bed likes .	the forks noticed that the bed likes .
the picture realized what these shirts hold .	the picture realized that these shirts hold .
this truck may see what the toys held .	this truck may see that the toys held .
these rings realize who the toy bothered .	these rings realize that the toy bothered .
the trucks had n't learned what this bed brings .	the trucks had n't learned that this bed brings .
this truck can notice what this spoon has held .	this truck can notice that this spoon has held .
that book might realize what the books had n't taken .	that book might realize that the books had n't taken .
those pictures notice who that crayon was bothering .	those pictures notice that that crayon was bothering .
that fork had n't realized what this bottle keeps .	that fork had n't realized that this bottle keeps .
those candles saw what these dolls find .	those candles saw that these dolls find .
this button has remembered what the hospital had n't made .	this button has remembered that the hospital had n't made .
those windows did n't know what this book took .	those windows did n't know that this book took .
these cups noticed what those cups kept .	these cups noticed that those cups kept .
these books saw what the room held .	these books saw that the room held .
the cars noticed what this book brings .	the cars noticed that this book brings .
those trucks learn what the dishes kept .	those trucks learn that the dishes kept .
that cup can realize what the hospital held .	that cup can realize that the hospital held .
the boats had noticed who the windows like .	the boats had noticed that the windows like .
the bowl sees what that car had held .	the bowl sees that that car had held .
these cars saw what these boats had held .	these cars saw that these boats had held .
this car would n't remember who this plate has n't confused .	this car would n't remember that this plate has n't confused .
those cups noticed what the schools kept .	those cups noticed that the schools kept .
the rug must remember what the candle was n't taking .	the rug must remember that the candle was n't taking .
the chairs learn what these bags are n't taking .	the chairs learn that these bags are n't taking .
those dolls had noticed who those shirts are n't bothering .	those dolls had noticed that those shirts are n't bothering .
these windows do n't notice who these shirts should n't bother .	these windows do n't notice that these shirts should n't bother .
that chair forgot what this chair must take .	that chair forgot that this chair must take .
this fork might forget what these plates should bring .	this fork might forget that these plates should bring .
those plates saw who that book might hate .	those plates saw that that book might hate .
the spoon could notice what the door might sell .	the spoon could notice that the door might sell .
the doll did n't notice what the fork should n't buy .	the doll did n't notice that the fork should n't buy .
the dolls have remembered what this rocket was bringing .	the dolls have remembered that this rocket was bringing .
these pictures saw what these bowls might make .	these pictures saw that these bowls might make .
this cup has n't known what those bags do n't fix .	this cup has n't known that those bags do n't fix .
that book has n't noticed who those candles could like .	that book has n't noticed that those candles could like .
this bowl can n't see who this crayon will hate .	this bowl can n't see that this crayon will hate .
this spoon forgot what this car did n't find .	this spoon forgot that this car did n't find .
these bags remembered who the shirts appreciate .	these bags remembered that the shirts appreciate .
that picture sees what this book wo n't fix .	that picture sees that this book wo n't fix .
this book had n't noticed what the bowls are n't fixing .	this book had n't noticed that the bowls are n't fixing .
these doors would n't see who that mall is n't bothering .	these doors would n't see that that mall is n't bothering .
these cups learned what the glasses buy .	these cups learned that the glasses buy .
these cups noticed who these chairs liked .	these cups noticed that these chairs liked .
that ring can n't forget what that glass had brought .	that ring can n't forget that that glass had brought .
the windows noticed what those bottles must keep .	the windows noticed that those bottles must keep .
those doors had realized who this room likes .	those doors had realized that this room likes .
the candles forget who that school likes .	the candles forget that that school likes .
these trucks have n't noticed what the rocket takes .	these trucks have n't noticed that the rocket takes .
the bottles might notice who this plate has liked .	the bottles might notice that this plate has liked .
those spoons had n't learned who that bag has n't bothered .	those spoons had n't learned that that bag has n't bothered .
the bottle knows who the schools bother .	the bottle knows that the schools bother .
those shoes know who those books liked .	those shoes know that those books liked .
the plates can notice what the door found .	the plates can notice that the door found .
those hats forgot who this shirt has scared .	those hats forgot that this shirt has scared .
this ship had n't realized what the car had found .	this ship had n't realized that the car had found .
that spoon should see who the schools may scare .	that spoon should see that the schools may scare .
the boat remembered what this library had kept .	the boat remembered that this library had kept .
those doors would n't remember what that mall had kept .	those doors would n't remember that that mall had kept .
these windows could n't remember who this door has n't liked .	these windows could n't remember that this door has n't liked .
the cups learn what this truck will steal .	the cups learn that this truck will steal .
these cars can forget who the spoons should scare .	these cars can forget that the spoons should scare .
these beds can see what the truck made .	these beds can see that the truck made .
the shirts learn who this ship may bother .	the shirts learn that this ship may bother .
those toys learn what this book should make .	those toys learn that this book should make .
that picture had learned who this candle likes .	that picture had learned that this candle likes .
the buttons have learned what this mirror stole .	the buttons have learned that this mirror stole .
the hats notice what those shirts fix .	the hats notice that those shirts fix .
those boxes saw what those chairs should n't steal .	those boxes saw that those chairs should n't steal .
the chairs can realize who that dish can n't bother .	the chairs can realize that that dish can n't bother .
those dishes must see what the spoons are n't holding .	those dishes must see that the spoons are n't holding .
that glass knew what these boxes will fix .	that glass knew that these boxes will fix .
those spoons forgot what this fork will sell .	those spoons forgot that this fork will sell .
these pictures forget who that rug has bothered .	these pictures forget that that rug has bothered .
the door saw what the schools have n't taken .	the door saw that the schools have n't taken .
the chairs would n't forget who that chair might appreciate .	the chairs would n't forget that that chair might appreciate .
the book realized what the door found .	the book realized that the door found .
that box can remember what that box will buy .	that box can remember that that box will buy .
the shoe had learned who this ring has n't confused .	the shoe had learned that this ring has n't confused .
the cup must realize what those plates take .	the cup must realize that those plates take .
those cars had n't learned what that glass has taken .	those cars had n't learned that that glass has taken .
those trucks will remember who those chairs have n't scared .	those trucks will remember that those chairs have n't scared .
this button had learned what this candle could n't steal .	this button had learned that this candle could n't steal .
the cars saw what those books have n't kept .	the cars saw that those books have n't kept .
those hats can learn what these cars should keep .	those hats can learn that these cars should keep .
the chair learned what the fork would steal .	the chair learned that the fork would steal .
those crayons could learn what the cars had n't fixed .	those crayons could learn that the cars had n't fixed .
that door had n't learned what this fork is buying .	that door had n't learned that this fork is buying .
the mirror learned what that library would fix .	the mirror learned that that library would fix .
the mirror remembered what those boxes stole .	the mirror remembered that those boxes stole .
those plates have n't remembered what this mall has n't brought .	those plates have n't remembered that this mall has n't brought .
the box has realized what the shirt keeps .	the box has realized that the shirt keeps .
this crayon has n't learned what the dishes stole .	this crayon has n't learned that the dishes stole .
this dish would learn what those shirts make .	this dish would learn that those shirts make .
this chair realized who the spoons confused .	this chair realized that the spoons confused .
those candles learn who these pictures might hate .	those candles learn that these pictures might hate .
that picture could n't notice what this plane may make .	that picture could n't notice that this plane may make .
those windows had n't learned what the crayons might hold .	those windows had n't learned that the crayons might hold .
the buttons realize what that rocket has found .	the buttons realize that that rocket has found .
that cup has remembered what that plane will bring .	that cup has remembered that that plane will bring .
this rug would n't remember what those candles might steal .	this rug would n't remember that those candles might steal .
the hat had n't known what the doll was holding .	the hat had n't known that the doll was holding .
that spoon would n't realize what that car had found .	that spoon would n't realize that that car had found .
these boats remember who those shirts praise .	these boats remember that those shirts praise .
the box had realized what this park took .	the box had realized that this park took .
those cars noticed who that plane must bother .	those cars noticed that that plane must bother .
these toys would forget what that bottle did n't find .	these toys would forget that that bottle did n't find .
the picture must know who that crayon had bothered .	the picture must know that that crayon had bothered .
the fork has remembered who those pictures praise .	the fork has remembered that those pictures praise .
those boats could n't see what those glasses fix .	those boats could n't see that those glasses fix .
that bottle learned who these schools bothered .	that bottle learned that these schools bothered .
that rug remembered what this window made .	that rug remembered that this window made .
those candles could learn what the cups brought .	those candles could learn that the cups brought .
that bottle knows what those crayons brought .	that bottle knows that those crayons brought .
the ship knew what the crayon made .	the ship knew that the crayon made .
those bottles had known what this restaurant stole .	those bottles had known that this restaurant stole .
the bed must forget what the schools were n't making .	the bed must forget that the schools were n't making .
this fork knows what the plates were n't fixing .	this fork knows that the plates were n't fixing .
the bowl had realized what these schools find .	the bowl had realized that these schools find .
these cups had n't learned who the dolls liked .	these cups had n't learned that the dolls liked .
these hats wo n't know what the cups had fixed .	these hats wo n't know that the cups had fixed .
this cup saw who that window likes .	this cup saw that that window likes .
the glasses notice who that glass confused .	the glasses notice that that glass confused .
the windows know what this plane had n't made .	the windows know that this plane had n't made .
these bags saw who that door confused .	these bags saw that that door confused .
these windows learned what those schools were bringing .	these windows learned that those schools were bringing .
those buttons forget what the rooms fixed .	those buttons forget that the rooms fixed .
those bowls learn what that library was n't making .	those bowls learn that that library was n't making .
these dolls learn what that bed has taken .	these dolls learn that that bed has taken .
the candles have n't realized what those glasses found .	the candles have n't realized that those glasses found .
the glasses may remember who the button has n't scared .	the glasses may remember that the button has n't scared .
the beds knew who the plate bothered .	the beds knew that the plate bothered .
the chairs could forget who the boat scares .	the chairs could forget that the boat scares .
those toys wo n't notice what this toy would n't make .	those toys wo n't notice that this toy would n't make .
that book can n't notice what the trucks might bring .	that book can n't notice that the trucks might bring .
these buttons remembered who those schools will like .	these buttons remembered that those schools will like .
the spoons might see what these dishes brought .	the spoons might see that these dishes brought .
those bottles forgot what the bed holds .	those bottles forgot that the bed holds .
those dishes must forget what that doll is keeping .	those dishes must forget that that doll is keeping .
these candles must realize what that library stole .	these candles must realize that that library stole .
those pictures know what those bags sell .	those pictures know that those bags sell .
that box must learn who those windows scare .	that box must learn that those windows scare .
this shirt sees who the glass was bothering .	this shirt sees that the glass was bothering .
the boats had n't realized what this shoe is finding .	the boats had n't realized that this shoe is finding .
these doors knew who this boat is n't bothering .	these doors knew that this boat is n't bothering .
those books had learned what this couch made .	those books had learned that this couch made .
the doors forgot what the dishes can take .	the doors forgot that the dishes can take .
the rug has learned who these chairs scared .	the rug has learned that these chairs scared .
the bed had n't noticed what that car can n't buy .	the bed had n't noticed that that car can n't buy .
that candle has learned what the books kept .	that candle has learned that the books kept .
this plane does n't see what the plane did n't hold .	this plane does n't see that the plane did n't hold .
that bowl forgot who those books will appreciate .	that bowl forgot that those books will appreciate .
those beds remember who that couch scares .	those beds remember that that couch scares .
these glasses could n't forget what the dishes are making .	these glasses could n't forget that the dishes are making .
the crayons remember what the rocket is buying .	the crayons remember that the rocket is buying .
the rug saw what the bag was buying .	the rug saw that the bag was buying .
the couch sees who the bicycle scares .	the couch sees that the bicycle scares .
those plates learn what this bicycle stole .	those plates learn that this bicycle stole .
that truck might learn what this spoon fixed .	that truck might learn that this spoon fixed .
that bicycle has remembered what these books are n't holding .	that bicycle has remembered that these books are n't holding .
that hat did n't forget who these shirts appreciate .	that hat did n't forget that these shirts appreciate .
those shirts learned what the books had taken .	those shirts learned that the books had taken .
the bowls know what this car kept .	the bowls know that this car kept .
that dish should notice what the plate could n't take .	that dish should notice that the plate could n't take .
the bottles notice what this kitchen bought .	the bottles notice that this kitchen bought .
the crayon will remember what that doll was finding .	the crayon will remember that that doll was finding .
these beds have seen who those crayons confused .	these beds have seen that those crayons confused .
the car may forget what this doll holds .	the car may forget that this doll holds .
that plate had n't realized what that plane is bringing .	that plate had n't realized that that plane is bringing .
