that plate did n't forget what the toy keeps .	that plate did n't forget that the toy keeps .
the picture saw what that plane has held .	the picture saw that that plane has held .
the toy knew what these schools fix .	the toy knew that these schools fix .
those pictures did n't know what this shirt kept .	those pictures did n't know that this shirt kept .
the spoons noticed what those spoons may bring .	the spoons noticed that those spoons may bring .
that button noticed what the bottle keeps .	that button noticed that the bottle keeps .
these rings may see who these bags praise .	these rings may see that these bags praise .
those trucks see what that bottle held .	those trucks see that that bottle held .
that hat had n't known who the doors have scared .	that hat had n't known that the doors have scared .
the spoon had n't known what this car found .	the spoon had n't known that this car found .
the glass had noticed who these windows may scare .	the glass had noticed that these windows may scare .
those boats remembered who this bowl could appreciate .	those boats remembered that this bowl could appreciate .
those rings had n't learned what the book does n't steal .	those rings had n't learned that the book does n't steal .
that plane forgot what these windows make .	that plane forgot that these windows make .
these buttons will see what these toys were n't keeping .	these buttons will see that these toys were n't keeping .
those cars forgot what those dishes had n't kept .	those cars forgot that those dishes had n't kept .
the plate should n't see who the school had scared .	the plate should n't see that the school had scared .
the hats realize who the plate had n't bothered .	the hats realize that the plate had n't bothered .
the shoe would forget what the cups made .	the shoe would forget that the cups made .
the shoes did n't see what this shoe makes .	the shoes did n't see that this shoe makes .
these bottles see who the glass confused .	these bottles see that the glass confused .
that plate saw what that restaurant should bring .	that plate saw that that restaurant should bring .
these doors could know who this shoe confused .	these doors could know that this shoe confused .
these cars realized what the buttons bring .	these cars realized that the buttons bring .
that bag had remembered what those cars have n't fixed .	that bag had remembered that those cars have n't fixed .
that bag had n't known what that boat bought .	that bag had n't known that that boat bought .
those bags might know what the park keeps .	those bags might know that the park keeps .
this car has learned who the beds must praise .	this car has learned that the beds must praise .
these cars had n't learned what this school took .	these cars had n't learned that this school took .
those forks noticed who these cars would n't bother .	those forks noticed that these cars would n't bother .
the mirror has known who the glasses scare .	the mirror has known that the glasses scare .
these rings forget who the forks bothered .	these rings forget that the forks bothered .
that rocket realized who the spoon is n't bothering .	that rocket realized that the spoon is n't bothering .
that glass did n't notice who the mall confused .	that glass did n't notice that the mall confused .
the cup will remember who this hat wo n't bother .	the cup will remember that this hat wo n't bother .
this boat can n't remember who the plate may appreciate .	this boat can n't remember that the plate may appreciate .
these shoes knew what this hospital keeps .	these shoes knew that this hospital keeps .
those bags forgot what that plate held .	those bags forgot that that plate held .
the ship should learn who those dolls do n't hate .	the ship should learn that those dolls do n't hate .
these bottles had remembered what this shirt brought .	these bottles had remembered that this shirt brought .
the bicycle noticed what those schools found .	the bicycle noticed that those schools found .
the cup had n't remembered what these forks have n't made .	the cup had n't remembered that these forks have n't made .
that toy could n't know what those crayons were n't holding .	that toy could n't know that those crayons were n't holding .
that bottle might realize who that plate was n't bothering .	that bottle might realize that that plate was n't bothering .
the candle had n't seen what this park takes .	the candle had n't seen that this park takes .
the cars remembered who this chair would n't hate .	the cars remembered that this chair would n't hate .
those spoons do n't see what this bank has held .	those spoons do n't see that this bank has held .
that button saw what the car would sell .	that button saw that the car would sell .
those spoons forgot what this school should steal .	those spoons forgot that this school should steal .
the bed knew who these chairs had bothered .	the bed knew that these chairs had bothered .
those trucks see who that room is n't bothering .	those trucks see that that room is n't bothering .
those candles remembered what the ship can n't bring .	those candles remembered that the ship can n't bring .
the boats could n't learn who this toy can like .	the boats could n't learn that this toy can like .
these forks should n't know who that bottle had liked .	these forks should n't know that that bottle had liked .
that window can n't know who these bottles confused .	that window can n't know that these bottles confused .
the bicycle has n't seen what that truck made .	the bicycle has n't seen that that truck made .
the crayon realized what this car bought .	the crayon realized that this car bought .
the plate would learn what the schools can sell .	the plate would learn that the schools can sell .
this shoe should know what those books keep .	this shoe should know that those books keep .
this button may learn who the bed can n't appreciate .	this button may learn that the bed can n't appreciate .
the ring realized who the spoons were bothering .	the ring realized that the spoons were bothering .
these rings may learn who the dish is n't bothering .	these rings may learn that the dish is n't bothering .
these pictures learn what these doors sell .	these pictures learn that these doors sell .
the toy learned what those crayons might keep .	the toy learned that those crayons might keep .
the spoons realize what this school was holding .	the spoons realize that this school was holding .
the box had realized what the fork took .	the box had realized that the fork took .
those hats knew who the cups scared .	those hats knew that the cups scared .
that book would know what the restaurant could sell .	that book would know that the restaurant could sell .
these plates will realize what the trucks had n't found .	these plates will realize that the trucks had n't found .
the pictures notice who this kitchen could n't hate .	the pictures notice that this kitchen could n't hate .
the bowl has n't noticed what this room has n't taken .	the bowl has n't noticed that this room has n't taken .
that bag had n't seen what that fork kept .	that bag had n't seen that that fork kept .
these cars have seen what that candle made .	these cars have seen that that candle made .
that doll has seen what this restaurant has found .	that doll has seen that this restaurant has found .
these doors wo n't see who that park could n't appreciate .	these doors wo n't see that that park could n't appreciate .
these books remember what these bags have n't taken .	these books remember that these bags have n't taken .
those bottles forget what that shirt has n't taken .	those bottles forget that that shirt has n't taken .
the crayons realized what those plates would n't sell .	the crayons realized that those plates would n't sell .
that book knows what that box brings .	that book knows that that box brings .
this fork saw who the cups have n't liked .	this fork saw that the cups have n't liked .
the couch saw who those crayons bothered .	the couch saw that those crayons bothered .
the hats had remembered what that candle has n't found .	the hats had remembered that that candle has n't found .
those toys could forget what the bed was n't buying .	those toys could forget that the bed was n't buying .
those bottles noticed what this picture is n't keeping .	those bottles noticed that this picture is n't keeping .
those buttons see what the pictures might fix .	those buttons see that the pictures might fix .
these windows wo n't remember what that toy has bought .	these windows wo n't remember that that toy has bought .
these bags remembered who these trucks praise .	these bags remembered that these trucks praise .
those boats could forget who this couch will like .	those boats could forget that this couch will like .
the spoons have seen who those cups are bothering .	the spoons have seen that those cups are bothering .
these candles know what that school is n't keeping .	these candles know that that school is n't keeping .
the toy can n't see what the boat took .	the toy can n't see that the boat took .
those pictures can see what that cup kept .	those pictures can see that that cup kept .
these spoons remember who that hat has n't liked .	these spoons remember that that hat has n't liked .
the boat could n't see what that bowl brings .	the boat could n't see that that bowl brings .
those boxes would know what this bowl did n't fix .	those boxes would know that this bowl did n't fix .
the boat learned who that library should n't hate .	the boat learned that that library should n't hate .
the hat had n't remembered who this crayon has n't bothered .	the hat had n't remembered that this crayon has n't bothered .
these bags noticed what this bicycle took .	these bags noticed that this bicycle took .
the candles realized who the book had n't scared .	the candles realized that the book had n't scared .
these rings know who the books bother .	these rings know that the books bother .
this ring knows what these bottles sell .	this ring knows that these bottles sell .
those doors have remembered who the boats can hate .	those doors have remembered that the boats can hate .
the chairs know what this car has kept .	the chairs know that this car has kept .
those dishes have remembered what the library can n't hold .	those dishes have remembered that the library can n't hold .
those spoons realized who the chairs scared .	those spoons realized that the chairs scared .
this bowl wo n't realize who that spoon could n't praise .	this bowl wo n't realize that that spoon could n't praise .
this crayon realized what those chairs steal .	this crayon realized that those chairs steal .
these bottles had realized who that restaurant will appreciate .	these bottles had realized that that restaurant will appreciate .
the car should forget what those chairs stole .	the car should forget that those chairs stole .
these boats have n't known what those crayons have held .	these boats have n't known that those crayons have held .
the spoons have seen what these books find .	the spoons have seen that these books find .
those cars saw what the bag has n't bought .	those cars saw that the bag has n't bought .
this fork had seen what that shirt would make .	this fork had seen that that shirt would make .
that boat can forget who this museum is bothering .	that boat can forget that this museum is bothering .
that plate remembered what these cups fix .	that plate remembered that these cups fix .
that truck realized who the car will like .	that truck realized that the car will like .
that dish would learn who that shirt would scare .	that dish would learn that that shirt would scare .
the cups knew who those shirts have scared .	the cups knew that those shirts have scared .
the bowl sees what that plane is n't making .	the bowl sees that that plane is n't making .
these rings remembered what those books held .	these rings remembered that those books held .
this dish could n't see what those cups made .	this dish could n't see that those cups made .
these pictures did n't see who this doll can like .	these pictures did n't see that this doll can like .
that rug knew what that ring had brought .	that rug knew that that ring had brought .
this car learned what those beds are n't holding .	this car learned that those beds are n't holding .
the chair saw what the rooms took .	the chair saw that the rooms took .
those books could n't learn who that cup was n't bothering .	those books could n't learn that that cup was n't bothering .
the hats forget what these bottles have found .	the hats forget that these bottles have found .
these boats know who this book has n't liked .	these boats know that this book has n't liked .
those dolls noticed who these chairs bother .	those dolls noticed that these chairs bother .
the chair may know what those chairs were n't making .	the chair may know that those chairs were n't making .
the rings might notice what that dish did n't keep .	the rings might notice that that dish did n't keep .
that rug remembered what those shoes have brought .	that rug remembered that those shoes have brought .
this picture had learned what those shoes can hold .	this picture had learned that those shoes can hold .
those shoes had n't seen what this candle was keeping .	those shoes had n't seen that this candle was keeping .
that dish forgot who those schools like .	that dish forgot that those schools like .
those books learned what the trucks bought .	those books learned that the trucks bought .
the shirts could notice who that room can bother .	the shirts could notice that that room can bother .
those toys had realized what that car is taking .	those toys had realized that that car is taking .
these plates have n't known what these cars should keep .	these plates have n't known that these cars should keep .
the doors remember who the boats liked .	the doors remember that the boats liked .
this fork saw who the books can praise .	this fork saw that the books can praise .
that shoe sees what these rings stole .	that shoe sees that these rings stole .
those cars had n't noticed what the beds did n't buy .	those cars had n't noticed that the beds did n't buy .
this toy saw who those pictures may appreciate .	this toy saw that those pictures may appreciate .
those cars should remember what this box stole .	those cars should remember that this box stole .
this bowl realized what those beds might fix .	this bowl realized that those beds might fix .
those windows realize who those bowls scare .	those windows realize that those bowls scare .
that ship had realized what those windows had n't made .	that ship had realized that those windows had n't made .
these trucks learned what the shoe is n't finding .	these trucks learned that the shoe is n't finding .
the bed sees who this bag did n't like .	the bed sees that this bag did n't like .
that plate may see what those rings buy .	that plate may see that those rings buy .
those pictures realized what that door bought .	those pictures realized that that door bought .
these spoons remember what that window was n't fixing .	these spoons remember that that window was n't fixing .
this mirror can notice what that bicycle was n't keeping .	this mirror can notice that that bicycle was n't keeping .
those rings had n't remembered who these glasses like .	those rings had n't remembered that these glasses like .
that rocket noticed what those chairs would keep .	that rocket noticed that those chairs would keep .
this toy saw who this library could scare .	this toy saw that this library could scare .
that chair does n't learn what this dish holds .	that chair does n't learn that this dish holds .
this plate knows who these doors scare .	this plate knows that these doors scare .
the toys saw who these dishes scare .	the toys saw that these dishes scare .
those boxes wo n't forget what the plane is fixing .	those boxes wo n't forget that the plane is fixing .
that ship may remember who the spoon had confused .	that ship may remember that the spoon had confused .
these doors can n't know what the mall has n't held .	these doors can n't know that the mall has n't held .
these books had remembered who those shoes did n't hate .	these books had remembered that those shoes did n't hate .
the cup knows what this truck will fix .	the cup knows that this truck will fix .
these hats realized what that window could steal .	these hats realized that that window could steal .
those pictures have noticed who the spoon may hate .	those pictures have noticed that the spoon may hate .
that shirt realized what these candles would buy .	that shirt realized that these candles would buy .
the chairs remember what these books would sell .	the chairs remember that these books would sell .
these shirts forgot what those candles brought .	these shirts forgot that those candles brought .
these dishes had n't learned what that crayon found .	these dishes had n't learned that that crayon found .
that ring saw what the beds have n't found .	that ring saw that the beds have n't found .
these cups had realized who the plane was bothering .	these cups had realized that the plane was bothering .
the rings realized what the library bought .	the rings realized that the library bought .
these doors see who the restaurant had n't scared .	these doors see that the restaurant had n't scared .
this crayon noticed what that door was n't bringing .	this crayon noticed that that door was n't bringing .
the bottles learned who these plates scare .	the bottles learned that these plates scare .
this cup remembered what the bed takes .	this cup remembered that the bed takes .
the boats forget who these chairs bothered .	the boats forget that these chairs bothered .
this ring has n't realized who those dolls like .	this ring has n't realized that those dolls like .
the plate wo n't realize who those bottles have liked .	the plate wo n't realize that those bottles have liked .
these dolls had n't remembered what these bowls find .	these dolls had n't remembered that these bowls find .
that chair had seen what these schools could n't fix .	that chair had seen that these schools could n't fix .
this picture does n't notice what the bottles should n't find .	this picture does n't notice that the bottles should n't find .
these dolls know what those pictures keep .	these dolls know that those pictures keep .
that toy had n't seen what this plane stole .	that toy had n't seen that this plane stole .
that hat has seen what that cup keeps .	that hat has seen that that cup keeps .
that car had n't seen what those books had made .	that car had n't seen that those books had made .
that bowl would n't see who this glass scared .	that bowl would n't see that this glass scared .
the hats had n't seen what this mirror took .	the hats had n't seen that this mirror took .
this car would n't see who the beds wo n't like .	this car would n't see that the beds wo n't like .
this ring saw what the mall has n't bought .	this ring saw that the mall has n't bought .
this book could n't notice what that crayon took .	this book could n't notice that that crayon took .
those shoes have realized who the bottle could like .	those shoes have realized that the bottle could like .
the bed remembered what the truck could n't keep .	the bed remembered that the truck could n't keep .
these cups must realize what these buttons bring .	these cups must realize that these buttons bring .
that bed knew what these buttons should n't bring .	that bed knew that these buttons should n't bring .
the ship could forget who these plates bother .	the ship could forget that these plates bother .
these buttons remembered who that couch was bothering .	these buttons remembered that that couch was bothering .
those boxes may realize who the schools bothered .	those boxes may realize that the schools bothered .
these boxes should notice what the museum wo n't find .	these boxes should notice that the museum wo n't find .
the box saw who that library liked .	the box saw that that library liked .
this button should n't remember what the bank was bringing .	this button should n't remember that the bank was bringing .
that crayon has n't learned who these books had scared .	that crayon has n't learned that these books had scared .
these hats should n't realize who that mall likes .	these hats should n't realize that that mall likes .
the cars must forget who the box likes .	the cars must forget that the box likes .
this couch should n't notice who that park can scare .	this couch should n't notice that that park can scare .
those books remember who those shirts did n't like .	those books remember that those shirts did n't like .
the chairs remembered what the bowls hold .	the chairs remembered that the bowls hold .
the glasses must realize what the rings could n't fix .	the glasses must realize that the rings could n't fix .
the boats must realize what this book made .	the boats must realize that this book made .
this book could remember what that park would n't make .	this book could remember that that park would n't make .
these forks may forget what those shoes sell .	these forks may forget that those shoes sell .
those crayons have remembered what this plane wo n't keep .	those crayons have remembered that this plane wo n't keep .
this cup should notice what the book stole .	this cup should notice that the book stole .
this rocket did n't see what this bag is n't bringing .	this rocket did n't see that this bag is n't bringing .
this book realized what the mall bought .	this book realized that the mall bought .
this car has realized what that bowl fixed .	this car has realized that that bowl fixed .
the hat sees who this chair liked .	the hat sees that this chair liked .
these forks remember what the bag makes .	these forks remember that the bag makes .
those glasses know who the plates confused .	those glasses know that the plates confused .
that fork noticed who this truck likes .	that fork noticed that this truck likes .
the bowl could remember who the mall wo n't appreciate .	the bowl could remember that the mall wo n't appreciate .
this bed had noticed what these boxes find .	this bed had noticed that these boxes find .
those spoons have known what the bag makes .	those spoons have known that the bag makes .
this chair had seen who those doors praise .	this chair had seen that those doors praise .
this ring did n't realize who that car should n't like .	this ring did n't realize that that car should n't like .
those pictures forgot what those chairs took .	those pictures forgot that those chairs took .
this cup can know who the toy has liked .	this cup can know that the toy has liked .
those glasses have seen what these cups take .	those glasses have seen that these cups take .
the cup might remember what that ring can n't fix .	the cup might remember that that ring can n't fix .
this car learned what these schools wo n't hold .	this car learned that these schools wo n't hold .
the books saw what the candle kept .	the books saw that the candle kept .
the bowls can n't notice who those pictures should n't bother .	the bowls can n't notice that those pictures should n't bother .
those shoes realize who that couch had n't scared .	those shoes realize that that couch had n't scared .
the car had realized what these shoes keep .	the car had realized that these shoes keep .
those dolls had n't known who those books are bothering .	those dolls had n't known that those books are bothering .
this couch realized what this candle had n't found .	this couch realized that this candle had n't found .
the boat can n't see who the glasses will praise .	the boat can n't see that the glasses will praise .
the window can n't forget what these doors have n't brought .	the window can n't forget that these doors have n't brought .
the couch did n't forget what the bag did n't keep .	the couch did n't forget that the bag did n't keep .
those plates knew what this school could n't fix .	those plates knew that this school could n't fix .
the bowls noticed what this window was taking .	the bowls noticed that this window was taking .
these candles did n't know what that door has taken .	these candles did n't know that that door has taken .
those books remembered what those boats held .	those books remembered that those boats held .
this bicycle does n't forget who the boats would n't scare .	this bicycle does n't forget that the boats would n't scare .
that bottle saw who this chair will bother .	that bottle saw that this chair will bother .
that plate has n't noticed what those bags bought .	that plate has n't noticed that those bags bought .
the cups may notice what that bed made .	the cups may notice that that bed made .
these cars realized what this bicycle might keep .	these cars realized that this bicycle might keep .
these buttons forget who the cups would n't hate .	these buttons forget that the cups would n't hate .
the glass could see who the truck has scared .	the glass could see that the truck has scared .
that button knows what the couch is holding .	that button knows that the couch is holding .
those candles noticed what these bags can buy .	those candles noticed that these bags can buy .
the chairs forget what those pictures are n't taking .	the chairs forget that those pictures are n't taking .
these cars forgot who this boat did n't appreciate .	these cars forgot that this boat did n't appreciate .
the button learned what those spoons had n't taken .	the button learned that those spoons had n't taken .
these beds have n't remembered what these pictures were taking .	these beds have n't remembered that these pictures were taking .
these toys may forget who the crayons should n't hate .	these toys may forget that the crayons should n't hate .
this shirt would n't see who these forks hate .	this shirt would n't see that these forks hate .
