those spoons wo n't learn who this room who can n't find the doctors has scared .	those spoons wo n't learn that this room who can n't find the doctors has scared .
these trucks learned who the park who heard these forks likes .	these trucks learned that the park who heard these forks likes .
this spoon has n't noticed what the plane who made the adult had n't brought .	this spoon has n't noticed that the plane who made the adult had n't brought .
the spoon had n't known who these cars who have laughed like .	the spoon had n't known that these cars who have laughed like .
this shoe might remember what those toys who this fork heard are n't holding .	this shoe might remember that those toys who this fork heard are n't holding .
this book learned who those plates who lie have confused .	this book learned that those plates who lie have confused .
those dishes could n't forget what those windows who would n't lift those guys took .	those dishes could n't forget that those windows who would n't lift those guys took .
the bowls realize what this bag who that bed has n't heard did n't fix .	the bowls realize that this bag who that bed has n't heard did n't fix .
this glass noticed what this mirror who should n't know that shirt keeps .	this glass noticed that this mirror who should n't know that shirt keeps .
that bed realized what the boats who exercise keep .	that bed realized that the boats who exercise keep .
these books can n't learn what these bottles who did n't hear those schools make .	these books can n't learn that these bottles who did n't hear those schools make .
this door sees who those windows who know those windows were n't bothering .	this door sees that those windows who know those windows were n't bothering .
the bags would know what the park who is painting found .	the bags would know that the park who is painting found .
this plane can n't learn who those chairs who these dolls can hear bothered .	this plane can n't learn that those chairs who these dolls can hear bothered .
the candles see what the buttons who were n't bringing the ladies had brought .	the candles see that the buttons who were n't bringing the ladies had brought .
the cars had n't seen what that plane who knew that library held .	the cars had n't seen that that plane who knew that library held .
those spoons had n't noticed who this box who is n't laughing does n't like .	those spoons had n't noticed that this box who is n't laughing does n't like .
these bowls knew who the kitchen who had talked should n't bother .	these bowls knew that the kitchen who had talked should n't bother .
the spoons can n't learn who the fork who has those people confused .	the spoons can n't learn that the fork who has those people confused .
these boats do n't notice who the dish who has n't thrown the patient does n't bother .	these boats do n't notice that the dish who has n't thrown the patient does n't bother .
these hats realize what the mirror who heard those hats was keeping .	these hats realize that the mirror who heard those hats was keeping .
these glasses learned what that restaurant who read should fix .	these glasses learned that that restaurant who read should fix .
those doors saw what those chairs who practice keep .	those doors saw that those chairs who practice keep .
these windows should learn what the boats who had n't heard the door are making .	these windows should learn that the boats who had n't heard the door are making .
the hat had seen what that bowl who did n't cough will sell .	the hat had seen that that bowl who did n't cough will sell .
the books do n't remember who the picture who talked confused .	the books do n't remember that the picture who talked confused .
the bed remembered what this bowl who these bags should hear has n't kept .	the bed remembered that this bowl who these bags should hear has n't kept .
these boats forgot what the ship who will talk made .	these boats forgot that the ship who will talk made .
this crayon must learn what the boat who waved had fixed .	this crayon must learn that the boat who waved had fixed .
these hats learned who the fork who the spoon has heard liked .	these hats learned that the fork who the spoon has heard liked .
the trucks know what that room who has n't heard the rooms might keep .	the trucks know that that room who has n't heard the rooms might keep .
those books wo n't realize what those bottles who the museum hears have kept .	those books wo n't realize that those bottles who the museum hears have kept .
these pictures learn who the mirror who the dolls would hear might praise .	these pictures learn that the mirror who the dolls would hear might praise .
the forks remembered what these rings who the shoes hear fix .	the forks remembered that these rings who the shoes hear fix .
the cups noticed what the bed who is keeping the boys found .	the cups noticed that the bed who is keeping the boys found .
this button had remembered who the shirt who this restaurant knows has n't bothered .	this button had remembered that the shirt who this restaurant knows has n't bothered .
this box can n't learn what the dishes who painted find .	this box can n't learn that the dishes who painted find .
the rings remember what that dish who has n't won was holding .	the rings remember that that dish who has n't won was holding .
the button knew what that boat who hears these schools will take .	the button knew that that boat who hears these schools will take .
the bowl has n't learned what the cups who those schools could know have kept .	the bowl has n't learned that the cups who those schools could know have kept .
that book noticed who that library who has waved does n't scare .	that book noticed that that library who has waved does n't scare .
those dolls have learned what that spoon who would n't move this patient had held .	those dolls have learned that that spoon who would n't move this patient had held .
the shirts can notice who the mirror who the museum has n't heard had confused .	the shirts can notice that the mirror who the museum has n't heard had confused .
these crayons could n't learn what this mirror who has dropped that driver has n't fixed .	these crayons could n't learn that this mirror who has dropped that driver has n't fixed .
these cups know who that hospital who talked is n't bothering .	these cups know that that hospital who talked is n't bothering .
that window forgot what the toys who stretch fixed .	that window forgot that the toys who stretch fixed .
the car might notice what those boats who know this bank have n't bought .	the car might notice that those boats who know this bank have n't bought .
the toys knew what that bank who might fix the women was n't buying .	the toys knew that that bank who might fix the women was n't buying .
those cars remembered who that chair who can n't lose those women might bother .	those cars remembered that that chair who can n't lose those women might bother .
this truck could forget what the chairs who this door hears sell .	this truck could forget that the chairs who this door hears sell .
this glass has n't learned what that candle who read had n't taken .	this glass has n't learned that that candle who read had n't taken .
the plane knows who the buttons who take the adult hate .	the plane knows that the buttons who take the adult hate .
these cars can remember what that kitchen who that kitchen had heard kept .	these cars can remember that that kitchen who that kitchen had heard kept .
this rug could n't know what this candle who this park knew is n't fixing .	this rug could n't know that this candle who this park knew is n't fixing .
these doors saw who this car who should hear that window liked .	these doors saw that this car who should hear that window liked .
this picture has noticed what these cars who heard this crayon buy .	this picture has noticed that these cars who heard this crayon buy .
that door remembered who the cups who are n't reading scared .	that door remembered that the cups who are n't reading scared .
this ring can forget who this fork who read has confused .	this ring can forget that this fork who read has confused .
that plate has learned what these windows who hear those schools will buy .	that plate has learned that these windows who hear those schools will buy .
the mirror sees what this door who read brings .	the mirror sees that this door who read brings .
the candle could see what this toy who knew the fork had taken .	the candle could see that this toy who knew the fork had taken .
those cars would forget who the schools who sang scare .	those cars would forget that the schools who sang scare .
the car knows what that candle who has n't waved took .	the car knows that that candle who has n't waved took .
this door could forget who those spoons who were holding the guy would praise .	this door could forget that those spoons who were holding the guy would praise .
those chairs would n't realize what these glasses who had n't bought this boy were n't taking .	those chairs would n't realize that these glasses who had n't bought this boy were n't taking .
these shirts learn who these bags who should n't know those crayons would like .	these shirts learn that these bags who should n't know those crayons would like .
that bicycle had n't noticed what that bowl who knew those doors keeps .	that bicycle had n't noticed that that bowl who knew those doors keeps .
those dolls realized who the box who waves had n't liked .	those dolls realized that the box who waves had n't liked .
those bottles remember what the bags who are n't bringing the people steal .	those bottles remember that the bags who are n't bringing the people steal .
the rug may remember what these shoes who are losing should find .	the rug may remember that these shoes who are losing should find .
this box had n't noticed what these bottles who have found that boy make .	this box had n't noticed that these bottles who have found that boy make .
these dolls had n't known what that library who had cleaned the teachers took .	these dolls had n't known that that library who had cleaned the teachers took .
the windows have n't noticed who this cup who knows that ring liked .	the windows have n't noticed that this cup who knows that ring liked .
those boats know what these cups who were n't talking should find .	those boats know that these cups who were n't talking should find .
these bowls noticed what the plate who would cry was n't keeping .	these bowls noticed that the plate who would cry was n't keeping .
the doors learn what this doll who brought the teachers was keeping .	the doors learn that this doll who brought the teachers was keeping .
these trucks realized what the ring who is n't waving kept .	these trucks realized that the ring who is n't waving kept .
this car noticed who those rings who talk hate .	this car noticed that those rings who talk hate .
the bag knows what that book who the books would n't know has taken .	the bag knows that that book who the books would n't know has taken .
this crayon had n't known who those cars who that ship has n't heard have n't bothered .	this crayon had n't known that those cars who that ship has n't heard have n't bothered .
the window saw what that rug who talks brought .	the window saw that that rug who talks brought .
these boats should n't forget what this ring who has the doctors is bringing .	these boats should n't forget that this ring who has the doctors is bringing .
the picture remembered who the restaurant who throws the man likes .	the picture remembered that the restaurant who throws the man likes .
these books remembered what that box who knew this rocket has fixed .	these books remembered that that box who knew this rocket has fixed .
that bottle remembered what that glass who lost the boys had n't bought .	that bottle remembered that that glass who lost the boys had n't bought .
that ring should remember who those books who those schools had heard hate .	that ring should remember that those books who those schools had heard hate .
this bag had learned what the toys who might cough find .	this bag had learned that the toys who might cough find .
the glass had n't noticed who this window who was reading liked .	the glass had n't noticed that this window who was reading liked .
the bicycle remembered who the dolls who heard the hat have n't liked .	the bicycle remembered that the dolls who heard the hat have n't liked .
the spoon had n't known what the window who was n't practicing will steal .	the spoon had n't known that the window who was n't practicing will steal .
those chairs have n't learned what the spoon who holds those people can buy .	those chairs have n't learned that the spoon who holds those people can buy .
these books have n't learned what this book who the chair hears made .	these books have n't learned that this book who the chair hears made .
this truck realized who that plane who knows that hat confused .	this truck realized that that plane who knows that hat confused .
this cup knew who that room who had n't heard this bottle should praise .	this cup knew that that room who had n't heard this bottle should praise .
this dish learned what these doors who had heard this room bring .	this dish learned that these doors who had heard this room bring .
these shoes have n't known who those forks who have n't yelled have confused .	these shoes have n't known that those forks who have n't yelled have confused .
the bowl sees what these toys who won fixed .	the bowl sees that these toys who won fixed .
those windows have noticed what the shirt who may yell had n't held .	those windows have noticed that the shirt who may yell had n't held .
the cars knew what the rings who have n't heard that window bought .	the cars knew that the rings who have n't heard that window bought .
those boxes have n't known what that toy who did n't talk was n't making .	those boxes have n't known that that toy who did n't talk was n't making .
the books can n't learn what the boxes who cry are n't buying .	the books can n't learn that the boxes who cry are n't buying .
this bottle noticed what those boxes who shake the teachers can n't hold .	this bottle noticed that those boxes who shake the teachers can n't hold .
the shoes forget what the museum who has n't lost the people made .	the shoes forget that the museum who has n't lost the people made .
that toy had seen who those candles who whisper had n't bothered .	that toy had seen that those candles who whisper had n't bothered .
these spoons notice what the room who those cups knew makes .	these spoons notice that the room who those cups knew makes .
this bowl knows what these toys who throw these women kept .	this bowl knows that these toys who throw these women kept .
those crayons wo n't know what that shoe who the plates hear could n't take .	those crayons wo n't know that that shoe who the plates hear could n't take .
that button may know who the bowls who that glass hears can n't praise .	that button may know that the bowls who that glass hears can n't praise .
this door had n't learned who the library who has heard that cup bothered .	this door had n't learned that the library who has heard that cup bothered .
those cars can forget what those dishes who wo n't sneeze bought .	those cars can forget that those dishes who wo n't sneeze bought .
the bottle learned what these dolls who would n't lie may bring .	the bottle learned that these dolls who would n't lie may bring .
that glass would n't notice who the bicycle who may cough scares .	that glass would n't notice that the bicycle who may cough scares .
that box had known who those trucks who could n't buy these boys like .	that box had known that those trucks who could n't buy these boys like .
the bed has known who these hats who sang have n't confused .	the bed has known that these hats who sang have n't confused .
the beds must realize what those candles who bring this customer were fixing .	the beds must realize that those candles who bring this customer were fixing .
that bag forgot what those bottles who have n't laughed kept .	that bag forgot that those bottles who have n't laughed kept .
the candles forget what that bank who had n't heard this button would fix .	the candles forget that that bank who had n't heard this button would fix .
those cars had learned what that crayon who does n't fix the queen held .	those cars had learned that that crayon who does n't fix the queen held .
this truck had n't remembered who the fork who knows the kitchen can like .	this truck had n't remembered that the fork who knows the kitchen can like .
the shoes forgot what those buttons who would n't hear this mall keep .	the shoes forgot that those buttons who would n't hear this mall keep .
the boats would forget what those shoes who had lost could steal .	the boats would forget that those shoes who had lost could steal .
these trucks had n't learned what these doors who had n't fixed that patient have brought .	these trucks had n't learned that these doors who had n't fixed that patient have brought .
the cars forget what those windows who found the man keep .	the cars forget that those windows who found the man keep .
the plate has n't seen what those crayons who would n't hear this mirror would n't steal .	the plate has n't seen that those crayons who would n't hear this mirror would n't steal .
the plates forget who this dish who should smile can n't praise .	the plates forget that this dish who should smile can n't praise .
these dolls noticed what that spoon who won brought .	these dolls noticed that that spoon who won brought .
the candles might forget what the hospital who had heard those schools was keeping .	the candles might forget that the hospital who had heard those schools was keeping .
those cars realize who this truck who must throw that teacher would n't hate .	those cars realize that this truck who must throw that teacher would n't hate .
those plates have noticed what this fork who the library knew is finding .	those plates have noticed that this fork who the library knew is finding .
these bowls did n't see what those cars who would know these dishes have n't made .	these bowls did n't see that those cars who would know these dishes have n't made .
the doors could know who this doll who hears that mirror scares .	the doors could know that this doll who hears that mirror scares .
those beds do n't notice what these forks who won steal .	those beds do n't notice that these forks who won steal .
these books have n't realized what the truck who was n't crying is n't finding .	these books have n't realized that the truck who was n't crying is n't finding .
that book had n't known what those boxes who knew those rooms were holding .	that book had n't known that those boxes who knew those rooms were holding .
that ring had n't seen who this cup who must keep the king can scare .	that ring had n't seen that this cup who must keep the king can scare .
these hats remember what the cups who are yelling are making .	these hats remember that the cups who are yelling are making .
those chairs can learn who the windows who that school hears hate .	those chairs can learn that the windows who that school hears hate .
that hat might realize what those cars who the glasses know have found .	that hat might realize that those cars who the glasses know have found .
that bed learned what that car who is n't making that customer would n't steal .	that bed learned that that car who is n't making that customer would n't steal .
the window can realize who those crayons who are n't painting liked .	the window can realize that those crayons who are n't painting liked .
those pictures noticed what the dish who had n't talked takes .	those pictures noticed that the dish who had n't talked takes .
this bag remembered what that kitchen who brought these children was n't holding .	this bag remembered that that kitchen who brought these children was n't holding .
these doors realized what the bottles who had n't made the teachers could n't fix .	these doors realized that the bottles who had n't made the teachers could n't fix .
that book had n't remembered who those cups who had n't heard those cups scare .	that book had n't remembered that those cups who had n't heard those cups scare .
the trucks would n't remember who that rocket who this box hears scared .	the trucks would n't remember that that rocket who this box hears scared .
this bicycle has n't noticed who the shoe who is losing does n't scare .	this bicycle has n't noticed that the shoe who is losing does n't scare .
the toys had noticed who those buttons who have heard that window praise .	the toys had noticed that those buttons who have heard that window praise .
this bottle knows what the dish who this book had n't heard held .	this bottle knows that the dish who this book had n't heard held .
the shirts can n't remember what those hats who sell the person have n't bought .	the shirts can n't remember that those hats who sell the person have n't bought .
these boats could remember what this bicycle who was buying these women takes .	these boats could remember that this bicycle who was buying these women takes .
this spoon had seen who the cars who have painted had bothered .	this spoon had seen that the cars who have painted had bothered .
this bowl has realized what the doll who stole the men had bought .	this bowl has realized that the doll who stole the men had bought .
that boat might learn who that bank who talks had bothered .	that boat might learn that that bank who talks had bothered .
those shoes wo n't see what the bottle who is n't smiling found .	those shoes wo n't see that the bottle who is n't smiling found .
the glasses could see who that chair who will sell that doctor scared .	the glasses could see that that chair who will sell that doctor scared .
those shoes forgot what those toys who knew that spoon kept .	those shoes forgot that those toys who knew that spoon kept .
this shirt noticed what those spoons who kept the ladies are fixing .	this shirt noticed that those spoons who kept the ladies are fixing .
the candle had seen what these beds who hear this picture took .	the candle had seen that these beds who hear this picture took .
this truck realized what this button who those shirts knew took .	this truck realized that this button who those shirts knew took .
the beds remember what that shoe who that truck knows took .	the beds remember that that shoe who that truck knows took .
these bottles know who the couch who knew this button would appreciate .	these bottles know that the couch who knew this button would appreciate .
that truck noticed what that crayon who can n't know the chair has taken .	that truck noticed that that crayon who can n't know the chair has taken .
the boats remembered what this truck who cried has n't brought .	the boats remembered that this truck who cried has n't brought .
these shirts had n't realized what those bottles who this school heard bring .	these shirts had n't realized that those bottles who this school heard bring .
the plane forgot who that bank who has n't read may hate .	the plane forgot that that bank who has n't read may hate .
the candle knows what this ship who did n't read holds .	the candle knows that this ship who did n't read holds .
that chair had known who the candle who has cleaned that child confused .	that chair had known that the candle who has cleaned that child confused .
those boats could n't see what the door who that rocket knew had held .	those boats could n't see that the door who that rocket knew had held .
these buttons remembered what this rocket who is reading takes .	these buttons remembered that this rocket who is reading takes .
those buttons see who these trucks who were screaming scare .	those buttons see that these trucks who were screaming scare .
that bed wo n't know what those shirts who had n't talked would take .	that bed wo n't know that those shirts who had n't talked would take .
the glasses have learned what these dolls who knew that room had n't taken .	the glasses have learned that these dolls who knew that room had n't taken .
the cup had n't realized what the room who sang will sell .	the cup had n't realized that the room who sang will sell .
those forks forgot who those books who laughed scare .	those forks forgot that those books who laughed scare .
the buttons wo n't notice who those glasses who had laughed do n't praise .	the buttons wo n't notice that those glasses who had laughed do n't praise .
this doll did n't learn what the toys who have n't heard these dishes sell .	this doll did n't learn that the toys who have n't heard these dishes sell .
that dish has known who the toys who that spoon heard like .	that dish has known that the toys who that spoon heard like .
the toy saw what those bottles who were losing fix .	the toy saw that those bottles who were losing fix .
this cup has n't noticed who the crayons who hear those cars have n't liked .	this cup has n't noticed that the crayons who hear those cars have n't liked .
the shoes have n't known what the button who has kept the boy must find .	the shoes have n't known that the button who has kept the boy must find .
this door saw what that room who those schools knew has found .	this door saw that that room who those schools knew has found .
the ship did n't realize who this book who the rocket knows would n't appreciate .	the ship did n't realize that this book who the rocket knows would n't appreciate .
those doors knew what these rooms who this chair would know should bring .	those doors knew that these rooms who this chair would know should bring .
the fork does n't learn what these trucks who are n't painting are n't holding .	the fork does n't learn that these trucks who are n't painting are n't holding .
