these buttons had n't noticed what the room who could hear this toy was n't buying .	these buttons had n't noticed that the room who could hear this toy was n't buying .
those boats have realized what that museum who is n't buying these women must hold .	those boats have realized that that museum who is n't buying these women must hold .
that toy has learned what this ring who that toy might hear had brought .	that toy has learned that this ring who that toy might hear had brought .
the plate wo n't learn what the book who has n't heard this school is n't finding .	the plate wo n't learn that the book who has n't heard this school is n't finding .
that couch knows what the buttons who those glasses might know make .	that couch knows that the buttons who those glasses might know make .
that car knows what the park who can take that queen is n't buying .	that car knows that the park who can take that queen is n't buying .
those toys saw what this mirror who was moving the girls has brought .	those toys saw that this mirror who was moving the girls has brought .
the shirts could forget what these shoes who could hear the shirt were n't holding .	the shirts could forget that these shoes who could hear the shirt were n't holding .
those bags have noticed who this school who cries will hate .	those bags have noticed that this school who cries will hate .
this boat can remember who the bed who throws those girls has liked .	this boat can remember that the bed who throws those girls has liked .
that glass should n't know what the boxes who knew the picture kept .	that glass should n't know that the boxes who knew the picture kept .
these doors should n't realize who this bowl who is painting has confused .	these doors should n't realize that this bowl who is painting has confused .
the cups realize what this rug who has n't found this lady will keep .	the cups realize that this rug who has n't found this lady will keep .
this ring had n't remembered who the cars who read had n't bothered .	this ring had n't remembered that the cars who read had n't bothered .
these rings may learn what those shirts who can n't hold those teachers stole .	these rings may learn that those shirts who can n't hold those teachers stole .
the trucks realize what that mall who must cough bought .	the trucks realize that that mall who must cough bought .
the mirror saw what the button who is n't talking should n't fix .	the mirror saw that the button who is n't talking should n't fix .
the shoes have remembered who these spoons who know the plate have scared .	the shoes have remembered that these spoons who know the plate have scared .
this picture knows what the cars who that ship should hear have found .	this picture knows that the cars who that ship should hear have found .
the boxes have n't learned what the crayon who was n't smiling was buying .	the boxes have n't learned that the crayon who was n't smiling was buying .
that chair has n't known who this book who had n't waved scared .	that chair has n't known that this book who had n't waved scared .
those trucks can notice what the dolls who had moved this lady keep .	those trucks can notice that the dolls who had moved this lady keep .
the book has known what the books who should know that hospital can n't keep .	the book has known that the books who should know that hospital can n't keep .
the glasses noticed who this plate who knows the glass liked .	the glasses noticed that this plate who knows the glass liked .
these rings had n't realized who the chairs who make this patient were n't bothering .	these rings had n't realized that the chairs who make this patient were n't bothering .
the bed had n't known what these buttons who lie bought .	the bed had n't known that these buttons who lie bought .
the mirror forgot what this button who talked could n't hold .	the mirror forgot that this button who talked could n't hold .
the shirt has n't realized who the book who could cry should bother .	the shirt has n't realized that the book who could cry should bother .
the bowls can realize who that crayon who is laughing should n't like .	the bowls can realize that that crayon who is laughing should n't like .
the book forgot what the windows who heard the candle steal .	the book forgot that the windows who heard the candle steal .
those beds forgot who the book who sings will scare .	those beds forgot that the book who sings will scare .
this ship realized what this boat who reads can n't fix .	this ship realized that this boat who reads can n't fix .
this candle can notice what that couch who that library can hear holds .	this candle can notice that that couch who that library can hear holds .
that door knows what the cups who cried can buy .	that door knows that the cups who cried can buy .
that bowl forgot what the cup who throws that teacher was n't keeping .	that bowl forgot that the cup who throws that teacher was n't keeping .
these windows remembered what the hospital who is waving could make .	these windows remembered that the hospital who is waving could make .
the cars had remembered what the shirts who this toy hears are n't holding .	the cars had remembered that the shirts who this toy hears are n't holding .
the pictures have known what those rings who must fix those women are n't holding .	the pictures have known that those rings who must fix those women are n't holding .
these pictures had noticed what that school who that door will hear had n't kept .	these pictures had noticed that that school who that door will hear had n't kept .
the car does n't learn who those chairs who lost like .	the car does n't learn that those chairs who lost like .
these doors did n't see what the shoe who the boats heard must fix .	these doors did n't see that the shoe who the boats heard must fix .
the car learned what this car who the fork wo n't hear could n't steal .	the car learned that this car who the fork wo n't hear could n't steal .
that box can n't see who the doors who talk are bothering .	that box can n't see that the doors who talk are bothering .
these chairs would forget who this door who knew the kitchen had bothered .	these chairs would forget that this door who knew the kitchen had bothered .
this fork has n't known what those doors who can smile fixed .	this fork has n't known that those doors who can smile fixed .
those spoons had remembered who this toy who is n't dropping the guy could n't hate .	those spoons had remembered that this toy who is n't dropping the guy could n't hate .
the shirt had n't realized who the cars who hear this bed should appreciate .	the shirt had n't realized that the cars who hear this bed should appreciate .
the truck has learned what that crayon who the library knew bought .	the truck has learned that that crayon who the library knew bought .
these chairs remembered what these shoes who the couch heard hold .	these chairs remembered that these shoes who the couch heard hold .
the bag may learn what that restaurant who would talk might sell .	the bag may learn that that restaurant who would talk might sell .
that shirt can n't remember what the book who is n't crying would fix .	that shirt can n't remember that the book who is n't crying would fix .
the beds have n't known what this box who could exercise is n't fixing .	the beds have n't known that this box who could exercise is n't fixing .
the ring had n't remembered what that restaurant who has laughed is n't finding .	the ring had n't remembered that that restaurant who has laughed is n't finding .
the beds do n't notice what that kitchen who heard these chairs stole .	the beds do n't notice that that kitchen who heard these chairs stole .
those bags forgot what the beds who had n't found the king can n't hold .	those bags forgot that the beds who had n't found the king can n't hold .
these toys should n't forget what those bottles who sneeze had n't bought .	these toys should n't forget that those bottles who sneeze had n't bought .
the toy realized what that candle who has heard these bowls makes .	the toy realized that that candle who has heard these bowls makes .
the chairs had noticed who that room who has lost should n't like .	the chairs had noticed that that room who has lost should n't like .
the door has noticed who those spoons who do n't fix those children had confused .	the door has noticed that those spoons who do n't fix those children had confused .
the candle can learn what the library who could sell the women stole .	the candle can learn that the library who could sell the women stole .
those books saw what that box who was lying is buying .	those books saw that that box who was lying is buying .
those candles have n't realized what the school who that spoon can n't know makes .	those candles have n't realized that the school who that spoon can n't know makes .
the shoe realized who the pictures who are n't shaking the adult have n't liked .	the shoe realized that the pictures who are n't shaking the adult have n't liked .
that box forgot who the books who these schools could hear praise .	that box forgot that the books who these schools could hear praise .
these bowls remembered what the books who the chair should n't hear buy .	these bowls remembered that the books who the chair should n't hear buy .
the door noticed what that bicycle who had n't fixed those ladies will sell .	the door noticed that that bicycle who had n't fixed those ladies will sell .
this doll saw what this ring who has n't waved takes .	this doll saw that this ring who has n't waved takes .
the cars realized what the cups who lost could n't fix .	the cars realized that the cups who lost could n't fix .
those rings learn what the bed who takes that patient can n't sell .	those rings learn that the bed who takes that patient can n't sell .
those cars could n't realize what these cars who drop this lady were making .	those cars could n't realize that these cars who drop this lady were making .
the boats must notice what these cars who the beds heard were n't fixing .	the boats must notice that these cars who the beds heard were n't fixing .
those shirts forgot what the rings who can lie hold .	those shirts forgot that the rings who can lie hold .
those pictures know what the room who paints bought .	those pictures know that the room who paints bought .
this shoe has known what this chair who exercises had n't made .	this shoe has known that this chair who exercises had n't made .
those crayons learned what the bowl who should n't scream is buying .	those crayons learned that the bowl who should n't scream is buying .
these dolls know who this shirt who hears these hats has n't confused .	these dolls know that this shirt who hears these hats has n't confused .
this book will see what this bed who made the adult brought .	this book will see that this bed who made the adult brought .
this ship sees what the glasses who could n't move those ladies sell .	this ship sees that the glasses who could n't move those ladies sell .
those rings realized who this car who the dishes hear confused .	those rings realized that this car who the dishes hear confused .
this dish learned what the beds who lie are n't holding .	this dish learned that the beds who lie are n't holding .
the rocket saw what these candles who the dolls heard are making .	the rocket saw that these candles who the dolls heard are making .
that rocket will notice what these doors who are fixing these doctors stole .	that rocket will notice that these doors who are fixing these doctors stole .
the box has known what the shoes who won were n't bringing .	the box has known that the shoes who won were n't bringing .
this bowl remembered who the mirror who would n't wave bothered .	this bowl remembered that the mirror who would n't wave bothered .
the bag can n't notice who the rooms who are n't yelling could n't scare .	the bag can n't notice that the rooms who are n't yelling could n't scare .
that mirror must notice what the doll who this library should know can n't hold .	that mirror must notice that the doll who this library should know can n't hold .
these spoons knew what the box who was shaking these doctors may buy .	these spoons knew that the box who was shaking these doctors may buy .
the pictures forgot who these crayons who know that hospital could n't appreciate .	the pictures forgot that these crayons who know that hospital could n't appreciate .
the chair had known what the shoes who know that kitchen would n't bring .	the chair had known that the shoes who know that kitchen would n't bring .
those dishes know who the candle who did n't clean those guys had confused .	those dishes know that the candle who did n't clean those guys had confused .
those plates know who the trucks who have kept that customer were n't bothering .	those plates know that the trucks who have kept that customer were n't bothering .
that spoon might remember what the cup who might hold this queen was n't making .	that spoon might remember that the cup who might hold this queen was n't making .
the doll remembered who those buttons who that mall knew bother .	the doll remembered that those buttons who that mall knew bother .
that plate can n't forget what that room who does n't make this dancer brought .	that plate can n't forget that that room who does n't make this dancer brought .
the beds remember who the plane who this book would hear has n't liked .	the beds remember that the plane who this book would hear has n't liked .
these pictures have seen what that room who had n't waved fixed .	these pictures have seen that that room who had n't waved fixed .
that ring had n't realized who the book who the schools have n't heard would n't appreciate .	that ring had n't realized that the book who the schools have n't heard would n't appreciate .
this spoon would know what this truck who the trucks would n't know fixed .	this spoon would know that this truck who the trucks would n't know fixed .
this bed saw who this museum who is n't singing scares .	this bed saw that this museum who is n't singing scares .
those boats had known what that hospital who had laughed brings .	those boats had known that that hospital who had laughed brings .
these bowls could know who that plane who the spoon knew did n't hate .	these bowls could know that that plane who the spoon knew did n't hate .
this truck could know who this truck who had heard this hat should hate .	this truck could know that this truck who had heard this hat should hate .
that crayon had n't realized what that park who can n't find that queen keeps .	that crayon had n't realized that that park who can n't find that queen keeps .
these plates learned what those books who could n't clean that girl bring .	these plates learned that those books who could n't clean that girl bring .
those cars learn what those dolls who had heard this hospital hold .	those cars learn that those dolls who had heard this hospital hold .
the plane learned who those trucks who were n't whispering appreciate .	the plane learned that those trucks who were n't whispering appreciate .
that plane can n't notice who this plane who might steal the person confused .	that plane can n't notice that this plane who might steal the person confused .
these cups noticed what those boats who could n't cry would fix .	these cups noticed that those boats who could n't cry would fix .
the toy could n't remember who that window who the bed knew had bothered .	the toy could n't remember that that window who the bed knew had bothered .
the shirts had n't realized who this museum who should n't scream has n't scared .	the shirts had n't realized that this museum who should n't scream has n't scared .
that ship would learn what those pictures who should clean that queen had found .	that ship would learn that those pictures who should clean that queen had found .
the dishes forget what those schools who shake these boys might find .	the dishes forget that those schools who shake these boys might find .
these shoes know what this kitchen who has the woman had bought .	these shoes know that this kitchen who has the woman had bought .
the window realized what those rings who do n't sing had n't brought .	the window realized that those rings who do n't sing had n't brought .
the bag can n't remember what that window who waved found .	the bag can n't remember that that window who waved found .
the glasses remembered what the spoons who these hats have n't heard have kept .	the glasses remembered that the spoons who these hats have n't heard have kept .
the button noticed what those buttons who are crying could take .	the button noticed that those buttons who are crying could take .
those dolls knew who this plate who has heard the picture might praise .	those dolls knew that this plate who has heard the picture might praise .
the bottle has remembered what the cups who shook that dancer were keeping .	the bottle has remembered that the cups who shook that dancer were keeping .
that ship had seen who that fork who that window heard can praise .	that ship had seen that that fork who that window heard can praise .
these books learn who the hat who could n't fix the women wo n't scare .	these books learn that the hat who could n't fix the women wo n't scare .
those spoons realize who that car who those dishes had n't heard was bothering .	those spoons realize that that car who those dishes had n't heard was bothering .
the door may notice what the dishes who take that patient might steal .	the door may notice that the dishes who take that patient might steal .
the shirt had n't learned what these schools who did n't stretch were n't buying .	the shirt had n't learned that these schools who did n't stretch were n't buying .
those bottles learned who the cups who yelled hate .	those bottles learned that the cups who yelled hate .
those crayons saw what the bowls who knew that shirt had n't taken .	those crayons saw that the bowls who knew that shirt had n't taken .
the cars do n't know who these bowls who hear this picture appreciate .	the cars do n't know that these bowls who hear this picture appreciate .
this hat had learned what that plane who has talked did n't find .	this hat had learned that that plane who has talked did n't find .
those cars might learn who the cars who lost have n't liked .	those cars might learn that the cars who lost have n't liked .
these dolls realize what the toys who heard these schools found .	these dolls realize that the toys who heard these schools found .
those windows should notice what the boat who was n't moving the guy will buy .	those windows should notice that the boat who was n't moving the guy will buy .
the toy remembered what these plates who lost that patient find .	the toy remembered that these plates who lost that patient find .
the bags have realized what this car who the mirror does n't hear keeps .	the bags have realized that this car who the mirror does n't hear keeps .
these candles had n't noticed what the restaurant who the toys have n't heard is n't buying .	these candles had n't noticed that the restaurant who the toys have n't heard is n't buying .
that chair noticed who the restaurant who moves those doctors likes .	that chair noticed that the restaurant who moves those doctors likes .
those bags notice what the bag who will exercise has n't fixed .	those bags notice that the bag who will exercise has n't fixed .
these boats may see what that bicycle who has n't thrown that queen should keep .	these boats may see that that bicycle who has n't thrown that queen should keep .
this crayon could n't remember what the mall who paints has made .	this crayon could n't remember that the mall who paints has made .
the bottles had n't realized what this chair who waves was finding .	the bottles had n't realized that this chair who waves was finding .
the doll knows what the shirt who has n't cried may take .	the doll knows that the shirt who has n't cried may take .
these dishes would n't know what the glasses who are losing this man keep .	these dishes would n't know that the glasses who are losing this man keep .
these boxes remember what these forks who took that dentist make .	these boxes remember that these forks who took that dentist make .
the bottles remember what this crayon who yelled wo n't take .	the bottles remember that this crayon who yelled wo n't take .
this mirror noticed what that bottle who would n't sing was n't fixing .	this mirror noticed that that bottle who would n't sing was n't fixing .
these chairs noticed who these candles who have n't waved have scared .	these chairs noticed that these candles who have n't waved have scared .
this plate must see what these cups who did n't sneeze could n't buy .	this plate must see that these cups who did n't sneeze could n't buy .
those cars have noticed who the boats who know that plate like .	those cars have noticed that the boats who know that plate like .
these candles had n't learned who those books who had talked can appreciate .	these candles had n't learned that those books who had talked can appreciate .
those books had known what that hat who would n't stretch should n't hold .	those books had known that that hat who would n't stretch should n't hold .
these bags forgot what those dishes who lost this woman steal .	these bags forgot that those dishes who lost this woman steal .
the chairs remembered what those boxes who take those doctors can n't buy .	the chairs remembered that those boxes who take those doctors can n't buy .
the doll has n't known who this picture who did n't drop this woman did n't like .	the doll has n't known that this picture who did n't drop this woman did n't like .
these hats learn what that bicycle who exercises kept .	these hats learn that that bicycle who exercises kept .
the crayon must notice who these books who could talk like .	the crayon must notice that these books who could talk like .
these hats would n't know who these windows who are n't dropping those children had bothered .	these hats would n't know that these windows who are n't dropping those children had bothered .
this bed knows what this ring who must win brings .	this bed knows that this ring who must win brings .
the shoes learn who this rocket who makes this boy should n't scare .	the shoes learn that this rocket who makes this boy should n't scare .
those boats can n't forget who those beds who can n't have the customer are bothering .	those boats can n't forget that those beds who can n't have the customer are bothering .
that car had n't seen who the dishes who that mall does n't know can bother .	that car had n't seen that the dishes who that mall does n't know can bother .
the cars learned what this truck who found these girls brings .	the cars learned that this truck who found these girls brings .
the cars remembered who that glass who the plate heard will scare .	the cars remembered that that glass who the plate heard will scare .
the ship had n't learned who these bags who should hear this book hate .	the ship had n't learned that these bags who should hear this book hate .
the car had n't remembered what this bowl who wo n't hold that patient was n't finding .	the car had n't remembered that this bowl who wo n't hold that patient was n't finding .
these windows saw who this school who moved these teachers was bothering .	these windows saw that this school who moved these teachers was bothering .
these glasses could n't remember what the car who the school should n't know was buying .	these glasses could n't remember that the car who the school should n't know was buying .
these beds had n't known who these schools who wave have confused .	these beds had n't known that these schools who wave have confused .
the bowls would notice what that shoe who that chair knows should buy .	the bowls would notice that that shoe who that chair knows should buy .
these bags have n't learned who those bottles who know the truck liked .	these bags have n't learned that those bottles who know the truck liked .
that bowl wo n't notice what this bowl who that rocket knew was making .	that bowl wo n't notice that this bowl who that rocket knew was making .
these trucks had n't noticed who these cars who know the bag have liked .	these trucks had n't noticed that these cars who know the bag have liked .
these dishes saw who the toys who moved this teacher scare .	these dishes saw that the toys who moved this teacher scare .
the box knew what the bed who this plate heard kept .	the box knew that the bed who this plate heard kept .
these toys notice who that candle who will sell that customer was bothering .	these toys notice that that candle who will sell that customer was bothering .
these trucks have n't realized what the mirror who was n't lying is n't fixing .	these trucks have n't realized that the mirror who was n't lying is n't fixing .
these bottles have n't remembered what the ring who the pictures hear had n't bought .	these bottles have n't remembered that the ring who the pictures hear had n't bought .
the cars realized what that museum who the ship hears has brought .	the cars realized that that museum who the ship hears has brought .
the forks had n't noticed what these chairs who paint fixed .	the forks had n't noticed that these chairs who paint fixed .
the box can n't notice what the plate who would win had n't found .	the box can n't notice that the plate who would win had n't found .
the bowls will remember what these bags who should know those buttons stole .	the bowls will remember that these bags who should know those buttons stole .
that rocket forgot what these windows who were n't cleaning the doctor had found .	that rocket forgot that these windows who were n't cleaning the doctor had found .
the chair sees what that room who should n't read makes .	the chair sees that that room who should n't read makes .
