the buttons can n't remember what this couch has taken .	the buttons can n't remember that this couch has taken .
this bag noticed what these forks buy .	this bag noticed that these forks buy .
those books noticed what those trucks made .	those books noticed that those trucks made .
this car might know what that room does n't make .	this car might know that that room does n't make .
those dishes forgot what the ring stole .	those dishes forgot that the ring stole .
that bottle had known what the ring took .	that bottle had known that the ring took .
those dolls should know what that hat may fix .	those dolls should know that that hat may fix .
that book has seen who the bottles should appreciate .	that book has seen that the bottles should appreciate .
the rocket has n't remembered what this window may fix .	the rocket has n't remembered that this window may fix .
those shoes had n't realized what that crayon does n't hold .	those shoes had n't realized that that crayon does n't hold .
this mirror sees what that hospital takes .	this mirror sees that that hospital takes .
this car realized what the crayons buy .	this car realized that the crayons buy .
these glasses remembered what the pictures buy .	these glasses remembered that the pictures buy .
the crayons realize who those rings may hate .	the crayons realize that those rings may hate .
these boats noticed who this chair has n't liked .	these boats noticed that this chair has n't liked .
those books realized what this car fixed .	those books realized that this car fixed .
this car can n't forget what these bottles have made .	this car can n't forget that these bottles have made .
those spoons have n't learned what those beds would n't keep .	those spoons have n't learned that those beds would n't keep .
these rings forget who the plates have confused .	these rings forget that the plates have confused .
the dolls forgot what these shirts are n't keeping .	the dolls forgot that these shirts are n't keeping .
the chairs might know what the kitchen has n't held .	the chairs might know that the kitchen has n't held .
those toys could notice what these rooms are n't keeping .	those toys could notice that these rooms are n't keeping .
these chairs had n't remembered what that window must bring .	these chairs had n't remembered that that window must bring .
those dolls must learn what those pictures have n't kept .	those dolls must learn that those pictures have n't kept .
those dolls could know what that car must sell .	those dolls could know that that car must sell .
the windows might forget what these books hold .	the windows might forget that these books hold .
those cars should know who this rug scares .	those cars should know that this rug scares .
the boat knows what the boxes find .	the boat knows that the boxes find .
this book does n't remember who the car has n't liked .	this book does n't remember that the car has n't liked .
those chairs had n't realized what the rooms should n't find .	those chairs had n't realized that the rooms should n't find .
this window sees what this truck is taking .	this window sees that this truck is taking .
the plane has noticed who the boats could like .	the plane has noticed that the boats could like .
that plane did n't see who those bottles have confused .	that plane did n't see that those bottles have confused .
those plates have seen who those boats had n't scared .	those plates have seen that those boats had n't scared .
the glasses knew what the bicycle brings .	the glasses knew that the bicycle brings .
these bowls knew who these boats do n't like .	these bowls knew that these boats do n't like .
the rings should see what that box takes .	the rings should see that that box takes .
that doll realized what that glass might make .	that doll realized that that glass might make .
this picture had realized what that bag was n't buying .	this picture had realized that that bag was n't buying .
these chairs had realized what the dolls would find .	these chairs had realized that the dolls would find .
this spoon may know what that hospital has n't taken .	this spoon may know that that hospital has n't taken .
this bottle must notice who that kitchen liked .	this bottle must notice that that kitchen liked .
that couch learned what those books might fix .	that couch learned that those books might fix .
the cars forgot what those buttons are n't taking .	the cars forgot that those buttons are n't taking .
the cars forgot what this bed can steal .	the cars forgot that this bed can steal .
that spoon knew what those glasses should steal .	that spoon knew that those glasses should steal .
the toy has learned what this plane may hold .	the toy has learned that this plane may hold .
the books forgot what that plane could fix .	the books forgot that that plane could fix .
the bowl has n't realized what the hat made .	the bowl has n't realized that the hat made .
this button knew who these bowls scared .	this button knew that these bowls scared .
that picture wo n't learn what this crayon should steal .	that picture wo n't learn that this crayon should steal .
that bed knew what the spoon takes .	that bed knew that the spoon takes .
the cup realized who the school could hate .	the cup realized that the school could hate .
the spoons had n't realized what the book took .	the spoons had n't realized that the book took .
this chair must notice what the fork makes .	this chair must notice that the fork makes .
those dishes know what the school can buy .	those dishes know that the school can buy .
this plate had noticed what that rocket keeps .	this plate had noticed that that rocket keeps .
these hats knew what this doll has taken .	these hats knew that this doll has taken .
these trucks noticed who this truck was bothering .	these trucks noticed that this truck was bothering .
the toys forgot who that plate liked .	the toys forgot that that plate liked .
the plate has n't known what that bag could fix .	the plate has n't known that that bag could fix .
that box had n't known who these boxes are n't bothering .	that box had n't known that these boxes are n't bothering .
those books could n't notice what that dish was keeping .	those books could n't notice that that dish was keeping .
these shoes remember who this rug can hate .	these shoes remember that this rug can hate .
those trucks could know what the dishes had brought .	those trucks could know that the dishes had brought .
this button knows what the school keeps .	this button knows that the school keeps .
the beds will see what these crayons have n't kept .	the beds will see that these crayons have n't kept .
the books had n't known what those books have n't taken .	the books had n't known that those books have n't taken .
these bottles can learn what the bowl makes .	these bottles can learn that the bowl makes .
these toys learn who the chairs like .	these toys learn that the chairs like .
those candles do n't learn what the plate kept .	those candles do n't learn that the plate kept .
the ship knew who these cars should hate .	the ship knew that these cars should hate .
that fork sees who the fork likes .	that fork sees that the fork likes .
that cup learned what these beds buy .	that cup learned that these beds buy .
those cars forget who those plates praise .	those cars forget that those plates praise .
these toys might remember what the cup made .	these toys might remember that the cup made .
the cars notice what the bed was taking .	the cars notice that the bed was taking .
that bed can n't see who the spoon can n't bother .	that bed can n't see that the spoon can n't bother .
the glass knows what the cup was bringing .	the glass knows that the cup was bringing .
this box noticed what this school would bring .	this box noticed that this school would bring .
those rings could n't see who the cars have scared .	those rings could n't see that the cars have scared .
those shirts realized who this mall scares .	those shirts realized that this mall scares .
the crayons notice what this book had n't kept .	the crayons notice that this book had n't kept .
the toys could n't notice who this toy will hate .	the toys could n't notice that this toy will hate .
the dishes had n't seen what this toy can sell .	the dishes had n't seen that this toy can sell .
the rings do n't learn who those beds have n't scared .	the rings do n't learn that those beds have n't scared .
those bags noticed what those doors are bringing .	those bags noticed that those doors are bringing .
this bed had noticed who those books have liked .	this bed had noticed that those books have liked .
that mirror knew what that car wo n't find .	that mirror knew that that car wo n't find .
those forks had noticed what the chair holds .	those forks had noticed that the chair holds .
this window must know what those bowls fix .	this window must know that those bowls fix .
these hats have learned what the boats steal .	these hats have learned that the boats steal .
that ship had n't learned what the forks brought .	that ship had n't learned that the forks brought .
these toys have remembered what that dish brought .	these toys have remembered that that dish brought .
this boat had n't known what this crayon holds .	this boat had n't known that this crayon holds .
the dolls forget what this candle would take .	the dolls forget that this candle would take .
these bowls should n't learn what those candles bought .	these bowls should n't learn that those candles bought .
this bowl did n't notice who this dish liked .	this bowl did n't notice that this dish liked .
the candles have n't remembered what the beds took .	the candles have n't remembered that the beds took .
this window had seen what these shoes hold .	this window had seen that these shoes hold .
these dolls knew what that plane had fixed .	these dolls knew that that plane had fixed .
the shoe knew who these schools liked .	the shoe knew that these schools liked .
this shoe might realize what these spoons fixed .	this shoe might realize that these spoons fixed .
this bicycle had learned what these beds make .	this bicycle had learned that these beds make .
those bags have noticed who those candles appreciate .	those bags have noticed that those candles appreciate .
these shirts could see what these crayons did n't find .	these shirts could see that these crayons did n't find .
these boxes have seen what that car takes .	these boxes have seen that that car takes .
those plates forgot what that restaurant should n't fix .	those plates forgot that that restaurant should n't fix .
that car would n't see what that book is bringing .	that car would n't see that that book is bringing .
the forks see what the glass had brought .	the forks see that the glass had brought .
this car saw who the picture could n't bother .	this car saw that the picture could n't bother .
those chairs have n't learned what this hospital kept .	those chairs have n't learned that this hospital kept .
the windows realize who those dolls hate .	the windows realize that those dolls hate .
the beds noticed who this school liked .	the beds noticed that this school liked .
those windows learn what those dishes were buying .	those windows learn that those dishes were buying .
the spoon did n't see what that dish bought .	the spoon did n't see that that dish bought .
the glasses know who that dish has n't bothered .	the glasses know that that dish has n't bothered .
these bags realize who the bottle will scare .	these bags realize that the bottle will scare .
these crayons saw what the room bought .	these crayons saw that the room bought .
the books do n't forget who these doors had n't bothered .	the books do n't forget that these doors had n't bothered .
those books noticed what the plate is n't fixing .	those books noticed that the plate is n't fixing .
these doors might forget what the crayons may keep .	these doors might forget that the crayons may keep .
those candles may notice what those rings had held .	those candles may notice that those rings had held .
the boxes notice what those doors stole .	the boxes notice that those doors stole .
this truck learned who those crayons like .	this truck learned that those crayons like .
that plate does n't learn what the chairs stole .	that plate does n't learn that the chairs stole .
the toy may remember what that museum makes .	the toy may remember that that museum makes .
those forks do n't see what that kitchen held .	those forks do n't see that that kitchen held .
this cup may realize who those doors would bother .	this cup may realize that those doors would bother .
the chairs had n't noticed what the truck has n't kept .	the chairs had n't noticed that the truck has n't kept .
the book wo n't forget what those chairs sell .	the book wo n't forget that those chairs sell .
the box had learned what those bags find .	the box had learned that those bags find .
that box learned who the plates do n't praise .	that box learned that the plates do n't praise .
the books remembered what that school is buying .	the books remembered that that school is buying .
this truck knows who that hospital would bother .	this truck knows that that hospital would bother .
that window forgot what the shirt keeps .	that window forgot that the shirt keeps .
these pictures have realized what this library wo n't buy .	these pictures have realized that this library wo n't buy .
the glasses did n't forget what these bowls may fix .	the glasses did n't forget that these bowls may fix .
these hats see what that couch fixed .	these hats see that that couch fixed .
the bowls realized what these doors will take .	the bowls realized that these doors will take .
these books realize what the museum did n't bring .	these books realize that the museum did n't bring .
the shoes noticed what those schools fixed .	the shoes noticed that those schools fixed .
those bottles will realize what the mirror is n't buying .	those bottles will realize that the mirror is n't buying .
those dolls forgot who this kitchen will appreciate .	those dolls forgot that this kitchen will appreciate .
the bags forget what that ring brought .	the bags forget that that ring brought .
these books have realized who these books can n't bother .	these books have realized that these books can n't bother .
the dish had remembered what those forks were holding .	the dish had remembered that those forks were holding .
those cars wo n't realize what the school might find .	those cars wo n't realize that the school might find .
the crayons saw what these plates hold .	the crayons saw that these plates hold .
that toy had n't realized who these cups should scare .	that toy had n't realized that these cups should scare .
the shoes will know what this shirt was n't fixing .	the shoes will know that this shirt was n't fixing .
the mirror should know what this glass held .	the mirror should know that this glass held .
that bag forgot who that bicycle would appreciate .	that bag forgot that that bicycle would appreciate .
those glasses have known what the schools had held .	those glasses have known that the schools had held .
this chair noticed who that plane had n't scared .	this chair noticed that that plane had n't scared .
these dolls had n't known what that dish brings .	these dolls had n't known that that dish brings .
those books can n't remember what this school found .	those books can n't remember that this school found .
the boats can realize who the picture must scare .	the boats can realize that the picture must scare .
those boxes remembered who that room had n't liked .	those boxes remembered that that room had n't liked .
those doors wo n't forget who those doors hate .	those doors wo n't forget that those doors hate .
this spoon had n't realized what this box fixed .	this spoon had n't realized that this box fixed .
that door will realize who those spoons could n't bother .	that door will realize that those spoons could n't bother .
these shirts realize what the candles do n't find .	these shirts realize that the candles do n't find .
the window must know what those windows should bring .	the window must know that those windows should bring .
the pictures noticed who those dolls appreciate .	the pictures noticed that those dolls appreciate .
the trucks will know what that ring brought .	the trucks will know that that ring brought .
these trucks knew what this chair has taken .	these trucks knew that this chair has taken .
the spoons learned what these boats are n't keeping .	the spoons learned that these boats are n't keeping .
those dishes learn what the cup was n't finding .	those dishes learn that the cup was n't finding .
these dolls remembered what these hats took .	these dolls remembered that these hats took .
that crayon sees who these bottles praise .	that crayon sees that these bottles praise .
the cup forgot who that room had n't scared .	the cup forgot that that room had n't scared .
that doll noticed what the door had held .	that doll noticed that the door had held .
that car can learn who the bicycle had n't confused .	that car can learn that the bicycle had n't confused .
the bottle sees what these glasses would sell .	the bottle sees that these glasses would sell .
that truck had learned who this library had liked .	that truck had learned that this library had liked .
that door must remember what that plate was n't taking .	that door must remember that that plate was n't taking .
this hat saw what these hats have n't taken .	this hat saw that these hats have n't taken .
those cars see who these books may bother .	those cars see that these books may bother .
this truck had n't known what the school will steal .	this truck had n't known that the school will steal .
the dishes could n't forget who the cars may hate .	the dishes could n't forget that the cars may hate .
these shirts have n't known who the toys scared .	these shirts have n't known that the toys scared .
that book has learned who those shoes liked .	that book has learned that those shoes liked .
this doll had n't learned what those chairs have n't brought .	this doll had n't learned that those chairs have n't brought .
the bags had n't known who these rooms would praise .	the bags had n't known that these rooms would praise .
these pictures would remember what this plate holds .	these pictures would remember that this plate holds .
those hats realized what this bed fixed .	those hats realized that this bed fixed .
that fork had n't noticed what the spoon was taking .	that fork had n't noticed that the spoon was taking .
these bottles learned what the rooms were n't taking .	these bottles learned that the rooms were n't taking .
those glasses knew what the shoe might sell .	those glasses knew that the shoe might sell .
those toys remembered what those bowls can fix .	those toys remembered that those bowls can fix .
the ring saw what the pictures had brought .	the ring saw that the pictures had brought .
that glass had n't learned what these hats had taken .	that glass had n't learned that these hats had taken .
the bag knew who those dolls have n't scared .	the bag knew that those dolls have n't scared .
those boxes would n't learn what those buttons wo n't take .	those boxes would n't learn that those buttons wo n't take .
these candles have noticed what these books fix .	these candles have noticed that these books fix .
the hats forgot who the cup has confused .	the hats forgot that the cup has confused .
the windows had seen what that kitchen may keep .	the windows had seen that that kitchen may keep .
this bottle will know who that bed has liked .	this bottle will know that that bed has liked .
these books know what those books hold .	these books know that those books hold .
the bag must know what that ship made .	the bag must know that that ship made .
the glasses must know what those toys fix .	the glasses must know that those toys fix .
that truck would n't realize what the couch should n't fix .	that truck would n't realize that the couch should n't fix .
these beds forgot what that hat is n't taking .	these beds forgot that that hat is n't taking .
that couch had n't noticed who that school has confused .	that couch had n't noticed that that school has confused .
that boat sees what those trucks sell .	that boat sees that those trucks sell .
the boats may see what these boats have made .	the boats may see that these boats have made .
the plate learned what these cars steal .	the plate learned that these cars steal .
this plane can realize what the ring can take .	this plane can realize that the ring can take .
these cars forget who that book wo n't hate .	these cars forget that that book wo n't hate .
these glasses have n't learned what those cars took .	these glasses have n't learned that those cars took .
this hat had n't remembered what that school keeps .	this hat had n't remembered that that school keeps .
the picture has learned what that truck was bringing .	the picture has learned that that truck was bringing .
the fork had n't known what that bag holds .	the fork had n't known that that bag holds .
these shoes may see what those bowls fixed .	these shoes may see that those bowls fixed .
this dish had known what the button holds .	this dish had known that the button holds .
that car could notice what those windows are n't keeping .	that car could notice that those windows are n't keeping .
this rug had remembered what this spoon can hold .	this rug had remembered that this spoon can hold .
that shoe does n't remember who the shirts will hate .	that shoe does n't remember that the shirts will hate .
this book could forget who the glasses must hate .	this book could forget that the glasses must hate .
those hats notice who this room may appreciate .	those hats notice that this room may appreciate .
these shirts notice what that ship is n't fixing .	these shirts notice that that ship is n't fixing .
those bags learn what this toy had n't fixed .	those bags learn that this toy had n't fixed .
this hat will know what these bags bring .	this hat will know that these bags bring .
the beds had noticed what the box keeps .	the beds had noticed that the box keeps .
those crayons forgot what that dish was n't fixing .	those crayons forgot that that dish was n't fixing .
the cars know what the glass was fixing .	the cars know that the glass was fixing .
the bottle realized what that car kept .	the bottle realized that that car kept .
this shoe does n't see what those boats sell .	this shoe does n't see that those boats sell .
the bottles can learn what those spoons should n't keep .	the bottles can learn that those spoons should n't keep .
this box might realize what the room had n't found .	this box might realize that the room had n't found .
the shoes wo n't see what these rings take .	the shoes wo n't see that these rings take .
these cars learned what those books have n't taken .	these cars learned that those books have n't taken .
these cars saw who these shirts had n't scared .	these cars saw that these shirts had n't scared .
those hats see what the plates do n't steal .	those hats see that the plates do n't steal .
these plates remember what the bank could n't steal .	these plates remember that the bank could n't steal .
that bowl should n't realize what that school should keep .	that bowl should n't realize that that school should keep .
that chair has n't realized who this restaurant should n't bother .	that chair has n't realized that this restaurant should n't bother .
the dolls had n't remembered who that rocket has n't liked .	the dolls had n't remembered that that rocket has n't liked .
the glasses had n't remembered who that park confused .	the glasses had n't remembered that that park confused .
the crayons wo n't notice who this bank could praise .	the crayons wo n't notice that this bank could praise .
the hats could n't forget who this school was bothering .	the hats could n't forget that this school was bothering .
the shirts had n't learned what that window was n't bringing .	the shirts had n't learned that that window was n't bringing .
those cars know what the room has n't found .	those cars know that the room has n't found .
these chairs see who this boat should bother .	these chairs see that this boat should bother .
those crayons realized what these trucks made .	those crayons realized that these trucks made .
the plates saw what those books might sell .	the plates saw that those books might sell .
those boats forget who the truck likes .	those boats forget that the truck likes .
those beds would forget what the boxes are n't buying .	those beds would forget that the boxes are n't buying .
that glass remembered what those glasses did n't steal .	that glass remembered that those glasses did n't steal .
the hat could n't notice who the trucks confused .	the hat could n't notice that the trucks confused .
the spoons should learn who this school had n't liked .	the spoons should learn that this school had n't liked .
those rings have realized who these rooms bothered .	those rings have realized that these rooms bothered .
those toys notice what those bags are n't buying .	those toys notice that those bags are n't buying .
the chairs did n't forget what the beds were n't making .	the chairs did n't forget that the beds were n't making .
this plane has n't known who that crayon likes .	this plane has n't known that that crayon likes .
this toy saw who the trucks bother .	this toy saw that the trucks bother .
that book could see what these bags are buying .	that book could see that these bags are buying .
these boxes remember who that boat scares .	these boxes remember that that boat scares .
this glass saw what these boats fix .	this glass saw that these boats fix .
these hats remember what the mall is n't finding .	these hats remember that the mall is n't finding .
