these candles did n't forget what the car was n't making .	these candles did n't forget that the car was n't making .
the rings see what the rug held .	the rings see that the rug held .
the chairs have n't noticed what the trucks do n't fix .	the chairs have n't noticed that the trucks do n't fix .
those hats forget what those candles are n't holding .	those hats forget that those candles are n't holding .
the crayons do n't learn what this glass made .	the crayons do n't learn that this glass made .
that bicycle remembered what these trucks bought .	that bicycle remembered that these trucks bought .
the doors remember what the cars would n't keep .	the doors remember that the cars would n't keep .
these shirts have n't realized who that bag liked .	these shirts have n't realized that that bag liked .
the ring knew what the museum found .	the ring knew that the museum found .
the crayons forget what that park did n't keep .	the crayons forget that that park did n't keep .
the candle learned what the door has made .	the candle learned that the door has made .
those forks remembered what the plates held .	those forks remembered that the plates held .
the bottles know what this dish took .	the bottles know that this dish took .
this book knows what the room had brought .	this book knows that the room had brought .
the cars should forget who these spoons can n't praise .	the cars should forget that these spoons can n't praise .
these chairs saw what these pictures are n't making .	these chairs saw that these pictures are n't making .
those glasses notice what the bank has n't brought .	those glasses notice that the bank has n't brought .
the dish wo n't learn what these schools were n't fixing .	the dish wo n't learn that these schools were n't fixing .
those cars learn what that spoon had n't bought .	those cars learn that that spoon had n't bought .
these rings see what those windows do n't steal .	these rings see that those windows do n't steal .
that ring has noticed what this fork had n't kept .	that ring has noticed that this fork had n't kept .
this car sees what this spoon was n't taking .	this car sees that this spoon was n't taking .
those dishes have n't remembered who the fork is n't bothering .	those dishes have n't remembered that the fork is n't bothering .
these forks had n't seen what the toy takes .	these forks had n't seen that the toy takes .
the bottle realized what these cars found .	the bottle realized that these cars found .
that boat could see what the ring bought .	that boat could see that the ring bought .
those forks wo n't see what these cups brought .	those forks wo n't see that these cups brought .
these boats forget what those candles might take .	these boats forget that those candles might take .
this truck can learn who the chairs bother .	this truck can learn that the chairs bother .
the window must learn what this hat found .	the window must learn that this hat found .
that rocket had remembered what the truck stole .	that rocket had remembered that the truck stole .
that rocket remembered what this bottle had n't found .	that rocket remembered that this bottle had n't found .
this box can know what the shoe has n't bought .	this box can know that the shoe has n't bought .
that bicycle knows what those bowls have n't held .	that bicycle knows that those bowls have n't held .
the cars know what those toys are buying .	the cars know that those toys are buying .
the cars have noticed what this ship should n't buy .	the cars have noticed that this ship should n't buy .
those forks learned who the school has n't scared .	those forks learned that the school has n't scared .
the forks should n't see what the door holds .	the forks should n't see that the door holds .
this couch did n't know who these schools may hate .	this couch did n't know that these schools may hate .
the pictures forget who the car has scared .	the pictures forget that the car has scared .
that book remembered who the shirts praise .	that book remembered that the shirts praise .
the doors had n't remembered who the school could n't appreciate .	the doors had n't remembered that the school could n't appreciate .
this truck learned what the bicycle keeps .	this truck learned that the bicycle keeps .
this mirror would learn what the dolls have n't found .	this mirror would learn that the dolls have n't found .
those bottles forgot what those trucks have n't brought .	those bottles forgot that those trucks have n't brought .
those beds had noticed what this crayon bought .	those beds had noticed that this crayon bought .
this door could n't notice what this candle could take .	this door could n't notice that this candle could take .
that spoon learned what the beds hold .	that spoon learned that the beds hold .
those windows knew what this rocket brings .	those windows knew that this rocket brings .
these dishes have n't realized who those boxes hate .	these dishes have n't realized that those boxes hate .
that candle knew what those doors made .	that candle knew that those doors made .
the trucks learn who these dolls bothered .	the trucks learn that these dolls bothered .
the beds had learned what those windows have taken .	the beds had learned that those windows have taken .
this bowl realized what this book fixed .	this bowl realized that this book fixed .
these cups realize what these toys had held .	these cups realize that these toys had held .
that box noticed who that cup had scared .	that box noticed that that cup had scared .
that toy has n't learned what the cars can bring .	that toy has n't learned that the cars can bring .
the windows forget what the forks bring .	the windows forget that the forks bring .
the picture wo n't forget who that mirror does n't bother .	the picture wo n't forget that that mirror does n't bother .
these hats know what these cups made .	these hats know that these cups made .
those boxes have n't learned what this fork had bought .	those boxes have n't learned that this fork had bought .
the beds had learned who the car was bothering .	the beds had learned that the car was bothering .
this rug should realize what the plate stole .	this rug should realize that the plate stole .
that shirt has n't realized what the ship is holding .	that shirt has n't realized that the ship is holding .
those windows did n't see who that book does n't bother .	those windows did n't see that that book does n't bother .
that car remembered what this kitchen has taken .	that car remembered that this kitchen has taken .
the window sees what these dishes had n't fixed .	the window sees that these dishes had n't fixed .
the cars learned what the toy was buying .	the cars learned that the toy was buying .
these windows noticed who this door had bothered .	these windows noticed that this door had bothered .
the ring learned what these books can n't keep .	the ring learned that these books can n't keep .
these rings have known what that box is n't finding .	these rings have known that that box is n't finding .
these pictures realized what the rug had found .	these pictures realized that the rug had found .
that button sees what this chair made .	that button sees that this chair made .
the bottle realized what those dolls stole .	the bottle realized that those dolls stole .
this truck does n't remember what the shirt was n't taking .	this truck does n't remember that the shirt was n't taking .
the pictures notice who the crayons confused .	the pictures notice that the crayons confused .
the candle should n't learn what the couch must buy .	the candle should n't learn that the couch must buy .
those bottles have noticed who that boat confused .	those bottles have noticed that that boat confused .
that ship can learn what the rings might fix .	that ship can learn that the rings might fix .
these candles had noticed what the bank made .	these candles had noticed that the bank made .
the buttons forget what those bottles found .	the buttons forget that those bottles found .
these rings have n't known what that dish is holding .	these rings have n't known that that dish is holding .
the plates had n't realized what the forks bought .	the plates had n't realized that the forks bought .
the cars must know who this bicycle would praise .	the cars must know that this bicycle would praise .
this mirror saw what that bicycle has held .	this mirror saw that that bicycle has held .
those crayons would realize what the candle was bringing .	those crayons would realize that the candle was bringing .
that dish could realize what this bank may steal .	that dish could realize that this bank may steal .
those cups did n't see who those schools have n't scared .	those cups did n't see that those schools have n't scared .
this cup knows what these cars fixed .	this cup knows that these cars fixed .
the ring learned what that bowl is making .	the ring learned that that bowl is making .
these doors realized what these crayons can n't bring .	these doors realized that these crayons can n't bring .
the trucks noticed what this kitchen makes .	the trucks noticed that this kitchen makes .
this boat learned what that ship has brought .	this boat learned that that ship has brought .
this doll had n't noticed what this fork takes .	this doll had n't noticed that this fork takes .
these books wo n't know what these schools would hold .	these books wo n't know that these schools would hold .
these boats knew what this button held .	these boats knew that this button held .
the candles may realize what that truck bought .	the candles may realize that that truck bought .
these hats learned what the mall was taking .	these hats learned that the mall was taking .
these cars remembered what those cups steal .	these cars remembered that those cups steal .
that toy has noticed who the bags would appreciate .	that toy has noticed that the bags would appreciate .
this mirror knew what this bank was n't bringing .	this mirror knew that this bank was n't bringing .
these bottles forgot who that book can n't like .	these bottles forgot that that book can n't like .
these trucks remember what these plates did n't make .	these trucks remember that these plates did n't make .
this ring had n't realized what the shirt is keeping .	this ring had n't realized that the shirt is keeping .
this button had n't noticed what these shirts sell .	this button had n't noticed that these shirts sell .
those shirts would realize who these rings appreciate .	those shirts would realize that these rings appreciate .
those beds wo n't learn who the bag could n't praise .	those beds wo n't learn that the bag could n't praise .
that ring could n't see what that bank is n't taking .	that ring could n't see that that bank is n't taking .
this window forgot what that bank must make .	this window forgot that that bank must make .
those forks forget who the candle has n't scared .	those forks forget that the candle has n't scared .
these plates had n't noticed who that car had n't confused .	these plates had n't noticed that that car had n't confused .
that box saw what that boat has brought .	that box saw that that boat has brought .
this mirror knew what the shirts fix .	this mirror knew that the shirts fix .
the glasses had n't known what the school held .	the glasses had n't known that the school held .
the bags had noticed who those beds would appreciate .	the bags had noticed that those beds would appreciate .
those pictures had seen who these glasses appreciate .	those pictures had seen that these glasses appreciate .
this bag knew who these doors might bother .	this bag knew that these doors might bother .
this shirt did n't forget who the dishes have scared .	this shirt did n't forget that the dishes have scared .
those hats could n't learn who this spoon confused .	those hats could n't learn that this spoon confused .
that spoon would notice who this chair was n't bothering .	that spoon would notice that this chair was n't bothering .
those candles forgot who that mirror likes .	those candles forgot that that mirror likes .
the candle remembered what this book made .	the candle remembered that this book made .
those bowls remember what those hats made .	those bowls remember that those hats made .
those windows can know who this park does n't bother .	those windows can know that this park does n't bother .
the hat wo n't know who this glass might bother .	the hat wo n't know that this glass might bother .
those crayons would notice what the trucks keep .	those crayons would notice that the trucks keep .
that button knew what that plane was bringing .	that button knew that that plane was bringing .
the hat can n't know what that ship was n't keeping .	the hat can n't know that that ship was n't keeping .
the couch has learned who this kitchen did n't like .	the couch has learned that this kitchen did n't like .
those shoes noticed what this hat bought .	those shoes noticed that this hat bought .
this ring can n't learn what that truck is keeping .	this ring can n't learn that that truck is keeping .
the toys learn what the book was keeping .	the toys learn that the book was keeping .
this picture could n't realize who this bottle had n't scared .	this picture could n't realize that this bottle had n't scared .
the book wo n't learn what that shirt is n't finding .	the book wo n't learn that that shirt is n't finding .
this spoon forgot what that car wo n't sell .	this spoon forgot that that car wo n't sell .
the plates can n't know what these cars had n't bought .	the plates can n't know that these cars had n't bought .
these beds had realized what those bags had brought .	these beds had realized that those bags had brought .
this doll knows who the books praise .	this doll knows that the books praise .
those cars learn who the rooms should hate .	those cars learn that the rooms should hate .
this book realized what these chairs fix .	this book realized that these chairs fix .
the button can remember who this plate had n't confused .	the button can remember that this plate had n't confused .
these boxes had n't noticed what that bag is n't finding .	these boxes had n't noticed that that bag is n't finding .
the spoon had remembered who the candle bothered .	the spoon had remembered that the candle bothered .
the chairs noticed what those cups can n't make .	the chairs noticed that those cups can n't make .
the pictures will realize what the hospital could n't steal .	the pictures will realize that the hospital could n't steal .
those dolls would n't forget what the school fixed .	those dolls would n't forget that the school fixed .
these boxes forget what those shirts must sell .	these boxes forget that those shirts must sell .
that door would n't remember what this book keeps .	that door would n't remember that this book keeps .
this doll forgot what these rings found .	this doll forgot that these rings found .
the crayon does n't forget who this restaurant bothered .	the crayon does n't forget that this restaurant bothered .
the truck did n't know who this museum has liked .	the truck did n't know that this museum has liked .
these glasses can see who the box wo n't praise .	these glasses can see that the box wo n't praise .
the car did n't see what those glasses have brought .	the car did n't see that those glasses have brought .
the cars learned what the cups would keep .	the cars learned that the cups would keep .
these bags see what those crayons found .	these bags see that those crayons found .
the door knew what that hat had n't found .	the door knew that that hat had n't found .
this rocket sees what that button wo n't hold .	this rocket sees that that button wo n't hold .
the mirror had realized who that picture had confused .	the mirror had realized that that picture had confused .
this book had realized who the doll has liked .	this book had realized that the doll has liked .
these cups realize who those doors would bother .	these cups realize that those doors would bother .
those pictures have seen what these bags have n't taken .	those pictures have seen that these bags have n't taken .
the box saw what the bottles have made .	the box saw that the bottles have made .
this toy had seen what the bed was fixing .	this toy had seen that the bed was fixing .
these bowls knew what the plate is n't buying .	these bowls knew that the plate is n't buying .
the door sees what that plate wo n't bring .	the door sees that that plate wo n't bring .
these books could n't notice who these schools had bothered .	these books could n't notice that these schools had bothered .
this dish would forget who those trucks had n't bothered .	this dish would forget that those trucks had n't bothered .
the glasses learned who the fork will scare .	the glasses learned that the fork will scare .
those toys should n't know who this bicycle bothered .	those toys should n't know that this bicycle bothered .
the dish can n't remember who this rug wo n't appreciate .	the dish can n't remember that this rug wo n't appreciate .
this mirror had seen what those books stole .	this mirror had seen that those books stole .
that book noticed what these windows found .	that book noticed that these windows found .
those bags realized who the room has n't bothered .	those bags realized that the room has n't bothered .
the plate sees what those crayons had n't taken .	the plate sees that those crayons had n't taken .
this ship must remember what that bed would n't buy .	this ship must remember that that bed would n't buy .
this bicycle wo n't forget what that ship is n't keeping .	this bicycle wo n't forget that that ship is n't keeping .
the forks saw what the toys had taken .	the forks saw that the toys had taken .
that cup saw who those candles hate .	that cup saw that those candles hate .
these forks forget what that boat wo n't sell .	these forks forget that that boat wo n't sell .
the bottle saw who the trucks scared .	the bottle saw that the trucks scared .
these pictures realized who that school liked .	these pictures realized that that school liked .
this ship has noticed who the candle has n't liked .	this ship has noticed that the candle has n't liked .
the boxes learned what that bed was n't fixing .	the boxes learned that that bed was n't fixing .
these bags learn what those schools take .	these bags learn that those schools take .
those boxes remembered what the boats had brought .	those boxes remembered that the boats had brought .
the dish could learn who this book bothered .	the dish could learn that this book bothered .
those dolls learn who the toys scare .	those dolls learn that the toys scare .
that crayon must realize what these rooms steal .	that crayon must realize that these rooms steal .
the shirts can remember what these spoons held .	the shirts can remember that these spoons held .
this book did n't know who the park might bother .	this book did n't know that the park might bother .
that plane has n't seen who the glass had scared .	that plane has n't seen that the glass had scared .
the truck should n't notice what the buttons held .	the truck should n't notice that the buttons held .
these cups may notice what that car kept .	these cups may notice that that car kept .
these bags realized what the buttons did n't keep .	these bags realized that the buttons did n't keep .
that cup saw what that room is n't finding .	that cup saw that that room is n't finding .
this hat knows what the chair was fixing .	this hat knows that the chair was fixing .
that rug remembered what these cars keep .	that rug remembered that these cars keep .
that fork saw who this boat liked .	that fork saw that this boat liked .
these buttons knew what the car is making .	these buttons knew that the car is making .
the window would notice what those cars have held .	the window would notice that those cars have held .
the dolls notice who this plane bothered .	the dolls notice that this plane bothered .
this candle would n't remember what the boats brought .	this candle would n't remember that the boats brought .
these boxes noticed who that button wo n't appreciate .	these boxes noticed that that button wo n't appreciate .
the bowls notice who this shoe had n't bothered .	the bowls notice that this shoe had n't bothered .
this door would n't see what this ship was fixing .	this door would n't see that this ship was fixing .
the couch learned who the rooms hate .	the couch learned that the rooms hate .
these dishes noticed what that book brought .	these dishes noticed that that book brought .
the crayons could see what the shoes will sell .	the crayons could see that the shoes will sell .
the hat saw what the boat brought .	the hat saw that the boat brought .
those dishes learn what that room may make .	those dishes learn that that room may make .
those rings learned who the bowl confused .	those rings learned that the bowl confused .
the boxes would n't see who this fork scared .	the boxes would n't see that this fork scared .
that bottle could n't remember who this hat would n't scare .	that bottle could n't remember that this hat would n't scare .
those bags saw who the rooms will appreciate .	those bags saw that the rooms will appreciate .
that rocket had n't realized what those plates found .	that rocket had n't realized that those plates found .
these pictures would n't remember who this glass has n't bothered .	these pictures would n't remember that this glass has n't bothered .
these crayons have n't realized what this box made .	these crayons have n't realized that this box made .
these rings realize what that window has brought .	these rings realize that that window has brought .
those windows saw what those schools have n't taken .	those windows saw that those schools have n't taken .
