those bags learn what these beds who win bring .	those bags learn that these beds who win bring .
the plane does n't see what that picture who has n't heard the bottles would n't bring .	the plane does n't see that that picture who has n't heard the bottles would n't bring .
this plate had seen what that glass who would throw that dancer was keeping .	this plate had seen that that glass who would throw that dancer was keeping .
this bottle will realize who the library who this chair should hear had n't scared .	this bottle will realize that the library who this chair should hear had n't scared .
those bags wo n't notice who that spoon who can n't have the children scares .	those bags wo n't notice that that spoon who can n't have the children scares .
this glass knew who these forks who lie praise .	this glass knew that these forks who lie praise .
those crayons forget what these bottles who took this dancer fixed .	those crayons forget that these bottles who took this dancer fixed .
the boats had n't seen who those plates who the cup has n't heard bothered .	the boats had n't seen that those plates who the cup has n't heard bothered .
the candle has n't noticed what these dolls who are n't buying the guy steal .	the candle has n't noticed that these dolls who are n't buying the guy steal .
those pictures will forget what the ring who is laughing had n't fixed .	those pictures will forget that the ring who is laughing had n't fixed .
this shoe has n't known what these dolls who wo n't stretch were n't holding .	this shoe has n't known that these dolls who wo n't stretch were n't holding .
this bowl sees what that mall who was n't holding that dentist stole .	this bowl sees that that mall who was n't holding that dentist stole .
these dolls remembered what the window who paints bought .	these dolls remembered that the window who paints bought .
these bottles may realize what these beds who would know those dishes find .	these bottles may realize that these beds who would know those dishes find .
those cars have seen what that restaurant who was yelling must bring .	those cars have seen that that restaurant who was yelling must bring .
these chairs remember what these dolls who can n't stretch hold .	these chairs remember that these dolls who can n't stretch hold .
the chairs know who these plates who could n't drop the doctors bother .	the chairs know that these plates who could n't drop the doctors bother .
the ship forgot what this kitchen who heard this bottle would n't take .	the ship forgot that this kitchen who heard this bottle would n't take .
these glasses learn what those dolls who yelled could n't hold .	these glasses learn that those dolls who yelled could n't hold .
those chairs had learned who the bowls who would n't smile should n't praise .	those chairs had learned that the bowls who would n't smile should n't praise .
the shirts noticed who the doll who is whispering has n't scared .	the shirts noticed that the doll who is whispering has n't scared .
the rings would n't notice what that picture who is n't painting is n't finding .	the rings would n't notice that that picture who is n't painting is n't finding .
this candle knows who this shoe who the fork has heard had n't confused .	this candle knows that this shoe who the fork has heard had n't confused .
that book has seen what the door who was n't moving these doctors was n't making .	that book has seen that the door who was n't moving these doctors was n't making .
these bowls have n't known what the schools who know these bottles bring .	these bowls have n't known that the schools who know these bottles bring .
those cups see who this car who this couch did n't hear likes .	those cups see that this car who this couch did n't hear likes .
those buttons remembered who those cars who shook the doctors will scare .	those buttons remembered that those cars who shook the doctors will scare .
this chair has n't learned what the plane who might hear those shoes does n't take .	this chair has n't learned that the plane who might hear those shoes does n't take .
the picture has n't remembered what those crayons who sang had n't made .	the picture has n't remembered that those crayons who sang had n't made .
these books noticed who the bank who is n't dropping the person had n't bothered .	these books noticed that the bank who is n't dropping the person had n't bothered .
this bag had seen what the crayons who will know this hospital steal .	this bag had seen that the crayons who will know this hospital steal .
the plates have noticed what this rug who that dish knew took .	the plates have noticed that this rug who that dish knew took .
those hats remember what that hospital who should n't know those cups makes .	those hats remember that that hospital who should n't know those cups makes .
this rocket had noticed what the crayons who heard this kitchen fixed .	this rocket had noticed that the crayons who heard this kitchen fixed .
the plate knew what these cups who have cleaned the dancer buy .	the plate knew that these cups who have cleaned the dancer buy .
those shirts realize what those glasses who wo n't keep this child had found .	those shirts realize that those glasses who wo n't keep this child had found .
this ring should notice who these doors who do n't hear that toy could n't appreciate .	this ring should notice that these doors who do n't hear that toy could n't appreciate .
those hats may remember what this bottle who had waved had n't bought .	those hats may remember that this bottle who had waved had n't bought .
these cars realize what those hats who wo n't talk are finding .	these cars realize that those hats who wo n't talk are finding .
the dish had noticed what the fork who was cleaning that child took .	the dish had noticed that the fork who was cleaning that child took .
that plane saw who those rings who waved hate .	that plane saw that those rings who waved hate .
this bed had n't known what these shirts who know that shoe are n't keeping .	this bed had n't known that these shirts who know that shoe are n't keeping .
these rings can know what the plates who threw the ladies will keep .	these rings can know that the plates who threw the ladies will keep .
these plates realize what that boat who that park had heard brings .	these plates realize that that boat who that park had heard brings .
the trucks remember who that mall who sings scared .	the trucks remember that that mall who sings scared .
the candles had known what that bed who would n't fix this customer had fixed .	the candles had known that that bed who would n't fix this customer had fixed .
the toys learned what the mirror who keeps the child brings .	the toys learned that the mirror who keeps the child brings .
these shirts had remembered what that spoon who is n't buying that child brought .	these shirts had remembered that that spoon who is n't buying that child brought .
these trucks had remembered what the cups who stretch must take .	these trucks had remembered that the cups who stretch must take .
the mirror sees what that bowl who does n't talk is n't keeping .	the mirror sees that that bowl who does n't talk is n't keeping .
that plate had n't noticed who those cars who that button can n't know had n't scared .	that plate had n't noticed that those cars who that button can n't know had n't scared .
the car knows who those windows who fix that queen will scare .	the car knows that those windows who fix that queen will scare .
the shirts remembered who the cars who might cough could n't bother .	the shirts remembered that the cars who might cough could n't bother .
this cup saw who this mall who does n't read scares .	this cup saw that this mall who does n't read scares .
the trucks learned what those doors who should n't hear those plates were buying .	the trucks learned that those doors who should n't hear those plates were buying .
the couch could n't see who that ship who these dolls know has n't scared .	the couch could n't see that that ship who these dolls know has n't scared .
this book has seen who the candle who brought these guys could appreciate .	this book has seen that the candle who brought these guys could appreciate .
those cars noticed who that bowl who won wo n't like .	those cars noticed that that bowl who won wo n't like .
this cup knows what the doors who are n't yelling could make .	this cup knows that the doors who are n't yelling could make .
those rings must forget who those crayons who laughed bothered .	those rings must forget that those crayons who laughed bothered .
these windows learned who that box who has n't talked has n't scared .	these windows learned that that box who has n't talked has n't scared .
this bag had n't known who that library who must make those boys scares .	this bag had n't known that that library who must make those boys scares .
the cup has n't noticed what those windows who were n't throwing this lady can sell .	the cup has n't noticed that those windows who were n't throwing this lady can sell .
the book had n't seen who those buttons who heard the crayon bother .	the book had n't seen that those buttons who heard the crayon bother .
these shirts should n't know who the rug who hears these doors might appreciate .	these shirts should n't know that the rug who hears these doors might appreciate .
this picture did n't realize who the dolls who knew that crayon could praise .	this picture did n't realize that the dolls who knew that crayon could praise .
this car realized who the windows who were waving confused .	this car realized that the windows who were waving confused .
the dish would forget who those forks who will hear this spoon had n't bothered .	the dish would forget that those forks who will hear this spoon had n't bothered .
those dolls would n't know what this doll who hears these cups took .	those dolls would n't know that this doll who hears these cups took .
these crayons must learn what this candle who shakes the teacher was keeping .	these crayons must learn that this candle who shakes the teacher was keeping .
those candles notice what this school who wo n't hear that bottle is n't taking .	those candles notice that this school who wo n't hear that bottle is n't taking .
those toys have n't remembered what that car who must paint may fix .	those toys have n't remembered that that car who must paint may fix .
the hats knew who these rooms who the dish knows hate .	the hats knew that these rooms who the dish knows hate .
the bag had realized what that restaurant who the kitchen would hear has n't kept .	the bag had realized that that restaurant who the kitchen would hear has n't kept .
these books forget what the candles who the hats should know held .	these books forget that the candles who the hats should know held .
the button realized what these bags who the school did n't know brought .	the button realized that these bags who the school did n't know brought .
this chair did n't see what these books who this bottle had n't heard were n't bringing .	this chair did n't see that these books who this bottle had n't heard were n't bringing .
the candles realize what those toys who were keeping that lady had found .	the candles realize that those toys who were keeping that lady had found .
the shirts have n't seen what that glass who wo n't clean the boy was n't buying .	the shirts have n't seen that that glass who wo n't clean the boy was n't buying .
that door had n't noticed what the hats who lose the men sell .	that door had n't noticed that the hats who lose the men sell .
these chairs learn what that bicycle who makes those ladies had n't brought .	these chairs learn that that bicycle who makes those ladies had n't brought .
that plane can remember what the cups who hear those toys fix .	that plane can remember that the cups who hear those toys fix .
those candles learn what the bank who was whispering could n't take .	those candles learn that the bank who was whispering could n't take .
the bowls should see what these trucks who stretch were n't buying .	the bowls should see that these trucks who stretch were n't buying .
the book had realized what the dishes who lie are n't holding .	the book had realized that the dishes who lie are n't holding .
the boat would n't notice what this kitchen who will cry should take .	the boat would n't notice that this kitchen who will cry should take .
the ship learned what that doll who can hear this bowl takes .	the ship learned that that doll who can hear this bowl takes .
this button noticed what the toy who does n't bring that teacher will buy .	this button noticed that the toy who does n't bring that teacher will buy .
the bottles do n't realize who that boat who knew these chairs has n't bothered .	the bottles do n't realize that that boat who knew these chairs has n't bothered .
that window had remembered what this spoon who talked held .	that window had remembered that this spoon who talked held .
the cars remembered what this school who exercises was n't fixing .	the cars remembered that this school who exercises was n't fixing .
that box had n't seen what the crayons who knew these rooms buy .	that box had n't seen that the crayons who knew these rooms buy .
the hats noticed what this crayon who must lose can steal .	the hats noticed that this crayon who must lose can steal .
the shirts had n't known who these spoons who are throwing this dancer bother .	the shirts had n't known that these spoons who are throwing this dancer bother .
this rug forgot who this couch who does n't make that driver had bothered .	this rug forgot that this couch who does n't make that driver had bothered .
that truck sees what that door who shakes this customer has n't bought .	that truck sees that that door who shakes this customer has n't bought .
the car noticed what the pictures who would sneeze could make .	the car noticed that the pictures who would sneeze could make .
the bowls know who that hospital who is smiling likes .	the bowls know that that hospital who is smiling likes .
those boxes saw what those beds who were n't bringing this dentist were buying .	those boxes saw that those beds who were n't bringing this dentist were buying .
the box would know what the candle who wo n't practice held .	the box would know that the candle who wo n't practice held .
the spoon did n't learn who that dish who would scream does n't scare .	the spoon did n't learn that that dish who would scream does n't scare .
this bed has n't seen who that picture who knows that couch has bothered .	this bed has n't seen that that picture who knows that couch has bothered .
the crayons remember what these books who sing wo n't bring .	the crayons remember that these books who sing wo n't bring .
these glasses knew what the toy who hears those buttons has found .	these glasses knew that the toy who hears those buttons has found .
those trucks notice what that picture who sang had n't held .	those trucks notice that that picture who sang had n't held .
this car remembered what this boat who hears the rooms is finding .	this car remembered that this boat who hears the rooms is finding .
these boats had realized who the hats who this doll knew appreciate .	these boats had realized that the hats who this doll knew appreciate .
those shirts forget what these candles who clean the adult might bring .	those shirts forget that these candles who clean the adult might bring .
this bottle saw what the button who should n't wave stole .	this bottle saw that the button who should n't wave stole .
these dolls realize who these shirts who have n't painted hate .	these dolls realize that these shirts who have n't painted hate .
these plates will know what these boxes who must take that boy fixed .	these plates will know that these boxes who must take that boy fixed .
that chair would notice what that ring who had n't kept that lady will steal .	that chair would notice that that ring who had n't kept that lady will steal .
the chair realized who those schools who sing praise .	the chair realized that those schools who sing praise .
that couch had seen who the books who had yelled could appreciate .	that couch had seen that the books who had yelled could appreciate .
these doors will see who the rings who have n't heard this bank appreciate .	these doors will see that the rings who have n't heard this bank appreciate .
that chair might realize who these dolls who find this customer have liked .	that chair might realize that these dolls who find this customer have liked .
the pictures have n't noticed who this bank who that doll heard could praise .	the pictures have n't noticed that this bank who that doll heard could praise .
those forks saw what this dish who did n't sing was finding .	those forks saw that this dish who did n't sing was finding .
those dolls realize what that room who lost the doctors can n't fix .	those dolls realize that that room who lost the doctors can n't fix .
the hats forget who the buttons who have read have bothered .	the hats forget that the buttons who have read have bothered .
these plates know what this rug who the rings would know fixed .	these plates know that this rug who the rings would know fixed .
those bags learned what that button who should n't win is n't finding .	those bags learned that that button who should n't win is n't finding .
those dishes see what that rocket who makes the adult stole .	those dishes see that that rocket who makes the adult stole .
the shoes had known what the doll who was singing has brought .	the shoes had known that the doll who was singing has brought .
these books had noticed what these shoes who had heard this bed would take .	these books had noticed that these shoes who had heard this bed would take .
this car sees what those bowls who are holding the dentist must bring .	this car sees that those bowls who are holding the dentist must bring .
this plane can n't know what the bank who cries had bought .	this plane can n't know that the bank who cries had bought .
those dishes can learn what the mall who wo n't know that toy is fixing .	those dishes can learn that the mall who wo n't know that toy is fixing .
that window has n't known what the book who these buttons knew bought .	that window has n't known that the book who these buttons knew bought .
these glasses learned what the bed who had dropped this doctor had n't made .	these glasses learned that the bed who had dropped this doctor had n't made .
this dish knows who these buttons who know that bicycle will like .	this dish knows that these buttons who know that bicycle will like .
the bag remembered what that mall who was n't yelling bought .	the bag remembered that that mall who was n't yelling bought .
that dish does n't realize what these doors who wo n't sneeze took .	that dish does n't realize that these doors who wo n't sneeze took .
the fork learned what that cup who hears those spoons must buy .	the fork learned that that cup who hears those spoons must buy .
those books learn what these windows who do n't find that dancer should keep .	those books learn that these windows who do n't find that dancer should keep .
the book has remembered what this crayon who is bringing that teacher would n't find .	the book has remembered that this crayon who is bringing that teacher would n't find .
the shirt should forget what that mall who was n't losing the guys kept .	the shirt should forget that that mall who was n't losing the guys kept .
this bowl had n't remembered who the car who is cleaning the driver confused .	this bowl had n't remembered that the car who is cleaning the driver confused .
those bottles noticed who these cars who could take that man had scared .	those bottles noticed that these cars who could take that man had scared .
that box learned what this plate who wo n't cough has n't made .	that box learned that this plate who wo n't cough has n't made .
this ring could see what those rings who will throw the king were n't bringing .	this ring could see that those rings who will throw the king were n't bringing .
those cars could n't realize what this book who has n't made that dentist took .	those cars could n't realize that this book who has n't made that dentist took .
that truck knew what those hats who lose are n't holding .	that truck knew that those hats who lose are n't holding .
these plates had n't learned who those windows who would n't yell might hate .	these plates had n't learned that those windows who would n't yell might hate .
these forks knew what this glass who may sell those teachers bought .	these forks knew that this glass who may sell those teachers bought .
those boats had known what the hat who was n't losing must fix .	those boats had known that the hat who was n't losing must fix .
these bowls notice what these doors who should n't sneeze bring .	these bowls notice that these doors who should n't sneeze bring .
those candles should forget what that school who bought this woman was n't keeping .	those candles should forget that that school who bought this woman was n't keeping .
the dolls see what that bottle who has n't heard the book is making .	the dolls see that that bottle who has n't heard the book is making .
that doll learned who this hospital who that car must hear scares .	that doll learned that this hospital who that car must hear scares .
these cars can remember who those bowls who could exercise liked .	these cars can remember that those bowls who could exercise liked .
this hat saw what the windows who should hear the buttons had made .	this hat saw that the windows who should hear the buttons had made .
these books realize what the books who have this lady found .	these books realize that the books who have this lady found .
the spoons forget what the book who cries has n't made .	the spoons forget that the book who cries has n't made .
the mirror forgot what this school who had n't cleaned the men was n't holding .	the mirror forgot that this school who had n't cleaned the men was n't holding .
those candles forget what the cups who sneeze bought .	those candles forget that the cups who sneeze bought .
the dolls forgot what the ring who has bought this dentist has n't bought .	the dolls forgot that the ring who has bought this dentist has n't bought .
these bags knew what the boat who would know this school was n't finding .	these bags knew that the boat who would know this school was n't finding .
the bowls remembered what this doll who bought this doctor is n't fixing .	the bowls remembered that this doll who bought this doctor is n't fixing .
the car knows what the boats who should smile sell .	the car knows that the boats who should smile sell .
that plate did n't learn who the pictures who hear this park bother .	that plate did n't learn that the pictures who hear this park bother .
this book may realize who those forks who cry praise .	this book may realize that those forks who cry praise .
these beds know what this school who would stretch will buy .	these beds know that this school who would stretch will buy .
that button can n't remember what the doors who brought that woman hold .	that button can n't remember that the doors who brought that woman hold .
the trucks learn who the bags who have this customer had n't liked .	the trucks learn that the bags who have this customer had n't liked .
those beds had n't known what those shirts who have n't yelled would keep .	those beds had n't known that those shirts who have n't yelled would keep .
those candles knew who these cars who had heard this candle had liked .	those candles knew that these cars who had heard this candle had liked .
that button forgot what the window who heard this car stole .	that button forgot that the window who heard this car stole .
the glass has n't seen who that shirt who had heard these spoons had liked .	the glass has n't seen that that shirt who had heard these spoons had liked .
these candles could notice who this shoe who may yell would bother .	these candles could notice that this shoe who may yell would bother .
that toy had n't remembered what these cups who have fixed that lady have brought .	that toy had n't remembered that these cups who have fixed that lady have brought .
this bed could n't know who the toys who the bottle can know had n't liked .	this bed could n't know that the toys who the bottle can know had n't liked .
the car might see what the rooms who hear those shirts steal .	the car might see that the rooms who hear those shirts steal .
those buttons have learned what these doors who have n't taken the guy found .	those buttons have learned that these doors who have n't taken the guy found .
the bags will know what those books who made that child would n't hold .	the bags will know that those books who made that child would n't hold .
that car had realized who the mall who is n't moving this king can hate .	that car had realized that the mall who is n't moving this king can hate .
those trucks had remembered who that ship who the school heard bothered .	those trucks had remembered that that ship who the school heard bothered .
that toy has n't seen what that window who wo n't stretch has held .	that toy has n't seen that that window who wo n't stretch has held .
this plane has n't noticed what that rocket who that car hears is n't buying .	this plane has n't noticed that that rocket who that car hears is n't buying .
those bottles could n't notice what that bottle who has n't brought this girl brings .	those bottles could n't notice that that bottle who has n't brought this girl brings .
that ring sees who the button who the buttons heard had n't scared .	that ring sees that the button who the buttons heard had n't scared .
those plates may learn who that park who those cups know had liked .	those plates may learn that that park who those cups know had liked .
