this toy had realized what the bottles who are n't dropping that guy are n't keeping .	this toy had realized that the bottles who are n't dropping that guy are n't keeping .
these dolls knew who those shoes who had the children appreciate .	these dolls knew that those shoes who had the children appreciate .
the dishes saw what those trucks who the boat hears hold .	the dishes saw that those trucks who the boat hears hold .
the truck must learn what those pictures who could steal the dancer can sell .	the truck must learn that those pictures who could steal the dancer can sell .
this bed knew what the rooms who are n't shaking that guy may bring .	this bed knew that the rooms who are n't shaking that guy may bring .
the buttons would n't know what the plane who should hear this bowl will sell .	the buttons would n't know that the plane who should hear this bowl will sell .
the bicycle has n't realized what the schools who this picture has n't heard might buy .	the bicycle has n't realized that the schools who this picture has n't heard might buy .
those rings know who those shirts who can hear the bowls like .	those rings know that those shirts who can hear the bowls like .
the candles have n't realized what those trucks who are n't smiling would buy .	the candles have n't realized that those trucks who are n't smiling would buy .
that shirt saw what those plates who should lose those boys find .	that shirt saw that those plates who should lose those boys find .
these doors could n't realize what these bottles who would know that hospital are n't finding .	these doors could n't realize that these bottles who would know that hospital are n't finding .
the truck does n't forget what this mirror who should n't win has n't kept .	the truck does n't forget that this mirror who should n't win has n't kept .
the crayon remembered what this box who fixed that adult holds .	the crayon remembered that this box who fixed that adult holds .
the dolls would forget what this boat who is losing was taking .	the dolls would forget that this boat who is losing was taking .
the boats knew what this plate who the couch would know had held .	the boats knew that this plate who the couch would know had held .
the forks do n't realize what the car who held this person can n't steal .	the forks do n't realize that the car who held this person can n't steal .
the boxes have n't learned what the hats who hear the boxes find .	the boxes have n't learned that the hats who hear the boxes find .
this shoe might remember what this couch who those rings have n't heard keeps .	this shoe might remember that this couch who those rings have n't heard keeps .
the button realized what those rings who sell the dentist have n't found .	the button realized that those rings who sell the dentist have n't found .
the doors have n't learned what this door who sings had n't made .	the doors have n't learned that this door who sings had n't made .
those doors have remembered what these cars who must win take .	those doors have remembered that these cars who must win take .
the bottle could n't see what that bowl who could n't lose should n't sell .	the bottle could n't see that that bowl who could n't lose should n't sell .
this car learned who this restaurant who bought those guys had n't scared .	this car learned that this restaurant who bought those guys had n't scared .
the dishes learn who the dolls who hear those shoes appreciate .	the dishes learn that the dolls who hear those shoes appreciate .
those books remembered what this car who hears these rings must bring .	those books remembered that this car who hears these rings must bring .
that rug wo n't see what that school who moves those children was n't bringing .	that rug wo n't see that that school who moves those children was n't bringing .
these beds remembered who the room who fixed these guys has n't bothered .	these beds remembered that the room who fixed these guys has n't bothered .
that boat wo n't see what those rings who brought the ladies could n't keep .	that boat wo n't see that those rings who brought the ladies could n't keep .
these glasses saw what those boxes who those schools hear are n't finding .	these glasses saw that those boxes who those schools hear are n't finding .
these dishes remembered what this library who the restaurant hears does n't bring .	these dishes remembered that this library who the restaurant hears does n't bring .
that bowl has remembered what this bottle who was n't yelling has found .	that bowl has remembered that this bottle who was n't yelling has found .
these books had n't learned what this book who that bank should hear is keeping .	these books had n't learned that this book who that bank should hear is keeping .
the doll realized what these forks who yelled hold .	the doll realized that these forks who yelled hold .
these books had n't known what those shoes who had held these teachers found .	these books had n't known that those shoes who had held these teachers found .
these bottles have realized who these spoons who had made those teachers can n't hate .	these bottles have realized that these spoons who had made those teachers can n't hate .
the cup had n't learned what the bicycle who knows this school has n't fixed .	the cup had n't learned that the bicycle who knows this school has n't fixed .
that bottle knew who this candle who is throwing these ladies scared .	that bottle knew that this candle who is throwing these ladies scared .
these boats learned what that ring who heard the candles is fixing .	these boats learned that that ring who heard the candles is fixing .
this bicycle has learned who the ring who the windows have heard could n't scare .	this bicycle has learned that the ring who the windows have heard could n't scare .
those spoons can learn what this mirror who the chairs should n't hear has n't fixed .	those spoons can learn that this mirror who the chairs should n't hear has n't fixed .
the bed saw who the beds who those windows knew may like .	the bed saw that the beds who those windows knew may like .
those spoons forgot what the library who reads should sell .	those spoons forgot that the library who reads should sell .
the doors know who this plane who lost might scare .	the doors know that this plane who lost might scare .
the book did n't learn what that window who may shake this boy can n't bring .	the book did n't learn that that window who may shake this boy can n't bring .
this hat had realized what these cups who could n't hear these bowls have n't taken .	this hat had realized that these cups who could n't hear these bowls have n't taken .
the boat knows who these plates who the boats know confused .	the boat knows that these plates who the boats know confused .
the dolls remember what these buttons who made these teachers might take .	the dolls remember that these buttons who made these teachers might take .
these windows learn who the rug who shakes that king had liked .	these windows learn that the rug who shakes that king had liked .
those forks have n't known what this doll who waved brings .	those forks have n't known that this doll who waved brings .
that hat realized what this bag who the rooms could n't know is fixing .	that hat realized that this bag who the rooms could n't know is fixing .
those dishes should realize what the dish who that book heard bought .	those dishes should realize that the dish who that book heard bought .
the rug had noticed what this couch who heard those plates brings .	the rug had noticed that this couch who heard those plates brings .
the dish learned what the window who had fixed the dancer wo n't make .	the dish learned that the window who had fixed the dancer wo n't make .
that crayon should n't remember what these boats who the kitchen heard fixed .	that crayon should n't remember that these boats who the kitchen heard fixed .
this hat has n't known who the schools who will hear the restaurant have liked .	this hat has n't known that the schools who will hear the restaurant have liked .
those doors remembered who this bowl who should know this crayon had confused .	those doors remembered that this bowl who should know this crayon had confused .
these cups have n't seen what those boxes who brought those doctors are n't fixing .	these cups have n't seen that those boxes who brought those doctors are n't fixing .
the bowl has remembered who those candles who heard that school will scare .	the bowl has remembered that those candles who heard that school will scare .
this cup knew what this library who must know the doors should find .	this cup knew that this library who must know the doors should find .
those crayons can notice what that restaurant who painted was n't taking .	those crayons can notice that that restaurant who painted was n't taking .
this plate may realize who those books who have n't made those teachers bother .	this plate may realize that those books who have n't made those teachers bother .
those boxes notice what this bank who heard the spoon fixed .	those boxes notice that this bank who heard the spoon fixed .
the dolls remembered who the restaurant who those pictures knew scared .	the dolls remembered that the restaurant who those pictures knew scared .
that chair will remember what the hospital who must clean those people held .	that chair will remember that the hospital who must clean those people held .
those bowls have known what this museum who those books know makes .	those bowls have known that this museum who those books know makes .
the pictures knew who the glasses who smile appreciate .	the pictures knew that the glasses who smile appreciate .
that plane would n't realize who the schools who lose like .	that plane would n't realize that the schools who lose like .
these pictures learned what that hospital who these boxes heard did n't hold .	these pictures learned that that hospital who these boxes heard did n't hold .
these crayons should n't remember what that spoon who might laugh had kept .	these crayons should n't remember that that spoon who might laugh had kept .
these candles learned what the toy who the spoons do n't hear holds .	these candles learned that the toy who the spoons do n't hear holds .
the shirts wo n't forget what that spoon who won makes .	the shirts wo n't forget that that spoon who won makes .
that doll learned what the cars who must buy the person have n't kept .	that doll learned that the cars who must buy the person have n't kept .
the bag saw what those chairs who those bottles had n't heard keep .	the bag saw that those chairs who those bottles had n't heard keep .
the windows saw what that park who is dropping this doctor should n't hold .	the windows saw that that park who is dropping this doctor should n't hold .
the bags saw what that bowl who was n't taking the king was n't buying .	the bags saw that that bowl who was n't taking the king was n't buying .
these candles did n't know what the candles who would know this hospital were n't holding .	these candles did n't know that the candles who would know this hospital were n't holding .
the truck could know what this button who this boat knew found .	the truck could know that this button who this boat knew found .
the rocket forgot who these doors who paint scare .	the rocket forgot that these doors who paint scare .
that shoe learned what those bottles who had n't painted were n't taking .	that shoe learned that those bottles who had n't painted were n't taking .
these cups can n't realize who those schools who are losing liked .	these cups can n't realize that those schools who are losing liked .
that ship should n't forget what these plates who wo n't wave held .	that ship should n't forget that these plates who wo n't wave held .
these cups had n't realized who that bed who had n't won was n't bothering .	these cups had n't realized that that bed who had n't won was n't bothering .
the windows notice who those rings who had n't lost hate .	the windows notice that those rings who had n't lost hate .
the shoes have seen what the button who knew this fork is n't making .	the shoes have seen that the button who knew this fork is n't making .
these windows had n't noticed what that doll who this dish did n't know will make .	these windows had n't noticed that that doll who this dish did n't know will make .
the bottles realize what those chairs who hear this bottle had made .	the bottles realize that those chairs who hear this bottle had made .
that window knew who those bowls who have laughed liked .	that window knew that those bowls who have laughed liked .
the shirts have noticed what these books who would n't move this queen would fix .	the shirts have noticed that these books who would n't move this queen would fix .
that car has learned what the button who won may buy .	that car has learned that the button who won may buy .
the chairs forgot what the bags who the books had heard have n't brought .	the chairs forgot that the bags who the books had heard have n't brought .
these forks wo n't realize what this truck who those doors have n't heard has n't fixed .	these forks wo n't realize that this truck who those doors have n't heard has n't fixed .
these books had n't learned who this park who was smiling would bother .	these books had n't learned that this park who was smiling would bother .
the window may see what this book who has n't yelled would n't fix .	the window may see that this book who has n't yelled would n't fix .
that door can n't realize what these schools who may move this customer were fixing .	that door can n't realize that these schools who may move this customer were fixing .
those spoons must remember who these bottles who do n't yell appreciate .	those spoons must remember that these bottles who do n't yell appreciate .
these trucks wo n't realize who the plate who did n't win has bothered .	these trucks wo n't realize that the plate who did n't win has bothered .
the shoe noticed what these dishes who would n't whisper were fixing .	the shoe noticed that these dishes who would n't whisper were fixing .
the bowls forget who that car who may know those doors may bother .	the bowls forget that that car who may know those doors may bother .
the spoon noticed who the dish who knew this restaurant was n't bothering .	the spoon noticed that the dish who knew this restaurant was n't bothering .
these buttons would n't see who this bed who had n't won would appreciate .	these buttons would n't see that this bed who had n't won would appreciate .
this rocket did n't know who the books who those chairs will know bothered .	this rocket did n't know that the books who those chairs will know bothered .
that couch wo n't see what that ring who was crying held .	that couch wo n't see that that ring who was crying held .
those hats notice what the ship who this plate heard made .	those hats notice that the ship who this plate heard made .
this couch remembered what those chairs who the forks knew make .	this couch remembered that those chairs who the forks knew make .
that candle did n't forget what these beds who sing stole .	that candle did n't forget that these beds who sing stole .
this spoon may see who those crayons who have n't heard the boat liked .	this spoon may see that those crayons who have n't heard the boat liked .
those candles would know what these schools who may fix this dentist fixed .	those candles would know that these schools who may fix this dentist fixed .
the trucks forget what the library who exercises was n't keeping .	the trucks forget that the library who exercises was n't keeping .
these hats may realize what these boats who would n't hear these doors must sell .	these hats may realize that these boats who would n't hear these doors must sell .
the car can n't realize who that shirt who hears that museum has liked .	the car can n't realize that that shirt who hears that museum has liked .
the cup saw what that book who would n't steal the king holds .	the cup saw that that book who would n't steal the king holds .
that truck wo n't remember what the school who the buttons had heard does n't hold .	that truck wo n't remember that the school who the buttons had heard does n't hold .
that hat can know what the cars who painted were taking .	that hat can know that the cars who painted were taking .
the boats saw what those crayons who are finding those men had found .	the boats saw that those crayons who are finding those men had found .
the chairs had seen what the fork who sang stole .	the chairs had seen that the fork who sang stole .
the box has n't seen who those beds who were n't taking that king bothered .	the box has n't seen that those beds who were n't taking that king bothered .
those books can n't forget what these schools who knew the forks buy .	those books can n't forget that these schools who knew the forks buy .
this door did n't realize what the fork who this hospital knew has n't taken .	this door did n't realize that the fork who this hospital knew has n't taken .
that doll wo n't forget who these cups who hear these books had n't scared .	that doll wo n't forget that these cups who hear these books had n't scared .
the glass forgot what this mall who had the women bought .	the glass forgot that this mall who had the women bought .
the truck realized what these cars who that mirror wo n't hear would keep .	the truck realized that these cars who that mirror wo n't hear would keep .
that bowl noticed what those glasses who had n't held this driver are making .	that bowl noticed that those glasses who had n't held this driver are making .
the window can n't realize what these schools who have cried might take .	the window can n't realize that these schools who have cried might take .
the box sees what that mall who is holding this doctor brings .	the box sees that that mall who is holding this doctor brings .
these cars would n't forget what the bottle who moves this customer had n't found .	these cars would n't forget that the bottle who moves this customer had n't found .
the picture has known who those cups who were n't talking must scare .	the picture has known that those cups who were n't talking must scare .
these cars saw what the boxes who could know that ring will fix .	these cars saw that the boxes who could know that ring will fix .
the shoes have n't noticed what that mirror who had heard those pictures bought .	the shoes have n't noticed that that mirror who had heard those pictures bought .
this rocket did n't see who those beds who are smiling wo n't appreciate .	this rocket did n't see that those beds who are smiling wo n't appreciate .
these dishes had learned what these windows who knew these hats had bought .	these dishes had learned that these windows who knew these hats had bought .
that toy saw what this fork who has n't heard this window took .	that toy saw that this fork who has n't heard this window took .
that button learned who these boxes who may hold that man hate .	that button learned that these boxes who may hold that man hate .
those cups learned who this doll who keeps those teachers is n't bothering .	those cups learned that this doll who keeps those teachers is n't bothering .
the ship has learned who this shoe who could hear that glass might appreciate .	the ship has learned that this shoe who could hear that glass might appreciate .
that button realized who these bowls who can n't cry bother .	that button realized that these bowls who can n't cry bother .
that rocket would know who the book who has talked liked .	that rocket would know that the book who has talked liked .
the shirt remembered who the hats who are yelling confused .	the shirt remembered that the hats who are yelling confused .
that door may realize what those boxes who were painting had bought .	that door may realize that those boxes who were painting had bought .
the hats forget what these hats who know this restaurant take .	the hats forget that these hats who know this restaurant take .
that box has n't known what these boxes who this rug knows have taken .	that box has n't known that these boxes who this rug knows have taken .
that bicycle should learn what this kitchen who is n't bringing those women brings .	that bicycle should learn that this kitchen who is n't bringing those women brings .
these doors saw what this boat who reads is n't making .	these doors saw that this boat who reads is n't making .
that toy could remember what the school who would n't whisper may fix .	that toy could remember that the school who would n't whisper may fix .
the beds learn who these cars who will hear that school praise .	the beds learn that these cars who will hear that school praise .
the plate has n't learned what the book who has n't cleaned the man held .	the plate has n't learned that the book who has n't cleaned the man held .
that box knows what these spoons who heard that mall had taken .	that box knows that these spoons who heard that mall had taken .
these glasses forget what this bowl who has n't held those men keeps .	these glasses forget that this bowl who has n't held those men keeps .
the buttons noticed what that bank who is finding this girl could hold .	the buttons noticed that that bank who is finding this girl could hold .
this car remembered who that park who wo n't sing has liked .	this car remembered that that park who wo n't sing has liked .
these shoes saw what these schools who exercise have found .	these shoes saw that these schools who exercise have found .
this dish sees what that book who had n't fixed the dentist bought .	this dish sees that that book who had n't fixed the dentist bought .
the bag had realized who the beds who bought these doctors scared .	the bag had realized that the beds who bought these doctors scared .
the spoon should remember who this car who is buying the children should like .	the spoon should remember that this car who is buying the children should like .
this picture can n't forget what this glass who reads has n't fixed .	this picture can n't forget that this glass who reads has n't fixed .
the cups see what this plane who had heard the room should bring .	the cups see that this plane who had heard the room should bring .
these hats would n't learn what that kitchen who that ring had heard fixed .	these hats would n't learn that that kitchen who that ring had heard fixed .
these doors had n't seen what the crayons who were n't yelling took .	these doors had n't seen that the crayons who were n't yelling took .
the chairs see what those cars who were reading buy .	the chairs see that those cars who were reading buy .
these dishes notice what this mirror who has n't cried makes .	these dishes notice that this mirror who has n't cried makes .
these buttons remembered who that mall who was n't reading may hate .	these buttons remembered that that mall who was n't reading may hate .
these shirts can know what this glass who heard the chair holds .	these shirts can know that this glass who heard the chair holds .
the dishes could learn who the boats who can sell these children are n't bothering .	the dishes could learn that the boats who can sell these children are n't bothering .
these doors should n't remember who that bag who can n't buy the children likes .	these doors should n't remember that that bag who can n't buy the children likes .
those windows had n't noticed what the bowls who this fork knew were n't taking .	those windows had n't noticed that the bowls who this fork knew were n't taking .
those pictures have learned what the shirts who are n't fixing that child had taken .	those pictures have learned that the shirts who are n't fixing that child had taken .
that box knows who that door who did n't know the pictures might hate .	that box knows that that door who did n't know the pictures might hate .
those cars might see who those buttons who these books heard will hate .	those cars might see that those buttons who these books heard will hate .
these glasses have noticed what the schools who were whispering have found .	these glasses have noticed that the schools who were whispering have found .
those dolls had seen what these pictures who had n't won would n't hold .	those dolls had seen that these pictures who had n't won would n't hold .
the boxes saw what the boxes who lose might make .	the boxes saw that the boxes who lose might make .
those cars realize who these forks who can lose should bother .	those cars realize that these forks who can lose should bother .
this door must remember what this boat who was n't yelling would n't steal .	this door must remember that this boat who was n't yelling would n't steal .
the doll forgot who the hats who hear the plates would hate .	the doll forgot that the hats who hear the plates would hate .
these spoons could n't see what the bank who wo n't lose would n't sell .	these spoons could n't see that the bank who wo n't lose would n't sell .
that car saw what the truck who the bicycle had n't heard had n't kept .	that car saw that the truck who the bicycle had n't heard had n't kept .
those crayons can n't remember what that car who heard these bowls keeps .	those crayons can n't remember that that car who heard these bowls keeps .
the box has known what this rocket who did n't hear this rocket should n't take .	the box has known that this rocket who did n't hear this rocket should n't take .
this rocket learned what the restaurant who knows the cups had n't made .	this rocket learned that the restaurant who knows the cups had n't made .
those doors forget what the school who throws that adult kept .	those doors forget that the school who throws that adult kept .
the dishes see who this bag who does n't stretch did n't scare .	the dishes see that this bag who does n't stretch did n't scare .
