my boss your cousins these teachers care for scare sings .	my boss your cousins these teachers care for sings .
the dentist these doctors those people visit scare paints .	the dentist these doctors those people visit paints .
the dancer your teachers the teachers care for worry reads .	the dancer your teachers the teachers care for reads .
the child those people those doctors praise teach paints .	the child those people those doctors praise paints .
my doctors my teacher your teacher scares talks to laugh .	my doctors my teacher your teacher scares laugh .
my teacher the doctors those children talk to visit talks .	my teacher the doctors those children talk to talks .
the teacher my doctors these teachers care for understand paints .	the teacher my doctors these teachers care for paints .
my doctor these people your teachers care for teach sings .	my doctor these people your teachers care for sings .
the doctor the people the teachers work with teach paints .	the doctor the people the teachers work with paints .
your cousin my doctors my teachers answer talk to cries .	your cousin my doctors my teachers answer cries .
your dentist my teachers my friends appreciate appreciate cries .	your dentist my teachers my friends appreciate cries .
my friend your doctors the doctors help talk to talks .	my friend your doctors the doctors help talks .
your cousin your teachers those teachers praise talk to sings .	your cousin your teachers those teachers praise sings .
that person these children those teachers appreciate care for waves .	that person these children those teachers appreciate waves .
my teacher my friends your cousins worry praise cries .	my teacher my friends your cousins worry cries .
your cousin those children your teachers help visit waves .	your cousin those children your teachers help waves .
that dentist these people my friends praise listen to paints .	that dentist these people my friends praise paints .
this adult your friends those people understand visit sings .	this adult your friends those people understand sings .
that person your teachers my cousins work with appreciate cries .	that person your teachers my cousins work with cries .
my cousins your boss that customer helps helps cough .	my cousins your boss that customer helps cough .
this customer my cousins my cousins scare care for talks .	this customer my cousins my cousins scare talks .
the driver these people these people worry praise paints .	the driver these people these people worry paints .
my friends that child your boss understands understands stretch .	my friends that child your boss understands stretch .
those doctors your boss my cousin scares talks to talk .	those doctors your boss my cousin scares talk .
this adult your cousins my teachers worry appreciate talks .	this adult your cousins my teachers worry talks .
the dentist the teachers these people talk to answer reads .	the dentist the teachers these people talk to reads .
these people the customer this adult understands understands lose .	these people the customer this adult understands lose .
that dentist your cousins these children care for teach exercises .	that dentist your cousins these children care for exercises .
my teachers your cousin that dancer talks to scares lose .	my teachers your cousin that dancer talks to lose .
your doctor the children these teachers appreciate care for talks .	your doctor the children these teachers appreciate talks .
this dancer the children these teachers worry appreciate reads .	this dancer the children these teachers worry reads .
this dancer those teachers these people listen to care for waves .	this dancer those teachers these people listen to waves .
my doctors my dentist your friend helps talks to read .	my doctors my dentist your friend helps read .
that dentist my teachers these teachers care for scare sings .	that dentist my teachers these teachers care for sings .
my cousin those people your teachers bother scare talks .	my cousin those people your teachers bother talks .
my cousin these people your friends scare work with exercises .	my cousin these people your friends scare exercises .
my dentist my cousins these children listen to visit cries .	my dentist my cousins these children listen to cries .
that person the children my teachers help care for reads .	that person the children my teachers help reads .
my teachers your friend your doctor understands works with scream .	my teachers your friend your doctor understands scream .
your cousins that customer the doctor helps works with yell .	your cousins that customer the doctor helps yell .
my cousin my teachers these children appreciate praise talks .	my cousin my teachers these children appreciate talks .
your cousin your teachers my friends work with worry waves .	your cousin your teachers my friends work with waves .
the dancer these children these children scare scare talks .	the dancer these children these children scare talks .
your dentist your friends these doctors bother appreciate cries .	your dentist your friends these doctors bother cries .
my dentist your cousins these teachers help praise talks .	my dentist your cousins these teachers help talks .
the customer these teachers these children help talk to sings .	the customer these teachers these children help sings .
this dancer these teachers the doctors visit worry cries .	this dancer these teachers the doctors visit cries .
your boss your friends your friends listen to appreciate talks .	your boss your friends your friends listen to talks .
my boss my teachers the people praise talk to talks .	my boss my teachers the people praise talks .
those teachers your boss this teacher helps talks to read .	those teachers your boss this teacher helps read .
this teacher my friends your friends care for appreciate reads .	this teacher my friends your friends care for reads .
my boss your friends these doctors answer care for waves .	my boss your friends these doctors answer waves .
your dentist those children your cousins worry worry cries .	your dentist those children your cousins worry cries .
these doctors this patient your dentist understands talks to laugh .	these doctors this patient your dentist understands laugh .
my teacher your friends my doctors visit understand talks .	my teacher your friends my doctors visit talks .
that dancer those people the people teach teach talks .	that dancer those people the people teach talks .
my boss these teachers these people work with understand talks .	my boss these teachers these people work with talks .
this dancer those children my doctors work with praise waves .	this dancer those children my doctors work with waves .
your teacher these teachers your doctors help help exercises .	your teacher these teachers your doctors help exercises .
these teachers my friend your teacher understands helps lose .	these teachers my friend your teacher understands lose .
the teachers your cousin your doctor scares scares lose .	the teachers your cousin your doctor scares lose .
your friend my doctors your teachers worry visit exercises .	your friend my doctors your teachers worry exercises .
your teacher the doctors your teachers work with work with paints .	your teacher the doctors your teachers work with paints .
that teacher those doctors the teachers listen to scare sings .	that teacher those doctors the teachers listen to sings .
my cousin those teachers my friends praise praise paints .	my cousin those teachers my friends praise paints .
your dentist the doctors these children talk to bother sings .	your dentist the doctors these children talk to sings .
this dentist my teachers the doctors care for visit cries .	this dentist my teachers the doctors care for cries .
this teacher my doctors the people teach visit cries .	this teacher my doctors the people teach cries .
your friend my cousins the people scare care for cries .	your friend my cousins the people scare cries .
this customer your cousins these doctors help appreciate cries .	this customer your cousins these doctors help cries .
my friends your boss my teacher understands scares practice .	my friends your boss my teacher understands practice .
the driver the people your teachers listen to bother paints .	the driver the people your teachers listen to paints .
my doctor your teachers those doctors care for listen to exercises .	my doctor your teachers those doctors care for exercises .
that person my friends these children care for listen to paints .	that person my friends these children care for paints .
that teacher your doctors these children praise listen to paints .	that teacher your doctors these children praise paints .
your dentist your friends those doctors listen to appreciate reads .	your dentist your friends those doctors listen to reads .
the people that teacher your teacher works with understands smile .	the people that teacher your teacher works with smile .
my cousin my teachers these teachers teach listen to talks .	my cousin my teachers these teachers teach talks .
that dentist my teachers my cousins scare help reads .	that dentist my teachers my cousins scare reads .
the teacher these teachers your cousins work with talk to sings .	the teacher these teachers your cousins work with sings .
my friend my friends your friends answer answer reads .	my friend my friends your friends answer reads .
that driver the children my friends teach understand talks .	that driver the children my friends teach talks .
your cousin these people my cousins bother talk to exercises .	your cousin these people my cousins bother exercises .
those people my boss the person works with scares lose .	those people my boss the person works with lose .
the driver these people those teachers scare care for reads .	the driver these people those teachers scare reads .
that dancer my cousins these children visit scare reads .	that dancer my cousins these children visit reads .
that customer my teachers the teachers visit understand sings .	that customer my teachers the teachers visit sings .
your cousins this customer this dancer works with talks to stretch .	your cousins this customer this dancer works with stretch .
the driver these doctors these doctors bother worry reads .	the driver these doctors these doctors bother reads .
the child your cousins my friends praise scare talks .	the child your cousins my friends praise talks .
this child your friends my teachers answer care for reads .	this child your friends my teachers answer reads .
my teachers your boss that customer understands understands scream .	my teachers your boss that customer understands scream .
the customer my doctors my teachers work with bother cries .	the customer my doctors my teachers work with cries .
my doctor my cousins my cousins bother appreciate reads .	my doctor my cousins my cousins bother reads .
the person my doctors your friends teach care for cries .	the person my doctors your friends teach cries .
your dentist these people those people talk to care for exercises .	your dentist these people those people talk to exercises .
my doctors the person my doctor understands talks to wave .	my doctors the person my doctor understands wave .
your doctors your dentist my doctor works with understands stretch .	your doctors your dentist my doctor works with stretch .
my doctors my boss the customer understands works with stretch .	my doctors my boss the customer understands stretch .
your boss those people my doctors visit worry talks .	your boss those people my doctors visit talks .
my cousin those teachers your doctors care for understand cries .	my cousin those teachers your doctors care for cries .
my boss your cousins my teachers teach help cries .	my boss your cousins my teachers teach cries .
the doctor those doctors my doctors listen to listen to sings .	the doctor those doctors my doctors listen to sings .
the dancer these teachers the people care for visit exercises .	the dancer these teachers the people care for exercises .
the child your friends my friends care for worry waves .	the child your friends my friends care for waves .
your friends this patient the person understands talks to read .	your friends this patient the person understands read .
your doctor those children your cousins help care for waves .	your doctor those children your cousins help waves .
the person the teachers my doctors teach help cries .	the person the teachers my doctors teach cries .
that dancer my friends those children work with talk to paints .	that dancer my friends those children work with paints .
my teachers that doctor your dentist understands works with wave .	my teachers that doctor your dentist understands wave .
my doctors my teacher that dentist works with scares scream .	my doctors my teacher that dentist works with scream .
your doctor those doctors those doctors visit answer exercises .	your doctor those doctors those doctors visit exercises .
my friend your doctors my friends worry worry cries .	my friend your doctors my friends worry cries .
this teacher my cousins these children teach teach cries .	this teacher my cousins these children teach cries .
your dentist these teachers your cousins work with talk to talks .	your dentist these teachers your cousins work with talks .
your doctor my doctors my cousins answer visit waves .	your doctor my doctors my cousins answer waves .
your friend these people your cousins appreciate help paints .	your friend these people your cousins appreciate paints .
your teacher the children these children help understand talks .	your teacher the children these children help talks .
my doctor my doctors those people appreciate worry cries .	my doctor my doctors those people appreciate cries .
the children this adult my teacher helps works with scream .	the children this adult my teacher helps scream .
this patient my doctors my teachers praise care for paints .	this patient my doctors my teachers praise paints .
your boss the teachers my cousins answer talk to reads .	your boss the teachers my cousins answer reads .
the people this doctor that person helps talks to whisper .	the people this doctor that person helps whisper .
your teacher the people these children understand scare cries .	your teacher the people these children understand cries .
the people my friend the dentist scares helps lose .	the people my friend the dentist scares lose .
your dentist these doctors your cousins talk to work with paints .	your dentist these doctors your cousins talk to paints .
my cousin your cousins my teachers appreciate bother waves .	my cousin your cousins my teachers appreciate waves .
your friends that dancer this dentist understands works with lose .	your friends that dancer this dentist understands lose .
my boss my friends these doctors teach bother paints .	my boss my friends these doctors teach paints .
the customer my teachers my teachers help scare waves .	the customer my teachers my teachers help waves .
your friend your teachers my friends listen to teach talks .	your friend your teachers my friends listen to talks .
your teachers the child the teacher talks to scares scream .	your teachers the child the teacher talks to scream .
this dancer the children those doctors appreciate understand waves .	this dancer the children those doctors appreciate waves .
this driver those children my friends visit care for talks .	this driver those children my friends visit talks .
my cousins the driver this patient talks to scares yell .	my cousins the driver this patient talks to yell .
this dancer those doctors my doctors praise visit sings .	this dancer those doctors my doctors praise sings .
your teachers the doctor your teacher works with understands exercise .	your teachers the doctor your teacher works with exercise .
those people that dentist your boss understands helps cry .	those people that dentist your boss understands cry .
that adult your friends your cousins work with work with exercises .	that adult your friends your cousins work with exercises .
these people your friend this patient works with scares laugh .	these people your friend this patient works with laugh .
my dentist my cousins your cousins worry bother cries .	my dentist my cousins your cousins worry cries .
your teacher these people my friends listen to listen to cries .	your teacher these people my friends listen to cries .
your doctor your cousins those people work with worry talks .	your doctor your cousins those people work with talks .
my cousins that teacher my doctor understands helps exercise .	my cousins that teacher my doctor understands exercise .
the adult my friends your doctors care for scare exercises .	the adult my friends your doctors care for exercises .
my doctor these children the teachers visit praise exercises .	my doctor these children the teachers visit exercises .
your teachers the child my cousin scares helps cry .	your teachers the child my cousin scares cry .
these teachers your doctor your friend scares helps win .	these teachers your doctor your friend scares win .
my cousin the teachers my cousins help scare cries .	my cousin the teachers my cousins help cries .
your teacher these doctors my teachers appreciate worry cries .	your teacher these doctors my teachers appreciate cries .
this dancer those people your cousins worry scare exercises .	this dancer those people your cousins worry exercises .
your boss those teachers your doctors praise bother reads .	your boss those teachers your doctors praise reads .
the teacher these teachers your teachers bother appreciate talks .	the teacher these teachers your teachers bother talks .
your friends this dentist this patient talks to helps sing .	your friends this dentist this patient talks to sing .
your doctor these people these doctors understand appreciate talks .	your doctor these people these doctors understand talks .
the doctor your friends your friends visit worry paints .	the doctor your friends your friends visit paints .
your doctor my doctors my cousins scare visit cries .	your doctor my doctors my cousins scare cries .
your dentist my friends these people scare help cries .	your dentist my friends these people scare cries .
my dentist the doctors your cousins scare listen to talks .	my dentist the doctors your cousins scare talks .
this adult your doctors your teachers help bother reads .	this adult your doctors your teachers help reads .
the child these children your friends help worry talks .	the child these children your friends help talks .
that doctor these doctors these teachers appreciate care for waves .	that doctor these doctors these teachers appreciate waves .
your cousin the teachers these teachers scare understand paints .	your cousin the teachers these teachers scare paints .
the driver my friends the children scare care for paints .	the driver my friends the children scare paints .
that person your doctors your doctors appreciate appreciate waves .	that person your doctors your doctors appreciate waves .
that teacher those people these doctors visit understand cries .	that teacher those people these doctors visit cries .
that dancer your doctors your teachers help help exercises .	that dancer your doctors your teachers help exercises .
these people my boss my dentist helps understands paint .	these people my boss my dentist helps paint .
my dentist my teachers the doctors scare care for exercises .	my dentist my teachers the doctors scare exercises .
the teacher these doctors those people worry teach paints .	the teacher these doctors those people worry paints .
the customer these teachers the people listen to worry exercises .	the customer these teachers the people listen to exercises .
the teacher your teachers those children praise talk to reads .	the teacher your teachers those children praise reads .
your boss your friends those children understand bother exercises .	your boss your friends those children understand exercises .
your teachers that child my doctor helps talks to scream .	your teachers that child my doctor helps scream .
your teacher the children the children worry appreciate waves .	your teacher the children the children worry waves .
that doctor these teachers your friends talk to listen to cries .	that doctor these teachers your friends talk to cries .
that patient the people those teachers scare talk to paints .	that patient the people those teachers scare paints .
my friends my boss the dancer scares talks to yell .	my friends my boss the dancer scares yell .
your doctor your cousins my doctors visit worry waves .	your doctor your cousins my doctors visit waves .
the dentist these teachers your friends listen to work with waves .	the dentist these teachers your friends listen to waves .
my boss these children my doctors praise visit waves .	my boss these children my doctors praise waves .
my doctors the patient your doctor helps scares stretch .	my doctors the patient your doctor helps stretch .
those people that child that person understands understands lie .	those people that child that person understands lie .
my dentist those teachers these people visit bother sings .	my dentist those teachers these people visit sings .
this patient the people those doctors understand help reads .	this patient the people those doctors understand reads .
my boss those teachers your cousins answer talk to paints .	my boss those teachers your cousins answer paints .
your boss these teachers these children worry worry waves .	your boss these teachers these children worry waves .
your doctor your teachers those doctors scare scare sings .	your doctor your teachers those doctors scare sings .
my teachers that dentist this customer understands scares whisper .	my teachers that dentist this customer understands whisper .
your friend my cousins your teachers answer talk to waves .	your friend my cousins your teachers answer waves .
the customer these doctors my teachers teach visit sings .	the customer these doctors my teachers teach sings .
this dentist my doctors these teachers answer help reads .	this dentist my doctors these teachers answer reads .
the teachers my teacher the patient helps talks to talk .	the teachers my teacher the patient helps talk .
that customer those teachers your friends care for praise exercises .	that customer those teachers your friends care for exercises .
my boss your friends my cousins help understand sings .	my boss your friends my cousins help sings .
your cousin your friends those children listen to worry reads .	your cousin your friends those children listen to reads .
my cousin your friends my friends scare bother sings .	my cousin your friends my friends scare sings .
your friend the children those teachers visit appreciate sings .	your friend the children those teachers visit sings .
the adult these teachers my friends worry appreciate cries .	the adult these teachers my friends worry cries .
those children my dentist this dancer helps talks to talk .	those children my dentist this dancer helps talk .
your teacher the teachers my doctors scare scare reads .	your teacher the teachers my doctors scare reads .
my doctor my friends your doctors praise understand cries .	my doctor my friends your doctors praise cries .
the dentist your cousins these children answer teach reads .	the dentist your cousins these children answer reads .
the doctors the teacher my teacher helps talks to exercise .	the doctors the teacher my teacher helps exercise .
these children the driver the patient talks to understands read .	these children the driver the patient talks to read .
this teacher my friends my cousins scare bother exercises .	this teacher my friends my cousins scare exercises .
my dentist my teachers the doctors scare praise talks .	my dentist my teachers the doctors scare talks .
this teacher those people my cousins care for visit talks .	this teacher those people my cousins care for talks .
your cousin the teachers your cousins appreciate help sings .	your cousin the teachers your cousins appreciate sings .
that doctor your cousins my doctors work with understand talks .	that doctor your cousins my doctors work with talks .
this dentist your cousins these teachers talk to help paints .	this dentist your cousins these teachers talk to paints .
my doctors that doctor that child helps works with laugh .	my doctors that doctor that child helps laugh .
your cousins the customer this adult works with talks to sing .	your cousins the customer this adult works with sing .
your dentist those doctors the doctors understand understand sings .	your dentist those doctors the doctors understand sings .
this doctor the doctors those children scare visit paints .	this doctor the doctors those children scare paints .
your boss my cousins those doctors teach talk to cries .	your boss my cousins those doctors teach cries .
these people the patient the dentist understands works with yell .	these people the patient the dentist understands yell .
your friend the children these people visit visit talks .	your friend the children these people visit talks .
my doctors that child this doctor helps understands scream .	my doctors that child this doctor helps scream .
your teacher these doctors these teachers praise help cries .	your teacher these doctors these teachers praise cries .
your cousin these children these people scare bother reads .	your cousin these children these people scare reads .
your friend my teachers these doctors visit appreciate talks .	your friend my teachers these doctors visit talks .
my cousin my cousins your cousins listen to bother reads .	my cousin my cousins your cousins listen to reads .
your cousin these doctors your teachers work with worry reads .	your cousin these doctors your teachers work with reads .
the child the doctors my cousins scare help cries .	the child the doctors my cousins scare cries .
the dancer your doctors these children bother teach talks .	the dancer your doctors these children bother talks .
