your boss my doctors your doctors work with visit waves .	your boss my doctors your doctors work with waves .
my doctors this customer your doctor helps helps read .	my doctors this customer your doctor helps read .
your cousin my teachers these children understand help paints .	your cousin my teachers these children understand paints .
the customer these people my friends bother care for waves .	the customer these people my friends bother waves .
the person your friends those children visit answer paints .	the person your friends those children visit paints .
your boss these doctors your friends bother understand waves .	your boss these doctors your friends bother waves .
your dentist these people those doctors care for listen to reads .	your dentist these people those doctors care for reads .
the doctor the children my teachers talk to appreciate talks .	the doctor the children my teachers talk to talks .
these children the adult my doctor scares talks to cry .	these children the adult my doctor scares cry .
those teachers my cousin your friend scares talks to laugh .	those teachers my cousin your friend scares laugh .
my teacher my cousins your cousins help talk to waves .	my teacher my cousins your cousins help waves .
the doctors my teacher this adult understands understands laugh .	the doctors my teacher this adult understands laugh .
your teacher your friends my teachers care for appreciate talks .	your teacher your friends my teachers care for talks .
your boss these teachers my teachers praise talk to paints .	your boss these teachers my teachers praise paints .
your cousins this driver the dentist talks to scares stretch .	your cousins this driver the dentist talks to stretch .
your friend those teachers those people help work with cries .	your friend those teachers those people help cries .
my doctor my doctors my cousins visit help cries .	my doctor my doctors my cousins visit cries .
your cousin my cousins those children answer visit paints .	your cousin my cousins those children answer paints .
this patient those children these teachers bother answer reads .	this patient those children these teachers bother reads .
that customer my friends my cousins bother work with reads .	that customer my friends my cousins bother reads .
my cousins my boss my cousin scares works with paint .	my cousins my boss my cousin scares paint .
the teacher my cousins the teachers listen to scare paints .	the teacher my cousins the teachers listen to paints .
the patient my cousins my friends work with talk to exercises .	the patient my cousins my friends work with exercises .
my cousin the children your teachers care for scare waves .	my cousin the children your teachers care for waves .
the driver your teachers these children appreciate work with sings .	the driver your teachers these children appreciate sings .
your doctor my doctors those teachers understand bother exercises .	your doctor my doctors those teachers understand exercises .
these children your doctor your dentist helps understands scream .	these children your doctor your dentist helps scream .
that doctor my cousins my cousins listen to worry sings .	that doctor my cousins my cousins listen to sings .
that doctor my cousins these people worry worry waves .	that doctor my cousins these people worry waves .
the patient your friends your cousins listen to care for waves .	the patient your friends your cousins listen to waves .
this patient your cousins your doctors praise talk to waves .	this patient your cousins your doctors praise waves .
your friends my friend my teacher talks to scares laugh .	your friends my friend my teacher talks to laugh .
your boss your friends my teachers scare scare waves .	your boss your friends my teachers scare waves .
the customer these teachers the teachers talk to worry talks .	the customer these teachers the teachers talk to talks .
this driver my teachers the people praise bother exercises .	this driver my teachers the people praise exercises .
my cousin those doctors the people appreciate worry exercises .	my cousin those doctors the people appreciate exercises .
my cousin these doctors those doctors help worry sings .	my cousin these doctors those doctors help sings .
your boss the doctors my doctors appreciate teach paints .	your boss the doctors my doctors appreciate paints .
your teacher your friends these teachers listen to visit talks .	your teacher your friends these teachers listen to talks .
that adult my friends those teachers teach teach sings .	that adult my friends those teachers teach sings .
the dentist the teachers those doctors teach worry sings .	the dentist the teachers those doctors teach sings .
my dentist those teachers the children visit praise talks .	my dentist those teachers the children visit talks .
my teacher your doctors these doctors care for answer talks .	my teacher your doctors these doctors care for talks .
my cousin those teachers my cousins listen to listen to exercises .	my cousin those teachers my cousins listen to exercises .
your doctor my cousins those teachers listen to appreciate talks .	your doctor my cousins those teachers listen to talks .
this driver these teachers those teachers understand praise waves .	this driver these teachers those teachers understand waves .
your teacher these children your teachers help help paints .	your teacher these children your teachers help paints .
my cousin your friends my doctors appreciate scare sings .	my cousin your friends my doctors appreciate sings .
your dentist your doctors your friends teach help paints .	your dentist your doctors your friends teach paints .
my cousin your doctors the doctors talk to listen to sings .	my cousin your doctors the doctors talk to sings .
this adult your friends your doctors teach understand cries .	this adult your friends your doctors teach cries .
your doctor your teachers these teachers appreciate worry exercises .	your doctor your teachers these teachers appreciate exercises .
your cousin those doctors those people praise talk to reads .	your cousin those doctors those people praise reads .
my boss your doctors those teachers teach answer talks .	my boss your doctors those teachers teach talks .
these children that doctor my boss works with understands lose .	these children that doctor my boss works with lose .
my cousin my doctors your cousins understand teach exercises .	my cousin my doctors your cousins understand exercises .
your boss those doctors your teachers work with understand waves .	your boss those doctors your teachers work with waves .
your boss the children my cousins help listen to exercises .	your boss the children my cousins help exercises .
the child the people the teachers teach care for talks .	the child the people the teachers teach talks .
this driver your cousins your cousins talk to praise sings .	this driver your cousins your cousins talk to sings .
my dentist the teachers your cousins worry understand paints .	my dentist the teachers your cousins worry paints .
my boss my doctors my friends praise visit reads .	my boss my doctors my friends praise reads .
your friends your friend the dentist scares talks to sing .	your friends your friend the dentist scares sing .
my cousin those doctors my teachers care for appreciate paints .	my cousin those doctors my teachers care for paints .
this adult my doctors your teachers help visit talks .	this adult my doctors your teachers help talks .
the people my doctor the child helps scares cry .	the people my doctor the child helps cry .
this doctor your teachers those teachers care for care for waves .	this doctor your teachers those teachers care for waves .
my cousin your doctors your doctors visit bother talks .	my cousin your doctors your doctors visit talks .
your cousin those doctors those children help worry cries .	your cousin those doctors those children help cries .
this driver these teachers your teachers scare scare exercises .	this driver these teachers your teachers scare exercises .
this driver these teachers the teachers praise listen to talks .	this driver these teachers the teachers praise talks .
that adult the doctors those teachers understand understand paints .	that adult the doctors those teachers understand paints .
the people this dentist this doctor works with understands smile .	the people this dentist this doctor works with smile .
your friend the doctors those teachers scare talk to cries .	your friend the doctors those teachers scare cries .
that doctor your teachers those teachers care for help talks .	that doctor your teachers those teachers care for talks .
that dancer the people your cousins work with worry sings .	that dancer the people your cousins work with sings .
that dancer these children those children listen to understand waves .	that dancer these children those children listen to waves .
that teacher your doctors my friends work with praise exercises .	that teacher your doctors my friends work with exercises .
the driver my cousins those children visit talk to paints .	the driver my cousins those children visit paints .
your dentist my friends these teachers teach listen to talks .	your dentist my friends these teachers teach talks .
the person my cousins the teachers listen to appreciate paints .	the person my cousins the teachers listen to paints .
my friend your friends your friends bother answer sings .	my friend your friends your friends bother sings .
that person the doctors your friends scare worry paints .	that person the doctors your friends scare paints .
your friends that teacher my teacher works with scares wave .	your friends that teacher my teacher works with wave .
the doctors the patient my dentist helps understands whisper .	the doctors the patient my dentist helps whisper .
these teachers that person the driver helps works with practice .	these teachers that person the driver helps practice .
the teacher those people these children appreciate scare cries .	the teacher those people these children appreciate cries .
your boss my doctors your doctors care for answer reads .	your boss my doctors your doctors care for reads .
those doctors my boss the driver works with understands cry .	those doctors my boss the driver works with cry .
my friends your cousin my friend works with helps read .	my friends your cousin my friend works with read .
your cousins this patient your cousin scares understands talk .	your cousins this patient your cousin scares talk .
the driver the children your teachers appreciate understand paints .	the driver the children your teachers appreciate paints .
your cousins your friend your doctor works with scares yell .	your cousins your friend your doctor works with yell .
my doctors this child my dentist helps scares whisper .	my doctors this child my dentist helps whisper .
my doctor my friends the people help scare waves .	my doctor my friends the people help waves .
this driver those people these doctors appreciate help exercises .	this driver those people these doctors appreciate exercises .
the teachers your doctor your boss scares talks to stretch .	the teachers your doctor your boss scares stretch .
this person my friends my teachers praise bother reads .	this person my friends my teachers praise reads .
that patient these doctors the children care for care for cries .	that patient these doctors the children care for cries .
that person these children the children listen to help paints .	that person these children the children listen to paints .
these people this customer my cousin scares understands scream .	these people this customer my cousin scares scream .
your doctor my friends those people praise listen to cries .	your doctor my friends those people praise cries .
my boss the doctors these people scare talk to exercises .	my boss the doctors these people scare exercises .
your cousin the people your friends listen to listen to sings .	your cousin the people your friends listen to sings .
my boss my doctors the people understand scare reads .	my boss my doctors the people understand reads .
my friend these people my doctors scare talk to talks .	my friend these people my doctors scare talks .
your cousin those people your doctors care for work with cries .	your cousin those people your doctors care for cries .
these teachers this person your friend works with scares yell .	these teachers this person your friend works with yell .
my cousins that doctor that person understands scares whisper .	my cousins that doctor that person understands whisper .
that child your friends your friends understand answer cries .	that child your friends your friends understand cries .
your friend my doctors my teachers worry visit reads .	your friend my doctors my teachers worry reads .
your boss my cousins these people praise work with paints .	your boss my cousins these people praise paints .
this person your teachers my cousins praise visit paints .	this person your teachers my cousins praise paints .
my doctor my teachers those teachers work with appreciate cries .	my doctor my teachers those teachers work with cries .
the doctors my boss the adult works with understands sneeze .	the doctors my boss the adult works with sneeze .
your teacher your cousins these teachers appreciate work with waves .	your teacher your cousins these teachers appreciate waves .
the person those children your friends answer help paints .	the person those children your friends answer paints .
your teacher my teachers the children appreciate teach paints .	your teacher my teachers the children appreciate paints .
my cousin your cousins those teachers help teach reads .	my cousin your cousins those teachers help reads .
this dancer those teachers these teachers talk to visit exercises .	this dancer those teachers these teachers talk to exercises .
the driver your doctors these children care for help exercises .	the driver your doctors these children care for exercises .
your friend my teachers these people understand bother reads .	your friend my teachers these people understand reads .
this teacher those people the people listen to praise cries .	this teacher those people the people listen to cries .
the doctor my teachers your friends visit appreciate sings .	the doctor my teachers your friends visit sings .
this dancer your friends these teachers worry work with reads .	this dancer your friends these teachers worry reads .
this teacher my friends your friends bother listen to reads .	this teacher my friends your friends bother reads .
my doctor the doctors the doctors work with teach paints .	my doctor the doctors the doctors work with paints .
the child the people these doctors help understand exercises .	the child the people these doctors help exercises .
that adult the children your teachers worry work with sings .	that adult the children your teachers worry sings .
this child the doctors those teachers appreciate understand waves .	this child the doctors those teachers appreciate waves .
my friend your doctors your friends scare visit cries .	my friend your doctors your friends scare cries .
those children my friend my teacher helps works with practice .	those children my friend my teacher helps practice .
this doctor my doctors these teachers visit talk to paints .	this doctor my doctors these teachers visit paints .
your cousin these people the doctors teach talk to paints .	your cousin these people the doctors teach paints .
my dentist those people your teachers work with visit exercises .	my dentist those people your teachers work with exercises .
your dentist these doctors my teachers talk to care for reads .	your dentist these doctors my teachers talk to reads .
that dentist the people these people bother worry exercises .	that dentist the people these people bother exercises .
these doctors my teacher that dancer works with works with talk .	these doctors my teacher that dancer works with talk .
that dancer the children my teachers care for praise reads .	that dancer the children my teachers care for reads .
your doctor these children my teachers talk to talk to talks .	your doctor these children my teachers talk to talks .
that driver your cousins the people scare visit paints .	that driver your cousins the people scare paints .
those children my boss that person works with talks to wave .	those children my boss that person works with wave .
your dentist my friends the teachers appreciate understand exercises .	your dentist my friends the teachers appreciate exercises .
the doctors this dentist my teacher understands helps laugh .	the doctors this dentist my teacher understands laugh .
the customer those doctors your friends appreciate scare sings .	the customer those doctors your friends appreciate sings .
these teachers my cousin the teacher talks to talks to whisper .	these teachers my cousin the teacher talks to whisper .
my boss my doctors my teachers visit worry reads .	my boss my doctors my teachers visit reads .
my teacher these teachers those children work with worry talks .	my teacher these teachers those children work with talks .
the child your teachers your teachers help teach cries .	the child your teachers your teachers help cries .
this driver my teachers these teachers understand listen to reads .	this driver my teachers these teachers understand reads .
the doctor my doctors the people listen to answer waves .	the doctor my doctors the people listen to waves .
my boss your doctors your teachers answer work with cries .	my boss your doctors your teachers answer cries .
your dentist your cousins my teachers teach help sings .	your dentist your cousins my teachers teach sings .
my cousin the people your friends help talk to sings .	my cousin the people your friends help sings .
my doctor the people those people answer listen to reads .	my doctor the people those people answer reads .
my cousin these people those children teach worry waves .	my cousin these people those children teach waves .
my dentist those people these doctors care for help talks .	my dentist those people these doctors care for talks .
the children my doctor that person works with scares practice .	the children my doctor that person works with practice .
this child your friends these children care for scare reads .	this child your friends these children care for reads .
my boss these children my doctors understand teach reads .	my boss these children my doctors understand reads .
that patient these children these doctors work with work with talks .	that patient these children these doctors work with talks .
this adult your doctors the people talk to answer waves .	this adult your doctors the people talk to waves .
that dentist those doctors those doctors answer worry talks .	that dentist those doctors those doctors answer talks .
your dentist these children these teachers listen to answer sings .	your dentist these children these teachers listen to sings .
my boss the children these doctors work with teach waves .	my boss the children these doctors work with waves .
your dentist those doctors my cousins answer listen to talks .	your dentist those doctors my cousins answer talks .
your cousin those children your teachers praise understand reads .	your cousin those children your teachers praise reads .
those teachers this teacher the doctor works with scares cry .	those teachers this teacher the doctor works with cry .
my boss these people these teachers listen to visit cries .	my boss these people these teachers listen to cries .
my teacher your friends those doctors praise answer cries .	my teacher your friends those doctors praise cries .
my dentist my teachers my teachers praise worry sings .	my dentist my teachers my teachers praise sings .
these doctors that child your boss helps scares smile .	these doctors that child your boss helps smile .
that adult the people your teachers work with care for waves .	that adult the people your teachers work with waves .
my cousin these people the children answer scare paints .	my cousin these people the children answer paints .
this child these doctors my teachers teach teach sings .	this child these doctors my teachers teach sings .
the patient my doctors my teachers talk to care for reads .	the patient my doctors my teachers talk to reads .
the teachers my dentist the adult helps talks to yell .	the teachers my dentist the adult helps yell .
that patient the people your friends care for answer sings .	that patient the people your friends care for sings .
the dentist my doctors my teachers help scare waves .	the dentist my doctors my teachers help waves .
this dancer your friends these doctors answer answer reads .	this dancer your friends these doctors answer reads .
my cousin your teachers my doctors answer work with cries .	my cousin your teachers my doctors answer cries .
your doctor my teachers the teachers visit help cries .	your doctor my teachers the teachers visit cries .
my dentist these teachers the doctors visit understand talks .	my dentist these teachers the doctors visit talks .
my doctor these people these teachers listen to bother sings .	my doctor these people these teachers listen to sings .
the teachers this dentist that teacher works with talks to read .	the teachers this dentist that teacher works with read .
the people that patient that patient helps scares talk .	the people that patient that patient helps talk .
your cousin your teachers these people bother visit reads .	your cousin your teachers these people bother reads .
this dancer your teachers these teachers teach worry exercises .	this dancer your teachers these teachers teach exercises .
my teachers the patient my boss helps scares win .	my teachers the patient my boss helps win .
that doctor these people your teachers praise praise waves .	that doctor these people your teachers praise waves .
the driver your cousins your teachers appreciate talk to exercises .	the driver your cousins your teachers appreciate exercises .
that person those children my doctors scare help talks .	that person those children my doctors scare talks .
these teachers that dentist this driver scares works with lose .	these teachers that dentist this driver scares lose .
that doctor my doctors the children talk to appreciate reads .	that doctor my doctors the children talk to reads .
the adult my cousins the teachers understand understand sings .	the adult my cousins the teachers understand sings .
this dancer the children my friends scare appreciate cries .	this dancer the children my friends scare cries .
the teacher my doctors the doctors answer scare cries .	the teacher my doctors the doctors answer cries .
this child my cousins these people teach answer reads .	this child my cousins these people teach reads .
the person your cousins those people care for appreciate cries .	the person your cousins those people care for cries .
your cousin my teachers your friends bother answer cries .	your cousin my teachers your friends bother cries .
this dancer my teachers my doctors listen to help exercises .	this dancer my teachers my doctors listen to exercises .
this child the doctors my cousins talk to answer sings .	this child the doctors my cousins talk to sings .
the doctor the doctors those teachers help work with cries .	the doctor the doctors those teachers help cries .
this driver these teachers the people worry bother cries .	this driver these teachers the people worry cries .
my boss the children my teachers visit scare paints .	my boss the children my teachers visit paints .
this adult your teachers the people teach teach sings .	this adult your teachers the people teach sings .
my teacher my doctors these teachers listen to worry sings .	my teacher my doctors these teachers listen to sings .
your doctor the children these children bother bother cries .	your doctor the children these children bother cries .
the patient my friends your doctors listen to visit reads .	the patient my friends your doctors listen to reads .
my doctors your boss that teacher understands helps sneeze .	my doctors your boss that teacher understands sneeze .
my boss these children the children teach praise cries .	my boss these children the children teach cries .
these children my dentist this dancer scares works with laugh .	these children my dentist this dancer scares laugh .
your boss my friends your cousins work with listen to talks .	your boss my friends your cousins work with talks .
that child your doctors my friends work with understand waves .	that child your doctors my friends work with waves .
my teachers the person your dentist helps helps read .	my teachers the person your dentist helps read .
my boss these people your doctors praise understand cries .	my boss these people your doctors praise cries .
my cousin the people these teachers care for talk to waves .	my cousin the people these teachers care for waves .
my friend my teachers your doctors scare praise sings .	my friend my teachers your doctors scare sings .
this child your cousins my cousins worry talk to cries .	this child your cousins my cousins worry cries .
these children this customer your boss helps understands win .	these children this customer your boss helps win .
my dentist the children my doctors worry teach sings .	my dentist the children my doctors worry sings .
the doctors the adult your teacher works with works with read .	the doctors the adult your teacher works with read .
your cousin my teachers those doctors work with bother cries .	your cousin my teachers those doctors work with cries .
the children your dentist my doctor talks to helps laugh .	the children your dentist my doctor talks to laugh .
the teacher those doctors my doctors understand bother reads .	the teacher those doctors my doctors understand reads .
this person the children your doctors visit bother reads .	this person the children your doctors visit reads .
