the doctors the teacher that person works with talks to read .	the doctors the teacher that person works with read .
this dentist my doctors these people answer appreciate cries .	this dentist my doctors these people answer cries .
that patient my cousins these doctors bother understand paints .	that patient my cousins these doctors bother paints .
the dentist the doctors these people listen to worry sings .	the dentist the doctors these people listen to sings .
your friend your cousins the children teach listen to talks .	your friend your cousins the children teach talks .
that customer these children the teachers teach listen to exercises .	that customer these children the teachers teach exercises .
the patient these people your cousins care for scare waves .	the patient these people your cousins care for waves .
your boss those children those doctors bother praise exercises .	your boss those children those doctors bother exercises .
this person your cousins your friends listen to help cries .	this person your cousins your friends listen to cries .
my friend my cousins your teachers listen to scare waves .	my friend my cousins your teachers listen to waves .
my boss the people your doctors listen to scare waves .	my boss the people your doctors listen to waves .
your teachers this person your boss understands works with paint .	your teachers this person your boss understands paint .
the people my teacher my dentist scares understands talk .	the people my teacher my dentist scares talk .
these children this child my cousin works with talks to cough .	these children this child my cousin works with cough .
your friend these doctors the children care for visit cries .	your friend these doctors the children care for cries .
the customer your cousins those people care for work with paints .	the customer your cousins those people care for paints .
this doctor those doctors the children appreciate listen to sings .	this doctor those doctors the children appreciate sings .
that customer those children my cousins bother appreciate talks .	that customer those children my cousins bother talks .
the adult the people your friends understand talk to waves .	the adult the people your friends understand waves .
that teacher those people my doctors praise visit reads .	that teacher those people my doctors praise reads .
your doctors your doctor my friend talks to works with wave .	your doctors your doctor my friend talks to wave .
my boss your doctors your cousins bother praise exercises .	my boss your doctors your cousins bother exercises .
the doctor my teachers my doctors care for understand sings .	the doctor my teachers my doctors care for sings .
those people the dancer that adult talks to helps exercise .	those people the dancer that adult talks to exercise .
my cousin your cousins your cousins bother care for reads .	my cousin your cousins your cousins bother reads .
the dentist my friends the teachers teach care for talks .	the dentist my friends the teachers teach talks .
my dentist my doctors those doctors praise bother sings .	my dentist my doctors those doctors praise sings .
those teachers your friend my doctor helps understands whisper .	those teachers your friend my doctor helps whisper .
your boss your teachers these doctors talk to talk to paints .	your boss your teachers these doctors talk to paints .
your teacher those doctors these people worry work with cries .	your teacher those doctors these people worry cries .
these doctors your doctor this adult helps scares whisper .	these doctors your doctor this adult helps whisper .
your friends my doctor this doctor works with scares lie .	your friends my doctor this doctor works with lie .
this driver your friends the children teach visit exercises .	this driver your friends the children teach exercises .
that dentist my cousins my cousins listen to talk to exercises .	that dentist my cousins my cousins listen to exercises .
my doctor these people these children listen to work with reads .	my doctor these people these children listen to reads .
your dentist my teachers those doctors listen to understand paints .	your dentist my teachers those doctors listen to paints .
this adult these doctors your teachers work with bother exercises .	this adult these doctors your teachers work with exercises .
that child my doctors your friends understand bother paints .	that child my doctors your friends understand paints .
my cousin your cousins these people scare answer sings .	my cousin your cousins these people scare sings .
your dentist these children your teachers worry praise reads .	your dentist these children your teachers worry reads .
the customer your cousins these teachers scare scare cries .	the customer your cousins these teachers scare cries .
that patient my cousins your friends appreciate understand talks .	that patient my cousins your friends appreciate talks .
your dentist your teachers my cousins help worry waves .	your dentist your teachers my cousins help waves .
your friend those teachers these children teach help waves .	your friend those teachers these children teach waves .
this adult your teachers those teachers worry listen to exercises .	this adult your teachers those teachers worry exercises .
your doctors that doctor the driver works with scares whisper .	your doctors that doctor the driver works with whisper .
my teachers this adult my friend scares scares lie .	my teachers this adult my friend scares lie .
your friend my doctors my cousins worry care for sings .	your friend my doctors my cousins worry sings .
your cousins the person your boss works with scares yell .	your cousins the person your boss works with yell .
the dancer your cousins my friends talk to praise sings .	the dancer your cousins my friends talk to sings .
my teacher these people those doctors praise talk to talks .	my teacher these people those doctors praise talks .
the customer these doctors the teachers talk to appreciate paints .	the customer these doctors the teachers talk to paints .
my cousin my doctors those children visit understand reads .	my cousin my doctors those children visit reads .
your friend your doctors the teachers appreciate answer waves .	your friend your doctors the teachers appreciate waves .
this teacher the children your friends visit help sings .	this teacher the children your friends visit sings .
the doctors your dentist that driver helps scares read .	the doctors your dentist that driver helps read .
my doctors the patient this child scares scares stretch .	my doctors the patient this child scares stretch .
this driver my friends my cousins visit appreciate exercises .	this driver my friends my cousins visit exercises .
my friend your teachers the children teach care for exercises .	my friend your teachers the children teach exercises .
that teacher these teachers my friends bother praise talks .	that teacher these teachers my friends bother talks .
my boss the people my friends praise appreciate exercises .	my boss the people my friends praise exercises .
my doctor my doctors the teachers understand scare paints .	my doctor my doctors the teachers understand paints .
the dentist your cousins these teachers help listen to talks .	the dentist your cousins these teachers help talks .
my teacher your friends your doctors work with talk to reads .	my teacher your friends your doctors work with reads .
that child your cousins my teachers talk to care for paints .	that child your cousins my teachers talk to paints .
your friend the children those people listen to bother talks .	your friend the children those people listen to talks .
my dentist my cousins my doctors bother care for waves .	my dentist my cousins my doctors bother waves .
my boss my cousins your friends work with scare reads .	my boss my cousins your friends work with reads .
your friends the child the doctor scares helps whisper .	your friends the child the doctor scares whisper .
this dancer my doctors these children help listen to reads .	this dancer my doctors these children help reads .
my teacher your teachers those people work with talk to cries .	my teacher your teachers those people work with cries .
that doctor your teachers those children praise care for talks .	that doctor your teachers those children praise talks .
the dentist your doctors my friends worry praise talks .	the dentist your doctors my friends worry talks .
my doctors that adult this patient understands helps smile .	my doctors that adult this patient understands smile .
the teacher my doctors your cousins listen to scare cries .	the teacher my doctors your cousins listen to cries .
my teacher my teachers these people praise listen to paints .	my teacher my teachers these people praise paints .
this driver the people those people bother listen to reads .	this driver the people those people bother reads .
your cousin your teachers my teachers worry help sings .	your cousin your teachers my teachers worry sings .
the doctors my friend that driver understands understands sneeze .	the doctors my friend that driver understands sneeze .
those children this driver that teacher works with helps laugh .	those children this driver that teacher works with laugh .
your friend those people those teachers bother visit sings .	your friend those people those teachers bother sings .
my cousin your doctors the children care for understand sings .	my cousin your doctors the children care for sings .
your doctors my teacher my teacher talks to scares smile .	your doctors my teacher my teacher talks to smile .
your teacher these teachers my doctors bother worry sings .	your teacher these teachers my doctors bother sings .
this patient your cousins my cousins care for scare talks .	this patient your cousins my cousins care for talks .
the child my doctors these doctors worry praise exercises .	the child my doctors these doctors worry exercises .
the teacher these people my cousins care for care for sings .	the teacher these people my cousins care for sings .
that adult my friends my teachers talk to teach reads .	that adult my friends my teachers talk to reads .
my doctor the people my doctors appreciate answer paints .	my doctor the people my doctors appreciate paints .
your doctors your dentist that child talks to helps lie .	your doctors your dentist that child talks to lie .
this child your friends the children bother worry exercises .	this child your friends the children bother exercises .
the dentist my teachers your friends talk to work with sings .	the dentist my teachers your friends talk to sings .
your doctor the teachers your cousins bother worry paints .	your doctor the teachers your cousins bother paints .
those teachers the patient your boss understands helps sneeze .	those teachers the patient your boss understands sneeze .
the teacher my cousins my friends visit talk to paints .	the teacher my cousins my friends visit paints .
your teachers my doctor my doctor works with understands paint .	your teachers my doctor my doctor works with paint .
my friend these teachers your teachers care for care for waves .	my friend these teachers your teachers care for waves .
that driver your teachers your friends listen to bother cries .	that driver your teachers your friends listen to cries .
your doctor my doctors these doctors help appreciate waves .	your doctor my doctors these doctors help waves .
my cousins that person the adult understands scares lose .	my cousins that person the adult understands lose .
that doctor my cousins your cousins appreciate scare reads .	that doctor my cousins your cousins appreciate reads .
your doctor these teachers my cousins talk to listen to waves .	your doctor these teachers my cousins talk to waves .
this teacher my friends your friends visit bother cries .	this teacher my friends your friends visit cries .
this dancer my friends these doctors answer understand paints .	this dancer my friends these doctors answer paints .
my doctors that patient the customer works with scares lie .	my doctors that patient the customer works with lie .
the patient my cousins your cousins answer bother exercises .	the patient my cousins your cousins answer exercises .
those teachers the patient your boss scares talks to win .	those teachers the patient your boss scares win .
those doctors my doctor my dentist helps helps smile .	those doctors my doctor my dentist helps smile .
my boss my doctors my friends talk to care for cries .	my boss my doctors my friends talk to cries .
your cousin my doctors your doctors worry teach reads .	your cousin my doctors your doctors worry reads .
your doctor those doctors the teachers talk to visit cries .	your doctor those doctors the teachers talk to cries .
the patient those doctors my friends work with talk to cries .	the patient those doctors my friends work with cries .
my dentist my doctors those people visit care for sings .	my dentist my doctors those people visit sings .
my boss your friends these children appreciate praise waves .	my boss your friends these children appreciate waves .
your doctor these people my doctors worry talk to exercises .	your doctor these people my doctors worry exercises .
the doctor those teachers those children care for listen to exercises .	the doctor those teachers those children care for exercises .
your friend those doctors your doctors scare teach reads .	your friend those doctors your doctors scare reads .
my doctors this driver this doctor scares understands win .	my doctors this driver this doctor scares win .
my cousins my doctor the adult works with talks to cough .	my cousins my doctor the adult works with cough .
your cousin your cousins your cousins understand scare exercises .	your cousin your cousins your cousins understand exercises .
the doctor my cousins my teachers answer answer sings .	the doctor my cousins my teachers answer sings .
these doctors my friend your friend scares helps whisper .	these doctors my friend your friend scares whisper .
my cousin my cousins these doctors bother scare exercises .	my cousin my cousins these doctors bother exercises .
that dentist those people these people praise bother waves .	that dentist those people these people praise waves .
my friend these doctors your teachers work with listen to cries .	my friend these doctors your teachers work with cries .
the dentist your doctors my doctors understand praise reads .	the dentist your doctors my doctors understand reads .
my doctor those people those doctors understand talk to cries .	my doctor those people those doctors understand cries .
the adult my teachers your friends praise talk to sings .	the adult my teachers your friends praise sings .
this driver the children the children worry praise cries .	this driver the children the children worry cries .
the dentist the teachers your teachers bother work with waves .	the dentist the teachers your teachers bother waves .
the teacher these children the doctors talk to scare cries .	the teacher these children the doctors talk to cries .
my friend these children my doctors care for talk to talks .	my friend these children my doctors care for talks .
your friends that dentist your cousin helps helps win .	your friends that dentist your cousin helps win .
that dentist those teachers my friends care for scare exercises .	that dentist those teachers my friends care for exercises .
my boss your doctors my doctors answer teach waves .	my boss your doctors my doctors answer waves .
this driver your friends those children appreciate bother paints .	this driver your friends those children appreciate paints .
that dentist your cousins those children understand work with waves .	that dentist your cousins those children understand waves .
my friend your teachers my doctors care for help talks .	my friend your teachers my doctors care for talks .
your cousin my teachers your doctors understand teach waves .	your cousin my teachers your doctors understand waves .
my teacher those teachers my teachers work with understand waves .	my teacher those teachers my teachers work with waves .
my friend your friends my friends talk to answer cries .	my friend your friends my friends talk to cries .
my friends your boss my dentist works with talks to yell .	my friends your boss my dentist works with yell .
my dentist my cousins those doctors visit praise sings .	my dentist my cousins those doctors visit sings .
this driver these children those doctors talk to talk to talks .	this driver these children those doctors talk to talks .
my doctor these children my friends talk to teach talks .	my doctor these children my friends talk to talks .
your friends your doctor your friend understands talks to sneeze .	your friends your doctor your friend understands sneeze .
my boss my cousins your cousins appreciate listen to reads .	my boss my cousins your cousins appreciate reads .
this customer those children those people appreciate listen to sings .	this customer those children those people appreciate sings .
that adult the doctors those doctors teach teach exercises .	that adult the doctors those doctors teach exercises .
that driver those people my teachers understand listen to cries .	that driver those people my teachers understand cries .
that dancer my doctors my doctors understand care for waves .	that dancer my doctors my doctors understand waves .
that patient these people my friends teach praise talks .	that patient these people my friends teach talks .
your teachers my friend the patient scares scares talk .	your teachers my friend the patient scares talk .
your friends this doctor your doctor scares understands whisper .	your friends this doctor your doctor scares whisper .
your boss my doctors the doctors understand praise exercises .	your boss my doctors the doctors understand exercises .
your teachers the driver that doctor helps scares sneeze .	your teachers the driver that doctor helps sneeze .
your cousin those children my doctors appreciate talk to talks .	your cousin those children my doctors appreciate talks .
that doctor these doctors my teachers care for teach paints .	that doctor these doctors my teachers care for paints .
these teachers your cousin this doctor understands understands read .	these teachers your cousin this doctor understands read .
that customer my teachers the doctors understand teach talks .	that customer my teachers the doctors understand talks .
your friends this person the dancer works with understands talk .	your friends this person the dancer works with talk .
this dentist my cousins your doctors care for answer waves .	this dentist my cousins your doctors care for waves .
this child my cousins the people bother work with sings .	this child my cousins the people bother sings .
your friends my cousin this patient understands scares lie .	your friends my cousin this patient understands lie .
the customer my teachers your friends praise listen to talks .	the customer my teachers your friends praise talks .
the dancer these doctors the children visit listen to talks .	the dancer these doctors the children visit talks .
this teacher your cousins these children listen to work with waves .	this teacher your cousins these children listen to waves .
my boss the teachers your cousins work with care for reads .	my boss the teachers your cousins work with reads .
this person the children your cousins praise appreciate reads .	this person the children your cousins praise reads .
my dentist those teachers your friends care for talk to exercises .	my dentist those teachers your friends care for exercises .
the people your teacher my boss understands works with exercise .	the people your teacher my boss understands exercise .
the driver my friends the children help understand talks .	the driver my friends the children help talks .
the person my cousins my doctors praise appreciate talks .	the person my cousins my doctors praise talks .
this child the doctors my cousins care for help paints .	this child the doctors my cousins care for paints .
the dancer your teachers these children talk to scare cries .	the dancer your teachers these children talk to cries .
this teacher your doctors those teachers worry appreciate cries .	this teacher your doctors those teachers worry cries .
my doctor your doctors my cousins appreciate talk to sings .	my doctor your doctors my cousins appreciate sings .
the doctor your doctors my doctors bother answer talks .	the doctor your doctors my doctors bother talks .
my teacher my teachers your teachers care for scare cries .	my teacher my teachers your teachers care for cries .
my dentist my teachers those doctors visit bother reads .	my dentist my teachers those doctors visit reads .
this patient these doctors your teachers appreciate work with waves .	this patient these doctors your teachers appreciate waves .
this teacher these children the teachers worry visit paints .	this teacher these children the teachers worry paints .
my boss my cousins the people talk to talk to exercises .	my boss my cousins the people talk to exercises .
the customer those people my cousins talk to bother waves .	the customer those people my cousins talk to waves .
that teacher those people my cousins listen to appreciate reads .	that teacher those people my cousins listen to reads .
that adult the teachers these doctors answer scare exercises .	that adult the teachers these doctors answer exercises .
that patient my cousins those doctors talk to worry reads .	that patient my cousins those doctors talk to reads .
my teachers the teacher your cousin understands understands exercise .	my teachers the teacher your cousin understands exercise .
the doctor the teachers my doctors bother worry cries .	the doctor the teachers my doctors bother cries .
my teacher your cousins my friends appreciate scare waves .	my teacher your cousins my friends appreciate waves .
that person these teachers my friends work with help exercises .	that person these teachers my friends work with exercises .
those people my dentist my doctor scares helps read .	those people my dentist my doctor scares read .
my friends the driver the person helps talks to whisper .	my friends the driver the person helps whisper .
that patient your friends those children visit understand waves .	that patient your friends those children visit waves .
this child your cousins the teachers work with listen to reads .	this child your cousins the teachers work with reads .
your boss my friends my cousins visit worry paints .	your boss my friends my cousins visit paints .
this dentist your doctors my doctors work with answer talks .	this dentist your doctors my doctors work with talks .
my teachers the person the teacher scares scares exercise .	my teachers the person the teacher scares exercise .
the customer the children your friends bother answer sings .	the customer the children your friends bother sings .
your boss your cousins your teachers worry help cries .	your boss your cousins your teachers worry cries .
my dentist the doctors my cousins worry work with paints .	my dentist the doctors my cousins worry paints .
the doctors my friend my cousin scares understands exercise .	the doctors my friend my cousin scares exercise .
my teacher those people your teachers teach care for exercises .	my teacher those people your teachers teach exercises .
the driver your teachers my cousins worry work with cries .	the driver your teachers my cousins worry cries .
my doctors your doctor my teacher understands understands read .	my doctors your doctor my teacher understands read .
this dentist these people my friends answer talk to paints .	this dentist these people my friends answer paints .
my teacher my doctors your doctors bother answer sings .	my teacher my doctors your doctors bother sings .
your dentist your cousins those children visit listen to cries .	your dentist your cousins those children visit cries .
your cousin those people those teachers appreciate scare cries .	your cousin those people those teachers appreciate cries .
your friend my doctors your doctors help praise reads .	your friend my doctors your doctors help reads .
my friends my dentist my doctor understands works with scream .	my friends my dentist my doctor understands scream .
my friends my doctor that dancer talks to talks to laugh .	my friends my doctor that dancer talks to laugh .
your doctor your friends your doctors teach talk to waves .	your doctor your friends your doctors teach waves .
my teacher these children my doctors talk to understand waves .	my teacher these children my doctors talk to waves .
my doctor the doctors my doctors talk to bother cries .	my doctor the doctors my doctors talk to cries .
my doctor my teachers those people praise care for exercises .	my doctor my teachers those people praise exercises .
the dancer the people your teachers work with understand sings .	the dancer the people your teachers work with sings .
those doctors your teacher the adult talks to understands yell .	those doctors your teacher the adult talks to yell .
this dentist my friends my friends answer understand sings .	this dentist my friends my friends answer sings .
your teacher my teachers my teachers care for praise paints .	your teacher my teachers my teachers care for paints .
your cousin the doctors your teachers worry bother exercises .	your cousin the doctors your teachers worry exercises .
the adult my teachers your doctors praise teach talks .	the adult my teachers your doctors praise talks .
my boss the people these teachers appreciate help reads .	my boss the people these teachers appreciate reads .
your cousin the children those people scare help reads .	your cousin the children those people scare reads .
the dancer these teachers your friends scare answer reads .	the dancer these teachers your friends scare reads .
the customer the teachers your doctors visit talk to talks .	the customer the teachers your doctors visit talks .
