my doctor your cousins those children bother listen to cries .	my doctor your cousins those children bother cries .
your teacher those children these people praise appreciate sings .	your teacher those children these people praise sings .
my friend my cousins the doctors work with worry paints .	my friend my cousins the doctors work with paints .
your doctor these doctors the children talk to help talks .	your doctor these doctors the children talk to talks .
the adult my friends those children answer work with exercises .	the adult my friends those children answer exercises .
your teacher those teachers the teachers praise scare cries .	your teacher those teachers the teachers praise cries .
that teacher my teachers the doctors answer scare talks .	that teacher my teachers the doctors answer talks .
my teachers your cousin your cousin talks to works with scream .	my teachers your cousin your cousin talks to scream .
your doctors this person your teacher understands helps whisper .	your doctors this person your teacher understands whisper .
my cousin my cousins these teachers talk to help cries .	my cousin my cousins these teachers talk to cries .
these people my doctor the person helps works with whisper .	these people my doctor the person helps whisper .
those people my cousin this doctor talks to works with lie .	those people my cousin this doctor talks to lie .
your teacher the doctors my friends listen to talk to sings .	your teacher the doctors my friends listen to sings .
your doctor the teachers your teachers bother visit talks .	your doctor the teachers your teachers bother talks .
my cousin these people the people care for visit waves .	my cousin these people the people care for waves .
those teachers my boss that teacher works with helps exercise .	those teachers my boss that teacher works with exercise .
your cousin your friends your teachers answer work with reads .	your cousin your friends your teachers answer reads .
my boss the teachers these doctors scare talk to reads .	my boss the teachers these doctors scare reads .
this doctor those teachers my friends teach worry cries .	this doctor those teachers my friends teach cries .
your friends my dentist the adult helps understands paint .	your friends my dentist the adult helps paint .
my cousin your doctors these teachers talk to help cries .	my cousin your doctors these teachers talk to cries .
that adult those teachers these teachers worry visit talks .	that adult those teachers these teachers worry talks .
that child your friends my friends work with work with reads .	that child your friends my friends work with reads .
the teacher those doctors your friends care for help waves .	the teacher those doctors your friends care for waves .
that person your cousins these teachers appreciate praise waves .	that person your cousins these teachers appreciate waves .
that dancer these children your cousins appreciate talk to exercises .	that dancer these children your cousins appreciate exercises .
that patient these teachers the people teach talk to reads .	that patient these teachers the people teach reads .
that customer these children your doctors work with praise exercises .	that customer these children your doctors work with exercises .
your cousin the people those doctors listen to talk to talks .	your cousin the people those doctors listen to talks .
your boss these doctors my friends answer help sings .	your boss these doctors my friends answer sings .
my doctor your friends my friends praise talk to exercises .	my doctor your friends my friends praise exercises .
this doctor your doctors those doctors listen to talk to waves .	this doctor your doctors those doctors listen to waves .
my cousin the teachers these doctors worry answer cries .	my cousin the teachers these doctors worry cries .
your boss my doctors your teachers talk to help paints .	your boss my doctors your teachers talk to paints .
my dentist your teachers my cousins listen to understand exercises .	my dentist your teachers my cousins listen to exercises .
that patient those teachers these doctors scare care for cries .	that patient those teachers these doctors scare cries .
my teacher those people your doctors help worry talks .	my teacher those people your doctors help talks .
my friends your teacher my friend works with talks to scream .	my friends your teacher my friend works with scream .
my teacher my doctors my doctors work with care for talks .	my teacher my doctors my doctors work with talks .
my teachers this driver this dentist helps works with cry .	my teachers this driver this dentist helps cry .
the driver those children your teachers help answer waves .	the driver those children your teachers help waves .
that teacher your teachers these children care for teach paints .	that teacher your teachers these children care for paints .
the dentist the children my teachers talk to talk to cries .	the dentist the children my teachers talk to cries .
this dentist your doctors these people appreciate teach waves .	this dentist your doctors these people appreciate waves .
your friend my doctors those children visit work with waves .	your friend my doctors those children visit waves .
my doctor your doctors your friends help teach paints .	my doctor your doctors your friends help paints .
this teacher those doctors those doctors teach answer talks .	this teacher those doctors those doctors teach talks .
those doctors that dancer this child helps understands laugh .	those doctors that dancer this child helps laugh .
my teachers your friend the patient scares talks to stretch .	my teachers your friend the patient scares stretch .
my teacher my doctors my cousins work with understand talks .	my teacher my doctors my cousins work with talks .
that patient these people these people answer talk to reads .	that patient these people these people answer reads .
my teacher your cousins those doctors work with bother talks .	my teacher your cousins those doctors work with talks .
your friends my cousin your boss understands talks to win .	your friends my cousin your boss understands win .
that dancer your friends my teachers scare bother cries .	that dancer your friends my teachers scare cries .
my cousin the teachers the children visit care for exercises .	my cousin the teachers the children visit exercises .
these teachers my doctor this dentist talks to scares cough .	these teachers my doctor this dentist talks to cough .
the doctor your teachers your cousins appreciate visit cries .	the doctor your teachers your cousins appreciate cries .
those people your doctor my boss works with helps exercise .	those people your doctor my boss works with exercise .
the teacher my doctors the teachers care for visit cries .	the teacher my doctors the teachers care for cries .
my doctors my boss your teacher understands helps win .	my doctors my boss your teacher understands win .
your teacher these doctors these people care for answer talks .	your teacher these doctors these people care for talks .
your teacher the people your cousins scare visit paints .	your teacher the people your cousins scare paints .
your cousin my friends those children praise listen to talks .	your cousin my friends those children praise talks .
your teachers the adult that dentist works with helps smile .	your teachers the adult that dentist works with smile .
your cousins that dancer the patient understands scares whisper .	your cousins that dancer the patient understands whisper .
your boss your friends your doctors answer bother exercises .	your boss your friends your doctors answer exercises .
your friend these people those teachers worry understand exercises .	your friend these people those teachers worry exercises .
the dentist your teachers my doctors scare appreciate talks .	the dentist your teachers my doctors scare talks .
my friend these teachers those teachers talk to talk to reads .	my friend these teachers those teachers talk to reads .
my doctor my cousins your doctors worry visit reads .	my doctor my cousins your doctors worry reads .
these people my doctor my doctor talks to talks to yell .	these people my doctor my doctor talks to yell .
my cousins your teacher the dancer works with understands read .	my cousins your teacher the dancer works with read .
your teachers your cousin that driver talks to understands wave .	your teachers your cousin that driver talks to wave .
the teachers my friend this patient talks to talks to smile .	the teachers my friend this patient talks to smile .
my boss my doctors my teachers worry appreciate cries .	my boss my doctors my teachers worry cries .
the doctors your boss my boss understands works with laugh .	the doctors your boss my boss understands laugh .
this child your doctors these doctors scare care for sings .	this child your doctors these doctors scare sings .
your friend your doctors my teachers care for visit talks .	your friend your doctors my teachers care for talks .
your teacher these teachers my doctors teach scare exercises .	your teacher these teachers my doctors teach exercises .
that doctor my friends my cousins visit talk to waves .	that doctor my friends my cousins visit waves .
your teacher those teachers these doctors talk to scare waves .	your teacher those teachers these doctors talk to waves .
my cousin the children those teachers appreciate praise talks .	my cousin the children those teachers appreciate talks .
my teacher the children those teachers praise appreciate sings .	my teacher the children those teachers praise sings .
my boss these doctors your doctors work with bother cries .	my boss these doctors your doctors work with cries .
those people that teacher the child scares talks to stretch .	those people that teacher the child scares stretch .
these doctors the driver your dentist scares works with read .	these doctors the driver your dentist scares read .
your friend these children your cousins appreciate scare talks .	your friend these children your cousins appreciate talks .
that child my cousins those doctors bother bother waves .	that child my cousins those doctors bother waves .
my teachers the person that teacher works with scares wave .	my teachers the person that teacher works with wave .
your teacher those teachers these teachers help help sings .	your teacher those teachers these teachers help sings .
your boss your cousins these doctors care for bother paints .	your boss your cousins these doctors care for paints .
your teachers the adult your teacher understands understands talk .	your teachers the adult your teacher understands talk .
my cousin the doctors my cousins answer talk to waves .	my cousin the doctors my cousins answer waves .
my teacher my cousins those teachers visit bother sings .	my teacher my cousins those teachers visit sings .
these doctors your teacher that dancer scares understands whisper .	these doctors your teacher that dancer scares whisper .
the doctors my cousin your doctor understands understands paint .	the doctors my cousin your doctor understands paint .
that adult these doctors your friends talk to listen to paints .	that adult these doctors your friends talk to paints .
my cousins your teacher the dentist works with works with laugh .	my cousins your teacher the dentist works with laugh .
your teacher those children my doctors talk to talk to waves .	your teacher those children my doctors talk to waves .
your friends my cousin that person works with talks to lose .	your friends my cousin that person works with lose .
your cousins that dancer my boss works with scares sneeze .	your cousins that dancer my boss works with sneeze .
that dentist my doctors these people care for listen to paints .	that dentist my doctors these people care for paints .
this doctor your teachers your doctors teach bother paints .	this doctor your teachers your doctors teach paints .
your doctor the children those children praise visit paints .	your doctor the children those children praise paints .
those children your boss my cousin talks to talks to scream .	those children your boss my cousin talks to scream .
these teachers my boss the driver works with helps stretch .	these teachers my boss the driver works with stretch .
your doctor the teachers your cousins bother understand cries .	your doctor the teachers your cousins bother cries .
this adult my doctors these teachers worry listen to reads .	this adult my doctors these teachers worry reads .
the dancer these teachers your doctors understand scare sings .	the dancer these teachers your doctors understand sings .
that patient these people the teachers bother scare paints .	that patient these people the teachers bother paints .
your cousin your teachers these people teach answer cries .	your cousin your teachers these people teach cries .
my boss those children those doctors listen to visit sings .	my boss those children those doctors listen to sings .
your boss my teachers the children praise work with reads .	your boss my teachers the children praise reads .
the person the teachers your teachers bother work with reads .	the person the teachers your teachers bother reads .
your teacher your doctors the teachers help listen to waves .	your teacher your doctors the teachers help waves .
your doctor the children my cousins teach answer exercises .	your doctor the children my cousins teach exercises .
my friends your doctor my dentist understands talks to lie .	my friends your doctor my dentist understands lie .
my boss these doctors your teachers talk to teach talks .	my boss these doctors your teachers talk to talks .
my dentist these doctors my cousins visit talk to sings .	my dentist these doctors my cousins visit sings .
this driver my cousins your cousins scare understand waves .	this driver my cousins your cousins scare waves .
your cousin these teachers these teachers understand care for reads .	your cousin these teachers these teachers understand reads .
my friends my doctor my doctor scares scares scream .	my friends my doctor my doctor scares scream .
your teacher my teachers the doctors worry appreciate cries .	your teacher my teachers the doctors worry cries .
this customer those people your cousins scare worry reads .	this customer those people your cousins scare reads .
the doctors that dancer the customer understands works with yell .	the doctors that dancer the customer understands yell .
my friend your doctors those doctors praise praise waves .	my friend your doctors those doctors praise waves .
the children my boss that patient helps helps lie .	the children my boss that patient helps lie .
your dentist those doctors my teachers bother talk to waves .	your dentist those doctors my teachers bother waves .
your cousin your teachers your friends scare worry talks .	your cousin your teachers your friends scare talks .
my teachers that teacher my boss helps helps wave .	my teachers that teacher my boss helps wave .
this driver your teachers these doctors understand praise cries .	this driver your teachers these doctors understand cries .
the doctors my boss your boss understands works with lose .	the doctors my boss your boss understands lose .
your friends my cousin this customer talks to helps exercise .	your friends my cousin this customer talks to exercise .
my teachers the adult my doctor helps talks to lie .	my teachers the adult my doctor helps lie .
my teachers that child that dancer talks to talks to laugh .	my teachers that child that dancer talks to laugh .
your teachers that patient this doctor helps helps win .	your teachers that patient this doctor helps win .
that customer your doctors those children help praise talks .	that customer your doctors those children help talks .
your doctor the doctors my friends care for visit sings .	your doctor the doctors my friends care for sings .
your teacher your friends my friends understand understand talks .	your teacher your friends my friends understand talks .
that dancer my cousins your friends listen to listen to exercises .	that dancer my cousins your friends listen to exercises .
my friend your doctors these doctors bother teach paints .	my friend your doctors these doctors bother paints .
my teachers the child your boss talks to talks to laugh .	my teachers the child your boss talks to laugh .
this teacher the children those doctors work with worry reads .	this teacher the children those doctors work with reads .
this patient these teachers the teachers answer work with waves .	this patient these teachers the teachers answer waves .
the teacher your teachers my friends care for worry exercises .	the teacher your teachers my friends care for exercises .
those children your dentist the teacher works with talks to win .	those children your dentist the teacher works with win .
your cousin my cousins the doctors answer work with waves .	your cousin my cousins the doctors answer waves .
this adult my friends my teachers talk to teach reads .	this adult my friends my teachers talk to reads .
my doctor these children your cousins praise bother waves .	my doctor these children your cousins praise waves .
this adult those doctors the children work with talk to waves .	this adult those doctors the children work with waves .
this patient your doctors my friends bother answer talks .	this patient your doctors my friends bother talks .
those people my boss your boss works with scares paint .	those people my boss your boss works with paint .
this adult the doctors these teachers understand talk to paints .	this adult the doctors these teachers understand paints .
my teacher these doctors my doctors understand praise talks .	my teacher these doctors my doctors understand talks .
your doctor your friends these teachers listen to scare sings .	your doctor your friends these teachers listen to sings .
my cousin your cousins my teachers care for work with cries .	my cousin your cousins my teachers care for cries .
your teachers my dentist your teacher understands understands win .	your teachers my dentist your teacher understands win .
my boss your cousins these doctors teach praise exercises .	my boss your cousins these doctors teach exercises .
my boss my doctors your cousins listen to teach cries .	my boss my doctors your cousins listen to cries .
your boss those doctors my cousins talk to answer waves .	your boss those doctors my cousins talk to waves .
my friend my doctors your teachers praise scare waves .	my friend my doctors your teachers praise waves .
the dancer my cousins those people understand teach reads .	the dancer my cousins those people understand reads .
my cousin your cousins my cousins talk to care for sings .	my cousin your cousins my cousins talk to sings .
the teacher your cousins these teachers worry worry talks .	the teacher your cousins these teachers worry talks .
this customer the doctors these doctors understand work with cries .	this customer the doctors these doctors understand cries .
your friends this patient this patient helps talks to paint .	your friends this patient this patient helps paint .
your dentist your friends these doctors listen to scare paints .	your dentist your friends these doctors listen to paints .
your boss your friends your friends teach help talks .	your boss your friends your friends teach talks .
the teachers the customer your doctor scares works with whisper .	the teachers the customer your doctor scares whisper .
those children that dentist your friend talks to understands win .	those children that dentist your friend talks to win .
your cousin the teachers my teachers understand appreciate reads .	your cousin the teachers my teachers understand reads .
that dentist the teachers my doctors appreciate talk to cries .	that dentist the teachers my doctors appreciate cries .
the children this driver your cousin talks to understands whisper .	the children this driver your cousin talks to whisper .
this doctor these doctors those doctors scare teach exercises .	this doctor these doctors those doctors scare exercises .
your cousin my teachers my friends help care for talks .	your cousin my teachers my friends help talks .
the driver my teachers those people scare understand reads .	the driver my teachers those people scare reads .
my boss your friends the children understand teach paints .	my boss your friends the children understand paints .
my boss your cousins these children scare talk to exercises .	my boss your cousins these children scare exercises .
that dentist your teachers my cousins teach bother sings .	that dentist your teachers my cousins teach sings .
my doctor those children the doctors work with scare reads .	my doctor those children the doctors work with reads .
my teachers my boss the dancer helps understands paint .	my teachers my boss the dancer helps paint .
this customer those teachers my cousins care for scare reads .	this customer those teachers my cousins care for reads .
your dentist your doctors your teachers worry appreciate sings .	your dentist your doctors your teachers worry sings .
your cousin the children these children appreciate scare talks .	your cousin the children these children appreciate talks .
this patient your cousins these children listen to praise cries .	this patient your cousins these children listen to cries .
my boss these people the doctors listen to praise talks .	my boss these people the doctors listen to talks .
this dentist these teachers your friends talk to appreciate paints .	this dentist these teachers your friends talk to paints .
my cousin the doctors my teachers answer scare reads .	my cousin the doctors my teachers answer reads .
these people the driver your boss scares helps laugh .	these people the driver your boss scares laugh .
your cousin my friends those doctors listen to teach paints .	your cousin my friends those doctors listen to paints .
my friend my teachers your teachers answer care for waves .	my friend my teachers your teachers answer waves .
your dentist your teachers your teachers appreciate visit waves .	your dentist your teachers your teachers appreciate waves .
these doctors your cousin this doctor scares works with paint .	these doctors your cousin this doctor scares paint .
my teacher my cousins your doctors understand bother talks .	my teacher my cousins your doctors understand talks .
this dancer my doctors these teachers appreciate praise waves .	this dancer my doctors these teachers appreciate waves .
my cousins that dancer this customer understands talks to sneeze .	my cousins that dancer this customer understands sneeze .
this patient these teachers your doctors work with understand exercises .	this patient these teachers your doctors work with exercises .
that teacher those teachers these teachers talk to teach paints .	that teacher those teachers these teachers talk to paints .
your cousin my cousins your cousins listen to work with waves .	your cousin my cousins your cousins listen to waves .
your friends this patient the dancer talks to helps win .	your friends this patient the dancer talks to win .
your friend those people my doctors talk to appreciate paints .	your friend those people my doctors talk to paints .
the child those teachers those teachers help teach exercises .	the child those teachers those teachers help exercises .
the child the people my cousins understand scare reads .	the child the people my cousins understand reads .
your doctor the teachers these doctors care for understand waves .	your doctor the teachers these doctors care for waves .
that adult these people your teachers understand work with waves .	that adult these people your teachers understand waves .
your dentist my doctors the children care for answer exercises .	your dentist my doctors the children care for exercises .
my teacher the children these teachers bother appreciate talks .	my teacher the children these teachers bother talks .
this child my doctors the people praise praise talks .	this child my doctors the people praise talks .
my doctor your cousins the doctors worry talk to sings .	my doctor your cousins the doctors worry sings .
my cousins your doctor your teacher helps talks to lie .	my cousins your doctor your teacher helps lie .
the children that doctor your doctor scares understands whisper .	the children that doctor your doctor scares whisper .
this driver the doctors the people talk to scare talks .	this driver the doctors the people talk to talks .
my teachers my cousin your cousin understands works with sneeze .	my teachers my cousin your cousin understands sneeze .
this person your friends my friends visit praise sings .	this person your friends my friends visit sings .
your doctors that dancer my dentist helps helps paint .	your doctors that dancer my dentist helps paint .
your cousins that dancer my doctor helps scares talk .	your cousins that dancer my doctor helps talk .
your dentist those people my friends scare understand sings .	your dentist those people my friends scare sings .
the dentist my cousins your teachers appreciate visit talks .	the dentist my cousins your teachers appreciate talks .
your dentist my teachers those people worry worry talks .	your dentist my teachers those people worry talks .
your doctors that person the patient scares helps exercise .	your doctors that person the patient scares exercise .
your teachers my cousin my teacher scares scares cry .	your teachers my cousin my teacher scares cry .
my teachers my cousin the dentist works with understands lose .	my teachers my cousin the dentist works with lose .
that driver my friends the people care for talk to paints .	that driver my friends the people care for paints .
your boss your doctors my friends bother teach waves .	your boss your doctors my friends bother waves .
the customer your friends those teachers understand talk to sings .	the customer your friends those teachers understand sings .
