these children that these boys had heard had n't ever eaten .	these children that these boys had n't heard had ever eaten .
those people that those girls can hear would n't ever see that spoon .	those people that those girls can n't hear would ever see that spoon .
the customer who has bought the cars has n't ever made the rings .	the customer who has n't bought the cars has ever made the rings .
that driver that did eat did n't ever notice the children .	that driver that did n't eat did ever notice the children .
this car that should drop could n't ever roll away .	this car that should n't drop could ever roll away .
these guys who the women should look like have n't ever brought this box .	these guys who the women should n't look like have ever brought this box .
those guys who have talked about those people do n't ever look like this bird .	those guys who have n't talked about those people do ever look like this bird .
this window that had broken had n't ever moved .	this window that had n't broken had ever moved .
these women that could run have n't ever noticed this driver .	these women that could n't run have ever noticed this driver .
these dogs that should run did n't ever grow .	these dogs that should n't run did ever grow .
these shirts that the girls should forget have n't ever moved .	these shirts that the girls should n't forget have ever moved .
this woman who has laughed could n't ever hear this king .	this woman who has n't laughed could ever hear this king .
those windows that those girls did talk about have n't ever broken the plane .	those windows that those girls did n't talk about have ever broken the plane .
the snake that that guy has heard had n't ever noticed this bag .	the snake that that guy has n't heard had ever noticed this bag .
the queen that that child does sound like would n't ever grow .	the queen that that child does n't sound like would ever grow .
this woman who should see this rocket has n't ever waved .	this woman who should n't see this rocket has ever waved .
that doctor who had noticed this adult could n't ever lose .	that doctor who had n't noticed this adult could ever lose .
the men who have held this dish do n't ever worry that boy .	the men who have n't held this dish do ever worry that boy .
the teacher who had lost those boats can n't ever bring this hat .	the teacher who had n't lost those boats can ever bring this hat .
the teachers who can lie did n't ever win .	the teachers who can n't lie did ever win .
this mouse that that woman has talked about can n't ever like the candle .	this mouse that that woman has n't talked about can ever like the candle .
those guys that had eaten had n't ever seen that candle .	those guys that had n't eaten had ever seen that candle .
those guys who can keep the plane have n't ever gone to this restaurant .	those guys who can n't keep the plane have ever gone to this restaurant .
these men who do read have n't ever thrown these chairs .	these men who do n't read have ever thrown these chairs .
these doctors who did steal the hats did n't ever shake these crayons .	these doctors who did n't steal the hats did ever shake these crayons .
that book that the teacher would talk about had n't ever rolled away .	that book that the teacher would n't talk about had ever rolled away .
this person who would buy the rocket had n't ever left this restaurant .	this person who would n't buy the rocket had ever left this restaurant .
the boys who do shake those chairs have n't ever painted .	the boys who do n't shake those chairs have ever painted .
that boy who had gone to that mall had n't ever kept that book .	that boy who had n't gone to that mall had ever kept that book .
the dentist who can sound like the dogs would n't ever know this turtle .	the dentist who can n't sound like the dogs would ever know this turtle .
the child who does hate the rabbits has n't ever confused the child .	the child who does n't hate the rabbits has ever confused the child .
those boys who had noticed these doctors had n't ever lost .	those boys who had n't noticed these doctors had ever lost .
the queen who does look like this patient has n't ever won .	the queen who does n't look like this patient has ever won .
those people who could lie should n't ever stretch .	those people who could n't lie should ever stretch .
that person that can eat had n't ever eaten .	that person that can n't eat had ever eaten .
that bed that this dentist had found should n't ever break .	that bed that this dentist had n't found should ever break .
the doctor who had seen this child can n't ever bring those plates .	the doctor who had n't seen this child can ever bring those plates .
this bag that that lady can talk about did n't ever drop .	this bag that that lady can n't talk about did ever drop .
that man who did shake that ring has n't ever scared those girls .	that man who did n't shake that ring has ever scared those girls .
those cups that those men had found did n't ever move .	those cups that those men had n't found did ever move .
those rings that have moved had n't ever dropped .	those rings that have n't moved had ever dropped .
those guys who these ladies had heard do n't ever shake this couch .	those guys who these ladies had n't heard do ever shake this couch .
the doctor who had seen those cats has n't ever taken those shirts .	the doctor who had n't seen those cats has ever taken those shirts .
the teachers who should lie could n't ever whisper .	the teachers who should n't lie could ever whisper .
the mirror that had rolled away had n't ever moved .	the mirror that had n't rolled away had ever moved .
the bottle that the horse had seen would n't ever drop .	the bottle that the horse had n't seen would ever drop .
these windows that have rolled away can n't ever move .	these windows that have n't rolled away can ever move .
the patient that the king has heard has n't ever eaten .	the patient that the king has n't heard has ever eaten .
the child who this adult would know had n't ever found those people .	the child who this adult would n't know had ever found those people .
these cups that those people could notice had n't ever moved .	these cups that those people could n't notice had ever moved .
these cats that had thought about this woman could n't ever notice those dogs .	these cats that had n't thought about this woman could ever notice those dogs .
those men who do sound like those ladies did n't ever praise the girls .	those men who do n't sound like those ladies did ever praise the girls .
that snake that that person had heard had n't ever seen the plane .	that snake that that person had n't heard had ever seen the plane .
those teachers who have cleaned the windows had n't ever moved this bottle .	those teachers who have n't cleaned the windows had ever moved this bottle .
that teacher who the woman would know has n't ever worked with the person .	that teacher who the woman would n't know has ever worked with the person .
the child who did shake the button would n't ever scare the people .	the child who did n't shake the button would ever scare the people .
the turtle that would eat can n't ever eat .	the turtle that would n't eat can ever eat .
the man who has noticed this rocket would n't ever talk .	the man who has n't noticed this rocket would ever talk .
this adult that this dancer does hear would n't ever learn .	this adult that this dancer does n't hear would ever learn .
these guys who could paint should n't ever stretch .	these guys who could n't paint should ever stretch .
that driver who should scream can n't ever run around those schools .	that driver who should n't scream can ever run around those schools .
those teachers that did grow do n't ever grow .	those teachers that did n't grow do ever grow .
the car that this adult should have had n't ever moved .	the car that this adult should n't have had ever moved .
that dancer who this girl has heard should n't ever cry .	that dancer who this girl has n't heard should ever cry .
this adult who has read did n't ever exercise .	this adult who has n't read did ever exercise .
the teachers who those boys had heard had n't ever heard those teachers .	the teachers who those boys had n't heard had ever heard those teachers .
the dog that had run has n't ever remembered the plane .	the dog that had n't run has ever remembered the plane .
that king who had seen this box had n't ever fixed this book .	that king who had n't seen this box had ever fixed this book .
the woman who does walk through this park would n't ever laugh .	the woman who does n't walk through this park would ever laugh .
the child who should talk about this hamster did n't ever make that couch .	the child who should n't talk about this hamster did ever make that couch .
the women who those women had heard should n't ever lift the book .	the women who those women had n't heard should ever lift the book .
this teacher who did make these dishes has n't ever heard these women .	this teacher who did n't make these dishes has ever heard these women .
the dancer who had won has n't ever worried that driver .	the dancer who had n't won has ever worried that driver .
the doctors that the men did hear would n't ever notice the spoons .	the doctors that the men did n't hear would ever notice the spoons .
these snakes that can hear those boys have n't ever learned .	these snakes that can n't hear those boys have ever learned .
the turtles that had grown could n't ever run .	the turtles that had n't grown could ever run .
this turtle that that woman had remembered did n't ever break the boxes .	this turtle that that woman had n't remembered did ever break the boxes .
the bottle that did roll away would n't ever break .	the bottle that did n't roll away would ever break .
this adult who had seen these rings has n't ever read .	this adult who had n't seen these rings has ever read .
this king that had grown has n't ever remembered the car .	this king that had n't grown has ever remembered the car .
the child who should make those shirts can n't ever cry .	the child who should n't make those shirts can ever cry .
this queen that had run has n't ever noticed these trucks .	this queen that had n't run has ever noticed these trucks .
the horse that has thought about those bowls has n't ever seen the turtle .	the horse that has n't thought about those bowls has ever seen the turtle .
the candle that would drop would n't ever roll away .	the candle that would n't drop would ever roll away .
these people who could lose the cars do n't ever return to this bank .	these people who could n't lose the cars do ever return to this bank .
this girl who does lift this dish had n't ever left the school .	this girl who does n't lift this dish had ever left the school .
this dentist who has heard that child had n't ever talked .	this dentist who has n't heard that child had ever talked .
that mirror that that girl would see does n't ever drop .	that mirror that that girl would n't see does ever drop .
the queen that has heard these girls has n't ever seen those forks .	the queen that has n't heard these girls has ever seen those forks .
that king who has made that shirt had n't ever heard the customer .	that king who has n't made that shirt had ever heard the customer .
the ladies that have learned had n't ever noticed those books .	the ladies that have n't learned had ever noticed those books .
the doctor that this girl does talk about did n't ever learn .	the doctor that this girl does n't talk about did ever learn .
this person that did grow should n't ever see that plane .	this person that did n't grow should ever see that plane .
the car that does break can n't ever drop .	the car that does n't break can ever drop .
these ladies who had seen this boat can n't ever work with that girl .	these ladies who had n't seen this boat can ever work with that girl .
the dish that had broken would n't ever move .	the dish that had n't broken would ever move .
that adult who would make that mirror has n't ever bought the forks .	that adult who would n't make that mirror has ever bought the forks .
that person who had seen this doll had n't ever walked through these schools .	that person who had n't seen this doll had ever walked through these schools .
the shirts that do roll away can n't ever break .	the shirts that do n't roll away can ever break .
that customer that this girl has heard would n't ever remember the king .	that customer that this girl has n't heard would ever remember the king .
the guy who had kept these bowls had n't ever kept those shoes .	the guy who had n't kept these bowls had ever kept those shoes .
the boys that would forget this candle had n't ever grown .	the boys that would n't forget this candle had ever grown .
the queen who can sound like this rabbit had n't ever made this doll .	the queen who can n't sound like this rabbit had ever made this doll .
the children that can eat could n't ever like those people .	the children that can n't eat could ever like those people .
those boys who have cried have n't ever talked to those women .	those boys who have n't cried have ever talked to those women .
these boys that have run had n't ever seen those chairs .	these boys that have n't run had ever seen those chairs .
this ring that that driver has remembered has n't ever dropped .	this ring that that driver has n't remembered has ever dropped .
this adult who that queen does look like can n't ever exercise .	this adult who that queen does n't look like can ever exercise .
the teachers who have walked through that school would n't ever practice .	the teachers who have n't walked through that school would ever practice .
this child that the driver does talk about does n't ever hate that fork .	this child that the driver does n't talk about does ever hate that fork .
this child who had noticed this crayon has n't ever painted .	this child who had n't noticed this crayon has ever painted .
that king who can like the mouse has n't ever talked .	that king who can n't like the mouse has ever talked .
this couch that the woman would shake does n't ever drop .	this couch that the woman would n't shake does ever drop .
the boys that had learned had n't ever thought about those turtles .	the boys that had n't learned had ever thought about those turtles .
those boxes that the girls should bring can n't ever move .	those boxes that the girls should n't bring can ever move .
the guys who had run around the school do n't ever paint .	the guys who had n't run around the school do ever paint .
these ladies that had noticed this ship do n't ever love that toy .	these ladies that had n't noticed this ship do ever love that toy .
the driver who has heard those mice had n't ever worked with that doctor .	the driver who has n't heard those mice had ever worked with that doctor .
the snake that that lady did look like had n't ever grown .	the snake that that lady did n't look like had ever grown .
this ship that this teacher has noticed did n't ever drop .	this ship that this teacher has n't noticed did ever drop .
the lady who that adult could hear could n't ever steal the dish .	the lady who that adult could n't hear could ever steal the dish .
those teachers who did like those boys have n't ever held the dishes .	those teachers who did n't like those boys have ever held the dishes .
this dancer who does talk about those men has n't ever painted .	this dancer who does n't talk about those men has ever painted .
the children who would scream had n't ever thrown the toys .	the children who would n't scream had ever thrown the toys .
the guys who could like this bird have n't ever won .	the guys who could n't like this bird have ever won .
the king that the girl has talked about had n't ever broken that bed .	the king that the girl has n't talked about had ever broken that bed .
the women who have talked about this cat have n't ever held those chairs .	the women who have n't talked about this cat have ever held those chairs .
the woman who this dentist could talk about does n't ever lose those cars .	the woman who this dentist could n't talk about does ever lose those cars .
the horses that did eat did n't ever run .	the horses that did n't eat did ever run .
this king who could practice would n't ever find these buttons .	this king who could n't practice would ever find these buttons .
this boy that has thought about those dogs had n't ever grown .	this boy that has n't thought about those dogs had ever grown .
that guy who should hold that cup has n't ever taken that chair .	that guy who should n't hold that cup has ever taken that chair .
these children who had yelled have n't ever painted .	these children who had n't yelled have ever painted .
the ladies who do talk about the boats had n't ever made the boat .	the ladies who do n't talk about the boats had ever made the boat .
the child who can like the mouse would n't ever clean the couch .	the child who can n't like the mouse would ever clean the couch .
the rug that that lady had talked about had n't ever broken those cups .	the rug that that lady had n't talked about had ever broken those cups .
the turtle that the lady has heard can n't ever grow .	the turtle that the lady has n't heard can ever grow .
the man that did sound like the lady can n't ever see the dogs .	the man that did n't sound like the lady can ever see the dogs .
this window that had dropped does n't ever move .	this window that had n't dropped does ever move .
those women who can think about those dishes should n't ever teach these women .	those women who can n't think about those dishes should ever teach these women .
the person who the queen would talk about had n't ever scared the guys .	the person who the queen would n't talk about had ever scared the guys .
these doctors who can know this boy had n't ever dropped those glasses .	these doctors who can n't know this boy had ever dropped those glasses .
the ladies who have left the school had n't ever laughed .	the ladies who have n't left the school had ever laughed .
this teacher that the adult would talk about has n't ever learned .	this teacher that the adult would n't talk about has ever learned .
these children who have thought about the cars had n't ever kept those dolls .	these children who have n't thought about the cars had ever kept those dolls .
those ladies who have thought about this window have n't ever heard the patient .	those ladies who have n't thought about this window have ever heard the patient .
this person who did wave had n't ever won .	this person who did n't wave had ever won .
the doctor who has talked about the rabbits had n't ever brought the cars .	the doctor who has n't talked about the rabbits had ever brought the cars .
the girl who could win should n't ever talk .	the girl who could n't win should ever talk .
the window that would drop has n't ever broken .	the window that would n't drop has ever broken .
that king who has heard that child does n't ever understand this king .	that king who has n't heard that child does ever understand this king .
the guys who can know the bird do n't ever practice .	the guys who can n't know the bird do ever practice .
these doors that the ladies had remembered had n't ever broken this book .	these doors that the ladies had n't remembered had ever broken this book .
this dentist who did know the doctors would n't ever look like those women .	this dentist who did n't know the doctors would ever look like those women .
that child who had waved has n't ever bothered the teacher .	that child who had n't waved has ever bothered the teacher .
that doctor who does laugh should n't ever exercise .	that doctor who does n't laugh should ever exercise .
these doctors who these women can talk about had n't ever left this restaurant .	these doctors who these women can n't talk about had ever left this restaurant .
that shirt that the rabbit can think about does n't ever drop .	that shirt that the rabbit can n't think about does ever drop .
the teachers who should look like this hamster had n't ever heard this queen .	the teachers who should n't look like this hamster had ever heard this queen .
those ladies who do see the dishes had n't ever taken these crayons .	those ladies who do n't see the dishes had ever taken these crayons .
the boys who could pass that bank had n't ever lost the king .	the boys who could n't pass that bank had ever lost the king .
the adult who could remember that dentist could n't ever read .	the adult who could n't remember that dentist could ever read .
the hats that those doctors had noticed had n't ever rolled away .	the hats that those doctors had n't noticed had ever rolled away .
these girls who these girls would talk about do n't ever hold those books .	these girls who these girls would n't talk about do ever hold those books .
that customer who does exercise does n't ever talk .	that customer who does n't exercise does ever talk .
this bird that has noticed these teachers has n't ever seen this book .	this bird that has n't noticed these teachers has ever seen this book .
these teachers who had seen that doll did n't ever steal those books .	these teachers who had n't seen that doll did ever steal those books .
that doctor who has passed this school could n't ever drive to that mall .	that doctor who has n't passed this school could ever drive to that mall .
the cat that has eaten has n't ever run .	the cat that has n't eaten has ever run .
this king who has passed that school has n't ever dropped the box .	this king who has n't passed that school has ever dropped the box .
the bird that could know that king had n't ever noticed this boy .	the bird that could n't know that king had ever noticed this boy .
the lady who should move this window should n't ever make that mirror .	the lady who should n't move this window should ever make that mirror .
the rabbits that do think about this book had n't ever noticed those ladies .	the rabbits that do n't think about this book had ever noticed those ladies .
the ring that would break had n't ever rolled away .	the ring that would n't break had ever rolled away .
the people that the teachers did talk about can n't ever notice these bottles .	the people that the teachers did n't talk about can ever notice these bottles .
this box that that queen would notice had n't ever broken these spoons .	this box that that queen would n't notice had ever broken these spoons .
the king who has heard that doctor has n't ever helped the ladies .	the king who has n't heard that doctor has ever helped the ladies .
the windows that had dropped have n't ever dropped .	the windows that had n't dropped have ever dropped .
the lady that has thought about this rug had n't ever grown .	the lady that has n't thought about this rug had ever grown .
that doctor who had seen these ladies did n't ever know the king .	that doctor who had n't seen these ladies did ever know the king .
the boy who that driver can sound like could n't ever laugh .	the boy who that driver can n't sound like could ever laugh .
that doctor that did see the dancer has n't ever grown .	that doctor that did n't see the dancer has ever grown .
the ladies who would talk about the bags had n't ever run around that museum .	the ladies who would n't talk about the bags had ever run around that museum .
this rocket that this teacher would move had n't ever moved .	this rocket that this teacher would n't move had ever moved .
the dogs that do run did n't ever learn .	the dogs that do n't run did ever learn .
the people who the women had talked about have n't ever waved .	the people who the women had n't talked about have ever waved .
that toy that this teacher should talk about did n't ever move .	that toy that this teacher should n't talk about did ever move .
that child who the dancer could know could n't ever bring that chair .	that child who the dancer could n't know could ever bring that chair .
that patient that can forget this crayon had n't ever seen those plates .	that patient that can n't forget this crayon had ever seen those plates .
these women that have run did n't ever notice these books .	these women that have n't run did ever notice these books .
the child who has painted had n't ever taught the girls .	the child who has n't painted had ever taught the girls .
that girl that had thought about the customer did n't ever think about that dog .	that girl that had n't thought about the customer did ever think about that dog .
these ladies who had heard the cat would n't ever lose .	these ladies who had n't heard the cat would ever lose .
the queen who would love the adult had n't ever bought the ring .	the queen who would n't love the adult had ever bought the ring .
the ladies who have talked about that plane have n't ever brought this rug .	the ladies who have n't talked about that plane have ever brought this rug .
these teachers who would go to that museum had n't ever bothered that queen .	these teachers who would n't go to that museum had ever bothered that queen .
this adult that did learn can n't ever like this bird .	this adult that did n't learn can ever like this bird .
the customer who has remembered the bed has n't ever lost that king .	the customer who has n't remembered the bed has ever lost that king .
those people who should walk through the schools would n't ever talk about these girls .	those people who should n't walk through the schools would ever talk about these girls .
those ladies who did leave the schools have n't ever lost .	those ladies who did n't leave the schools have ever lost .
the boys who those women had heard can n't ever cough .	the boys who those women had n't heard can ever cough .
those girls who would talk about those glasses would n't ever look like the lady .	those girls who would n't talk about those glasses would ever look like the lady .
