the doctor who has cleaned the toys had n't ever waved .	the doctor who has n't cleaned the toys had ever waved .
those teachers who had noticed those ladies do n't ever have the books .	those teachers who had n't noticed those ladies do ever have the books .
this shoe that that cat has thought about had n't ever moved .	this shoe that that cat has n't thought about had ever moved .
these women that had heard those turtles have n't ever noticed those mice .	these women that had n't heard those turtles have ever noticed those mice .
those horses that the women have heard have n't ever seen that mirror .	those horses that the women have n't heard have ever seen that mirror .
this person who had thought about those shirts can n't ever sound like the ladies .	this person who had n't thought about those shirts can ever sound like the ladies .
the person who had heard those teachers did n't ever answer this person .	the person who had n't heard those teachers did ever answer this person .
that adult who would look like those horses had n't ever thrown that bag .	that adult who would n't look like those horses had ever thrown that bag .
the person who should clean that picture would n't ever lift the shoe .	the person who should n't clean that picture would ever lift the shoe .
this dentist who can laugh can n't ever sing .	this dentist who can n't laugh can ever sing .
these people that have grown did n't ever run .	these people that have n't grown did ever run .
this car that the person does love has n't ever rolled away .	this car that the person does n't love has ever rolled away .
these horses that have thought about these boxes had n't ever seen these glasses .	these horses that have n't thought about these boxes had ever seen these glasses .
the patient who can notice the customer could n't ever scare that driver .	the patient who can n't notice the customer could ever scare that driver .
this door that this girl does steal did n't ever roll away .	this door that this girl does n't steal did ever roll away .
that person who did forget that dentist had n't ever moved the chair .	that person who did n't forget that dentist had ever moved the chair .
this doctor who could move the chairs has n't ever confused that person .	this doctor who could n't move the chairs has ever confused that person .
these children who did talk about that plate could n't ever walk through those schools .	these children who did n't talk about that plate could ever walk through those schools .
that adult who could drive to these schools can n't ever answer that girl .	that adult who could n't drive to these schools can ever answer that girl .
the men that could know this guy had n't ever eaten .	the men that could n't know this guy had ever eaten .
that man who the dancer has heard had n't ever won .	that man who the dancer has n't heard had ever won .
this doll that the girl can talk about does n't ever break the bags .	this doll that the girl can n't talk about does ever break the bags .
this customer who would exercise did n't ever teach the woman .	this customer who would n't exercise did ever teach the woman .
that patient who did clean the candle has n't ever talked to the customer .	that patient who did n't clean the candle has ever talked to the customer .
these books that had dropped do n't ever drop .	these books that had n't dropped do ever drop .
the men who can sound like this man could n't ever sneeze .	the men who can n't sound like this man could ever sneeze .
that boy who does lose this cup has n't ever cried .	that boy who does n't lose this cup has ever cried .
this patient who did remember this book should n't ever wave .	this patient who did n't remember this book should ever wave .
the fork that this dog should like had n't ever broken those trucks .	the fork that this dog should n't like had ever broken those trucks .
this book that this boy could see has n't ever dropped .	this book that this boy could n't see has ever dropped .
the girl who has dropped the pictures has n't ever won .	the girl who has n't dropped the pictures has ever won .
the patient who would throw the books can n't ever laugh .	the patient who would n't throw the books can ever laugh .
that driver that this patient has heard had n't ever grown .	that driver that this patient has n't heard had ever grown .
that adult who this dentist has heard had n't ever held that rocket .	that adult who this dentist has n't heard had ever held that rocket .
those people that could know this rabbit had n't ever run .	those people that could n't know this rabbit had ever run .
the driver who had talked about this car would n't ever have the ship .	the driver who had n't talked about this car would ever have the ship .
this person who had remembered the boxes did n't ever return to these schools .	this person who had n't remembered the boxes did ever return to these schools .
this box that had dropped has n't ever rolled away .	this box that had n't dropped has ever rolled away .
the dancer who had laughed has n't ever moved the trucks .	the dancer who had n't laughed has ever moved the trucks .
these children who can shake that fork could n't ever pass the museum .	these children who can n't shake that fork could ever pass the museum .
those snakes that those guys would talk about do n't ever remember the dog .	those snakes that those guys would n't talk about do ever remember the dog .
these girls who had fixed the candle had n't ever worked with this lady .	these girls who had n't fixed the candle had ever worked with this lady .
this queen who would know that rabbit should n't ever hear that girl .	this queen who would n't know that rabbit should ever hear that girl .
the doctors who could sneeze have n't ever painted .	the doctors who could n't sneeze have ever painted .
that customer that should forget this mirror could n't ever learn .	that customer that should n't forget this mirror could ever learn .
those children who did lose these forks have n't ever scared these doctors .	those children who did n't lose these forks have ever scared these doctors .
those people who did go to that kitchen can n't ever steal these plates .	those people who did n't go to that kitchen can ever steal these plates .
these horses that would look like that person had n't ever eaten .	these horses that would n't look like that person had ever eaten .
these boys who should whisper can n't ever bother these guys .	these boys who should n't whisper can ever bother these guys .
that woman who had talked has n't ever moved this ring .	that woman who had n't talked has ever moved this ring .
the child who did hate these shoes could n't ever make the windows .	the child who did n't hate these shoes could ever make the windows .
the toy that that hamster had seen has n't ever dropped .	the toy that that hamster had n't seen has ever dropped .
those ladies who have noticed that shirt do n't ever scare those doctors .	those ladies who have n't noticed that shirt do ever scare those doctors .
this dentist that that adult has heard has n't ever learned .	this dentist that that adult has n't heard has ever learned .
that dish that the man would talk about has n't ever broken the forks .	that dish that the man would n't talk about has ever broken the forks .
the guy who this woman can sound like should n't ever praise the dentist .	the guy who this woman can n't sound like should ever praise the dentist .
the bottle that has dropped has n't ever dropped .	the bottle that has n't dropped has ever dropped .
the spoon that this bird can notice did n't ever break .	the spoon that this bird can n't notice did ever break .
that king that the guy has seen has n't ever broken the candles .	that king that the guy has n't seen has ever broken the candles .
the doctor who had noticed these pictures has n't ever talked to this boy .	the doctor who had n't noticed these pictures has ever talked to this boy .
the dolls that had dropped had n't ever broken .	the dolls that had n't dropped had ever broken .
the driver that the lady could talk about could n't ever notice the ladies .	the driver that the lady could n't talk about could ever notice the ladies .
this dancer who could talk about those doctors has n't ever lost those dolls .	this dancer who could n't talk about those doctors has ever lost those dolls .
that rocket that has dropped can n't ever drop .	that rocket that has n't dropped can ever drop .
this picture that this child had found had n't ever broken .	this picture that this child had n't found had ever broken .
this person who does cry did n't ever visit the boy .	this person who does n't cry did ever visit the boy .
those doctors who have bought that box have n't ever answered that man .	those doctors who have n't bought that box have ever answered that man .
that dentist who did talk about the spoon had n't ever answered these women .	that dentist who did n't talk about the spoon had ever answered these women .
the teacher that would think about this mirror has n't ever remembered the bed .	the teacher that would n't think about this mirror has ever remembered the bed .
that doctor who had made the books should n't ever teach the dentist .	that doctor who had n't made the books should ever teach the dentist .
this dentist that this guy did look like could n't ever grow .	this dentist that this guy did n't look like could ever grow .
this guy who should bring that button has n't ever held the candle .	this guy who should n't bring that button has ever held the candle .
this bowl that the customer had noticed did n't ever break the rocket .	this bowl that the customer had n't noticed did ever break the rocket .
this adult who had left the school could n't ever visit those children .	this adult who had n't left the school could ever visit those children .
that guy who had thrown the book had n't ever brought the books .	that guy who had n't thrown the book had ever brought the books .
these people who should talk about the teachers have n't ever laughed .	these people who should n't talk about the teachers have ever laughed .
the cat that this customer has remembered has n't ever broken those plates .	the cat that this customer has n't remembered has ever broken those plates .
those people who those children can talk about could n't ever read .	those people who those children can n't talk about could ever read .
those ladies who had thrown those cars did n't ever lose .	those ladies who had n't thrown those cars did ever lose .
that girl that had seen those birds had n't ever seen these rabbits .	that girl that had n't seen those birds had ever seen these rabbits .
this person that should run had n't ever thought about that dish .	this person that should n't run had ever thought about that dish .
that dancer that would learn did n't ever grow .	that dancer that would n't learn did ever grow .
the lady who the woman could look like should n't ever throw the truck .	the lady who the woman could n't look like should ever throw the truck .
those men who did talk have n't ever worked with that doctor .	those men who did n't talk have ever worked with that doctor .
this dentist who this girl does hear should n't ever drop the boat .	this dentist who this girl does n't hear should ever drop the boat .
the person who has thought about this book has n't ever worked with the king .	the person who has n't thought about this book has ever worked with the king .
the glass that that driver can forget had n't ever broken .	the glass that that driver can n't forget had ever broken .
this adult that that dancer has talked about had n't ever run .	this adult that that dancer has n't talked about had ever run .
this spoon that the horse had thought about had n't ever moved .	this spoon that the horse had n't thought about had ever moved .
these dogs that these mice have noticed had n't ever broken the trucks .	these dogs that these mice have n't noticed had ever broken the trucks .
that patient who had waved has n't ever cried .	that patient who had n't waved has ever cried .
those doctors that have run do n't ever like those mice .	those doctors that have n't run do ever like those mice .
this patient who has walked through the room has n't ever yelled .	this patient who has n't walked through the room has ever yelled .
the men who should run around these rooms do n't ever take this chair .	the men who should n't run around these rooms do ever take this chair .
that woman who had talked about that mouse had n't ever talked about the turtle .	that woman who had n't talked about that mouse had ever talked about the turtle .
the queen who did forget the teacher could n't ever have those pictures .	the queen who did n't forget the teacher could ever have those pictures .
this cat that that queen did know did n't ever notice this spoon .	this cat that that queen did n't know did ever notice this spoon .
these men who should like the glass did n't ever yell .	these men who should n't like the glass did ever yell .
that dentist who has noticed that picture has n't ever worried the women .	that dentist who has n't noticed that picture has ever worried the women .
the guys who could think about that person have n't ever confused the king .	the guys who could n't think about that person have ever confused the king .
the doctor who could sneeze did n't ever teach the king .	the doctor who could n't sneeze did ever teach the king .
these rabbits that can see these pictures have n't ever thought about this customer .	these rabbits that can n't see these pictures have ever thought about this customer .
that hamster that does remember these boats would n't ever run .	that hamster that does n't remember these boats would ever run .
the customer who should cry has n't ever bought this glass .	the customer who should n't cry has ever bought this glass .
that dancer who this king has talked about has n't ever held the fork .	that dancer who this king has n't talked about has ever held the fork .
that king who should notice the girls had n't ever brought these rings .	that king who should n't notice the girls had ever brought these rings .
that child who this adult can look like could n't ever pass that mall .	that child who this adult can n't look like could ever pass that mall .
this customer who can hear the dogs has n't ever talked to these teachers .	this customer who can n't hear the dogs has ever talked to these teachers .
these birds that have learned had n't ever seen this teacher .	these birds that have n't learned had ever seen this teacher .
those girls that would hate this dog have n't ever learned .	those girls that would n't hate this dog have ever learned .
these bottles that the guys have bought could n't ever break .	these bottles that the guys have n't bought could ever break .
this man who did see the bottles did n't ever return to those rooms .	this man who did n't see the bottles did ever return to those rooms .
these girls that have grown could n't ever see the horses .	these girls that have n't grown could ever see the horses .
those ladies who had noticed those bags can n't ever read .	those ladies who had n't noticed those bags can ever read .
those pictures that should roll away could n't ever drop .	those pictures that should n't roll away could ever drop .
that king that can hear that turtle did n't ever remember those teachers .	that king that can n't hear that turtle did ever remember those teachers .
these guys who had talked about the turtle do n't ever care for this boy .	these guys who had n't talked about the turtle do ever care for this boy .
the woman who this child had heard had n't ever thrown the bowl .	the woman who this child had n't heard had ever thrown the bowl .
that hamster that has grown should n't ever forget the shirt .	that hamster that has n't grown should ever forget the shirt .
that lady who does forget these children has n't ever passed this mall .	that lady who does n't forget these children has ever passed this mall .
this doll that that queen would keep has n't ever broken .	this doll that that queen would n't keep has ever broken .
the dog that had grown had n't ever thought about those buttons .	the dog that had n't grown had ever thought about those buttons .
these cats that the children could hear have n't ever learned .	these cats that the children could n't hear have ever learned .
those boys who can wave would n't ever exercise .	those boys who can n't wave would ever exercise .
that child who has thought about that mirror has n't ever talked about the cars .	that child who has n't thought about that mirror has ever talked about the cars .
this couch that the customer can remember has n't ever broken this button .	this couch that the customer can n't remember has ever broken this button .
the man who this boy did sound like should n't ever hold that fork .	the man who this boy did n't sound like should ever hold that fork .
this bed that has dropped had n't ever dropped .	this bed that has n't dropped had ever dropped .
the ladies who had fixed those cars could n't ever appreciate these men .	the ladies who had n't fixed those cars could ever appreciate these men .
that cat that had noticed the teachers can n't ever eat .	that cat that had n't noticed the teachers can ever eat .
that queen who this customer could talk about had n't ever moved this bed .	that queen who this customer could n't talk about had ever moved this bed .
that adult that that child has talked about has n't ever run .	that adult that that child has n't talked about has ever run .
this picture that the lady should keep did n't ever drop .	this picture that the lady should n't keep did ever drop .
the dancer who did cry would n't ever bring this candle .	the dancer who did n't cry would ever bring this candle .
the horse that would sound like this dancer had n't ever noticed the window .	the horse that would n't sound like this dancer had ever noticed the window .
the lady who could look like those cats can n't ever scare these boys .	the lady who could n't look like those cats can ever scare these boys .
those ladies that these ladies can talk about had n't ever broken these glasses .	those ladies that these ladies can n't talk about had ever broken these glasses .
those doctors who had thrown those cars had n't ever lost those girls .	those doctors who had n't thrown those cars had ever lost those girls .
this dentist that has grown has n't ever run .	this dentist that has n't grown has ever run .
the dogs that have thought about these mice have n't ever thought about the toys .	the dogs that have n't thought about these mice have ever thought about the toys .
this girl who has waved has n't ever found this boy .	this girl who has n't waved has ever found this boy .
these books that the turtles had thought about had n't ever dropped .	these books that the turtles had n't thought about had ever dropped .
the dentist who has laughed had n't ever heard these children .	the dentist who has n't laughed had ever heard these children .
that bag that has broken can n't ever roll away .	that bag that has n't broken can ever roll away .
the man that would notice these spoons can n't ever run .	the man that would n't notice these spoons can ever run .
this ring that the man should forget had n't ever moved .	this ring that the man should n't forget had ever moved .
these women who had noticed this doctor had n't ever cleaned that plate .	these women who had n't noticed this doctor had ever cleaned that plate .
that patient that had heard that patient has n't ever eaten .	that patient that had n't heard that patient has ever eaten .
that boy that that dentist would look like could n't ever eat .	that boy that that dentist would n't look like could ever eat .
the doctor who should wave has n't ever painted .	the doctor who should n't wave has ever painted .
these dogs that could eat can n't ever learn .	these dogs that could n't eat can ever learn .
this bird that the guy had talked about had n't ever thought about the mice .	this bird that the guy had n't talked about had ever thought about the mice .
that king who did leave the museum has n't ever painted .	that king who did n't leave the museum has ever painted .
that dog that does think about that shoe does n't ever love that picture .	that dog that does n't think about that shoe does ever love that picture .
that dentist that the adult could sound like does n't ever run .	that dentist that the adult could n't sound like does ever run .
the cats that do learn would n't ever learn .	the cats that do n't learn would ever learn .
this customer who has held this bag would n't ever care for the women .	this customer who has n't held this bag would ever care for the women .
this boat that the bird has noticed had n't ever rolled away .	this boat that the bird has n't noticed had ever rolled away .
this plate that has rolled away would n't ever roll away .	this plate that has n't rolled away would ever roll away .
that dish that could drop has n't ever moved .	that dish that could n't drop has ever moved .
the boy who would talk about that plate does n't ever whisper .	the boy who would n't talk about that plate does ever whisper .
these girls who could throw those doors have n't ever bought this rocket .	these girls who could n't throw those doors have ever bought this rocket .
the child who could notice the chair has n't ever painted .	the child who could n't notice the chair has ever painted .
this mouse that the woman had heard should n't ever like this doll .	this mouse that the woman had n't heard should ever like this doll .
the boy who had thrown that candle has n't ever yelled .	the boy who had n't thrown that candle has ever yelled .
this doll that would move can n't ever roll away .	this doll that would n't move can ever roll away .
the boys who had talked about the spoon had n't ever passed these rooms .	the boys who had n't talked about the spoon had ever passed these rooms .
the dancer that that teacher can sound like has n't ever eaten .	the dancer that that teacher can n't sound like has ever eaten .
those snakes that the children have seen have n't ever broken these rings .	those snakes that the children have n't seen have ever broken these rings .
the patient that did love those turtles did n't ever forget the books .	the patient that did n't love those turtles did ever forget the books .
the women who can drop those dishes have n't ever lost this hat .	the women who can n't drop those dishes have ever lost this hat .
the cup that the man has bought did n't ever move .	the cup that the man has n't bought did ever move .
this guy who has taken the boxes had n't ever taught that woman .	this guy who has n't taken the boxes had ever taught that woman .
this dancer who has remembered those women can n't ever work with the king .	this dancer who has n't remembered those women can ever work with the king .
the window that this king had remembered has n't ever broken .	the window that this king had n't remembered has ever broken .
the boys who the teachers have talked about have n't ever lost the people .	the boys who the teachers have n't talked about have ever lost the people .
that adult that did notice the women has n't ever thought about these books .	that adult that did n't notice the women has ever thought about these books .
these trucks that those men do see do n't ever break this dish .	these trucks that those men do n't see do ever break this dish .
the doctors who do see the truck had n't ever walked through the park .	the doctors who do n't see the truck had ever walked through the park .
the guy that did run had n't ever seen the turtle .	the guy that did n't run had ever seen the turtle .
the customer who had fixed these boxes had n't ever lost .	the customer who had n't fixed these boxes had ever lost .
the boy who does talk does n't ever wave .	the boy who does n't talk does ever wave .
those women who do sound like the boys did n't ever sing .	those women who do n't sound like the boys did ever sing .
these horses that can grow could n't ever grow .	these horses that can n't grow could ever grow .
this bird that has thought about these trucks had n't ever learned .	this bird that has n't thought about these trucks had ever learned .
this driver who had thought about the plate does n't ever leave that library .	this driver who had n't thought about the plate does ever leave that library .
those people who can drop this spoon have n't ever read .	those people who can n't drop this spoon have ever read .
these ladies that have remembered that ring do n't ever eat .	these ladies that have n't remembered that ring do ever eat .
those pictures that have dropped should n't ever move .	those pictures that have n't dropped should ever move .
this customer who should hold these pictures had n't ever taken that shoe .	this customer who should n't hold these pictures had ever taken that shoe .
the men who had talked about this chair had n't ever moved that bowl .	the men who had n't talked about this chair had ever moved that bowl .
the boat that this boy should have has n't ever moved .	the boat that this boy should n't have has ever moved .
the people who would clean the door have n't ever heard these turtles .	the people who would n't clean the door have ever heard these turtles .
this ship that could drop would n't ever roll away .	this ship that could n't drop would ever roll away .
this dancer who should hear those people would n't ever talk to these teachers .	this dancer who should n't hear those people would ever talk to these teachers .
this boy that did run had n't ever eaten .	this boy that did n't run had ever eaten .
the patient that that cat would think about has n't ever broken these books .	the patient that that cat would n't think about has ever broken these books .
