that dancer who the woman can talk about could n't ever whisper .	that dancer who the woman can n't talk about could ever whisper .
the person who has heard that person should n't ever praise this driver .	the person who has n't heard that person should ever praise this driver .
this box that that teacher has talked about did n't ever roll away .	this box that that teacher has n't talked about did ever roll away .
those women who did paint should n't ever throw these bottles .	those women who did n't paint should ever throw these bottles .
this patient that had heard this guy has n't ever seen the cat .	this patient that had n't heard this guy has ever seen the cat .
that adult who should remember these birds has n't ever painted .	that adult who should n't remember these birds has ever painted .
these girls who should take those boats could n't ever sell this fork .	these girls who should n't take those boats could ever sell this fork .
this driver who has remembered that candle would n't ever whisper .	this driver who has n't remembered that candle would ever whisper .
that guy who this dentist should sound like can n't ever drive to the park .	that guy who this dentist should n't sound like can ever drive to the park .
those children who have painted had n't ever bought these books .	those children who have n't painted had ever bought these books .
these forks that have dropped have n't ever broken .	these forks that have n't dropped have ever broken .
the dish that has dropped can n't ever break .	the dish that has n't dropped can ever break .
the guys who should think about those shirts should n't ever smile .	the guys who should n't think about those shirts should ever smile .
that lady who would forget this dish should n't ever read .	that lady who would n't forget this dish should ever read .
that king who this adult could sound like had n't ever visited that queen .	that king who this adult could n't sound like had ever visited that queen .
these boys that had heard these people can n't ever eat .	these boys that had n't heard these people can ever eat .
these men who could look like those boys have n't ever cried .	these men who could n't look like those boys have ever cried .
the patient who can run around these schools could n't ever whisper .	the patient who can n't run around these schools could ever whisper .
the adult that had eaten has n't ever thought about these bowls .	the adult that had n't eaten has ever thought about these bowls .
that queen that that dog had remembered does n't ever break this hat .	that queen that that dog had n't remembered does ever break this hat .
this adult that that person has talked about would n't ever run .	this adult that that person has n't talked about would ever run .
this queen who has gone to this library could n't ever whisper .	this queen who has n't gone to this library could ever whisper .
the man who had seen those trucks can n't ever take those bottles .	the man who had n't seen those trucks can ever take those bottles .
this man who should throw that doll would n't ever cough .	this man who should n't throw that doll would ever cough .
the hamster that would eat could n't ever grow .	the hamster that would n't eat could ever grow .
the lady who had taken this picture should n't ever move this window .	the lady who had n't taken this picture should ever move this window .
that child who can run around this kitchen did n't ever drop the mirror .	that child who can n't run around this kitchen did ever drop the mirror .
those girls who could hear that horse should n't ever practice .	those girls who could n't hear that horse should ever practice .
those women who the doctors should know do n't ever scream .	those women who the doctors should n't know do ever scream .
the queen that this lady would talk about has n't ever eaten .	the queen that this lady would n't talk about has ever eaten .
the mirror that that driver has remembered has n't ever rolled away .	the mirror that that driver has n't remembered has ever rolled away .
those doctors who do forget that plane had n't ever kept the mirror .	those doctors who do n't forget that plane had ever kept the mirror .
this child who this doctor had talked about could n't ever understand the person .	this child who this doctor had n't talked about could ever understand the person .
that person who should look like that guy has n't ever taught those women .	that person who should n't look like that guy has ever taught those women .
those people who could lie have n't ever heard those teachers .	those people who could n't lie have ever heard those teachers .
these men who can pass that mall would n't ever appreciate those boys .	these men who can n't pass that mall would ever appreciate those boys .
that fork that this doctor had noticed has n't ever dropped .	that fork that this doctor had n't noticed has ever dropped .
this woman who did forget those bags did n't ever whisper .	this woman who did n't forget those bags did ever whisper .
these girls who could like the car had n't ever found the doors .	these girls who could n't like the car had ever found the doors .
this window that had broken had n't ever broken .	this window that had n't broken had ever broken .
this lady who had cleaned these candles does n't ever pass this park .	this lady who had n't cleaned these candles does ever pass this park .
those doctors who can read have n't ever helped this dancer .	those doctors who can n't read have ever helped this dancer .
those birds that these children have heard had n't ever grown .	those birds that these children have n't heard had ever grown .
the customer who can remember these toys had n't ever made the box .	the customer who can n't remember these toys had ever made the box .
the doctor who the driver had talked about did n't ever praise this dentist .	the doctor who the driver had n't talked about did ever praise this dentist .
that girl that had seen the bags would n't ever learn .	that girl that had n't seen the bags would ever learn .
the teacher who would hear the guy did n't ever have those forks .	the teacher who would n't hear the guy did ever have those forks .
this glass that that dentist should talk about can n't ever break that glass .	this glass that that dentist should n't talk about can ever break that glass .
this guy that should like this turtle has n't ever seen that plane .	this guy that should n't like this turtle has ever seen that plane .
the children who can laugh can n't ever hear the people .	the children who can n't laugh can ever hear the people .
the customer who can go to the restaurant has n't ever passed that school .	the customer who can n't go to the restaurant has ever passed that school .
these bowls that these boys should like have n't ever broken that book .	these bowls that these boys should n't like have ever broken that book .
the king who has lost these buttons could n't ever exercise .	the king who has n't lost these buttons could ever exercise .
this doctor who the doctor can talk about should n't ever steal those crayons .	this doctor who the doctor can n't talk about should ever steal those crayons .
the mouse that has run had n't ever run .	the mouse that has n't run had ever run .
this person that had noticed these snakes should n't ever think about those crayons .	this person that had n't noticed these snakes should ever think about those crayons .
the queen that has remembered that doctor has n't ever remembered the people .	the queen that has n't remembered that doctor has ever remembered the people .
these men who the guys could hear did n't ever clean this spoon .	these men who the guys could n't hear did ever clean this spoon .
the teacher who the woman had heard did n't ever pass these rooms .	the teacher who the woman had n't heard did ever pass these rooms .
the plate that that person can bring has n't ever rolled away .	the plate that that person can n't bring has ever rolled away .
those doctors who should pass the museum do n't ever talk about the birds .	those doctors who should n't pass the museum do ever talk about the birds .
the horses that have run had n't ever noticed this dentist .	the horses that have n't run had ever noticed this dentist .
this mirror that the boy has fixed would n't ever roll away .	this mirror that the boy has n't fixed would ever roll away .
that cat that this man had talked about could n't ever think about the rabbits .	that cat that this man had n't talked about could ever think about the rabbits .
that child who has thought about that shirt has n't ever found the bottle .	that child who has n't thought about that shirt has ever found the bottle .
those girls who should talk about the book should n't ever move this spoon .	those girls who should n't talk about the book should ever move this spoon .
this dentist that should think about those cats had n't ever seen those boats .	this dentist that should n't think about those cats had ever seen those boats .
that lady that does learn can n't ever learn .	that lady that does n't learn can ever learn .
that customer that this dancer should sound like had n't ever noticed this doctor .	that customer that this dancer should n't sound like had ever noticed this doctor .
these forks that these teachers did take had n't ever dropped .	these forks that these teachers did n't take had ever dropped .
the dishes that do move had n't ever moved .	the dishes that do n't move had ever moved .
that adult who that boy could know should n't ever shake the bottles .	that adult who that boy could n't know should ever shake the bottles .
the children who do think about the shoe should n't ever care for the guy .	the children who do n't think about the shoe should ever care for the guy .
the dancer who had brought those plates does n't ever care for the men .	the dancer who had n't brought those plates does ever care for the men .
these toys that have moved have n't ever rolled away .	these toys that have n't moved have ever rolled away .
the boy who the teacher has heard has n't ever cried .	the boy who the teacher has n't heard has ever cried .
these children that could grow have n't ever learned .	these children that could n't grow have ever learned .
these men who have gone to the bank have n't ever lost .	these men who have n't gone to the bank have ever lost .
that child who should exercise has n't ever taken those rings .	that child who should n't exercise has ever taken those rings .
that doctor who should see the shirt could n't ever talk .	that doctor who should n't see the shirt could ever talk .
those girls that could run should n't ever eat .	those girls that could n't run should ever eat .
those children who did like this shoe do n't ever clean the bowl .	those children who did n't like this shoe do ever clean the bowl .
the patient who would cry had n't ever run around the park .	the patient who would n't cry had ever run around the park .
the men who could sell the bag did n't ever care for that driver .	the men who could n't sell the bag did ever care for that driver .
these people who can hear those cats have n't ever fixed the shoe .	these people who can n't hear those cats have ever fixed the shoe .
that driver who would practice would n't ever fix that mirror .	that driver who would n't practice would ever fix that mirror .
the men who do pass the room can n't ever cry .	the men who do n't pass the room can ever cry .
this queen who does walk through the restaurant did n't ever talk to that dancer .	this queen who does n't walk through the restaurant did ever talk to that dancer .
this child who has heard those mice has n't ever gone to the room .	this child who has n't heard those mice has ever gone to the room .
that queen that that dentist does talk about had n't ever seen that fork .	that queen that that dentist does n't talk about had ever seen that fork .
this driver who the child has heard would n't ever take those crayons .	this driver who the child has n't heard would ever take those crayons .
the guy that has grown had n't ever run .	the guy that has n't grown had ever run .
that customer who has laughed would n't ever find the button .	that customer who has n't laughed would ever find the button .
the lady that this teacher has thought about has n't ever broken the beds .	the lady that this teacher has n't thought about has ever broken the beds .
this dancer who did like the woman would n't ever yell .	this dancer who did n't like the woman would ever yell .
those children who did win have n't ever scared these ladies .	those children who did n't win have ever scared these ladies .
the people who do think about the picture can n't ever walk through that kitchen .	the people who do n't think about the picture can ever walk through that kitchen .
these children who should love the mirror had n't ever brought those shoes .	these children who should n't love the mirror had ever brought those shoes .
the dog that that woman should know could n't ever grow .	the dog that that woman should n't know could ever grow .
those ladies who do go to this park did n't ever drive to these schools .	those ladies who do n't go to this park did ever drive to these schools .
the child that had learned should n't ever hate the door .	the child that had n't learned should ever hate the door .
the women who should see the dog could n't ever go to that bank .	the women who should n't see the dog could ever go to that bank .
the boys who had thought about this cup had n't ever fixed these trucks .	the boys who had n't thought about this cup had ever fixed these trucks .
the boy who can take these books would n't ever leave this park .	the boy who can n't take these books would ever leave this park .
the bird that this child could forget had n't ever broken that spoon .	the bird that this child could n't forget had ever broken that spoon .
the men who do hear the girl have n't ever cried .	the men who do n't hear the girl have ever cried .
this customer who the teacher had talked about has n't ever worked with the dentist .	this customer who the teacher had n't talked about has ever worked with the dentist .
the bottles that these horses have remembered had n't ever rolled away .	the bottles that these horses have n't remembered had ever rolled away .
the teacher who had seen the rabbit did n't ever drop the window .	the teacher who had n't seen the rabbit did ever drop the window .
this patient who had talked about those cats would n't ever find the bowls .	this patient who had n't talked about those cats would ever find the bowls .
the lady who this woman had talked about has n't ever lost these doors .	the lady who this woman had n't talked about has ever lost these doors .
that queen that that person does know had n't ever run .	that queen that that person does n't know had ever run .
these children who have remembered those shirts should n't ever move this rug .	these children who have n't remembered those shirts should ever move this rug .
the dancer that that guy does talk about had n't ever noticed that bed .	the dancer that that guy does n't talk about had ever noticed that bed .
the king that this king has talked about would n't ever remember this doctor .	the king that this king has n't talked about would ever remember this doctor .
this teacher that did see that shoe does n't ever remember that box .	this teacher that did n't see that shoe does ever remember that box .
these children that had remembered that ring should n't ever grow .	these children that had n't remembered that ring should ever grow .
the mouse that that queen has thought about has n't ever broken the windows .	the mouse that that queen has n't thought about has ever broken the windows .
those guys that have eaten had n't ever thought about the doctors .	those guys that have n't eaten had ever thought about the doctors .
those plates that should move did n't ever break .	those plates that should n't move did ever break .
the snakes that those guys should sound like had n't ever grown .	the snakes that those guys should n't sound like had ever grown .
this person who this boy has talked about has n't ever cried .	this person who this boy has n't talked about has ever cried .
the beds that these doctors have dropped do n't ever roll away .	the beds that these doctors have n't dropped do ever roll away .
those doctors who had yelled had n't ever talked .	those doctors who had n't yelled had ever talked .
these horses that have eaten have n't ever noticed this shirt .	these horses that have n't eaten have ever noticed this shirt .
the guy who could sneeze has n't ever scared these girls .	the guy who could n't sneeze has ever scared these girls .
the guy who has thought about the adult has n't ever made that doll .	the guy who has n't thought about the adult has ever made that doll .
the birds that those women have talked about could n't ever love the book .	the birds that those women have n't talked about could ever love the book .
the boys who had talked about the rocket do n't ever lose .	the boys who had n't talked about the rocket do ever lose .
this boat that this girl does see has n't ever broken this picture .	this boat that this girl does n't see has ever broken this picture .
the dishes that have broken have n't ever dropped .	the dishes that have n't broken have ever dropped .
this boy who had run around these schools would n't ever sell the bottle .	this boy who had n't run around these schools would ever sell the bottle .
those women who should drive to the restaurant could n't ever run around the hospital .	those women who should n't drive to the restaurant could ever run around the hospital .
the king that had remembered this lady has n't ever thought about this cup .	the king that had n't remembered this lady has ever thought about this cup .
the rabbit that can sound like those dogs had n't ever remembered these shirts .	the rabbit that can n't sound like those dogs had ever remembered these shirts .
that boy who could sound like these men does n't ever visit that doctor .	that boy who could n't sound like these men does ever visit that doctor .
this door that the horse had noticed did n't ever break these doors .	this door that the horse had n't noticed did ever break these doors .
that bird that this lady had talked about does n't ever break the toys .	that bird that this lady had n't talked about does ever break the toys .
the teachers who would throw the fork have n't ever helped this woman .	the teachers who would n't throw the fork have ever helped this woman .
those boys who had found these hats could n't ever praise that child .	those boys who had n't found these hats could ever praise that child .
the birds that had heard those people could n't ever remember the girl .	the birds that had n't heard those people could ever remember the girl .
the king that has heard this rabbit had n't ever grown .	the king that has n't heard this rabbit had ever grown .
that teacher who does shake this window did n't ever buy the books .	that teacher who does n't shake this window did ever buy the books .
that boy who should notice that plate has n't ever painted .	that boy who should n't notice that plate has ever painted .
this adult who had moved the doors should n't ever return to that school .	this adult who had n't moved the doors should ever return to that school .
these chairs that have rolled away have n't ever rolled away .	these chairs that have n't rolled away have ever rolled away .
those books that these ladies have seen would n't ever drop .	those books that these ladies have n't seen would ever drop .
the children who had lost that ship do n't ever scream .	the children who had n't lost that ship do ever scream .
these girls that have eaten had n't ever remembered the box .	these girls that have n't eaten had ever remembered the box .
those guys who would hate these bottles do n't ever lose that box .	those guys who would n't hate these bottles do ever lose that box .
the people who had thought about these cars did n't ever win .	the people who had n't thought about these cars did ever win .
this dentist who would take the books had n't ever dropped the cars .	this dentist who would n't take the books had ever dropped the cars .
the box that the boy had brought has n't ever broken .	the box that the boy had n't brought has ever broken .
that guy who has heard this lady had n't ever helped that woman .	that guy who has n't heard this lady had ever helped that woman .
this plane that the guy has talked about had n't ever broken .	this plane that the guy has n't talked about had ever broken .
this queen that that guy can sound like has n't ever remembered those pictures .	this queen that that guy can n't sound like has ever remembered those pictures .
the cars that did move had n't ever broken .	the cars that did n't move had ever broken .
the picture that this girl could forget has n't ever broken .	the picture that this girl could n't forget has ever broken .
these men who should look like that cat did n't ever look like these horses .	these men who should n't look like that cat did ever look like these horses .
that dancer who has remembered the dog has n't ever made that doll .	that dancer who has n't remembered the dog has ever made that doll .
that person who would cry has n't ever cried .	that person who would n't cry has ever cried .
that dancer who this man can talk about has n't ever helped this driver .	that dancer who this man can n't talk about has ever helped this driver .
this adult who has passed these rooms did n't ever sneeze .	this adult who has n't passed these rooms did ever sneeze .
the teacher who has heard those guys could n't ever buy the book .	the teacher who has n't heard those guys could ever buy the book .
these ladies who had thought about those rabbits did n't ever clean that plane .	these ladies who had n't thought about those rabbits did ever clean that plane .
that boy who could love this bowl has n't ever lost this crayon .	that boy who could n't love this bowl has ever lost this crayon .
these girls who could forget this rocket do n't ever look like that cat .	these girls who could n't forget this rocket do ever look like that cat .
that candle that has dropped had n't ever moved .	that candle that has n't dropped had ever moved .
the driver who had remembered the ladies had n't ever answered the women .	the driver who had n't remembered the ladies had ever answered the women .
these ladies who did cough had n't ever dropped the buttons .	these ladies who did n't cough had ever dropped the buttons .
the horse that this teacher can talk about had n't ever grown .	the horse that this teacher can n't talk about had ever grown .
that adult who can lose this cup had n't ever helped this patient .	that adult who can n't lose this cup had ever helped this patient .
this teacher who could whisper had n't ever taught this king .	this teacher who could n't whisper had ever taught this king .
those boys who can hate the book do n't ever care for the teachers .	those boys who can n't hate the book do ever care for the teachers .
those cups that could roll away had n't ever moved .	those cups that could n't roll away had ever moved .
that boy who had heard the guys did n't ever walk through those schools .	that boy who had n't heard the guys did ever walk through those schools .
this woman who has made the cup has n't ever painted .	this woman who has n't made the cup has ever painted .
that girl who should steal those windows should n't ever care for this adult .	that girl who should n't steal those windows should ever care for this adult .
the plates that would drop can n't ever drop .	the plates that would n't drop can ever drop .
the guy who has heard that doctor has n't ever kept that bowl .	the guy who has n't heard that doctor has ever kept that bowl .
the man who that patient had talked about should n't ever whisper .	the man who that patient had n't talked about should ever whisper .
the shoe that the turtle has remembered could n't ever drop .	the shoe that the turtle has n't remembered could ever drop .
this lady that could hate that dancer had n't ever learned .	this lady that could n't hate that dancer had ever learned .
the girls who could talk about these books can n't ever yell .	the girls who could n't talk about these books can ever yell .
that customer who could notice this lady can n't ever understand the adult .	that customer who could n't notice this lady can ever understand the adult .
those buttons that have rolled away can n't ever break .	those buttons that have n't rolled away can ever break .
that dentist that that rabbit could love could n't ever break the chair .	that dentist that that rabbit could n't love could ever break the chair .
the doctors who the people had talked about did n't ever shake the beds .	the doctors who the people had n't talked about did ever shake the beds .
that man who has seen those trucks has n't ever run around this park .	that man who has n't seen those trucks has ever run around this park .
that customer who that doctor did sound like should n't ever have that book .	that customer who that doctor did n't sound like should ever have that book .
those people who had seen these ladies have n't ever left this school .	those people who had n't seen these ladies have ever left this school .
the box that this dentist did lift did n't ever roll away .	the box that this dentist did n't lift did ever roll away .
that patient who should forget this mirror did n't ever know the person .	that patient who should n't forget this mirror did ever know the person .
the adult that does like those cups did n't ever like this adult .	the adult that does n't like those cups did ever like this adult .
