those girls who had talked about these pictures would n't ever whisper .	those girls who had n't talked about these pictures would ever whisper .
that crayon that the snake has noticed had n't ever broken those toys .	that crayon that the snake has n't noticed had ever broken those toys .
these people who had yelled did n't ever lift this bowl .	these people who had n't yelled did ever lift this bowl .
this customer that this driver did see does n't ever break these cars .	this customer that this driver did n't see does ever break these cars .
the birds that those men had heard had n't ever noticed that glass .	the birds that those men had n't heard had ever noticed that glass .
the doctor who had heard these ladies had n't ever worked with those girls .	the doctor who had n't heard these ladies had ever worked with those girls .
the girls who have heard the lady should n't ever cry .	the girls who have n't heard the lady should ever cry .
this queen who had heard the girl has n't ever heard the girls .	this queen who had n't heard the girl has ever heard the girls .
the man who had talked about that rabbit did n't ever lose .	the man who had n't talked about that rabbit did ever lose .
that king who has heard the hamster did n't ever bring these bottles .	that king who has n't heard the hamster did ever bring these bottles .
that hamster that the girl has heard has n't ever learned .	that hamster that the girl has n't heard has ever learned .
this patient who could hear these dogs had n't ever yelled .	this patient who could n't hear these dogs had ever yelled .
the teachers who would sound like the teachers can n't ever cough .	the teachers who would n't sound like the teachers can ever cough .
this woman that has noticed this rabbit would n't ever grow .	this woman that has n't noticed this rabbit would ever grow .
that crayon that would break has n't ever moved .	that crayon that would n't break has ever moved .
those children who did like this king have n't ever lost these women .	those children who did n't like this king have ever lost these women .
those women who had talked about the snake can n't ever take that door .	those women who had n't talked about the snake can ever take that door .
the child who has thought about this window had n't ever fixed the bottles .	the child who has n't thought about this window had ever fixed the bottles .
this button that this child does keep did n't ever roll away .	this button that this child does n't keep did ever roll away .
that customer that this woman does talk about has n't ever thought about the bed .	that customer that this woman does n't talk about has ever thought about the bed .
the lady that had grown had n't ever noticed this boat .	the lady that had n't grown had ever noticed this boat .
that adult who could clean the bowls has n't ever cried .	that adult who could n't clean the bowls has ever cried .
these ladies that have heard this person should n't ever think about the dishes .	these ladies that have n't heard this person should ever think about the dishes .
that man who would think about this rabbit had n't ever won .	that man who would n't think about this rabbit had ever won .
the shoe that this mouse had thought about would n't ever drop .	the shoe that this mouse had n't thought about would ever drop .
that driver who has talked about the dogs has n't ever thrown these spoons .	that driver who has n't talked about the dogs has ever thrown these spoons .
this girl who can move that bag has n't ever worked with the king .	this girl who can n't move that bag has ever worked with the king .
the plates that these teachers have brought have n't ever moved .	the plates that these teachers have n't brought have ever moved .
that dentist who has left the park had n't ever worked with the person .	that dentist who has n't left the park had ever worked with the person .
the child who would talk about that mirror should n't ever run around that hospital .	the child who would n't talk about that mirror should ever run around that hospital .
the man who can sound like that person had n't ever found this girl .	the man who can n't sound like that person had ever found this girl .
these ladies who the teachers had heard did n't ever sing .	these ladies who the teachers had n't heard did ever sing .
this teacher who did hate this teacher does n't ever practice .	this teacher who did n't hate this teacher does ever practice .
the dog that had eaten has n't ever remembered those guys .	the dog that had n't eaten has ever remembered those guys .
that king who does drive to this mall should n't ever make that cup .	that king who does n't drive to this mall should ever make that cup .
that dancer that the person has seen would n't ever break that plane .	that dancer that the person has n't seen would ever break that plane .
the book that this lady could hold should n't ever roll away .	the book that this lady could n't hold should ever roll away .
these doctors that these children should know have n't ever grown .	these doctors that these children should n't know have ever grown .
the lady that the guy does talk about has n't ever grown .	the lady that the guy does n't talk about has ever grown .
the men who would remember that car have n't ever talked to these people .	the men who would n't remember that car have ever talked to these people .
that chair that this boy can hate should n't ever break those bowls .	that chair that this boy can n't hate should ever break those bowls .
the mouse that had heard this king has n't ever grown .	the mouse that had n't heard this king has ever grown .
that adult who had talked can n't ever worry these people .	that adult who had n't talked can ever worry these people .
the king who the child could talk about had n't ever gone to this room .	the king who the child could n't talk about had ever gone to this room .
those people who have painted have n't ever painted .	those people who have n't painted have ever painted .
this doctor who could sound like those women should n't ever keep these glasses .	this doctor who could n't sound like those women should ever keep these glasses .
the guys who have won have n't ever waved .	the guys who have n't won have ever waved .
the man who did hear the queen has n't ever made the car .	the man who did n't hear the queen has ever made the car .
the pictures that those girls have seen have n't ever moved .	the pictures that those girls have n't seen have ever moved .
the boys who have won had n't ever dropped the hats .	the boys who have n't won had ever dropped the hats .
this patient that has remembered this rocket can n't ever like these cats .	this patient that has n't remembered this rocket can ever like these cats .
that guy who this king had heard had n't ever cleaned this hat .	that guy who this king had n't heard had ever cleaned this hat .
these girls that do eat have n't ever run .	these girls that do n't eat have ever run .
this customer who could buy the books had n't ever held those shirts .	this customer who could n't buy the books had ever held those shirts .
those girls who did run around the library can n't ever have that bottle .	those girls who did n't run around the library can ever have that bottle .
those rabbits that have remembered this spoon have n't ever remembered this turtle .	those rabbits that have n't remembered this spoon have ever remembered this turtle .
the bird that this girl had seen has n't ever broken the window .	the bird that this girl had n't seen has ever broken the window .
the fork that could move had n't ever moved .	the fork that could n't move had ever moved .
the guy who has moved those forks has n't ever taken the doors .	the guy who has n't moved those forks has ever taken the doors .
this dog that had remembered these shirts had n't ever remembered those ladies .	this dog that had n't remembered these shirts had ever remembered those ladies .
that queen that can run would n't ever forget the books .	that queen that can n't run would ever forget the books .
that doctor who this person would look like did n't ever sell those bottles .	that doctor who this person would n't look like did ever sell those bottles .
this guy who can sound like this guy could n't ever sing .	this guy who can n't sound like this guy could ever sing .
the teachers who have laughed do n't ever know this dentist .	the teachers who have n't laughed do ever know this dentist .
these cars that the guys have noticed should n't ever drop .	these cars that the guys have n't noticed should ever drop .
the books that the men had thought about had n't ever broken .	the books that the men had n't thought about had ever broken .
that customer who would scream can n't ever bother the guy .	that customer who would n't scream can ever bother the guy .
the doctors who can make this truck have n't ever visited this teacher .	the doctors who can n't make this truck have ever visited this teacher .
these teachers that do run would n't ever hate the boat .	these teachers that do n't run would ever hate the boat .
the driver who had found the trucks has n't ever talked about the ship .	the driver who had n't found the trucks has ever talked about the ship .
these teachers that would know those people had n't ever seen that guy .	these teachers that would n't know those people had ever seen that guy .
those children who would exercise do n't ever bother this girl .	those children who would n't exercise do ever bother this girl .
that guy who has remembered the dogs can n't ever know this guy .	that guy who has n't remembered the dogs can ever know this guy .
those guys who the ladies should talk about had n't ever passed that hospital .	those guys who the ladies should n't talk about had ever passed that hospital .
these cars that the guys have fixed did n't ever drop .	these cars that the guys have n't fixed did ever drop .
that girl who had heard the girl would n't ever paint .	that girl who had n't heard the girl would ever paint .
that queen who has walked through the mall has n't ever made those bowls .	that queen who has n't walked through the mall has ever made those bowls .
the men who have seen the mice have n't ever worked with this girl .	the men who have n't seen the mice have ever worked with this girl .
these children who can make those glasses should n't ever teach the adult .	these children who can n't make those glasses should ever teach the adult .
the cup that the girl had thought about has n't ever broken the chairs .	the cup that the girl had n't thought about has ever broken the chairs .
those chairs that these children have seen had n't ever dropped .	those chairs that these children have n't seen had ever dropped .
these girls who would sound like the hamster should n't ever drive to the bank .	these girls who would n't sound like the hamster should ever drive to the bank .
the women who did buy the dishes have n't ever dropped that ship .	the women who did n't buy the dishes have ever dropped that ship .
that dancer who would lift those dishes has n't ever taken the cars .	that dancer who would n't lift those dishes has ever taken the cars .
that dentist who should sell the picture has n't ever left this school .	that dentist who should n't sell the picture has ever left this school .
those men who do look like this boy did n't ever sneeze .	those men who do n't look like this boy did ever sneeze .
the teachers who the people had heard have n't ever yelled .	the teachers who the people had n't heard have ever yelled .
the woman who would know the turtle had n't ever gone to those schools .	the woman who would n't know the turtle had ever gone to those schools .
the customer who had noticed that truck should n't ever wave .	the customer who had n't noticed that truck should ever wave .
that teacher who the customer has heard did n't ever steal the glass .	that teacher who the customer has n't heard did ever steal the glass .
this lady who had dropped this fork had n't ever talked about the books .	this lady who had n't dropped this fork had ever talked about the books .
that woman who has seen this ship had n't ever thrown these spoons .	that woman who has n't seen this ship had ever thrown these spoons .
the driver who had talked about those snakes does n't ever buy the box .	the driver who had n't talked about those snakes does ever buy the box .
the girl who that teacher would look like did n't ever scare this man .	the girl who that teacher would n't look like did ever scare this man .
the woman who has painted had n't ever brought these cars .	the woman who has n't painted had ever brought these cars .
this queen who would wave has n't ever dropped this book .	this queen who would n't wave has ever dropped this book .
the customer who has walked through those schools would n't ever lose the windows .	the customer who has n't walked through those schools would ever lose the windows .
this teacher that this doctor did talk about had n't ever seen this dentist .	this teacher that this doctor did n't talk about had ever seen this dentist .
this dancer that that girl can talk about had n't ever learned .	this dancer that that girl can n't talk about had ever learned .
the guys that have seen those doors had n't ever remembered this driver .	the guys that have n't seen those doors had ever remembered this driver .
the man who could talk about that shirt had n't ever won .	the man who could n't talk about that shirt had ever won .
those men who would cough had n't ever worked with the teachers .	those men who would n't cough had ever worked with the teachers .
the queen that can eat would n't ever eat .	the queen that can n't eat would ever eat .
the dancer who that dancer has talked about can n't ever drive to the kitchen .	the dancer who that dancer has n't talked about can ever drive to the kitchen .
this guy who has painted could n't ever fix this mirror .	this guy who has n't painted could ever fix this mirror .
that lady who did hear this woman did n't ever cry .	that lady who did n't hear this woman did ever cry .
this crayon that that person had talked about does n't ever break these dolls .	this crayon that that person had n't talked about does ever break these dolls .
these men who have held those spoons would n't ever look like the dancer .	these men who have n't held those spoons would ever look like the dancer .
those shirts that could roll away can n't ever drop .	those shirts that could n't roll away can ever drop .
the guys who had gone to the restaurant do n't ever sell those bags .	the guys who had n't gone to the restaurant do ever sell those bags .
the doctor who would talk about the crayons had n't ever confused the doctors .	the doctor who would n't talk about the crayons had ever confused the doctors .
those crayons that the turtles had remembered would n't ever move .	those crayons that the turtles had n't remembered would ever move .
the king who could throw that doll has n't ever talked .	the king who could n't throw that doll has ever talked .
this man who had seen those turtles would n't ever hold the door .	this man who had n't seen those turtles would ever hold the door .
the child that the girl had heard does n't ever see that customer .	the child that the girl had n't heard does ever see that customer .
the doctors that could remember the chairs can n't ever like that window .	the doctors that could n't remember the chairs can ever like that window .
the birds that those ladies did know should n't ever learn .	the birds that those ladies did n't know should ever learn .
this dentist who has lost those chairs can n't ever throw this picture .	this dentist who has n't lost those chairs can ever throw this picture .
the girls who have painted could n't ever teach this driver .	the girls who have n't painted could ever teach this driver .
that boy who had heard this bird has n't ever confused this driver .	that boy who had n't heard this bird has ever confused this driver .
this dish that the man did like has n't ever dropped .	this dish that the man did n't like has ever dropped .
the chairs that had moved could n't ever break .	the chairs that had n't moved could ever break .
this woman who had talked about those toys does n't ever throw the car .	this woman who had n't talked about those toys does ever throw the car .
that queen that had run did n't ever notice this button .	that queen that had n't run did ever notice this button .
those guys who these boys do hear did n't ever take that plate .	those guys who these boys do n't hear did ever take that plate .
the king that has remembered these teachers had n't ever remembered these doctors .	the king that has n't remembered these teachers had ever remembered these doctors .
this lady who did hate those dogs has n't ever passed these schools .	this lady who did n't hate those dogs has ever passed these schools .
the children that should run did n't ever think about those mice .	the children that should n't run did ever think about those mice .
the box that this rabbit does hate does n't ever break .	the box that this rabbit does n't hate does ever break .
that customer who does run around this park has n't ever lost .	that customer who does n't run around this park has ever lost .
this girl who this man has heard can n't ever worry the women .	this girl who this man has n't heard can ever worry the women .
this king who should see the driver should n't ever yell .	this king who should n't see the driver should ever yell .
that boy who has brought that door could n't ever win .	that boy who has n't brought that door could ever win .
the glass that this child can talk about has n't ever rolled away .	the glass that this child can n't talk about has ever rolled away .
this snake that had run has n't ever learned .	this snake that had n't run has ever learned .
the person who this teacher had talked about has n't ever lost those children .	the person who this teacher had n't talked about has ever lost those children .
these people who the guys do sound like could n't ever clean the boxes .	these people who the guys do n't sound like could ever clean the boxes .
that snake that this king would sound like has n't ever noticed these chairs .	that snake that this king would n't sound like has ever noticed these chairs .
those cats that can grow can n't ever hate those boats .	those cats that can n't grow can ever hate those boats .
the guy that had remembered those rabbits had n't ever seen the couch .	the guy that had n't remembered those rabbits had ever seen the couch .
this woman who had heard that mouse can n't ever praise these girls .	this woman who had n't heard that mouse can ever praise these girls .
that guy who should talk about the bag has n't ever cleaned these cars .	that guy who should n't talk about the bag has ever cleaned these cars .
this doctor who did see those people does n't ever lose .	this doctor who did n't see those people does ever lose .
the customer that that lady had talked about would n't ever forget the person .	the customer that that lady had n't talked about would ever forget the person .
those people who have cleaned that book would n't ever sing .	those people who have n't cleaned that book would ever sing .
that teacher that the dentist has talked about has n't ever grown .	that teacher that the dentist has n't talked about has ever grown .
these dogs that would learn did n't ever eat .	these dogs that would n't learn did ever eat .
the teacher who should take this plane had n't ever talked about those plates .	the teacher who should n't take this plane had ever talked about those plates .
that bicycle that this queen should remember has n't ever broken these books .	that bicycle that this queen should n't remember has ever broken these books .
these people that have heard this driver did n't ever notice that cat .	these people that have n't heard this driver did ever notice that cat .
that rabbit that that adult would hear had n't ever eaten .	that rabbit that that adult would n't hear had ever eaten .
the woman who does yell can n't ever know this guy .	the woman who does n't yell can ever know this guy .
that lady who had seen the spoon had n't ever answered these boys .	that lady who had n't seen the spoon had ever answered these boys .
the car that this horse would remember could n't ever break that mirror .	the car that this horse would n't remember could ever break that mirror .
that couch that has broken should n't ever roll away .	that couch that has n't broken should ever roll away .
this customer who that dentist had talked about has n't ever bothered the teacher .	this customer who that dentist had n't talked about has ever bothered the teacher .
that ring that the driver should remember should n't ever move .	that ring that the driver should n't remember should ever move .
that king who did paint can n't ever answer that girl .	that king who did n't paint can ever answer that girl .
that lady who has thought about those dogs would n't ever lift the bottles .	that lady who has n't thought about those dogs would ever lift the bottles .
the girls that do know those men should n't ever love the bags .	the girls that do n't know those men should ever love the bags .
this teacher who should think about this candle has n't ever painted .	this teacher who should n't think about this candle has ever painted .
these men who should see these horses have n't ever lost .	these men who should n't see these horses have ever lost .
this lady who had thrown the trucks has n't ever kept that book .	this lady who had n't thrown the trucks has ever kept that book .
that mouse that should hate those windows could n't ever learn .	that mouse that should n't hate those windows could ever learn .
these pictures that these guys have seen have n't ever broken .	these pictures that these guys have n't seen have ever broken .
this queen that should look like that dog has n't ever grown .	this queen that should n't look like that dog has ever grown .
that dentist that the dentist does talk about would n't ever break the book .	that dentist that the dentist does n't talk about would ever break the book .
this adult who has laughed had n't ever talked about that boat .	this adult who has n't laughed had ever talked about that boat .
that customer who does lie has n't ever lost .	that customer who does n't lie has ever lost .
that guy who had talked about this rocket can n't ever shake that car .	that guy who had n't talked about this rocket can ever shake that car .
the teachers who can hate this lady did n't ever work with the children .	the teachers who can n't hate this lady did ever work with the children .
that customer who could cry has n't ever walked through the schools .	that customer who could n't cry has ever walked through the schools .
that woman who had thought about the dancer can n't ever win .	that woman who had n't thought about the dancer can ever win .
this customer who has remembered that bottle had n't ever painted .	this customer who has n't remembered that bottle had ever painted .
this driver who had thought about this customer has n't ever made that book .	this driver who had n't thought about this customer has ever made that book .
this woman who should talk about the mirror had n't ever gone to the kitchen .	this woman who should n't talk about the mirror had ever gone to the kitchen .
the dentist that had run had n't ever eaten .	the dentist that had n't run had ever eaten .
the rabbit that had seen this box had n't ever noticed the hats .	the rabbit that had n't seen this box had ever noticed the hats .
these women who had walked through this room had n't ever visited this boy .	these women who had n't walked through this room had ever visited this boy .
that teacher who can go to those schools would n't ever drop those doors .	that teacher who can n't go to those schools would ever drop those doors .
the candles that the doctors had seen had n't ever broken .	the candles that the doctors had n't seen had ever broken .
the doctor who can talk about the rug can n't ever worry those men .	the doctor who can n't talk about the rug can ever worry those men .
these teachers who would look like the snakes have n't ever painted .	these teachers who would n't look like the snakes have ever painted .
this driver who has seen the child has n't ever heard this guy .	this driver who has n't seen the child has ever heard this guy .
this mirror that should move could n't ever move .	this mirror that should n't move could ever move .
these people who did shake those trucks have n't ever scared the driver .	these people who did n't shake those trucks have ever scared the driver .
this window that the man has kept would n't ever roll away .	this window that the man has n't kept would ever roll away .
the dancer who has bought that doll did n't ever scare the boy .	the dancer who has n't bought that doll did ever scare the boy .
that girl who had noticed the ship should n't ever buy the doors .	that girl who had n't noticed the ship should ever buy the doors .
this dentist that did notice these birds should n't ever love those forks .	this dentist that did n't notice these birds should ever love those forks .
that dentist who had noticed the children did n't ever praise this adult .	that dentist who had n't noticed the children did ever praise this adult .
the teachers who have lost the shirt would n't ever keep these shoes .	the teachers who have n't lost the shirt would ever keep these shoes .
these chairs that the boys should like have n't ever broken those bags .	these chairs that the boys should n't like have ever broken those bags .
the ship that the customer can remember has n't ever moved .	the ship that the customer can n't remember has ever moved .
