has n't that adult visited the teacher ?	have n't that adult visited the teacher ?
do the children fix the forks ?	does the children fix the forks ?
does n't that king cry ?	do n't that king cry ?
does n't this adult cry ?	do n't this adult cry ?
are n't these men working with this person ?	is n't these men working with this person ?
do these boys care for the men ?	does these boys care for the men ?
have n't these shirts rolled away ?	has n't these shirts rolled away ?
has the rocket moved ?	have the rocket moved ?
does n't the dancer take these bags ?	do n't the dancer take these bags ?
does n't this doctor smile ?	do n't this doctor smile ?
has that woman helped that queen ?	have that woman helped that queen ?
is the person listening to these ladies ?	are the person listening to these ladies ?
do n't the children praise the queen ?	does n't the children praise the queen ?
is the man shaking these bags ?	are the man shaking these bags ?
was this lady lying ?	were this lady lying ?
does that king scare this patient ?	do that king scare this patient ?
does that lady understand these boys ?	do that lady understand these boys ?
do the cars break that door ?	does the cars break that door ?
are n't the cars breaking those crayons ?	is n't the cars breaking those crayons ?
was this lady bringing those cups ?	were this lady bringing those cups ?
were n't those doors moving ?	was n't those doors moving ?
have n't these cats thought about the ship ?	has n't these cats thought about the ship ?
was that boy dropping that chair ?	were that boy dropping that chair ?
do n't the birds eat ?	does n't the birds eat ?
is n't the mouse thinking about that teacher ?	are n't the mouse thinking about that teacher ?
have those plates broken the fork ?	has those plates broken the fork ?
do these children notice that driver ?	does these children notice that driver ?
does this woman drop that shirt ?	do this woman drop that shirt ?
has this person laughed ?	have this person laughed ?
is this bag dropping ?	are this bag dropping ?
has the queen won ?	have the queen won ?
were those girls buying these cars ?	was those girls buying these cars ?
do n't these people shake this box ?	does n't these people shake this box ?
has this dancer noticed the couch ?	have this dancer noticed the couch ?
does this guy drive to the bank ?	do this guy drive to the bank ?
were n't the people driving to the school ?	was n't the people driving to the school ?
have those books broken that spoon ?	has those books broken that spoon ?
were n't those doors dropping ?	was n't those doors dropping ?
are the women running ?	is the women running ?
do n't the horses break the trucks ?	does n't the horses break the trucks ?
does the glass roll away ?	do the glass roll away ?
has n't that king brought that plane ?	have n't that king brought that plane ?
have n't these books rolled away ?	has n't these books rolled away ?
does that dentist think about the chairs ?	do that dentist think about the chairs ?
were those girls holding the dishes ?	was those girls holding the dishes ?
does that man notice this dancer ?	do that man notice this dancer ?
do n't these guys hate that boat ?	does n't these guys hate that boat ?
do those candles roll away ?	does those candles roll away ?
has the dentist heard this dog ?	have the dentist heard this dog ?
has this lady left that bank ?	have this lady left that bank ?
were n't these men bothering that person ?	was n't these men bothering that person ?
has n't that customer brought these glasses ?	have n't that customer brought these glasses ?
do n't the women exercise ?	does n't the women exercise ?
was n't this box breaking those dishes ?	were n't this box breaking those dishes ?
does the doctor move the shirt ?	do the doctor move the shirt ?
do n't those bottles break ?	does n't those bottles break ?
has n't the hamster eaten ?	have n't the hamster eaten ?
is this child laughing ?	are this child laughing ?
are the doctors finding the toy ?	is the doctors finding the toy ?
does this driver know these people ?	do this driver know these people ?
was the customer talking to this girl ?	were the customer talking to this girl ?
were n't the guys waving ?	was n't the guys waving ?
has this guy bothered these women ?	have this guy bothered these women ?
has n't this bird run ?	have n't this bird run ?
does n't this customer make these chairs ?	do n't this customer make these chairs ?
do n't the men keep those toys ?	does n't the men keep those toys ?
have n't the people broken the bowl ?	has n't the people broken the bowl ?
has the dog broken those forks ?	have the dog broken those forks ?
is that dentist yelling ?	are that dentist yelling ?
has n't that plane moved ?	have n't that plane moved ?
has n't this boat moved ?	have n't this boat moved ?
has that rug dropped ?	have that rug dropped ?
has the plane rolled away ?	have the plane rolled away ?
was that plane dropping ?	were that plane dropping ?
have n't these girls thrown this button ?	has n't these girls thrown this button ?
has that dancer talked about that girl ?	have that dancer talked about that girl ?
has n't that boy taken this plane ?	have n't that boy taken this plane ?
were those cats thinking about this bowl ?	was those cats thinking about this bowl ?
does n't this lady sneeze ?	do n't this lady sneeze ?
do n't the people drive to the museum ?	does n't the people drive to the museum ?
does the turtle hate those girls ?	do the turtle hate those girls ?
have n't these boys lost the book ?	has n't these boys lost the book ?
does n't the girl lie ?	do n't the girl lie ?
do these guys read ?	does these guys read ?
do n't those books break the forks ?	does n't those books break the forks ?
has n't that dancer fixed the windows ?	have n't that dancer fixed the windows ?
do n't these chairs roll away ?	does n't these chairs roll away ?
do the windows move ?	does the windows move ?
is n't the dentist running ?	are n't the dentist running ?
have these children thrown the crayon ?	has these children thrown the crayon ?
have n't these teachers read ?	has n't these teachers read ?
is the teacher laughing ?	are the teacher laughing ?
were those chairs breaking ?	was those chairs breaking ?
have these doctors left the rooms ?	has these doctors left the rooms ?
are n't the snakes eating ?	is n't the snakes eating ?
does this boat break the bowl ?	do this boat break the bowl ?
were the pictures breaking that book ?	was the pictures breaking that book ?
do those people know this patient ?	does those people know this patient ?
do n't those ladies go to those schools ?	does n't those ladies go to those schools ?
has n't that picture broken those hats ?	have n't that picture broken those hats ?
does n't that customer wave ?	do n't that customer wave ?
were n't the ladies losing ?	was n't the ladies losing ?
is that teacher listening to the child ?	are that teacher listening to the child ?
was n't this dentist running ?	were n't this dentist running ?
have n't the dogs noticed that cup ?	has n't the dogs noticed that cup ?
does n't this bird forget this rocket ?	do n't this bird forget this rocket ?
has n't that customer left this kitchen ?	have n't that customer left this kitchen ?
is n't this person running ?	are n't this person running ?
does that girl answer this person ?	do that girl answer this person ?
is n't the queen thinking about those boys ?	are n't the queen thinking about those boys ?
is n't that ship dropping ?	are n't that ship dropping ?
does n't that dancer bother this woman ?	do n't that dancer bother this woman ?
is that toy breaking these pictures ?	are that toy breaking these pictures ?
were the guys talking about the birds ?	was the guys talking about the birds ?
has n't the bag moved ?	have n't the bag moved ?
does this book break ?	do this book break ?
have n't these teachers broken the crayons ?	has n't these teachers broken the crayons ?
were these snakes running ?	was these snakes running ?
does n't the boy break the candles ?	do n't the boy break the candles ?
does n't the guy cry ?	do n't the guy cry ?
does n't this dentist throw the shirt ?	do n't this dentist throw the shirt ?
have those children read ?	has those children read ?
does this hat drop ?	do this hat drop ?
have these plates broken these pictures ?	has these plates broken these pictures ?
is n't the chair dropping ?	are n't the chair dropping ?
does n't that patient run around this library ?	do n't that patient run around this library ?
were n't those windows rolling away ?	was n't those windows rolling away ?
does n't that rabbit love that book ?	do n't that rabbit love that book ?
does this bird love these windows ?	do this bird love these windows ?
was that bag breaking these hats ?	were that bag breaking these hats ?
has the driver talked about these teachers ?	have the driver talked about these teachers ?
is n't the woman buying this box ?	are n't the woman buying this box ?
do those boxes break these dolls ?	does those boxes break these dolls ?
have those girls run ?	has those girls run ?
is n't that dish rolling away ?	are n't that dish rolling away ?
do n't these ladies grow ?	does n't these ladies grow ?
does the man grow ?	do the man grow ?
is n't this woman growing ?	are n't this woman growing ?
is n't the customer cleaning the bottles ?	are n't the customer cleaning the bottles ?
has n't this king won ?	have n't this king won ?
were n't those boys reading ?	was n't those boys reading ?
are n't the guys eating ?	is n't the guys eating ?
does that child hear the horses ?	do that child hear the horses ?
does that child sing ?	do that child sing ?
was the woman holding the door ?	were the woman holding the door ?
does the plane break the couch ?	do the plane break the couch ?
were n't these children dropping the bags ?	was n't these children dropping the bags ?
are n't those birds growing ?	is n't those birds growing ?
were the doctors visiting the driver ?	was the doctors visiting the driver ?
are n't the women fixing the rug ?	is n't the women fixing the rug ?
was that crayon breaking this bed ?	were that crayon breaking this bed ?
do these bags break the toys ?	does these bags break the toys ?
have n't those doctors read ?	has n't those doctors read ?
has this queen learned ?	have this queen learned ?
does n't that teacher learn ?	do n't that teacher learn ?
do those doctors run ?	does those doctors run ?
is n't that teacher bringing the shoes ?	are n't that teacher bringing the shoes ?
was the man talking about these bottles ?	were the man talking about these bottles ?
has that doctor lost these bags ?	have that doctor lost these bags ?
do those buttons break those cars ?	does those buttons break those cars ?
does n't that teacher buy the ship ?	do n't that teacher buy the ship ?
has n't this queen lost ?	have n't this queen lost ?
does n't this dish break these rings ?	do n't this dish break these rings ?
have those boys bought the bags ?	has those boys bought the bags ?
have n't these men heard the snakes ?	has n't these men heard the snakes ?
is that customer running ?	are that customer running ?
has n't the book broken ?	have n't the book broken ?
does n't the lady find this glass ?	do n't the lady find this glass ?
was n't the girl holding the rocket ?	were n't the girl holding the rocket ?
do these boys fix the car ?	does these boys fix the car ?
has n't that boy brought this spoon ?	have n't that boy brought this spoon ?
does that adult go to those schools ?	do that adult go to those schools ?
has the doctor kept those chairs ?	have the doctor kept those chairs ?
do n't those birds break the dolls ?	does n't those birds break the dolls ?
is the cup moving ?	are the cup moving ?
have n't the guys found this queen ?	has n't the guys found this queen ?
does n't that cup break those shoes ?	do n't that cup break those shoes ?
does n't the queen lift this rocket ?	do n't the queen lift this rocket ?
does n't the person eat ?	do n't the person eat ?
has that car broken ?	have that car broken ?
are n't the doctors losing ?	is n't the doctors losing ?
does this bottle roll away ?	do this bottle roll away ?
are n't these boys visiting the doctor ?	is n't these boys visiting the doctor ?
does n't the dentist grow ?	do n't the dentist grow ?
have these children left that hospital ?	has these children left that hospital ?
is that patient learning ?	are that patient learning ?
do these guys lose the bags ?	does these guys lose the bags ?
do n't these women find that shoe ?	does n't these women find that shoe ?
was that boy listening to this dancer ?	were that boy listening to this dancer ?
has n't this doll broken ?	have n't this doll broken ?
were n't these ladies cleaning these bowls ?	was n't these ladies cleaning these bowls ?
does that lady cough ?	do that lady cough ?
was n't that woman breaking this dish ?	were n't that woman breaking this dish ?
have n't these children painted ?	has n't these children painted ?
do the books drop ?	does the books drop ?
is n't this dentist buying these buttons ?	are n't this dentist buying these buttons ?
does n't the adult look like the teachers ?	do n't the adult look like the teachers ?
was n't that ring breaking that toy ?	were n't that ring breaking that toy ?
are n't these turtles running ?	is n't these turtles running ?
does that book drop ?	do that book drop ?
have n't those boys dropped this rocket ?	has n't those boys dropped this rocket ?
has the woman thought about the bottles ?	have the woman thought about the bottles ?
has n't this patient run ?	have n't this patient run ?
has n't the boy found this lady ?	have n't the boy found this lady ?
is n't the bed moving ?	are n't the bed moving ?
does n't this doctor break this book ?	do n't this doctor break this book ?
is this driver throwing the bag ?	are this driver throwing the bag ?
do n't these men stretch ?	does n't these men stretch ?
do those ladies cough ?	does those ladies cough ?
were these ladies walking through this restaurant ?	was these ladies walking through this restaurant ?
has the cat seen that horse ?	have the cat seen that horse ?
has the lady brought this glass ?	have the lady brought this glass ?
has n't the girl broken these candles ?	have n't the girl broken these candles ?
has this man walked through that museum ?	have this man walked through that museum ?
has that child broken that truck ?	have that child broken that truck ?
does the mouse forget those snakes ?	do the mouse forget those snakes ?
is n't this customer lying ?	are n't this customer lying ?
was this person practicing ?	were this person practicing ?
are these girls bringing these cups ?	is these girls bringing these cups ?
is n't this hamster breaking that bowl ?	are n't this hamster breaking that bowl ?
was n't the king making those rings ?	were n't the king making those rings ?
do n't those pictures break this chair ?	does n't those pictures break this chair ?
has n't this customer learned ?	have n't this customer learned ?
does that king move this mirror ?	do that king move this mirror ?
does the king cry ?	do the king cry ?
is this lady thinking about this boat ?	are this lady thinking about this boat ?
have those men lost this truck ?	has those men lost this truck ?
has that doctor heard those ladies ?	have that doctor heard those ladies ?
has n't that driver dropped the cars ?	have n't that driver dropped the cars ?
was this boy learning ?	were this boy learning ?
do n't those teachers steal the hat ?	does n't those teachers steal the hat ?
has this doctor learned ?	have this doctor learned ?
has the bird noticed the plane ?	have the bird noticed the plane ?
does n't the boy find this ship ?	do n't the boy find this ship ?
is n't that dentist holding that dish ?	are n't that dentist holding that dish ?
is n't the man waving ?	are n't the man waving ?
do those boys go to this museum ?	does those boys go to this museum ?
does the dentist help this girl ?	do the dentist help this girl ?
do n't these ladies laugh ?	does n't these ladies laugh ?
does n't this person talk ?	do n't this person talk ?
were those girls thinking about the spoons ?	was those girls thinking about the spoons ?
have n't those boxes rolled away ?	has n't those boxes rolled away ?
were n't these boys teaching that man ?	was n't these boys teaching that man ?
is that turtle breaking the car ?	are that turtle breaking the car ?
do n't those doctors win ?	does n't those doctors win ?
does n't this guy answer the guy ?	do n't this guy answer the guy ?
was n't this cat thinking about that book ?	were n't this cat thinking about that book ?
has the ship broken this dish ?	have the ship broken this dish ?
was that car breaking ?	were that car breaking ?
is this queen eating ?	are this queen eating ?
were n't those dogs eating ?	was n't those dogs eating ?
have the teachers worried that teacher ?	has the teachers worried that teacher ?
is the person shaking this hat ?	are the person shaking this hat ?
do n't the men worry the teachers ?	does n't the men worry the teachers ?
does this person remember these candles ?	do this person remember these candles ?
does the child read ?	do the child read ?
does n't the girl yell ?	do n't the girl yell ?
have n't these doctors held that shirt ?	has n't these doctors held that shirt ?
is the dancer eating ?	are the dancer eating ?
have n't those rabbits broken these windows ?	has n't those rabbits broken these windows ?
does n't the teacher worry that dentist ?	do n't the teacher worry that dentist ?
has that teacher broken these windows ?	have that teacher broken these windows ?
was that rocket dropping ?	were that rocket dropping ?
has this guy noticed this crayon ?	have this guy noticed this crayon ?
has n't that girl held those books ?	have n't that girl held those books ?
has that patient worried those teachers ?	have that patient worried those teachers ?
does the woman leave that kitchen ?	do the woman leave that kitchen ?
have those men remembered those doors ?	has those men remembered those doors ?
was this child losing the boat ?	were this child losing the boat ?
were those boxes breaking ?	was those boxes breaking ?
do n't the birds grow ?	does n't the birds grow ?
does that lady visit the doctors ?	do that lady visit the doctors ?
were n't those horses eating ?	was n't those horses eating ?
was n't this driver reading ?	were n't this driver reading ?
does this horse think about those cups ?	do this horse think about those cups ?
do the horses break these forks ?	does the horses break these forks ?
is n't that teacher eating ?	are n't that teacher eating ?
does the crayon move ?	do the crayon move ?
are the ladies crying ?	is the ladies crying ?
was n't this customer buying the glass ?	were n't this customer buying the glass ?
has n't that patient talked ?	have n't that patient talked ?
do those guys practice ?	does those guys practice ?
does this customer wave ?	do this customer wave ?
does that man bring that spoon ?	do that man bring that spoon ?
do n't those men fix those buttons ?	does n't those men fix those buttons ?
do n't these ladies stretch ?	does n't these ladies stretch ?
do n't these people appreciate the woman ?	does n't these people appreciate the woman ?
does this patient love that guy ?	do this patient love that guy ?
do n't those girls wave ?	does n't those girls wave ?
do the shirts roll away ?	does the shirts roll away ?
has n't this driver worked with the patient ?	have n't this driver worked with the patient ?
are these teachers losing the dishes ?	is these teachers losing the dishes ?
does that patient lose ?	do that patient lose ?
has n't that girl moved this door ?	have n't that girl moved this door ?
were n't these chairs dropping ?	was n't these chairs dropping ?
does this person hate the plane ?	do this person hate the plane ?
were the rabbits running ?	was the rabbits running ?
has n't that king run around the mall ?	have n't that king run around the mall ?
is this boy finding the couch ?	are this boy finding the couch ?
do n't these doctors eat ?	does n't these doctors eat ?
do n't those boys run ?	does n't those boys run ?
was the bed breaking those candles ?	were the bed breaking those candles ?
do the toys roll away ?	does the toys roll away ?
is n't this teacher breaking the box ?	are n't this teacher breaking the box ?
does that cup break this spoon ?	do that cup break this spoon ?
do those boys help the boy ?	does those boys help the boy ?
was that dentist screaming ?	were that dentist screaming ?
does that customer have this dish ?	do that customer have this dish ?
are these shoes breaking the chairs ?	is these shoes breaking the chairs ?
are n't those dolls breaking that spoon ?	is n't those dolls breaking that spoon ?
does n't the man leave that school ?	do n't the man leave that school ?
does that child return to the schools ?	do that child return to the schools ?
was the cat learning ?	were the cat learning ?
has that doctor thrown the hat ?	have that doctor thrown the hat ?
has the book rolled away ?	have the book rolled away ?
does n't the boy eat ?	do n't the boy eat ?
are those crayons moving ?	is those crayons moving ?
have the teachers cleaned this bicycle ?	has the teachers cleaned this bicycle ?
has that doctor confused the boys ?	have that doctor confused the boys ?
does the picture break ?	do the picture break ?
were these doctors cleaning this car ?	was these doctors cleaning this car ?
does n't that guy lose this shirt ?	do n't that guy lose this shirt ?
do the women hate those teachers ?	does the women hate those teachers ?
has that plane rolled away ?	have that plane rolled away ?
does n't that doctor win ?	do n't that doctor win ?
does this doctor yell ?	do this doctor yell ?
are these ladies smiling ?	is these ladies smiling ?
has n't this doctor scared these men ?	have n't this doctor scared these men ?
were these forks breaking that chair ?	was these forks breaking that chair ?
do these horses notice the child ?	does these horses notice the child ?
is this rocket rolling away ?	are this rocket rolling away ?
has n't that lady lost ?	have n't that lady lost ?
has the lady won ?	have the lady won ?
does this lady teach the people ?	do this lady teach the people ?
does the lady leave this restaurant ?	do the lady leave this restaurant ?
were these men crying ?	was these men crying ?
were these hats breaking the shirts ?	was these hats breaking the shirts ?
are these mice breaking these glasses ?	is these mice breaking these glasses ?
were these bowls rolling away ?	was these bowls rolling away ?
do n't the candles roll away ?	does n't the candles roll away ?
has the man cried ?	have the man cried ?
do these guys bother that woman ?	does these guys bother that woman ?
was n't that rocket dropping ?	were n't that rocket dropping ?
have these men run around the rooms ?	has these men run around the rooms ?
has n't the patient answered these girls ?	have n't the patient answered these girls ?
has this customer broken this glass ?	have this customer broken this glass ?
does n't the girl throw the car ?	do n't the girl throw the car ?
have those children eaten ?	has those children eaten ?
does n't that dancer buy the bicycle ?	do n't that dancer buy the bicycle ?
was n't that adult leaving that museum ?	were n't that adult leaving that museum ?
does n't the adult pass that room ?	do n't the adult pass that room ?
was the lady breaking this ship ?	were the lady breaking this ship ?
is n't this lady helping these guys ?	are n't this lady helping these guys ?
was the king running around this school ?	were the king running around this school ?
are n't the doctors visiting those women ?	is n't the doctors visiting those women ?
does n't the rabbit notice that king ?	do n't the rabbit notice that king ?
has the dish rolled away ?	have the dish rolled away ?
has this child thrown this shoe ?	have this child thrown this shoe ?
is n't that couch dropping ?	are n't that couch dropping ?
have n't these ladies gone to this restaurant ?	has n't these ladies gone to this restaurant ?
has n't this woman remembered those snakes ?	have n't this woman remembered those snakes ?
is n't this plane breaking ?	are n't this plane breaking ?
is that truck moving ?	are that truck moving ?
does the child learn ?	do the child learn ?
does the woman paint ?	do the woman paint ?
does that dancer keep this bowl ?	do that dancer keep this bowl ?
was n't this dog growing ?	were n't this dog growing ?
has n't the teacher bothered these men ?	have n't the teacher bothered these men ?
does that horse grow ?	do that horse grow ?
were n't those ladies holding those books ?	was n't those ladies holding those books ?
does n't the cat learn ?	do n't the cat learn ?
does that queen think about those dolls ?	do that queen think about those dolls ?
has this button broken this ship ?	have this button broken this ship ?
has n't the dentist learned ?	have n't the dentist learned ?
does that king whisper ?	do that king whisper ?
has n't this driver grown ?	have n't this driver grown ?
have these shirts dropped ?	has these shirts dropped ?
was the mouse breaking these bottles ?	were the mouse breaking these bottles ?
has n't this dentist taken the shoe ?	have n't this dentist taken the shoe ?
do n't the men sneeze ?	does n't the men sneeze ?
was the boy smiling ?	were the boy smiling ?
has n't the candle dropped ?	have n't the candle dropped ?
has that woman heard the rabbits ?	have that woman heard the rabbits ?
were n't those men talking to those children ?	was n't those men talking to those children ?
has that girl worried those children ?	have that girl worried those children ?
does n't the child talk ?	do n't the child talk ?
has n't the boy remembered these cars ?	have n't the boy remembered these cars ?
does n't the lady steal the window ?	do n't the lady steal the window ?
do n't these turtles break that door ?	does n't these turtles break that door ?
