were these chairs moving ?	was these chairs moving ?
do those men sing ?	does those men sing ?
does this child grow ?	do this child grow ?
were n't the books dropping ?	was n't the books dropping ?
is this dentist going to that room ?	are this dentist going to that room ?
does this dancer answer this woman ?	do this dancer answer this woman ?
does this ring roll away ?	do this ring roll away ?
was this person buying these trucks ?	were this person buying these trucks ?
has that ring moved ?	have that ring moved ?
have the snakes eaten ?	has the snakes eaten ?
do n't the teachers leave those schools ?	does n't the teachers leave those schools ?
are those ladies losing these forks ?	is those ladies losing these forks ?
has n't the bird remembered those bowls ?	have n't the bird remembered those bowls ?
do n't the doctors smile ?	does n't the doctors smile ?
has n't this glass dropped ?	have n't this glass dropped ?
has n't this doctor found this teacher ?	have n't this doctor found this teacher ?
is that dog thinking about that dog ?	are that dog thinking about that dog ?
have n't those people helped those women ?	has n't those people helped those women ?
was n't the person laughing ?	were n't the person laughing ?
do these doctors leave the school ?	does these doctors leave the school ?
was this adult working with this child ?	were this adult working with this child ?
were the people shaking this hat ?	was the people shaking this hat ?
does n't the bird think about this button ?	do n't the bird think about this button ?
does that doctor have that fork ?	do that doctor have that fork ?
does n't this girl break the door ?	do n't this girl break the door ?
has n't the candle moved ?	have n't the candle moved ?
have those snakes grown ?	has those snakes grown ?
does n't this plane move ?	do n't this plane move ?
does n't that doctor sing ?	do n't that doctor sing ?
does this man steal these cars ?	do this man steal these cars ?
was n't this woman keeping that bowl ?	were n't this woman keeping that bowl ?
does that king look like that girl ?	do that king look like that girl ?
has this picture broken that glass ?	have this picture broken that glass ?
has n't this queen waved ?	have n't this queen waved ?
was n't the dentist singing ?	were n't the dentist singing ?
is n't this boy leaving that museum ?	are n't this boy leaving that museum ?
are n't those boys moving this car ?	is n't those boys moving this car ?
has n't that king won ?	have n't that king won ?
have these spoons broken those candles ?	has these spoons broken those candles ?
do those people find the crayons ?	does those people find the crayons ?
has the child yelled ?	have the child yelled ?
does n't the driver cry ?	do n't the driver cry ?
has the teacher lost the cars ?	have the teacher lost the cars ?
do n't those people sound like this patient ?	does n't those people sound like this patient ?
are n't these people cleaning this book ?	is n't these people cleaning this book ?
does n't that boy bring the couch ?	do n't that boy bring the couch ?
were n't the horses eating ?	was n't the horses eating ?
were n't those boats breaking ?	was n't those boats breaking ?
does the lady shake these buttons ?	do the lady shake these buttons ?
do these girls cry ?	does these girls cry ?
has this boy made that toy ?	have this boy made that toy ?
does n't the dog love this woman ?	do n't the dog love this woman ?
do those hats break the plane ?	does those hats break the plane ?
does n't the dentist sound like this dancer ?	do n't the dentist sound like this dancer ?
does n't this shoe move ?	do n't this shoe move ?
does n't that boy appreciate this customer ?	do n't that boy appreciate this customer ?
are the boys losing ?	is the boys losing ?
is this mirror moving ?	are this mirror moving ?
has n't the driver heard the doctors ?	have n't the driver heard the doctors ?
were those boys dropping the car ?	was those boys dropping the car ?
does the girl run around the rooms ?	do the girl run around the rooms ?
does n't this car roll away ?	do n't this car roll away ?
do n't these crayons roll away ?	does n't these crayons roll away ?
are these men thinking about these shoes ?	is these men thinking about these shoes ?
has the glass rolled away ?	have the glass rolled away ?
is the boy running ?	are the boy running ?
does this child smile ?	do this child smile ?
do n't those teachers sound like those teachers ?	does n't those teachers sound like those teachers ?
was the boy yelling ?	were the boy yelling ?
was the button breaking ?	were the button breaking ?
do those children throw that plate ?	does those children throw that plate ?
do n't these boys practice ?	does n't these boys practice ?
have the doctors thought about the snakes ?	has the doctors thought about the snakes ?
were those girls talking ?	was those girls talking ?
do n't the children talk about this toy ?	does n't the children talk about this toy ?
were these doors breaking that couch ?	was these doors breaking that couch ?
is n't the guy talking to this doctor ?	are n't the guy talking to this doctor ?
does this adult laugh ?	do this adult laugh ?
has n't the shoe dropped ?	have n't the shoe dropped ?
does this plane move ?	do this plane move ?
do the horses forget the ship ?	does the horses forget the ship ?
has n't that woman heard the lady ?	have n't that woman heard the lady ?
do n't those snakes notice that man ?	does n't those snakes notice that man ?
have those children painted ?	has those children painted ?
does n't this patient worry that boy ?	do n't this patient worry that boy ?
are the cats thinking about those glasses ?	is the cats thinking about those glasses ?
does n't that dentist sound like these girls ?	do n't that dentist sound like these girls ?
do the guys talk ?	does the guys talk ?
does n't the lady know the teacher ?	do n't the lady know the teacher ?
does that dentist lose ?	do that dentist lose ?
does that woman think about the button ?	do that woman think about the button ?
was n't this woman talking to that guy ?	were n't this woman talking to that guy ?
is this teacher bothering the person ?	are this teacher bothering the person ?
is n't the bag dropping ?	are n't the bag dropping ?
does n't that person care for that driver ?	do n't that person care for that driver ?
has n't the hat broken that mirror ?	have n't the hat broken that mirror ?
has n't this lady moved the boat ?	have n't this lady moved the boat ?
has n't that customer run ?	have n't that customer run ?
has that crayon rolled away ?	have that crayon rolled away ?
do n't these guys practice ?	does n't these guys practice ?
is this bed breaking the shirt ?	are this bed breaking the shirt ?
do n't the people eat ?	does n't the people eat ?
do the children throw the plane ?	does the children throw the plane ?
has n't the man heard this boy ?	have n't the man heard this boy ?
does n't that teacher bother these guys ?	do n't that teacher bother these guys ?
is n't the dentist making those cars ?	are n't the dentist making those cars ?
are n't the buttons breaking the spoons ?	is n't the buttons breaking the spoons ?
has n't that snake thought about the dolls ?	have n't that snake thought about the dolls ?
has the patient confused this driver ?	have the patient confused this driver ?
does n't this boy talk to these men ?	do n't this boy talk to these men ?
does n't this adult return to that kitchen ?	do n't this adult return to that kitchen ?
do those women sing ?	does those women sing ?
does this cat eat ?	do this cat eat ?
do n't the boys visit the child ?	does n't the boys visit the child ?
is n't this woman reading ?	are n't this woman reading ?
was that king buying those crayons ?	were that king buying those crayons ?
is this bottle rolling away ?	are this bottle rolling away ?
was the adult fixing this mirror ?	were the adult fixing this mirror ?
are n't these teachers reading ?	is n't these teachers reading ?
has the king broken the dish ?	have the king broken the dish ?
does that truck roll away ?	do that truck roll away ?
have n't the books broken ?	has n't the books broken ?
does the book break ?	do the book break ?
does n't this queen bring the glass ?	do n't this queen bring the glass ?
does n't this girl steal these boxes ?	do n't this girl steal these boxes ?
does n't the adult run ?	do n't the adult run ?
was n't this child reading ?	were n't this child reading ?
has that cat eaten ?	have that cat eaten ?
has the woman helped the guys ?	have the woman helped the guys ?
has n't that guy run around the room ?	have n't that guy run around the room ?
does that fork break that doll ?	do that fork break that doll ?
is n't this doctor laughing ?	are n't this doctor laughing ?
was n't the lady reading ?	were n't the lady reading ?
does n't that dancer know this snake ?	do n't that dancer know this snake ?
have n't the dishes moved ?	has n't the dishes moved ?
has n't the car broken these crayons ?	have n't the car broken these crayons ?
have n't those people confused the boys ?	has n't those people confused the boys ?
does n't the bird think about that truck ?	do n't the bird think about that truck ?
have the chairs broken the book ?	has the chairs broken the book ?
was the patient running around those rooms ?	were the patient running around those rooms ?
have n't these people found the book ?	has n't these people found the book ?
has that dancer confused that guy ?	have that dancer confused that guy ?
has this doctor fixed this book ?	have this doctor fixed this book ?
does this window drop ?	do this window drop ?
has that adult remembered those cars ?	have that adult remembered those cars ?
do n't those men cough ?	does n't those men cough ?
does n't the teacher hate that person ?	do n't the teacher hate that person ?
has this dentist talked to this king ?	have this dentist talked to this king ?
was n't this box dropping ?	were n't this box dropping ?
has n't the person yelled ?	have n't the person yelled ?
was this boat breaking ?	were this boat breaking ?
were n't these women walking through those schools ?	was n't these women walking through those schools ?
does n't this queen listen to the driver ?	do n't this queen listen to the driver ?
was n't the book breaking those buttons ?	were n't the book breaking those buttons ?
does the child sing ?	do the child sing ?
does n't that girl fix those boats ?	do n't that girl fix those boats ?
was the girl fixing the boat ?	were the girl fixing the boat ?
have n't the doctors yelled ?	has n't the doctors yelled ?
have the people left that school ?	has the people left that school ?
is n't that rug breaking that window ?	are n't that rug breaking that window ?
does n't the rug drop ?	do n't the rug drop ?
were the doors dropping ?	was the doors dropping ?
does n't that woman move the glasses ?	do n't that woman move the glasses ?
was n't the dancer singing ?	were n't the dancer singing ?
have those dogs eaten ?	has those dogs eaten ?
do n't the people bring those spoons ?	does n't the people bring those spoons ?
does this plate roll away ?	do this plate roll away ?
has this cat grown ?	have this cat grown ?
has this guy thrown this truck ?	have this guy thrown this truck ?
has the patient worked with that lady ?	have the patient worked with that lady ?
has that guy won ?	have that guy won ?
are those trucks breaking that glass ?	is those trucks breaking that glass ?
has n't the turtle broken the candles ?	have n't the turtle broken the candles ?
does that bag drop ?	do that bag drop ?
were n't these boys running ?	was n't these boys running ?
are n't those shoes breaking this window ?	is n't those shoes breaking this window ?
does n't this patient exercise ?	do n't this patient exercise ?
does n't this driver bother these doctors ?	do n't this driver bother these doctors ?
has the teacher won ?	have the teacher won ?
does n't the girl take that door ?	do n't the girl take that door ?
do n't those spoons drop ?	does n't those spoons drop ?
is the customer keeping this bottle ?	are the customer keeping this bottle ?
do the teachers find these dishes ?	does the teachers find these dishes ?
does that adult find this plane ?	do that adult find this plane ?
is n't the patient making these hats ?	are n't the patient making these hats ?
have n't the toys dropped ?	has n't the toys dropped ?
do n't the candles move ?	does n't the candles move ?
were these boys making the boats ?	was these boys making the boats ?
has this picture rolled away ?	have this picture rolled away ?
was n't this shoe breaking ?	were n't this shoe breaking ?
do n't these rabbits grow ?	does n't these rabbits grow ?
does that queen drive to the rooms ?	do that queen drive to the rooms ?
has n't this guy yelled ?	have n't this guy yelled ?
has this driver held this doll ?	have this driver held this doll ?
has n't the king dropped those windows ?	have n't the king dropped those windows ?
does this person lose that shoe ?	do this person lose that shoe ?
is n't the guy thinking about that doll ?	are n't the guy thinking about that doll ?
do the teachers talk about the queen ?	does the teachers talk about the queen ?
are n't those glasses moving ?	is n't those glasses moving ?
is the child eating ?	are the child eating ?
have n't the doctors won ?	has n't the doctors won ?
do n't the boys cough ?	does n't the boys cough ?
are those hats moving ?	is those hats moving ?
were n't these guys cleaning those spoons ?	was n't these guys cleaning those spoons ?
were n't these girls dropping those forks ?	was n't these girls dropping those forks ?
does the fork drop ?	do the fork drop ?
was n't that book moving ?	were n't that book moving ?
were these boys fixing these shoes ?	was these boys fixing these shoes ?
has the man bought that hat ?	have the man bought that hat ?
does n't that patient exercise ?	do n't that patient exercise ?
has that chair rolled away ?	have that chair rolled away ?
does this patient like the cars ?	do this patient like the cars ?
were n't those women dropping that bag ?	was n't those women dropping that bag ?
does n't that driver drop those windows ?	do n't that driver drop those windows ?
does the patient walk through that bank ?	do the patient walk through that bank ?
do these women go to that museum ?	does these women go to that museum ?
is that hamster growing ?	are that hamster growing ?
do n't those bowls drop ?	does n't those bowls drop ?
does n't the woman think about the dancer ?	do n't the woman think about the dancer ?
have the ladies lost that glass ?	has the ladies lost that glass ?
do those turtles break the bowl ?	does those turtles break the bowl ?
does n't that patient hate the boats ?	do n't that patient hate the boats ?
have these women answered those teachers ?	has these women answered those teachers ?
