Allison says that my dad 's dentist 's boss 's teacher 's daughter 's daughter is happy .	Allison helps my dad 's dentist 's boss 's teacher 's daughter 's daughter is happy .
the person says that your wife 's mother 's mother 's wife 's brother 's boss is clever .	the person works with your wife 's mother 's mother 's wife 's brother 's boss is clever .
my doctor says that my grandmother 's husband 's dentist 's mother 's son 's friend is bored .	my doctor helps my grandmother 's husband 's dentist 's mother 's son 's friend is bored .
the dancer thinks that my grandmother 's father 's grandmother 's teacher 's dad 's dentist is young .	the dancer talks to my grandmother 's father 's grandmother 's teacher 's dad 's dentist is young .
the teacher knows that my mother 's wife 's daughter 's mother 's mom 's teacher is friendly .	the teacher talks to my mother 's wife 's daughter 's mother 's mom 's teacher is friendly .
April knows that my sister 's daughter 's doctor 's doctor 's mother 's grandmother is upset .	April scares my sister 's daughter 's doctor 's doctor 's mother 's grandmother is upset .
Steve says that your wife 's husband 's dad 's boss 's doctor 's doctor is quiet .	Steve scares your wife 's husband 's dad 's boss 's doctor 's doctor is quiet .
my cousin says that your son 's wife 's friend 's father 's doctor 's friend is strong .	my cousin helps your son 's wife 's friend 's father 's doctor 's friend is strong .
the teacher knows that my cousin 's mom 's dad 's cousin 's father 's mother is young .	the teacher talks to my cousin 's mom 's dad 's cousin 's father 's mother is young .
Anna knows that your son 's brother 's doctor 's sister 's boss 's son is smart .	Anna talks to your son 's brother 's doctor 's sister 's boss 's son is smart .
your teacher knows that your father 's mom 's mother 's grandmother 's mom 's cousin is confused .	your teacher helps your father 's mom 's mother 's grandmother 's mom 's cousin is confused .
your doctor knows that my son 's cousin 's mother 's friend 's wife 's friend is gentle .	your doctor works with my son 's cousin 's mother 's friend 's wife 's friend is gentle .
Todd knows that your friend 's mother 's sister 's wife 's wife 's friend is young .	Todd helps your friend 's mother 's sister 's wife 's wife 's friend is young .
my doctor knows that my husband 's wife 's wife 's daughter 's daughter 's mother is friendly .	my doctor helps my husband 's wife 's wife 's daughter 's daughter 's mother is friendly .
your boss says that my doctor 's dentist 's father 's daughter 's son 's father is quiet .	your boss helps my doctor 's dentist 's father 's daughter 's son 's father is quiet .
James knows that my doctor 's teacher 's son 's husband 's husband 's father is smart .	James talks to my doctor 's teacher 's son 's husband 's husband 's father is smart .
the child knows that my doctor 's boss 's sister 's wife 's father 's friend is bored .	the child scares my doctor 's boss 's sister 's wife 's father 's friend is bored .
my boss thinks that your grandmother 's boss 's dentist 's wife 's father 's daughter is excited .	my boss works with your grandmother 's boss 's dentist 's wife 's father 's daughter is excited .
the dentist says that my wife 's cousin 's doctor 's boss 's mom 's sister is lucky .	the dentist helps my wife 's cousin 's doctor 's boss 's mom 's sister is lucky .
Peter thinks that my boss 's father 's teacher 's wife 's sister 's mom is helpful .	Peter works with my boss 's father 's teacher 's wife 's sister 's mom is helpful .
Martin thinks that my husband 's father 's cousin 's sister 's mom 's sister is boring .	Martin talks to my husband 's father 's cousin 's sister 's mom 's sister is boring .
your boss says that your daughter 's mom 's mother 's wife 's friend 's friend is busy .	your boss talks to your daughter 's mom 's mother 's wife 's friend 's friend is busy .
Anne says that my friend 's mom 's son 's husband 's mother 's sister is sleepy .	Anne scares my friend 's mom 's son 's husband 's mother 's sister is sleepy .
the patient knows that your sister 's dentist 's mother 's teacher 's dad 's dad is quiet .	the patient talks to your sister 's dentist 's mother 's teacher 's dad 's dad is quiet .
Carl says that my dad 's daughter 's father 's mom 's sister 's doctor is hungry .	Carl scares my dad 's daughter 's father 's mom 's sister 's doctor is hungry .
Kevin says that my son 's dad 's friend 's boss 's boss 's wife is helpful .	Kevin scares my son 's dad 's friend 's boss 's boss 's wife is helpful .
my doctor thinks that my boss 's daughter 's doctor 's wife 's sister 's husband is surprised .	my doctor scares my boss 's daughter 's doctor 's wife 's sister 's husband is surprised .
your teacher thinks that my doctor 's dentist 's wife 's friend 's daughter 's dad is important .	your teacher helps my doctor 's dentist 's wife 's friend 's daughter 's dad is important .
the adult says that my wife 's doctor 's doctor 's father 's mother 's sister is tall .	the adult scares my wife 's doctor 's doctor 's father 's mother 's sister is tall .
the dentist thinks that my doctor 's sister 's dad 's husband 's boss 's mom is excited .	the dentist talks to my doctor 's sister 's dad 's husband 's boss 's mom is excited .
Jane says that your grandmother 's dad 's dentist 's boss 's husband 's mom is wrong .	Jane talks to your grandmother 's dad 's dentist 's boss 's husband 's mom is wrong .
the child says that your sister 's dad 's doctor 's son 's grandmother 's dentist is bored .	the child helps your sister 's dad 's doctor 's son 's grandmother 's dentist is bored .
the child thinks that your dad 's boss 's friend 's brother 's husband 's cousin is lucky .	the child works with your dad 's boss 's friend 's brother 's husband 's cousin is lucky .
Judy knows that my grandmother 's father 's wife 's cousin 's teacher 's cousin is friendly .	Judy helps my grandmother 's father 's wife 's cousin 's teacher 's cousin is friendly .
your boss knows that your grandmother 's boss 's dentist 's cousin 's mother 's friend is lucky .	your boss works with your grandmother 's boss 's dentist 's cousin 's mother 's friend is lucky .
the child thinks that your wife 's teacher 's mom 's friend 's sister 's doctor is lucky .	the child helps your wife 's teacher 's mom 's friend 's sister 's doctor is lucky .
the driver knows that my father 's doctor 's dentist 's sister 's mom 's sister is happy .	the driver scares my father 's doctor 's dentist 's sister 's mom 's sister is happy .
Adam thinks that your friend 's friend 's son 's cousin 's cousin 's wife is tall .	Adam helps your friend 's friend 's son 's cousin 's cousin 's wife is tall .
my teacher says that your friend 's dentist 's cousin 's friend 's son 's dentist is important .	my teacher scares your friend 's dentist 's cousin 's friend 's son 's dentist is important .
your doctor knows that my cousin 's son 's friend 's mother 's mother 's daughter is smart .	your doctor helps my cousin 's son 's friend 's mother 's mother 's daughter is smart .
the patient thinks that your brother 's teacher 's sister 's grandmother 's friend 's mother is strong .	the patient helps your brother 's teacher 's sister 's grandmother 's friend 's mother is strong .
Laurie says that my dentist 's boss 's daughter 's wife 's husband 's mother is bored .	Laurie works with my dentist 's boss 's daughter 's wife 's husband 's mother is bored .
Jessica says that your brother 's teacher 's teacher 's wife 's teacher 's wife is upset .	Jessica works with your brother 's teacher 's teacher 's wife 's teacher 's wife is upset .
Amy thinks that my dentist 's dad 's brother 's husband 's mother 's husband is busy .	Amy works with my dentist 's dad 's brother 's husband 's mother 's husband is busy .
the teacher says that your mother 's brother 's son 's cousin 's dentist 's wife is tall .	the teacher helps your mother 's brother 's son 's cousin 's dentist 's wife is tall .
my boss thinks that my son 's friend 's dad 's dentist 's dentist 's dad is confused .	my boss talks to my son 's friend 's dad 's dentist 's dentist 's dad is confused .
the dentist thinks that my boss 's sister 's doctor 's wife 's daughter 's brother is nice .	the dentist works with my boss 's sister 's doctor 's wife 's daughter 's brother is nice .
your cousin says that your husband 's dad 's mom 's teacher 's mom 's grandmother is smart .	your cousin scares your husband 's dad 's mom 's teacher 's mom 's grandmother is smart .
your teacher knows that my mom 's grandmother 's sister 's son 's son 's cousin is friendly .	your teacher talks to my mom 's grandmother 's sister 's son 's son 's cousin is friendly .
the child thinks that my wife 's doctor 's boss 's dentist 's son 's doctor is hungry .	the child talks to my wife 's doctor 's boss 's dentist 's son 's doctor is hungry .
the driver thinks that my cousin 's son 's daughter 's dentist 's mother 's dentist is gentle .	the driver works with my cousin 's son 's daughter 's dentist 's mother 's dentist is gentle .
my cousin knows that your sister 's teacher 's son 's father 's brother 's mother is strong .	my cousin scares your sister 's teacher 's son 's father 's brother 's mother is strong .
Aaron says that your sister 's cousin 's wife 's husband 's boss 's sister is kind .	Aaron talks to your sister 's cousin 's wife 's husband 's boss 's sister is kind .
my dentist says that my doctor 's sister 's mom 's son 's father 's brother is important .	my dentist works with my doctor 's sister 's mom 's son 's father 's brother is important .
the person thinks that your doctor 's father 's mom 's dad 's boss 's boss is hungry .	the person helps your doctor 's father 's mom 's dad 's boss 's boss is hungry .
the dancer knows that my teacher 's daughter 's daughter 's sister 's grandmother 's grandmother is friendly .	the dancer works with my teacher 's daughter 's daughter 's sister 's grandmother 's grandmother is friendly .
James thinks that your friend 's son 's father 's doctor 's grandmother 's grandmother is sleepy .	James scares your friend 's son 's father 's doctor 's grandmother 's grandmother is sleepy .
your teacher knows that my dentist 's dentist 's cousin 's grandmother 's mom 's sister is tired .	your teacher talks to my dentist 's dentist 's cousin 's grandmother 's mom 's sister is tired .
the customer says that your daughter 's grandmother 's husband 's dad 's brother 's sister is strong .	the customer works with your daughter 's grandmother 's husband 's dad 's brother 's sister is strong .
your dentist thinks that my mom 's doctor 's wife 's doctor 's dad 's husband is young .	your dentist helps my mom 's doctor 's wife 's doctor 's dad 's husband is young .
the child knows that your dentist 's dad 's doctor 's wife 's grandmother 's mother is happy .	the child works with your dentist 's dad 's doctor 's wife 's grandmother 's mother is happy .
Susan thinks that my friend 's friend 's mother 's doctor 's daughter 's wife is kind .	Susan works with my friend 's friend 's mother 's doctor 's daughter 's wife is kind .
my dentist thinks that your daughter 's brother 's mom 's friend 's wife 's father is surprised .	my dentist talks to your daughter 's brother 's mom 's friend 's wife 's father is surprised .
the patient says that my doctor 's mom 's daughter 's father 's brother 's father is gentle .	the patient talks to my doctor 's mom 's daughter 's father 's brother 's father is gentle .
my teacher thinks that my mother 's father 's teacher 's wife 's boss 's teacher is lucky .	my teacher talks to my mother 's father 's teacher 's wife 's boss 's teacher is lucky .
my cousin knows that your boss 's teacher 's father 's cousin 's grandmother 's teacher is strong .	my cousin helps your boss 's teacher 's father 's cousin 's grandmother 's teacher is strong .
the doctor thinks that my father 's sister 's son 's brother 's husband 's boss is nice .	the doctor scares my father 's sister 's son 's brother 's husband 's boss is nice .
Sara says that your dentist 's son 's wife 's mother 's wife 's son is upset .	Sara works with your dentist 's son 's wife 's mother 's wife 's son is upset .
my friend thinks that your daughter 's son 's friend 's boss 's grandmother 's teacher is clever .	my friend helps your daughter 's son 's friend 's boss 's grandmother 's teacher is clever .
Nancy thinks that your daughter 's mom 's son 's wife 's dentist 's grandmother is lucky .	Nancy scares your daughter 's mom 's son 's wife 's dentist 's grandmother is lucky .
the doctor knows that my son 's mom 's dentist 's cousin 's husband 's daughter is confused .	the doctor helps my son 's mom 's dentist 's cousin 's husband 's daughter is confused .
my doctor knows that your wife 's doctor 's dentist 's teacher 's daughter 's friend is quiet .	my doctor helps your wife 's doctor 's dentist 's teacher 's daughter 's friend is quiet .
the dentist says that my mom 's dentist 's cousin 's son 's brother 's husband is surprised .	the dentist scares my mom 's dentist 's cousin 's son 's brother 's husband is surprised .
Becky knows that my boss 's friend 's boss 's daughter 's dentist 's mom is curious .	Becky works with my boss 's friend 's boss 's daughter 's dentist 's mom is curious .
Amelia thinks that your doctor 's mom 's cousin 's wife 's grandmother 's cousin is sleepy .	Amelia works with your doctor 's mom 's cousin 's wife 's grandmother 's cousin is sleepy .
Barbara knows that your brother 's doctor 's dentist 's wife 's father 's father is hungry .	Barbara scares your brother 's doctor 's dentist 's wife 's father 's father is hungry .
Todd thinks that my cousin 's doctor 's dentist 's father 's cousin 's mother is curious .	Todd works with my cousin 's doctor 's dentist 's father 's cousin 's mother is curious .
my cousin knows that my dentist 's mom 's husband 's doctor 's dentist 's mom is friendly .	my cousin talks to my dentist 's mom 's husband 's doctor 's dentist 's mom is friendly .
Amelia knows that your doctor 's dad 's grandmother 's doctor 's daughter 's dentist is smart .	Amelia helps your doctor 's dad 's grandmother 's doctor 's daughter 's dentist is smart .
my friend thinks that my daughter 's dentist 's friend 's dentist 's father 's mom is smart .	my friend talks to my daughter 's dentist 's friend 's dentist 's father 's mom is smart .
the customer thinks that my grandmother 's sister 's father 's sister 's grandmother 's doctor is smart .	the customer helps my grandmother 's sister 's father 's sister 's grandmother 's doctor is smart .
your doctor knows that your sister 's doctor 's father 's dad 's doctor 's grandmother is sleepy .	your doctor works with your sister 's doctor 's father 's dad 's doctor 's grandmother is sleepy .
Leslie says that my teacher 's cousin 's cousin 's dad 's brother 's dentist is nice .	Leslie works with my teacher 's cousin 's cousin 's dad 's brother 's dentist is nice .
Jennifer knows that your teacher 's mother 's dad 's mom 's boss 's teacher is confused .	Jennifer talks to your teacher 's mother 's dad 's mom 's boss 's teacher is confused .
your friend knows that your brother 's son 's dentist 's wife 's friend 's son is upset .	your friend works with your brother 's son 's dentist 's wife 's friend 's son is upset .
the patient knows that my friend 's teacher 's mother 's cousin 's mom 's dad is upset .	the patient helps my friend 's teacher 's mother 's cousin 's mom 's dad is upset .
John thinks that your father 's father 's doctor 's son 's cousin 's son is gentle .	John scares your father 's father 's doctor 's son 's cousin 's son is gentle .
Noah says that my cousin 's mother 's brother 's mom 's husband 's mom is tired .	Noah works with my cousin 's mother 's brother 's mom 's husband 's mom is tired .
my cousin knows that your daughter 's father 's grandmother 's teacher 's teacher 's mother is wrong .	my cousin helps your daughter 's father 's grandmother 's teacher 's teacher 's mother is wrong .
the driver says that my grandmother 's son 's dad 's grandmother 's father 's boss is sleepy .	the driver talks to my grandmother 's son 's dad 's grandmother 's father 's boss is sleepy .
my cousin thinks that my daughter 's wife 's cousin 's son 's brother 's friend is important .	my cousin scares my daughter 's wife 's cousin 's son 's brother 's friend is important .
the dancer knows that your husband 's dad 's cousin 's daughter 's mom 's friend is gentle .	the dancer scares your husband 's dad 's cousin 's daughter 's mom 's friend is gentle .
the teacher knows that your dad 's daughter 's wife 's dad 's dentist 's brother is curious .	the teacher scares your dad 's daughter 's wife 's dad 's dentist 's brother is curious .
the patient thinks that your dentist 's teacher 's boss 's dentist 's brother 's father is sleepy .	the patient talks to your dentist 's teacher 's boss 's dentist 's brother 's father is sleepy .
the child says that my boss 's friend 's father 's father 's teacher 's brother is smart .	the child works with my boss 's friend 's father 's father 's teacher 's brother is smart .
my doctor thinks that your mother 's friend 's sister 's doctor 's dad 's boss is angry .	my doctor helps your mother 's friend 's sister 's doctor 's dad 's boss is angry .
the child says that my friend 's father 's son 's boss 's son 's son is nice .	the child helps my friend 's father 's son 's boss 's son 's son is nice .
the child knows that your father 's dad 's dad 's dad 's mother 's friend is confused .	the child scares your father 's dad 's dad 's dad 's mother 's friend is confused .
your teacher knows that your daughter 's friend 's friend 's daughter 's friend 's daughter is happy .	your teacher works with your daughter 's friend 's friend 's daughter 's friend 's daughter is happy .
the patient knows that your mom 's boss 's mom 's grandmother 's father 's daughter is busy .	the patient works with your mom 's boss 's mom 's grandmother 's father 's daughter is busy .
the customer thinks that your mom 's doctor 's brother 's mother 's daughter 's friend is friendly .	the customer works with your mom 's doctor 's brother 's mother 's daughter 's friend is friendly .
my friend knows that your daughter 's brother 's grandmother 's daughter 's grandmother 's mom is hungry .	my friend helps your daughter 's brother 's grandmother 's daughter 's grandmother 's mom is hungry .
the dentist thinks that my teacher 's friend 's dad 's friend 's daughter 's husband is excited .	the dentist works with my teacher 's friend 's dad 's friend 's daughter 's husband is excited .
the dentist thinks that my boss 's sister 's friend 's boss 's sister 's grandmother is angry .	the dentist helps my boss 's sister 's friend 's boss 's sister 's grandmother is angry .
your friend knows that my mom 's grandmother 's son 's dad 's teacher 's daughter is nice .	your friend talks to my mom 's grandmother 's son 's dad 's teacher 's daughter is nice .
your friend knows that my father 's mother 's boss 's brother 's husband 's father is friendly .	your friend talks to my father 's mother 's boss 's brother 's husband 's father is friendly .
the driver says that my daughter 's dad 's son 's husband 's brother 's wife is hungry .	the driver talks to my daughter 's dad 's son 's husband 's brother 's wife is hungry .
the dancer thinks that my mom 's boss 's cousin 's friend 's doctor 's boss is clever .	the dancer works with my mom 's boss 's cousin 's friend 's doctor 's boss is clever .
Mary knows that my father 's son 's dentist 's wife 's friend 's boss is surprised .	Mary talks to my father 's son 's dentist 's wife 's friend 's boss is surprised .
my teacher knows that my wife 's grandmother 's mother 's wife 's sister 's wife is lucky .	my teacher helps my wife 's grandmother 's mother 's wife 's sister 's wife is lucky .
James thinks that my cousin 's husband 's father 's wife 's grandmother 's husband is happy .	James helps my cousin 's husband 's father 's wife 's grandmother 's husband is happy .
William says that your friend 's mom 's father 's teacher 's dad 's wife is careful .	William works with your friend 's mom 's father 's teacher 's dad 's wife is careful .
the person says that your father 's sister 's friend 's grandmother 's mother 's doctor is busy .	the person scares your father 's sister 's friend 's grandmother 's mother 's doctor is busy .
the customer knows that your teacher 's brother 's teacher 's daughter 's father 's wife is confused .	the customer works with your teacher 's brother 's teacher 's daughter 's father 's wife is confused .
the patient knows that my dentist 's cousin 's father 's wife 's son 's father is busy .	the patient helps my dentist 's cousin 's father 's wife 's son 's father is busy .
Samantha thinks that my dentist 's sister 's boss 's grandmother 's husband 's friend is strong .	Samantha works with my dentist 's sister 's boss 's grandmother 's husband 's friend is strong .
Janet says that my wife 's son 's daughter 's sister 's teacher 's mom is lucky .	Janet scares my wife 's son 's daughter 's sister 's teacher 's mom is lucky .
my friend says that my mother 's teacher 's daughter 's grandmother 's husband 's brother is boring .	my friend helps my mother 's teacher 's daughter 's grandmother 's husband 's brother is boring .
Amelia says that your cousin 's husband 's grandmother 's teacher 's dad 's mother is careful .	Amelia helps your cousin 's husband 's grandmother 's teacher 's dad 's mother is careful .
the customer says that my boss 's husband 's father 's mother 's brother 's wife is gentle .	the customer scares my boss 's husband 's father 's mother 's brother 's wife is gentle .
my friend knows that your wife 's sister 's wife 's husband 's son 's sister is tired .	my friend works with your wife 's sister 's wife 's husband 's son 's sister is tired .
Sally knows that your friend 's friend 's mom 's daughter 's cousin 's son is lucky .	Sally scares your friend 's friend 's mom 's daughter 's cousin 's son is lucky .
your teacher knows that your dentist 's grandmother 's teacher 's dentist 's brother 's dentist is confused .	your teacher scares your dentist 's grandmother 's teacher 's dentist 's brother 's dentist is confused .
Laura thinks that my daughter 's cousin 's boss 's daughter 's brother 's cousin is strong .	Laura helps my daughter 's cousin 's boss 's daughter 's brother 's cousin is strong .
Tracy knows that my sister 's daughter 's mom 's brother 's dentist 's grandmother is tired .	Tracy scares my sister 's daughter 's mom 's brother 's dentist 's grandmother is tired .
John says that your daughter 's brother 's grandmother 's father 's sister 's boss is wrong .	John scares your daughter 's brother 's grandmother 's father 's sister 's boss is wrong .
my dentist says that my friend 's mom 's dentist 's wife 's dentist 's husband is wrong .	my dentist talks to my friend 's mom 's dentist 's wife 's dentist 's husband is wrong .
the dancer says that your father 's grandmother 's cousin 's grandmother 's daughter 's teacher is friendly .	the dancer scares your father 's grandmother 's cousin 's grandmother 's daughter 's teacher is friendly .
the patient thinks that my mom 's wife 's doctor 's husband 's sister 's daughter is nice .	the patient works with my mom 's wife 's doctor 's husband 's sister 's daughter is nice .
my friend thinks that my dad 's brother 's cousin 's friend 's dad 's dentist is sleepy .	my friend helps my dad 's brother 's cousin 's friend 's dad 's dentist is sleepy .
your dentist thinks that your grandmother 's boss 's mom 's wife 's brother 's brother is boring .	your dentist talks to your grandmother 's boss 's mom 's wife 's brother 's brother is boring .
your dentist thinks that my dad 's son 's brother 's cousin 's boss 's dad is sleepy .	your dentist talks to my dad 's son 's brother 's cousin 's boss 's dad is sleepy .
your friend says that my father 's dentist 's friend 's grandmother 's brother 's teacher is busy .	your friend helps my father 's dentist 's friend 's grandmother 's brother 's teacher is busy .
the person knows that my sister 's doctor 's cousin 's mother 's doctor 's daughter is boring .	the person talks to my sister 's doctor 's cousin 's mother 's doctor 's daughter is boring .
my boss knows that my dentist 's dentist 's doctor 's wife 's father 's son is sleepy .	my boss works with my dentist 's dentist 's doctor 's wife 's father 's son is sleepy .
the child says that my husband 's wife 's sister 's cousin 's friend 's wife is upset .	the child talks to my husband 's wife 's sister 's cousin 's friend 's wife is upset .
my teacher thinks that your sister 's doctor 's grandmother 's father 's husband 's daughter is boring .	my teacher works with your sister 's doctor 's grandmother 's father 's husband 's daughter is boring .
Nina thinks that my teacher 's daughter 's sister 's dad 's daughter 's mother is clever .	Nina scares my teacher 's daughter 's sister 's dad 's daughter 's mother is clever .
my friend says that my daughter 's friend 's father 's dentist 's father 's husband is careful .	my friend talks to my daughter 's friend 's father 's dentist 's father 's husband is careful .
your doctor knows that my sister 's brother 's grandmother 's wife 's grandmother 's husband is curious .	your doctor helps my sister 's brother 's grandmother 's wife 's grandmother 's husband is curious .
your dentist says that my cousin 's father 's dad 's sister 's friend 's cousin is gentle .	your dentist helps my cousin 's father 's dad 's sister 's friend 's cousin is gentle .
Aaron knows that my friend 's dentist 's brother 's dentist 's wife 's doctor is wrong .	Aaron works with my friend 's dentist 's brother 's dentist 's wife 's doctor is wrong .
