the hat thinks that my mother 's wife 's teacher 's cousin 's mother 's wife 's cousin 's doctor 's friend 's door is wrong .	the hat works with my mother 's wife 's teacher 's cousin 's mother 's wife 's cousin 's doctor 's friend 's door is wrong .
the button says that my boss 's teacher 's dad 's doctor 's cousin 's cousin 's doctor 's father 's teacher 's crayon is excited .	the button helps my boss 's teacher 's dad 's doctor 's cousin 's cousin 's doctor 's father 's teacher 's crayon is excited .
the bed says that my doctor 's son 's mother 's son 's husband 's father 's wife 's teacher 's cousin 's glass is curious .	the bed scares my doctor 's son 's mother 's son 's husband 's father 's wife 's teacher 's cousin 's glass is curious .
the fork thinks that my sister 's dad 's teacher 's daughter 's boss 's grandmother 's son 's son 's grandmother 's crayon is quiet .	the fork works with my sister 's dad 's teacher 's daughter 's boss 's grandmother 's son 's son 's grandmother 's crayon is quiet .
the car says that my mom 's son 's mother 's friend 's grandmother 's sister 's father 's dad 's cousin 's mirror is strong .	the car helps my mom 's son 's mother 's friend 's grandmother 's sister 's father 's dad 's cousin 's mirror is strong .
the toy says that your dentist 's husband 's father 's mom 's mother 's wife 's sister 's friend 's doctor 's bottle is nice .	the toy works with your dentist 's husband 's father 's mom 's mother 's wife 's sister 's friend 's doctor 's bottle is nice .
the ring says that my doctor 's father 's sister 's sister 's friend 's husband 's teacher 's teacher 's boss 's doll is careful .	the ring works with my doctor 's father 's sister 's sister 's friend 's husband 's teacher 's teacher 's boss 's doll is careful .
the car says that my grandmother 's son 's daughter 's dentist 's sister 's mother 's husband 's teacher 's cousin 's candle is curious .	the car scares my grandmother 's son 's daughter 's dentist 's sister 's mother 's husband 's teacher 's cousin 's candle is curious .
the shirt says that my mom 's husband 's husband 's daughter 's brother 's sister 's mother 's dentist 's teacher 's toy is excited .	the shirt scares my mom 's husband 's husband 's daughter 's brother 's sister 's mother 's dentist 's teacher 's toy is excited .
the plate says that your brother 's brother 's friend 's doctor 's grandmother 's mom 's husband 's son 's brother 's bowl is lucky .	the plate scares your brother 's brother 's friend 's doctor 's grandmother 's mom 's husband 's son 's brother 's bowl is lucky .
the shoe thinks that my brother 's cousin 's mom 's doctor 's son 's cousin 's mother 's mom 's grandmother 's book is bored .	the shoe scares my brother 's cousin 's mom 's doctor 's son 's cousin 's mother 's mom 's grandmother 's book is bored .
the bed says that your brother 's grandmother 's brother 's brother 's brother 's boss 's mom 's mom 's teacher 's book is upset .	the bed talks to your brother 's grandmother 's brother 's brother 's brother 's boss 's mom 's mom 's teacher 's book is upset .
the crayon knows that your sister 's dentist 's teacher 's mother 's mom 's grandmother 's cousin 's teacher 's father 's plane is upset .	the crayon scares your sister 's dentist 's teacher 's mother 's mom 's grandmother 's cousin 's teacher 's father 's plane is upset .
the bag knows that your dentist 's wife 's wife 's sister 's doctor 's dad 's doctor 's sister 's mom 's window is strong .	the bag helps your dentist 's wife 's wife 's sister 's doctor 's dad 's doctor 's sister 's mom 's window is strong .
the picture knows that your husband 's friend 's teacher 's boss 's mother 's father 's friend 's grandmother 's sister 's rug is upset .	the picture works with your husband 's friend 's teacher 's boss 's mother 's father 's friend 's grandmother 's sister 's rug is upset .
the spoon says that my cousin 's teacher 's daughter 's brother 's doctor 's daughter 's dad 's grandmother 's mom 's bottle is sleepy .	the spoon helps my cousin 's teacher 's daughter 's brother 's doctor 's daughter 's dad 's grandmother 's mom 's bottle is sleepy .
the boat says that your mother 's daughter 's friend 's teacher 's brother 's teacher 's boss 's teacher 's grandmother 's plate is lucky .	the boat scares your mother 's daughter 's friend 's teacher 's brother 's teacher 's boss 's teacher 's grandmother 's plate is lucky .
the plane says that your boss 's dentist 's doctor 's wife 's husband 's boss 's mom 's doctor 's boss 's bed is excited .	the plane works with your boss 's dentist 's doctor 's wife 's husband 's boss 's mom 's doctor 's boss 's bed is excited .
the book thinks that your brother 's mother 's dentist 's mom 's doctor 's daughter 's wife 's dentist 's sister 's doll is lucky .	the book helps your brother 's mother 's dentist 's mom 's doctor 's daughter 's wife 's dentist 's sister 's doll is lucky .
the fork knows that my brother 's brother 's grandmother 's daughter 's sister 's mother 's boss 's dad 's mother 's box is helpful .	the fork scares my brother 's brother 's grandmother 's daughter 's sister 's mother 's boss 's dad 's mother 's box is helpful .
the couch knows that your dentist 's father 's father 's brother 's father 's husband 's boss 's dentist 's cousin 's ship is busy .	the couch helps your dentist 's father 's father 's brother 's father 's husband 's boss 's dentist 's cousin 's ship is busy .
the hat thinks that your teacher 's grandmother 's mom 's brother 's doctor 's teacher 's dentist 's father 's daughter 's shoe is wrong .	the hat helps your teacher 's grandmother 's mom 's brother 's doctor 's teacher 's dentist 's father 's daughter 's shoe is wrong .
the cup says that my dad 's boss 's mom 's teacher 's doctor 's doctor 's boss 's dentist 's grandmother 's chair is important .	the cup helps my dad 's boss 's mom 's teacher 's doctor 's doctor 's boss 's dentist 's grandmother 's chair is important .
the doll says that your brother 's dentist 's dentist 's husband 's son 's wife 's mom 's cousin 's daughter 's door is gentle .	the doll helps your brother 's dentist 's dentist 's husband 's son 's wife 's mom 's cousin 's daughter 's door is gentle .
the book says that my husband 's brother 's grandmother 's husband 's brother 's daughter 's dentist 's mother 's wife 's ring is tired .	the book scares my husband 's brother 's grandmother 's husband 's brother 's daughter 's dentist 's mother 's wife 's ring is tired .
the hat knows that your mother 's grandmother 's mother 's friend 's sister 's doctor 's dentist 's friend 's grandmother 's fork is smart .	the hat works with your mother 's grandmother 's mother 's friend 's sister 's doctor 's dentist 's friend 's grandmother 's fork is smart .
the toy knows that your teacher 's father 's daughter 's teacher 's mother 's cousin 's boss 's mom 's teacher 's spoon is excited .	the toy talks to your teacher 's father 's daughter 's teacher 's mother 's cousin 's boss 's mom 's teacher 's spoon is excited .
the book thinks that my boss 's doctor 's teacher 's friend 's father 's father 's cousin 's father 's mom 's book is boring .	the book works with my boss 's doctor 's teacher 's friend 's father 's father 's cousin 's father 's mom 's book is boring .
the couch knows that my doctor 's husband 's wife 's father 's daughter 's dad 's doctor 's daughter 's father 's plate is bored .	the couch works with my doctor 's husband 's wife 's father 's daughter 's dad 's doctor 's daughter 's father 's plate is bored .
the cup knows that your wife 's wife 's brother 's mother 's brother 's father 's grandmother 's friend 's friend 's ship is wrong .	the cup talks to your wife 's wife 's brother 's mother 's brother 's father 's grandmother 's friend 's friend 's ship is wrong .
the couch knows that my son 's sister 's father 's son 's grandmother 's grandmother 's son 's wife 's brother 's shoe is quiet .	the couch works with my son 's sister 's father 's son 's grandmother 's grandmother 's son 's wife 's brother 's shoe is quiet .
the toy knows that your son 's sister 's mother 's sister 's grandmother 's doctor 's dad 's boss 's husband 's hat is gentle .	the toy works with your son 's sister 's mother 's sister 's grandmother 's doctor 's dad 's boss 's husband 's hat is gentle .
the mirror knows that my dad 's friend 's grandmother 's wife 's sister 's sister 's doctor 's dentist 's mother 's toy is strong .	the mirror helps my dad 's friend 's grandmother 's wife 's sister 's sister 's doctor 's dentist 's mother 's toy is strong .
the chair says that your husband 's mom 's cousin 's grandmother 's mother 's husband 's teacher 's cousin 's brother 's cup is hungry .	the chair works with your husband 's mom 's cousin 's grandmother 's mother 's husband 's teacher 's cousin 's brother 's cup is hungry .
the chair says that my sister 's cousin 's son 's dad 's daughter 's friend 's dentist 's boss 's brother 's bowl is friendly .	the chair talks to my sister 's cousin 's son 's dad 's daughter 's friend 's dentist 's boss 's brother 's bowl is friendly .
the book thinks that your mom 's husband 's grandmother 's daughter 's sister 's teacher 's teacher 's dad 's dentist 's bowl is tired .	the book talks to your mom 's husband 's grandmother 's daughter 's sister 's teacher 's teacher 's dad 's dentist 's bowl is tired .
the car thinks that your husband 's brother 's mom 's boss 's husband 's grandmother 's mom 's cousin 's mother 's candle is surprised .	the car works with your husband 's brother 's mom 's boss 's husband 's grandmother 's mom 's cousin 's mother 's candle is surprised .
the picture thinks that my sister 's grandmother 's husband 's brother 's cousin 's husband 's daughter 's brother 's husband 's boat is smart .	the picture works with my sister 's grandmother 's husband 's brother 's cousin 's husband 's daughter 's brother 's husband 's boat is smart .
the mirror says that your doctor 's daughter 's son 's friend 's daughter 's wife 's mom 's sister 's wife 's hat is lucky .	the mirror talks to your doctor 's daughter 's son 's friend 's daughter 's wife 's mom 's sister 's wife 's hat is lucky .
the bowl knows that my grandmother 's doctor 's sister 's father 's mother 's daughter 's grandmother 's boss 's brother 's car is angry .	the bowl works with my grandmother 's doctor 's sister 's father 's mother 's daughter 's grandmother 's boss 's brother 's car is angry .
the mirror knows that your dentist 's doctor 's cousin 's cousin 's daughter 's daughter 's father 's mother 's father 's chair is happy .	the mirror helps your dentist 's doctor 's cousin 's cousin 's daughter 's daughter 's father 's mother 's father 's chair is happy .
the fork knows that your brother 's sister 's husband 's father 's daughter 's husband 's doctor 's dad 's brother 's truck is gentle .	the fork helps your brother 's sister 's husband 's father 's daughter 's husband 's doctor 's dad 's brother 's truck is gentle .
the toy thinks that your brother 's dentist 's mom 's brother 's dentist 's husband 's sister 's father 's grandmother 's mirror is helpful .	the toy talks to your brother 's dentist 's mom 's brother 's dentist 's husband 's sister 's father 's grandmother 's mirror is helpful .
the chair thinks that your brother 's mom 's grandmother 's son 's boss 's brother 's dad 's father 's boss 's plane is bored .	the chair talks to your brother 's mom 's grandmother 's son 's boss 's brother 's dad 's father 's boss 's plane is bored .
the book thinks that your dentist 's cousin 's wife 's son 's grandmother 's friend 's dentist 's wife 's mom 's couch is nice .	the book talks to your dentist 's cousin 's wife 's son 's grandmother 's friend 's dentist 's wife 's mom 's couch is nice .
the rocket thinks that your boss 's friend 's teacher 's dad 's doctor 's sister 's grandmother 's teacher 's sister 's bag is tall .	the rocket talks to your boss 's friend 's teacher 's dad 's doctor 's sister 's grandmother 's teacher 's sister 's bag is tall .
the truck thinks that your friend 's brother 's cousin 's boss 's wife 's husband 's brother 's boss 's dad 's bicycle is bored .	the truck talks to your friend 's brother 's cousin 's boss 's wife 's husband 's brother 's boss 's dad 's bicycle is bored .
the chair thinks that your son 's grandmother 's mom 's friend 's mother 's cousin 's wife 's father 's dad 's bicycle is busy .	the chair works with your son 's grandmother 's mom 's friend 's mother 's cousin 's wife 's father 's dad 's bicycle is busy .
the bag thinks that your husband 's grandmother 's daughter 's wife 's mom 's father 's daughter 's dentist 's grandmother 's crayon is upset .	the bag talks to your husband 's grandmother 's daughter 's wife 's mom 's father 's daughter 's dentist 's grandmother 's crayon is upset .
the plate says that my mother 's dad 's mom 's brother 's father 's grandmother 's husband 's friend 's grandmother 's door is surprised .	the plate talks to my mother 's dad 's mom 's brother 's father 's grandmother 's husband 's friend 's grandmother 's door is surprised .
the dish knows that my grandmother 's daughter 's brother 's teacher 's brother 's sister 's boss 's teacher 's son 's plate is excited .	the dish talks to my grandmother 's daughter 's brother 's teacher 's brother 's sister 's boss 's teacher 's son 's plate is excited .
the book thinks that your husband 's son 's dad 's mom 's friend 's dad 's dentist 's boss 's mother 's crayon is strong .	the book helps your husband 's son 's dad 's mom 's friend 's dad 's dentist 's boss 's mother 's crayon is strong .
the boat thinks that my mom 's mother 's dad 's doctor 's brother 's mother 's mother 's sister 's dentist 's window is young .	the boat talks to my mom 's mother 's dad 's doctor 's brother 's mother 's mother 's sister 's dentist 's window is young .
the couch says that my boss 's mother 's brother 's teacher 's son 's brother 's husband 's mom 's dentist 's button is quiet .	the couch helps my boss 's mother 's brother 's teacher 's son 's brother 's husband 's mom 's dentist 's button is quiet .
the hat says that your teacher 's father 's son 's grandmother 's teacher 's wife 's boss 's friend 's dentist 's shoe is sleepy .	the hat talks to your teacher 's father 's son 's grandmother 's teacher 's wife 's boss 's friend 's dentist 's shoe is sleepy .
the plate knows that your mom 's wife 's boss 's cousin 's doctor 's boss 's friend 's father 's doctor 's door is smart .	the plate talks to your mom 's wife 's boss 's cousin 's doctor 's boss 's friend 's father 's doctor 's door is smart .
the box says that your son 's brother 's dad 's boss 's mom 's brother 's boss 's husband 's teacher 's shirt is tall .	the box scares your son 's brother 's dad 's boss 's mom 's brother 's boss 's husband 's teacher 's shirt is tall .
the mirror says that your husband 's son 's father 's friend 's friend 's daughter 's mother 's grandmother 's friend 's crayon is lucky .	the mirror talks to your husband 's son 's father 's friend 's friend 's daughter 's mother 's grandmother 's friend 's crayon is lucky .
the bed knows that my dad 's dad 's dad 's dad 's sister 's grandmother 's cousin 's husband 's father 's shoe is clever .	the bed talks to my dad 's dad 's dad 's dad 's sister 's grandmother 's cousin 's husband 's father 's shoe is clever .
the box says that your sister 's boss 's wife 's boss 's father 's boss 's mom 's sister 's grandmother 's door is young .	the box scares your sister 's boss 's wife 's boss 's father 's boss 's mom 's sister 's grandmother 's door is young .
the car thinks that your boss 's cousin 's boss 's wife 's boss 's cousin 's mother 's dad 's cousin 's car is friendly .	the car scares your boss 's cousin 's boss 's wife 's boss 's cousin 's mother 's dad 's cousin 's car is friendly .
the fork knows that your cousin 's wife 's daughter 's mom 's son 's daughter 's daughter 's boss 's father 's dish is tired .	the fork scares your cousin 's wife 's daughter 's mom 's son 's daughter 's daughter 's boss 's father 's dish is tired .
the car knows that my daughter 's son 's brother 's brother 's mother 's husband 's son 's cousin 's dad 's truck is careful .	the car helps my daughter 's son 's brother 's brother 's mother 's husband 's son 's cousin 's dad 's truck is careful .
the couch thinks that my dad 's father 's boss 's teacher 's father 's daughter 's teacher 's boss 's mom 's couch is sleepy .	the couch scares my dad 's father 's boss 's teacher 's father 's daughter 's teacher 's boss 's mom 's couch is sleepy .
the rug knows that your brother 's daughter 's dentist 's boss 's dad 's wife 's dad 's dentist 's husband 's bed is bored .	the rug scares your brother 's daughter 's dentist 's boss 's dad 's wife 's dad 's dentist 's husband 's bed is bored .
the plate knows that my brother 's friend 's dad 's grandmother 's boss 's daughter 's dad 's mother 's sister 's cup is sleepy .	the plate works with my brother 's friend 's dad 's grandmother 's boss 's daughter 's dad 's mother 's sister 's cup is sleepy .
the truck says that your daughter 's friend 's son 's dentist 's grandmother 's brother 's friend 's husband 's son 's bicycle is boring .	the truck talks to your daughter 's friend 's son 's dentist 's grandmother 's brother 's friend 's husband 's son 's bicycle is boring .
the candle thinks that my daughter 's dad 's wife 's father 's son 's husband 's mother 's daughter 's grandmother 's couch is tired .	the candle helps my daughter 's dad 's wife 's father 's son 's husband 's mother 's daughter 's grandmother 's couch is tired .
the shoe knows that your friend 's father 's father 's husband 's wife 's mother 's boss 's dentist 's sister 's window is angry .	the shoe works with your friend 's father 's father 's husband 's wife 's mother 's boss 's dentist 's sister 's window is angry .
the truck thinks that your friend 's mother 's mother 's daughter 's son 's friend 's sister 's daughter 's sister 's plate is excited .	the truck scares your friend 's mother 's mother 's daughter 's son 's friend 's sister 's daughter 's sister 's plate is excited .
the fork says that my teacher 's dentist 's friend 's grandmother 's boss 's dentist 's dad 's husband 's dentist 's toy is sleepy .	the fork works with my teacher 's dentist 's friend 's grandmother 's boss 's dentist 's dad 's husband 's dentist 's toy is sleepy .
the toy says that my husband 's doctor 's brother 's son 's daughter 's mom 's son 's mom 's grandmother 's door is helpful .	the toy helps my husband 's doctor 's brother 's son 's daughter 's mom 's son 's mom 's grandmother 's door is helpful .
the box knows that my husband 's father 's grandmother 's dentist 's brother 's friend 's father 's daughter 's doctor 's chair is angry .	the box talks to my husband 's father 's grandmother 's dentist 's brother 's friend 's father 's daughter 's doctor 's chair is angry .
the rocket says that my grandmother 's grandmother 's grandmother 's wife 's daughter 's dentist 's sister 's mother 's wife 's bag is boring .	the rocket talks to my grandmother 's grandmother 's grandmother 's wife 's daughter 's dentist 's sister 's mother 's wife 's bag is boring .
the rocket thinks that my mother 's sister 's doctor 's doctor 's brother 's father 's grandmother 's brother 's son 's picture is strong .	the rocket works with my mother 's sister 's doctor 's doctor 's brother 's father 's grandmother 's brother 's son 's picture is strong .
the plane thinks that your brother 's cousin 's dentist 's father 's daughter 's boss 's friend 's dentist 's wife 's door is strong .	the plane scares your brother 's cousin 's dentist 's father 's daughter 's boss 's friend 's dentist 's wife 's door is strong .
the fork thinks that your dentist 's sister 's wife 's dad 's daughter 's friend 's dad 's mother 's grandmother 's bottle is boring .	the fork helps your dentist 's sister 's wife 's dad 's daughter 's friend 's dad 's mother 's grandmother 's bottle is boring .
the car knows that your sister 's sister 's mom 's daughter 's teacher 's dad 's friend 's brother 's mother 's door is young .	the car helps your sister 's sister 's mom 's daughter 's teacher 's dad 's friend 's brother 's mother 's door is young .
the glass says that my son 's teacher 's sister 's boss 's son 's dentist 's doctor 's brother 's teacher 's car is helpful .	the glass scares my son 's teacher 's sister 's boss 's son 's dentist 's doctor 's brother 's teacher 's car is helpful .
the crayon thinks that your dad 's daughter 's mom 's mom 's son 's father 's teacher 's teacher 's daughter 's plane is friendly .	the crayon helps your dad 's daughter 's mom 's mom 's son 's father 's teacher 's teacher 's daughter 's plane is friendly .
the window knows that my father 's mom 's doctor 's son 's dad 's cousin 's daughter 's cousin 's father 's cup is friendly .	the window works with my father 's mom 's doctor 's son 's dad 's cousin 's daughter 's cousin 's father 's cup is friendly .
the button thinks that your grandmother 's father 's mother 's cousin 's dentist 's cousin 's teacher 's boss 's mom 's ring is bored .	the button works with your grandmother 's father 's mother 's cousin 's dentist 's cousin 's teacher 's boss 's mom 's ring is bored .
the chair thinks that your grandmother 's boss 's dentist 's father 's brother 's brother 's sister 's boss 's wife 's car is strong .	the chair scares your grandmother 's boss 's dentist 's father 's brother 's brother 's sister 's boss 's wife 's car is strong .
the door knows that your doctor 's doctor 's son 's friend 's daughter 's dentist 's dad 's brother 's husband 's crayon is excited .	the door works with your doctor 's doctor 's son 's friend 's daughter 's dentist 's dad 's brother 's husband 's crayon is excited .
the rocket thinks that your grandmother 's wife 's daughter 's father 's brother 's son 's daughter 's father 's son 's car is helpful .	the rocket works with your grandmother 's wife 's daughter 's father 's brother 's son 's daughter 's father 's son 's car is helpful .
the dish knows that my son 's mother 's brother 's grandmother 's dentist 's daughter 's father 's son 's doctor 's rug is bored .	the dish talks to my son 's mother 's brother 's grandmother 's dentist 's daughter 's father 's son 's doctor 's rug is bored .
the cup knows that my daughter 's daughter 's son 's friend 's friend 's teacher 's dentist 's brother 's dad 's spoon is happy .	the cup scares my daughter 's daughter 's son 's friend 's friend 's teacher 's dentist 's brother 's dad 's spoon is happy .
the car thinks that my sister 's brother 's boss 's teacher 's brother 's doctor 's cousin 's grandmother 's mother 's ring is boring .	the car scares my sister 's brother 's boss 's teacher 's brother 's doctor 's cousin 's grandmother 's mother 's ring is boring .
the ship thinks that my dad 's dentist 's dentist 's friend 's teacher 's dentist 's boss 's brother 's wife 's door is sleepy .	the ship scares my dad 's dentist 's dentist 's friend 's teacher 's dentist 's boss 's brother 's wife 's door is sleepy .
the shoe says that your boss 's dad 's daughter 's brother 's dad 's dad 's cousin 's boss 's sister 's bicycle is nice .	the shoe talks to your boss 's dad 's daughter 's brother 's dad 's dad 's cousin 's boss 's sister 's bicycle is nice .
the ship knows that my boss 's sister 's teacher 's teacher 's mom 's daughter 's doctor 's father 's doctor 's chair is busy .	the ship helps my boss 's sister 's teacher 's teacher 's mom 's daughter 's doctor 's father 's doctor 's chair is busy .
the door knows that your mother 's brother 's friend 's husband 's mother 's dad 's mom 's mom 's dad 's cup is confused .	the door scares your mother 's brother 's friend 's husband 's mother 's dad 's mom 's mom 's dad 's cup is confused .
the truck thinks that my cousin 's dad 's friend 's dad 's doctor 's brother 's mother 's wife 's brother 's rug is clever .	the truck works with my cousin 's dad 's friend 's dad 's doctor 's brother 's mother 's wife 's brother 's rug is clever .
the ship thinks that my grandmother 's grandmother 's teacher 's brother 's cousin 's boss 's daughter 's daughter 's teacher 's hat is nice .	the ship talks to my grandmother 's grandmother 's teacher 's brother 's cousin 's boss 's daughter 's daughter 's teacher 's hat is nice .
the book says that my daughter 's brother 's cousin 's teacher 's brother 's mom 's boss 's friend 's grandmother 's cup is clever .	the book helps my daughter 's brother 's cousin 's teacher 's brother 's mom 's boss 's friend 's grandmother 's cup is clever .
the chair knows that my dentist 's mom 's husband 's son 's father 's sister 's boss 's mother 's boss 's button is strong .	the chair scares my dentist 's mom 's husband 's son 's father 's sister 's boss 's mother 's boss 's button is strong .
the rocket knows that my father 's doctor 's mom 's mother 's friend 's grandmother 's son 's daughter 's wife 's toy is strong .	the rocket helps my father 's doctor 's mom 's mother 's friend 's grandmother 's son 's daughter 's wife 's toy is strong .
the hat knows that your mother 's dad 's friend 's mom 's brother 's cousin 's mother 's husband 's teacher 's cup is sleepy .	the hat helps your mother 's dad 's friend 's mom 's brother 's cousin 's mother 's husband 's teacher 's cup is sleepy .
the bottle says that my grandmother 's mom 's mother 's doctor 's sister 's wife 's boss 's boss 's boss 's mirror is sleepy .	the bottle talks to my grandmother 's mom 's mother 's doctor 's sister 's wife 's boss 's boss 's boss 's mirror is sleepy .
