the plate says that your dad 's sister 's mother 's daughter 's son 's friend 's brother 's dentist 's cousin 's wife 's bowl is angry .	the plate scares your dad 's sister 's mother 's daughter 's son 's friend 's brother 's dentist 's cousin 's wife 's bowl is angry .
the crayon knows that my cousin 's sister 's dentist 's boss 's daughter 's sister 's dad 's dentist 's son 's mother 's couch is quiet .	the crayon works with my cousin 's sister 's dentist 's boss 's daughter 's sister 's dad 's dentist 's son 's mother 's couch is quiet .
the bowl says that your mom 's sister 's wife 's doctor 's cousin 's brother 's father 's doctor 's mother 's dentist 's car is helpful .	the bowl talks to your mom 's sister 's wife 's doctor 's cousin 's brother 's father 's doctor 's mother 's dentist 's car is helpful .
the bed thinks that my father 's mother 's mom 's mom 's dad 's mom 's grandmother 's mother 's daughter 's dentist 's ship is important .	the bed works with my father 's mother 's mom 's mom 's dad 's mom 's grandmother 's mother 's daughter 's dentist 's ship is important .
the ship knows that my doctor 's father 's son 's brother 's daughter 's boss 's mom 's husband 's doctor 's daughter 's bicycle is boring .	the ship scares my doctor 's father 's son 's brother 's daughter 's boss 's mom 's husband 's doctor 's daughter 's bicycle is boring .
the plane knows that my doctor 's mother 's dad 's cousin 's mother 's cousin 's mother 's father 's dentist 's sister 's candle is helpful .	the plane scares my doctor 's mother 's dad 's cousin 's mother 's cousin 's mother 's father 's dentist 's sister 's candle is helpful .
the car thinks that my boss 's mother 's friend 's mother 's brother 's mother 's son 's husband 's sister 's dentist 's button is hungry .	the car works with my boss 's mother 's friend 's mother 's brother 's mother 's son 's husband 's sister 's dentist 's button is hungry .
the plate says that my mom 's doctor 's doctor 's teacher 's brother 's dentist 's boss 's wife 's mom 's friend 's glass is friendly .	the plate works with my mom 's doctor 's doctor 's teacher 's brother 's dentist 's boss 's wife 's mom 's friend 's glass is friendly .
the mirror knows that my sister 's mother 's boss 's friend 's teacher 's dentist 's friend 's sister 's father 's daughter 's toy is smart .	the mirror talks to my sister 's mother 's boss 's friend 's teacher 's dentist 's friend 's sister 's father 's daughter 's toy is smart .
the rug says that my son 's friend 's wife 's father 's boss 's boss 's friend 's father 's brother 's wife 's book is excited .	the rug scares my son 's friend 's wife 's father 's boss 's boss 's friend 's father 's brother 's wife 's book is excited .
the window says that your dentist 's daughter 's sister 's daughter 's wife 's dentist 's grandmother 's son 's cousin 's mom 's cup is clever .	the window talks to your dentist 's daughter 's sister 's daughter 's wife 's dentist 's grandmother 's son 's cousin 's mom 's cup is clever .
the book knows that your husband 's dentist 's daughter 's sister 's husband 's dentist 's father 's father 's dad 's wife 's car is curious .	the book talks to your husband 's dentist 's daughter 's sister 's husband 's dentist 's father 's father 's dad 's wife 's car is curious .
the glass knows that my doctor 's dentist 's dad 's father 's mom 's wife 's dentist 's sister 's boss 's friend 's window is tall .	the glass helps my doctor 's dentist 's dad 's father 's mom 's wife 's dentist 's sister 's boss 's friend 's window is tall .
the bed knows that my sister 's father 's cousin 's dad 's husband 's boss 's boss 's son 's wife 's grandmother 's book is young .	the bed talks to my sister 's father 's cousin 's dad 's husband 's boss 's boss 's son 's wife 's grandmother 's book is young .
the door knows that your wife 's dad 's daughter 's boss 's boss 's wife 's teacher 's dentist 's mother 's husband 's button is wrong .	the door helps your wife 's dad 's daughter 's boss 's boss 's wife 's teacher 's dentist 's mother 's husband 's button is wrong .
the fork knows that your wife 's dentist 's dentist 's sister 's boss 's son 's son 's teacher 's teacher 's mother 's toy is sleepy .	the fork helps your wife 's dentist 's dentist 's sister 's boss 's son 's son 's teacher 's teacher 's mother 's toy is sleepy .
the bicycle thinks that my boss 's mom 's daughter 's cousin 's brother 's doctor 's boss 's father 's boss 's father 's shirt is friendly .	the bicycle talks to my boss 's mom 's daughter 's cousin 's brother 's doctor 's boss 's father 's boss 's father 's shirt is friendly .
the rug knows that your mother 's boss 's sister 's daughter 's sister 's friend 's doctor 's father 's husband 's husband 's ship is wrong .	the rug helps your mother 's boss 's sister 's daughter 's sister 's friend 's doctor 's father 's husband 's husband 's ship is wrong .
the bicycle thinks that my dentist 's doctor 's cousin 's husband 's cousin 's boss 's mother 's cousin 's boss 's son 's plate is tired .	the bicycle talks to my dentist 's doctor 's cousin 's husband 's cousin 's boss 's mother 's cousin 's boss 's son 's plate is tired .
the car says that my daughter 's son 's teacher 's dad 's husband 's friend 's daughter 's father 's son 's cousin 's box is strong .	the car helps my daughter 's son 's teacher 's dad 's husband 's friend 's daughter 's father 's son 's cousin 's box is strong .
the button thinks that my mom 's boss 's mom 's boss 's brother 's friend 's grandmother 's boss 's friend 's husband 's ring is careful .	the button scares my mom 's boss 's mom 's boss 's brother 's friend 's grandmother 's boss 's friend 's husband 's ring is careful .
the truck says that my father 's grandmother 's doctor 's teacher 's dad 's dentist 's dad 's cousin 's wife 's doctor 's crayon is surprised .	the truck talks to my father 's grandmother 's doctor 's teacher 's dad 's dentist 's dad 's cousin 's wife 's doctor 's crayon is surprised .
the car knows that your teacher 's cousin 's boss 's father 's daughter 's dad 's son 's dentist 's grandmother 's sister 's box is curious .	the car helps your teacher 's cousin 's boss 's father 's daughter 's dad 's son 's dentist 's grandmother 's sister 's box is curious .
the rocket thinks that your dentist 's dad 's doctor 's grandmother 's son 's brother 's daughter 's grandmother 's wife 's dentist 's dish is smart .	the rocket works with your dentist 's dad 's doctor 's grandmother 's son 's brother 's daughter 's grandmother 's wife 's dentist 's dish is smart .
the bottle says that your wife 's boss 's grandmother 's sister 's dentist 's grandmother 's dad 's son 's friend 's daughter 's book is happy .	the bottle helps your wife 's boss 's grandmother 's sister 's dentist 's grandmother 's dad 's son 's friend 's daughter 's book is happy .
the rocket thinks that your mother 's sister 's grandmother 's mom 's teacher 's boss 's boss 's boss 's husband 's daughter 's couch is nice .	the rocket helps your mother 's sister 's grandmother 's mom 's teacher 's boss 's boss 's boss 's husband 's daughter 's couch is nice .
the chair knows that your son 's doctor 's father 's mother 's dentist 's wife 's wife 's grandmother 's mom 's dad 's plane is healthy .	the chair scares your son 's doctor 's father 's mother 's dentist 's wife 's wife 's grandmother 's mom 's dad 's plane is healthy .
the bag knows that your husband 's wife 's dad 's teacher 's mother 's dad 's mom 's doctor 's mother 's friend 's fork is surprised .	the bag scares your husband 's wife 's dad 's teacher 's mother 's dad 's mom 's doctor 's mother 's friend 's fork is surprised .
the button says that your mother 's cousin 's brother 's brother 's mother 's teacher 's husband 's dad 's dentist 's friend 's ship is upset .	the button scares your mother 's cousin 's brother 's brother 's mother 's teacher 's husband 's dad 's dentist 's friend 's ship is upset .
the glass thinks that my mom 's son 's sister 's mom 's mother 's doctor 's father 's dad 's dad 's boss 's book is careful .	the glass scares my mom 's son 's sister 's mom 's mother 's doctor 's father 's dad 's dad 's boss 's book is careful .
the couch says that your friend 's boss 's dentist 's wife 's sister 's daughter 's wife 's wife 's teacher 's wife 's crayon is angry .	the couch scares your friend 's boss 's dentist 's wife 's sister 's daughter 's wife 's wife 's teacher 's wife 's crayon is angry .
the plate says that my brother 's son 's daughter 's mother 's doctor 's cousin 's daughter 's sister 's sister 's wife 's hat is lucky .	the plate helps my brother 's son 's daughter 's mother 's doctor 's cousin 's daughter 's sister 's sister 's wife 's hat is lucky .
the toy thinks that my mother 's friend 's grandmother 's dad 's friend 's father 's wife 's cousin 's dentist 's friend 's car is young .	the toy talks to my mother 's friend 's grandmother 's dad 's friend 's father 's wife 's cousin 's dentist 's friend 's car is young .
the couch thinks that your doctor 's daughter 's grandmother 's mom 's mom 's grandmother 's dentist 's friend 's brother 's father 's chair is quiet .	the couch talks to your doctor 's daughter 's grandmother 's mom 's mom 's grandmother 's dentist 's friend 's brother 's father 's chair is quiet .
the bicycle thinks that your doctor 's husband 's wife 's wife 's husband 's mother 's sister 's grandmother 's friend 's wife 's book is young .	the bicycle talks to your doctor 's husband 's wife 's wife 's husband 's mother 's sister 's grandmother 's friend 's wife 's book is young .
the shirt thinks that your teacher 's dentist 's boss 's doctor 's mom 's wife 's sister 's mom 's dentist 's friend 's door is wrong .	the shirt talks to your teacher 's dentist 's boss 's doctor 's mom 's wife 's sister 's mom 's dentist 's friend 's door is wrong .
the candle knows that your mother 's mom 's grandmother 's wife 's mom 's brother 's sister 's dad 's grandmother 's boss 's mirror is smart .	the candle helps your mother 's mom 's grandmother 's wife 's mom 's brother 's sister 's dad 's grandmother 's boss 's mirror is smart .
the door says that my mother 's daughter 's daughter 's father 's grandmother 's sister 's father 's doctor 's sister 's mother 's book is confused .	the door talks to my mother 's daughter 's daughter 's father 's grandmother 's sister 's father 's doctor 's sister 's mother 's book is confused .
the shirt knows that your dad 's dad 's sister 's dad 's teacher 's mom 's dentist 's mom 's mother 's sister 's bottle is happy .	the shirt helps your dad 's dad 's sister 's dad 's teacher 's mom 's dentist 's mom 's mother 's sister 's bottle is happy .
the mirror thinks that your boss 's doctor 's dad 's husband 's brother 's husband 's wife 's daughter 's mother 's mom 's toy is quiet .	the mirror works with your boss 's doctor 's dad 's husband 's brother 's husband 's wife 's daughter 's mother 's mom 's toy is quiet .
the rug thinks that my mother 's cousin 's teacher 's sister 's mother 's cousin 's doctor 's mom 's mother 's teacher 's doll is kind .	the rug helps my mother 's cousin 's teacher 's sister 's mother 's cousin 's doctor 's mom 's mother 's teacher 's doll is kind .
the shoe says that your sister 's brother 's dad 's brother 's mother 's cousin 's dad 's friend 's mom 's sister 's book is busy .	the shoe helps your sister 's brother 's dad 's brother 's mother 's cousin 's dad 's friend 's mom 's sister 's book is busy .
the box knows that my wife 's mother 's dad 's husband 's cousin 's friend 's mother 's dad 's cousin 's sister 's hat is tired .	the box helps my wife 's mother 's dad 's husband 's cousin 's friend 's mother 's dad 's cousin 's sister 's hat is tired .
the bowl thinks that my doctor 's dad 's dentist 's friend 's grandmother 's son 's mom 's dentist 's husband 's friend 's ship is smart .	the bowl scares my doctor 's dad 's dentist 's friend 's grandmother 's son 's mom 's dentist 's husband 's friend 's ship is smart .
the truck knows that my daughter 's daughter 's teacher 's father 's boss 's cousin 's brother 's dentist 's sister 's mom 's spoon is confused .	the truck helps my daughter 's daughter 's teacher 's father 's boss 's cousin 's brother 's dentist 's sister 's mom 's spoon is confused .
the shoe thinks that my mom 's teacher 's dentist 's cousin 's wife 's doctor 's mother 's brother 's dentist 's mom 's picture is tired .	the shoe talks to my mom 's teacher 's dentist 's cousin 's wife 's doctor 's mother 's brother 's dentist 's mom 's picture is tired .
the mirror says that my friend 's teacher 's brother 's mom 's teacher 's brother 's sister 's dentist 's mom 's son 's plane is healthy .	the mirror works with my friend 's teacher 's brother 's mom 's teacher 's brother 's sister 's dentist 's mom 's son 's plane is healthy .
the window knows that my teacher 's teacher 's cousin 's dad 's brother 's friend 's mother 's friend 's father 's daughter 's couch is busy .	the window talks to my teacher 's teacher 's cousin 's dad 's brother 's friend 's mother 's friend 's father 's daughter 's couch is busy .
the bowl thinks that my grandmother 's daughter 's mother 's son 's sister 's father 's daughter 's mother 's cousin 's wife 's truck is smart .	the bowl scares my grandmother 's daughter 's mother 's son 's sister 's father 's daughter 's mother 's cousin 's wife 's truck is smart .
the cup thinks that my boss 's mom 's doctor 's husband 's doctor 's dad 's son 's grandmother 's son 's husband 's candle is confused .	the cup helps my boss 's mom 's doctor 's husband 's doctor 's dad 's son 's grandmother 's son 's husband 's candle is confused .
the bed says that your grandmother 's mother 's friend 's dad 's friend 's son 's dentist 's cousin 's daughter 's mother 's shoe is tall .	the bed talks to your grandmother 's mother 's friend 's dad 's friend 's son 's dentist 's cousin 's daughter 's mother 's shoe is tall .
the book says that my boss 's cousin 's boss 's mom 's father 's teacher 's teacher 's dentist 's boss 's grandmother 's bag is sleepy .	the book works with my boss 's cousin 's boss 's mom 's father 's teacher 's teacher 's dentist 's boss 's grandmother 's bag is sleepy .
the bottle knows that your brother 's sister 's father 's daughter 's dentist 's cousin 's cousin 's boss 's dad 's dad 's button is hungry .	the bottle scares your brother 's sister 's father 's daughter 's dentist 's cousin 's cousin 's boss 's dad 's dad 's button is hungry .
the ring thinks that my cousin 's husband 's son 's mom 's mother 's grandmother 's daughter 's daughter 's teacher 's doctor 's toy is bored .	the ring works with my cousin 's husband 's son 's mom 's mother 's grandmother 's daughter 's daughter 's teacher 's doctor 's toy is bored .
the car knows that your brother 's wife 's teacher 's brother 's son 's teacher 's grandmother 's friend 's doctor 's daughter 's bottle is happy .	the car works with your brother 's wife 's teacher 's brother 's son 's teacher 's grandmother 's friend 's doctor 's daughter 's bottle is happy .
the window says that my doctor 's husband 's husband 's teacher 's grandmother 's daughter 's cousin 's mother 's doctor 's mom 's plane is quiet .	the window works with my doctor 's husband 's husband 's teacher 's grandmother 's daughter 's cousin 's mother 's doctor 's mom 's plane is quiet .
the couch knows that your wife 's mother 's daughter 's sister 's dad 's son 's boss 's brother 's brother 's son 's bowl is busy .	the couch works with your wife 's mother 's daughter 's sister 's dad 's son 's boss 's brother 's brother 's son 's bowl is busy .
the plate thinks that my cousin 's dentist 's boss 's doctor 's dad 's dentist 's dentist 's teacher 's grandmother 's dentist 's truck is helpful .	the plate scares my cousin 's dentist 's boss 's doctor 's dad 's dentist 's dentist 's teacher 's grandmother 's dentist 's truck is helpful .
the rocket thinks that my son 's mother 's grandmother 's friend 's brother 's wife 's brother 's father 's sister 's daughter 's crayon is excited .	the rocket helps my son 's mother 's grandmother 's friend 's brother 's wife 's brother 's father 's sister 's daughter 's crayon is excited .
the fork says that my cousin 's son 's dentist 's doctor 's wife 's wife 's brother 's cousin 's dentist 's daughter 's candle is hungry .	the fork helps my cousin 's son 's dentist 's doctor 's wife 's wife 's brother 's cousin 's dentist 's daughter 's candle is hungry .
the crayon says that my brother 's mother 's friend 's sister 's mother 's friend 's dentist 's son 's cousin 's dad 's book is healthy .	the crayon talks to my brother 's mother 's friend 's sister 's mother 's friend 's dentist 's son 's cousin 's dad 's book is healthy .
the plane thinks that your mother 's daughter 's husband 's teacher 's mom 's brother 's son 's sister 's husband 's dad 's bowl is clever .	the plane scares your mother 's daughter 's husband 's teacher 's mom 's brother 's son 's sister 's husband 's dad 's bowl is clever .
the boat knows that my brother 's daughter 's dad 's dentist 's husband 's wife 's teacher 's dad 's boss 's grandmother 's dish is quiet .	the boat scares my brother 's daughter 's dad 's dentist 's husband 's wife 's teacher 's dad 's boss 's grandmother 's dish is quiet .
the ship thinks that my mom 's cousin 's dentist 's daughter 's mom 's dad 's brother 's dad 's sister 's cousin 's shirt is angry .	the ship talks to my mom 's cousin 's dentist 's daughter 's mom 's dad 's brother 's dad 's sister 's cousin 's shirt is angry .
the truck knows that my daughter 's husband 's daughter 's father 's teacher 's daughter 's daughter 's daughter 's brother 's grandmother 's shoe is careful .	the truck helps my daughter 's husband 's daughter 's father 's teacher 's daughter 's daughter 's daughter 's brother 's grandmother 's shoe is careful .
the crayon thinks that your husband 's cousin 's son 's dad 's friend 's grandmother 's mom 's daughter 's teacher 's dentist 's hat is kind .	the crayon talks to your husband 's cousin 's son 's dad 's friend 's grandmother 's mom 's daughter 's teacher 's dentist 's hat is kind .
the plate says that your mother 's husband 's husband 's dentist 's cousin 's mother 's dad 's sister 's friend 's doctor 's dish is healthy .	the plate helps your mother 's husband 's husband 's dentist 's cousin 's mother 's dad 's sister 's friend 's doctor 's dish is healthy .
the window thinks that my doctor 's doctor 's mother 's wife 's dentist 's mother 's father 's mother 's husband 's doctor 's door is angry .	the window scares my doctor 's doctor 's mother 's wife 's dentist 's mother 's father 's mother 's husband 's doctor 's door is angry .
the fork knows that your friend 's friend 's friend 's teacher 's doctor 's sister 's mother 's teacher 's doctor 's dentist 's car is busy .	the fork works with your friend 's friend 's friend 's teacher 's doctor 's sister 's mother 's teacher 's doctor 's dentist 's car is busy .
the bag thinks that your father 's father 's son 's doctor 's mom 's sister 's brother 's doctor 's doctor 's friend 's cup is healthy .	the bag scares your father 's father 's son 's doctor 's mom 's sister 's brother 's doctor 's doctor 's friend 's cup is healthy .
the toy thinks that your brother 's grandmother 's cousin 's dad 's grandmother 's dad 's mom 's cousin 's husband 's dad 's hat is busy .	the toy scares your brother 's grandmother 's cousin 's dad 's grandmother 's dad 's mom 's cousin 's husband 's dad 's hat is busy .
the boat thinks that your father 's husband 's friend 's mom 's cousin 's father 's cousin 's boss 's sister 's dad 's shoe is clever .	the boat talks to your father 's husband 's friend 's mom 's cousin 's father 's cousin 's boss 's sister 's dad 's shoe is clever .
the shirt says that your doctor 's grandmother 's boss 's husband 's mom 's father 's husband 's teacher 's sister 's dentist 's car is smart .	the shirt talks to your doctor 's grandmother 's boss 's husband 's mom 's father 's husband 's teacher 's sister 's dentist 's car is smart .
the candle thinks that your dentist 's teacher 's wife 's mom 's grandmother 's dentist 's husband 's sister 's dentist 's sister 's ship is helpful .	the candle works with your dentist 's teacher 's wife 's mom 's grandmother 's dentist 's husband 's sister 's dentist 's sister 's ship is helpful .
the truck knows that your grandmother 's friend 's wife 's husband 's doctor 's wife 's father 's mother 's friend 's brother 's toy is hungry .	the truck works with your grandmother 's friend 's wife 's husband 's doctor 's wife 's father 's mother 's friend 's brother 's toy is hungry .
the bag thinks that your son 's son 's doctor 's wife 's son 's wife 's wife 's grandmother 's daughter 's father 's car is busy .	the bag works with your son 's son 's doctor 's wife 's son 's wife 's wife 's grandmother 's daughter 's father 's car is busy .
the bag says that your teacher 's mom 's brother 's teacher 's teacher 's husband 's dad 's teacher 's grandmother 's wife 's door is gentle .	the bag scares your teacher 's mom 's brother 's teacher 's teacher 's husband 's dad 's teacher 's grandmother 's wife 's door is gentle .
the rug says that your daughter 's cousin 's cousin 's teacher 's cousin 's daughter 's mother 's wife 's friend 's teacher 's ring is curious .	the rug talks to your daughter 's cousin 's cousin 's teacher 's cousin 's daughter 's mother 's wife 's friend 's teacher 's ring is curious .
the bicycle thinks that your dad 's doctor 's cousin 's son 's wife 's father 's mother 's son 's dad 's sister 's crayon is tall .	the bicycle helps your dad 's doctor 's cousin 's son 's wife 's father 's mother 's son 's dad 's sister 's crayon is tall .
the boat says that your mother 's teacher 's wife 's cousin 's wife 's boss 's sister 's brother 's grandmother 's dentist 's car is wrong .	the boat helps your mother 's teacher 's wife 's cousin 's wife 's boss 's sister 's brother 's grandmother 's dentist 's car is wrong .
the book says that your son 's brother 's brother 's teacher 's dentist 's son 's wife 's daughter 's dentist 's mother 's fork is gentle .	the book helps your son 's brother 's brother 's teacher 's dentist 's son 's wife 's daughter 's dentist 's mother 's fork is gentle .
the shirt thinks that your mother 's sister 's mom 's mom 's dentist 's cousin 's mom 's doctor 's friend 's husband 's plane is boring .	the shirt scares your mother 's sister 's mom 's mom 's dentist 's cousin 's mom 's doctor 's friend 's husband 's plane is boring .
the car says that my daughter 's boss 's husband 's dentist 's brother 's doctor 's dentist 's friend 's sister 's sister 's chair is boring .	the car talks to my daughter 's boss 's husband 's dentist 's brother 's doctor 's dentist 's friend 's sister 's sister 's chair is boring .
the bag knows that your doctor 's teacher 's son 's friend 's dad 's daughter 's boss 's husband 's grandmother 's husband 's bicycle is bored .	the bag talks to your doctor 's teacher 's son 's friend 's dad 's daughter 's boss 's husband 's grandmother 's husband 's bicycle is bored .
the ship says that my husband 's daughter 's mother 's mom 's sister 's cousin 's brother 's daughter 's teacher 's dad 's window is quiet .	the ship helps my husband 's daughter 's mother 's mom 's sister 's cousin 's brother 's daughter 's teacher 's dad 's window is quiet .
the shoe says that your mother 's doctor 's dentist 's brother 's dad 's sister 's mother 's teacher 's cousin 's daughter 's spoon is clever .	the shoe works with your mother 's doctor 's dentist 's brother 's dad 's sister 's mother 's teacher 's cousin 's daughter 's spoon is clever .
the shirt knows that your son 's friend 's grandmother 's grandmother 's husband 's grandmother 's sister 's mom 's dentist 's grandmother 's glass is friendly .	the shirt scares your son 's friend 's grandmother 's grandmother 's husband 's grandmother 's sister 's mom 's dentist 's grandmother 's glass is friendly .
the chair thinks that my wife 's wife 's doctor 's wife 's friend 's sister 's husband 's father 's sister 's friend 's doll is upset .	the chair scares my wife 's wife 's doctor 's wife 's friend 's sister 's husband 's father 's sister 's friend 's doll is upset .
the dish says that my boss 's friend 's cousin 's brother 's friend 's boss 's dentist 's friend 's mom 's cousin 's bowl is friendly .	the dish talks to my boss 's friend 's cousin 's brother 's friend 's boss 's dentist 's friend 's mom 's cousin 's bowl is friendly .
the toy knows that your husband 's mother 's father 's daughter 's sister 's dad 's doctor 's dad 's grandmother 's dad 's dish is excited .	the toy scares your husband 's mother 's father 's daughter 's sister 's dad 's doctor 's dad 's grandmother 's dad 's dish is excited .
the door says that your brother 's teacher 's mom 's cousin 's son 's boss 's mom 's mother 's dentist 's boss 's door is surprised .	the door helps your brother 's teacher 's mom 's cousin 's son 's boss 's mom 's mother 's dentist 's boss 's door is surprised .
the picture knows that your dentist 's boss 's husband 's mom 's brother 's son 's son 's mother 's mom 's dentist 's bag is surprised .	the picture talks to your dentist 's boss 's husband 's mom 's brother 's son 's son 's mother 's mom 's dentist 's bag is surprised .
the mirror knows that my daughter 's daughter 's friend 's dad 's dentist 's teacher 's grandmother 's sister 's son 's sister 's bag is upset .	the mirror scares my daughter 's daughter 's friend 's dad 's dentist 's teacher 's grandmother 's sister 's son 's sister 's bag is upset .
