the ring thinks that your husband 's mom 's friend 's brother 's boss 's dad 's grandmother 's father 's mother 's hat is young .	the ring helps your husband 's mom 's friend 's brother 's boss 's dad 's grandmother 's father 's mother 's hat is young .
the candle knows that my sister 's dentist 's brother 's dentist 's son 's father 's dad 's wife 's sister 's mirror is friendly .	the candle scares my sister 's dentist 's brother 's dentist 's son 's father 's dad 's wife 's sister 's mirror is friendly .
the fork thinks that my doctor 's cousin 's cousin 's friend 's father 's son 's doctor 's teacher 's son 's bicycle is kind .	the fork helps my doctor 's cousin 's cousin 's friend 's father 's son 's doctor 's teacher 's son 's bicycle is kind .
the rocket thinks that your father 's mother 's cousin 's sister 's son 's doctor 's wife 's dentist 's grandmother 's chair is surprised .	the rocket scares your father 's mother 's cousin 's sister 's son 's doctor 's wife 's dentist 's grandmother 's chair is surprised .
the candle knows that your husband 's dentist 's sister 's teacher 's doctor 's husband 's boss 's doctor 's mom 's shoe is confused .	the candle works with your husband 's dentist 's sister 's teacher 's doctor 's husband 's boss 's doctor 's mom 's shoe is confused .
the fork says that my father 's dad 's grandmother 's daughter 's mother 's doctor 's mother 's boss 's wife 's toy is gentle .	the fork helps my father 's dad 's grandmother 's daughter 's mother 's doctor 's mother 's boss 's wife 's toy is gentle .
the spoon says that your father 's daughter 's teacher 's boss 's dentist 's doctor 's grandmother 's husband 's sister 's picture is healthy .	the spoon talks to your father 's daughter 's teacher 's boss 's dentist 's doctor 's grandmother 's husband 's sister 's picture is healthy .
the shirt says that my husband 's son 's sister 's mom 's cousin 's father 's brother 's brother 's brother 's crayon is clever .	the shirt scares my husband 's son 's sister 's mom 's cousin 's father 's brother 's brother 's brother 's crayon is clever .
the window says that my friend 's dentist 's boss 's sister 's cousin 's grandmother 's cousin 's boss 's daughter 's fork is healthy .	the window helps my friend 's dentist 's boss 's sister 's cousin 's grandmother 's cousin 's boss 's daughter 's fork is healthy .
the couch thinks that your boss 's father 's doctor 's father 's daughter 's cousin 's dad 's dad 's dad 's rocket is friendly .	the couch helps your boss 's father 's doctor 's father 's daughter 's cousin 's dad 's dad 's dad 's rocket is friendly .
the bag says that my boss 's teacher 's friend 's cousin 's mom 's sister 's father 's grandmother 's dad 's bowl is clever .	the bag scares my boss 's teacher 's friend 's cousin 's mom 's sister 's father 's grandmother 's dad 's bowl is clever .
the car thinks that my grandmother 's daughter 's brother 's grandmother 's mother 's doctor 's wife 's wife 's mom 's chair is sleepy .	the car works with my grandmother 's daughter 's brother 's grandmother 's mother 's doctor 's wife 's wife 's mom 's chair is sleepy .
the window knows that my daughter 's grandmother 's teacher 's dad 's teacher 's dentist 's dentist 's dad 's grandmother 's glass is curious .	the window helps my daughter 's grandmother 's teacher 's dad 's teacher 's dentist 's dentist 's dad 's grandmother 's glass is curious .
the chair thinks that your boss 's teacher 's husband 's mother 's dentist 's sister 's brother 's teacher 's father 's hat is nice .	the chair scares your boss 's teacher 's husband 's mother 's dentist 's sister 's brother 's teacher 's father 's hat is nice .
the spoon knows that your doctor 's cousin 's husband 's boss 's grandmother 's dentist 's husband 's dad 's sister 's mirror is clever .	the spoon talks to your doctor 's cousin 's husband 's boss 's grandmother 's dentist 's husband 's dad 's sister 's mirror is clever .
the glass says that my teacher 's cousin 's son 's mom 's teacher 's father 's doctor 's mother 's mother 's bowl is sleepy .	the glass helps my teacher 's cousin 's son 's mom 's teacher 's father 's doctor 's mother 's mother 's bowl is sleepy .
the book says that my daughter 's dentist 's son 's wife 's mom 's mom 's father 's doctor 's mom 's bowl is wrong .	the book talks to my daughter 's dentist 's son 's wife 's mom 's mom 's father 's doctor 's mom 's bowl is wrong .
the button knows that your son 's son 's boss 's daughter 's daughter 's brother 's dad 's husband 's brother 's dish is helpful .	the button talks to your son 's son 's boss 's daughter 's daughter 's brother 's dad 's husband 's brother 's dish is helpful .
the glass thinks that my teacher 's wife 's friend 's cousin 's dad 's father 's son 's mother 's friend 's book is careful .	the glass scares my teacher 's wife 's friend 's cousin 's dad 's father 's son 's mother 's friend 's book is careful .
the truck thinks that your grandmother 's dad 's dentist 's sister 's father 's friend 's doctor 's son 's husband 's crayon is happy .	the truck helps your grandmother 's dad 's dentist 's sister 's father 's friend 's doctor 's son 's husband 's crayon is happy .
the book says that my father 's boss 's father 's father 's sister 's friend 's wife 's daughter 's husband 's chair is hungry .	the book helps my father 's boss 's father 's father 's sister 's friend 's wife 's daughter 's husband 's chair is hungry .
the hat says that my wife 's mom 's mom 's mom 's son 's dad 's dentist 's teacher 's doctor 's boat is careful .	the hat scares my wife 's mom 's mom 's mom 's son 's dad 's dentist 's teacher 's doctor 's boat is careful .
the rug says that my brother 's sister 's grandmother 's husband 's father 's dentist 's cousin 's teacher 's friend 's button is friendly .	the rug talks to my brother 's sister 's grandmother 's husband 's father 's dentist 's cousin 's teacher 's friend 's button is friendly .
the door says that my son 's brother 's mom 's father 's sister 's teacher 's dad 's father 's grandmother 's truck is happy .	the door works with my son 's brother 's mom 's father 's sister 's teacher 's dad 's father 's grandmother 's truck is happy .
the rocket says that your brother 's wife 's sister 's dentist 's teacher 's grandmother 's husband 's mom 's dentist 's rocket is angry .	the rocket talks to your brother 's wife 's sister 's dentist 's teacher 's grandmother 's husband 's mom 's dentist 's rocket is angry .
the bottle says that my doctor 's sister 's husband 's wife 's doctor 's cousin 's sister 's cousin 's grandmother 's doll is sleepy .	the bottle helps my doctor 's sister 's husband 's wife 's doctor 's cousin 's sister 's cousin 's grandmother 's doll is sleepy .
the fork says that my dentist 's grandmother 's son 's sister 's grandmother 's mother 's son 's boss 's dad 's chair is curious .	the fork helps my dentist 's grandmother 's son 's sister 's grandmother 's mother 's son 's boss 's dad 's chair is curious .
the glass thinks that my mom 's mom 's father 's mom 's son 's brother 's mother 's son 's cousin 's fork is busy .	the glass scares my mom 's mom 's father 's mom 's son 's brother 's mother 's son 's cousin 's fork is busy .
the door says that my teacher 's mom 's daughter 's father 's friend 's mom 's friend 's sister 's mother 's chair is tall .	the door works with my teacher 's mom 's daughter 's father 's friend 's mom 's friend 's sister 's mother 's chair is tall .
the dish knows that my dad 's doctor 's dad 's husband 's father 's friend 's friend 's grandmother 's cousin 's truck is excited .	the dish talks to my dad 's doctor 's dad 's husband 's father 's friend 's friend 's grandmother 's cousin 's truck is excited .
the glass thinks that my brother 's grandmother 's doctor 's wife 's doctor 's son 's husband 's boss 's grandmother 's ship is careful .	the glass works with my brother 's grandmother 's doctor 's wife 's doctor 's son 's husband 's boss 's grandmother 's ship is careful .
the candle knows that your grandmother 's mother 's husband 's mom 's teacher 's cousin 's son 's dad 's dentist 's plane is wrong .	the candle talks to your grandmother 's mother 's husband 's mom 's teacher 's cousin 's son 's dad 's dentist 's plane is wrong .
the book knows that your daughter 's mother 's sister 's son 's mom 's husband 's grandmother 's mom 's son 's button is excited .	the book helps your daughter 's mother 's sister 's son 's mom 's husband 's grandmother 's mom 's son 's button is excited .
the spoon knows that your husband 's grandmother 's teacher 's wife 's wife 's boss 's dad 's teacher 's dentist 's dish is careful .	the spoon talks to your husband 's grandmother 's teacher 's wife 's wife 's boss 's dad 's teacher 's dentist 's dish is careful .
the spoon knows that my doctor 's cousin 's husband 's friend 's teacher 's sister 's friend 's husband 's teacher 's rocket is bored .	the spoon scares my doctor 's cousin 's husband 's friend 's teacher 's sister 's friend 's husband 's teacher 's rocket is bored .
the shirt knows that my brother 's grandmother 's dad 's mom 's friend 's grandmother 's friend 's dentist 's dad 's glass is curious .	the shirt talks to my brother 's grandmother 's dad 's mom 's friend 's grandmother 's friend 's dentist 's dad 's glass is curious .
the car thinks that your boss 's mom 's friend 's dad 's son 's sister 's doctor 's dad 's son 's glass is curious .	the car helps your boss 's mom 's friend 's dad 's son 's sister 's doctor 's dad 's son 's glass is curious .
the chair thinks that your friend 's cousin 's mom 's father 's wife 's wife 's mom 's boss 's cousin 's window is hungry .	the chair works with your friend 's cousin 's mom 's father 's wife 's wife 's mom 's boss 's cousin 's window is hungry .
the dish thinks that my teacher 's mother 's brother 's cousin 's cousin 's mother 's grandmother 's boss 's dad 's bed is clever .	the dish scares my teacher 's mother 's brother 's cousin 's cousin 's mother 's grandmother 's boss 's dad 's bed is clever .
the hat thinks that your husband 's wife 's sister 's daughter 's boss 's friend 's doctor 's teacher 's father 's rug is sleepy .	the hat talks to your husband 's wife 's sister 's daughter 's boss 's friend 's doctor 's teacher 's father 's rug is sleepy .
the mirror says that your wife 's father 's cousin 's doctor 's grandmother 's daughter 's wife 's cousin 's mother 's glass is confused .	the mirror talks to your wife 's father 's cousin 's doctor 's grandmother 's daughter 's wife 's cousin 's mother 's glass is confused .
the ring thinks that my doctor 's mom 's boss 's father 's brother 's sister 's husband 's friend 's grandmother 's crayon is clever .	the ring helps my doctor 's mom 's boss 's father 's brother 's sister 's husband 's friend 's grandmother 's crayon is clever .
the toy knows that my dentist 's mother 's grandmother 's brother 's boss 's friend 's husband 's father 's dad 's door is happy .	the toy helps my dentist 's mother 's grandmother 's brother 's boss 's friend 's husband 's father 's dad 's door is happy .
the car thinks that your dad 's dentist 's wife 's friend 's cousin 's doctor 's friend 's dentist 's friend 's door is clever .	the car scares your dad 's dentist 's wife 's friend 's cousin 's doctor 's friend 's dentist 's friend 's door is clever .
the window knows that your son 's daughter 's dentist 's boss 's boss 's mom 's boss 's son 's dad 's shoe is surprised .	the window works with your son 's daughter 's dentist 's boss 's boss 's mom 's boss 's son 's dad 's shoe is surprised .
the ship thinks that my sister 's husband 's sister 's sister 's cousin 's mother 's father 's cousin 's father 's ship is nice .	the ship talks to my sister 's husband 's sister 's sister 's cousin 's mother 's father 's cousin 's father 's ship is nice .
the book thinks that my mom 's wife 's father 's boss 's mother 's father 's friend 's son 's daughter 's boat is hungry .	the book helps my mom 's wife 's father 's boss 's mother 's father 's friend 's son 's daughter 's boat is hungry .
the candle says that your sister 's teacher 's grandmother 's mom 's friend 's sister 's son 's doctor 's husband 's hat is excited .	the candle helps your sister 's teacher 's grandmother 's mom 's friend 's sister 's son 's doctor 's husband 's hat is excited .
the window thinks that my father 's doctor 's mother 's doctor 's friend 's brother 's dentist 's son 's son 's bag is careful .	the window talks to my father 's doctor 's mother 's doctor 's friend 's brother 's dentist 's son 's son 's bag is careful .
the rocket thinks that your sister 's mother 's daughter 's doctor 's brother 's dentist 's dad 's mom 's friend 's car is young .	the rocket scares your sister 's mother 's daughter 's doctor 's brother 's dentist 's dad 's mom 's friend 's car is young .
the shoe knows that my dad 's brother 's mom 's father 's friend 's boss 's son 's dentist 's sister 's ring is healthy .	the shoe works with my dad 's brother 's mom 's father 's friend 's boss 's son 's dentist 's sister 's ring is healthy .
the picture thinks that my cousin 's dad 's mom 's dentist 's dentist 's dentist 's doctor 's dad 's son 's rug is bored .	the picture talks to my cousin 's dad 's mom 's dentist 's dentist 's dentist 's doctor 's dad 's son 's rug is bored .
the bottle thinks that my wife 's dentist 's teacher 's sister 's father 's daughter 's boss 's dentist 's mom 's book is tired .	the bottle works with my wife 's dentist 's teacher 's sister 's father 's daughter 's boss 's dentist 's mom 's book is tired .
the doll knows that your husband 's mother 's sister 's husband 's wife 's boss 's boss 's dad 's mom 's bag is quiet .	the doll talks to your husband 's mother 's sister 's husband 's wife 's boss 's boss 's dad 's mom 's bag is quiet .
the crayon says that your daughter 's grandmother 's teacher 's boss 's sister 's wife 's son 's son 's brother 's car is upset .	the crayon helps your daughter 's grandmother 's teacher 's boss 's sister 's wife 's son 's son 's brother 's car is upset .
the couch knows that your sister 's husband 's dad 's teacher 's cousin 's doctor 's dad 's grandmother 's doctor 's ring is lucky .	the couch scares your sister 's husband 's dad 's teacher 's cousin 's doctor 's dad 's grandmother 's doctor 's ring is lucky .
the toy knows that my brother 's grandmother 's mother 's son 's dad 's son 's sister 's dentist 's dentist 's bed is gentle .	the toy scares my brother 's grandmother 's mother 's son 's dad 's son 's sister 's dentist 's dentist 's bed is gentle .
the chair knows that my father 's son 's daughter 's wife 's dentist 's boss 's dad 's son 's doctor 's glass is young .	the chair helps my father 's son 's daughter 's wife 's dentist 's boss 's dad 's son 's doctor 's glass is young .
the picture knows that my husband 's brother 's mom 's cousin 's sister 's husband 's cousin 's doctor 's sister 's couch is hungry .	the picture helps my husband 's brother 's mom 's cousin 's sister 's husband 's cousin 's doctor 's sister 's couch is hungry .
the book says that my husband 's boss 's mother 's mom 's husband 's friend 's mother 's daughter 's daughter 's bottle is friendly .	the book talks to my husband 's boss 's mother 's mom 's husband 's friend 's mother 's daughter 's daughter 's bottle is friendly .
the car thinks that my dentist 's boss 's cousin 's husband 's son 's cousin 's sister 's daughter 's husband 's doll is happy .	the car works with my dentist 's boss 's cousin 's husband 's son 's cousin 's sister 's daughter 's husband 's doll is happy .
the shirt thinks that your dad 's friend 's cousin 's boss 's dentist 's mother 's cousin 's daughter 's father 's glass is careful .	the shirt scares your dad 's friend 's cousin 's boss 's dentist 's mother 's cousin 's daughter 's father 's glass is careful .
the rug knows that my mom 's father 's wife 's friend 's husband 's mother 's son 's wife 's grandmother 's couch is curious .	the rug helps my mom 's father 's wife 's friend 's husband 's mother 's son 's wife 's grandmother 's couch is curious .
the shoe says that your grandmother 's son 's father 's cousin 's mother 's father 's doctor 's brother 's boss 's dish is tall .	the shoe talks to your grandmother 's son 's father 's cousin 's mother 's father 's doctor 's brother 's boss 's dish is tall .
the spoon knows that your wife 's cousin 's mom 's boss 's teacher 's daughter 's sister 's wife 's doctor 's doll is friendly .	the spoon talks to your wife 's cousin 's mom 's boss 's teacher 's daughter 's sister 's wife 's doctor 's doll is friendly .
the glass says that your friend 's mom 's boss 's wife 's son 's dentist 's cousin 's mom 's mother 's book is angry .	the glass talks to your friend 's mom 's boss 's wife 's son 's dentist 's cousin 's mom 's mother 's book is angry .
the ship says that your doctor 's wife 's mother 's friend 's husband 's mom 's boss 's daughter 's teacher 's boat is confused .	the ship scares your doctor 's wife 's mother 's friend 's husband 's mom 's boss 's daughter 's teacher 's boat is confused .
the shirt knows that my cousin 's boss 's mom 's cousin 's sister 's daughter 's grandmother 's dad 's boss 's book is young .	the shirt works with my cousin 's boss 's mom 's cousin 's sister 's daughter 's grandmother 's dad 's boss 's book is young .
the bowl thinks that my grandmother 's dentist 's friend 's father 's cousin 's cousin 's son 's mom 's grandmother 's window is excited .	the bowl talks to my grandmother 's dentist 's friend 's father 's cousin 's cousin 's son 's mom 's grandmother 's window is excited .
the candle thinks that my grandmother 's doctor 's dentist 's friend 's mom 's friend 's grandmother 's dad 's doctor 's ring is helpful .	the candle works with my grandmother 's doctor 's dentist 's friend 's mom 's friend 's grandmother 's dad 's doctor 's ring is helpful .
the bed says that your sister 's boss 's mom 's daughter 's mom 's grandmother 's grandmother 's daughter 's cousin 's picture is boring .	the bed scares your sister 's boss 's mom 's daughter 's mom 's grandmother 's grandmother 's daughter 's cousin 's picture is boring .
the dish thinks that your husband 's teacher 's dad 's husband 's boss 's dad 's grandmother 's mother 's friend 's crayon is confused .	the dish scares your husband 's teacher 's dad 's husband 's boss 's dad 's grandmother 's mother 's friend 's crayon is confused .
the bed knows that my daughter 's grandmother 's boss 's daughter 's husband 's grandmother 's grandmother 's daughter 's grandmother 's chair is strong .	the bed talks to my daughter 's grandmother 's boss 's daughter 's husband 's grandmother 's grandmother 's daughter 's grandmother 's chair is strong .
the toy thinks that my wife 's mom 's mother 's sister 's sister 's brother 's daughter 's mother 's grandmother 's book is gentle .	the toy works with my wife 's mom 's mother 's sister 's sister 's brother 's daughter 's mother 's grandmother 's book is gentle .
the rug thinks that your grandmother 's mother 's grandmother 's brother 's dentist 's wife 's cousin 's teacher 's dad 's book is boring .	the rug helps your grandmother 's mother 's grandmother 's brother 's dentist 's wife 's cousin 's teacher 's dad 's book is boring .
the box thinks that my daughter 's mom 's doctor 's wife 's father 's daughter 's wife 's dentist 's doctor 's shoe is bored .	the box helps my daughter 's mom 's doctor 's wife 's father 's daughter 's wife 's dentist 's doctor 's shoe is bored .
the shoe knows that my brother 's wife 's doctor 's brother 's dad 's dentist 's doctor 's doctor 's wife 's truck is upset .	the shoe helps my brother 's wife 's doctor 's brother 's dad 's dentist 's doctor 's doctor 's wife 's truck is upset .
the ring says that your wife 's son 's dentist 's dad 's mother 's grandmother 's daughter 's daughter 's husband 's glass is kind .	the ring helps your wife 's son 's dentist 's dad 's mother 's grandmother 's daughter 's daughter 's husband 's glass is kind .
the plane thinks that your teacher 's son 's teacher 's mom 's dad 's teacher 's brother 's friend 's grandmother 's toy is tired .	the plane works with your teacher 's son 's teacher 's mom 's dad 's teacher 's brother 's friend 's grandmother 's toy is tired .
the bed says that your daughter 's friend 's husband 's mother 's sister 's grandmother 's cousin 's brother 's grandmother 's fork is kind .	the bed works with your daughter 's friend 's husband 's mother 's sister 's grandmother 's cousin 's brother 's grandmother 's fork is kind .
the couch thinks that my teacher 's teacher 's doctor 's dad 's sister 's husband 's teacher 's husband 's father 's ring is quiet .	the couch scares my teacher 's teacher 's doctor 's dad 's sister 's husband 's teacher 's husband 's father 's ring is quiet .
the bicycle knows that your boss 's husband 's dad 's dad 's doctor 's cousin 's son 's teacher 's dad 's book is tired .	the bicycle works with your boss 's husband 's dad 's dad 's doctor 's cousin 's son 's teacher 's dad 's book is tired .
the bowl knows that my dentist 's brother 's doctor 's daughter 's mom 's father 's boss 's doctor 's teacher 's plate is boring .	the bowl works with my dentist 's brother 's doctor 's daughter 's mom 's father 's boss 's doctor 's teacher 's plate is boring .
the book thinks that my father 's husband 's daughter 's brother 's friend 's mother 's dentist 's brother 's grandmother 's chair is boring .	the book works with my father 's husband 's daughter 's brother 's friend 's mother 's dentist 's brother 's grandmother 's chair is boring .
the mirror says that my mom 's sister 's teacher 's doctor 's dad 's grandmother 's husband 's daughter 's dad 's car is smart .	the mirror scares my mom 's sister 's teacher 's doctor 's dad 's grandmother 's husband 's daughter 's dad 's car is smart .
the shirt thinks that my friend 's husband 's doctor 's boss 's daughter 's brother 's cousin 's dentist 's husband 's bowl is happy .	the shirt works with my friend 's husband 's doctor 's boss 's daughter 's brother 's cousin 's dentist 's husband 's bowl is happy .
the car thinks that my mother 's dad 's husband 's mother 's boss 's wife 's mom 's sister 's dad 's spoon is tired .	the car helps my mother 's dad 's husband 's mother 's boss 's wife 's mom 's sister 's dad 's spoon is tired .
the fork knows that my boss 's sister 's husband 's father 's friend 's grandmother 's wife 's wife 's brother 's shirt is quiet .	the fork works with my boss 's sister 's husband 's father 's friend 's grandmother 's wife 's wife 's brother 's shirt is quiet .
the cup knows that my father 's husband 's cousin 's cousin 's son 's grandmother 's doctor 's mom 's dad 's picture is boring .	the cup helps my father 's husband 's cousin 's cousin 's son 's grandmother 's doctor 's mom 's dad 's picture is boring .
the rocket knows that your friend 's son 's boss 's cousin 's son 's father 's husband 's teacher 's cousin 's door is nice .	the rocket works with your friend 's son 's boss 's cousin 's son 's father 's husband 's teacher 's cousin 's door is nice .
the bed thinks that your dentist 's friend 's teacher 's brother 's boss 's boss 's brother 's cousin 's mom 's toy is upset .	the bed scares your dentist 's friend 's teacher 's brother 's boss 's boss 's brother 's cousin 's mom 's toy is upset .
the ship knows that my brother 's mother 's cousin 's doctor 's dad 's dentist 's sister 's son 's cousin 's crayon is curious .	the ship scares my brother 's mother 's cousin 's doctor 's dad 's dentist 's sister 's son 's cousin 's crayon is curious .
the hat knows that your boss 's teacher 's wife 's cousin 's husband 's sister 's cousin 's dentist 's doctor 's toy is tall .	the hat helps your boss 's teacher 's wife 's cousin 's husband 's sister 's cousin 's dentist 's doctor 's toy is tall .
the window thinks that your teacher 's mom 's cousin 's teacher 's father 's dad 's father 's brother 's cousin 's cup is curious .	the window works with your teacher 's mom 's cousin 's teacher 's father 's dad 's father 's brother 's cousin 's cup is curious .
the plane thinks that your son 's daughter 's doctor 's cousin 's boss 's grandmother 's grandmother 's doctor 's wife 's box is clever .	the plane works with your son 's daughter 's doctor 's cousin 's boss 's grandmother 's grandmother 's doctor 's wife 's box is clever .
the bicycle thinks that your husband 's grandmother 's sister 's mother 's sister 's daughter 's friend 's mom 's mom 's button is quiet .	the bicycle talks to your husband 's grandmother 's sister 's mother 's sister 's daughter 's friend 's mom 's mom 's button is quiet .
the ring knows that my father 's wife 's mother 's mom 's doctor 's sister 's grandmother 's friend 's mom 's plate is careful .	the ring talks to my father 's wife 's mother 's mom 's doctor 's sister 's grandmother 's friend 's mom 's plate is careful .
the truck says that your father 's mom 's sister 's daughter 's friend 's doctor 's dad 's grandmother 's dad 's truck is excited .	the truck talks to your father 's mom 's sister 's daughter 's friend 's doctor 's dad 's grandmother 's dad 's truck is excited .
the chair says that your grandmother 's grandmother 's sister 's wife 's mother 's dentist 's grandmother 's husband 's daughter 's dish is confused .	the chair scares your grandmother 's grandmother 's sister 's wife 's mother 's dentist 's grandmother 's husband 's daughter 's dish is confused .
the crayon knows that your son 's teacher 's doctor 's dentist 's husband 's son 's mom 's husband 's grandmother 's car is tall .	the crayon helps your son 's teacher 's doctor 's dentist 's husband 's son 's mom 's husband 's grandmother 's car is tall .
