the car knows that my father 's mom 's doctor 's dentist 's doctor 's dad 's boss 's dentist 's teacher 's mother 's shirt is sleepy .	the car works with my father 's mom 's doctor 's dentist 's doctor 's dad 's boss 's dentist 's teacher 's mother 's shirt is sleepy .
the cup says that my brother 's husband 's cousin 's friend 's boss 's friend 's dad 's father 's mother 's dentist 's shoe is important .	the cup scares my brother 's husband 's cousin 's friend 's boss 's friend 's dad 's father 's mother 's dentist 's shoe is important .
the hat thinks that your mother 's teacher 's dad 's husband 's daughter 's mother 's son 's mom 's grandmother 's mom 's ring is happy .	the hat talks to your mother 's teacher 's dad 's husband 's daughter 's mother 's son 's mom 's grandmother 's mom 's ring is happy .
the dish says that my father 's dad 's wife 's doctor 's dad 's grandmother 's mom 's teacher 's dad 's dentist 's box is hungry .	the dish scares my father 's dad 's wife 's doctor 's dad 's grandmother 's mom 's teacher 's dad 's dentist 's box is hungry .
the car thinks that my father 's dentist 's wife 's teacher 's dentist 's mother 's boss 's teacher 's sister 's boss 's door is sleepy .	the car helps my father 's dentist 's wife 's teacher 's dentist 's mother 's boss 's teacher 's sister 's boss 's door is sleepy .
the truck knows that my dentist 's teacher 's mom 's son 's mom 's friend 's son 's mother 's cousin 's grandmother 's picture is nice .	the truck scares my dentist 's teacher 's mom 's son 's mom 's friend 's son 's mother 's cousin 's grandmother 's picture is nice .
the box knows that my husband 's husband 's mother 's wife 's sister 's son 's boss 's mom 's dentist 's mom 's bed is hungry .	the box talks to my husband 's husband 's mother 's wife 's sister 's son 's boss 's mom 's dentist 's mom 's bed is hungry .
the candle says that your brother 's sister 's husband 's mother 's mom 's cousin 's daughter 's mom 's dentist 's mother 's doll is sleepy .	the candle scares your brother 's sister 's husband 's mother 's mom 's cousin 's daughter 's mom 's dentist 's mother 's doll is sleepy .
the picture knows that my friend 's grandmother 's dentist 's brother 's cousin 's husband 's cousin 's dentist 's cousin 's dentist 's plate is curious .	the picture scares my friend 's grandmother 's dentist 's brother 's cousin 's husband 's cousin 's dentist 's cousin 's dentist 's plate is curious .
the hat thinks that your sister 's dentist 's friend 's brother 's wife 's father 's dad 's father 's mom 's cousin 's rug is smart .	the hat talks to your sister 's dentist 's friend 's brother 's wife 's father 's dad 's father 's mom 's cousin 's rug is smart .
the book says that your dad 's mother 's daughter 's son 's wife 's husband 's husband 's friend 's mom 's husband 's truck is careful .	the book helps your dad 's mother 's daughter 's son 's wife 's husband 's husband 's friend 's mom 's husband 's truck is careful .
the bottle knows that your daughter 's husband 's grandmother 's mom 's doctor 's boss 's teacher 's teacher 's wife 's sister 's spoon is young .	the bottle helps your daughter 's husband 's grandmother 's mom 's doctor 's boss 's teacher 's teacher 's wife 's sister 's spoon is young .
the book says that your mother 's friend 's boss 's dentist 's dentist 's teacher 's boss 's mother 's daughter 's daughter 's button is boring .	the book talks to your mother 's friend 's boss 's dentist 's dentist 's teacher 's boss 's mother 's daughter 's daughter 's button is boring .
the plate knows that my brother 's father 's sister 's teacher 's sister 's wife 's mother 's son 's boss 's dad 's bag is happy .	the plate works with my brother 's father 's sister 's teacher 's sister 's wife 's mother 's son 's boss 's dad 's bag is happy .
the glass thinks that your son 's dentist 's friend 's teacher 's mother 's husband 's grandmother 's mom 's friend 's mom 's window is careful .	the glass scares your son 's dentist 's friend 's teacher 's mother 's husband 's grandmother 's mom 's friend 's mom 's window is careful .
the book knows that my cousin 's brother 's wife 's doctor 's grandmother 's daughter 's dad 's grandmother 's wife 's father 's bicycle is strong .	the book scares my cousin 's brother 's wife 's doctor 's grandmother 's daughter 's dad 's grandmother 's wife 's father 's bicycle is strong .
the bottle says that my mom 's son 's brother 's sister 's son 's mom 's mom 's friend 's mother 's mom 's shirt is healthy .	the bottle works with my mom 's son 's brother 's sister 's son 's mom 's mom 's friend 's mother 's mom 's shirt is healthy .
the candle says that my wife 's dad 's dad 's dentist 's father 's boss 's sister 's doctor 's sister 's boss 's book is bored .	the candle helps my wife 's dad 's dad 's dentist 's father 's boss 's sister 's doctor 's sister 's boss 's book is bored .
the bag knows that my mother 's grandmother 's grandmother 's grandmother 's son 's daughter 's grandmother 's husband 's sister 's dentist 's car is healthy .	the bag scares my mother 's grandmother 's grandmother 's grandmother 's son 's daughter 's grandmother 's husband 's sister 's dentist 's car is healthy .
the shirt knows that your brother 's dad 's teacher 's dentist 's teacher 's daughter 's sister 's mother 's wife 's dad 's boat is healthy .	the shirt helps your brother 's dad 's teacher 's dentist 's teacher 's daughter 's sister 's mother 's wife 's dad 's boat is healthy .
the dish thinks that my sister 's mother 's cousin 's teacher 's boss 's teacher 's wife 's daughter 's friend 's wife 's boat is happy .	the dish scares my sister 's mother 's cousin 's teacher 's boss 's teacher 's wife 's daughter 's friend 's wife 's boat is happy .
the boat says that my mother 's boss 's wife 's cousin 's cousin 's mother 's boss 's grandmother 's dentist 's doctor 's bicycle is tired .	the boat talks to my mother 's boss 's wife 's cousin 's cousin 's mother 's boss 's grandmother 's dentist 's doctor 's bicycle is tired .
the book thinks that my dad 's wife 's mother 's dentist 's grandmother 's daughter 's mom 's father 's doctor 's cousin 's couch is tall .	the book helps my dad 's wife 's mother 's dentist 's grandmother 's daughter 's mom 's father 's doctor 's cousin 's couch is tall .
the chair says that my mother 's dentist 's doctor 's cousin 's mom 's grandmother 's father 's daughter 's doctor 's cousin 's bed is smart .	the chair scares my mother 's dentist 's doctor 's cousin 's mom 's grandmother 's father 's daughter 's doctor 's cousin 's bed is smart .
the candle thinks that my boss 's boss 's cousin 's mom 's friend 's wife 's teacher 's cousin 's grandmother 's teacher 's boat is kind .	the candle talks to my boss 's boss 's cousin 's mom 's friend 's wife 's teacher 's cousin 's grandmother 's teacher 's boat is kind .
the shoe thinks that your doctor 's teacher 's doctor 's father 's brother 's mother 's brother 's dentist 's cousin 's wife 's plate is confused .	the shoe helps your doctor 's teacher 's doctor 's father 's brother 's mother 's brother 's dentist 's cousin 's wife 's plate is confused .
the mirror knows that your mom 's husband 's mom 's sister 's son 's dentist 's teacher 's sister 's daughter 's sister 's plane is strong .	the mirror scares your mom 's husband 's mom 's sister 's son 's dentist 's teacher 's sister 's daughter 's sister 's plane is strong .
the bowl says that my mother 's mom 's husband 's brother 's husband 's teacher 's sister 's doctor 's mom 's sister 's doll is angry .	the bowl works with my mother 's mom 's husband 's brother 's husband 's teacher 's sister 's doctor 's mom 's sister 's doll is angry .
the fork knows that your wife 's father 's brother 's daughter 's son 's mother 's father 's teacher 's husband 's friend 's ring is helpful .	the fork talks to your wife 's father 's brother 's daughter 's son 's mother 's father 's teacher 's husband 's friend 's ring is helpful .
the doll knows that my boss 's friend 's grandmother 's daughter 's dad 's doctor 's mom 's father 's doctor 's father 's spoon is boring .	the doll talks to my boss 's friend 's grandmother 's daughter 's dad 's doctor 's mom 's father 's doctor 's father 's spoon is boring .
the picture says that my daughter 's father 's mother 's mother 's father 's teacher 's mom 's boss 's mother 's boss 's hat is happy .	the picture works with my daughter 's father 's mother 's mother 's father 's teacher 's mom 's boss 's mother 's boss 's hat is happy .
the candle knows that my son 's mom 's teacher 's dad 's mom 's dentist 's mom 's sister 's dentist 's daughter 's bottle is busy .	the candle works with my son 's mom 's teacher 's dad 's mom 's dentist 's mom 's sister 's dentist 's daughter 's bottle is busy .
the chair thinks that my father 's father 's mom 's son 's mom 's daughter 's teacher 's mom 's cousin 's friend 's truck is quiet .	the chair scares my father 's father 's mom 's son 's mom 's daughter 's teacher 's mom 's cousin 's friend 's truck is quiet .
the door knows that your brother 's boss 's dad 's dad 's dentist 's husband 's teacher 's cousin 's wife 's sister 's mirror is strong .	the door scares your brother 's boss 's dad 's dad 's dentist 's husband 's teacher 's cousin 's wife 's sister 's mirror is strong .
the plate knows that your mom 's mom 's mother 's grandmother 's father 's sister 's son 's wife 's boss 's sister 's hat is tall .	the plate talks to your mom 's mom 's mother 's grandmother 's father 's sister 's son 's wife 's boss 's sister 's hat is tall .
the crayon thinks that your son 's friend 's cousin 's doctor 's sister 's dad 's teacher 's dentist 's cousin 's husband 's book is kind .	the crayon talks to your son 's friend 's cousin 's doctor 's sister 's dad 's teacher 's dentist 's cousin 's husband 's book is kind .
the fork says that my daughter 's mother 's husband 's wife 's boss 's friend 's brother 's sister 's friend 's grandmother 's cup is boring .	the fork helps my daughter 's mother 's husband 's wife 's boss 's friend 's brother 's sister 's friend 's grandmother 's cup is boring .
the crayon thinks that my friend 's husband 's daughter 's doctor 's brother 's mom 's father 's husband 's father 's dentist 's window is wrong .	the crayon talks to my friend 's husband 's daughter 's doctor 's brother 's mom 's father 's husband 's father 's dentist 's window is wrong .
the dish thinks that your mother 's dentist 's brother 's dad 's mom 's husband 's grandmother 's mom 's grandmother 's son 's shoe is upset .	the dish works with your mother 's dentist 's brother 's dad 's mom 's husband 's grandmother 's mom 's grandmother 's son 's shoe is upset .
the mirror says that your son 's doctor 's dad 's dentist 's brother 's teacher 's mother 's cousin 's mom 's daughter 's fork is careful .	the mirror works with your son 's doctor 's dad 's dentist 's brother 's teacher 's mother 's cousin 's mom 's daughter 's fork is careful .
the glass knows that my brother 's boss 's doctor 's dad 's friend 's wife 's brother 's boss 's brother 's wife 's bed is young .	the glass helps my brother 's boss 's doctor 's dad 's friend 's wife 's brother 's boss 's brother 's wife 's bed is young .
the couch knows that my boss 's wife 's father 's brother 's husband 's son 's grandmother 's boss 's dentist 's cousin 's shirt is important .	the couch helps my boss 's wife 's father 's brother 's husband 's son 's grandmother 's boss 's dentist 's cousin 's shirt is important .
the box knows that your friend 's doctor 's dentist 's teacher 's sister 's son 's mom 's doctor 's cousin 's son 's mirror is wrong .	the box works with your friend 's doctor 's dentist 's teacher 's sister 's son 's mom 's doctor 's cousin 's son 's mirror is wrong .
the shoe knows that your father 's cousin 's grandmother 's mom 's grandmother 's friend 's dad 's dentist 's dentist 's friend 's bicycle is excited .	the shoe scares your father 's cousin 's grandmother 's mom 's grandmother 's friend 's dad 's dentist 's dentist 's friend 's bicycle is excited .
the toy says that my dad 's husband 's mom 's boss 's brother 's dentist 's cousin 's husband 's daughter 's doctor 's bowl is strong .	the toy scares my dad 's husband 's mom 's boss 's brother 's dentist 's cousin 's husband 's daughter 's doctor 's bowl is strong .
the bowl thinks that my mother 's son 's mom 's boss 's doctor 's son 's son 's grandmother 's mother 's son 's ring is boring .	the bowl helps my mother 's son 's mom 's boss 's doctor 's son 's son 's grandmother 's mother 's son 's ring is boring .
the glass thinks that your boss 's doctor 's boss 's grandmother 's sister 's daughter 's husband 's mother 's sister 's sister 's car is boring .	the glass scares your boss 's doctor 's boss 's grandmother 's sister 's daughter 's husband 's mother 's sister 's sister 's car is boring .
the bag knows that my brother 's teacher 's boss 's father 's daughter 's son 's grandmother 's cousin 's son 's son 's bed is young .	the bag scares my brother 's teacher 's boss 's father 's daughter 's son 's grandmother 's cousin 's son 's son 's bed is young .
the rug knows that your teacher 's father 's friend 's boss 's mom 's wife 's husband 's mother 's grandmother 's husband 's shirt is gentle .	the rug talks to your teacher 's father 's friend 's boss 's mom 's wife 's husband 's mother 's grandmother 's husband 's shirt is gentle .
the glass thinks that my grandmother 's sister 's boss 's doctor 's dad 's sister 's doctor 's boss 's cousin 's friend 's bowl is nice .	the glass scares my grandmother 's sister 's boss 's doctor 's dad 's sister 's doctor 's boss 's cousin 's friend 's bowl is nice .
the candle says that my father 's daughter 's doctor 's boss 's sister 's teacher 's daughter 's boss 's mother 's boss 's button is important .	the candle helps my father 's daughter 's doctor 's boss 's sister 's teacher 's daughter 's boss 's mother 's boss 's button is important .
the bottle thinks that your son 's sister 's dad 's father 's grandmother 's friend 's husband 's cousin 's daughter 's husband 's car is young .	the bottle works with your son 's sister 's dad 's father 's grandmother 's friend 's husband 's cousin 's daughter 's husband 's car is young .
the dish says that your dentist 's mother 's mom 's doctor 's daughter 's grandmother 's sister 's brother 's cousin 's dentist 's plate is curious .	the dish scares your dentist 's mother 's mom 's doctor 's daughter 's grandmother 's sister 's brother 's cousin 's dentist 's plate is curious .
the car knows that your dentist 's teacher 's husband 's mother 's doctor 's mom 's cousin 's cousin 's boss 's cousin 's picture is quiet .	the car works with your dentist 's teacher 's husband 's mother 's doctor 's mom 's cousin 's cousin 's boss 's cousin 's picture is quiet .
the bicycle thinks that your wife 's mom 's teacher 's husband 's wife 's boss 's brother 's brother 's wife 's sister 's truck is angry .	the bicycle helps your wife 's mom 's teacher 's husband 's wife 's boss 's brother 's brother 's wife 's sister 's truck is angry .
the mirror knows that your cousin 's son 's friend 's grandmother 's friend 's dad 's mother 's daughter 's brother 's wife 's picture is boring .	the mirror scares your cousin 's son 's friend 's grandmother 's friend 's dad 's mother 's daughter 's brother 's wife 's picture is boring .
the bag thinks that your father 's grandmother 's daughter 's teacher 's cousin 's doctor 's daughter 's teacher 's dentist 's mother 's picture is quiet .	the bag works with your father 's grandmother 's daughter 's teacher 's cousin 's doctor 's daughter 's teacher 's dentist 's mother 's picture is quiet .
the picture knows that my husband 's mother 's father 's brother 's husband 's cousin 's mother 's daughter 's doctor 's wife 's ring is kind .	the picture scares my husband 's mother 's father 's brother 's husband 's cousin 's mother 's daughter 's doctor 's wife 's ring is kind .
the rug thinks that your dad 's brother 's grandmother 's mom 's boss 's dentist 's father 's brother 's brother 's sister 's fork is important .	the rug talks to your dad 's brother 's grandmother 's mom 's boss 's dentist 's father 's brother 's brother 's sister 's fork is important .
the ship thinks that your sister 's grandmother 's doctor 's sister 's mother 's cousin 's sister 's boss 's dentist 's cousin 's toy is confused .	the ship talks to your sister 's grandmother 's doctor 's sister 's mother 's cousin 's sister 's boss 's dentist 's cousin 's toy is confused .
the ring says that your mother 's daughter 's brother 's teacher 's dentist 's teacher 's daughter 's friend 's dentist 's dad 's car is tall .	the ring talks to your mother 's daughter 's brother 's teacher 's dentist 's teacher 's daughter 's friend 's dentist 's dad 's car is tall .
the rug says that my grandmother 's mom 's friend 's grandmother 's grandmother 's doctor 's father 's mom 's husband 's wife 's button is smart .	the rug scares my grandmother 's mom 's friend 's grandmother 's grandmother 's doctor 's father 's mom 's husband 's wife 's button is smart .
the truck says that your daughter 's doctor 's doctor 's grandmother 's wife 's sister 's sister 's doctor 's sister 's dentist 's chair is gentle .	the truck works with your daughter 's doctor 's doctor 's grandmother 's wife 's sister 's sister 's doctor 's sister 's dentist 's chair is gentle .
the ring knows that your friend 's boss 's cousin 's brother 's dentist 's boss 's wife 's husband 's boss 's cousin 's rocket is friendly .	the ring scares your friend 's boss 's cousin 's brother 's dentist 's boss 's wife 's husband 's boss 's cousin 's rocket is friendly .
the plate knows that my doctor 's sister 's sister 's father 's father 's brother 's wife 's mom 's dentist 's sister 's book is important .	the plate scares my doctor 's sister 's sister 's father 's father 's brother 's wife 's mom 's dentist 's sister 's book is important .
the hat says that your friend 's boss 's cousin 's husband 's grandmother 's dentist 's friend 's mother 's daughter 's cousin 's ship is healthy .	the hat scares your friend 's boss 's cousin 's husband 's grandmother 's dentist 's friend 's mother 's daughter 's cousin 's ship is healthy .
the doll thinks that your brother 's father 's sister 's father 's grandmother 's daughter 's husband 's daughter 's boss 's mother 's picture is excited .	the doll scares your brother 's father 's sister 's father 's grandmother 's daughter 's husband 's daughter 's boss 's mother 's picture is excited .
the fork knows that your brother 's brother 's daughter 's mother 's mom 's doctor 's dentist 's sister 's father 's teacher 's bicycle is smart .	the fork works with your brother 's brother 's daughter 's mother 's mom 's doctor 's dentist 's sister 's father 's teacher 's bicycle is smart .
the doll thinks that my mom 's mother 's sister 's teacher 's mother 's teacher 's sister 's friend 's wife 's grandmother 's car is friendly .	the doll works with my mom 's mother 's sister 's teacher 's mother 's teacher 's sister 's friend 's wife 's grandmother 's car is friendly .
the truck says that my daughter 's wife 's cousin 's dad 's grandmother 's wife 's dad 's cousin 's cousin 's son 's ring is lucky .	the truck scares my daughter 's wife 's cousin 's dad 's grandmother 's wife 's dad 's cousin 's cousin 's son 's ring is lucky .
the picture says that your daughter 's sister 's mother 's boss 's teacher 's mom 's mother 's daughter 's dentist 's father 's mirror is curious .	the picture talks to your daughter 's sister 's mother 's boss 's teacher 's mom 's mother 's daughter 's dentist 's father 's mirror is curious .
the car knows that my teacher 's daughter 's sister 's mom 's dad 's doctor 's teacher 's dad 's husband 's mom 's picture is tall .	the car helps my teacher 's daughter 's sister 's mom 's dad 's doctor 's teacher 's dad 's husband 's mom 's picture is tall .
the crayon thinks that my sister 's doctor 's brother 's son 's son 's wife 's sister 's brother 's sister 's doctor 's boat is clever .	the crayon talks to my sister 's doctor 's brother 's son 's son 's wife 's sister 's brother 's sister 's doctor 's boat is clever .
the truck says that your dad 's boss 's sister 's husband 's son 's brother 's doctor 's cousin 's friend 's grandmother 's book is hungry .	the truck scares your dad 's boss 's sister 's husband 's son 's brother 's doctor 's cousin 's friend 's grandmother 's book is hungry .
the ship knows that my grandmother 's wife 's brother 's dentist 's teacher 's boss 's teacher 's wife 's grandmother 's mother 's doll is careful .	the ship works with my grandmother 's wife 's brother 's dentist 's teacher 's boss 's teacher 's wife 's grandmother 's mother 's doll is careful .
the rug says that your father 's wife 's mother 's wife 's cousin 's mom 's mom 's sister 's friend 's mom 's doll is sleepy .	the rug helps your father 's wife 's mother 's wife 's cousin 's mom 's mom 's sister 's friend 's mom 's doll is sleepy .
the bag thinks that my daughter 's boss 's dad 's mom 's mother 's friend 's teacher 's mom 's sister 's wife 's door is happy .	the bag talks to my daughter 's boss 's dad 's mom 's mother 's friend 's teacher 's mom 's sister 's wife 's door is happy .
the crayon knows that my doctor 's father 's father 's mother 's dad 's friend 's brother 's friend 's mom 's wife 's rocket is helpful .	the crayon helps my doctor 's father 's father 's mother 's dad 's friend 's brother 's friend 's mom 's wife 's rocket is helpful .
the bicycle says that your friend 's brother 's wife 's dad 's mom 's daughter 's friend 's wife 's husband 's sister 's ship is tired .	the bicycle scares your friend 's brother 's wife 's dad 's mom 's daughter 's friend 's wife 's husband 's sister 's ship is tired .
the fork thinks that your grandmother 's husband 's father 's boss 's son 's brother 's teacher 's friend 's father 's friend 's bottle is tall .	the fork helps your grandmother 's husband 's father 's boss 's son 's brother 's teacher 's friend 's father 's friend 's bottle is tall .
the rug knows that my dentist 's mom 's mother 's doctor 's boss 's cousin 's teacher 's dad 's cousin 's father 's book is boring .	the rug helps my dentist 's mom 's mother 's doctor 's boss 's cousin 's teacher 's dad 's cousin 's father 's book is boring .
the bicycle says that my husband 's dad 's wife 's wife 's cousin 's father 's father 's doctor 's mother 's grandmother 's plane is smart .	the bicycle scares my husband 's dad 's wife 's wife 's cousin 's father 's father 's doctor 's mother 's grandmother 's plane is smart .
the ring says that my dad 's sister 's sister 's brother 's friend 's boss 's dentist 's teacher 's brother 's friend 's ring is friendly .	the ring talks to my dad 's sister 's sister 's brother 's friend 's boss 's dentist 's teacher 's brother 's friend 's ring is friendly .
the plane knows that my doctor 's cousin 's mother 's cousin 's doctor 's doctor 's sister 's son 's boss 's brother 's toy is tall .	the plane scares my doctor 's cousin 's mother 's cousin 's doctor 's doctor 's sister 's son 's boss 's brother 's toy is tall .
the candle says that your daughter 's doctor 's doctor 's son 's friend 's grandmother 's sister 's husband 's brother 's sister 's bottle is young .	the candle scares your daughter 's doctor 's doctor 's son 's friend 's grandmother 's sister 's husband 's brother 's sister 's bottle is young .
the hat says that your sister 's doctor 's father 's friend 's teacher 's brother 's dentist 's son 's boss 's teacher 's toy is tall .	the hat works with your sister 's doctor 's father 's friend 's teacher 's brother 's dentist 's son 's boss 's teacher 's toy is tall .
the plane knows that your friend 's friend 's sister 's mom 's sister 's husband 's teacher 's dad 's mom 's grandmother 's car is tall .	the plane talks to your friend 's friend 's sister 's mom 's sister 's husband 's teacher 's dad 's mom 's grandmother 's car is tall .
the rocket says that my mom 's dentist 's dad 's grandmother 's son 's cousin 's teacher 's cousin 's husband 's mother 's glass is smart .	the rocket scares my mom 's dentist 's dad 's grandmother 's son 's cousin 's teacher 's cousin 's husband 's mother 's glass is smart .
the book knows that my brother 's father 's doctor 's cousin 's father 's father 's cousin 's wife 's teacher 's daughter 's bag is careful .	the book talks to my brother 's father 's doctor 's cousin 's father 's father 's cousin 's wife 's teacher 's daughter 's bag is careful .
the truck knows that your wife 's daughter 's friend 's friend 's doctor 's dentist 's grandmother 's dentist 's dad 's teacher 's boat is confused .	the truck works with your wife 's daughter 's friend 's friend 's doctor 's dentist 's grandmother 's dentist 's dad 's teacher 's boat is confused .
the truck knows that my cousin 's friend 's wife 's mother 's son 's husband 's grandmother 's dentist 's sister 's father 's car is gentle .	the truck helps my cousin 's friend 's wife 's mother 's son 's husband 's grandmother 's dentist 's sister 's father 's car is gentle .
the ship knows that your father 's sister 's dentist 's mother 's husband 's daughter 's mother 's mother 's mom 's father 's ring is helpful .	the ship works with your father 's sister 's dentist 's mother 's husband 's daughter 's mother 's mother 's mom 's father 's ring is helpful .
the rug thinks that my mother 's mom 's teacher 's son 's dad 's father 's grandmother 's dentist 's brother 's grandmother 's book is important .	the rug works with my mother 's mom 's teacher 's son 's dad 's father 's grandmother 's dentist 's brother 's grandmother 's book is important .
