the bag gave your son 's grandmother 's father 's car the mirror .	the bag cleaned your son 's grandmother 's father 's car the mirror .
the box bought my daughter 's dentist 's son 's bag the picture .	the box cleaned my daughter 's dentist 's son 's bag the picture .
the bottle showed my mother 's sister 's wife 's door the door .	the bottle shook my mother 's sister 's wife 's door the door .
the car gave your cousin 's father 's wife 's button the hat .	the car moved your cousin 's father 's wife 's button the hat .
the bicycle gave my son 's father 's boss 's boat the door .	the bicycle moved my son 's father 's boss 's boat the door .
the ship bought your doctor 's dentist 's wife 's book the car .	the ship kept your doctor 's dentist 's wife 's book the car .
the picture showed your sister 's mother 's brother 's toy the chair .	the picture shook your sister 's mother 's brother 's toy the chair .
the window gave my grandmother 's doctor 's boss 's candle the rocket .	the window dropped my grandmother 's doctor 's boss 's candle the rocket .
the spoon bought my father 's cousin 's brother 's doll the bed .	the spoon held my father 's cousin 's brother 's doll the bed .
the chair sent my sister 's teacher 's teacher 's box the crayon .	the chair lost my sister 's teacher 's teacher 's box the crayon .
the shirt gave my dad 's boss 's dad 's bicycle the couch .	the shirt shook my dad 's boss 's dad 's bicycle the couch .
the bowl sent your mom 's dentist 's grandmother 's shirt the plate .	the bowl dropped your mom 's dentist 's grandmother 's shirt the plate .
the window bought your sister 's son 's daughter 's cup the bed .	the window kept your sister 's son 's daughter 's cup the bed .
the rug bought your boss 's doctor 's dad 's shoe the window .	the rug moved your boss 's doctor 's dad 's shoe the window .
the door bought your dentist 's brother 's cousin 's dish the book .	the door shook your dentist 's brother 's cousin 's dish the book .
the boat gave my friend 's grandmother 's husband 's candle the doll .	the boat lost my friend 's grandmother 's husband 's candle the doll .
the glass showed my husband 's grandmother 's son 's mirror the bowl .	the glass moved my husband 's grandmother 's son 's mirror the bowl .
the ship showed my sister 's father 's friend 's button the shirt .	the ship held my sister 's father 's friend 's button the shirt .
the car bought my mom 's mom 's brother 's bottle the bag .	the car kept my mom 's mom 's brother 's bottle the bag .
the button gave my teacher 's grandmother 's father 's plane the couch .	the button moved my teacher 's grandmother 's father 's plane the couch .
the shoe showed your daughter 's father 's sister 's shirt the car .	the shoe shook your daughter 's father 's sister 's shirt the car .
the candle showed my sister 's cousin 's sister 's couch the bed .	the candle held my sister 's cousin 's sister 's couch the bed .
the ship showed your dentist 's cousin 's sister 's bottle the window .	the ship shook your dentist 's cousin 's sister 's bottle the window .
the book bought my grandmother 's sister 's dad 's rocket the mirror .	the book kept my grandmother 's sister 's dad 's rocket the mirror .
the glass bought my boss 's mother 's sister 's boat the shirt .	the glass moved my boss 's mother 's sister 's boat the shirt .
the spoon bought your sister 's son 's mom 's chair the door .	the spoon lost your sister 's son 's mom 's chair the door .
the chair sent my doctor 's son 's mom 's plate the button .	the chair moved my doctor 's son 's mom 's plate the button .
the book gave my cousin 's son 's teacher 's car the bottle .	the book cleaned my cousin 's son 's teacher 's car the bottle .
the bicycle sent my cousin 's mom 's husband 's fork the plate .	the bicycle held my cousin 's mom 's husband 's fork the plate .
the window sent your husband 's father 's teacher 's shoe the shirt .	the window held your husband 's father 's teacher 's shoe the shirt .
the chair sent my daughter 's doctor 's husband 's couch the door .	the chair shook my daughter 's doctor 's husband 's couch the door .
the bicycle showed your grandmother 's father 's husband 's glass the crayon .	the bicycle moved your grandmother 's father 's husband 's glass the crayon .
the toy gave your mother 's husband 's grandmother 's truck the fork .	the toy cleaned your mother 's husband 's grandmother 's truck the fork .
the spoon gave your dad 's friend 's daughter 's ring the bed .	the spoon cleaned your dad 's friend 's daughter 's ring the bed .
the spoon showed my grandmother 's brother 's dad 's bag the plane .	the spoon held my grandmother 's brother 's dad 's bag the plane .
the toy sent my father 's mom 's friend 's truck the box .	the toy cleaned my father 's mom 's friend 's truck the box .
the toy sent my wife 's sister 's father 's doll the picture .	the toy shook my wife 's sister 's father 's doll the picture .
the shoe sent my friend 's mom 's cousin 's bed the window .	the shoe dropped my friend 's mom 's cousin 's bed the window .
the mirror bought your mom 's mom 's boss 's plane the candle .	the mirror held your mom 's mom 's boss 's plane the candle .
the book bought your wife 's cousin 's daughter 's couch the book .	the book moved your wife 's cousin 's daughter 's couch the book .
the truck showed my teacher 's doctor 's daughter 's shoe the couch .	the truck held my teacher 's doctor 's daughter 's shoe the couch .
the boat showed your mother 's dentist 's brother 's couch the book .	the boat dropped your mother 's dentist 's brother 's couch the book .
the plate gave my husband 's husband 's sister 's glass the ship .	the plate kept my husband 's husband 's sister 's glass the ship .
the chair showed your boss 's sister 's boss 's rug the fork .	the chair cleaned your boss 's sister 's boss 's rug the fork .
the fork showed my husband 's father 's friend 's book the plane .	the fork cleaned my husband 's father 's friend 's book the plane .
the shoe bought my wife 's mom 's doctor 's book the book .	the shoe shook my wife 's mom 's doctor 's book the book .
the rocket bought your sister 's dad 's mother 's toy the hat .	the rocket dropped your sister 's dad 's mother 's toy the hat .
the shirt gave your mom 's mother 's boss 's glass the crayon .	the shirt shook your mom 's mother 's boss 's glass the crayon .
the truck showed your dad 's sister 's sister 's plane the spoon .	the truck kept your dad 's sister 's sister 's plane the spoon .
the shirt showed my teacher 's brother 's grandmother 's plate the dish .	the shirt dropped my teacher 's brother 's grandmother 's plate the dish .
the doll showed your doctor 's dad 's boss 's bowl the picture .	the doll shook your doctor 's dad 's boss 's bowl the picture .
the truck bought your brother 's dad 's doctor 's chair the button .	the truck kept your brother 's dad 's doctor 's chair the button .
the bottle sent my teacher 's grandmother 's cousin 's plate the book .	the bottle cleaned my teacher 's grandmother 's cousin 's plate the book .
the shoe sent your father 's father 's mother 's dish the car .	the shoe moved your father 's father 's mother 's dish the car .
the picture showed your doctor 's sister 's wife 's shirt the doll .	the picture moved your doctor 's sister 's wife 's shirt the doll .
the spoon showed your husband 's cousin 's doctor 's plane the glass .	the spoon held your husband 's cousin 's doctor 's plane the glass .
the book sent my mom 's mom 's cousin 's boat the plane .	the book kept my mom 's mom 's cousin 's boat the plane .
the car bought your mother 's mom 's teacher 's truck the truck .	the car moved your mother 's mom 's teacher 's truck the truck .
the boat sent your daughter 's dad 's doctor 's rug the cup .	the boat held your daughter 's dad 's doctor 's rug the cup .
the plate gave your mother 's friend 's boss 's hat the bicycle .	the plate cleaned your mother 's friend 's boss 's hat the bicycle .
the glass showed my friend 's mom 's dad 's bowl the cup .	the glass moved my friend 's mom 's dad 's bowl the cup .
the hat sent your dad 's friend 's wife 's cup the couch .	the hat moved your dad 's friend 's wife 's cup the couch .
the dish bought my friend 's mother 's dentist 's rocket the door .	the dish lost my friend 's mother 's dentist 's rocket the door .
the bed bought my dad 's wife 's teacher 's box the car .	the bed shook my dad 's wife 's teacher 's box the car .
the bag showed my father 's friend 's dad 's car the rug .	the bag held my father 's friend 's dad 's car the rug .
the rocket bought your wife 's husband 's wife 's window the glass .	the rocket kept your wife 's husband 's wife 's window the glass .
the rug bought your father 's friend 's wife 's plane the fork .	the rug held your father 's friend 's wife 's plane the fork .
the truck gave my friend 's brother 's brother 's car the boat .	the truck lost my friend 's brother 's brother 's car the boat .
the bottle showed my cousin 's dentist 's mother 's bowl the crayon .	the bottle shook my cousin 's dentist 's mother 's bowl the crayon .
the fork showed my brother 's mom 's friend 's bottle the bag .	the fork shook my brother 's mom 's friend 's bottle the bag .
the car bought your daughter 's friend 's sister 's car the glass .	the car moved your daughter 's friend 's sister 's car the glass .
the bed sent your dad 's wife 's doctor 's toy the bag .	the bed kept your dad 's wife 's doctor 's toy the bag .
the toy sent your teacher 's friend 's teacher 's bicycle the book .	the toy moved your teacher 's friend 's teacher 's bicycle the book .
the door sent my sister 's boss 's husband 's picture the couch .	the door dropped my sister 's boss 's husband 's picture the couch .
the book showed my dad 's friend 's father 's shoe the book .	the book shook my dad 's friend 's father 's shoe the book .
the car gave your cousin 's grandmother 's boss 's shirt the rocket .	the car held your cousin 's grandmother 's boss 's shirt the rocket .
the chair bought my sister 's friend 's grandmother 's rocket the plate .	the chair kept my sister 's friend 's grandmother 's rocket the plate .
the candle sent your daughter 's doctor 's brother 's bed the candle .	the candle lost your daughter 's doctor 's brother 's bed the candle .
the box showed my husband 's mother 's sister 's chair the crayon .	the box lost my husband 's mother 's sister 's chair the crayon .
the bicycle bought my grandmother 's husband 's friend 's picture the bottle .	the bicycle dropped my grandmother 's husband 's friend 's picture the bottle .
the fork bought your grandmother 's father 's husband 's rocket the dish .	the fork held your grandmother 's father 's husband 's rocket the dish .
the shirt showed my wife 's dad 's dentist 's bag the glass .	the shirt shook my wife 's dad 's dentist 's bag the glass .
the chair gave your wife 's sister 's brother 's cup the candle .	the chair dropped your wife 's sister 's brother 's cup the candle .
the bicycle showed your dad 's wife 's mother 's rug the picture .	the bicycle moved your dad 's wife 's mother 's rug the picture .
the bicycle sent my grandmother 's father 's father 's box the spoon .	the bicycle moved my grandmother 's father 's father 's box the spoon .
the bed gave your dad 's brother 's sister 's door the ship .	the bed cleaned your dad 's brother 's sister 's door the ship .
the door showed my boss 's mom 's boss 's book the rocket .	the door dropped my boss 's mom 's boss 's book the rocket .
the ship showed my sister 's father 's boss 's plate the ring .	the ship kept my sister 's father 's boss 's plate the ring .
the plate bought my husband 's mom 's mother 's plate the door .	the plate lost my husband 's mom 's mother 's plate the door .
the bottle bought your dad 's father 's dentist 's candle the spoon .	the bottle lost your dad 's father 's dentist 's candle the spoon .
the window showed your friend 's grandmother 's doctor 's couch the rug .	the window dropped your friend 's grandmother 's doctor 's couch the rug .
the rug sent your boss 's cousin 's friend 's book the chair .	the rug cleaned your boss 's cousin 's friend 's book the chair .
the chair showed my friend 's friend 's daughter 's plane the fork .	the chair moved my friend 's friend 's daughter 's plane the fork .
the couch gave your grandmother 's father 's wife 's cup the hat .	the couch lost your grandmother 's father 's wife 's cup the hat .
the bowl gave my sister 's husband 's sister 's bicycle the shoe .	the bowl dropped my sister 's husband 's sister 's bicycle the shoe .
the doll gave my daughter 's daughter 's wife 's mirror the picture .	the doll moved my daughter 's daughter 's wife 's mirror the picture .
the picture showed my doctor 's dentist 's sister 's plane the dish .	the picture kept my doctor 's dentist 's sister 's plane the dish .
the bottle sent my mother 's boss 's mom 's bag the plane .	the bottle held my mother 's boss 's mom 's bag the plane .
the bottle bought my mom 's father 's husband 's fork the button .	the bottle lost my mom 's father 's husband 's fork the button .
the book gave your friend 's wife 's friend 's truck the fork .	the book moved your friend 's wife 's friend 's truck the fork .
the picture gave your husband 's boss 's son 's couch the crayon .	the picture shook your husband 's boss 's son 's couch the crayon .
the button showed my husband 's dentist 's son 's bowl the book .	the button cleaned my husband 's dentist 's son 's bowl the book .
the bowl gave my grandmother 's boss 's daughter 's dish the ship .	the bowl cleaned my grandmother 's boss 's daughter 's dish the ship .
the shirt gave your son 's son 's friend 's rug the book .	the shirt held your son 's son 's friend 's rug the book .
the rocket bought your mom 's brother 's husband 's bottle the car .	the rocket shook your mom 's brother 's husband 's bottle the car .
the hat bought your friend 's cousin 's dad 's dish the book .	the hat dropped your friend 's cousin 's dad 's dish the book .
the box bought your teacher 's brother 's brother 's plate the picture .	the box cleaned your teacher 's brother 's brother 's plate the picture .
the book bought your boss 's brother 's wife 's ring the glass .	the book kept your boss 's brother 's wife 's ring the glass .
the button sent your wife 's dad 's father 's crayon the toy .	the button lost your wife 's dad 's father 's crayon the toy .
the picture gave my grandmother 's father 's teacher 's boat the plate .	the picture lost my grandmother 's father 's teacher 's boat the plate .
the book showed my dad 's mother 's wife 's cup the ship .	the book kept my dad 's mother 's wife 's cup the ship .
the bottle showed your teacher 's wife 's doctor 's shoe the truck .	the bottle dropped your teacher 's wife 's doctor 's shoe the truck .
the candle gave my son 's father 's husband 's rocket the bicycle .	the candle cleaned my son 's father 's husband 's rocket the bicycle .
the bowl showed your husband 's mom 's dentist 's toy the toy .	the bowl held your husband 's mom 's dentist 's toy the toy .
the shirt bought my sister 's dad 's dentist 's bowl the bag .	the shirt lost my sister 's dad 's dentist 's bowl the bag .
the crayon showed your sister 's husband 's wife 's truck the crayon .	the crayon cleaned your sister 's husband 's wife 's truck the crayon .
the book gave my dad 's husband 's mother 's picture the picture .	the book dropped my dad 's husband 's mother 's picture the picture .
the car bought your wife 's teacher 's dad 's hat the hat .	the car shook your wife 's teacher 's dad 's hat the hat .
the crayon showed my father 's friend 's dentist 's shoe the cup .	the crayon held my father 's friend 's dentist 's shoe the cup .
the bag bought my sister 's wife 's mother 's bottle the toy .	the bag moved my sister 's wife 's mother 's bottle the toy .
the candle sent your dad 's son 's mom 's mirror the rocket .	the candle held your dad 's son 's mom 's mirror the rocket .
the plane sent my friend 's sister 's boss 's fork the rug .	the plane moved my friend 's sister 's boss 's fork the rug .
the book sent my son 's mom 's doctor 's chair the plane .	the book dropped my son 's mom 's doctor 's chair the plane .
the dish showed my dad 's boss 's dentist 's crayon the bicycle .	the dish kept my dad 's boss 's dentist 's crayon the bicycle .
the book gave your father 's wife 's cousin 's crayon the bottle .	the book dropped your father 's wife 's cousin 's crayon the bottle .
the dish gave my son 's dentist 's friend 's bed the shirt .	the dish held my son 's dentist 's friend 's bed the shirt .
the plane showed my friend 's brother 's husband 's glass the candle .	the plane shook my friend 's brother 's husband 's glass the candle .
the picture bought my mother 's doctor 's boss 's rocket the fork .	the picture kept my mother 's doctor 's boss 's rocket the fork .
the boat bought your sister 's mom 's teacher 's book the bed .	the boat moved your sister 's mom 's teacher 's book the bed .
the truck bought my mom 's doctor 's dad 's mirror the candle .	the truck held my mom 's doctor 's dad 's mirror the candle .
the box gave my wife 's brother 's wife 's bed the window .	the box dropped my wife 's brother 's wife 's bed the window .
the glass sent my dentist 's father 's wife 's fork the fork .	the glass held my dentist 's father 's wife 's fork the fork .
the door gave my boss 's mother 's teacher 's shoe the book .	the door moved my boss 's mother 's teacher 's shoe the book .
the chair sent your dad 's mom 's doctor 's mirror the button .	the chair held your dad 's mom 's doctor 's mirror the button .
the truck bought my doctor 's brother 's husband 's toy the cup .	the truck cleaned my doctor 's brother 's husband 's toy the cup .
the shirt sent my son 's son 's wife 's shirt the ring .	the shirt moved my son 's son 's wife 's shirt the ring .
the bowl gave your daughter 's sister 's son 's shoe the rocket .	the bowl moved your daughter 's sister 's son 's shoe the rocket .
the dish showed your dad 's son 's wife 's plane the doll .	the dish held your dad 's son 's wife 's plane the doll .
the book showed your husband 's brother 's husband 's mirror the book .	the book held your husband 's brother 's husband 's mirror the book .
the bed bought your daughter 's mother 's grandmother 's book the shirt .	the bed shook your daughter 's mother 's grandmother 's book the shirt .
the ring sent my brother 's mother 's dad 's spoon the rug .	the ring kept my brother 's mother 's dad 's spoon the rug .
the picture showed my brother 's grandmother 's wife 's bicycle the rocket .	the picture cleaned my brother 's grandmother 's wife 's bicycle the rocket .
the door gave my doctor 's husband 's sister 's crayon the candle .	the door moved my doctor 's husband 's sister 's crayon the candle .
the doll gave my dentist 's daughter 's daughter 's rocket the chair .	the doll lost my dentist 's daughter 's daughter 's rocket the chair .
the bed sent my friend 's friend 's doctor 's rocket the truck .	the bed held my friend 's friend 's doctor 's rocket the truck .
the bowl sent my doctor 's son 's brother 's plate the plane .	the bowl lost my doctor 's son 's brother 's plate the plane .
the shirt gave my boss 's mother 's dad 's couch the rocket .	the shirt held my boss 's mother 's dad 's couch the rocket .
the fork showed my grandmother 's teacher 's cousin 's doll the spoon .	the fork kept my grandmother 's teacher 's cousin 's doll the spoon .
the bicycle gave your grandmother 's friend 's husband 's bag the chair .	the bicycle dropped your grandmother 's friend 's husband 's bag the chair .
the dish sent your boss 's husband 's grandmother 's shirt the door .	the dish lost your boss 's husband 's grandmother 's shirt the door .
the plate sent my grandmother 's boss 's sister 's doll the toy .	the plate dropped my grandmother 's boss 's sister 's doll the toy .
the fork sent my boss 's son 's sister 's bed the toy .	the fork moved my boss 's son 's sister 's bed the toy .
the doll showed my cousin 's doctor 's sister 's shirt the dish .	the doll shook my cousin 's doctor 's sister 's shirt the dish .
the boat bought your mom 's husband 's son 's chair the shirt .	the boat held your mom 's husband 's son 's chair the shirt .
the truck showed my brother 's wife 's son 's rug the rocket .	the truck moved my brother 's wife 's son 's rug the rocket .
the bed bought your dad 's wife 's dad 's rug the mirror .	the bed dropped your dad 's wife 's dad 's rug the mirror .
the bicycle sent your brother 's husband 's mother 's ship the toy .	the bicycle kept your brother 's husband 's mother 's ship the toy .
the plane bought your mother 's cousin 's mom 's truck the car .	the plane kept your mother 's cousin 's mom 's truck the car .
the boat bought your grandmother 's friend 's friend 's toy the bowl .	the boat kept your grandmother 's friend 's friend 's toy the bowl .
the ship showed your son 's dentist 's friend 's box the bottle .	the ship lost your son 's dentist 's friend 's box the bottle .
the car sent my boss 's boss 's doctor 's book the spoon .	the car shook my boss 's boss 's doctor 's book the spoon .
the boat showed your teacher 's father 's cousin 's rug the ring .	the boat kept your teacher 's father 's cousin 's rug the ring .
the dish gave your friend 's dentist 's dentist 's bed the toy .	the dish kept your friend 's dentist 's dentist 's bed the toy .
the ring bought my son 's teacher 's father 's car the plate .	the ring lost my son 's teacher 's father 's car the plate .
the book sent your father 's dad 's daughter 's box the glass .	the book lost your father 's dad 's daughter 's box the glass .
the rocket bought my boss 's mom 's teacher 's boat the door .	the rocket cleaned my boss 's mom 's teacher 's boat the door .
the door sent my dentist 's cousin 's sister 's mirror the bag .	the door lost my dentist 's cousin 's sister 's mirror the bag .
the chair showed my brother 's dentist 's dad 's box the truck .	the chair moved my brother 's dentist 's dad 's box the truck .
the dish bought your boss 's brother 's sister 's rocket the shirt .	the dish shook your boss 's brother 's sister 's rocket the shirt .
the bicycle bought my friend 's daughter 's friend 's shirt the car .	the bicycle moved my friend 's daughter 's friend 's shirt the car .
the bag bought your doctor 's mother 's grandmother 's hat the candle .	the bag cleaned your doctor 's mother 's grandmother 's hat the candle .
the fork bought my brother 's wife 's cousin 's bag the crayon .	the fork dropped my brother 's wife 's cousin 's bag the crayon .
the car sent your husband 's mother 's friend 's candle the glass .	the car lost your husband 's mother 's friend 's candle the glass .
the car sent my brother 's husband 's boss 's shoe the bed .	the car kept my brother 's husband 's boss 's shoe the bed .
the crayon bought your grandmother 's mom 's grandmother 's shirt the glass .	the crayon shook your grandmother 's mom 's grandmother 's shirt the glass .
the picture showed your son 's sister 's dad 's book the plane .	the picture held your son 's sister 's dad 's book the plane .
the fork showed your dentist 's dentist 's mom 's bottle the button .	the fork lost your dentist 's dentist 's mom 's bottle the button .
the glass showed my husband 's father 's brother 's candle the plate .	the glass moved my husband 's father 's brother 's candle the plate .
the door bought your dentist 's doctor 's husband 's ship the car .	the door moved your dentist 's doctor 's husband 's ship the car .
the doll bought your friend 's doctor 's grandmother 's rug the bowl .	the doll moved your friend 's doctor 's grandmother 's rug the bowl .
the cup showed my mom 's dentist 's mom 's bowl the truck .	the cup moved my mom 's dentist 's mom 's bowl the truck .
the bowl gave my brother 's father 's cousin 's rocket the truck .	the bowl cleaned my brother 's father 's cousin 's rocket the truck .
the couch gave my son 's dentist 's doctor 's toy the door .	the couch lost my son 's dentist 's doctor 's toy the door .
the truck gave your cousin 's mom 's father 's hat the ring .	the truck dropped your cousin 's mom 's father 's hat the ring .
the box gave my friend 's friend 's sister 's rocket the car .	the box moved my friend 's friend 's sister 's rocket the car .
the plane sent my boss 's cousin 's husband 's door the dish .	the plane cleaned my boss 's cousin 's husband 's door the dish .
the door gave your doctor 's grandmother 's mom 's car the picture .	the door moved your doctor 's grandmother 's mom 's car the picture .
the hat sent your daughter 's doctor 's husband 's bag the book .	the hat lost your daughter 's doctor 's husband 's bag the book .
the window showed my sister 's husband 's brother 's shoe the bed .	the window lost my sister 's husband 's brother 's shoe the bed .
the window sent my teacher 's mom 's wife 's dish the spoon .	the window shook my teacher 's mom 's wife 's dish the spoon .
the toy showed your cousin 's sister 's wife 's couch the rug .	the toy moved your cousin 's sister 's wife 's couch the rug .
the door gave my cousin 's brother 's sister 's door the button .	the door held my cousin 's brother 's sister 's door the button .
the shoe gave my grandmother 's dentist 's son 's window the book .	the shoe held my grandmother 's dentist 's son 's window the book .
the ring gave your daughter 's mom 's wife 's bicycle the bed .	the ring lost your daughter 's mom 's wife 's bicycle the bed .
the rocket showed my husband 's mom 's dentist 's shirt the cup .	the rocket held my husband 's mom 's dentist 's shirt the cup .
the ring showed your friend 's mom 's mom 's spoon the button .	the ring moved your friend 's mom 's mom 's spoon the button .
