the driver thinks that my dentist 's daughter 's grandmother 's sister 's wife is helpful .	the driver scares my dentist 's daughter 's grandmother 's sister 's wife is helpful .
my dentist thinks that my teacher 's friend 's daughter 's doctor 's teacher is important .	my dentist talks to my teacher 's friend 's daughter 's doctor 's teacher is important .
the person knows that your friend 's brother 's friend 's mom 's teacher is gentle .	the person works with your friend 's brother 's friend 's mom 's teacher is gentle .
my dentist knows that my daughter 's dentist 's cousin 's friend 's grandmother is hungry .	my dentist scares my daughter 's dentist 's cousin 's friend 's grandmother is hungry .
my cousin knows that my sister 's teacher 's friend 's brother 's son is nice .	my cousin talks to my sister 's teacher 's friend 's brother 's son is nice .
my teacher thinks that my cousin 's mom 's mother 's father 's daughter is sleepy .	my teacher talks to my cousin 's mom 's mother 's father 's daughter is sleepy .
your doctor says that my brother 's wife 's cousin 's sister 's boss is curious .	your doctor works with my brother 's wife 's cousin 's sister 's boss is curious .
the dancer says that my teacher 's friend 's friend 's grandmother 's sister is young .	the dancer helps my teacher 's friend 's friend 's grandmother 's sister is young .
Amelia knows that your grandmother 's brother 's boss 's teacher 's dad is young .	Amelia helps your grandmother 's brother 's boss 's teacher 's dad is young .
the person says that your son 's son 's doctor 's husband 's dad is curious .	the person scares your son 's son 's doctor 's husband 's dad is curious .
Michael knows that my son 's teacher 's teacher 's sister 's grandmother is quiet .	Michael works with my son 's teacher 's teacher 's sister 's grandmother is quiet .
the dentist thinks that my doctor 's husband 's doctor 's son 's friend is helpful .	the dentist scares my doctor 's husband 's doctor 's son 's friend is helpful .
your friend thinks that my wife 's friend 's wife 's dentist 's brother is clever .	your friend scares my wife 's friend 's wife 's dentist 's brother is clever .
the doctor knows that your friend 's son 's brother 's husband 's dad is boring .	the doctor talks to your friend 's son 's brother 's husband 's dad is boring .
your teacher thinks that your daughter 's boss 's husband 's teacher 's mother is young .	your teacher talks to your daughter 's boss 's husband 's teacher 's mother is young .
your teacher thinks that my mom 's son 's grandmother 's sister 's wife is healthy .	your teacher helps my mom 's son 's grandmother 's sister 's wife is healthy .
my dentist knows that my sister 's dentist 's cousin 's husband 's doctor is important .	my dentist talks to my sister 's dentist 's cousin 's husband 's doctor is important .
your teacher thinks that your cousin 's son 's teacher 's sister 's mother is busy .	your teacher works with your cousin 's son 's teacher 's sister 's mother is busy .
Jennifer thinks that my sister 's dentist 's friend 's father 's boss is angry .	Jennifer works with my sister 's dentist 's friend 's father 's boss is angry .
my teacher says that my dad 's dad 's wife 's grandmother 's daughter is lucky .	my teacher helps my dad 's dad 's wife 's grandmother 's daughter is lucky .
my cousin thinks that my brother 's grandmother 's boss 's daughter 's doctor is healthy .	my cousin scares my brother 's grandmother 's boss 's daughter 's doctor is healthy .
the dancer says that my grandmother 's son 's boss 's mom 's teacher is young .	the dancer works with my grandmother 's son 's boss 's mom 's teacher is young .
George knows that your mother 's cousin 's sister 's son 's sister is friendly .	George scares your mother 's cousin 's sister 's son 's sister is friendly .
Melissa knows that your dad 's friend 's daughter 's cousin 's daughter is sleepy .	Melissa scares your dad 's friend 's daughter 's cousin 's daughter is sleepy .
my cousin says that your mother 's brother 's boss 's teacher 's mother is gentle .	my cousin talks to your mother 's brother 's boss 's teacher 's mother is gentle .
the driver knows that your brother 's daughter 's father 's father 's brother is important .	the driver helps your brother 's daughter 's father 's father 's brother is important .
the patient says that my teacher 's son 's husband 's father 's husband is young .	the patient talks to my teacher 's son 's husband 's father 's husband is young .
Alice thinks that my grandmother 's daughter 's wife 's boss 's father is clever .	Alice talks to my grandmother 's daughter 's wife 's boss 's father is clever .
the customer thinks that your mother 's mother 's daughter 's mom 's mother is careful .	the customer scares your mother 's mother 's daughter 's mom 's mother is careful .
my teacher says that my doctor 's friend 's grandmother 's daughter 's dad is tired .	my teacher scares my doctor 's friend 's grandmother 's daughter 's dad is tired .
the dentist knows that your dentist 's wife 's boss 's grandmother 's son is tall .	the dentist talks to your dentist 's wife 's boss 's grandmother 's son is tall .
the child says that my doctor 's teacher 's grandmother 's friend 's sister is confused .	the child helps my doctor 's teacher 's grandmother 's friend 's sister is confused .
the doctor knows that my daughter 's cousin 's mom 's mom 's boss is friendly .	the doctor scares my daughter 's cousin 's mom 's mom 's boss is friendly .
the child thinks that your son 's son 's son 's boss 's doctor is helpful .	the child helps your son 's son 's son 's boss 's doctor is helpful .
Aaron thinks that your doctor 's mother 's teacher 's sister 's wife is careful .	Aaron scares your doctor 's mother 's teacher 's sister 's wife is careful .
the driver says that my teacher 's wife 's son 's father 's brother is tall .	the driver helps my teacher 's wife 's son 's father 's brother is tall .
the teacher knows that your father 's daughter 's daughter 's brother 's doctor is gentle .	the teacher scares your father 's daughter 's daughter 's brother 's doctor is gentle .
the child says that my cousin 's teacher 's sister 's wife 's son is angry .	the child scares my cousin 's teacher 's sister 's wife 's son is angry .
my doctor thinks that your sister 's dentist 's daughter 's grandmother 's dentist is kind .	my doctor talks to your sister 's dentist 's daughter 's grandmother 's dentist is kind .
the customer thinks that your brother 's dentist 's son 's doctor 's mom is helpful .	the customer helps your brother 's dentist 's son 's doctor 's mom is helpful .
your boss knows that my grandmother 's son 's doctor 's father 's teacher is lucky .	your boss talks to my grandmother 's son 's doctor 's father 's teacher is lucky .
Julia thinks that my teacher 's doctor 's teacher 's dentist 's daughter is excited .	Julia talks to my teacher 's doctor 's teacher 's dentist 's daughter is excited .
Paul thinks that my son 's mother 's sister 's dad 's father is smart .	Paul scares my son 's mother 's sister 's dad 's father is smart .
the person knows that my daughter 's mother 's cousin 's friend 's teacher is friendly .	the person works with my daughter 's mother 's cousin 's friend 's teacher is friendly .
the dancer knows that your cousin 's friend 's mother 's wife 's father is careful .	the dancer talks to your cousin 's friend 's mother 's wife 's father is careful .
the teacher thinks that your wife 's mom 's brother 's father 's brother is clever .	the teacher works with your wife 's mom 's brother 's father 's brother is clever .
Becky says that your cousin 's husband 's boss 's husband 's brother is careful .	Becky talks to your cousin 's husband 's boss 's husband 's brother is careful .
my friend says that your grandmother 's cousin 's father 's father 's wife is excited .	my friend scares your grandmother 's cousin 's father 's father 's wife is excited .
your friend thinks that my sister 's dentist 's sister 's doctor 's cousin is tall .	your friend scares my sister 's dentist 's sister 's doctor 's cousin is tall .
your doctor knows that my dentist 's wife 's dentist 's son 's dentist is busy .	your doctor scares my dentist 's wife 's dentist 's son 's dentist is busy .
the adult thinks that my wife 's daughter 's son 's sister 's father is boring .	the adult talks to my wife 's daughter 's son 's sister 's father is boring .
the patient says that my brother 's sister 's father 's daughter 's friend is sleepy .	the patient works with my brother 's sister 's father 's daughter 's friend is sleepy .
the adult thinks that your wife 's father 's mom 's sister 's sister is strong .	the adult talks to your wife 's father 's mom 's sister 's sister is strong .
the customer knows that your boss 's sister 's teacher 's dentist 's son is careful .	the customer helps your boss 's sister 's teacher 's dentist 's son is careful .
Amelia says that my daughter 's mom 's cousin 's daughter 's brother is quiet .	Amelia talks to my daughter 's mom 's cousin 's daughter 's brother is quiet .
your dentist says that your daughter 's dad 's wife 's husband 's mom is young .	your dentist works with your daughter 's dad 's wife 's husband 's mom is young .
the dentist knows that my teacher 's boss 's dad 's dad 's sister is boring .	the dentist scares my teacher 's boss 's dad 's dad 's sister is boring .
your cousin knows that my father 's daughter 's boss 's mother 's dentist is important .	your cousin talks to my father 's daughter 's boss 's mother 's dentist is important .
your boss says that my son 's son 's dentist 's dad 's teacher is upset .	your boss talks to my son 's son 's dentist 's dad 's teacher is upset .
Naomi knows that my teacher 's husband 's dad 's friend 's dad is lucky .	Naomi helps my teacher 's husband 's dad 's friend 's dad is lucky .
Elizabeth thinks that my father 's father 's mother 's dad 's cousin is friendly .	Elizabeth scares my father 's father 's mother 's dad 's cousin is friendly .
the customer knows that your wife 's dad 's boss 's teacher 's mom is nice .	the customer talks to your wife 's dad 's boss 's teacher 's mom is nice .
your friend knows that my grandmother 's grandmother 's father 's cousin 's wife is smart .	your friend scares my grandmother 's grandmother 's father 's cousin 's wife is smart .
my dentist knows that my daughter 's mom 's sister 's dentist 's teacher is helpful .	my dentist talks to my daughter 's mom 's sister 's dentist 's teacher is helpful .
Denise knows that your grandmother 's mom 's sister 's dad 's doctor is curious .	Denise works with your grandmother 's mom 's sister 's dad 's doctor is curious .
the dentist thinks that your doctor 's sister 's father 's doctor 's wife is clever .	the dentist works with your doctor 's sister 's father 's doctor 's wife is clever .
Michelle knows that my cousin 's daughter 's grandmother 's brother 's boss is wrong .	Michelle works with my cousin 's daughter 's grandmother 's brother 's boss is wrong .
the dancer knows that your sister 's wife 's boss 's husband 's husband is upset .	the dancer talks to your sister 's wife 's boss 's husband 's husband is upset .
your friend says that your doctor 's husband 's dentist 's teacher 's teacher is tired .	your friend works with your doctor 's husband 's dentist 's teacher 's teacher is tired .
the doctor knows that your mother 's dad 's dad 's dad 's dentist is strong .	the doctor helps your mother 's dad 's dad 's dad 's dentist is strong .
my teacher says that my friend 's dad 's teacher 's grandmother 's father is wrong .	my teacher talks to my friend 's dad 's teacher 's grandmother 's father is wrong .
your teacher thinks that your teacher 's husband 's brother 's son 's doctor is clever .	your teacher helps your teacher 's husband 's brother 's son 's doctor is clever .
my dentist says that your boss 's doctor 's grandmother 's dentist 's cousin is helpful .	my dentist talks to your boss 's doctor 's grandmother 's dentist 's cousin is helpful .
the adult thinks that your wife 's dad 's brother 's wife 's doctor is kind .	the adult works with your wife 's dad 's brother 's wife 's doctor is kind .
your teacher knows that your mother 's son 's grandmother 's mother 's cousin is curious .	your teacher scares your mother 's son 's grandmother 's mother 's cousin is curious .
my teacher thinks that my mother 's mom 's dentist 's friend 's sister is young .	my teacher helps my mother 's mom 's dentist 's friend 's sister is young .
the dentist thinks that my dentist 's teacher 's doctor 's daughter 's husband is angry .	the dentist works with my dentist 's teacher 's doctor 's daughter 's husband is angry .
the customer knows that my brother 's mom 's husband 's cousin 's husband is surprised .	the customer helps my brother 's mom 's husband 's cousin 's husband is surprised .
the dentist says that my boss 's sister 's cousin 's grandmother 's dad is healthy .	the dentist works with my boss 's sister 's cousin 's grandmother 's dad is healthy .
the dancer knows that my husband 's wife 's husband 's mother 's wife is strong .	the dancer helps my husband 's wife 's husband 's mother 's wife is strong .
the driver says that my mom 's dad 's brother 's teacher 's son is quiet .	the driver talks to my mom 's dad 's brother 's teacher 's son is quiet .
Erin thinks that your daughter 's mom 's son 's friend 's father is upset .	Erin talks to your daughter 's mom 's son 's friend 's father is upset .
my dentist knows that your boss 's teacher 's wife 's mom 's father is quiet .	my dentist works with your boss 's teacher 's wife 's mom 's father is quiet .
your doctor thinks that your cousin 's teacher 's grandmother 's boss 's grandmother is gentle .	your doctor works with your cousin 's teacher 's grandmother 's boss 's grandmother is gentle .
Brian knows that my mom 's brother 's brother 's doctor 's father is curious .	Brian talks to my mom 's brother 's brother 's doctor 's father is curious .
the doctor knows that my wife 's dad 's grandmother 's son 's doctor is nice .	the doctor helps my wife 's dad 's grandmother 's son 's doctor is nice .
Kristen knows that my son 's grandmother 's brother 's teacher 's daughter is quiet .	Kristen scares my son 's grandmother 's brother 's teacher 's daughter is quiet .
Alexander knows that your son 's dentist 's mother 's sister 's mother is clever .	Alexander works with your son 's dentist 's mother 's sister 's mother is clever .
Mark knows that your mother 's husband 's grandmother 's friend 's daughter is wrong .	Mark works with your mother 's husband 's grandmother 's friend 's daughter is wrong .
your doctor knows that your cousin 's cousin 's boss 's friend 's sister is busy .	your doctor helps your cousin 's cousin 's boss 's friend 's sister is busy .
Aaron says that my daughter 's daughter 's mom 's son 's husband is curious .	Aaron scares my daughter 's daughter 's mom 's son 's husband is curious .
Carol says that my doctor 's friend 's mother 's dad 's wife is healthy .	Carol works with my doctor 's friend 's mother 's dad 's wife is healthy .
Laurie says that your mom 's husband 's doctor 's dentist 's dad is important .	Laurie helps your mom 's husband 's doctor 's dentist 's dad is important .
the teacher knows that my dad 's daughter 's cousin 's wife 's dad is hungry .	the teacher talks to my dad 's daughter 's cousin 's wife 's dad is hungry .
Rebecca thinks that my dad 's doctor 's wife 's mom 's brother is wrong .	Rebecca scares my dad 's doctor 's wife 's mom 's brother is wrong .
John thinks that my father 's dad 's wife 's sister 's boss is young .	John scares my father 's dad 's wife 's sister 's boss is young .
your friend thinks that my brother 's wife 's grandmother 's husband 's dad is important .	your friend talks to my brother 's wife 's grandmother 's husband 's dad is important .
your dentist says that my grandmother 's mom 's son 's dentist 's doctor is quiet .	your dentist scares my grandmother 's mom 's son 's dentist 's doctor is quiet .
your teacher says that my mother 's mom 's mom 's dentist 's friend is bored .	your teacher scares my mother 's mom 's mom 's dentist 's friend is bored .
the teacher says that my dad 's boss 's boss 's wife 's dad is quiet .	the teacher talks to my dad 's boss 's boss 's wife 's dad is quiet .
Deborah thinks that my dentist 's boss 's father 's wife 's mother is tired .	Deborah scares my dentist 's boss 's father 's wife 's mother is tired .
Frank says that your mom 's mom 's sister 's brother 's wife is sleepy .	Frank talks to your mom 's mom 's sister 's brother 's wife is sleepy .
your boss says that my son 's grandmother 's cousin 's cousin 's mom is tall .	your boss helps my son 's grandmother 's cousin 's cousin 's mom is tall .
the dentist thinks that your friend 's brother 's teacher 's mother 's mother is bored .	the dentist works with your friend 's brother 's teacher 's mother 's mother is bored .
your boss knows that my father 's dad 's dentist 's husband 's mom is confused .	your boss helps my father 's dad 's dentist 's husband 's mom is confused .
my dentist thinks that my friend 's mother 's friend 's teacher 's mom is tall .	my dentist helps my friend 's mother 's friend 's teacher 's mom is tall .
Allison thinks that your dentist 's grandmother 's wife 's brother 's mom is excited .	Allison works with your dentist 's grandmother 's wife 's brother 's mom is excited .
the doctor thinks that my wife 's cousin 's friend 's brother 's teacher is bored .	the doctor scares my wife 's cousin 's friend 's brother 's teacher is bored .
the adult says that your wife 's mom 's daughter 's cousin 's wife is upset .	the adult scares your wife 's mom 's daughter 's cousin 's wife is upset .
the doctor knows that your dad 's husband 's daughter 's sister 's friend is curious .	the doctor scares your dad 's husband 's daughter 's sister 's friend is curious .
Bill thinks that your father 's friend 's daughter 's boss 's boss is important .	Bill scares your father 's friend 's daughter 's boss 's boss is important .
my doctor thinks that your boss 's dentist 's boss 's dad 's mom is important .	my doctor helps your boss 's dentist 's boss 's dad 's mom is important .
the teacher knows that my friend 's grandmother 's dad 's daughter 's daughter is quiet .	the teacher scares my friend 's grandmother 's dad 's daughter 's daughter is quiet .
the dancer says that your father 's dad 's dentist 's wife 's friend is curious .	the dancer scares your father 's dad 's dentist 's wife 's friend is curious .
the dancer says that your boss 's wife 's brother 's mom 's sister is lucky .	the dancer works with your boss 's wife 's brother 's mom 's sister is lucky .
Thomas knows that your dentist 's wife 's cousin 's son 's sister is clever .	Thomas talks to your dentist 's wife 's cousin 's son 's sister is clever .
the teacher thinks that my sister 's teacher 's boss 's teacher 's dentist is happy .	the teacher scares my sister 's teacher 's boss 's teacher 's dentist is happy .
Scott says that your dad 's mom 's son 's mother 's dentist is quiet .	Scott scares your dad 's mom 's son 's mother 's dentist is quiet .
my cousin knows that my husband 's father 's teacher 's cousin 's wife is tired .	my cousin scares my husband 's father 's teacher 's cousin 's wife is tired .
the child knows that your dentist 's daughter 's mother 's teacher 's son is wrong .	the child talks to your dentist 's daughter 's mother 's teacher 's son is wrong .
my friend knows that my mother 's wife 's brother 's dentist 's mother is healthy .	my friend scares my mother 's wife 's brother 's dentist 's mother is healthy .
Tracy thinks that my grandmother 's husband 's mother 's boss 's daughter is angry .	Tracy talks to my grandmother 's husband 's mother 's boss 's daughter is angry .
Nancy says that my daughter 's teacher 's husband 's boss 's mom is healthy .	Nancy works with my daughter 's teacher 's husband 's boss 's mom is healthy .
Denise knows that my friend 's sister 's dentist 's boss 's sister is sleepy .	Denise talks to my friend 's sister 's dentist 's boss 's sister is sleepy .
your cousin thinks that your mother 's sister 's dad 's father 's mom is boring .	your cousin helps your mother 's sister 's dad 's father 's mom is boring .
your friend thinks that my friend 's dentist 's boss 's dentist 's dentist is helpful .	your friend helps my friend 's dentist 's boss 's dentist 's dentist is helpful .
your cousin knows that my friend 's mother 's teacher 's mom 's doctor is happy .	your cousin helps my friend 's mother 's teacher 's mom 's doctor is happy .
Michael thinks that your dentist 's wife 's mother 's dentist 's doctor is tall .	Michael helps your dentist 's wife 's mother 's dentist 's doctor is tall .
Elizabeth thinks that your father 's mom 's doctor 's mom 's friend is wrong .	Elizabeth helps your father 's mom 's doctor 's mom 's friend is wrong .
the child says that your dad 's wife 's wife 's dentist 's mom is tired .	the child works with your dad 's wife 's wife 's dentist 's mom is tired .
Judy knows that my dad 's friend 's dentist 's friend 's sister is nice .	Judy helps my dad 's friend 's dentist 's friend 's sister is nice .
your friend knows that your grandmother 's mother 's friend 's grandmother 's friend is busy .	your friend scares your grandmother 's mother 's friend 's grandmother 's friend is busy .
Steve knows that your father 's grandmother 's son 's mom 's son is tired .	Steve scares your father 's grandmother 's son 's mom 's son is tired .
Julia knows that your boss 's cousin 's cousin 's boss 's mom is curious .	Julia works with your boss 's cousin 's cousin 's boss 's mom is curious .
my dentist thinks that my boss 's dentist 's mother 's wife 's mother is gentle .	my dentist talks to my boss 's dentist 's mother 's wife 's mother is gentle .
the dentist says that your grandmother 's daughter 's brother 's teacher 's brother is healthy .	the dentist talks to your grandmother 's daughter 's brother 's teacher 's brother is healthy .
my dentist knows that my teacher 's sister 's friend 's doctor 's wife is sleepy .	my dentist works with my teacher 's sister 's friend 's doctor 's wife is sleepy .
Tracy says that my sister 's daughter 's doctor 's teacher 's wife is busy .	Tracy talks to my sister 's daughter 's doctor 's teacher 's wife is busy .
Nina knows that my dad 's grandmother 's wife 's daughter 's grandmother is bored .	Nina talks to my dad 's grandmother 's wife 's daughter 's grandmother is bored .
the driver knows that my dad 's friend 's dad 's doctor 's dentist is gentle .	the driver helps my dad 's friend 's dad 's doctor 's dentist is gentle .
Vanessa says that your friend 's wife 's boss 's daughter 's boss is surprised .	Vanessa helps your friend 's wife 's boss 's daughter 's boss is surprised .
my doctor knows that your boss 's mom 's grandmother 's father 's dentist is surprised .	my doctor scares your boss 's mom 's grandmother 's father 's dentist is surprised .
Karen thinks that my cousin 's sister 's wife 's husband 's father is sleepy .	Karen works with my cousin 's sister 's wife 's husband 's father is sleepy .
the child says that your grandmother 's doctor 's wife 's mom 's son is smart .	the child talks to your grandmother 's doctor 's wife 's mom 's son is smart .
the dancer says that your cousin 's wife 's husband 's husband 's dentist is kind .	the dancer works with your cousin 's wife 's husband 's husband 's dentist is kind .
your teacher thinks that your daughter 's grandmother 's sister 's wife 's husband is boring .	your teacher scares your daughter 's grandmother 's sister 's wife 's husband is boring .
the adult says that your mom 's dentist 's doctor 's mother 's boss is smart .	the adult works with your mom 's dentist 's doctor 's mother 's boss is smart .
the person knows that my sister 's doctor 's dentist 's friend 's friend is careful .	the person works with my sister 's doctor 's dentist 's friend 's friend is careful .
Anne says that your mother 's cousin 's friend 's brother 's grandmother is kind .	Anne helps your mother 's cousin 's friend 's brother 's grandmother is kind .
the teacher thinks that my father 's brother 's cousin 's cousin 's friend is gentle .	the teacher works with my father 's brother 's cousin 's cousin 's friend is gentle .
Sarah knows that my grandmother 's mom 's mom 's sister 's father is young .	Sarah scares my grandmother 's mom 's mom 's sister 's father is young .
my dentist thinks that my grandmother 's daughter 's boss 's mom 's son is excited .	my dentist talks to my grandmother 's daughter 's boss 's mom 's son is excited .
the adult thinks that my friend 's mother 's dentist 's dad 's son is excited .	the adult scares my friend 's mother 's dentist 's dad 's son is excited .
your cousin thinks that my grandmother 's boss 's dentist 's sister 's boss is excited .	your cousin helps my grandmother 's boss 's dentist 's sister 's boss is excited .
my dentist thinks that my son 's daughter 's doctor 's boss 's mother is boring .	my dentist helps my son 's daughter 's doctor 's boss 's mother is boring .
the dentist says that your cousin 's dad 's husband 's cousin 's teacher is hungry .	the dentist talks to your cousin 's dad 's husband 's cousin 's teacher is hungry .
my boss says that your dentist 's grandmother 's grandmother 's wife 's daughter is curious .	my boss talks to your dentist 's grandmother 's grandmother 's wife 's daughter is curious .
your doctor thinks that your mom 's sister 's brother 's cousin 's cousin is strong .	your doctor helps your mom 's sister 's brother 's cousin 's cousin is strong .
Martin says that my daughter 's boss 's dad 's dad 's boss is smart .	Martin works with my daughter 's boss 's dad 's dad 's boss is smart .
