the bed knows that my friend 's cousin 's brother 's sister 's cousin 's father 's daughter 's son 's dish is careful .	the bed helps my friend 's cousin 's brother 's sister 's cousin 's father 's daughter 's son 's dish is careful .
the glass knows that my boss 's husband 's sister 's wife 's wife 's father 's brother 's friend 's rocket is nice .	the glass works with my boss 's husband 's sister 's wife 's wife 's father 's brother 's friend 's rocket is nice .
the book knows that my boss 's cousin 's doctor 's cousin 's dad 's friend 's father 's daughter 's bicycle is bored .	the book helps my boss 's cousin 's doctor 's cousin 's dad 's friend 's father 's daughter 's bicycle is bored .
the picture says that my mom 's father 's friend 's husband 's son 's teacher 's cousin 's daughter 's bag is hungry .	the picture talks to my mom 's father 's friend 's husband 's son 's teacher 's cousin 's daughter 's bag is hungry .
the shirt knows that your sister 's mom 's friend 's husband 's dentist 's mom 's dad 's father 's rocket is busy .	the shirt helps your sister 's mom 's friend 's husband 's dentist 's mom 's dad 's father 's rocket is busy .
the doll thinks that your doctor 's father 's son 's cousin 's teacher 's dad 's husband 's mother 's fork is clever .	the doll scares your doctor 's father 's son 's cousin 's teacher 's dad 's husband 's mother 's fork is clever .
the boat thinks that your friend 's mother 's dad 's friend 's father 's cousin 's friend 's daughter 's doll is friendly .	the boat talks to your friend 's mother 's dad 's friend 's father 's cousin 's friend 's daughter 's doll is friendly .
the candle thinks that your son 's wife 's boss 's mother 's brother 's wife 's cousin 's dad 's truck is careful .	the candle talks to your son 's wife 's boss 's mother 's brother 's wife 's cousin 's dad 's truck is careful .
the fork says that my boss 's sister 's teacher 's sister 's grandmother 's wife 's wife 's cousin 's window is curious .	the fork helps my boss 's sister 's teacher 's sister 's grandmother 's wife 's wife 's cousin 's window is curious .
the rug thinks that your friend 's cousin 's sister 's brother 's daughter 's teacher 's wife 's husband 's door is clever .	the rug helps your friend 's cousin 's sister 's brother 's daughter 's teacher 's wife 's husband 's door is clever .
the crayon says that your dentist 's daughter 's dad 's doctor 's doctor 's wife 's cousin 's father 's doll is lucky .	the crayon helps your dentist 's daughter 's dad 's doctor 's doctor 's wife 's cousin 's father 's doll is lucky .
the picture knows that your grandmother 's mother 's teacher 's sister 's mom 's mom 's mother 's son 's book is busy .	the picture helps your grandmother 's mother 's teacher 's sister 's mom 's mom 's mother 's son 's book is busy .
the book says that your doctor 's teacher 's boss 's brother 's doctor 's brother 's daughter 's dentist 's mirror is upset .	the book helps your doctor 's teacher 's boss 's brother 's doctor 's brother 's daughter 's dentist 's mirror is upset .
the door knows that my grandmother 's brother 's daughter 's boss 's sister 's wife 's mom 's cousin 's plane is young .	the door works with my grandmother 's brother 's daughter 's boss 's sister 's wife 's mom 's cousin 's plane is young .
the picture knows that your son 's cousin 's teacher 's cousin 's sister 's father 's mother 's mother 's cup is upset .	the picture scares your son 's cousin 's teacher 's cousin 's sister 's father 's mother 's mother 's cup is upset .
the door thinks that my brother 's grandmother 's friend 's grandmother 's boss 's son 's grandmother 's dentist 's car is bored .	the door works with my brother 's grandmother 's friend 's grandmother 's boss 's son 's grandmother 's dentist 's car is bored .
the book knows that your dentist 's sister 's husband 's husband 's sister 's sister 's daughter 's husband 's crayon is happy .	the book talks to your dentist 's sister 's husband 's husband 's sister 's sister 's daughter 's husband 's crayon is happy .
the book knows that my cousin 's dad 's father 's mom 's grandmother 's boss 's son 's dad 's ship is young .	the book scares my cousin 's dad 's father 's mom 's grandmother 's boss 's son 's dad 's ship is young .
the fork says that my mother 's doctor 's grandmother 's cousin 's dad 's daughter 's doctor 's husband 's box is friendly .	the fork helps my mother 's doctor 's grandmother 's cousin 's dad 's daughter 's doctor 's husband 's box is friendly .
the picture knows that my sister 's cousin 's teacher 's daughter 's sister 's grandmother 's dentist 's husband 's bed is kind .	the picture works with my sister 's cousin 's teacher 's daughter 's sister 's grandmother 's dentist 's husband 's bed is kind .
the book says that your friend 's daughter 's dentist 's friend 's father 's doctor 's teacher 's mother 's glass is bored .	the book talks to your friend 's daughter 's dentist 's friend 's father 's doctor 's teacher 's mother 's glass is bored .
the candle knows that my cousin 's father 's son 's daughter 's cousin 's doctor 's boss 's sister 's crayon is nice .	the candle talks to my cousin 's father 's son 's daughter 's cousin 's doctor 's boss 's sister 's crayon is nice .
the glass knows that your mom 's brother 's daughter 's doctor 's father 's brother 's sister 's friend 's crayon is careful .	the glass helps your mom 's brother 's daughter 's doctor 's father 's brother 's sister 's friend 's crayon is careful .
the picture thinks that your dad 's dentist 's dad 's doctor 's father 's friend 's dad 's grandmother 's bowl is tall .	the picture works with your dad 's dentist 's dad 's doctor 's father 's friend 's dad 's grandmother 's bowl is tall .
the bowl thinks that your friend 's father 's friend 's father 's grandmother 's grandmother 's father 's wife 's bicycle is important .	the bowl talks to your friend 's father 's friend 's father 's grandmother 's grandmother 's father 's wife 's bicycle is important .
the truck knows that your husband 's wife 's doctor 's dentist 's father 's mom 's mom 's boss 's couch is smart .	the truck scares your husband 's wife 's doctor 's dentist 's father 's mom 's mom 's boss 's couch is smart .
the shirt knows that your wife 's friend 's doctor 's mother 's wife 's friend 's doctor 's husband 's couch is curious .	the shirt helps your wife 's friend 's doctor 's mother 's wife 's friend 's doctor 's husband 's couch is curious .
the chair knows that my cousin 's daughter 's mom 's doctor 's son 's mom 's doctor 's friend 's picture is bored .	the chair scares my cousin 's daughter 's mom 's doctor 's son 's mom 's doctor 's friend 's picture is bored .
the plate knows that my daughter 's cousin 's sister 's dad 's mother 's friend 's wife 's husband 's car is friendly .	the plate talks to my daughter 's cousin 's sister 's dad 's mother 's friend 's wife 's husband 's car is friendly .
the couch knows that my brother 's son 's mom 's boss 's mom 's mother 's dad 's dad 's bag is excited .	the couch talks to my brother 's son 's mom 's boss 's mom 's mother 's dad 's dad 's bag is excited .
the chair says that my cousin 's mother 's dad 's daughter 's brother 's cousin 's friend 's husband 's box is clever .	the chair talks to my cousin 's mother 's dad 's daughter 's brother 's cousin 's friend 's husband 's box is clever .
the picture thinks that your wife 's boss 's husband 's mother 's mother 's son 's brother 's husband 's fork is hungry .	the picture helps your wife 's boss 's husband 's mother 's mother 's son 's brother 's husband 's fork is hungry .
the mirror knows that my doctor 's teacher 's dad 's friend 's mom 's daughter 's sister 's husband 's shoe is tired .	the mirror talks to my doctor 's teacher 's dad 's friend 's mom 's daughter 's sister 's husband 's shoe is tired .
the ship thinks that your brother 's mom 's brother 's husband 's son 's friend 's grandmother 's sister 's chair is busy .	the ship talks to your brother 's mom 's brother 's husband 's son 's friend 's grandmother 's sister 's chair is busy .
the hat thinks that your wife 's grandmother 's friend 's friend 's cousin 's mother 's friend 's teacher 's button is lucky .	the hat talks to your wife 's grandmother 's friend 's friend 's cousin 's mother 's friend 's teacher 's button is lucky .
the hat knows that my son 's brother 's son 's friend 's son 's daughter 's mom 's husband 's shoe is important .	the hat works with my son 's brother 's son 's friend 's son 's daughter 's mom 's husband 's shoe is important .
the plate thinks that your daughter 's dentist 's dad 's father 's son 's wife 's dad 's sister 's door is quiet .	the plate works with your daughter 's dentist 's dad 's father 's son 's wife 's dad 's sister 's door is quiet .
the plane says that your dad 's grandmother 's dad 's friend 's grandmother 's son 's dad 's father 's book is sleepy .	the plane works with your dad 's grandmother 's dad 's friend 's grandmother 's son 's dad 's father 's book is sleepy .
the window knows that your mom 's father 's doctor 's husband 's husband 's boss 's grandmother 's doctor 's window is upset .	the window talks to your mom 's father 's doctor 's husband 's husband 's boss 's grandmother 's doctor 's window is upset .
the ring says that my brother 's brother 's husband 's daughter 's brother 's brother 's daughter 's daughter 's toy is smart .	the ring scares my brother 's brother 's husband 's daughter 's brother 's brother 's daughter 's daughter 's toy is smart .
the book says that your friend 's dentist 's boss 's mother 's dentist 's friend 's teacher 's son 's rocket is young .	the book scares your friend 's dentist 's boss 's mother 's dentist 's friend 's teacher 's son 's rocket is young .
the box knows that my mom 's grandmother 's doctor 's husband 's boss 's wife 's sister 's wife 's picture is important .	the box talks to my mom 's grandmother 's doctor 's husband 's boss 's wife 's sister 's wife 's picture is important .
the candle says that your husband 's teacher 's doctor 's boss 's daughter 's daughter 's boss 's mom 's dish is helpful .	the candle helps your husband 's teacher 's doctor 's boss 's daughter 's daughter 's boss 's mom 's dish is helpful .
the glass says that your dad 's cousin 's grandmother 's mother 's grandmother 's dad 's dentist 's doctor 's bag is sleepy .	the glass scares your dad 's cousin 's grandmother 's mother 's grandmother 's dad 's dentist 's doctor 's bag is sleepy .
the bag thinks that my husband 's father 's dad 's grandmother 's teacher 's father 's dentist 's brother 's rug is bored .	the bag talks to my husband 's father 's dad 's grandmother 's teacher 's father 's dentist 's brother 's rug is bored .
the cup says that your doctor 's boss 's father 's daughter 's daughter 's mom 's mom 's husband 's bottle is tired .	the cup helps your doctor 's boss 's father 's daughter 's daughter 's mom 's mom 's husband 's bottle is tired .
the candle says that your wife 's dad 's boss 's cousin 's wife 's dad 's sister 's cousin 's hat is confused .	the candle works with your wife 's dad 's boss 's cousin 's wife 's dad 's sister 's cousin 's hat is confused .
the couch thinks that your grandmother 's brother 's brother 's cousin 's friend 's grandmother 's daughter 's dentist 's shoe is bored .	the couch scares your grandmother 's brother 's brother 's cousin 's friend 's grandmother 's daughter 's dentist 's shoe is bored .
the ring says that your dentist 's friend 's mom 's son 's friend 's sister 's dad 's cousin 's crayon is careful .	the ring talks to your dentist 's friend 's mom 's son 's friend 's sister 's dad 's cousin 's crayon is careful .
the plane knows that my son 's dentist 's sister 's son 's cousin 's husband 's mother 's daughter 's ring is tall .	the plane helps my son 's dentist 's sister 's son 's cousin 's husband 's mother 's daughter 's ring is tall .
the window says that my son 's teacher 's father 's wife 's dad 's boss 's son 's daughter 's truck is nice .	the window helps my son 's teacher 's father 's wife 's dad 's boss 's son 's daughter 's truck is nice .
the shirt knows that my grandmother 's doctor 's grandmother 's son 's wife 's daughter 's son 's husband 's boat is angry .	the shirt scares my grandmother 's doctor 's grandmother 's son 's wife 's daughter 's son 's husband 's boat is angry .
the rocket knows that your father 's brother 's boss 's mom 's dad 's dentist 's teacher 's sister 's mirror is strong .	the rocket works with your father 's brother 's boss 's mom 's dad 's dentist 's teacher 's sister 's mirror is strong .
the bag thinks that your father 's teacher 's teacher 's brother 's grandmother 's cousin 's mother 's dad 's toy is bored .	the bag helps your father 's teacher 's teacher 's brother 's grandmother 's cousin 's mother 's dad 's toy is bored .
the truck says that your dad 's husband 's husband 's grandmother 's mom 's father 's father 's son 's plate is excited .	the truck scares your dad 's husband 's husband 's grandmother 's mom 's father 's father 's son 's plate is excited .
the hat knows that my dad 's brother 's father 's boss 's mother 's brother 's father 's sister 's rug is nice .	the hat scares my dad 's brother 's father 's boss 's mother 's brother 's father 's sister 's rug is nice .
the plane thinks that my brother 's friend 's wife 's boss 's father 's doctor 's mother 's father 's truck is kind .	the plane helps my brother 's friend 's wife 's boss 's father 's doctor 's mother 's father 's truck is kind .
the bicycle thinks that my son 's son 's husband 's doctor 's grandmother 's father 's teacher 's daughter 's candle is wrong .	the bicycle talks to my son 's son 's husband 's doctor 's grandmother 's father 's teacher 's daughter 's candle is wrong .
the chair thinks that your grandmother 's grandmother 's teacher 's mother 's teacher 's father 's sister 's sister 's window is confused .	the chair talks to your grandmother 's grandmother 's teacher 's mother 's teacher 's father 's sister 's sister 's window is confused .
the car knows that my father 's teacher 's husband 's doctor 's grandmother 's boss 's husband 's daughter 's doll is confused .	the car works with my father 's teacher 's husband 's doctor 's grandmother 's boss 's husband 's daughter 's doll is confused .
the glass knows that your wife 's friend 's husband 's brother 's son 's wife 's dad 's teacher 's chair is smart .	the glass works with your wife 's friend 's husband 's brother 's son 's wife 's dad 's teacher 's chair is smart .
the shirt thinks that your father 's teacher 's mom 's wife 's son 's brother 's grandmother 's doctor 's doll is quiet .	the shirt scares your father 's teacher 's mom 's wife 's son 's brother 's grandmother 's doctor 's doll is quiet .
the book knows that your mother 's daughter 's brother 's wife 's friend 's cousin 's doctor 's wife 's doll is busy .	the book talks to your mother 's daughter 's brother 's wife 's friend 's cousin 's doctor 's wife 's doll is busy .
the dish says that my daughter 's mother 's sister 's brother 's dad 's son 's doctor 's daughter 's crayon is tall .	the dish scares my daughter 's mother 's sister 's brother 's dad 's son 's doctor 's daughter 's crayon is tall .
the book knows that my boss 's son 's boss 's mother 's mother 's son 's teacher 's sister 's door is wrong .	the book works with my boss 's son 's boss 's mother 's mother 's son 's teacher 's sister 's door is wrong .
the rocket says that your daughter 's friend 's friend 's grandmother 's mother 's daughter 's wife 's grandmother 's bicycle is gentle .	the rocket scares your daughter 's friend 's friend 's grandmother 's mother 's daughter 's wife 's grandmother 's bicycle is gentle .
the candle knows that my dentist 's grandmother 's boss 's father 's doctor 's mother 's daughter 's wife 's bottle is upset .	the candle helps my dentist 's grandmother 's boss 's father 's doctor 's mother 's daughter 's wife 's bottle is upset .
the crayon knows that your grandmother 's teacher 's boss 's husband 's teacher 's son 's dad 's daughter 's spoon is helpful .	the crayon talks to your grandmother 's teacher 's boss 's husband 's teacher 's son 's dad 's daughter 's spoon is helpful .
the bicycle knows that your doctor 's boss 's mother 's sister 's wife 's son 's dad 's mother 's shirt is healthy .	the bicycle works with your doctor 's boss 's mother 's sister 's wife 's son 's dad 's mother 's shirt is healthy .
the toy knows that my dentist 's husband 's son 's wife 's dad 's dentist 's father 's husband 's chair is curious .	the toy helps my dentist 's husband 's son 's wife 's dad 's dentist 's father 's husband 's chair is curious .
the ring thinks that your cousin 's sister 's mother 's wife 's cousin 's husband 's mother 's daughter 's fork is tired .	the ring works with your cousin 's sister 's mother 's wife 's cousin 's husband 's mother 's daughter 's fork is tired .
the bag says that your boss 's husband 's dentist 's dentist 's father 's sister 's grandmother 's teacher 's door is sleepy .	the bag works with your boss 's husband 's dentist 's dentist 's father 's sister 's grandmother 's teacher 's door is sleepy .
the car knows that your dentist 's daughter 's mom 's mom 's father 's friend 's grandmother 's husband 's ring is clever .	the car talks to your dentist 's daughter 's mom 's mom 's father 's friend 's grandmother 's husband 's ring is clever .
the car knows that your father 's teacher 's brother 's mom 's husband 's brother 's father 's wife 's bottle is confused .	the car works with your father 's teacher 's brother 's mom 's husband 's brother 's father 's wife 's bottle is confused .
the picture thinks that your friend 's teacher 's daughter 's grandmother 's dentist 's sister 's mom 's dad 's doll is tired .	the picture works with your friend 's teacher 's daughter 's grandmother 's dentist 's sister 's mom 's dad 's doll is tired .
the ring says that your sister 's husband 's mom 's grandmother 's teacher 's friend 's friend 's boss 's fork is upset .	the ring scares your sister 's husband 's mom 's grandmother 's teacher 's friend 's friend 's boss 's fork is upset .
the toy knows that your son 's doctor 's doctor 's friend 's mother 's mother 's mom 's wife 's rug is tall .	the toy helps your son 's doctor 's doctor 's friend 's mother 's mother 's mom 's wife 's rug is tall .
the crayon knows that your brother 's sister 's sister 's father 's sister 's husband 's cousin 's mom 's rug is careful .	the crayon scares your brother 's sister 's sister 's father 's sister 's husband 's cousin 's mom 's rug is careful .
the bed says that my grandmother 's brother 's cousin 's father 's cousin 's dentist 's wife 's boss 's toy is excited .	the bed helps my grandmother 's brother 's cousin 's father 's cousin 's dentist 's wife 's boss 's toy is excited .
the bottle says that my boss 's grandmother 's cousin 's teacher 's brother 's boss 's mom 's daughter 's plane is nice .	the bottle works with my boss 's grandmother 's cousin 's teacher 's brother 's boss 's mom 's daughter 's plane is nice .
the plate knows that my wife 's brother 's sister 's teacher 's father 's dad 's grandmother 's grandmother 's bag is quiet .	the plate helps my wife 's brother 's sister 's teacher 's father 's dad 's grandmother 's grandmother 's bag is quiet .
the door knows that my sister 's son 's father 's cousin 's boss 's son 's friend 's dad 's shirt is helpful .	the door helps my sister 's son 's father 's cousin 's boss 's son 's friend 's dad 's shirt is helpful .
the crayon thinks that my mom 's doctor 's brother 's husband 's mom 's son 's dentist 's mother 's rocket is clever .	the crayon talks to my mom 's doctor 's brother 's husband 's mom 's son 's dentist 's mother 's rocket is clever .
the car knows that my father 's teacher 's father 's father 's daughter 's doctor 's teacher 's son 's bowl is curious .	the car helps my father 's teacher 's father 's father 's daughter 's doctor 's teacher 's son 's bowl is curious .
the button says that your dentist 's father 's friend 's boss 's father 's father 's teacher 's father 's candle is strong .	the button talks to your dentist 's father 's friend 's boss 's father 's father 's teacher 's father 's candle is strong .
the hat thinks that my teacher 's grandmother 's daughter 's father 's brother 's son 's dad 's dad 's fork is lucky .	the hat talks to my teacher 's grandmother 's daughter 's father 's brother 's son 's dad 's dad 's fork is lucky .
the hat thinks that my wife 's daughter 's wife 's sister 's teacher 's boss 's wife 's teacher 's fork is kind .	the hat works with my wife 's daughter 's wife 's sister 's teacher 's boss 's wife 's teacher 's fork is kind .
the mirror knows that my sister 's doctor 's brother 's husband 's cousin 's grandmother 's boss 's wife 's shoe is busy .	the mirror scares my sister 's doctor 's brother 's husband 's cousin 's grandmother 's boss 's wife 's shoe is busy .
the car knows that my boss 's husband 's cousin 's dentist 's friend 's grandmother 's friend 's boss 's book is lucky .	the car helps my boss 's husband 's cousin 's dentist 's friend 's grandmother 's friend 's boss 's book is lucky .
the shirt says that my dad 's teacher 's daughter 's brother 's mom 's sister 's wife 's dad 's fork is clever .	the shirt scares my dad 's teacher 's daughter 's brother 's mom 's sister 's wife 's dad 's fork is clever .
the button says that my father 's father 's doctor 's brother 's friend 's son 's father 's teacher 's mirror is quiet .	the button scares my father 's father 's doctor 's brother 's friend 's son 's father 's teacher 's mirror is quiet .
the car thinks that your wife 's wife 's teacher 's dentist 's doctor 's husband 's doctor 's father 's boat is sleepy .	the car helps your wife 's wife 's teacher 's dentist 's doctor 's husband 's doctor 's father 's boat is sleepy .
the shoe says that your teacher 's doctor 's wife 's mother 's boss 's doctor 's dentist 's dad 's rocket is quiet .	the shoe talks to your teacher 's doctor 's wife 's mother 's boss 's doctor 's dentist 's dad 's rocket is quiet .
the bicycle says that my boss 's son 's sister 's cousin 's doctor 's mom 's friend 's daughter 's bed is helpful .	the bicycle works with my boss 's son 's sister 's cousin 's doctor 's mom 's friend 's daughter 's bed is helpful .
the hat knows that your teacher 's grandmother 's dad 's father 's friend 's friend 's sister 's wife 's plane is careful .	the hat helps your teacher 's grandmother 's dad 's father 's friend 's friend 's sister 's wife 's plane is careful .
the mirror thinks that my father 's sister 's mother 's doctor 's sister 's dad 's wife 's mom 's shirt is bored .	the mirror helps my father 's sister 's mother 's doctor 's sister 's dad 's wife 's mom 's shirt is bored .
the glass knows that my mother 's doctor 's sister 's wife 's boss 's mother 's dentist 's mother 's doll is upset .	the glass helps my mother 's doctor 's sister 's wife 's boss 's mother 's dentist 's mother 's doll is upset .
the plane says that your father 's boss 's dentist 's teacher 's mom 's mom 's sister 's mom 's button is hungry .	the plane talks to your father 's boss 's dentist 's teacher 's mom 's mom 's sister 's mom 's button is hungry .
the bag thinks that my teacher 's father 's sister 's teacher 's cousin 's grandmother 's mom 's dentist 's bed is wrong .	the bag helps my teacher 's father 's sister 's teacher 's cousin 's grandmother 's mom 's dentist 's bed is wrong .
the mirror knows that my grandmother 's daughter 's brother 's mother 's friend 's dad 's friend 's doctor 's window is boring .	the mirror scares my grandmother 's daughter 's brother 's mother 's friend 's dad 's friend 's doctor 's window is boring .
the doll thinks that my father 's son 's husband 's daughter 's husband 's teacher 's brother 's daughter 's box is healthy .	the doll talks to my father 's son 's husband 's daughter 's husband 's teacher 's brother 's daughter 's box is healthy .
the box knows that my dentist 's teacher 's mother 's daughter 's grandmother 's doctor 's boss 's brother 's ship is strong .	the box helps my dentist 's teacher 's mother 's daughter 's grandmother 's doctor 's boss 's brother 's ship is strong .
the button thinks that my boss 's dad 's dentist 's daughter 's mother 's boss 's dentist 's daughter 's mirror is angry .	the button helps my boss 's dad 's dentist 's daughter 's mother 's boss 's dentist 's daughter 's mirror is angry .
the box thinks that your son 's daughter 's brother 's brother 's teacher 's brother 's mom 's friend 's shoe is bored .	the box works with your son 's daughter 's brother 's brother 's teacher 's brother 's mom 's friend 's shoe is bored .
the bag knows that your wife 's dentist 's dad 's brother 's friend 's doctor 's boss 's teacher 's boat is tired .	the bag talks to your wife 's dentist 's dad 's brother 's friend 's doctor 's boss 's teacher 's boat is tired .
the fork thinks that my father 's daughter 's mother 's dentist 's teacher 's son 's brother 's dentist 's ship is quiet .	the fork talks to my father 's daughter 's mother 's dentist 's teacher 's son 's brother 's dentist 's ship is quiet .
the shirt thinks that your dad 's sister 's doctor 's doctor 's son 's dentist 's cousin 's mom 's bottle is young .	the shirt works with your dad 's sister 's doctor 's doctor 's son 's dentist 's cousin 's mom 's bottle is young .
the book thinks that your dentist 's sister 's son 's grandmother 's dentist 's teacher 's sister 's dentist 's bag is sleepy .	the book scares your dentist 's sister 's son 's grandmother 's dentist 's teacher 's sister 's dentist 's bag is sleepy .
