the chair knows that my son 's boss 's teacher 's son 's grandmother 's dentist 's doctor 's husband 's wife 's dad 's window is surprised .	the chair helps my son 's boss 's teacher 's son 's grandmother 's dentist 's doctor 's husband 's wife 's dad 's window is surprised .
the doll thinks that my father 's dad 's son 's sister 's father 's mom 's father 's cousin 's daughter 's doctor 's plane is careful .	the doll talks to my father 's dad 's son 's sister 's father 's mom 's father 's cousin 's daughter 's doctor 's plane is careful .
the plane thinks that my son 's friend 's brother 's mother 's father 's sister 's brother 's husband 's father 's husband 's bicycle is tall .	the plane helps my son 's friend 's brother 's mother 's father 's sister 's brother 's husband 's father 's husband 's bicycle is tall .
the couch thinks that your cousin 's friend 's daughter 's friend 's mother 's cousin 's dentist 's wife 's teacher 's sister 's bicycle is quiet .	the couch talks to your cousin 's friend 's daughter 's friend 's mother 's cousin 's dentist 's wife 's teacher 's sister 's bicycle is quiet .
the car thinks that your friend 's sister 's mom 's friend 's husband 's father 's husband 's dad 's grandmother 's father 's couch is excited .	the car scares your friend 's sister 's mom 's friend 's husband 's father 's husband 's dad 's grandmother 's father 's couch is excited .
the cup says that my son 's husband 's boss 's son 's dad 's dentist 's mother 's cousin 's mother 's wife 's box is friendly .	the cup talks to my son 's husband 's boss 's son 's dad 's dentist 's mother 's cousin 's mother 's wife 's box is friendly .
the couch thinks that your dentist 's boss 's mother 's boss 's father 's cousin 's brother 's sister 's daughter 's cousin 's crayon is upset .	the couch talks to your dentist 's boss 's mother 's boss 's father 's cousin 's brother 's sister 's daughter 's cousin 's crayon is upset .
the rug thinks that your mom 's dad 's teacher 's father 's teacher 's grandmother 's husband 's wife 's brother 's friend 's fork is friendly .	the rug scares your mom 's dad 's teacher 's father 's teacher 's grandmother 's husband 's wife 's brother 's friend 's fork is friendly .
the rug says that my doctor 's grandmother 's doctor 's mom 's husband 's doctor 's brother 's husband 's doctor 's boss 's dish is helpful .	the rug works with my doctor 's grandmother 's doctor 's mom 's husband 's doctor 's brother 's husband 's doctor 's boss 's dish is helpful .
the rocket knows that your boss 's daughter 's sister 's mom 's grandmother 's father 's daughter 's brother 's brother 's brother 's book is bored .	the rocket scares your boss 's daughter 's sister 's mom 's grandmother 's father 's daughter 's brother 's brother 's brother 's book is bored .
the picture knows that my doctor 's grandmother 's sister 's wife 's dad 's dentist 's dentist 's son 's teacher 's teacher 's ring is quiet .	the picture scares my doctor 's grandmother 's sister 's wife 's dad 's dentist 's dentist 's son 's teacher 's teacher 's ring is quiet .
the spoon thinks that your husband 's sister 's friend 's doctor 's boss 's boss 's wife 's husband 's teacher 's sister 's couch is important .	the spoon scares your husband 's sister 's friend 's doctor 's boss 's boss 's wife 's husband 's teacher 's sister 's couch is important .
the book says that your son 's cousin 's doctor 's sister 's boss 's sister 's wife 's sister 's grandmother 's dentist 's doll is angry .	the book works with your son 's cousin 's doctor 's sister 's boss 's sister 's wife 's sister 's grandmother 's dentist 's doll is angry .
the ship thinks that my mother 's grandmother 's daughter 's dentist 's sister 's dentist 's father 's mom 's boss 's dentist 's plate is excited .	the ship talks to my mother 's grandmother 's daughter 's dentist 's sister 's dentist 's father 's mom 's boss 's dentist 's plate is excited .
the dish knows that my father 's father 's grandmother 's friend 's dentist 's wife 's dad 's mom 's daughter 's dentist 's ship is upset .	the dish works with my father 's father 's grandmother 's friend 's dentist 's wife 's dad 's mom 's daughter 's dentist 's ship is upset .
the shoe says that your daughter 's cousin 's teacher 's mom 's boss 's father 's grandmother 's wife 's grandmother 's father 's shoe is careful .	the shoe scares your daughter 's cousin 's teacher 's mom 's boss 's father 's grandmother 's wife 's grandmother 's father 's shoe is careful .
the hat knows that my mom 's husband 's brother 's wife 's dentist 's brother 's son 's teacher 's dentist 's cousin 's bowl is tall .	the hat talks to my mom 's husband 's brother 's wife 's dentist 's brother 's son 's teacher 's dentist 's cousin 's bowl is tall .
the car says that my brother 's friend 's dentist 's husband 's mother 's grandmother 's boss 's husband 's father 's cousin 's book is nice .	the car scares my brother 's friend 's dentist 's husband 's mother 's grandmother 's boss 's husband 's father 's cousin 's book is nice .
the ship thinks that my dentist 's daughter 's teacher 's teacher 's mother 's friend 's father 's daughter 's daughter 's teacher 's door is hungry .	the ship helps my dentist 's daughter 's teacher 's teacher 's mother 's friend 's father 's daughter 's daughter 's teacher 's door is hungry .
the rug knows that your mother 's mom 's teacher 's doctor 's grandmother 's mother 's teacher 's husband 's son 's mom 's window is excited .	the rug works with your mother 's mom 's teacher 's doctor 's grandmother 's mother 's teacher 's husband 's son 's mom 's window is excited .
the couch knows that my sister 's mom 's cousin 's dentist 's friend 's husband 's teacher 's daughter 's mom 's friend 's boat is healthy .	the couch scares my sister 's mom 's cousin 's dentist 's friend 's husband 's teacher 's daughter 's mom 's friend 's boat is healthy .
the doll thinks that your boss 's sister 's friend 's boss 's dentist 's mother 's sister 's wife 's mother 's mother 's candle is kind .	the doll talks to your boss 's sister 's friend 's boss 's dentist 's mother 's sister 's wife 's mother 's mother 's candle is kind .
the book knows that my boss 's wife 's grandmother 's husband 's father 's mom 's son 's wife 's friend 's sister 's rocket is busy .	the book scares my boss 's wife 's grandmother 's husband 's father 's mom 's son 's wife 's friend 's sister 's rocket is busy .
the glass knows that my husband 's sister 's son 's father 's teacher 's dad 's daughter 's teacher 's brother 's sister 's bottle is happy .	the glass scares my husband 's sister 's son 's father 's teacher 's dad 's daughter 's teacher 's brother 's sister 's bottle is happy .
the bag knows that my dentist 's father 's friend 's sister 's teacher 's husband 's husband 's boss 's mother 's grandmother 's book is happy .	the bag works with my dentist 's father 's friend 's sister 's teacher 's husband 's husband 's boss 's mother 's grandmother 's book is happy .
the chair thinks that your son 's dad 's dentist 's mom 's grandmother 's brother 's doctor 's brother 's father 's mom 's book is excited .	the chair talks to your son 's dad 's dentist 's mom 's grandmother 's brother 's doctor 's brother 's father 's mom 's book is excited .
the boat says that my father 's dentist 's father 's wife 's father 's dad 's sister 's sister 's boss 's mother 's boat is hungry .	the boat helps my father 's dentist 's father 's wife 's father 's dad 's sister 's sister 's boss 's mother 's boat is hungry .
the book says that your brother 's husband 's sister 's husband 's daughter 's teacher 's grandmother 's brother 's daughter 's daughter 's plate is hungry .	the book talks to your brother 's husband 's sister 's husband 's daughter 's teacher 's grandmother 's brother 's daughter 's daughter 's plate is hungry .
the glass says that your doctor 's teacher 's boss 's dad 's boss 's cousin 's dentist 's dad 's grandmother 's wife 's bed is angry .	the glass scares your doctor 's teacher 's boss 's dad 's boss 's cousin 's dentist 's dad 's grandmother 's wife 's bed is angry .
the plate says that my daughter 's wife 's dentist 's boss 's boss 's grandmother 's son 's boss 's daughter 's teacher 's cup is sleepy .	the plate helps my daughter 's wife 's dentist 's boss 's boss 's grandmother 's son 's boss 's daughter 's teacher 's cup is sleepy .
the plane says that your father 's dad 's dentist 's wife 's doctor 's husband 's husband 's boss 's sister 's son 's book is friendly .	the plane talks to your father 's dad 's dentist 's wife 's doctor 's husband 's husband 's boss 's sister 's son 's book is friendly .
the book knows that your mother 's sister 's husband 's mother 's wife 's daughter 's dad 's daughter 's boss 's husband 's candle is young .	the book helps your mother 's sister 's husband 's mother 's wife 's daughter 's dad 's daughter 's boss 's husband 's candle is young .
the book thinks that my sister 's dad 's mom 's son 's dad 's father 's daughter 's son 's son 's dentist 's chair is boring .	the book works with my sister 's dad 's mom 's son 's dad 's father 's daughter 's son 's son 's dentist 's chair is boring .
the toy says that your father 's daughter 's father 's father 's father 's dentist 's doctor 's mother 's son 's sister 's candle is curious .	the toy scares your father 's daughter 's father 's father 's father 's dentist 's doctor 's mother 's son 's sister 's candle is curious .
the box says that my father 's doctor 's doctor 's son 's sister 's teacher 's teacher 's father 's sister 's mother 's fork is tired .	the box works with my father 's doctor 's doctor 's son 's sister 's teacher 's teacher 's father 's sister 's mother 's fork is tired .
the bed knows that your teacher 's dentist 's wife 's cousin 's wife 's boss 's husband 's brother 's sister 's doctor 's book is lucky .	the bed scares your teacher 's dentist 's wife 's cousin 's wife 's boss 's husband 's brother 's sister 's doctor 's book is lucky .
the cup knows that my sister 's husband 's doctor 's father 's son 's dad 's wife 's dentist 's teacher 's cousin 's book is quiet .	the cup helps my sister 's husband 's doctor 's father 's son 's dad 's wife 's dentist 's teacher 's cousin 's book is quiet .
the car knows that my dad 's cousin 's friend 's sister 's husband 's boss 's friend 's friend 's teacher 's husband 's shirt is tired .	the car works with my dad 's cousin 's friend 's sister 's husband 's boss 's friend 's friend 's teacher 's husband 's shirt is tired .
the shoe knows that my wife 's mom 's teacher 's cousin 's mother 's cousin 's grandmother 's dentist 's father 's son 's picture is important .	the shoe talks to my wife 's mom 's teacher 's cousin 's mother 's cousin 's grandmother 's dentist 's father 's son 's picture is important .
the car thinks that my father 's husband 's mother 's sister 's mom 's mother 's grandmother 's son 's teacher 's son 's car is confused .	the car works with my father 's husband 's mother 's sister 's mom 's mother 's grandmother 's son 's teacher 's son 's car is confused .
the plate says that my mom 's dad 's friend 's husband 's brother 's sister 's wife 's son 's brother 's cousin 's chair is lucky .	the plate helps my mom 's dad 's friend 's husband 's brother 's sister 's wife 's son 's brother 's cousin 's chair is lucky .
the book thinks that your cousin 's boss 's dad 's teacher 's cousin 's cousin 's cousin 's husband 's daughter 's cousin 's dish is surprised .	the book scares your cousin 's boss 's dad 's teacher 's cousin 's cousin 's cousin 's husband 's daughter 's cousin 's dish is surprised .
the bottle says that your son 's father 's mother 's mother 's teacher 's boss 's mother 's son 's wife 's doctor 's picture is confused .	the bottle helps your son 's father 's mother 's mother 's teacher 's boss 's mother 's son 's wife 's doctor 's picture is confused .
the fork thinks that my sister 's mother 's mother 's grandmother 's sister 's friend 's teacher 's dad 's husband 's husband 's window is tall .	the fork helps my sister 's mother 's mother 's grandmother 's sister 's friend 's teacher 's dad 's husband 's husband 's window is tall .
the shoe thinks that my teacher 's doctor 's friend 's boss 's teacher 's boss 's boss 's doctor 's daughter 's son 's ship is upset .	the shoe scares my teacher 's doctor 's friend 's boss 's teacher 's boss 's boss 's doctor 's daughter 's son 's ship is upset .
the bottle knows that your teacher 's grandmother 's brother 's son 's mother 's mom 's daughter 's dad 's boss 's mom 's bed is gentle .	the bottle works with your teacher 's grandmother 's brother 's son 's mother 's mom 's daughter 's dad 's boss 's mom 's bed is gentle .
the window knows that my son 's mom 's father 's dad 's son 's friend 's brother 's mom 's cousin 's grandmother 's door is kind .	the window scares my son 's mom 's father 's dad 's son 's friend 's brother 's mom 's cousin 's grandmother 's door is kind .
the car thinks that your boss 's husband 's mom 's grandmother 's mother 's cousin 's husband 's grandmother 's father 's friend 's truck is tall .	the car talks to your boss 's husband 's mom 's grandmother 's mother 's cousin 's husband 's grandmother 's father 's friend 's truck is tall .
the bed knows that my dentist 's son 's daughter 's husband 's friend 's husband 's mom 's friend 's friend 's husband 's spoon is surprised .	the bed scares my dentist 's son 's daughter 's husband 's friend 's husband 's mom 's friend 's friend 's husband 's spoon is surprised .
the bottle thinks that my son 's doctor 's father 's mother 's mom 's husband 's mother 's mother 's husband 's son 's rocket is gentle .	the bottle talks to my son 's doctor 's father 's mother 's mom 's husband 's mother 's mother 's husband 's son 's rocket is gentle .
the candle says that your grandmother 's dad 's boss 's daughter 's grandmother 's sister 's friend 's friend 's dad 's teacher 's bowl is sleepy .	the candle scares your grandmother 's dad 's boss 's daughter 's grandmother 's sister 's friend 's friend 's dad 's teacher 's bowl is sleepy .
the rocket knows that your dentist 's dentist 's cousin 's mom 's mom 's dentist 's cousin 's dad 's father 's father 's toy is friendly .	the rocket talks to your dentist 's dentist 's cousin 's mom 's mom 's dentist 's cousin 's dad 's father 's father 's toy is friendly .
the candle thinks that your mother 's friend 's mom 's dad 's dad 's grandmother 's cousin 's brother 's teacher 's husband 's bicycle is tired .	the candle helps your mother 's friend 's mom 's dad 's dad 's grandmother 's cousin 's brother 's teacher 's husband 's bicycle is tired .
the truck says that my sister 's grandmother 's cousin 's sister 's teacher 's wife 's husband 's friend 's mother 's grandmother 's plate is excited .	the truck helps my sister 's grandmother 's cousin 's sister 's teacher 's wife 's husband 's friend 's mother 's grandmother 's plate is excited .
the couch knows that my sister 's brother 's mom 's husband 's son 's friend 's brother 's mom 's son 's brother 's bag is tall .	the couch scares my sister 's brother 's mom 's husband 's son 's friend 's brother 's mom 's son 's brother 's bag is tall .
the bed says that your dad 's son 's brother 's dentist 's husband 's doctor 's wife 's husband 's husband 's boss 's fork is smart .	the bed talks to your dad 's son 's brother 's dentist 's husband 's doctor 's wife 's husband 's husband 's boss 's fork is smart .
the plane says that my daughter 's doctor 's husband 's sister 's dad 's dentist 's teacher 's doctor 's father 's son 's plate is happy .	the plane talks to my daughter 's doctor 's husband 's sister 's dad 's dentist 's teacher 's doctor 's father 's son 's plate is happy .
the plate thinks that your friend 's mother 's dentist 's dentist 's daughter 's mom 's brother 's teacher 's mom 's teacher 's shoe is friendly .	the plate talks to your friend 's mother 's dentist 's dentist 's daughter 's mom 's brother 's teacher 's mom 's teacher 's shoe is friendly .
the shoe thinks that my boss 's father 's brother 's daughter 's dad 's boss 's doctor 's doctor 's friend 's father 's book is sleepy .	the shoe scares my boss 's father 's brother 's daughter 's dad 's boss 's doctor 's doctor 's friend 's father 's book is sleepy .
the boat knows that your father 's sister 's grandmother 's sister 's husband 's brother 's doctor 's sister 's father 's father 's boat is happy .	the boat scares your father 's sister 's grandmother 's sister 's husband 's brother 's doctor 's sister 's father 's father 's boat is happy .
the bottle thinks that your husband 's doctor 's wife 's daughter 's friend 's father 's husband 's doctor 's wife 's dentist 's bag is smart .	the bottle works with your husband 's doctor 's wife 's daughter 's friend 's father 's husband 's doctor 's wife 's dentist 's bag is smart .
the rocket says that my cousin 's son 's doctor 's brother 's sister 's doctor 's friend 's dad 's cousin 's wife 's plate is strong .	the rocket scares my cousin 's son 's doctor 's brother 's sister 's doctor 's friend 's dad 's cousin 's wife 's plate is strong .
the toy knows that your dentist 's doctor 's dad 's cousin 's grandmother 's daughter 's doctor 's teacher 's mother 's sister 's shoe is healthy .	the toy talks to your dentist 's doctor 's dad 's cousin 's grandmother 's daughter 's doctor 's teacher 's mother 's sister 's shoe is healthy .
the bottle says that your cousin 's dad 's cousin 's father 's mom 's husband 's cousin 's doctor 's teacher 's wife 's ship is bored .	the bottle scares your cousin 's dad 's cousin 's father 's mom 's husband 's cousin 's doctor 's teacher 's wife 's ship is bored .
the bowl says that your husband 's husband 's teacher 's dad 's father 's mom 's mother 's dad 's grandmother 's mom 's bottle is smart .	the bowl scares your husband 's husband 's teacher 's dad 's father 's mom 's mother 's dad 's grandmother 's mom 's bottle is smart .
the rug knows that my mother 's teacher 's wife 's dentist 's teacher 's husband 's husband 's mom 's friend 's doctor 's shirt is sleepy .	the rug talks to my mother 's teacher 's wife 's dentist 's teacher 's husband 's husband 's mom 's friend 's doctor 's shirt is sleepy .
the plane says that your wife 's dad 's mom 's son 's teacher 's daughter 's dad 's grandmother 's dad 's doctor 's doll is upset .	the plane helps your wife 's dad 's mom 's son 's teacher 's daughter 's dad 's grandmother 's dad 's doctor 's doll is upset .
the rocket says that my daughter 's grandmother 's brother 's father 's boss 's father 's dad 's sister 's sister 's brother 's doll is quiet .	the rocket talks to my daughter 's grandmother 's brother 's father 's boss 's father 's dad 's sister 's sister 's brother 's doll is quiet .
the ship says that your boss 's husband 's mom 's wife 's boss 's boss 's sister 's husband 's daughter 's teacher 's hat is young .	the ship scares your boss 's husband 's mom 's wife 's boss 's boss 's sister 's husband 's daughter 's teacher 's hat is young .
the glass says that your cousin 's mother 's dentist 's friend 's husband 's dentist 's mother 's boss 's friend 's cousin 's hat is tired .	the glass works with your cousin 's mother 's dentist 's friend 's husband 's dentist 's mother 's boss 's friend 's cousin 's hat is tired .
the dish knows that my mom 's grandmother 's sister 's sister 's mother 's mother 's wife 's mother 's cousin 's sister 's rocket is young .	the dish works with my mom 's grandmother 's sister 's sister 's mother 's mother 's wife 's mother 's cousin 's sister 's rocket is young .
the bag knows that my daughter 's cousin 's daughter 's teacher 's daughter 's mother 's husband 's cousin 's daughter 's grandmother 's crayon is curious .	the bag scares my daughter 's cousin 's daughter 's teacher 's daughter 's mother 's husband 's cousin 's daughter 's grandmother 's crayon is curious .
the rocket thinks that my cousin 's cousin 's mother 's sister 's dad 's dentist 's cousin 's boss 's dad 's cousin 's car is excited .	the rocket works with my cousin 's cousin 's mother 's sister 's dad 's dentist 's cousin 's boss 's dad 's cousin 's car is excited .
the bag says that my friend 's sister 's brother 's mother 's mom 's boss 's dad 's husband 's brother 's mother 's door is gentle .	the bag works with my friend 's sister 's brother 's mother 's mom 's boss 's dad 's husband 's brother 's mother 's door is gentle .
the rocket says that your cousin 's daughter 's teacher 's dentist 's mother 's grandmother 's mom 's dentist 's grandmother 's teacher 's button is upset .	the rocket helps your cousin 's daughter 's teacher 's dentist 's mother 's grandmother 's mom 's dentist 's grandmother 's teacher 's button is upset .
the rug says that your doctor 's grandmother 's teacher 's grandmother 's mom 's son 's dad 's friend 's father 's teacher 's ring is hungry .	the rug talks to your doctor 's grandmother 's teacher 's grandmother 's mom 's son 's dad 's friend 's father 's teacher 's ring is hungry .
the box says that your grandmother 's grandmother 's teacher 's sister 's teacher 's sister 's father 's friend 's mom 's sister 's book is healthy .	the box talks to your grandmother 's grandmother 's teacher 's sister 's teacher 's sister 's father 's friend 's mom 's sister 's book is healthy .
the boat says that your mom 's teacher 's daughter 's dad 's son 's doctor 's doctor 's son 's mom 's sister 's car is curious .	the boat works with your mom 's teacher 's daughter 's dad 's son 's doctor 's doctor 's son 's mom 's sister 's car is curious .
the bag thinks that my dad 's father 's sister 's mother 's boss 's father 's teacher 's grandmother 's husband 's mother 's glass is curious .	the bag works with my dad 's father 's sister 's mother 's boss 's father 's teacher 's grandmother 's husband 's mother 's glass is curious .
the rug says that your husband 's wife 's son 's dad 's grandmother 's dad 's doctor 's cousin 's son 's friend 's toy is bored .	the rug scares your husband 's wife 's son 's dad 's grandmother 's dad 's doctor 's cousin 's son 's friend 's toy is bored .
the ring says that my dad 's son 's father 's wife 's brother 's wife 's brother 's sister 's son 's doctor 's book is tired .	the ring works with my dad 's son 's father 's wife 's brother 's wife 's brother 's sister 's son 's doctor 's book is tired .
the picture says that your mother 's teacher 's doctor 's brother 's husband 's cousin 's husband 's son 's cousin 's brother 's ship is healthy .	the picture works with your mother 's teacher 's doctor 's brother 's husband 's cousin 's husband 's son 's cousin 's brother 's ship is healthy .
the car says that my friend 's teacher 's husband 's friend 's dad 's brother 's brother 's friend 's mom 's daughter 's rocket is nice .	the car works with my friend 's teacher 's husband 's friend 's dad 's brother 's brother 's friend 's mom 's daughter 's rocket is nice .
the couch knows that your mother 's boss 's boss 's dentist 's dentist 's father 's daughter 's wife 's mother 's doctor 's bowl is careful .	the couch talks to your mother 's boss 's boss 's dentist 's dentist 's father 's daughter 's wife 's mother 's doctor 's bowl is careful .
the glass says that your dentist 's boss 's father 's daughter 's brother 's son 's wife 's wife 's cousin 's cousin 's dish is lucky .	the glass talks to your dentist 's boss 's father 's daughter 's brother 's son 's wife 's wife 's cousin 's cousin 's dish is lucky .
the bicycle knows that your mom 's son 's friend 's mother 's cousin 's wife 's wife 's cousin 's husband 's daughter 's doll is excited .	the bicycle works with your mom 's son 's friend 's mother 's cousin 's wife 's wife 's cousin 's husband 's daughter 's doll is excited .
the plane thinks that my grandmother 's daughter 's father 's wife 's boss 's wife 's dad 's husband 's cousin 's doctor 's bottle is tall .	the plane talks to my grandmother 's daughter 's father 's wife 's boss 's wife 's dad 's husband 's cousin 's doctor 's bottle is tall .
the bottle says that your cousin 's doctor 's mom 's doctor 's cousin 's boss 's father 's daughter 's mother 's son 's picture is important .	the bottle works with your cousin 's doctor 's mom 's doctor 's cousin 's boss 's father 's daughter 's mother 's son 's picture is important .
the mirror knows that my boss 's cousin 's boss 's mom 's daughter 's sister 's wife 's sister 's father 's brother 's shirt is wrong .	the mirror works with my boss 's cousin 's boss 's mom 's daughter 's sister 's wife 's sister 's father 's brother 's shirt is wrong .
the mirror thinks that your grandmother 's mother 's grandmother 's doctor 's husband 's grandmother 's husband 's daughter 's friend 's wife 's toy is important .	the mirror helps your grandmother 's mother 's grandmother 's doctor 's husband 's grandmother 's husband 's daughter 's friend 's wife 's toy is important .
the car knows that my husband 's grandmother 's wife 's dentist 's dentist 's wife 's dad 's son 's grandmother 's boss 's truck is confused .	the car talks to my husband 's grandmother 's wife 's dentist 's dentist 's wife 's dad 's son 's grandmother 's boss 's truck is confused .
the doll thinks that my son 's father 's friend 's wife 's brother 's dad 's wife 's father 's wife 's doctor 's bed is happy .	the doll talks to my son 's father 's friend 's wife 's brother 's dad 's wife 's father 's wife 's doctor 's bed is happy .
the rocket knows that your teacher 's father 's dad 's doctor 's teacher 's mother 's brother 's boss 's son 's friend 's boat is boring .	the rocket talks to your teacher 's father 's dad 's doctor 's teacher 's mother 's brother 's boss 's son 's friend 's boat is boring .
