my friend says that your dad 's grandmother 's doctor 's dad 's father is tired .	my friend talks to your dad 's grandmother 's doctor 's dad 's father is tired .
your boss says that your friend 's wife 's mom 's sister 's mom is angry .	your boss helps your friend 's wife 's mom 's sister 's mom is angry .
the customer knows that my father 's boss 's doctor 's son 's teacher is boring .	the customer helps my father 's boss 's doctor 's son 's teacher is boring .
Naomi thinks that my son 's son 's daughter 's cousin 's son is careful .	Naomi helps my son 's son 's daughter 's cousin 's son is careful .
your friend knows that my sister 's husband 's wife 's sister 's daughter is surprised .	your friend scares my sister 's husband 's wife 's sister 's daughter is surprised .
the customer thinks that your brother 's doctor 's friend 's wife 's sister is hungry .	the customer talks to your brother 's doctor 's friend 's wife 's sister is hungry .
Thomas thinks that my friend 's friend 's brother 's mom 's dentist is kind .	Thomas helps my friend 's friend 's brother 's mom 's dentist is kind .
the customer knows that your mom 's teacher 's teacher 's husband 's father is smart .	the customer talks to your mom 's teacher 's teacher 's husband 's father is smart .
my dentist says that my wife 's father 's teacher 's cousin 's sister is healthy .	my dentist works with my wife 's father 's teacher 's cousin 's sister is healthy .
the dentist thinks that your grandmother 's cousin 's wife 's dentist 's son is strong .	the dentist scares your grandmother 's cousin 's wife 's dentist 's son is strong .
Sara thinks that your dad 's husband 's daughter 's mom 's daughter is important .	Sara scares your dad 's husband 's daughter 's mom 's daughter is important .
my cousin knows that my sister 's boss 's friend 's grandmother 's brother is tall .	my cousin helps my sister 's boss 's friend 's grandmother 's brother is tall .
your teacher thinks that my boss 's husband 's doctor 's wife 's wife is gentle .	your teacher helps my boss 's husband 's doctor 's wife 's wife is gentle .
the dentist says that your wife 's dad 's wife 's mother 's brother is important .	the dentist scares your wife 's dad 's wife 's mother 's brother is important .
the driver knows that my teacher 's husband 's teacher 's sister 's friend is wrong .	the driver talks to my teacher 's husband 's teacher 's sister 's friend is wrong .
your dentist thinks that my cousin 's doctor 's brother 's wife 's doctor is tired .	your dentist scares my cousin 's doctor 's brother 's wife 's doctor is tired .
William says that your mom 's mom 's dad 's teacher 's cousin is wrong .	William talks to your mom 's mom 's dad 's teacher 's cousin is wrong .
Nancy knows that my mother 's mom 's brother 's son 's brother is lucky .	Nancy works with my mother 's mom 's brother 's son 's brother is lucky .
the patient says that your husband 's son 's daughter 's teacher 's wife is sleepy .	the patient helps your husband 's son 's daughter 's teacher 's wife is sleepy .
Kevin thinks that my teacher 's sister 's wife 's doctor 's doctor is smart .	Kevin helps my teacher 's sister 's wife 's doctor 's doctor is smart .
Timothy thinks that your mother 's grandmother 's mom 's boss 's wife is tall .	Timothy works with your mother 's grandmother 's mom 's boss 's wife is tall .
your dentist says that your husband 's friend 's daughter 's boss 's son is healthy .	your dentist works with your husband 's friend 's daughter 's boss 's son is healthy .
your boss knows that your cousin 's grandmother 's grandmother 's daughter 's father is quiet .	your boss scares your cousin 's grandmother 's grandmother 's daughter 's father is quiet .
the dancer says that your friend 's husband 's dentist 's father 's dentist is friendly .	the dancer works with your friend 's husband 's dentist 's father 's dentist is friendly .
Jennifer thinks that my cousin 's daughter 's doctor 's daughter 's boss is nice .	Jennifer scares my cousin 's daughter 's doctor 's daughter 's boss is nice .
Anne says that your teacher 's mom 's father 's cousin 's dad is wrong .	Anne helps your teacher 's mom 's father 's cousin 's dad is wrong .
Peter says that my sister 's dad 's teacher 's grandmother 's teacher is angry .	Peter scares my sister 's dad 's teacher 's grandmother 's teacher is angry .
my boss says that your brother 's teacher 's grandmother 's friend 's teacher is bored .	my boss talks to your brother 's teacher 's grandmother 's friend 's teacher is bored .
Denise knows that your mom 's grandmother 's brother 's son 's cousin is tall .	Denise talks to your mom 's grandmother 's brother 's son 's cousin is tall .
Sally says that your son 's daughter 's sister 's brother 's boss is smart .	Sally talks to your son 's daughter 's sister 's brother 's boss is smart .
Sandra says that my friend 's husband 's son 's doctor 's mother is lucky .	Sandra scares my friend 's husband 's son 's doctor 's mother is lucky .
my dentist thinks that my dad 's father 's wife 's doctor 's mother is healthy .	my dentist works with my dad 's father 's wife 's doctor 's mother is healthy .
my cousin knows that your dad 's cousin 's mom 's dad 's grandmother is kind .	my cousin talks to your dad 's cousin 's mom 's dad 's grandmother is kind .
the person says that my boss 's father 's friend 's wife 's daughter is tired .	the person helps my boss 's father 's friend 's wife 's daughter is tired .
Allison knows that my wife 's brother 's sister 's son 's husband is clever .	Allison talks to my wife 's brother 's sister 's son 's husband is clever .
Rebecca thinks that your dentist 's mom 's brother 's friend 's sister is important .	Rebecca helps your dentist 's mom 's brother 's friend 's sister is important .
Adam thinks that your brother 's sister 's daughter 's husband 's daughter is confused .	Adam helps your brother 's sister 's daughter 's husband 's daughter is confused .
the adult thinks that my brother 's doctor 's cousin 's husband 's friend is excited .	the adult helps my brother 's doctor 's cousin 's husband 's friend is excited .
the teacher knows that my boss 's mom 's friend 's father 's boss is bored .	the teacher works with my boss 's mom 's friend 's father 's boss is bored .
April knows that my boss 's cousin 's doctor 's boss 's husband is angry .	April talks to my boss 's cousin 's doctor 's boss 's husband is angry .
your dentist knows that your boss 's sister 's husband 's brother 's teacher is upset .	your dentist helps your boss 's sister 's husband 's brother 's teacher is upset .
Lisa thinks that your dad 's husband 's mom 's doctor 's brother is busy .	Lisa scares your dad 's husband 's mom 's doctor 's brother is busy .
your doctor thinks that my boss 's husband 's husband 's cousin 's sister is nice .	your doctor helps my boss 's husband 's husband 's cousin 's sister is nice .
the adult thinks that my husband 's wife 's cousin 's brother 's son is wrong .	the adult scares my husband 's wife 's cousin 's brother 's son is wrong .
my boss knows that my dentist 's sister 's daughter 's husband 's father is tall .	my boss scares my dentist 's sister 's daughter 's husband 's father is tall .
the teacher thinks that my teacher 's wife 's doctor 's cousin 's friend is quiet .	the teacher talks to my teacher 's wife 's doctor 's cousin 's friend is quiet .
the teacher thinks that your brother 's friend 's cousin 's grandmother 's cousin is sleepy .	the teacher helps your brother 's friend 's cousin 's grandmother 's cousin is sleepy .
my dentist thinks that my mother 's wife 's sister 's friend 's grandmother is happy .	my dentist scares my mother 's wife 's sister 's friend 's grandmother is happy .
my doctor thinks that my mom 's friend 's brother 's mom 's grandmother is helpful .	my doctor scares my mom 's friend 's brother 's mom 's grandmother is helpful .
Andrew says that my sister 's brother 's mother 's sister 's brother is excited .	Andrew works with my sister 's brother 's mother 's sister 's brother is excited .
Michelle thinks that your teacher 's brother 's grandmother 's doctor 's sister is wrong .	Michelle works with your teacher 's brother 's grandmother 's doctor 's sister is wrong .
my doctor thinks that your dentist 's husband 's mother 's husband 's mom is happy .	my doctor works with your dentist 's husband 's mother 's husband 's mom is happy .
Jessica says that my daughter 's dad 's dad 's daughter 's mom is quiet .	Jessica scares my daughter 's dad 's dad 's daughter 's mom is quiet .
Samantha knows that your brother 's dad 's wife 's teacher 's brother is strong .	Samantha scares your brother 's dad 's wife 's teacher 's brother is strong .
my doctor knows that my dentist 's friend 's mother 's brother 's teacher is nice .	my doctor talks to my dentist 's friend 's mother 's brother 's teacher is nice .
the customer says that your wife 's mom 's cousin 's husband 's daughter is quiet .	the customer talks to your wife 's mom 's cousin 's husband 's daughter is quiet .
the driver thinks that your friend 's father 's daughter 's mother 's friend is lucky .	the driver helps your friend 's father 's daughter 's mother 's friend is lucky .
Wendy thinks that my cousin 's mother 's friend 's daughter 's grandmother is smart .	Wendy works with my cousin 's mother 's friend 's daughter 's grandmother is smart .
my boss knows that your mother 's father 's doctor 's mom 's mom is important .	my boss scares your mother 's father 's doctor 's mom 's mom is important .
Rebecca knows that my mother 's teacher 's dentist 's doctor 's boss is tired .	Rebecca scares my mother 's teacher 's dentist 's doctor 's boss is tired .
the customer thinks that my brother 's father 's brother 's grandmother 's doctor is young .	the customer helps my brother 's father 's brother 's grandmother 's doctor is young .
my cousin thinks that my cousin 's mother 's husband 's cousin 's brother is friendly .	my cousin talks to my cousin 's mother 's husband 's cousin 's brother is friendly .
the doctor thinks that your cousin 's dentist 's cousin 's boss 's mom is upset .	the doctor talks to your cousin 's dentist 's cousin 's boss 's mom is upset .
your friend says that my teacher 's mom 's teacher 's mom 's brother is young .	your friend works with my teacher 's mom 's teacher 's mom 's brother is young .
the adult thinks that your daughter 's father 's cousin 's sister 's husband is careful .	the adult talks to your daughter 's father 's cousin 's sister 's husband is careful .
Judy knows that my husband 's wife 's cousin 's sister 's doctor is gentle .	Judy scares my husband 's wife 's cousin 's sister 's doctor is gentle .
the dancer knows that my son 's dentist 's son 's father 's mom is curious .	the dancer scares my son 's dentist 's son 's father 's mom is curious .
the teacher thinks that your grandmother 's friend 's dad 's sister 's sister is upset .	the teacher scares your grandmother 's friend 's dad 's sister 's sister is upset .
Becky says that my dentist 's son 's cousin 's cousin 's brother is confused .	Becky talks to my dentist 's son 's cousin 's cousin 's brother is confused .
Michael thinks that your father 's dad 's mother 's son 's mother is healthy .	Michael works with your father 's dad 's mother 's son 's mother is healthy .
your cousin knows that my cousin 's boss 's dentist 's mom 's boss is happy .	your cousin works with my cousin 's boss 's dentist 's mom 's boss is happy .
Todd says that your wife 's doctor 's boss 's mother 's daughter is wrong .	Todd scares your wife 's doctor 's boss 's mother 's daughter is wrong .
the person knows that my father 's boss 's mom 's sister 's dentist is gentle .	the person talks to my father 's boss 's mom 's sister 's dentist is gentle .
the customer says that your cousin 's teacher 's daughter 's brother 's sister is nice .	the customer works with your cousin 's teacher 's daughter 's brother 's sister is nice .
Lisa says that my father 's cousin 's dentist 's sister 's wife is kind .	Lisa talks to my father 's cousin 's dentist 's sister 's wife is kind .
the dancer thinks that your teacher 's mother 's boss 's doctor 's teacher is strong .	the dancer helps your teacher 's mother 's boss 's doctor 's teacher is strong .
my friend knows that my grandmother 's husband 's wife 's grandmother 's grandmother is hungry .	my friend works with my grandmother 's husband 's wife 's grandmother 's grandmother is hungry .
the doctor says that your dad 's mom 's teacher 's brother 's mom is busy .	the doctor scares your dad 's mom 's teacher 's brother 's mom is busy .
the customer thinks that your doctor 's dad 's brother 's boss 's mother is young .	the customer talks to your doctor 's dad 's brother 's boss 's mother is young .
my dentist thinks that your teacher 's grandmother 's brother 's boss 's husband is happy .	my dentist scares your teacher 's grandmother 's brother 's boss 's husband is happy .
Julia knows that my dad 's boss 's dentist 's husband 's doctor is excited .	Julia scares my dad 's boss 's dentist 's husband 's doctor is excited .
Becca thinks that your dentist 's father 's doctor 's brother 's boss is tired .	Becca scares your dentist 's father 's doctor 's brother 's boss is tired .
Jerry knows that my husband 's son 's doctor 's cousin 's mother is gentle .	Jerry works with my husband 's son 's doctor 's cousin 's mother is gentle .
the child thinks that my son 's boss 's cousin 's doctor 's dentist is bored .	the child helps my son 's boss 's cousin 's doctor 's dentist is bored .
Jessica thinks that my son 's grandmother 's daughter 's dentist 's grandmother is young .	Jessica helps my son 's grandmother 's daughter 's dentist 's grandmother is young .
my doctor knows that your dentist 's dad 's sister 's brother 's daughter is tall .	my doctor scares your dentist 's dad 's sister 's brother 's daughter is tall .
my cousin says that your brother 's dad 's father 's husband 's friend is curious .	my cousin helps your brother 's dad 's father 's husband 's friend is curious .
your friend says that my friend 's dentist 's brother 's mom 's grandmother is nice .	your friend scares my friend 's dentist 's brother 's mom 's grandmother is nice .
my teacher thinks that your mom 's dad 's teacher 's teacher 's dad is young .	my teacher scares your mom 's dad 's teacher 's teacher 's dad is young .
the person says that my mother 's mom 's husband 's boss 's doctor is kind .	the person talks to my mother 's mom 's husband 's boss 's doctor is kind .
Frank thinks that your son 's wife 's boss 's doctor 's daughter is surprised .	Frank helps your son 's wife 's boss 's doctor 's daughter is surprised .
Nicole says that my doctor 's mother 's teacher 's daughter 's teacher is tired .	Nicole talks to my doctor 's mother 's teacher 's daughter 's teacher is tired .
the dentist knows that your daughter 's sister 's dad 's sister 's daughter is hungry .	the dentist works with your daughter 's sister 's dad 's sister 's daughter is hungry .
my doctor knows that your grandmother 's father 's husband 's cousin 's friend is hungry .	my doctor works with your grandmother 's father 's husband 's cousin 's friend is hungry .
Judy knows that your son 's teacher 's father 's dad 's teacher is excited .	Judy talks to your son 's teacher 's father 's dad 's teacher is excited .
Elizabeth says that my dentist 's sister 's father 's cousin 's mother is curious .	Elizabeth works with my dentist 's sister 's father 's cousin 's mother is curious .
the dentist knows that my friend 's boss 's brother 's grandmother 's mom is hungry .	the dentist talks to my friend 's boss 's brother 's grandmother 's mom is hungry .
the doctor knows that my teacher 's mother 's father 's boss 's dentist is young .	the doctor helps my teacher 's mother 's father 's boss 's dentist is young .
Leslie knows that your daughter 's mother 's daughter 's mother 's husband is important .	Leslie talks to your daughter 's mother 's daughter 's mother 's husband is important .
the dentist knows that your dad 's brother 's sister 's mom 's father is healthy .	the dentist helps your dad 's brother 's sister 's mom 's father is healthy .
Amelia knows that your friend 's dad 's mother 's husband 's boss is sleepy .	Amelia scares your friend 's dad 's mother 's husband 's boss is sleepy .
the teacher thinks that my grandmother 's father 's son 's boss 's husband is helpful .	the teacher works with my grandmother 's father 's son 's boss 's husband is helpful .
the person says that your grandmother 's teacher 's dentist 's mom 's sister is lucky .	the person helps your grandmother 's teacher 's dentist 's mom 's sister is lucky .
George knows that your sister 's teacher 's husband 's teacher 's daughter is busy .	George works with your sister 's teacher 's husband 's teacher 's daughter is busy .
my dentist thinks that your doctor 's son 's dad 's wife 's wife is boring .	my dentist works with your doctor 's son 's dad 's wife 's wife is boring .
the doctor says that your dentist 's teacher 's mom 's daughter 's daughter is wrong .	the doctor helps your dentist 's teacher 's mom 's daughter 's daughter is wrong .
my dentist knows that your son 's boss 's grandmother 's brother 's cousin is gentle .	my dentist scares your son 's boss 's grandmother 's brother 's cousin is gentle .
Amy says that my doctor 's doctor 's wife 's daughter 's dad is friendly .	Amy scares my doctor 's doctor 's wife 's daughter 's dad is friendly .
your friend says that my father 's boss 's wife 's father 's wife is confused .	your friend helps my father 's boss 's wife 's father 's wife is confused .
the patient thinks that my dentist 's son 's son 's grandmother 's son is bored .	the patient scares my dentist 's son 's son 's grandmother 's son is bored .
my teacher says that my mother 's dentist 's mother 's daughter 's husband is surprised .	my teacher talks to my mother 's dentist 's mother 's daughter 's husband is surprised .
the driver knows that your grandmother 's doctor 's sister 's dentist 's teacher is smart .	the driver works with your grandmother 's doctor 's sister 's dentist 's teacher is smart .
my teacher knows that my wife 's husband 's doctor 's husband 's mother is happy .	my teacher talks to my wife 's husband 's doctor 's husband 's mother is happy .
Laura knows that my teacher 's dentist 's father 's daughter 's father is wrong .	Laura helps my teacher 's dentist 's father 's daughter 's father is wrong .
my doctor knows that my son 's mom 's friend 's mom 's father is careful .	my doctor talks to my son 's mom 's friend 's mom 's father is careful .
your doctor knows that your teacher 's dad 's sister 's brother 's sister is sleepy .	your doctor helps your teacher 's dad 's sister 's brother 's sister is sleepy .
Laurie thinks that my daughter 's boss 's husband 's son 's dentist is wrong .	Laurie talks to my daughter 's boss 's husband 's son 's dentist is wrong .
Jessica thinks that your mother 's mom 's mother 's mother 's doctor is young .	Jessica helps your mother 's mom 's mother 's mother 's doctor is young .
Jill knows that your husband 's mom 's wife 's wife 's brother is quiet .	Jill helps your husband 's mom 's wife 's wife 's brother is quiet .
Martin says that your sister 's brother 's mom 's grandmother 's boss is clever .	Martin talks to your sister 's brother 's mom 's grandmother 's boss is clever .
my teacher knows that my friend 's cousin 's mother 's dentist 's wife is angry .	my teacher talks to my friend 's cousin 's mother 's dentist 's wife is angry .
Jerry says that my dad 's boss 's doctor 's friend 's daughter is young .	Jerry scares my dad 's boss 's doctor 's friend 's daughter is young .
Kristen knows that your friend 's friend 's brother 's dad 's daughter is bored .	Kristen scares your friend 's friend 's brother 's dad 's daughter is bored .
your dentist says that your mother 's dad 's father 's grandmother 's mom is bored .	your dentist talks to your mother 's dad 's father 's grandmother 's mom is bored .
Sara knows that my mother 's son 's cousin 's wife 's wife is angry .	Sara works with my mother 's son 's cousin 's wife 's wife is angry .
the adult knows that my mom 's cousin 's mom 's mother 's friend is gentle .	the adult works with my mom 's cousin 's mom 's mother 's friend is gentle .
the teacher knows that your brother 's daughter 's grandmother 's wife 's doctor is upset .	the teacher helps your brother 's daughter 's grandmother 's wife 's doctor is upset .
Dan knows that your husband 's boss 's father 's son 's cousin is angry .	Dan scares your husband 's boss 's father 's son 's cousin is angry .
Amy thinks that my dad 's mother 's cousin 's friend 's brother is smart .	Amy helps my dad 's mother 's cousin 's friend 's brother is smart .
the dentist knows that your brother 's mother 's dentist 's doctor 's wife is helpful .	the dentist works with your brother 's mother 's dentist 's doctor 's wife is helpful .
the teacher knows that your mother 's teacher 's dentist 's friend 's dentist is careful .	the teacher helps your mother 's teacher 's dentist 's friend 's dentist is careful .
the dancer knows that your daughter 's grandmother 's grandmother 's mom 's grandmother is important .	the dancer talks to your daughter 's grandmother 's grandmother 's mom 's grandmother is important .
my friend knows that my mother 's wife 's sister 's friend 's mother is nice .	my friend works with my mother 's wife 's sister 's friend 's mother is nice .
my boss says that my son 's grandmother 's dad 's friend 's cousin is clever .	my boss works with my son 's grandmother 's dad 's friend 's cousin is clever .
the adult thinks that your dentist 's mother 's brother 's cousin 's husband is nice .	the adult works with your dentist 's mother 's brother 's cousin 's husband is nice .
Paul says that my grandmother 's father 's father 's daughter 's friend is busy .	Paul works with my grandmother 's father 's father 's daughter 's friend is busy .
the dancer thinks that your brother 's cousin 's father 's doctor 's mom is quiet .	the dancer scares your brother 's cousin 's father 's doctor 's mom is quiet .
Anne says that your sister 's mother 's dad 's father 's husband is kind .	Anne helps your sister 's mother 's dad 's father 's husband is kind .
Bill thinks that my father 's cousin 's husband 's mother 's mom is healthy .	Bill works with my father 's cousin 's husband 's mother 's mom is healthy .
your cousin knows that your brother 's boss 's cousin 's son 's grandmother is smart .	your cousin works with your brother 's boss 's cousin 's son 's grandmother is smart .
the dancer says that my wife 's doctor 's dad 's cousin 's dentist is tall .	the dancer talks to my wife 's doctor 's dad 's cousin 's dentist is tall .
Richard says that my cousin 's father 's daughter 's mom 's husband is gentle .	Richard scares my cousin 's father 's daughter 's mom 's husband is gentle .
the driver thinks that my doctor 's boss 's mom 's grandmother 's dentist is young .	the driver helps my doctor 's boss 's mom 's grandmother 's dentist is young .
my dentist says that your dad 's mother 's dentist 's cousin 's mom is careful .	my dentist talks to your dad 's mother 's dentist 's cousin 's mom is careful .
my teacher thinks that my father 's wife 's sister 's sister 's teacher is excited .	my teacher works with my father 's wife 's sister 's sister 's teacher is excited .
your doctor says that your daughter 's grandmother 's boss 's son 's mother is bored .	your doctor works with your daughter 's grandmother 's boss 's son 's mother is bored .
the adult knows that your wife 's cousin 's mother 's friend 's husband is tall .	the adult talks to your wife 's cousin 's mother 's friend 's husband is tall .
my boss knows that my daughter 's wife 's mother 's doctor 's dad is curious .	my boss helps my daughter 's wife 's mother 's doctor 's dad is curious .
the patient says that your husband 's grandmother 's mother 's doctor 's husband is lucky .	the patient scares your husband 's grandmother 's mother 's doctor 's husband is lucky .
William knows that my friend 's boss 's grandmother 's dentist 's dentist is young .	William talks to my friend 's boss 's grandmother 's dentist 's dentist is young .
Becky knows that my brother 's husband 's mom 's teacher 's brother is hungry .	Becky works with my brother 's husband 's mom 's teacher 's brother is hungry .
Susan thinks that my sister 's son 's sister 's mother 's mom is smart .	Susan talks to my sister 's son 's sister 's mother 's mom is smart .
the teacher says that your friend 's mom 's boss 's grandmother 's boss is careful .	the teacher helps your friend 's mom 's boss 's grandmother 's boss is careful .
my cousin says that your mom 's boss 's son 's mother 's friend is busy .	my cousin works with your mom 's boss 's son 's mother 's friend is busy .
your boss says that your wife 's mom 's husband 's mom 's mom is quiet .	your boss helps your wife 's mom 's husband 's mom 's mom is quiet .
your doctor says that my teacher 's son 's sister 's dad 's dad is tired .	your doctor helps my teacher 's son 's sister 's dad 's dad is tired .
your friend says that my brother 's son 's mom 's son 's mom is quiet .	your friend scares my brother 's son 's mom 's son 's mom is quiet .
the dancer thinks that my sister 's grandmother 's dad 's doctor 's teacher is hungry .	the dancer works with my sister 's grandmother 's dad 's doctor 's teacher is hungry .
my teacher says that my brother 's daughter 's doctor 's father 's son is bored .	my teacher scares my brother 's daughter 's doctor 's father 's son is bored .
Cindy knows that your sister 's mother 's husband 's dentist 's wife is important .	Cindy helps your sister 's mother 's husband 's dentist 's wife is important .
