the box says that my father 's dentist 's wife 's mom 's sister 's teacher 's son 's friend 's dish is tired .	the box talks to my father 's dentist 's wife 's mom 's sister 's teacher 's son 's friend 's dish is tired .
the bag says that my grandmother 's mom 's grandmother 's boss 's father 's cousin 's mother 's dentist 's button is upset .	the bag works with my grandmother 's mom 's grandmother 's boss 's father 's cousin 's mother 's dentist 's button is upset .
the chair says that my grandmother 's dad 's friend 's grandmother 's cousin 's husband 's grandmother 's son 's mirror is kind .	the chair scares my grandmother 's dad 's friend 's grandmother 's cousin 's husband 's grandmother 's son 's mirror is kind .
the ship says that your grandmother 's boss 's doctor 's wife 's boss 's friend 's doctor 's mom 's bed is important .	the ship talks to your grandmother 's boss 's doctor 's wife 's boss 's friend 's doctor 's mom 's bed is important .
the glass thinks that my father 's father 's friend 's husband 's grandmother 's boss 's grandmother 's cousin 's rocket is wrong .	the glass helps my father 's father 's friend 's husband 's grandmother 's boss 's grandmother 's cousin 's rocket is wrong .
the door thinks that my father 's dentist 's dad 's mom 's cousin 's father 's friend 's sister 's box is curious .	the door talks to my father 's dentist 's dad 's mom 's cousin 's father 's friend 's sister 's box is curious .
the spoon knows that your mother 's teacher 's father 's son 's cousin 's mother 's dentist 's mother 's mirror is friendly .	the spoon talks to your mother 's teacher 's father 's son 's cousin 's mother 's dentist 's mother 's mirror is friendly .
the window says that your sister 's mother 's mother 's husband 's mother 's doctor 's doctor 's father 's rug is young .	the window helps your sister 's mother 's mother 's husband 's mother 's doctor 's doctor 's father 's rug is young .
the candle says that my doctor 's son 's husband 's cousin 's wife 's teacher 's husband 's mom 's bowl is tired .	the candle helps my doctor 's son 's husband 's cousin 's wife 's teacher 's husband 's mom 's bowl is tired .
the ring knows that your boss 's mother 's cousin 's doctor 's father 's mom 's mother 's grandmother 's candle is happy .	the ring talks to your boss 's mother 's cousin 's doctor 's father 's mom 's mother 's grandmother 's candle is happy .
the bicycle thinks that your dentist 's mom 's dentist 's sister 's father 's dad 's dad 's son 's book is wrong .	the bicycle scares your dentist 's mom 's dentist 's sister 's father 's dad 's dad 's son 's book is wrong .
the crayon says that your mother 's boss 's friend 's doctor 's teacher 's daughter 's son 's brother 's spoon is tired .	the crayon scares your mother 's boss 's friend 's doctor 's teacher 's daughter 's son 's brother 's spoon is tired .
the mirror says that my father 's daughter 's dad 's husband 's cousin 's wife 's mom 's grandmother 's bag is tall .	the mirror works with my father 's daughter 's dad 's husband 's cousin 's wife 's mom 's grandmother 's bag is tall .
the mirror knows that my grandmother 's doctor 's sister 's friend 's dad 's daughter 's cousin 's husband 's door is lucky .	the mirror helps my grandmother 's doctor 's sister 's friend 's dad 's daughter 's cousin 's husband 's door is lucky .
the shoe knows that my boss 's mom 's dentist 's brother 's grandmother 's dad 's grandmother 's mom 's bed is tired .	the shoe works with my boss 's mom 's dentist 's brother 's grandmother 's dad 's grandmother 's mom 's bed is tired .
the book thinks that my son 's friend 's mom 's sister 's grandmother 's doctor 's mother 's father 's box is clever .	the book works with my son 's friend 's mom 's sister 's grandmother 's doctor 's mother 's father 's box is clever .
the bag says that my sister 's cousin 's dentist 's friend 's husband 's father 's sister 's dentist 's bicycle is young .	the bag scares my sister 's cousin 's dentist 's friend 's husband 's father 's sister 's dentist 's bicycle is young .
the rocket thinks that your mother 's boss 's dentist 's mom 's father 's dad 's mother 's brother 's shoe is curious .	the rocket scares your mother 's boss 's dentist 's mom 's father 's dad 's mother 's brother 's shoe is curious .
the ship knows that my boss 's cousin 's mother 's dad 's boss 's mother 's mother 's brother 's book is clever .	the ship scares my boss 's cousin 's mother 's dad 's boss 's mother 's mother 's brother 's book is clever .
the couch says that your mother 's father 's mother 's husband 's friend 's cousin 's dentist 's teacher 's plate is tall .	the couch helps your mother 's father 's mother 's husband 's friend 's cousin 's dentist 's teacher 's plate is tall .
the glass knows that your friend 's dentist 's teacher 's father 's dad 's husband 's husband 's husband 's shirt is tired .	the glass helps your friend 's dentist 's teacher 's father 's dad 's husband 's husband 's husband 's shirt is tired .
the rug thinks that my husband 's cousin 's mom 's mother 's wife 's cousin 's teacher 's dad 's door is upset .	the rug talks to my husband 's cousin 's mom 's mother 's wife 's cousin 's teacher 's dad 's door is upset .
the rocket knows that my daughter 's wife 's boss 's grandmother 's daughter 's doctor 's boss 's son 's glass is surprised .	the rocket scares my daughter 's wife 's boss 's grandmother 's daughter 's doctor 's boss 's son 's glass is surprised .
the hat thinks that your cousin 's mom 's son 's mother 's brother 's father 's dentist 's teacher 's rug is kind .	the hat helps your cousin 's mom 's son 's mother 's brother 's father 's dentist 's teacher 's rug is kind .
the ship knows that my son 's daughter 's grandmother 's teacher 's dad 's cousin 's doctor 's wife 's cup is upset .	the ship talks to my son 's daughter 's grandmother 's teacher 's dad 's cousin 's doctor 's wife 's cup is upset .
the rug knows that my dentist 's grandmother 's mom 's father 's husband 's doctor 's father 's brother 's door is busy .	the rug scares my dentist 's grandmother 's mom 's father 's husband 's doctor 's father 's brother 's door is busy .
the box thinks that my daughter 's wife 's brother 's mom 's doctor 's wife 's dentist 's teacher 's bowl is surprised .	the box works with my daughter 's wife 's brother 's mom 's doctor 's wife 's dentist 's teacher 's bowl is surprised .
the bag thinks that your dad 's brother 's boss 's mom 's son 's boss 's husband 's grandmother 's book is boring .	the bag scares your dad 's brother 's boss 's mom 's son 's boss 's husband 's grandmother 's book is boring .
the couch thinks that my friend 's mother 's son 's grandmother 's doctor 's doctor 's brother 's cousin 's box is curious .	the couch talks to my friend 's mother 's son 's grandmother 's doctor 's doctor 's brother 's cousin 's box is curious .
the bicycle knows that my dentist 's doctor 's friend 's mom 's dentist 's husband 's father 's sister 's book is strong .	the bicycle talks to my dentist 's doctor 's friend 's mom 's dentist 's husband 's father 's sister 's book is strong .
the shoe thinks that your wife 's dad 's boss 's dentist 's daughter 's teacher 's cousin 's mother 's box is tired .	the shoe talks to your wife 's dad 's boss 's dentist 's daughter 's teacher 's cousin 's mother 's box is tired .
the boat knows that my grandmother 's dentist 's husband 's husband 's boss 's dad 's sister 's brother 's bag is boring .	the boat scares my grandmother 's dentist 's husband 's husband 's boss 's dad 's sister 's brother 's bag is boring .
the chair knows that my wife 's friend 's boss 's father 's brother 's teacher 's dentist 's dentist 's car is tall .	the chair scares my wife 's friend 's boss 's father 's brother 's teacher 's dentist 's dentist 's car is tall .
the crayon says that my mom 's mother 's boss 's wife 's husband 's boss 's wife 's son 's candle is hungry .	the crayon talks to my mom 's mother 's boss 's wife 's husband 's boss 's wife 's son 's candle is hungry .
the mirror thinks that my boss 's cousin 's daughter 's mom 's dentist 's husband 's friend 's doctor 's rocket is angry .	the mirror scares my boss 's cousin 's daughter 's mom 's dentist 's husband 's friend 's doctor 's rocket is angry .
the rocket thinks that my son 's dentist 's wife 's doctor 's wife 's friend 's son 's friend 's plate is tall .	the rocket helps my son 's dentist 's wife 's doctor 's wife 's friend 's son 's friend 's plate is tall .
the spoon says that my dad 's mother 's doctor 's friend 's boss 's sister 's daughter 's daughter 's bowl is curious .	the spoon talks to my dad 's mother 's doctor 's friend 's boss 's sister 's daughter 's daughter 's bowl is curious .
the couch says that your husband 's mom 's grandmother 's doctor 's husband 's mom 's mom 's grandmother 's truck is young .	the couch works with your husband 's mom 's grandmother 's doctor 's husband 's mom 's mom 's grandmother 's truck is young .
the bag thinks that your cousin 's teacher 's mother 's dad 's cousin 's doctor 's mom 's son 's box is gentle .	the bag works with your cousin 's teacher 's mother 's dad 's cousin 's doctor 's mom 's son 's box is gentle .
the crayon thinks that my daughter 's son 's boss 's husband 's son 's husband 's dentist 's dentist 's plate is wrong .	the crayon talks to my daughter 's son 's boss 's husband 's son 's husband 's dentist 's dentist 's plate is wrong .
the door knows that your cousin 's sister 's sister 's teacher 's mother 's daughter 's mom 's mother 's fork is friendly .	the door scares your cousin 's sister 's sister 's teacher 's mother 's daughter 's mom 's mother 's fork is friendly .
the hat knows that your father 's friend 's wife 's father 's doctor 's wife 's mother 's doctor 's chair is boring .	the hat helps your father 's friend 's wife 's father 's doctor 's wife 's mother 's doctor 's chair is boring .
the dish knows that your dentist 's teacher 's father 's sister 's friend 's mother 's mother 's husband 's fork is kind .	the dish works with your dentist 's teacher 's father 's sister 's friend 's mother 's mother 's husband 's fork is kind .
the glass says that your wife 's grandmother 's wife 's brother 's brother 's mom 's husband 's daughter 's book is boring .	the glass works with your wife 's grandmother 's wife 's brother 's brother 's mom 's husband 's daughter 's book is boring .
the truck thinks that your brother 's cousin 's wife 's grandmother 's brother 's boss 's dad 's brother 's dish is smart .	the truck talks to your brother 's cousin 's wife 's grandmother 's brother 's boss 's dad 's brother 's dish is smart .
the toy says that my sister 's friend 's doctor 's doctor 's brother 's daughter 's mother 's brother 's crayon is clever .	the toy helps my sister 's friend 's doctor 's doctor 's brother 's daughter 's mother 's brother 's crayon is clever .
the dish thinks that my wife 's mom 's father 's teacher 's sister 's brother 's sister 's teacher 's car is helpful .	the dish scares my wife 's mom 's father 's teacher 's sister 's brother 's sister 's teacher 's car is helpful .
the truck thinks that my brother 's mother 's grandmother 's son 's daughter 's mom 's dad 's sister 's door is sleepy .	the truck talks to my brother 's mother 's grandmother 's son 's daughter 's mom 's dad 's sister 's door is sleepy .
the boat thinks that your wife 's mom 's doctor 's dentist 's mom 's mom 's son 's father 's car is excited .	the boat talks to your wife 's mom 's doctor 's dentist 's mom 's mom 's son 's father 's car is excited .
the doll thinks that your brother 's wife 's boss 's doctor 's cousin 's doctor 's daughter 's brother 's car is gentle .	the doll scares your brother 's wife 's boss 's doctor 's cousin 's doctor 's daughter 's brother 's car is gentle .
the cup says that your daughter 's teacher 's grandmother 's grandmother 's mom 's dentist 's grandmother 's husband 's mirror is sleepy .	the cup talks to your daughter 's teacher 's grandmother 's grandmother 's mom 's dentist 's grandmother 's husband 's mirror is sleepy .
the dish says that your daughter 's sister 's father 's boss 's brother 's dentist 's teacher 's father 's door is kind .	the dish talks to your daughter 's sister 's father 's boss 's brother 's dentist 's teacher 's father 's door is kind .
the boat thinks that my sister 's husband 's teacher 's grandmother 's teacher 's dentist 's mother 's husband 's car is hungry .	the boat works with my sister 's husband 's teacher 's grandmother 's teacher 's dentist 's mother 's husband 's car is hungry .
the bed thinks that my son 's sister 's daughter 's father 's dentist 's brother 's grandmother 's son 's dish is quiet .	the bed works with my son 's sister 's daughter 's father 's dentist 's brother 's grandmother 's son 's dish is quiet .
the plate thinks that my doctor 's brother 's mother 's dentist 's son 's husband 's mother 's doctor 's ship is important .	the plate scares my doctor 's brother 's mother 's dentist 's son 's husband 's mother 's doctor 's ship is important .
the shirt thinks that my son 's teacher 's doctor 's mom 's boss 's father 's grandmother 's father 's ship is careful .	the shirt helps my son 's teacher 's doctor 's mom 's boss 's father 's grandmother 's father 's ship is careful .
the boat says that your brother 's boss 's boss 's friend 's mother 's father 's doctor 's son 's book is quiet .	the boat helps your brother 's boss 's boss 's friend 's mother 's father 's doctor 's son 's book is quiet .
the book knows that your dad 's cousin 's teacher 's mom 's grandmother 's doctor 's dentist 's doctor 's crayon is smart .	the book works with your dad 's cousin 's teacher 's mom 's grandmother 's doctor 's dentist 's doctor 's crayon is smart .
the box knows that my teacher 's daughter 's doctor 's mom 's mom 's daughter 's dad 's father 's box is confused .	the box helps my teacher 's daughter 's doctor 's mom 's mom 's daughter 's dad 's father 's box is confused .
the shirt says that your dad 's friend 's son 's cousin 's brother 's daughter 's doctor 's sister 's boat is upset .	the shirt helps your dad 's friend 's son 's cousin 's brother 's daughter 's doctor 's sister 's boat is upset .
the picture thinks that your mom 's son 's cousin 's teacher 's boss 's mom 's son 's cousin 's hat is lucky .	the picture works with your mom 's son 's cousin 's teacher 's boss 's mom 's son 's cousin 's hat is lucky .
the plane knows that your daughter 's friend 's cousin 's husband 's friend 's brother 's son 's father 's book is friendly .	the plane talks to your daughter 's friend 's cousin 's husband 's friend 's brother 's son 's father 's book is friendly .
the plane says that your father 's teacher 's daughter 's cousin 's dad 's cousin 's sister 's dad 's fork is quiet .	the plane talks to your father 's teacher 's daughter 's cousin 's dad 's cousin 's sister 's dad 's fork is quiet .
the hat thinks that your grandmother 's son 's teacher 's doctor 's wife 's sister 's father 's boss 's book is confused .	the hat helps your grandmother 's son 's teacher 's doctor 's wife 's sister 's father 's boss 's book is confused .
the plate thinks that my cousin 's doctor 's dentist 's brother 's grandmother 's dentist 's friend 's grandmother 's toy is tall .	the plate helps my cousin 's doctor 's dentist 's brother 's grandmother 's dentist 's friend 's grandmother 's toy is tall .
the glass thinks that your doctor 's cousin 's mom 's teacher 's grandmother 's father 's mother 's boss 's car is important .	the glass talks to your doctor 's cousin 's mom 's teacher 's grandmother 's father 's mother 's boss 's car is important .
the plate knows that your daughter 's brother 's sister 's wife 's sister 's teacher 's daughter 's sister 's book is surprised .	the plate talks to your daughter 's brother 's sister 's wife 's sister 's teacher 's daughter 's sister 's book is surprised .
the ring knows that my doctor 's father 's dentist 's daughter 's grandmother 's wife 's doctor 's teacher 's book is boring .	the ring scares my doctor 's father 's dentist 's daughter 's grandmother 's wife 's doctor 's teacher 's book is boring .
the window knows that my grandmother 's father 's cousin 's cousin 's doctor 's grandmother 's dad 's grandmother 's shoe is tired .	the window talks to my grandmother 's father 's cousin 's cousin 's doctor 's grandmother 's dad 's grandmother 's shoe is tired .
the rocket says that your wife 's dentist 's father 's mom 's son 's son 's father 's father 's hat is excited .	the rocket talks to your wife 's dentist 's father 's mom 's son 's son 's father 's father 's hat is excited .
the dish knows that my brother 's cousin 's boss 's grandmother 's grandmother 's dentist 's brother 's father 's candle is important .	the dish scares my brother 's cousin 's boss 's grandmother 's grandmother 's dentist 's brother 's father 's candle is important .
the couch knows that my sister 's grandmother 's wife 's son 's dad 's husband 's friend 's friend 's rug is careful .	the couch scares my sister 's grandmother 's wife 's son 's dad 's husband 's friend 's friend 's rug is careful .
the book knows that my sister 's teacher 's brother 's friend 's grandmother 's grandmother 's boss 's grandmother 's shoe is tired .	the book talks to my sister 's teacher 's brother 's friend 's grandmother 's grandmother 's boss 's grandmother 's shoe is tired .
the book thinks that my boss 's wife 's daughter 's wife 's dad 's daughter 's dad 's friend 's ship is hungry .	the book talks to my boss 's wife 's daughter 's wife 's dad 's daughter 's dad 's friend 's ship is hungry .
the doll says that my teacher 's mom 's son 's doctor 's son 's friend 's teacher 's doctor 's doll is surprised .	the doll works with my teacher 's mom 's son 's doctor 's son 's friend 's teacher 's doctor 's doll is surprised .
the box says that your cousin 's sister 's mother 's mom 's daughter 's dad 's husband 's dad 's mirror is tall .	the box scares your cousin 's sister 's mother 's mom 's daughter 's dad 's husband 's dad 's mirror is tall .
the window says that your teacher 's dad 's grandmother 's son 's mom 's father 's daughter 's dad 's mirror is angry .	the window talks to your teacher 's dad 's grandmother 's son 's mom 's father 's daughter 's dad 's mirror is angry .
the shoe thinks that your teacher 's boss 's grandmother 's father 's dentist 's dentist 's teacher 's son 's toy is important .	the shoe scares your teacher 's boss 's grandmother 's father 's dentist 's dentist 's teacher 's son 's toy is important .
the bicycle knows that your cousin 's brother 's son 's friend 's boss 's husband 's mom 's daughter 's bowl is bored .	the bicycle helps your cousin 's brother 's son 's friend 's boss 's husband 's mom 's daughter 's bowl is bored .
the button thinks that your grandmother 's dad 's teacher 's mother 's dentist 's doctor 's boss 's sister 's rocket is clever .	the button helps your grandmother 's dad 's teacher 's mother 's dentist 's doctor 's boss 's sister 's rocket is clever .
the window thinks that my mother 's cousin 's teacher 's grandmother 's mom 's mother 's brother 's cousin 's crayon is strong .	the window scares my mother 's cousin 's teacher 's grandmother 's mom 's mother 's brother 's cousin 's crayon is strong .
the rocket knows that your son 's boss 's grandmother 's wife 's brother 's boss 's boss 's sister 's couch is young .	the rocket scares your son 's boss 's grandmother 's wife 's brother 's boss 's boss 's sister 's couch is young .
the hat knows that your cousin 's teacher 's brother 's mom 's doctor 's teacher 's boss 's mother 's book is wrong .	the hat talks to your cousin 's teacher 's brother 's mom 's doctor 's teacher 's boss 's mother 's book is wrong .
the plane says that my mother 's sister 's grandmother 's boss 's mother 's dad 's dad 's daughter 's ship is busy .	the plane helps my mother 's sister 's grandmother 's boss 's mother 's dad 's dad 's daughter 's ship is busy .
the plate knows that your dad 's doctor 's boss 's boss 's wife 's husband 's boss 's brother 's boat is busy .	the plate scares your dad 's doctor 's boss 's boss 's wife 's husband 's boss 's brother 's boat is busy .
the plane thinks that my daughter 's friend 's grandmother 's friend 's doctor 's boss 's friend 's father 's spoon is sleepy .	the plane works with my daughter 's friend 's grandmother 's friend 's doctor 's boss 's friend 's father 's spoon is sleepy .
the candle knows that my husband 's mother 's son 's mom 's husband 's son 's teacher 's dad 's dish is boring .	the candle talks to my husband 's mother 's son 's mom 's husband 's son 's teacher 's dad 's dish is boring .
the cup knows that my cousin 's son 's father 's dentist 's friend 's teacher 's wife 's teacher 's plate is lucky .	the cup scares my cousin 's son 's father 's dentist 's friend 's teacher 's wife 's teacher 's plate is lucky .
the boat says that my mom 's wife 's friend 's friend 's sister 's daughter 's daughter 's brother 's shirt is kind .	the boat talks to my mom 's wife 's friend 's friend 's sister 's daughter 's daughter 's brother 's shirt is kind .
the picture says that my husband 's dad 's husband 's mom 's grandmother 's husband 's doctor 's friend 's bowl is lucky .	the picture scares my husband 's dad 's husband 's mom 's grandmother 's husband 's doctor 's friend 's bowl is lucky .
the bag says that my teacher 's dad 's mother 's dentist 's son 's dentist 's daughter 's friend 's rug is gentle .	the bag helps my teacher 's dad 's mother 's dentist 's son 's dentist 's daughter 's friend 's rug is gentle .
the book thinks that your boss 's friend 's dentist 's grandmother 's brother 's boss 's daughter 's dentist 's fork is wrong .	the book works with your boss 's friend 's dentist 's grandmother 's brother 's boss 's daughter 's dentist 's fork is wrong .
the ring thinks that my teacher 's mom 's father 's dad 's brother 's friend 's sister 's brother 's car is smart .	the ring helps my teacher 's mom 's father 's dad 's brother 's friend 's sister 's brother 's car is smart .
the candle knows that your mother 's boss 's wife 's grandmother 's dentist 's daughter 's boss 's mom 's rug is tired .	the candle helps your mother 's boss 's wife 's grandmother 's dentist 's daughter 's boss 's mom 's rug is tired .
the plane thinks that my daughter 's boss 's friend 's teacher 's teacher 's dentist 's son 's mom 's bowl is sleepy .	the plane helps my daughter 's boss 's friend 's teacher 's teacher 's dentist 's son 's mom 's bowl is sleepy .
the book says that my mother 's boss 's mother 's mother 's mom 's husband 's teacher 's cousin 's box is curious .	the book helps my mother 's boss 's mother 's mother 's mom 's husband 's teacher 's cousin 's box is curious .
the ship says that your doctor 's boss 's teacher 's mother 's doctor 's teacher 's friend 's dad 's spoon is helpful .	the ship talks to your doctor 's boss 's teacher 's mother 's doctor 's teacher 's friend 's dad 's spoon is helpful .
the truck says that your father 's father 's sister 's friend 's doctor 's wife 's daughter 's dentist 's dish is tall .	the truck scares your father 's father 's sister 's friend 's doctor 's wife 's daughter 's dentist 's dish is tall .
the book knows that your mother 's dentist 's boss 's grandmother 's cousin 's doctor 's husband 's brother 's car is tall .	the book scares your mother 's dentist 's boss 's grandmother 's cousin 's doctor 's husband 's brother 's car is tall .
the truck says that my dad 's boss 's grandmother 's cousin 's husband 's dentist 's friend 's dentist 's book is happy .	the truck talks to my dad 's boss 's grandmother 's cousin 's husband 's dentist 's friend 's dentist 's book is happy .
the couch knows that your wife 's dad 's teacher 's mother 's mother 's boss 's son 's boss 's ship is angry .	the couch helps your wife 's dad 's teacher 's mother 's mother 's boss 's son 's boss 's ship is angry .
the shoe thinks that your wife 's cousin 's teacher 's mother 's dad 's boss 's friend 's son 's plate is hungry .	the shoe works with your wife 's cousin 's teacher 's mother 's dad 's boss 's friend 's son 's plate is hungry .
the button knows that your grandmother 's son 's husband 's sister 's husband 's husband 's dentist 's husband 's picture is lucky .	the button works with your grandmother 's son 's husband 's sister 's husband 's husband 's dentist 's husband 's picture is lucky .
the spoon says that your grandmother 's cousin 's husband 's mother 's doctor 's boss 's cousin 's cousin 's book is helpful .	the spoon helps your grandmother 's cousin 's husband 's mother 's doctor 's boss 's cousin 's cousin 's book is helpful .
the bed thinks that my mom 's brother 's mother 's husband 's boss 's husband 's mother 's son 's bicycle is upset .	the bed talks to my mom 's brother 's mother 's husband 's boss 's husband 's mother 's son 's bicycle is upset .
the book says that your dentist 's father 's doctor 's teacher 's dentist 's friend 's friend 's mom 's chair is gentle .	the book scares your dentist 's father 's doctor 's teacher 's dentist 's friend 's friend 's mom 's chair is gentle .
the chair says that your doctor 's husband 's mother 's wife 's boss 's dad 's friend 's dad 's spoon is surprised .	the chair helps your doctor 's husband 's mother 's wife 's boss 's dad 's friend 's dad 's spoon is surprised .
the plane thinks that my friend 's wife 's grandmother 's dad 's daughter 's teacher 's daughter 's wife 's plane is excited .	the plane works with my friend 's wife 's grandmother 's dad 's daughter 's teacher 's daughter 's wife 's plane is excited .
