the doll gave your friend 's teacher 's mother 's chair the car .	the doll kept your friend 's teacher 's mother 's chair the car .
the ship showed my grandmother 's husband 's sister 's bicycle the shoe .	the ship cleaned my grandmother 's husband 's sister 's bicycle the shoe .
the shoe sent my mom 's wife 's father 's glass the bicycle .	the shoe shook my mom 's wife 's father 's glass the bicycle .
the hat bought your grandmother 's dad 's sister 's chair the doll .	the hat lost your grandmother 's dad 's sister 's chair the doll .
the shoe showed your sister 's dentist 's sister 's book the bag .	the shoe held your sister 's dentist 's sister 's book the bag .
the mirror showed my father 's grandmother 's boss 's ship the dish .	the mirror cleaned my father 's grandmother 's boss 's ship the dish .
the bottle showed your mom 's brother 's teacher 's fork the button .	the bottle lost your mom 's brother 's teacher 's fork the button .
the box showed my mother 's sister 's father 's picture the dish .	the box kept my mother 's sister 's father 's picture the dish .
the fork bought my mother 's father 's mom 's hat the bottle .	the fork kept my mother 's father 's mom 's hat the bottle .
the crayon bought your dad 's husband 's doctor 's plane the ring .	the crayon held your dad 's husband 's doctor 's plane the ring .
the bag showed my friend 's son 's dentist 's plate the bag .	the bag dropped my friend 's son 's dentist 's plate the bag .
the ring bought my husband 's dentist 's boss 's spoon the boat .	the ring moved my husband 's dentist 's boss 's spoon the boat .
the car sent my friend 's mother 's wife 's book the hat .	the car dropped my friend 's mother 's wife 's book the hat .
the chair showed my daughter 's cousin 's teacher 's picture the dish .	the chair lost my daughter 's cousin 's teacher 's picture the dish .
the box bought my daughter 's father 's father 's toy the hat .	the box moved my daughter 's father 's father 's toy the hat .
the crayon showed my daughter 's mom 's wife 's ring the box .	the crayon shook my daughter 's mom 's wife 's ring the box .
the mirror sent my boss 's boss 's teacher 's mirror the bicycle .	the mirror shook my boss 's boss 's teacher 's mirror the bicycle .
the door showed my dentist 's cousin 's husband 's bowl the button .	the door dropped my dentist 's cousin 's husband 's bowl the button .
the cup showed my teacher 's wife 's mom 's spoon the doll .	the cup lost my teacher 's wife 's mom 's spoon the doll .
the dish sent your cousin 's son 's boss 's shoe the candle .	the dish kept your cousin 's son 's boss 's shoe the candle .
the bottle showed your mother 's son 's doctor 's hat the rocket .	the bottle shook your mother 's son 's doctor 's hat the rocket .
the chair sent my husband 's doctor 's husband 's cup the truck .	the chair held my husband 's doctor 's husband 's cup the truck .
the dish showed your dad 's wife 's son 's button the hat .	the dish held your dad 's wife 's son 's button the hat .
the bottle sent my dentist 's daughter 's son 's couch the ring .	the bottle dropped my dentist 's daughter 's son 's couch the ring .
the ship gave my daughter 's brother 's mother 's plate the shoe .	the ship kept my daughter 's brother 's mother 's plate the shoe .
the fork showed your brother 's son 's doctor 's shoe the bottle .	the fork cleaned your brother 's son 's doctor 's shoe the bottle .
the plane gave my mom 's brother 's teacher 's book the cup .	the plane moved my mom 's brother 's teacher 's book the cup .
the doll showed your boss 's husband 's mother 's door the plate .	the doll moved your boss 's husband 's mother 's door the plate .
the plane showed your brother 's wife 's wife 's doll the toy .	the plane dropped your brother 's wife 's wife 's doll the toy .
the bag showed my sister 's husband 's boss 's bed the crayon .	the bag lost my sister 's husband 's boss 's bed the crayon .
the boat showed my boss 's boss 's father 's fork the plane .	the boat shook my boss 's boss 's father 's fork the plane .
the book showed my wife 's wife 's boss 's glass the rocket .	the book moved my wife 's wife 's boss 's glass the rocket .
the boat gave my wife 's brother 's daughter 's mirror the hat .	the boat cleaned my wife 's brother 's daughter 's mirror the hat .
the boat showed my dentist 's brother 's doctor 's doll the dish .	the boat moved my dentist 's brother 's doctor 's doll the dish .
the fork bought your son 's father 's wife 's door the rug .	the fork held your son 's father 's wife 's door the rug .
the rocket showed your daughter 's doctor 's father 's fork the cup .	the rocket dropped your daughter 's doctor 's father 's fork the cup .
the door showed my friend 's husband 's daughter 's crayon the bag .	the door cleaned my friend 's husband 's daughter 's crayon the bag .
the plate gave your daughter 's cousin 's husband 's book the doll .	the plate shook your daughter 's cousin 's husband 's book the doll .
the window sent your cousin 's mom 's boss 's shirt the mirror .	the window held your cousin 's mom 's boss 's shirt the mirror .
the toy showed your husband 's doctor 's brother 's ring the button .	the toy cleaned your husband 's doctor 's brother 's ring the button .
the car gave my mother 's grandmother 's grandmother 's book the shoe .	the car dropped my mother 's grandmother 's grandmother 's book the shoe .
the car gave my daughter 's father 's father 's candle the picture .	the car held my daughter 's father 's father 's candle the picture .
the dish showed my wife 's mother 's husband 's bed the box .	the dish cleaned my wife 's mother 's husband 's bed the box .
the bicycle showed my friend 's boss 's husband 's car the window .	the bicycle kept my friend 's boss 's husband 's car the window .
the plate bought my father 's mom 's brother 's glass the toy .	the plate moved my father 's mom 's brother 's glass the toy .
the crayon showed your mother 's husband 's dad 's rug the rocket .	the crayon kept your mother 's husband 's dad 's rug the rocket .
the glass showed your dentist 's daughter 's doctor 's bag the crayon .	the glass shook your dentist 's daughter 's doctor 's bag the crayon .
the book gave your daughter 's mom 's teacher 's toy the truck .	the book dropped your daughter 's mom 's teacher 's toy the truck .
the button showed my mom 's father 's sister 's glass the ship .	the button kept my mom 's father 's sister 's glass the ship .
the button gave my brother 's daughter 's mom 's dish the candle .	the button lost my brother 's daughter 's mom 's dish the candle .
the dish gave my daughter 's son 's wife 's glass the car .	the dish shook my daughter 's son 's wife 's glass the car .
the boat showed your father 's daughter 's boss 's bed the candle .	the boat lost your father 's daughter 's boss 's bed the candle .
the candle sent my doctor 's daughter 's mother 's fork the plate .	the candle held my doctor 's daughter 's mother 's fork the plate .
the rocket bought my husband 's mother 's dentist 's crayon the book .	the rocket lost my husband 's mother 's dentist 's crayon the book .
the doll bought my dad 's brother 's teacher 's couch the button .	the doll lost my dad 's brother 's teacher 's couch the button .
the plate gave my sister 's dad 's boss 's window the plane .	the plate held my sister 's dad 's boss 's window the plane .
the fork gave my mother 's cousin 's dentist 's crayon the shoe .	the fork moved my mother 's cousin 's dentist 's crayon the shoe .
the toy sent your doctor 's daughter 's husband 's chair the fork .	the toy held your doctor 's daughter 's husband 's chair the fork .
the picture bought your husband 's doctor 's cousin 's truck the chair .	the picture kept your husband 's doctor 's cousin 's truck the chair .
the candle sent your dentist 's sister 's doctor 's fork the book .	the candle held your dentist 's sister 's doctor 's fork the book .
the truck bought your daughter 's mother 's boss 's fork the window .	the truck lost your daughter 's mother 's boss 's fork the window .
the cup sent your dentist 's mom 's mom 's cup the window .	the cup held your dentist 's mom 's mom 's cup the window .
the truck showed my doctor 's boss 's friend 's ship the toy .	the truck held my doctor 's boss 's friend 's ship the toy .
the glass gave your mom 's boss 's cousin 's bed the hat .	the glass moved your mom 's boss 's cousin 's bed the hat .
the spoon showed my cousin 's friend 's dentist 's shoe the book .	the spoon dropped my cousin 's friend 's dentist 's shoe the book .
the bottle sent your grandmother 's teacher 's dad 's door the book .	the bottle lost your grandmother 's teacher 's dad 's door the book .
the shoe bought your son 's teacher 's son 's car the chair .	the shoe lost your son 's teacher 's son 's car the chair .
the candle showed my son 's daughter 's son 's door the toy .	the candle moved my son 's daughter 's son 's door the toy .
the truck sent your friend 's dad 's cousin 's shirt the fork .	the truck cleaned your friend 's dad 's cousin 's shirt the fork .
the crayon gave my doctor 's dentist 's doctor 's bottle the boat .	the crayon cleaned my doctor 's dentist 's doctor 's bottle the boat .
the hat showed my friend 's dad 's mother 's bicycle the glass .	the hat moved my friend 's dad 's mother 's bicycle the glass .
the fork showed your daughter 's sister 's cousin 's book the boat .	the fork moved your daughter 's sister 's cousin 's book the boat .
the candle showed my husband 's husband 's mom 's shoe the candle .	the candle shook my husband 's husband 's mom 's shoe the candle .
the fork sent your boss 's dentist 's grandmother 's couch the ring .	the fork shook your boss 's dentist 's grandmother 's couch the ring .
the rocket showed my father 's mom 's son 's candle the bottle .	the rocket cleaned my father 's mom 's son 's candle the bottle .
the toy sent your cousin 's doctor 's doctor 's ring the hat .	the toy shook your cousin 's doctor 's doctor 's ring the hat .
the doll bought your mother 's cousin 's doctor 's crayon the doll .	the doll shook your mother 's cousin 's doctor 's crayon the doll .
the candle showed your friend 's teacher 's doctor 's book the spoon .	the candle dropped your friend 's teacher 's doctor 's book the spoon .
the rocket bought my sister 's son 's cousin 's chair the car .	the rocket lost my sister 's son 's cousin 's chair the car .
the plate showed your dentist 's mother 's son 's fork the bowl .	the plate lost your dentist 's mother 's son 's fork the bowl .
the book sent your sister 's father 's mom 's button the picture .	the book held your sister 's father 's mom 's button the picture .
the book bought your brother 's boss 's brother 's bag the bag .	the book cleaned your brother 's boss 's brother 's bag the bag .
the dish bought your husband 's cousin 's doctor 's mirror the rug .	the dish held your husband 's cousin 's doctor 's mirror the rug .
the doll bought my friend 's mom 's dad 's candle the door .	the doll cleaned my friend 's mom 's dad 's candle the door .
the truck sent your doctor 's teacher 's mom 's car the fork .	the truck cleaned your doctor 's teacher 's mom 's car the fork .
the box showed your teacher 's husband 's cousin 's shirt the couch .	the box dropped your teacher 's husband 's cousin 's shirt the couch .
the couch sent my cousin 's doctor 's friend 's glass the plate .	the couch moved my cousin 's doctor 's friend 's glass the plate .
the cup sent your friend 's friend 's doctor 's bicycle the plane .	the cup held your friend 's friend 's doctor 's bicycle the plane .
the plate bought your grandmother 's wife 's husband 's plate the bottle .	the plate kept your grandmother 's wife 's husband 's plate the bottle .
the door gave your brother 's wife 's sister 's spoon the button .	the door moved your brother 's wife 's sister 's spoon the button .
the door bought your dad 's dad 's cousin 's bed the shirt .	the door lost your dad 's dad 's cousin 's bed the shirt .
the bowl sent your sister 's mom 's son 's mirror the boat .	the bowl held your sister 's mom 's son 's mirror the boat .
the fork gave your brother 's dad 's boss 's book the bag .	the fork kept your brother 's dad 's boss 's book the bag .
the toy bought your dentist 's wife 's brother 's car the rug .	the toy dropped your dentist 's wife 's brother 's car the rug .
the car bought your cousin 's father 's brother 's mirror the rug .	the car shook your cousin 's father 's brother 's mirror the rug .
the plate sent your dad 's cousin 's father 's mirror the book .	the plate shook your dad 's cousin 's father 's mirror the book .
the car bought your daughter 's boss 's mom 's dish the candle .	the car held your daughter 's boss 's mom 's dish the candle .
the shoe showed your teacher 's dentist 's teacher 's book the glass .	the shoe held your teacher 's dentist 's teacher 's book the glass .
the bicycle gave my boss 's doctor 's mother 's shirt the mirror .	the bicycle lost my boss 's doctor 's mother 's shirt the mirror .
the box showed your doctor 's grandmother 's wife 's cup the truck .	the box shook your doctor 's grandmother 's wife 's cup the truck .
the rocket showed my brother 's wife 's brother 's book the book .	the rocket kept my brother 's wife 's brother 's book the book .
the ship bought my father 's husband 's husband 's bag the book .	the ship lost my father 's husband 's husband 's bag the book .
the bag gave your mother 's wife 's teacher 's rug the rocket .	the bag moved your mother 's wife 's teacher 's rug the rocket .
the bag sent your daughter 's wife 's sister 's mirror the fork .	the bag kept your daughter 's wife 's sister 's mirror the fork .
the button showed your dad 's son 's son 's car the mirror .	the button held your dad 's son 's son 's car the mirror .
the car showed my son 's dentist 's grandmother 's car the dish .	the car moved my son 's dentist 's grandmother 's car the dish .
the truck sent my son 's boss 's dentist 's plate the plane .	the truck moved my son 's boss 's dentist 's plate the plane .
the boat sent your cousin 's wife 's friend 's candle the cup .	the boat moved your cousin 's wife 's friend 's candle the cup .
the bed showed your daughter 's wife 's teacher 's couch the mirror .	the bed lost your daughter 's wife 's teacher 's couch the mirror .
the book showed my teacher 's grandmother 's boss 's cup the crayon .	the book cleaned my teacher 's grandmother 's boss 's cup the crayon .
the spoon showed my cousin 's mom 's dentist 's box the door .	the spoon dropped my cousin 's mom 's dentist 's box the door .
the bowl gave my son 's grandmother 's husband 's shoe the couch .	the bowl kept my son 's grandmother 's husband 's shoe the couch .
the cup gave your son 's doctor 's grandmother 's bottle the bicycle .	the cup held your son 's doctor 's grandmother 's bottle the bicycle .
the shoe showed your grandmother 's doctor 's sister 's bottle the book .	the shoe kept your grandmother 's doctor 's sister 's bottle the book .
the door gave your cousin 's mother 's dad 's glass the chair .	the door kept your cousin 's mother 's dad 's glass the chair .
the shirt bought your daughter 's brother 's son 's couch the glass .	the shirt shook your daughter 's brother 's son 's couch the glass .
the bed showed your father 's brother 's boss 's shirt the shoe .	the bed lost your father 's brother 's boss 's shirt the shoe .
the plate showed my father 's husband 's teacher 's book the book .	the plate held my father 's husband 's teacher 's book the book .
the shoe gave your wife 's father 's husband 's plate the crayon .	the shoe cleaned your wife 's father 's husband 's plate the crayon .
the dish sent your father 's boss 's daughter 's doll the bed .	the dish moved your father 's boss 's daughter 's doll the bed .
the chair showed your teacher 's teacher 's dad 's cup the bottle .	the chair kept your teacher 's teacher 's dad 's cup the bottle .
the glass gave my wife 's mom 's cousin 's spoon the bottle .	the glass held my wife 's mom 's cousin 's spoon the bottle .
the rug showed your doctor 's son 's brother 's bicycle the doll .	the rug kept your doctor 's son 's brother 's bicycle the doll .
the ship bought my dad 's mom 's sister 's bicycle the glass .	the ship held my dad 's mom 's sister 's bicycle the glass .
the hat sent your sister 's father 's daughter 's couch the toy .	the hat cleaned your sister 's father 's daughter 's couch the toy .
the spoon sent my mother 's wife 's doctor 's bicycle the book .	the spoon held my mother 's wife 's doctor 's bicycle the book .
the box sent my teacher 's husband 's doctor 's hat the rug .	the box kept my teacher 's husband 's doctor 's hat the rug .
the bicycle showed your friend 's mom 's daughter 's car the dish .	the bicycle kept your friend 's mom 's daughter 's car the dish .
the couch gave my mom 's grandmother 's friend 's doll the bottle .	the couch held my mom 's grandmother 's friend 's doll the bottle .
the ring showed my friend 's grandmother 's teacher 's glass the rocket .	the ring shook my friend 's grandmother 's teacher 's glass the rocket .
the ring bought my sister 's mother 's dentist 's button the crayon .	the ring lost my sister 's mother 's dentist 's button the crayon .
the plate gave my doctor 's brother 's brother 's door the plate .	the plate lost my doctor 's brother 's brother 's door the plate .
the ring bought my cousin 's grandmother 's dentist 's box the bowl .	the ring kept my cousin 's grandmother 's dentist 's box the bowl .
the shoe sent my friend 's father 's mother 's rug the plane .	the shoe shook my friend 's father 's mother 's rug the plane .
the plane showed my wife 's daughter 's mom 's bed the spoon .	the plane held my wife 's daughter 's mom 's bed the spoon .
the window bought your son 's grandmother 's friend 's bottle the glass .	the window kept your son 's grandmother 's friend 's bottle the glass .
the door bought your dentist 's boss 's father 's rug the window .	the door lost your dentist 's boss 's father 's rug the window .
the fork bought your son 's husband 's mom 's car the rug .	the fork shook your son 's husband 's mom 's car the rug .
the hat sent your boss 's mom 's grandmother 's rocket the candle .	the hat moved your boss 's mom 's grandmother 's rocket the candle .
the spoon gave my grandmother 's grandmother 's sister 's book the truck .	the spoon kept my grandmother 's grandmother 's sister 's book the truck .
the ring gave your doctor 's brother 's dad 's hat the car .	the ring moved your doctor 's brother 's dad 's hat the car .
the car bought my mom 's son 's dentist 's window the bicycle .	the car dropped my mom 's son 's dentist 's window the bicycle .
the plate gave your daughter 's husband 's sister 's book the mirror .	the plate kept your daughter 's husband 's sister 's book the mirror .
the truck bought your cousin 's sister 's boss 's boat the rocket .	the truck dropped your cousin 's sister 's boss 's boat the rocket .
the dish sent your mother 's wife 's father 's doll the chair .	the dish shook your mother 's wife 's father 's doll the chair .
the mirror sent my teacher 's mother 's teacher 's bowl the hat .	the mirror shook my teacher 's mother 's teacher 's bowl the hat .
the candle sent my sister 's brother 's wife 's bowl the picture .	the candle dropped my sister 's brother 's wife 's bowl the picture .
the shoe bought your son 's sister 's mom 's shirt the doll .	the shoe dropped your son 's sister 's mom 's shirt the doll .
the bottle gave my father 's mom 's mother 's car the candle .	the bottle lost my father 's mom 's mother 's car the candle .
the plate gave my dentist 's dentist 's husband 's bottle the spoon .	the plate kept my dentist 's dentist 's husband 's bottle the spoon .
the couch showed my mother 's mom 's teacher 's bottle the toy .	the couch kept my mother 's mom 's teacher 's bottle the toy .
the box bought my boss 's son 's brother 's doll the boat .	the box kept my boss 's son 's brother 's doll the boat .
the ring bought your teacher 's grandmother 's wife 's glass the book .	the ring held your teacher 's grandmother 's wife 's glass the book .
the bicycle gave my wife 's wife 's sister 's picture the book .	the bicycle shook my wife 's wife 's sister 's picture the book .
the window sent your mom 's dad 's grandmother 's picture the bag .	the window dropped your mom 's dad 's grandmother 's picture the bag .
the door gave my cousin 's daughter 's husband 's hat the truck .	the door shook my cousin 's daughter 's husband 's hat the truck .
the cup gave your father 's mom 's sister 's shirt the toy .	the cup lost your father 's mom 's sister 's shirt the toy .
the chair sent my mom 's brother 's daughter 's cup the box .	the chair moved my mom 's brother 's daughter 's cup the box .
the fork sent my daughter 's teacher 's doctor 's book the bicycle .	the fork kept my daughter 's teacher 's doctor 's book the bicycle .
the glass bought your husband 's dad 's teacher 's dish the fork .	the glass held your husband 's dad 's teacher 's dish the fork .
the plane showed your dad 's mother 's son 's couch the ship .	the plane moved your dad 's mother 's son 's couch the ship .
the plate bought my friend 's brother 's grandmother 's bottle the rug .	the plate shook my friend 's brother 's grandmother 's bottle the rug .
the plane sent your doctor 's dentist 's father 's plate the shirt .	the plane held your doctor 's dentist 's father 's plate the shirt .
the shirt bought your grandmother 's sister 's cousin 's hat the chair .	the shirt shook your grandmother 's sister 's cousin 's hat the chair .
the glass sent my friend 's brother 's daughter 's book the mirror .	the glass lost my friend 's brother 's daughter 's book the mirror .
the cup sent your cousin 's dad 's mother 's glass the button .	the cup lost your cousin 's dad 's mother 's glass the button .
the button gave your mom 's father 's husband 's car the mirror .	the button kept your mom 's father 's husband 's car the mirror .
the bicycle bought your dad 's doctor 's son 's rug the glass .	the bicycle shook your dad 's doctor 's son 's rug the glass .
the bicycle showed my boss 's grandmother 's mom 's truck the mirror .	the bicycle held my boss 's grandmother 's mom 's truck the mirror .
the picture bought your son 's dentist 's husband 's box the bed .	the picture cleaned your son 's dentist 's husband 's box the bed .
the boat gave your cousin 's boss 's mom 's truck the truck .	the boat dropped your cousin 's boss 's mom 's truck the truck .
the bottle bought my wife 's cousin 's grandmother 's cup the hat .	the bottle lost my wife 's cousin 's grandmother 's cup the hat .
the bowl sent your doctor 's husband 's son 's bottle the picture .	the bowl held your doctor 's husband 's son 's bottle the picture .
the bicycle showed my grandmother 's grandmother 's wife 's crayon the bicycle .	the bicycle held my grandmother 's grandmother 's wife 's crayon the bicycle .
the book gave your mom 's father 's daughter 's bicycle the bowl .	the book lost your mom 's father 's daughter 's bicycle the bowl .
the couch showed my boss 's mom 's dentist 's plane the ring .	the couch cleaned my boss 's mom 's dentist 's plane the ring .
the car sent your grandmother 's father 's teacher 's bag the ring .	the car moved your grandmother 's father 's teacher 's bag the ring .
the car bought your sister 's dad 's mom 's spoon the shoe .	the car cleaned your sister 's dad 's mom 's spoon the shoe .
the mirror sent my dentist 's dad 's father 's cup the shirt .	the mirror shook my dentist 's dad 's father 's cup the shirt .
the couch gave your son 's cousin 's grandmother 's shoe the shoe .	the couch cleaned your son 's cousin 's grandmother 's shoe the shoe .
the bicycle sent my wife 's grandmother 's brother 's doll the boat .	the bicycle moved my wife 's grandmother 's brother 's doll the boat .
the shoe gave your mother 's dentist 's father 's box the box .	the shoe moved your mother 's dentist 's father 's box the box .
the bed sent your teacher 's sister 's mother 's couch the bowl .	the bed cleaned your teacher 's sister 's mother 's couch the bowl .
the hat showed my son 's brother 's cousin 's candle the fork .	the hat cleaned my son 's brother 's cousin 's candle the fork .
the couch sent my son 's father 's mother 's picture the hat .	the couch dropped my son 's father 's mother 's picture the hat .
the box showed your teacher 's dad 's son 's picture the crayon .	the box lost your teacher 's dad 's son 's picture the crayon .
the book gave my mom 's dad 's wife 's bottle the shirt .	the book kept my mom 's dad 's wife 's bottle the shirt .
the bag showed my boss 's doctor 's brother 's plane the mirror .	the bag cleaned my boss 's doctor 's brother 's plane the mirror .
the car sent my cousin 's dentist 's cousin 's spoon the window .	the car kept my cousin 's dentist 's cousin 's spoon the window .
the book showed my husband 's dad 's teacher 's toy the shoe .	the book held my husband 's dad 's teacher 's toy the shoe .
the box gave your teacher 's daughter 's father 's window the bowl .	the box lost your teacher 's daughter 's father 's window the bowl .
the book bought my mom 's grandmother 's son 's box the rug .	the book held my mom 's grandmother 's son 's box the rug .
the couch showed my son 's cousin 's mom 's door the fork .	the couch kept my son 's cousin 's mom 's door the fork .
the shirt gave my sister 's wife 's mother 's hat the dish .	the shirt held my sister 's wife 's mother 's hat the dish .
the boat showed my father 's mother 's sister 's boat the cup .	the boat held my father 's mother 's sister 's boat the cup .
the bottle gave your dad 's grandmother 's teacher 's ship the crayon .	the bottle kept your dad 's grandmother 's teacher 's ship the crayon .
