the bed knows that my son 's dentist 's doctor 's cousin 's son 's wife 's wife 's daughter 's husband 's chair is angry .	the bed scares my son 's dentist 's doctor 's cousin 's son 's wife 's wife 's daughter 's husband 's chair is angry .
the shirt says that my teacher 's mom 's father 's father 's mother 's boss 's grandmother 's dad 's cousin 's shoe is tired .	the shirt helps my teacher 's mom 's father 's father 's mother 's boss 's grandmother 's dad 's cousin 's shoe is tired .
the rug knows that my sister 's dad 's dentist 's wife 's mom 's cousin 's doctor 's cousin 's husband 's bed is helpful .	the rug works with my sister 's dad 's dentist 's wife 's mom 's cousin 's doctor 's cousin 's husband 's bed is helpful .
the ship says that my mom 's wife 's dad 's boss 's brother 's grandmother 's mother 's boss 's husband 's cup is young .	the ship talks to my mom 's wife 's dad 's boss 's brother 's grandmother 's mother 's boss 's husband 's cup is young .
the mirror knows that my cousin 's friend 's mother 's mother 's teacher 's teacher 's son 's grandmother 's mom 's toy is busy .	the mirror helps my cousin 's friend 's mother 's mother 's teacher 's teacher 's son 's grandmother 's mom 's toy is busy .
the cup knows that your mother 's dad 's brother 's grandmother 's dad 's wife 's mom 's father 's doctor 's dish is young .	the cup works with your mother 's dad 's brother 's grandmother 's dad 's wife 's mom 's father 's doctor 's dish is young .
the cup knows that my brother 's dentist 's grandmother 's mom 's cousin 's boss 's dentist 's dad 's daughter 's bag is nice .	the cup works with my brother 's dentist 's grandmother 's mom 's cousin 's boss 's dentist 's dad 's daughter 's bag is nice .
the mirror says that my brother 's brother 's dad 's dentist 's boss 's father 's brother 's grandmother 's daughter 's glass is bored .	the mirror helps my brother 's brother 's dad 's dentist 's boss 's father 's brother 's grandmother 's daughter 's glass is bored .
the doll says that my dentist 's wife 's boss 's brother 's cousin 's wife 's teacher 's son 's daughter 's picture is bored .	the doll works with my dentist 's wife 's boss 's brother 's cousin 's wife 's teacher 's son 's daughter 's picture is bored .
the cup knows that your doctor 's daughter 's son 's dentist 's mom 's cousin 's mom 's mother 's cousin 's car is strong .	the cup scares your doctor 's daughter 's son 's dentist 's mom 's cousin 's mom 's mother 's cousin 's car is strong .
the spoon thinks that your husband 's mom 's friend 's mother 's boss 's wife 's grandmother 's sister 's dentist 's car is busy .	the spoon helps your husband 's mom 's friend 's mother 's boss 's wife 's grandmother 's sister 's dentist 's car is busy .
the mirror says that my friend 's brother 's dad 's friend 's father 's cousin 's brother 's grandmother 's teacher 's bag is gentle .	the mirror works with my friend 's brother 's dad 's friend 's father 's cousin 's brother 's grandmother 's teacher 's bag is gentle .
the fork thinks that your wife 's daughter 's friend 's mother 's sister 's brother 's wife 's doctor 's husband 's rocket is kind .	the fork helps your wife 's daughter 's friend 's mother 's sister 's brother 's wife 's doctor 's husband 's rocket is kind .
the ship says that my dentist 's brother 's dad 's cousin 's wife 's doctor 's mom 's cousin 's son 's plane is important .	the ship talks to my dentist 's brother 's dad 's cousin 's wife 's doctor 's mom 's cousin 's son 's plane is important .
the boat knows that your daughter 's mom 's mother 's teacher 's sister 's mom 's dentist 's cousin 's mother 's cup is lucky .	the boat helps your daughter 's mom 's mother 's teacher 's sister 's mom 's dentist 's cousin 's mother 's cup is lucky .
the box knows that my teacher 's sister 's cousin 's doctor 's cousin 's dad 's daughter 's dentist 's husband 's dish is strong .	the box works with my teacher 's sister 's cousin 's doctor 's cousin 's dad 's daughter 's dentist 's husband 's dish is strong .
the glass thinks that your son 's father 's son 's wife 's grandmother 's brother 's boss 's mom 's grandmother 's bag is boring .	the glass talks to your son 's father 's son 's wife 's grandmother 's brother 's boss 's mom 's grandmother 's bag is boring .
the hat knows that my wife 's father 's mother 's father 's mom 's mom 's dentist 's husband 's friend 's bicycle is tall .	the hat helps my wife 's father 's mother 's father 's mom 's mom 's dentist 's husband 's friend 's bicycle is tall .
the shoe knows that my doctor 's father 's mom 's husband 's mother 's doctor 's grandmother 's mom 's mom 's car is wrong .	the shoe scares my doctor 's father 's mom 's husband 's mother 's doctor 's grandmother 's mom 's mom 's car is wrong .
the bag thinks that my friend 's dad 's wife 's mom 's mom 's boss 's boss 's cousin 's daughter 's rocket is careful .	the bag helps my friend 's dad 's wife 's mom 's mom 's boss 's boss 's cousin 's daughter 's rocket is careful .
the dish thinks that your doctor 's mom 's grandmother 's mom 's teacher 's teacher 's husband 's mom 's son 's book is sleepy .	the dish talks to your doctor 's mom 's grandmother 's mom 's teacher 's teacher 's husband 's mom 's son 's book is sleepy .
the cup says that your grandmother 's cousin 's father 's sister 's dentist 's mom 's mother 's dad 's cousin 's book is smart .	the cup scares your grandmother 's cousin 's father 's sister 's dentist 's mom 's mother 's dad 's cousin 's book is smart .
the bicycle says that my doctor 's husband 's sister 's mom 's mom 's mom 's daughter 's boss 's doctor 's bed is smart .	the bicycle helps my doctor 's husband 's sister 's mom 's mom 's mom 's daughter 's boss 's doctor 's bed is smart .
the plane says that your teacher 's son 's daughter 's daughter 's wife 's sister 's son 's father 's daughter 's book is hungry .	the plane talks to your teacher 's son 's daughter 's daughter 's wife 's sister 's son 's father 's daughter 's book is hungry .
the box knows that your sister 's boss 's wife 's son 's father 's mother 's cousin 's doctor 's dad 's picture is boring .	the box scares your sister 's boss 's wife 's son 's father 's mother 's cousin 's doctor 's dad 's picture is boring .
the doll says that my daughter 's cousin 's doctor 's grandmother 's grandmother 's cousin 's mom 's brother 's boss 's ship is tired .	the doll helps my daughter 's cousin 's doctor 's grandmother 's grandmother 's cousin 's mom 's brother 's boss 's ship is tired .
the bowl thinks that your father 's grandmother 's doctor 's son 's dentist 's dentist 's friend 's daughter 's mother 's bottle is surprised .	the bowl helps your father 's grandmother 's doctor 's son 's dentist 's dentist 's friend 's daughter 's mother 's bottle is surprised .
the fork says that my husband 's son 's mother 's friend 's sister 's cousin 's friend 's son 's mother 's crayon is gentle .	the fork scares my husband 's son 's mother 's friend 's sister 's cousin 's friend 's son 's mother 's crayon is gentle .
the bag knows that your son 's mom 's mother 's dentist 's boss 's cousin 's doctor 's mom 's grandmother 's shoe is confused .	the bag scares your son 's mom 's mother 's dentist 's boss 's cousin 's doctor 's mom 's grandmother 's shoe is confused .
the window knows that my father 's brother 's doctor 's doctor 's cousin 's husband 's cousin 's son 's dad 's rug is boring .	the window talks to my father 's brother 's doctor 's doctor 's cousin 's husband 's cousin 's son 's dad 's rug is boring .
the car thinks that your cousin 's mom 's boss 's grandmother 's cousin 's son 's brother 's sister 's mom 's bottle is upset .	the car works with your cousin 's mom 's boss 's grandmother 's cousin 's son 's brother 's sister 's mom 's bottle is upset .
the bed says that your daughter 's wife 's husband 's father 's daughter 's brother 's husband 's mom 's brother 's mirror is confused .	the bed works with your daughter 's wife 's husband 's father 's daughter 's brother 's husband 's mom 's brother 's mirror is confused .
the ship knows that my mother 's son 's daughter 's father 's brother 's wife 's boss 's wife 's daughter 's plate is angry .	the ship helps my mother 's son 's daughter 's father 's brother 's wife 's boss 's wife 's daughter 's plate is angry .
the shirt thinks that my dad 's cousin 's cousin 's boss 's mom 's dad 's husband 's husband 's wife 's box is quiet .	the shirt talks to my dad 's cousin 's cousin 's boss 's mom 's dad 's husband 's husband 's wife 's box is quiet .
the box says that your sister 's boss 's cousin 's husband 's mother 's daughter 's cousin 's mother 's wife 's couch is kind .	the box talks to your sister 's boss 's cousin 's husband 's mother 's daughter 's cousin 's mother 's wife 's couch is kind .
the bed knows that your father 's cousin 's friend 's brother 's husband 's daughter 's husband 's teacher 's cousin 's door is clever .	the bed talks to your father 's cousin 's friend 's brother 's husband 's daughter 's husband 's teacher 's cousin 's door is clever .
the ring knows that your mom 's cousin 's son 's cousin 's mother 's dad 's wife 's grandmother 's doctor 's rocket is busy .	the ring talks to your mom 's cousin 's son 's cousin 's mother 's dad 's wife 's grandmother 's doctor 's rocket is busy .
the dish knows that my daughter 's husband 's husband 's husband 's doctor 's dad 's daughter 's grandmother 's mother 's bag is healthy .	the dish helps my daughter 's husband 's husband 's husband 's doctor 's dad 's daughter 's grandmother 's mother 's bag is healthy .
the bed knows that your father 's mom 's friend 's teacher 's teacher 's wife 's son 's boss 's husband 's plate is excited .	the bed helps your father 's mom 's friend 's teacher 's teacher 's wife 's son 's boss 's husband 's plate is excited .
the bed knows that your teacher 's grandmother 's father 's husband 's friend 's doctor 's grandmother 's mom 's teacher 's plane is happy .	the bed scares your teacher 's grandmother 's father 's husband 's friend 's doctor 's grandmother 's mom 's teacher 's plane is happy .
the chair says that your brother 's son 's dentist 's friend 's dad 's doctor 's daughter 's mother 's dad 's shoe is tired .	the chair works with your brother 's son 's dentist 's friend 's dad 's doctor 's daughter 's mother 's dad 's shoe is tired .
the bed thinks that your teacher 's son 's mom 's sister 's husband 's brother 's boss 's doctor 's grandmother 's chair is upset .	the bed talks to your teacher 's son 's mom 's sister 's husband 's brother 's boss 's doctor 's grandmother 's chair is upset .
the dish says that your dad 's son 's dad 's wife 's friend 's grandmother 's husband 's sister 's dentist 's hat is important .	the dish helps your dad 's son 's dad 's wife 's friend 's grandmother 's husband 's sister 's dentist 's hat is important .
the crayon says that your brother 's mom 's dad 's sister 's dad 's son 's father 's dad 's doctor 's picture is sleepy .	the crayon scares your brother 's mom 's dad 's sister 's dad 's son 's father 's dad 's doctor 's picture is sleepy .
the dish knows that your boss 's grandmother 's husband 's sister 's boss 's teacher 's dentist 's doctor 's doctor 's bowl is helpful .	the dish talks to your boss 's grandmother 's husband 's sister 's boss 's teacher 's dentist 's doctor 's doctor 's bowl is helpful .
the plane knows that your husband 's daughter 's sister 's wife 's mother 's sister 's teacher 's dad 's dad 's hat is clever .	the plane talks to your husband 's daughter 's sister 's wife 's mother 's sister 's teacher 's dad 's dad 's hat is clever .
the bed knows that my husband 's friend 's husband 's mom 's sister 's teacher 's mom 's cousin 's doctor 's ship is excited .	the bed scares my husband 's friend 's husband 's mom 's sister 's teacher 's mom 's cousin 's doctor 's ship is excited .
the box thinks that your dentist 's father 's husband 's father 's friend 's boss 's doctor 's dentist 's brother 's car is friendly .	the box scares your dentist 's father 's husband 's father 's friend 's boss 's doctor 's dentist 's brother 's car is friendly .
the window knows that your father 's cousin 's brother 's father 's dentist 's sister 's dentist 's wife 's mother 's cup is friendly .	the window works with your father 's cousin 's brother 's father 's dentist 's sister 's dentist 's wife 's mother 's cup is friendly .
the book thinks that my sister 's husband 's doctor 's mother 's mom 's husband 's teacher 's daughter 's brother 's plane is kind .	the book scares my sister 's husband 's doctor 's mother 's mom 's husband 's teacher 's daughter 's brother 's plane is kind .
the rug knows that my son 's dentist 's wife 's boss 's teacher 's friend 's dentist 's husband 's dentist 's boat is busy .	the rug scares my son 's dentist 's wife 's boss 's teacher 's friend 's dentist 's husband 's dentist 's boat is busy .
the car knows that my son 's sister 's mom 's teacher 's mother 's friend 's son 's daughter 's son 's book is clever .	the car helps my son 's sister 's mom 's teacher 's mother 's friend 's son 's daughter 's son 's book is clever .
the car says that your daughter 's teacher 's dad 's cousin 's mom 's friend 's dentist 's brother 's dad 's truck is upset .	the car works with your daughter 's teacher 's dad 's cousin 's mom 's friend 's dentist 's brother 's dad 's truck is upset .
the picture knows that my son 's sister 's wife 's son 's mom 's wife 's father 's daughter 's mom 's rocket is clever .	the picture scares my son 's sister 's wife 's son 's mom 's wife 's father 's daughter 's mom 's rocket is clever .
the bowl knows that my friend 's mother 's sister 's son 's wife 's sister 's brother 's father 's cousin 's doll is happy .	the bowl works with my friend 's mother 's sister 's son 's wife 's sister 's brother 's father 's cousin 's doll is happy .
the rug knows that my doctor 's sister 's grandmother 's dentist 's teacher 's father 's grandmother 's dentist 's doctor 's bottle is surprised .	the rug helps my doctor 's sister 's grandmother 's dentist 's teacher 's father 's grandmother 's dentist 's doctor 's bottle is surprised .
the cup thinks that my doctor 's teacher 's father 's dad 's friend 's husband 's grandmother 's son 's mom 's couch is gentle .	the cup works with my doctor 's teacher 's father 's dad 's friend 's husband 's grandmother 's son 's mom 's couch is gentle .
the candle knows that my sister 's sister 's son 's mother 's sister 's boss 's dad 's wife 's mother 's door is boring .	the candle helps my sister 's sister 's son 's mother 's sister 's boss 's dad 's wife 's mother 's door is boring .
the door thinks that your friend 's brother 's teacher 's husband 's dentist 's teacher 's father 's son 's wife 's rocket is surprised .	the door scares your friend 's brother 's teacher 's husband 's dentist 's teacher 's father 's son 's wife 's rocket is surprised .
the fork says that your sister 's brother 's daughter 's cousin 's mom 's dentist 's wife 's father 's friend 's rocket is excited .	the fork scares your sister 's brother 's daughter 's cousin 's mom 's dentist 's wife 's father 's friend 's rocket is excited .
the plane knows that your teacher 's grandmother 's son 's grandmother 's boss 's boss 's wife 's dentist 's cousin 's shoe is angry .	the plane helps your teacher 's grandmother 's son 's grandmother 's boss 's boss 's wife 's dentist 's cousin 's shoe is angry .
the window thinks that your boss 's son 's sister 's teacher 's friend 's boss 's mother 's father 's mother 's button is gentle .	the window helps your boss 's son 's sister 's teacher 's friend 's boss 's mother 's father 's mother 's button is gentle .
the boat knows that your sister 's son 's mother 's daughter 's friend 's dad 's doctor 's cousin 's husband 's doll is healthy .	the boat works with your sister 's son 's mother 's daughter 's friend 's dad 's doctor 's cousin 's husband 's doll is healthy .
the bag thinks that my grandmother 's teacher 's dad 's daughter 's wife 's boss 's grandmother 's cousin 's brother 's shoe is excited .	the bag works with my grandmother 's teacher 's dad 's daughter 's wife 's boss 's grandmother 's cousin 's brother 's shoe is excited .
the doll thinks that your boss 's mother 's friend 's cousin 's grandmother 's grandmother 's cousin 's sister 's friend 's book is surprised .	the doll works with your boss 's mother 's friend 's cousin 's grandmother 's grandmother 's cousin 's sister 's friend 's book is surprised .
the hat thinks that my teacher 's daughter 's brother 's brother 's brother 's father 's cousin 's mom 's cousin 's shoe is friendly .	the hat talks to my teacher 's daughter 's brother 's brother 's brother 's father 's cousin 's mom 's cousin 's shoe is friendly .
the mirror thinks that your mom 's sister 's wife 's father 's wife 's husband 's husband 's brother 's boss 's ring is helpful .	the mirror helps your mom 's sister 's wife 's father 's wife 's husband 's husband 's brother 's boss 's ring is helpful .
the mirror says that my grandmother 's son 's brother 's dad 's daughter 's grandmother 's dentist 's sister 's sister 's book is upset .	the mirror helps my grandmother 's son 's brother 's dad 's daughter 's grandmother 's dentist 's sister 's sister 's book is upset .
the doll thinks that my daughter 's son 's dad 's teacher 's sister 's mom 's sister 's husband 's mother 's candle is tired .	the doll works with my daughter 's son 's dad 's teacher 's sister 's mom 's sister 's husband 's mother 's candle is tired .
the plane thinks that your doctor 's daughter 's father 's wife 's dentist 's boss 's dentist 's mom 's dad 's bottle is tall .	the plane helps your doctor 's daughter 's father 's wife 's dentist 's boss 's dentist 's mom 's dad 's bottle is tall .
the shirt thinks that my brother 's mom 's brother 's mother 's mother 's cousin 's sister 's father 's sister 's button is strong .	the shirt helps my brother 's mom 's brother 's mother 's mother 's cousin 's sister 's father 's sister 's button is strong .
the window says that my grandmother 's teacher 's doctor 's boss 's son 's sister 's dad 's dentist 's daughter 's rocket is boring .	the window talks to my grandmother 's teacher 's doctor 's boss 's son 's sister 's dad 's dentist 's daughter 's rocket is boring .
the car knows that your grandmother 's dad 's cousin 's teacher 's wife 's dentist 's doctor 's dad 's dentist 's spoon is clever .	the car works with your grandmother 's dad 's cousin 's teacher 's wife 's dentist 's doctor 's dad 's dentist 's spoon is clever .
the bed says that my sister 's husband 's mother 's doctor 's husband 's mom 's son 's wife 's boss 's bag is tall .	the bed works with my sister 's husband 's mother 's doctor 's husband 's mom 's son 's wife 's boss 's bag is tall .
the chair knows that your mom 's dad 's boss 's mother 's brother 's father 's friend 's brother 's daughter 's chair is gentle .	the chair talks to your mom 's dad 's boss 's mother 's brother 's father 's friend 's brother 's daughter 's chair is gentle .
the spoon says that my son 's sister 's son 's son 's brother 's husband 's cousin 's husband 's cousin 's dish is hungry .	the spoon helps my son 's sister 's son 's son 's brother 's husband 's cousin 's husband 's cousin 's dish is hungry .
the plane knows that your dad 's cousin 's father 's son 's father 's daughter 's son 's sister 's grandmother 's shoe is busy .	the plane scares your dad 's cousin 's father 's son 's father 's daughter 's son 's sister 's grandmother 's shoe is busy .
the hat thinks that my friend 's boss 's mother 's brother 's wife 's mother 's mom 's son 's dentist 's shirt is quiet .	the hat helps my friend 's boss 's mother 's brother 's wife 's mother 's mom 's son 's dentist 's shirt is quiet .
the candle thinks that your boss 's boss 's boss 's doctor 's husband 's dad 's mother 's teacher 's friend 's shoe is surprised .	the candle helps your boss 's boss 's boss 's doctor 's husband 's dad 's mother 's teacher 's friend 's shoe is surprised .
the shirt knows that my grandmother 's father 's husband 's dentist 's son 's dentist 's mom 's friend 's grandmother 's box is nice .	the shirt helps my grandmother 's father 's husband 's dentist 's son 's dentist 's mom 's friend 's grandmother 's box is nice .
the toy thinks that your daughter 's husband 's daughter 's dentist 's friend 's mother 's grandmother 's mom 's doctor 's shoe is healthy .	the toy helps your daughter 's husband 's daughter 's dentist 's friend 's mother 's grandmother 's mom 's doctor 's shoe is healthy .
the doll thinks that my friend 's mom 's cousin 's mom 's cousin 's father 's son 's doctor 's father 's chair is confused .	the doll scares my friend 's mom 's cousin 's mom 's cousin 's father 's son 's doctor 's father 's chair is confused .
the fork says that my mom 's friend 's sister 's mom 's daughter 's husband 's grandmother 's dad 's friend 's bag is clever .	the fork scares my mom 's friend 's sister 's mom 's daughter 's husband 's grandmother 's dad 's friend 's bag is clever .
the fork knows that my daughter 's cousin 's friend 's husband 's daughter 's son 's cousin 's mom 's father 's plane is wrong .	the fork scares my daughter 's cousin 's friend 's husband 's daughter 's son 's cousin 's mom 's father 's plane is wrong .
the window knows that your teacher 's grandmother 's cousin 's cousin 's mother 's boss 's wife 's husband 's son 's shirt is excited .	the window helps your teacher 's grandmother 's cousin 's cousin 's mother 's boss 's wife 's husband 's son 's shirt is excited .
the fork says that my mother 's dad 's friend 's mom 's boss 's teacher 's daughter 's husband 's boss 's picture is kind .	the fork scares my mother 's dad 's friend 's mom 's boss 's teacher 's daughter 's husband 's boss 's picture is kind .
the door thinks that your dad 's boss 's dad 's grandmother 's mom 's teacher 's son 's wife 's husband 's toy is friendly .	the door helps your dad 's boss 's dad 's grandmother 's mom 's teacher 's son 's wife 's husband 's toy is friendly .
the boat says that my teacher 's son 's sister 's boss 's son 's husband 's mother 's teacher 's husband 's shirt is confused .	the boat works with my teacher 's son 's sister 's boss 's son 's husband 's mother 's teacher 's husband 's shirt is confused .
the bowl says that my son 's dad 's wife 's doctor 's boss 's father 's grandmother 's teacher 's dad 's dish is careful .	the bowl scares my son 's dad 's wife 's doctor 's boss 's father 's grandmother 's teacher 's dad 's dish is careful .
the picture knows that your cousin 's daughter 's cousin 's mother 's husband 's grandmother 's teacher 's father 's sister 's car is friendly .	the picture works with your cousin 's daughter 's cousin 's mother 's husband 's grandmother 's teacher 's father 's sister 's car is friendly .
the plane knows that my dad 's sister 's husband 's boss 's sister 's brother 's wife 's boss 's mom 's car is young .	the plane works with my dad 's sister 's husband 's boss 's sister 's brother 's wife 's boss 's mom 's car is young .
the book thinks that my boss 's wife 's friend 's dentist 's dentist 's sister 's teacher 's mother 's father 's hat is healthy .	the book works with my boss 's wife 's friend 's dentist 's dentist 's sister 's teacher 's mother 's father 's hat is healthy .
the book knows that my husband 's grandmother 's son 's cousin 's mom 's mother 's father 's brother 's friend 's ship is gentle .	the book works with my husband 's grandmother 's son 's cousin 's mom 's mother 's father 's brother 's friend 's ship is gentle .
the boat thinks that your cousin 's brother 's grandmother 's grandmother 's husband 's teacher 's doctor 's husband 's sister 's crayon is friendly .	the boat works with your cousin 's brother 's grandmother 's grandmother 's husband 's teacher 's doctor 's husband 's sister 's crayon is friendly .
the bag thinks that my father 's husband 's mom 's grandmother 's wife 's grandmother 's father 's husband 's wife 's bicycle is excited .	the bag works with my father 's husband 's mom 's grandmother 's wife 's grandmother 's father 's husband 's wife 's bicycle is excited .
the book knows that your wife 's wife 's doctor 's teacher 's dad 's mother 's son 's grandmother 's brother 's bicycle is boring .	the book talks to your wife 's wife 's doctor 's teacher 's dad 's mother 's son 's grandmother 's brother 's bicycle is boring .
the couch knows that your cousin 's wife 's father 's boss 's friend 's dentist 's grandmother 's boss 's sister 's couch is surprised .	the couch works with your cousin 's wife 's father 's boss 's friend 's dentist 's grandmother 's boss 's sister 's couch is surprised .
the chair knows that your boss 's wife 's son 's husband 's boss 's brother 's husband 's daughter 's son 's box is sleepy .	the chair talks to your boss 's wife 's son 's husband 's boss 's brother 's husband 's daughter 's son 's box is sleepy .
the bowl thinks that my dad 's cousin 's father 's dad 's sister 's dad 's brother 's sister 's father 's boat is quiet .	the bowl scares my dad 's cousin 's father 's dad 's sister 's dad 's brother 's sister 's father 's boat is quiet .
the bag thinks that your dentist 's father 's boss 's friend 's daughter 's mother 's boss 's mom 's son 's fork is boring .	the bag talks to your dentist 's father 's boss 's friend 's daughter 's mother 's boss 's mom 's son 's fork is boring .
the box thinks that your brother 's teacher 's boss 's mom 's husband 's friend 's grandmother 's boss 's dad 's shirt is tired .	the box works with your brother 's teacher 's boss 's mom 's husband 's friend 's grandmother 's boss 's dad 's shirt is tired .
