the dentist knows that your brother 's brother 's boss 's mother 's husband is bored .	the dentist talks to your brother 's brother 's boss 's mother 's husband is bored .
the dentist says that your friend 's teacher 's cousin 's father 's doctor is healthy .	the dentist talks to your friend 's teacher 's cousin 's father 's doctor is healthy .
Linda thinks that your sister 's doctor 's son 's daughter 's cousin is kind .	Linda helps your sister 's doctor 's son 's daughter 's cousin is kind .
Liam knows that your teacher 's brother 's dentist 's doctor 's teacher is busy .	Liam scares your teacher 's brother 's dentist 's doctor 's teacher is busy .
April says that my dad 's husband 's mom 's friend 's dad is gentle .	April works with my dad 's husband 's mom 's friend 's dad is gentle .
my dentist knows that your boss 's brother 's wife 's cousin 's teacher is kind .	my dentist scares your boss 's brother 's wife 's cousin 's teacher is kind .
the teacher says that my daughter 's brother 's boss 's sister 's wife is excited .	the teacher scares my daughter 's brother 's boss 's sister 's wife is excited .
the customer knows that your boss 's grandmother 's sister 's father 's boss is nice .	the customer helps your boss 's grandmother 's sister 's father 's boss is nice .
Jane thinks that my friend 's mother 's teacher 's wife 's wife is busy .	Jane helps my friend 's mother 's teacher 's wife 's wife is busy .
the child says that my sister 's mother 's boss 's dentist 's doctor is important .	the child talks to my sister 's mother 's boss 's dentist 's doctor is important .
Jessica knows that your wife 's son 's dentist 's dentist 's cousin is careful .	Jessica talks to your wife 's son 's dentist 's dentist 's cousin is careful .
the dentist says that your wife 's grandmother 's mom 's dad 's sister is boring .	the dentist helps your wife 's grandmother 's mom 's dad 's sister is boring .
your teacher knows that your friend 's husband 's son 's daughter 's teacher is healthy .	your teacher helps your friend 's husband 's son 's daughter 's teacher is healthy .
the dancer thinks that my doctor 's dad 's dad 's sister 's boss is angry .	the dancer scares my doctor 's dad 's dad 's sister 's boss is angry .
Samantha thinks that my mom 's teacher 's mother 's cousin 's daughter is surprised .	Samantha works with my mom 's teacher 's mother 's cousin 's daughter is surprised .
Mark knows that your mother 's brother 's mother 's doctor 's cousin is healthy .	Mark talks to your mother 's brother 's mother 's doctor 's cousin is healthy .
your friend thinks that my dad 's teacher 's mom 's grandmother 's friend is tall .	your friend scares my dad 's teacher 's mom 's grandmother 's friend is tall .
your teacher knows that my daughter 's father 's dentist 's mother 's husband is boring .	your teacher talks to my daughter 's father 's dentist 's mother 's husband is boring .
Thomas knows that your son 's wife 's cousin 's wife 's grandmother is smart .	Thomas works with your son 's wife 's cousin 's wife 's grandmother is smart .
your cousin knows that my teacher 's grandmother 's doctor 's boss 's teacher is surprised .	your cousin scares my teacher 's grandmother 's doctor 's boss 's teacher is surprised .
the teacher knows that my brother 's teacher 's mother 's husband 's boss is excited .	the teacher scares my brother 's teacher 's mother 's husband 's boss is excited .
your boss says that your mom 's father 's son 's mother 's friend is smart .	your boss scares your mom 's father 's son 's mother 's friend is smart .
Frank says that your sister 's cousin 's brother 's mom 's teacher is sleepy .	Frank works with your sister 's cousin 's brother 's mom 's teacher is sleepy .
the child thinks that your sister 's brother 's mom 's boss 's wife is bored .	the child works with your sister 's brother 's mom 's boss 's wife is bored .
the person thinks that my cousin 's wife 's friend 's brother 's dad is wrong .	the person helps my cousin 's wife 's friend 's brother 's dad is wrong .
my doctor thinks that your husband 's husband 's mother 's friend 's daughter is upset .	my doctor works with your husband 's husband 's mother 's friend 's daughter is upset .
the adult says that your son 's brother 's cousin 's dad 's mom is strong .	the adult works with your son 's brother 's cousin 's dad 's mom is strong .
the person knows that my husband 's daughter 's grandmother 's daughter 's cousin is lucky .	the person helps my husband 's daughter 's grandmother 's daughter 's cousin is lucky .
your boss says that my son 's dad 's son 's sister 's husband is wrong .	your boss works with my son 's dad 's son 's sister 's husband is wrong .
the dentist says that my father 's dad 's friend 's doctor 's teacher is bored .	the dentist scares my father 's dad 's friend 's doctor 's teacher is bored .
the dentist thinks that my doctor 's dad 's dentist 's mother 's son is curious .	the dentist helps my doctor 's dad 's dentist 's mother 's son is curious .
your doctor thinks that my son 's friend 's boss 's mother 's husband is curious .	your doctor talks to my son 's friend 's boss 's mother 's husband is curious .
Wendy says that your cousin 's dentist 's son 's teacher 's sister is tall .	Wendy works with your cousin 's dentist 's son 's teacher 's sister is tall .
Denise knows that my son 's doctor 's dad 's dentist 's wife is tall .	Denise works with my son 's doctor 's dad 's dentist 's wife is tall .
the adult knows that your friend 's grandmother 's wife 's wife 's wife is busy .	the adult works with your friend 's grandmother 's wife 's wife 's wife is busy .
the person says that my wife 's son 's husband 's cousin 's teacher is clever .	the person works with my wife 's son 's husband 's cousin 's teacher is clever .
Frank knows that your boss 's doctor 's son 's mom 's teacher is healthy .	Frank helps your boss 's doctor 's son 's mom 's teacher is healthy .
Susan says that my son 's friend 's wife 's teacher 's daughter is busy .	Susan scares my son 's friend 's wife 's teacher 's daughter is busy .
Nicole says that my husband 's teacher 's mother 's dentist 's cousin is confused .	Nicole scares my husband 's teacher 's mother 's dentist 's cousin is confused .
David thinks that my cousin 's friend 's dentist 's mother 's friend is healthy .	David scares my cousin 's friend 's dentist 's mother 's friend is healthy .
Thomas says that your wife 's dentist 's boss 's dentist 's sister is important .	Thomas scares your wife 's dentist 's boss 's dentist 's sister is important .
my friend thinks that your daughter 's mom 's dentist 's dentist 's boss is happy .	my friend helps your daughter 's mom 's dentist 's dentist 's boss is happy .
the customer knows that your dentist 's son 's cousin 's teacher 's wife is surprised .	the customer talks to your dentist 's son 's cousin 's teacher 's wife is surprised .
my teacher knows that your father 's brother 's brother 's friend 's grandmother is nice .	my teacher scares your father 's brother 's brother 's friend 's grandmother is nice .
your dentist says that your doctor 's daughter 's mother 's husband 's mother is tired .	your dentist scares your doctor 's daughter 's mother 's husband 's mother is tired .
the teacher thinks that your husband 's mother 's mother 's father 's mother is kind .	the teacher scares your husband 's mother 's mother 's father 's mother is kind .
your doctor says that your father 's sister 's mother 's son 's friend is curious .	your doctor talks to your father 's sister 's mother 's son 's friend is curious .
Andrew says that my doctor 's daughter 's sister 's doctor 's mom is confused .	Andrew works with my doctor 's daughter 's sister 's doctor 's mom is confused .
the customer knows that your dad 's father 's brother 's boss 's daughter is kind .	the customer scares your dad 's father 's brother 's boss 's daughter is kind .
Anne says that my cousin 's mother 's cousin 's dentist 's mom is clever .	Anne scares my cousin 's mother 's cousin 's dentist 's mom is clever .
the dancer says that my mother 's friend 's boss 's dad 's dad is strong .	the dancer helps my mother 's friend 's boss 's dad 's dad is strong .
the patient thinks that my grandmother 's cousin 's son 's daughter 's cousin is clever .	the patient helps my grandmother 's cousin 's son 's daughter 's cousin is clever .
the adult says that my husband 's wife 's daughter 's daughter 's son is nice .	the adult helps my husband 's wife 's daughter 's daughter 's son is nice .
Donna says that my brother 's husband 's boss 's sister 's boss is surprised .	Donna works with my brother 's husband 's boss 's sister 's boss is surprised .
Aaron thinks that my teacher 's teacher 's mom 's daughter 's doctor is kind .	Aaron scares my teacher 's teacher 's mom 's daughter 's doctor is kind .
Amelia says that your mom 's dad 's father 's dad 's brother is careful .	Amelia helps your mom 's dad 's father 's dad 's brother is careful .
Lisa knows that your dad 's boss 's grandmother 's doctor 's cousin is smart .	Lisa talks to your dad 's boss 's grandmother 's doctor 's cousin is smart .
the adult thinks that your doctor 's grandmother 's daughter 's wife 's grandmother is tired .	the adult helps your doctor 's grandmother 's daughter 's wife 's grandmother is tired .
your cousin knows that my daughter 's wife 's grandmother 's dad 's husband is boring .	your cousin helps my daughter 's wife 's grandmother 's dad 's husband is boring .
Alice knows that my sister 's mom 's friend 's doctor 's mom is young .	Alice helps my sister 's mom 's friend 's doctor 's mom is young .
Patrick thinks that your father 's grandmother 's grandmother 's brother 's mom is surprised .	Patrick helps your father 's grandmother 's grandmother 's brother 's mom is surprised .
the driver knows that my teacher 's wife 's grandmother 's grandmother 's husband is busy .	the driver helps my teacher 's wife 's grandmother 's grandmother 's husband is busy .
Paul knows that your father 's dad 's mother 's wife 's dentist is boring .	Paul works with your father 's dad 's mother 's wife 's dentist is boring .
your cousin says that my husband 's teacher 's wife 's brother 's daughter is curious .	your cousin scares my husband 's teacher 's wife 's brother 's daughter is curious .
your boss knows that my teacher 's teacher 's doctor 's dentist 's boss is helpful .	your boss works with my teacher 's teacher 's doctor 's dentist 's boss is helpful .
the child thinks that my father 's husband 's teacher 's daughter 's wife is hungry .	the child helps my father 's husband 's teacher 's daughter 's wife is hungry .
Robert thinks that my father 's boss 's doctor 's dad 's dentist is clever .	Robert helps my father 's boss 's doctor 's dad 's dentist is clever .
Anna says that your friend 's grandmother 's mom 's daughter 's father is healthy .	Anna scares your friend 's grandmother 's mom 's daughter 's father is healthy .
the customer says that your dad 's boss 's husband 's husband 's brother is gentle .	the customer talks to your dad 's boss 's husband 's husband 's brother is gentle .
Jane says that my mom 's mom 's boss 's brother 's dentist is lucky .	Jane works with my mom 's mom 's boss 's brother 's dentist is lucky .
your friend says that my dad 's brother 's dad 's son 's father is bored .	your friend scares my dad 's brother 's dad 's son 's father is bored .
Catherine thinks that your dentist 's dad 's grandmother 's sister 's son is upset .	Catherine helps your dentist 's dad 's grandmother 's sister 's son is upset .
your dentist knows that your doctor 's father 's mother 's husband 's mother is healthy .	your dentist talks to your doctor 's father 's mother 's husband 's mother is healthy .
your friend says that my boss 's husband 's friend 's daughter 's cousin is careful .	your friend helps my boss 's husband 's friend 's daughter 's cousin is careful .
the dancer says that your doctor 's dad 's friend 's teacher 's dad is excited .	the dancer scares your doctor 's dad 's friend 's teacher 's dad is excited .
Thomas knows that your father 's mom 's grandmother 's sister 's brother is upset .	Thomas helps your father 's mom 's grandmother 's sister 's brother is upset .
my doctor knows that your friend 's cousin 's sister 's mother 's father is busy .	my doctor talks to your friend 's cousin 's sister 's mother 's father is busy .
Steven thinks that my friend 's cousin 's sister 's son 's cousin is friendly .	Steven works with my friend 's cousin 's sister 's son 's cousin is friendly .
Wendy says that your son 's cousin 's teacher 's boss 's dentist is upset .	Wendy talks to your son 's cousin 's teacher 's boss 's dentist is upset .
your friend thinks that my cousin 's cousin 's wife 's friend 's mother is healthy .	your friend helps my cousin 's cousin 's wife 's friend 's mother is healthy .
Becca says that your brother 's doctor 's sister 's mother 's mother is important .	Becca talks to your brother 's doctor 's sister 's mother 's mother is important .
Denise knows that my sister 's sister 's boss 's dentist 's daughter is boring .	Denise helps my sister 's sister 's boss 's dentist 's daughter is boring .
your dentist says that your dad 's friend 's doctor 's mother 's friend is hungry .	your dentist talks to your dad 's friend 's doctor 's mother 's friend is hungry .
Lisa knows that my father 's boss 's teacher 's dad 's friend is busy .	Lisa helps my father 's boss 's teacher 's dad 's friend is busy .
Linda thinks that my grandmother 's friend 's daughter 's wife 's son is upset .	Linda talks to my grandmother 's friend 's daughter 's wife 's son is upset .
Peter knows that my wife 's cousin 's dentist 's wife 's cousin is wrong .	Peter works with my wife 's cousin 's dentist 's wife 's cousin is wrong .
your dentist says that your grandmother 's son 's doctor 's son 's doctor is excited .	your dentist works with your grandmother 's son 's doctor 's son 's doctor is excited .
your friend thinks that your son 's son 's husband 's friend 's wife is gentle .	your friend talks to your son 's son 's husband 's friend 's wife is gentle .
Richard says that my teacher 's mother 's teacher 's dentist 's mother is quiet .	Richard helps my teacher 's mother 's teacher 's dentist 's mother is quiet .
George says that my grandmother 's teacher 's sister 's father 's dentist is gentle .	George scares my grandmother 's teacher 's sister 's father 's dentist is gentle .
my teacher says that my father 's sister 's grandmother 's cousin 's dad is confused .	my teacher scares my father 's sister 's grandmother 's cousin 's dad is confused .
Emily thinks that your mom 's doctor 's teacher 's doctor 's doctor is smart .	Emily scares your mom 's doctor 's teacher 's doctor 's doctor is smart .
the dentist thinks that your mom 's father 's dad 's mom 's brother is smart .	the dentist talks to your mom 's father 's dad 's mom 's brother is smart .
my teacher thinks that my husband 's son 's husband 's son 's dentist is helpful .	my teacher scares my husband 's son 's husband 's son 's dentist is helpful .
my friend thinks that your grandmother 's brother 's son 's sister 's brother is helpful .	my friend scares your grandmother 's brother 's son 's sister 's brother is helpful .
Jill thinks that my dad 's sister 's father 's teacher 's mother is strong .	Jill works with my dad 's sister 's father 's teacher 's mother is strong .
the dentist thinks that your mother 's grandmother 's dad 's boss 's boss is happy .	the dentist helps your mother 's grandmother 's dad 's boss 's boss is happy .
your teacher knows that your sister 's daughter 's sister 's sister 's daughter is surprised .	your teacher scares your sister 's daughter 's sister 's sister 's daughter is surprised .
Kristen says that your boss 's doctor 's teacher 's father 's doctor is helpful .	Kristen works with your boss 's doctor 's teacher 's father 's doctor is helpful .
Paul says that your doctor 's cousin 's boss 's daughter 's mom is boring .	Paul scares your doctor 's cousin 's boss 's daughter 's mom is boring .
my cousin thinks that my boss 's grandmother 's daughter 's wife 's dentist is strong .	my cousin talks to my boss 's grandmother 's daughter 's wife 's dentist is strong .
the adult knows that my daughter 's sister 's son 's brother 's teacher is careful .	the adult helps my daughter 's sister 's son 's brother 's teacher is careful .
my dentist thinks that your son 's friend 's son 's sister 's mom is strong .	my dentist talks to your son 's friend 's son 's sister 's mom is strong .
my boss says that your friend 's son 's boss 's doctor 's dentist is happy .	my boss works with your friend 's son 's boss 's doctor 's dentist is happy .
Martin knows that your daughter 's dentist 's cousin 's son 's grandmother is surprised .	Martin works with your daughter 's dentist 's cousin 's son 's grandmother is surprised .
my dentist knows that my cousin 's husband 's grandmother 's friend 's doctor is smart .	my dentist helps my cousin 's husband 's grandmother 's friend 's doctor is smart .
my friend knows that my sister 's boss 's brother 's mother 's son is healthy .	my friend helps my sister 's boss 's brother 's mother 's son is healthy .
my dentist knows that my sister 's friend 's dad 's mother 's dad is tall .	my dentist talks to my sister 's friend 's dad 's mother 's dad is tall .
my teacher thinks that your son 's brother 's wife 's sister 's teacher is healthy .	my teacher scares your son 's brother 's wife 's sister 's teacher is healthy .
your teacher thinks that your wife 's teacher 's dad 's husband 's dentist is smart .	your teacher scares your wife 's teacher 's dad 's husband 's dentist is smart .
your dentist knows that my doctor 's father 's cousin 's wife 's doctor is friendly .	your dentist talks to my doctor 's father 's cousin 's wife 's doctor is friendly .
the child says that your brother 's dentist 's mom 's cousin 's cousin is excited .	the child works with your brother 's dentist 's mom 's cousin 's cousin is excited .
your friend thinks that my husband 's boss 's mom 's husband 's husband is upset .	your friend helps my husband 's boss 's mom 's husband 's husband is upset .
the customer says that my teacher 's grandmother 's dentist 's father 's sister is friendly .	the customer scares my teacher 's grandmother 's dentist 's father 's sister is friendly .
the customer says that your brother 's sister 's dentist 's sister 's cousin is excited .	the customer scares your brother 's sister 's dentist 's sister 's cousin is excited .
Travis thinks that your teacher 's brother 's doctor 's teacher 's dad is careful .	Travis talks to your teacher 's brother 's doctor 's teacher 's dad is careful .
the adult thinks that your husband 's dentist 's doctor 's husband 's grandmother is young .	the adult talks to your husband 's dentist 's doctor 's husband 's grandmother is young .
Jerry says that your boss 's sister 's father 's dad 's teacher is young .	Jerry works with your boss 's sister 's father 's dad 's teacher is young .
Julie says that your son 's mother 's father 's brother 's sister is friendly .	Julie talks to your son 's mother 's father 's brother 's sister is friendly .
the child says that your cousin 's dentist 's daughter 's son 's son is quiet .	the child scares your cousin 's dentist 's daughter 's son 's son is quiet .
Tracy thinks that my friend 's brother 's mom 's cousin 's cousin is strong .	Tracy helps my friend 's brother 's mom 's cousin 's cousin is strong .
my teacher says that my friend 's grandmother 's mom 's dad 's mother is busy .	my teacher works with my friend 's grandmother 's mom 's dad 's mother is busy .
the customer thinks that my doctor 's mother 's grandmother 's husband 's mom is happy .	the customer talks to my doctor 's mother 's grandmother 's husband 's mom is happy .
the customer knows that your mom 's son 's dentist 's boss 's wife is upset .	the customer helps your mom 's son 's dentist 's boss 's wife is upset .
Jessica says that your cousin 's mom 's cousin 's doctor 's mom is wrong .	Jessica talks to your cousin 's mom 's cousin 's doctor 's mom is wrong .
your boss says that your teacher 's daughter 's grandmother 's dad 's dad is hungry .	your boss scares your teacher 's daughter 's grandmother 's dad 's dad is hungry .
your dentist thinks that my husband 's grandmother 's brother 's sister 's mom is quiet .	your dentist talks to my husband 's grandmother 's brother 's sister 's mom is quiet .
the doctor thinks that my father 's father 's wife 's dentist 's dad is hungry .	the doctor works with my father 's father 's wife 's dentist 's dad is hungry .
the doctor knows that your husband 's friend 's wife 's husband 's teacher is important .	the doctor scares your husband 's friend 's wife 's husband 's teacher is important .
George says that your wife 's mom 's doctor 's boss 's daughter is hungry .	George talks to your wife 's mom 's doctor 's boss 's daughter is hungry .
my cousin thinks that your husband 's sister 's doctor 's brother 's dad is young .	my cousin helps your husband 's sister 's doctor 's brother 's dad is young .
Amelia knows that your mother 's sister 's grandmother 's cousin 's mother is wrong .	Amelia works with your mother 's sister 's grandmother 's cousin 's mother is wrong .
my dentist knows that your dentist 's boss 's husband 's wife 's daughter is helpful .	my dentist scares your dentist 's boss 's husband 's wife 's daughter is helpful .
the teacher thinks that your grandmother 's dentist 's wife 's dentist 's son is upset .	the teacher talks to your grandmother 's dentist 's wife 's dentist 's son is upset .
your doctor knows that your cousin 's mom 's wife 's cousin 's doctor is surprised .	your doctor scares your cousin 's mom 's wife 's cousin 's doctor is surprised .
Karen knows that your dad 's wife 's dad 's father 's dentist is upset .	Karen scares your dad 's wife 's dad 's father 's dentist is upset .
Emily thinks that my mom 's sister 's doctor 's daughter 's wife is surprised .	Emily works with my mom 's sister 's doctor 's daughter 's wife is surprised .
your dentist says that my boss 's son 's friend 's mom 's daughter is careful .	your dentist works with my boss 's son 's friend 's mom 's daughter is careful .
my teacher says that my doctor 's friend 's doctor 's dad 's mom is sleepy .	my teacher helps my doctor 's friend 's doctor 's dad 's mom is sleepy .
my friend says that your son 's mom 's sister 's mother 's doctor is strong .	my friend helps your son 's mom 's sister 's mother 's doctor is strong .
Naomi knows that my boss 's husband 's dad 's wife 's sister is young .	Naomi works with my boss 's husband 's dad 's wife 's sister is young .
your boss thinks that your teacher 's friend 's daughter 's mom 's father is clever .	your boss scares your teacher 's friend 's daughter 's mom 's father is clever .
your dentist thinks that your brother 's father 's dad 's mom 's son is upset .	your dentist works with your brother 's father 's dad 's mom 's son is upset .
your doctor knows that my husband 's teacher 's brother 's doctor 's boss is gentle .	your doctor works with my husband 's teacher 's brother 's doctor 's boss is gentle .
your dentist says that my friend 's mother 's grandmother 's brother 's dad is hungry .	your dentist talks to my friend 's mother 's grandmother 's brother 's dad is hungry .
Brian thinks that my father 's doctor 's doctor 's boss 's father is smart .	Brian scares my father 's doctor 's doctor 's boss 's father is smart .
Jane thinks that my wife 's mom 's daughter 's son 's cousin is confused .	Jane talks to my wife 's mom 's daughter 's son 's cousin is confused .
Jessica thinks that my dentist 's grandmother 's husband 's dentist 's dentist is angry .	Jessica helps my dentist 's grandmother 's husband 's dentist 's dentist is angry .
Richard thinks that your daughter 's cousin 's son 's brother 's dentist is bored .	Richard scares your daughter 's cousin 's son 's brother 's dentist is bored .
Sandra says that my mom 's dentist 's husband 's father 's sister is helpful .	Sandra scares my mom 's dentist 's husband 's father 's sister is helpful .
the child says that your cousin 's brother 's mom 's grandmother 's doctor is kind .	the child talks to your cousin 's brother 's mom 's grandmother 's doctor is kind .
Michelle thinks that your cousin 's friend 's son 's son 's mother is confused .	Michelle scares your cousin 's friend 's son 's son 's mother is confused .
your boss thinks that your boss 's dentist 's grandmother 's dentist 's wife is curious .	your boss works with your boss 's dentist 's grandmother 's dentist 's wife is curious .
your cousin thinks that your son 's daughter 's mother 's teacher 's father is friendly .	your cousin helps your son 's daughter 's mother 's teacher 's father is friendly .
my cousin says that my daughter 's wife 's mom 's dad 's son is quiet .	my cousin helps my daughter 's wife 's mom 's dad 's son is quiet .
the adult knows that your father 's son 's teacher 's boss 's mom is helpful .	the adult talks to your father 's son 's teacher 's boss 's mom is helpful .
your dentist says that my friend 's sister 's wife 's mom 's dentist is sleepy .	your dentist works with my friend 's sister 's wife 's mom 's dentist is sleepy .
your friend says that your husband 's grandmother 's friend 's son 's son is young .	your friend scares your husband 's grandmother 's friend 's son 's son is young .
the adult knows that your boss 's boss 's cousin 's boss 's dad is important .	the adult scares your boss 's boss 's cousin 's boss 's dad is important .
the dancer says that your sister 's daughter 's wife 's boss 's sister is quiet .	the dancer talks to your sister 's daughter 's wife 's boss 's sister is quiet .
