the rug says that my wife 's father 's sister 's brother 's dad 's dad 's mom 's cousin 's sister 's dentist 's car is angry .	the rug works with my wife 's father 's sister 's brother 's dad 's dad 's mom 's cousin 's sister 's dentist 's car is angry .
the window knows that your mom 's teacher 's cousin 's husband 's doctor 's teacher 's boss 's boss 's boss 's father 's bowl is careful .	the window works with your mom 's teacher 's cousin 's husband 's doctor 's teacher 's boss 's boss 's boss 's father 's bowl is careful .
the truck knows that my doctor 's friend 's friend 's grandmother 's sister 's wife 's dentist 's mom 's son 's grandmother 's bed is excited .	the truck scares my doctor 's friend 's friend 's grandmother 's sister 's wife 's dentist 's mom 's son 's grandmother 's bed is excited .
the car says that my teacher 's brother 's friend 's dad 's doctor 's boss 's doctor 's dad 's cousin 's boss 's bag is friendly .	the car works with my teacher 's brother 's friend 's dad 's doctor 's boss 's doctor 's dad 's cousin 's boss 's bag is friendly .
the plate says that my son 's husband 's brother 's friend 's mother 's wife 's son 's doctor 's cousin 's father 's picture is young .	the plate works with my son 's husband 's brother 's friend 's mother 's wife 's son 's doctor 's cousin 's father 's picture is young .
the bag knows that my friend 's sister 's husband 's dentist 's father 's wife 's grandmother 's boss 's dentist 's brother 's car is friendly .	the bag helps my friend 's sister 's husband 's dentist 's father 's wife 's grandmother 's boss 's dentist 's brother 's car is friendly .
the glass says that your son 's sister 's boss 's son 's father 's doctor 's teacher 's sister 's grandmother 's teacher 's picture is healthy .	the glass scares your son 's sister 's boss 's son 's father 's doctor 's teacher 's sister 's grandmother 's teacher 's picture is healthy .
the couch says that my father 's father 's sister 's husband 's brother 's friend 's doctor 's teacher 's wife 's dentist 's bottle is healthy .	the couch talks to my father 's father 's sister 's husband 's brother 's friend 's doctor 's teacher 's wife 's dentist 's bottle is healthy .
the cup thinks that your teacher 's mom 's son 's boss 's daughter 's brother 's daughter 's son 's cousin 's wife 's plate is surprised .	the cup helps your teacher 's mom 's son 's boss 's daughter 's brother 's daughter 's son 's cousin 's wife 's plate is surprised .
the truck says that your dad 's dad 's father 's father 's husband 's mom 's husband 's dentist 's brother 's wife 's chair is kind .	the truck helps your dad 's dad 's father 's father 's husband 's mom 's husband 's dentist 's brother 's wife 's chair is kind .
the shoe says that my brother 's cousin 's boss 's friend 's mom 's mom 's brother 's sister 's husband 's sister 's glass is strong .	the shoe scares my brother 's cousin 's boss 's friend 's mom 's mom 's brother 's sister 's husband 's sister 's glass is strong .
the ring thinks that my husband 's father 's son 's teacher 's boss 's friend 's son 's boss 's son 's son 's boat is helpful .	the ring works with my husband 's father 's son 's teacher 's boss 's friend 's son 's boss 's son 's son 's boat is helpful .
the rug knows that your cousin 's mom 's son 's wife 's doctor 's friend 's mother 's wife 's cousin 's cousin 's car is strong .	the rug works with your cousin 's mom 's son 's wife 's doctor 's friend 's mother 's wife 's cousin 's cousin 's car is strong .
the spoon says that my friend 's teacher 's dad 's teacher 's daughter 's husband 's mom 's brother 's father 's mom 's doll is strong .	the spoon scares my friend 's teacher 's dad 's teacher 's daughter 's husband 's mom 's brother 's father 's mom 's doll is strong .
the picture says that your sister 's mom 's brother 's dad 's friend 's mother 's dad 's son 's wife 's grandmother 's window is tall .	the picture works with your sister 's mom 's brother 's dad 's friend 's mother 's dad 's son 's wife 's grandmother 's window is tall .
the hat thinks that my husband 's teacher 's doctor 's cousin 's cousin 's wife 's grandmother 's mother 's cousin 's wife 's plane is tall .	the hat talks to my husband 's teacher 's doctor 's cousin 's cousin 's wife 's grandmother 's mother 's cousin 's wife 's plane is tall .
the window thinks that my teacher 's mother 's cousin 's sister 's mom 's husband 's brother 's father 's mother 's cousin 's window is smart .	the window works with my teacher 's mother 's cousin 's sister 's mom 's husband 's brother 's father 's mother 's cousin 's window is smart .
the fork says that my son 's father 's doctor 's boss 's husband 's daughter 's son 's son 's friend 's friend 's shirt is friendly .	the fork works with my son 's father 's doctor 's boss 's husband 's daughter 's son 's son 's friend 's friend 's shirt is friendly .
the bed says that my teacher 's friend 's boss 's sister 's cousin 's mother 's sister 's doctor 's brother 's doctor 's bowl is lucky .	the bed scares my teacher 's friend 's boss 's sister 's cousin 's mother 's sister 's doctor 's brother 's doctor 's bowl is lucky .
the bicycle says that my friend 's dentist 's grandmother 's boss 's dentist 's husband 's son 's brother 's friend 's friend 's crayon is bored .	the bicycle talks to my friend 's dentist 's grandmother 's boss 's dentist 's husband 's son 's brother 's friend 's friend 's crayon is bored .
the shirt thinks that your wife 's sister 's teacher 's daughter 's dentist 's friend 's teacher 's husband 's father 's mother 's dish is upset .	the shirt talks to your wife 's sister 's teacher 's daughter 's dentist 's friend 's teacher 's husband 's father 's mother 's dish is upset .
the bed knows that your brother 's friend 's sister 's wife 's mother 's grandmother 's mother 's wife 's teacher 's father 's couch is young .	the bed works with your brother 's friend 's sister 's wife 's mother 's grandmother 's mother 's wife 's teacher 's father 's couch is young .
the bottle says that my brother 's friend 's dad 's doctor 's grandmother 's dentist 's cousin 's brother 's grandmother 's wife 's doll is surprised .	the bottle helps my brother 's friend 's dad 's doctor 's grandmother 's dentist 's cousin 's brother 's grandmother 's wife 's doll is surprised .
the mirror knows that my friend 's father 's wife 's father 's teacher 's teacher 's cousin 's dentist 's dentist 's mother 's doll is curious .	the mirror talks to my friend 's father 's wife 's father 's teacher 's teacher 's cousin 's dentist 's dentist 's mother 's doll is curious .
the spoon says that your dentist 's son 's sister 's brother 's mother 's wife 's sister 's sister 's sister 's son 's window is happy .	the spoon helps your dentist 's son 's sister 's brother 's mother 's wife 's sister 's sister 's sister 's son 's window is happy .
the candle knows that your brother 's brother 's mother 's wife 's boss 's brother 's brother 's son 's brother 's friend 's boat is friendly .	the candle scares your brother 's brother 's mother 's wife 's boss 's brother 's brother 's son 's brother 's friend 's boat is friendly .
the box thinks that your husband 's dad 's mother 's wife 's daughter 's dad 's mom 's grandmother 's mom 's cousin 's mirror is young .	the box works with your husband 's dad 's mother 's wife 's daughter 's dad 's mom 's grandmother 's mom 's cousin 's mirror is young .
the chair says that my teacher 's boss 's cousin 's mother 's son 's daughter 's friend 's grandmother 's daughter 's husband 's cup is nice .	the chair scares my teacher 's boss 's cousin 's mother 's son 's daughter 's friend 's grandmother 's daughter 's husband 's cup is nice .
the book thinks that your boss 's friend 's boss 's mom 's boss 's son 's daughter 's teacher 's teacher 's daughter 's button is hungry .	the book scares your boss 's friend 's boss 's mom 's boss 's son 's daughter 's teacher 's teacher 's daughter 's button is hungry .
the rug knows that your mother 's mom 's dad 's son 's brother 's father 's cousin 's mother 's sister 's mother 's hat is bored .	the rug helps your mother 's mom 's dad 's son 's brother 's father 's cousin 's mother 's sister 's mother 's hat is bored .
the glass says that your wife 's husband 's mother 's teacher 's cousin 's dentist 's doctor 's dad 's father 's son 's boat is curious .	the glass helps your wife 's husband 's mother 's teacher 's cousin 's dentist 's doctor 's dad 's father 's son 's boat is curious .
the box says that my son 's wife 's son 's father 's son 's dad 's doctor 's mom 's boss 's husband 's bowl is tired .	the box scares my son 's wife 's son 's father 's son 's dad 's doctor 's mom 's boss 's husband 's bowl is tired .
the bed says that your son 's husband 's boss 's mother 's doctor 's cousin 's wife 's wife 's sister 's doctor 's bed is healthy .	the bed helps your son 's husband 's boss 's mother 's doctor 's cousin 's wife 's wife 's sister 's doctor 's bed is healthy .
the plate says that my daughter 's mom 's teacher 's dad 's grandmother 's dad 's mother 's boss 's sister 's daughter 's glass is young .	the plate works with my daughter 's mom 's teacher 's dad 's grandmother 's dad 's mother 's boss 's sister 's daughter 's glass is young .
the box knows that my grandmother 's doctor 's husband 's doctor 's grandmother 's brother 's wife 's father 's boss 's boss 's mirror is gentle .	the box helps my grandmother 's doctor 's husband 's doctor 's grandmother 's brother 's wife 's father 's boss 's boss 's mirror is gentle .
the book thinks that your husband 's grandmother 's wife 's cousin 's wife 's grandmother 's dad 's father 's doctor 's grandmother 's rug is tall .	the book talks to your husband 's grandmother 's wife 's cousin 's wife 's grandmother 's dad 's father 's doctor 's grandmother 's rug is tall .
the bowl says that my brother 's father 's teacher 's grandmother 's father 's brother 's friend 's wife 's daughter 's dad 's bed is gentle .	the bowl works with my brother 's father 's teacher 's grandmother 's father 's brother 's friend 's wife 's daughter 's dad 's bed is gentle .
the doll thinks that your boss 's mom 's doctor 's boss 's grandmother 's daughter 's mom 's grandmother 's cousin 's mother 's ship is healthy .	the doll talks to your boss 's mom 's doctor 's boss 's grandmother 's daughter 's mom 's grandmother 's cousin 's mother 's ship is healthy .
the cup knows that your mom 's husband 's doctor 's mother 's grandmother 's grandmother 's mother 's grandmother 's wife 's mom 's rug is nice .	the cup helps your mom 's husband 's doctor 's mother 's grandmother 's grandmother 's mother 's grandmother 's wife 's mom 's rug is nice .
the button says that my wife 's sister 's grandmother 's son 's grandmother 's boss 's sister 's son 's sister 's husband 's doll is healthy .	the button scares my wife 's sister 's grandmother 's son 's grandmother 's boss 's sister 's son 's sister 's husband 's doll is healthy .
the box says that your mom 's sister 's sister 's cousin 's son 's brother 's cousin 's doctor 's teacher 's dad 's bowl is quiet .	the box talks to your mom 's sister 's sister 's cousin 's son 's brother 's cousin 's doctor 's teacher 's dad 's bowl is quiet .
the plane thinks that my father 's teacher 's dad 's wife 's cousin 's wife 's grandmother 's son 's daughter 's doctor 's window is excited .	the plane talks to my father 's teacher 's dad 's wife 's cousin 's wife 's grandmother 's son 's daughter 's doctor 's window is excited .
the candle thinks that my dentist 's grandmother 's daughter 's doctor 's brother 's brother 's mom 's friend 's cousin 's father 's bottle is upset .	the candle talks to my dentist 's grandmother 's daughter 's doctor 's brother 's brother 's mom 's friend 's cousin 's father 's bottle is upset .
the car thinks that my teacher 's sister 's mother 's teacher 's friend 's dentist 's friend 's mom 's teacher 's mom 's rocket is happy .	the car helps my teacher 's sister 's mother 's teacher 's friend 's dentist 's friend 's mom 's teacher 's mom 's rocket is happy .
the shoe thinks that my boss 's wife 's dentist 's brother 's daughter 's mother 's friend 's wife 's mother 's cousin 's rug is young .	the shoe helps my boss 's wife 's dentist 's brother 's daughter 's mother 's friend 's wife 's mother 's cousin 's rug is young .
the fork thinks that my teacher 's mom 's friend 's cousin 's brother 's daughter 's doctor 's dad 's husband 's dad 's crayon is curious .	the fork works with my teacher 's mom 's friend 's cousin 's brother 's daughter 's doctor 's dad 's husband 's dad 's crayon is curious .
the shoe says that my cousin 's father 's father 's husband 's dentist 's sister 's grandmother 's mother 's dad 's mom 's window is strong .	the shoe scares my cousin 's father 's father 's husband 's dentist 's sister 's grandmother 's mother 's dad 's mom 's window is strong .
the rug thinks that your boss 's father 's mom 's brother 's grandmother 's son 's cousin 's mom 's doctor 's husband 's bed is excited .	the rug works with your boss 's father 's mom 's brother 's grandmother 's son 's cousin 's mom 's doctor 's husband 's bed is excited .
the bed says that your husband 's cousin 's wife 's friend 's daughter 's daughter 's husband 's wife 's wife 's dentist 's candle is hungry .	the bed works with your husband 's cousin 's wife 's friend 's daughter 's daughter 's husband 's wife 's wife 's dentist 's candle is hungry .
the shoe thinks that your daughter 's father 's friend 's sister 's dad 's boss 's grandmother 's daughter 's doctor 's sister 's bed is confused .	the shoe helps your daughter 's father 's friend 's sister 's dad 's boss 's grandmother 's daughter 's doctor 's sister 's bed is confused .
the couch thinks that your brother 's dentist 's sister 's wife 's boss 's friend 's cousin 's son 's doctor 's dad 's spoon is tired .	the couch talks to your brother 's dentist 's sister 's wife 's boss 's friend 's cousin 's son 's doctor 's dad 's spoon is tired .
the mirror knows that my grandmother 's sister 's cousin 's son 's friend 's son 's daughter 's sister 's boss 's dentist 's truck is quiet .	the mirror talks to my grandmother 's sister 's cousin 's son 's friend 's son 's daughter 's sister 's boss 's dentist 's truck is quiet .
the bed thinks that your brother 's cousin 's cousin 's mom 's friend 's daughter 's son 's sister 's doctor 's grandmother 's spoon is happy .	the bed talks to your brother 's cousin 's cousin 's mom 's friend 's daughter 's son 's sister 's doctor 's grandmother 's spoon is happy .
the plane knows that my dentist 's daughter 's mother 's mom 's mother 's friend 's daughter 's wife 's cousin 's husband 's ship is quiet .	the plane works with my dentist 's daughter 's mother 's mom 's mother 's friend 's daughter 's wife 's cousin 's husband 's ship is quiet .
the doll thinks that my mother 's brother 's teacher 's teacher 's brother 's husband 's son 's cousin 's grandmother 's mom 's couch is important .	the doll talks to my mother 's brother 's teacher 's teacher 's brother 's husband 's son 's cousin 's grandmother 's mom 's couch is important .
the book says that my cousin 's husband 's son 's brother 's wife 's teacher 's brother 's daughter 's father 's mother 's bag is happy .	the book helps my cousin 's husband 's son 's brother 's wife 's teacher 's brother 's daughter 's father 's mother 's bag is happy .
the bag thinks that your sister 's boss 's dad 's dentist 's husband 's doctor 's father 's son 's daughter 's boss 's book is lucky .	the bag works with your sister 's boss 's dad 's dentist 's husband 's doctor 's father 's son 's daughter 's boss 's book is lucky .
the button knows that your father 's son 's cousin 's brother 's brother 's father 's father 's cousin 's doctor 's son 's fork is strong .	the button talks to your father 's son 's cousin 's brother 's brother 's father 's father 's cousin 's doctor 's son 's fork is strong .
the button says that your daughter 's sister 's son 's grandmother 's mom 's son 's mom 's father 's son 's friend 's toy is confused .	the button helps your daughter 's sister 's son 's grandmother 's mom 's son 's mom 's father 's son 's friend 's toy is confused .
the hat thinks that your teacher 's friend 's doctor 's wife 's dentist 's teacher 's mom 's teacher 's grandmother 's son 's bicycle is hungry .	the hat helps your teacher 's friend 's doctor 's wife 's dentist 's teacher 's mom 's teacher 's grandmother 's son 's bicycle is hungry .
the rocket says that your teacher 's dentist 's mom 's dad 's doctor 's husband 's sister 's sister 's cousin 's boss 's shirt is curious .	the rocket works with your teacher 's dentist 's mom 's dad 's doctor 's husband 's sister 's sister 's cousin 's boss 's shirt is curious .
the spoon knows that my son 's doctor 's mom 's wife 's teacher 's mom 's mother 's dad 's son 's friend 's window is tall .	the spoon helps my son 's doctor 's mom 's wife 's teacher 's mom 's mother 's dad 's son 's friend 's window is tall .
the hat knows that your dentist 's sister 's father 's son 's son 's doctor 's son 's boss 's dentist 's father 's window is tired .	the hat scares your dentist 's sister 's father 's son 's son 's doctor 's son 's boss 's dentist 's father 's window is tired .
the fork knows that your dad 's mother 's father 's daughter 's grandmother 's mom 's mother 's mom 's doctor 's grandmother 's dish is confused .	the fork helps your dad 's mother 's father 's daughter 's grandmother 's mom 's mother 's mom 's doctor 's grandmother 's dish is confused .
the window thinks that your cousin 's mother 's wife 's daughter 's brother 's sister 's wife 's son 's doctor 's teacher 's rocket is clever .	the window works with your cousin 's mother 's wife 's daughter 's brother 's sister 's wife 's son 's doctor 's teacher 's rocket is clever .
the dish knows that my doctor 's cousin 's grandmother 's brother 's mom 's dad 's mother 's son 's brother 's cousin 's book is surprised .	the dish talks to my doctor 's cousin 's grandmother 's brother 's mom 's dad 's mother 's son 's brother 's cousin 's book is surprised .
the shirt says that my husband 's friend 's brother 's daughter 's sister 's friend 's sister 's dad 's doctor 's sister 's ship is angry .	the shirt talks to my husband 's friend 's brother 's daughter 's sister 's friend 's sister 's dad 's doctor 's sister 's ship is angry .
the book thinks that your doctor 's brother 's sister 's teacher 's wife 's teacher 's teacher 's friend 's cousin 's dad 's mirror is lucky .	the book scares your doctor 's brother 's sister 's teacher 's wife 's teacher 's teacher 's friend 's cousin 's dad 's mirror is lucky .
the book thinks that your teacher 's friend 's mother 's dentist 's sister 's father 's daughter 's daughter 's grandmother 's dad 's chair is surprised .	the book works with your teacher 's friend 's mother 's dentist 's sister 's father 's daughter 's daughter 's grandmother 's dad 's chair is surprised .
the button thinks that my son 's grandmother 's cousin 's cousin 's doctor 's boss 's sister 's sister 's boss 's mom 's doll is kind .	the button talks to my son 's grandmother 's cousin 's cousin 's doctor 's boss 's sister 's sister 's boss 's mom 's doll is kind .
the bag knows that my father 's daughter 's grandmother 's sister 's daughter 's son 's wife 's friend 's sister 's sister 's book is tired .	the bag works with my father 's daughter 's grandmother 's sister 's daughter 's son 's wife 's friend 's sister 's sister 's book is tired .
the toy says that my sister 's friend 's daughter 's sister 's friend 's teacher 's mother 's daughter 's father 's husband 's chair is smart .	the toy works with my sister 's friend 's daughter 's sister 's friend 's teacher 's mother 's daughter 's father 's husband 's chair is smart .
the window thinks that your teacher 's cousin 's wife 's boss 's daughter 's dad 's teacher 's mother 's doctor 's doctor 's toy is helpful .	the window scares your teacher 's cousin 's wife 's boss 's daughter 's dad 's teacher 's mother 's doctor 's doctor 's toy is helpful .
the bowl knows that your brother 's friend 's wife 's wife 's father 's friend 's son 's mom 's mom 's doctor 's truck is hungry .	the bowl scares your brother 's friend 's wife 's wife 's father 's friend 's son 's mom 's mom 's doctor 's truck is hungry .
the picture says that my friend 's husband 's cousin 's daughter 's doctor 's brother 's doctor 's mom 's friend 's father 's button is important .	the picture works with my friend 's husband 's cousin 's daughter 's doctor 's brother 's doctor 's mom 's friend 's father 's button is important .
the truck thinks that my dad 's friend 's sister 's father 's wife 's daughter 's cousin 's mom 's grandmother 's mother 's shoe is surprised .	the truck talks to my dad 's friend 's sister 's father 's wife 's daughter 's cousin 's mom 's grandmother 's mother 's shoe is surprised .
the couch says that my doctor 's son 's cousin 's dentist 's dad 's daughter 's dentist 's friend 's doctor 's brother 's chair is wrong .	the couch helps my doctor 's son 's cousin 's dentist 's dad 's daughter 's dentist 's friend 's doctor 's brother 's chair is wrong .
the door says that my friend 's sister 's dentist 's son 's teacher 's dad 's mother 's mother 's teacher 's friend 's ship is bored .	the door helps my friend 's sister 's dentist 's son 's teacher 's dad 's mother 's mother 's teacher 's friend 's ship is bored .
the candle says that my mother 's grandmother 's daughter 's sister 's dad 's teacher 's daughter 's mom 's sister 's wife 's mirror is hungry .	the candle scares my mother 's grandmother 's daughter 's sister 's dad 's teacher 's daughter 's mom 's sister 's wife 's mirror is hungry .
the plane knows that your dentist 's grandmother 's daughter 's mother 's grandmother 's husband 's cousin 's daughter 's grandmother 's teacher 's spoon is young .	the plane helps your dentist 's grandmother 's daughter 's mother 's grandmother 's husband 's cousin 's daughter 's grandmother 's teacher 's spoon is young .
the chair knows that your sister 's grandmother 's father 's teacher 's daughter 's friend 's teacher 's brother 's sister 's son 's car is angry .	the chair works with your sister 's grandmother 's father 's teacher 's daughter 's friend 's teacher 's brother 's sister 's son 's car is angry .
the car thinks that your son 's cousin 's boss 's brother 's teacher 's husband 's grandmother 's doctor 's sister 's teacher 's candle is busy .	the car scares your son 's cousin 's boss 's brother 's teacher 's husband 's grandmother 's doctor 's sister 's teacher 's candle is busy .
the hat knows that my father 's doctor 's boss 's dentist 's wife 's wife 's cousin 's brother 's friend 's teacher 's cup is tall .	the hat works with my father 's doctor 's boss 's dentist 's wife 's wife 's cousin 's brother 's friend 's teacher 's cup is tall .
the candle thinks that my cousin 's daughter 's daughter 's friend 's daughter 's wife 's husband 's husband 's son 's daughter 's bottle is healthy .	the candle talks to my cousin 's daughter 's daughter 's friend 's daughter 's wife 's husband 's husband 's son 's daughter 's bottle is healthy .
the toy knows that your mom 's mother 's grandmother 's sister 's teacher 's mother 's mom 's brother 's mom 's mother 's car is friendly .	the toy works with your mom 's mother 's grandmother 's sister 's teacher 's mother 's mom 's brother 's mom 's mother 's car is friendly .
the plate knows that my dad 's teacher 's grandmother 's daughter 's friend 's doctor 's cousin 's boss 's friend 's son 's rug is important .	the plate talks to my dad 's teacher 's grandmother 's daughter 's friend 's doctor 's cousin 's boss 's friend 's son 's rug is important .
the shoe knows that your friend 's husband 's brother 's dentist 's wife 's dad 's wife 's teacher 's son 's teacher 's hat is busy .	the shoe works with your friend 's husband 's brother 's dentist 's wife 's dad 's wife 's teacher 's son 's teacher 's hat is busy .
the toy knows that my mom 's father 's husband 's dad 's father 's son 's father 's friend 's mother 's son 's bottle is careful .	the toy scares my mom 's father 's husband 's dad 's father 's son 's father 's friend 's mother 's son 's bottle is careful .
the hat knows that your husband 's grandmother 's boss 's dad 's father 's friend 's boss 's sister 's wife 's doctor 's window is surprised .	the hat talks to your husband 's grandmother 's boss 's dad 's father 's friend 's boss 's sister 's wife 's doctor 's window is surprised .
the bottle knows that my friend 's boss 's wife 's friend 's dad 's doctor 's teacher 's doctor 's father 's dentist 's candle is bored .	the bottle helps my friend 's boss 's wife 's friend 's dad 's doctor 's teacher 's doctor 's father 's dentist 's candle is bored .
the book knows that my teacher 's mother 's wife 's husband 's boss 's wife 's grandmother 's mom 's teacher 's cousin 's fork is curious .	the book scares my teacher 's mother 's wife 's husband 's boss 's wife 's grandmother 's mom 's teacher 's cousin 's fork is curious .
the ship thinks that my dentist 's teacher 's brother 's dad 's doctor 's dentist 's friend 's friend 's husband 's mother 's dish is curious .	the ship talks to my dentist 's teacher 's brother 's dad 's doctor 's dentist 's friend 's friend 's husband 's mother 's dish is curious .
the cup thinks that my brother 's cousin 's mother 's mother 's son 's husband 's cousin 's wife 's mother 's dentist 's mirror is wrong .	the cup works with my brother 's cousin 's mother 's mother 's son 's husband 's cousin 's wife 's mother 's dentist 's mirror is wrong .
