the picture says that your mom 's friend 's son 's grandmother 's daughter 's brother 's doctor 's car is confused .	the picture scares your mom 's friend 's son 's grandmother 's daughter 's brother 's doctor 's car is confused .
the boat thinks that my boss 's doctor 's wife 's grandmother 's brother 's daughter 's grandmother 's shoe is friendly .	the boat helps my boss 's doctor 's wife 's grandmother 's brother 's daughter 's grandmother 's shoe is friendly .
the mirror knows that your dad 's dentist 's cousin 's cousin 's father 's father 's grandmother 's box is bored .	the mirror works with your dad 's dentist 's cousin 's cousin 's father 's father 's grandmother 's box is bored .
the window thinks that your mother 's daughter 's doctor 's daughter 's doctor 's husband 's doctor 's truck is bored .	the window talks to your mother 's daughter 's doctor 's daughter 's doctor 's husband 's doctor 's truck is bored .
the chair says that your mom 's teacher 's teacher 's mom 's son 's father 's teacher 's book is bored .	the chair helps your mom 's teacher 's teacher 's mom 's son 's father 's teacher 's book is bored .
the toy knows that my grandmother 's dad 's mother 's doctor 's boss 's dad 's son 's cup is upset .	the toy talks to my grandmother 's dad 's mother 's doctor 's boss 's dad 's son 's cup is upset .
the cup says that your boss 's father 's dentist 's husband 's dentist 's son 's wife 's ship is confused .	the cup talks to your boss 's father 's dentist 's husband 's dentist 's son 's wife 's ship is confused .
the dish thinks that your father 's wife 's teacher 's dentist 's mom 's mother 's friend 's chair is boring .	the dish helps your father 's wife 's teacher 's dentist 's mom 's mother 's friend 's chair is boring .
the book says that my boss 's grandmother 's father 's friend 's son 's friend 's brother 's bag is sleepy .	the book works with my boss 's grandmother 's father 's friend 's son 's friend 's brother 's bag is sleepy .
the bed knows that your cousin 's sister 's friend 's daughter 's cousin 's mom 's sister 's picture is hungry .	the bed helps your cousin 's sister 's friend 's daughter 's cousin 's mom 's sister 's picture is hungry .
the ring knows that my teacher 's wife 's boss 's brother 's brother 's friend 's boss 's toy is strong .	the ring talks to my teacher 's wife 's boss 's brother 's brother 's friend 's boss 's toy is strong .
the couch thinks that my sister 's dad 's brother 's doctor 's doctor 's mother 's teacher 's rug is happy .	the couch scares my sister 's dad 's brother 's doctor 's doctor 's mother 's teacher 's rug is happy .
the button says that my teacher 's mom 's doctor 's doctor 's mom 's sister 's wife 's window is friendly .	the button helps my teacher 's mom 's doctor 's doctor 's mom 's sister 's wife 's window is friendly .
the door knows that my husband 's mom 's cousin 's dad 's husband 's father 's cousin 's doll is curious .	the door talks to my husband 's mom 's cousin 's dad 's husband 's father 's cousin 's doll is curious .
the car thinks that my grandmother 's son 's sister 's mother 's daughter 's daughter 's cousin 's rug is young .	the car works with my grandmother 's son 's sister 's mother 's daughter 's daughter 's cousin 's rug is young .
the button says that your sister 's cousin 's son 's grandmother 's grandmother 's father 's dentist 's spoon is boring .	the button helps your sister 's cousin 's son 's grandmother 's grandmother 's father 's dentist 's spoon is boring .
the spoon says that my boss 's daughter 's boss 's husband 's wife 's sister 's grandmother 's car is boring .	the spoon scares my boss 's daughter 's boss 's husband 's wife 's sister 's grandmother 's car is boring .
the book knows that my daughter 's daughter 's daughter 's brother 's brother 's grandmother 's dad 's book is careful .	the book scares my daughter 's daughter 's daughter 's brother 's brother 's grandmother 's dad 's book is careful .
the window thinks that your boss 's mother 's mom 's teacher 's dad 's doctor 's friend 's bottle is lucky .	the window scares your boss 's mother 's mom 's teacher 's dad 's doctor 's friend 's bottle is lucky .
the crayon says that my wife 's brother 's mother 's mother 's mother 's husband 's dad 's door is strong .	the crayon talks to my wife 's brother 's mother 's mother 's mother 's husband 's dad 's door is strong .
the dish knows that my brother 's mother 's wife 's father 's brother 's husband 's wife 's cup is hungry .	the dish helps my brother 's mother 's wife 's father 's brother 's husband 's wife 's cup is hungry .
the chair says that my brother 's daughter 's friend 's sister 's grandmother 's son 's mother 's ship is strong .	the chair talks to my brother 's daughter 's friend 's sister 's grandmother 's son 's mother 's ship is strong .
the toy says that my teacher 's teacher 's daughter 's brother 's grandmother 's sister 's cousin 's spoon is excited .	the toy helps my teacher 's teacher 's daughter 's brother 's grandmother 's sister 's cousin 's spoon is excited .
the book says that my cousin 's mom 's friend 's boss 's mom 's mom 's cousin 's car is tall .	the book helps my cousin 's mom 's friend 's boss 's mom 's mom 's cousin 's car is tall .
the bed knows that your dentist 's mother 's doctor 's wife 's brother 's mom 's husband 's candle is sleepy .	the bed talks to your dentist 's mother 's doctor 's wife 's brother 's mom 's husband 's candle is sleepy .
the button says that my son 's teacher 's dentist 's boss 's grandmother 's teacher 's sister 's cup is hungry .	the button scares my son 's teacher 's dentist 's boss 's grandmother 's teacher 's sister 's cup is hungry .
the bottle knows that my brother 's grandmother 's daughter 's teacher 's son 's cousin 's mom 's button is tall .	the bottle talks to my brother 's grandmother 's daughter 's teacher 's son 's cousin 's mom 's button is tall .
the ship says that my sister 's dad 's father 's cousin 's doctor 's boss 's teacher 's glass is angry .	the ship helps my sister 's dad 's father 's cousin 's doctor 's boss 's teacher 's glass is angry .
the bowl says that my dentist 's friend 's sister 's teacher 's dad 's husband 's wife 's window is helpful .	the bowl works with my dentist 's friend 's sister 's teacher 's dad 's husband 's wife 's window is helpful .
the hat says that your father 's father 's mom 's doctor 's husband 's teacher 's brother 's crayon is friendly .	the hat works with your father 's father 's mom 's doctor 's husband 's teacher 's brother 's crayon is friendly .
the rocket says that my grandmother 's teacher 's teacher 's grandmother 's friend 's son 's teacher 's cup is happy .	the rocket helps my grandmother 's teacher 's teacher 's grandmother 's friend 's son 's teacher 's cup is happy .
the hat thinks that your wife 's boss 's father 's son 's mother 's sister 's daughter 's bowl is bored .	the hat scares your wife 's boss 's father 's son 's mother 's sister 's daughter 's bowl is bored .
the box knows that my mother 's dad 's mother 's daughter 's dad 's dad 's husband 's cup is strong .	the box works with my mother 's dad 's mother 's daughter 's dad 's dad 's husband 's cup is strong .
the box says that your mother 's mom 's mom 's husband 's friend 's teacher 's husband 's candle is happy .	the box scares your mother 's mom 's mom 's husband 's friend 's teacher 's husband 's candle is happy .
the bed says that my cousin 's teacher 's friend 's husband 's mother 's sister 's grandmother 's cup is happy .	the bed scares my cousin 's teacher 's friend 's husband 's mother 's sister 's grandmother 's cup is happy .
the doll says that my cousin 's mom 's sister 's teacher 's husband 's mom 's wife 's bicycle is strong .	the doll scares my cousin 's mom 's sister 's teacher 's husband 's mom 's wife 's bicycle is strong .
the car knows that your doctor 's father 's friend 's doctor 's father 's son 's dentist 's bed is quiet .	the car talks to your doctor 's father 's friend 's doctor 's father 's son 's dentist 's bed is quiet .
the plane thinks that my friend 's father 's mother 's teacher 's son 's mother 's friend 's spoon is important .	the plane works with my friend 's father 's mother 's teacher 's son 's mother 's friend 's spoon is important .
the ship thinks that my doctor 's mom 's brother 's son 's husband 's daughter 's sister 's book is wrong .	the ship talks to my doctor 's mom 's brother 's son 's husband 's daughter 's sister 's book is wrong .
the fork thinks that your doctor 's cousin 's doctor 's boss 's doctor 's father 's daughter 's car is boring .	the fork works with your doctor 's cousin 's doctor 's boss 's doctor 's father 's daughter 's car is boring .
the boat knows that my daughter 's daughter 's mom 's dad 's sister 's daughter 's wife 's shoe is sleepy .	the boat works with my daughter 's daughter 's mom 's dad 's sister 's daughter 's wife 's shoe is sleepy .
the bag says that your dad 's father 's husband 's mom 's brother 's brother 's dad 's shoe is quiet .	the bag scares your dad 's father 's husband 's mom 's brother 's brother 's dad 's shoe is quiet .
the bag thinks that my husband 's boss 's doctor 's husband 's boss 's wife 's teacher 's toy is young .	the bag scares my husband 's boss 's doctor 's husband 's boss 's wife 's teacher 's toy is young .
the spoon knows that your daughter 's grandmother 's doctor 's daughter 's cousin 's brother 's dentist 's ring is tall .	the spoon talks to your daughter 's grandmother 's doctor 's daughter 's cousin 's brother 's dentist 's ring is tall .
the crayon thinks that my sister 's brother 's cousin 's cousin 's mother 's cousin 's father 's couch is tall .	the crayon works with my sister 's brother 's cousin 's cousin 's mother 's cousin 's father 's couch is tall .
the chair says that my son 's mom 's husband 's mom 's friend 's doctor 's mother 's boat is careful .	the chair helps my son 's mom 's husband 's mom 's friend 's doctor 's mother 's boat is careful .
the door knows that my brother 's friend 's doctor 's friend 's dentist 's husband 's brother 's book is friendly .	the door talks to my brother 's friend 's doctor 's friend 's dentist 's husband 's brother 's book is friendly .
the shoe knows that my mom 's wife 's wife 's dentist 's teacher 's grandmother 's doctor 's plane is tired .	the shoe works with my mom 's wife 's wife 's dentist 's teacher 's grandmother 's doctor 's plane is tired .
the fork knows that my son 's dentist 's son 's daughter 's grandmother 's brother 's friend 's mirror is smart .	the fork talks to my son 's dentist 's son 's daughter 's grandmother 's brother 's friend 's mirror is smart .
the dish thinks that my boss 's sister 's sister 's mother 's teacher 's brother 's boss 's cup is angry .	the dish helps my boss 's sister 's sister 's mother 's teacher 's brother 's boss 's cup is angry .
the ring knows that my friend 's father 's father 's daughter 's dad 's teacher 's mother 's cup is bored .	the ring helps my friend 's father 's father 's daughter 's dad 's teacher 's mother 's cup is bored .
the boat says that my husband 's husband 's sister 's mother 's dad 's teacher 's dentist 's button is helpful .	the boat scares my husband 's husband 's sister 's mother 's dad 's teacher 's dentist 's button is helpful .
the truck thinks that your sister 's son 's wife 's friend 's cousin 's boss 's grandmother 's candle is strong .	the truck works with your sister 's son 's wife 's friend 's cousin 's boss 's grandmother 's candle is strong .
the bicycle thinks that your teacher 's dad 's grandmother 's husband 's friend 's wife 's friend 's chair is careful .	the bicycle helps your teacher 's dad 's grandmother 's husband 's friend 's wife 's friend 's chair is careful .
the crayon knows that my friend 's dad 's daughter 's mom 's mother 's father 's brother 's chair is nice .	the crayon helps my friend 's dad 's daughter 's mom 's mother 's father 's brother 's chair is nice .
the bed says that your grandmother 's husband 's teacher 's wife 's cousin 's teacher 's boss 's dish is careful .	the bed scares your grandmother 's husband 's teacher 's wife 's cousin 's teacher 's boss 's dish is careful .
the plane says that my brother 's daughter 's dad 's dad 's dad 's doctor 's mom 's glass is excited .	the plane works with my brother 's daughter 's dad 's dad 's dad 's doctor 's mom 's glass is excited .
the couch says that your mom 's dentist 's teacher 's cousin 's father 's father 's wife 's dish is bored .	the couch scares your mom 's dentist 's teacher 's cousin 's father 's father 's wife 's dish is bored .
the bottle knows that your teacher 's sister 's sister 's boss 's friend 's father 's boss 's car is helpful .	the bottle works with your teacher 's sister 's sister 's boss 's friend 's father 's boss 's car is helpful .
the boat thinks that my grandmother 's doctor 's wife 's dentist 's dentist 's friend 's father 's hat is gentle .	the boat talks to my grandmother 's doctor 's wife 's dentist 's dentist 's friend 's father 's hat is gentle .
the bicycle knows that my dentist 's daughter 's brother 's sister 's mom 's husband 's doctor 's couch is busy .	the bicycle scares my dentist 's daughter 's brother 's sister 's mom 's husband 's doctor 's couch is busy .
the bed knows that my dentist 's doctor 's friend 's dentist 's grandmother 's mom 's friend 's window is wrong .	the bed helps my dentist 's doctor 's friend 's dentist 's grandmother 's mom 's friend 's window is wrong .
the ring says that your brother 's brother 's sister 's grandmother 's doctor 's husband 's father 's fork is tall .	the ring works with your brother 's brother 's sister 's grandmother 's doctor 's husband 's father 's fork is tall .
the boat says that my teacher 's father 's grandmother 's son 's son 's cousin 's cousin 's car is important .	the boat talks to my teacher 's father 's grandmother 's son 's son 's cousin 's cousin 's car is important .
the window knows that your doctor 's son 's dad 's daughter 's brother 's boss 's wife 's plane is strong .	the window helps your doctor 's son 's dad 's daughter 's brother 's boss 's wife 's plane is strong .
the plane says that your dentist 's doctor 's cousin 's teacher 's friend 's sister 's mom 's candle is tired .	the plane works with your dentist 's doctor 's cousin 's teacher 's friend 's sister 's mom 's candle is tired .
the bed knows that my teacher 's teacher 's grandmother 's dentist 's mom 's brother 's friend 's dish is curious .	the bed helps my teacher 's teacher 's grandmother 's dentist 's mom 's brother 's friend 's dish is curious .
the book says that my wife 's brother 's friend 's boss 's teacher 's husband 's brother 's shoe is upset .	the book works with my wife 's brother 's friend 's boss 's teacher 's husband 's brother 's shoe is upset .
the truck thinks that your doctor 's brother 's cousin 's son 's grandmother 's sister 's sister 's book is clever .	the truck scares your doctor 's brother 's cousin 's son 's grandmother 's sister 's sister 's book is clever .
the button says that my brother 's doctor 's boss 's teacher 's boss 's wife 's teacher 's truck is excited .	the button works with my brother 's doctor 's boss 's teacher 's boss 's wife 's teacher 's truck is excited .
the box says that my father 's husband 's daughter 's mom 's friend 's doctor 's grandmother 's bowl is sleepy .	the box scares my father 's husband 's daughter 's mom 's friend 's doctor 's grandmother 's bowl is sleepy .
the candle knows that your doctor 's friend 's father 's dentist 's friend 's mom 's dentist 's boat is excited .	the candle works with your doctor 's friend 's father 's dentist 's friend 's mom 's dentist 's boat is excited .
the book knows that your doctor 's mother 's doctor 's sister 's daughter 's cousin 's daughter 's couch is confused .	the book works with your doctor 's mother 's doctor 's sister 's daughter 's cousin 's daughter 's couch is confused .
the crayon says that your sister 's grandmother 's brother 's mother 's mom 's cousin 's dentist 's chair is young .	the crayon talks to your sister 's grandmother 's brother 's mother 's mom 's cousin 's dentist 's chair is young .
the glass says that my sister 's cousin 's boss 's mother 's father 's mother 's son 's bowl is important .	the glass helps my sister 's cousin 's boss 's mother 's father 's mother 's son 's bowl is important .
the shoe thinks that my doctor 's sister 's friend 's daughter 's mother 's doctor 's dentist 's couch is confused .	the shoe helps my doctor 's sister 's friend 's daughter 's mother 's doctor 's dentist 's couch is confused .
the glass says that your son 's dad 's boss 's friend 's boss 's grandmother 's cousin 's shoe is wrong .	the glass helps your son 's dad 's boss 's friend 's boss 's grandmother 's cousin 's shoe is wrong .
the book says that your teacher 's sister 's cousin 's sister 's dentist 's cousin 's dad 's boat is young .	the book scares your teacher 's sister 's cousin 's sister 's dentist 's cousin 's dad 's boat is young .
the bag says that your doctor 's mother 's wife 's doctor 's friend 's sister 's doctor 's truck is lucky .	the bag helps your doctor 's mother 's wife 's doctor 's friend 's sister 's doctor 's truck is lucky .
the rocket says that your son 's husband 's brother 's sister 's wife 's boss 's cousin 's bed is hungry .	the rocket helps your son 's husband 's brother 's sister 's wife 's boss 's cousin 's bed is hungry .
the boat says that your mother 's dad 's mother 's husband 's cousin 's grandmother 's teacher 's truck is happy .	the boat helps your mother 's dad 's mother 's husband 's cousin 's grandmother 's teacher 's truck is happy .
the car says that your grandmother 's teacher 's husband 's wife 's doctor 's cousin 's cousin 's shirt is young .	the car works with your grandmother 's teacher 's husband 's wife 's doctor 's cousin 's cousin 's shirt is young .
the spoon thinks that my dad 's doctor 's wife 's grandmother 's father 's father 's teacher 's shirt is curious .	the spoon scares my dad 's doctor 's wife 's grandmother 's father 's father 's teacher 's shirt is curious .
the shirt knows that my mother 's mom 's husband 's dentist 's daughter 's daughter 's dad 's truck is hungry .	the shirt helps my mother 's mom 's husband 's dentist 's daughter 's daughter 's dad 's truck is hungry .
the doll knows that my cousin 's dad 's brother 's friend 's brother 's friend 's dad 's window is tired .	the doll scares my cousin 's dad 's brother 's friend 's brother 's friend 's dad 's window is tired .
the toy knows that your husband 's son 's dentist 's friend 's husband 's father 's wife 's bed is bored .	the toy scares your husband 's son 's dentist 's friend 's husband 's father 's wife 's bed is bored .
the door knows that my boss 's mother 's son 's dad 's teacher 's mother 's husband 's rocket is gentle .	the door helps my boss 's mother 's son 's dad 's teacher 's mother 's husband 's rocket is gentle .
the plate thinks that my father 's mom 's teacher 's mom 's doctor 's mom 's friend 's bicycle is tall .	the plate helps my father 's mom 's teacher 's mom 's doctor 's mom 's friend 's bicycle is tall .
the ring knows that your father 's dentist 's mom 's dad 's grandmother 's sister 's mother 's book is strong .	the ring talks to your father 's dentist 's mom 's dad 's grandmother 's sister 's mother 's book is strong .
the fork says that your sister 's son 's friend 's grandmother 's father 's son 's wife 's toy is clever .	the fork helps your sister 's son 's friend 's grandmother 's father 's son 's wife 's toy is clever .
the ring says that my teacher 's mother 's father 's grandmother 's mom 's cousin 's mother 's button is boring .	the ring scares my teacher 's mother 's father 's grandmother 's mom 's cousin 's mother 's button is boring .
the bottle thinks that your boss 's friend 's husband 's daughter 's brother 's mom 's boss 's cup is clever .	the bottle helps your boss 's friend 's husband 's daughter 's brother 's mom 's boss 's cup is clever .
the bed says that your boss 's daughter 's brother 's son 's grandmother 's doctor 's dentist 's dish is upset .	the bed scares your boss 's daughter 's brother 's son 's grandmother 's doctor 's dentist 's dish is upset .
the window says that your dentist 's wife 's father 's sister 's daughter 's father 's dentist 's spoon is strong .	the window works with your dentist 's wife 's father 's sister 's daughter 's father 's dentist 's spoon is strong .
the chair knows that your dad 's mom 's doctor 's boss 's friend 's son 's mom 's crayon is strong .	the chair works with your dad 's mom 's doctor 's boss 's friend 's son 's mom 's crayon is strong .
the bag thinks that your brother 's friend 's dentist 's boss 's son 's mother 's friend 's window is excited .	the bag helps your brother 's friend 's dentist 's boss 's son 's mother 's friend 's window is excited .
the bicycle says that your dad 's dad 's mother 's boss 's friend 's cousin 's husband 's plane is happy .	the bicycle works with your dad 's dad 's mother 's boss 's friend 's cousin 's husband 's plane is happy .
the chair thinks that your mother 's wife 's father 's mom 's mother 's son 's father 's book is helpful .	the chair talks to your mother 's wife 's father 's mom 's mother 's son 's father 's book is helpful .
the hat thinks that my cousin 's cousin 's mom 's husband 's daughter 's dentist 's teacher 's plate is helpful .	the hat works with my cousin 's cousin 's mom 's husband 's daughter 's dentist 's teacher 's plate is helpful .
the hat thinks that my wife 's mother 's father 's brother 's father 's cousin 's dentist 's book is confused .	the hat scares my wife 's mother 's father 's brother 's father 's cousin 's dentist 's book is confused .
the glass says that my brother 's sister 's mom 's doctor 's boss 's dad 's mother 's doll is angry .	the glass scares my brother 's sister 's mom 's doctor 's boss 's dad 's mother 's doll is angry .
the shirt says that my daughter 's friend 's father 's husband 's sister 's son 's dad 's rocket is young .	the shirt helps my daughter 's friend 's father 's husband 's sister 's son 's dad 's rocket is young .
the plane says that your husband 's cousin 's sister 's friend 's dad 's dentist 's dad 's bed is surprised .	the plane scares your husband 's cousin 's sister 's friend 's dad 's dentist 's dad 's bed is surprised .
the truck thinks that my teacher 's brother 's husband 's grandmother 's doctor 's sister 's brother 's candle is important .	the truck scares my teacher 's brother 's husband 's grandmother 's doctor 's sister 's brother 's candle is important .
the truck says that my wife 's dad 's father 's brother 's dad 's dad 's friend 's bottle is kind .	the truck scares my wife 's dad 's father 's brother 's dad 's dad 's friend 's bottle is kind .
the couch thinks that your father 's grandmother 's friend 's daughter 's boss 's boss 's friend 's bed is nice .	the couch talks to your father 's grandmother 's friend 's daughter 's boss 's boss 's friend 's bed is nice .
the ship says that your sister 's grandmother 's husband 's dentist 's mother 's brother 's dad 's bag is sleepy .	the ship helps your sister 's grandmother 's husband 's dentist 's mother 's brother 's dad 's bag is sleepy .
the bottle knows that my dad 's father 's friend 's friend 's cousin 's dentist 's doctor 's plate is gentle .	the bottle helps my dad 's father 's friend 's friend 's cousin 's dentist 's doctor 's plate is gentle .
the bag thinks that my dad 's son 's husband 's boss 's boss 's husband 's cousin 's glass is surprised .	the bag works with my dad 's son 's husband 's boss 's boss 's husband 's cousin 's glass is surprised .
the spoon says that your friend 's mom 's dad 's boss 's father 's dentist 's friend 's boat is important .	the spoon helps your friend 's mom 's dad 's boss 's father 's dentist 's friend 's boat is important .
the boat thinks that your doctor 's doctor 's boss 's boss 's sister 's wife 's friend 's bicycle is healthy .	the boat works with your doctor 's doctor 's boss 's boss 's sister 's wife 's friend 's bicycle is healthy .
the fork thinks that your husband 's boss 's dentist 's wife 's daughter 's grandmother 's mother 's bicycle is clever .	the fork talks to your husband 's boss 's dentist 's wife 's daughter 's grandmother 's mother 's bicycle is clever .
the toy says that your grandmother 's sister 's daughter 's brother 's sister 's mother 's friend 's cup is angry .	the toy helps your grandmother 's sister 's daughter 's brother 's sister 's mother 's friend 's cup is angry .
the bicycle thinks that my mom 's husband 's father 's husband 's friend 's daughter 's husband 's boat is surprised .	the bicycle talks to my mom 's husband 's father 's husband 's friend 's daughter 's husband 's boat is surprised .
the cup thinks that your dad 's boss 's doctor 's daughter 's mom 's son 's boss 's cup is upset .	the cup helps your dad 's boss 's doctor 's daughter 's mom 's son 's boss 's cup is upset .
the bowl knows that your mother 's father 's sister 's cousin 's sister 's husband 's friend 's shoe is quiet .	the bowl works with your mother 's father 's sister 's cousin 's sister 's husband 's friend 's shoe is quiet .
the mirror says that my doctor 's friend 's dad 's cousin 's cousin 's grandmother 's mom 's plate is tired .	the mirror scares my doctor 's friend 's dad 's cousin 's cousin 's grandmother 's mom 's plate is tired .
the car thinks that my brother 's mom 's father 's mother 's teacher 's dad 's friend 's toy is confused .	the car scares my brother 's mom 's father 's mother 's teacher 's dad 's friend 's toy is confused .
