the rocket thinks that your mom 's teacher 's boss 's brother 's father 's mother 's mom 's mirror is bored .	the rocket works with your mom 's teacher 's boss 's brother 's father 's mother 's mom 's mirror is bored .
the door says that your dad 's doctor 's boss 's wife 's sister 's husband 's husband 's chair is bored .	the door scares your dad 's doctor 's boss 's wife 's sister 's husband 's husband 's chair is bored .
the mirror thinks that my dad 's wife 's son 's brother 's daughter 's husband 's daughter 's ship is lucky .	the mirror works with my dad 's wife 's son 's brother 's daughter 's husband 's daughter 's ship is lucky .
the chair knows that my sister 's boss 's sister 's father 's daughter 's mom 's boss 's doll is excited .	the chair works with my sister 's boss 's sister 's father 's daughter 's mom 's boss 's doll is excited .
the picture says that your dad 's sister 's brother 's sister 's mother 's wife 's cousin 's shoe is lucky .	the picture talks to your dad 's sister 's brother 's sister 's mother 's wife 's cousin 's shoe is lucky .
the picture says that your brother 's friend 's husband 's father 's cousin 's doctor 's cousin 's car is friendly .	the picture talks to your brother 's friend 's husband 's father 's cousin 's doctor 's cousin 's car is friendly .
the crayon says that your wife 's grandmother 's mom 's cousin 's dentist 's grandmother 's boss 's bicycle is hungry .	the crayon works with your wife 's grandmother 's mom 's cousin 's dentist 's grandmother 's boss 's bicycle is hungry .
the window knows that your friend 's son 's brother 's dentist 's cousin 's cousin 's teacher 's toy is happy .	the window scares your friend 's son 's brother 's dentist 's cousin 's cousin 's teacher 's toy is happy .
the fork says that my dad 's boss 's grandmother 's dad 's wife 's grandmother 's husband 's toy is busy .	the fork helps my dad 's boss 's grandmother 's dad 's wife 's grandmother 's husband 's toy is busy .
the plate thinks that your dad 's husband 's son 's mom 's husband 's sister 's teacher 's door is sleepy .	the plate scares your dad 's husband 's son 's mom 's husband 's sister 's teacher 's door is sleepy .
the rug thinks that your son 's mother 's teacher 's mother 's friend 's grandmother 's teacher 's book is healthy .	the rug talks to your son 's mother 's teacher 's mother 's friend 's grandmother 's teacher 's book is healthy .
the plate thinks that my wife 's dad 's cousin 's teacher 's daughter 's husband 's son 's doll is lucky .	the plate helps my wife 's dad 's cousin 's teacher 's daughter 's husband 's son 's doll is lucky .
the button thinks that your wife 's wife 's boss 's son 's mom 's dad 's friend 's cup is bored .	the button talks to your wife 's wife 's boss 's son 's mom 's dad 's friend 's cup is bored .
the rug says that my father 's husband 's mother 's teacher 's boss 's father 's brother 's shirt is gentle .	the rug helps my father 's husband 's mother 's teacher 's boss 's father 's brother 's shirt is gentle .
the spoon says that your son 's dad 's boss 's wife 's dad 's dad 's sister 's car is upset .	the spoon talks to your son 's dad 's boss 's wife 's dad 's dad 's sister 's car is upset .
the crayon knows that your grandmother 's friend 's dad 's son 's mom 's mom 's doctor 's door is boring .	the crayon works with your grandmother 's friend 's dad 's son 's mom 's mom 's doctor 's door is boring .
the picture thinks that your wife 's friend 's husband 's daughter 's brother 's wife 's dentist 's rocket is smart .	the picture helps your wife 's friend 's husband 's daughter 's brother 's wife 's dentist 's rocket is smart .
the cup says that my mother 's grandmother 's mother 's grandmother 's dentist 's son 's doctor 's shoe is healthy .	the cup talks to my mother 's grandmother 's mother 's grandmother 's dentist 's son 's doctor 's shoe is healthy .
the boat says that my friend 's doctor 's dentist 's grandmother 's dentist 's boss 's wife 's rug is boring .	the boat helps my friend 's doctor 's dentist 's grandmother 's dentist 's boss 's wife 's rug is boring .
the fork knows that my dad 's sister 's son 's cousin 's dentist 's dentist 's grandmother 's bowl is hungry .	the fork talks to my dad 's sister 's son 's cousin 's dentist 's dentist 's grandmother 's bowl is hungry .
the plate knows that your teacher 's daughter 's doctor 's cousin 's brother 's brother 's husband 's button is careful .	the plate talks to your teacher 's daughter 's doctor 's cousin 's brother 's brother 's husband 's button is careful .
the rug thinks that your mother 's boss 's son 's dentist 's father 's mother 's husband 's button is important .	the rug talks to your mother 's boss 's son 's dentist 's father 's mother 's husband 's button is important .
the plate says that your boss 's doctor 's husband 's doctor 's teacher 's brother 's father 's bicycle is tall .	the plate helps your boss 's doctor 's husband 's doctor 's teacher 's brother 's father 's bicycle is tall .
the rocket says that my father 's cousin 's teacher 's doctor 's teacher 's doctor 's mother 's bicycle is wrong .	the rocket scares my father 's cousin 's teacher 's doctor 's teacher 's doctor 's mother 's bicycle is wrong .
the doll knows that your mom 's daughter 's son 's sister 's son 's friend 's son 's cup is careful .	the doll works with your mom 's daughter 's son 's sister 's son 's friend 's son 's cup is careful .
the candle thinks that your cousin 's son 's brother 's friend 's friend 's dentist 's teacher 's cup is tired .	the candle helps your cousin 's son 's brother 's friend 's friend 's dentist 's teacher 's cup is tired .
the picture thinks that your husband 's teacher 's sister 's mom 's wife 's grandmother 's father 's button is bored .	the picture helps your husband 's teacher 's sister 's mom 's wife 's grandmother 's father 's button is bored .
the car thinks that your grandmother 's wife 's sister 's son 's father 's husband 's wife 's book is careful .	the car scares your grandmother 's wife 's sister 's son 's father 's husband 's wife 's book is careful .
the couch knows that your friend 's sister 's dentist 's boss 's father 's brother 's mother 's glass is lucky .	the couch helps your friend 's sister 's dentist 's boss 's father 's brother 's mother 's glass is lucky .
the hat thinks that my mother 's boss 's brother 's cousin 's friend 's cousin 's friend 's doll is excited .	the hat talks to my mother 's boss 's brother 's cousin 's friend 's cousin 's friend 's doll is excited .
the plane thinks that my wife 's sister 's grandmother 's friend 's sister 's father 's doctor 's picture is careful .	the plane talks to my wife 's sister 's grandmother 's friend 's sister 's father 's doctor 's picture is careful .
the shirt knows that my doctor 's husband 's mom 's teacher 's teacher 's cousin 's son 's ring is kind .	the shirt scares my doctor 's husband 's mom 's teacher 's teacher 's cousin 's son 's ring is kind .
the chair knows that your cousin 's son 's sister 's husband 's son 's daughter 's sister 's button is young .	the chair talks to your cousin 's son 's sister 's husband 's son 's daughter 's sister 's button is young .
the button says that your sister 's teacher 's son 's friend 's son 's son 's son 's door is quiet .	the button scares your sister 's teacher 's son 's friend 's son 's son 's son 's door is quiet .
the dish knows that my cousin 's mother 's grandmother 's doctor 's cousin 's teacher 's sister 's candle is angry .	the dish works with my cousin 's mother 's grandmother 's doctor 's cousin 's teacher 's sister 's candle is angry .
the shoe says that my husband 's dentist 's teacher 's husband 's doctor 's husband 's daughter 's rug is busy .	the shoe helps my husband 's dentist 's teacher 's husband 's doctor 's husband 's daughter 's rug is busy .
the box thinks that your father 's doctor 's dad 's cousin 's mother 's friend 's father 's chair is bored .	the box talks to your father 's doctor 's dad 's cousin 's mother 's friend 's father 's chair is bored .
the ship says that your grandmother 's son 's daughter 's son 's sister 's doctor 's grandmother 's car is tall .	the ship scares your grandmother 's son 's daughter 's son 's sister 's doctor 's grandmother 's car is tall .
the picture knows that my daughter 's daughter 's sister 's doctor 's dad 's father 's boss 's candle is helpful .	the picture talks to my daughter 's daughter 's sister 's doctor 's dad 's father 's boss 's candle is helpful .
the cup says that my husband 's teacher 's dentist 's wife 's mother 's son 's daughter 's book is busy .	the cup works with my husband 's teacher 's dentist 's wife 's mother 's son 's daughter 's book is busy .
the shirt says that your son 's brother 's friend 's mother 's friend 's dentist 's doctor 's book is angry .	the shirt talks to your son 's brother 's friend 's mother 's friend 's dentist 's doctor 's book is angry .
the rug says that my son 's brother 's wife 's cousin 's boss 's mom 's brother 's spoon is young .	the rug talks to my son 's brother 's wife 's cousin 's boss 's mom 's brother 's spoon is young .
the bowl thinks that my friend 's husband 's boss 's sister 's daughter 's father 's wife 's rug is hungry .	the bowl works with my friend 's husband 's boss 's sister 's daughter 's father 's wife 's rug is hungry .
the bottle knows that my wife 's brother 's teacher 's wife 's father 's wife 's daughter 's picture is lucky .	the bottle talks to my wife 's brother 's teacher 's wife 's father 's wife 's daughter 's picture is lucky .
the doll thinks that your friend 's daughter 's brother 's dentist 's brother 's son 's mother 's door is smart .	the doll helps your friend 's daughter 's brother 's dentist 's brother 's son 's mother 's door is smart .
the bicycle knows that your friend 's wife 's mom 's husband 's sister 's sister 's dad 's shoe is bored .	the bicycle works with your friend 's wife 's mom 's husband 's sister 's sister 's dad 's shoe is bored .
the bicycle knows that your mother 's brother 's sister 's wife 's father 's daughter 's teacher 's book is boring .	the bicycle helps your mother 's brother 's sister 's wife 's father 's daughter 's teacher 's book is boring .
the plate says that your mom 's mother 's brother 's grandmother 's husband 's mom 's mom 's truck is healthy .	the plate scares your mom 's mother 's brother 's grandmother 's husband 's mom 's mom 's truck is healthy .
the glass knows that your boss 's sister 's cousin 's dad 's grandmother 's cousin 's son 's bed is careful .	the glass helps your boss 's sister 's cousin 's dad 's grandmother 's cousin 's son 's bed is careful .
the ship thinks that my mom 's teacher 's mother 's teacher 's son 's daughter 's dad 's book is helpful .	the ship helps my mom 's teacher 's mother 's teacher 's son 's daughter 's dad 's book is helpful .
the shoe thinks that my son 's father 's grandmother 's dentist 's cousin 's mother 's brother 's door is boring .	the shoe helps my son 's father 's grandmother 's dentist 's cousin 's mother 's brother 's door is boring .
the plane says that my sister 's teacher 's doctor 's dad 's brother 's dad 's cousin 's ship is nice .	the plane helps my sister 's teacher 's doctor 's dad 's brother 's dad 's cousin 's ship is nice .
the door thinks that your daughter 's grandmother 's cousin 's brother 's daughter 's teacher 's husband 's book is kind .	the door talks to your daughter 's grandmother 's cousin 's brother 's daughter 's teacher 's husband 's book is kind .
the car thinks that your daughter 's husband 's friend 's boss 's grandmother 's wife 's father 's picture is tired .	the car scares your daughter 's husband 's friend 's boss 's grandmother 's wife 's father 's picture is tired .
the fork thinks that your sister 's father 's doctor 's grandmother 's daughter 's sister 's brother 's shoe is excited .	the fork scares your sister 's father 's doctor 's grandmother 's daughter 's sister 's brother 's shoe is excited .
the shirt says that my brother 's boss 's doctor 's husband 's grandmother 's father 's wife 's truck is angry .	the shirt scares my brother 's boss 's doctor 's husband 's grandmother 's father 's wife 's truck is angry .
the button thinks that your teacher 's teacher 's mom 's sister 's sister 's sister 's brother 's mirror is quiet .	the button scares your teacher 's teacher 's mom 's sister 's sister 's sister 's brother 's mirror is quiet .
the doll says that your father 's doctor 's dad 's mother 's mother 's wife 's mother 's mirror is bored .	the doll helps your father 's doctor 's dad 's mother 's mother 's wife 's mother 's mirror is bored .
the bed knows that your grandmother 's sister 's mom 's wife 's boss 's doctor 's wife 's cup is wrong .	the bed talks to your grandmother 's sister 's mom 's wife 's boss 's doctor 's wife 's cup is wrong .
the glass says that my boss 's doctor 's dentist 's daughter 's husband 's son 's husband 's hat is smart .	the glass works with my boss 's doctor 's dentist 's daughter 's husband 's son 's husband 's hat is smart .
the door thinks that your sister 's grandmother 's dentist 's brother 's sister 's brother 's dentist 's truck is helpful .	the door works with your sister 's grandmother 's dentist 's brother 's sister 's brother 's dentist 's truck is helpful .
the car thinks that your brother 's wife 's dentist 's father 's mom 's father 's husband 's dish is helpful .	the car scares your brother 's wife 's dentist 's father 's mom 's father 's husband 's dish is helpful .
the mirror says that my husband 's dad 's cousin 's dentist 's father 's husband 's sister 's box is boring .	the mirror scares my husband 's dad 's cousin 's dentist 's father 's husband 's sister 's box is boring .
the spoon knows that my teacher 's son 's boss 's father 's dad 's wife 's wife 's picture is tall .	the spoon helps my teacher 's son 's boss 's father 's dad 's wife 's wife 's picture is tall .
the box knows that my wife 's sister 's friend 's boss 's boss 's boss 's dad 's toy is lucky .	the box works with my wife 's sister 's friend 's boss 's boss 's boss 's dad 's toy is lucky .
the picture knows that your dentist 's sister 's husband 's mom 's friend 's dad 's sister 's book is angry .	the picture helps your dentist 's sister 's husband 's mom 's friend 's dad 's sister 's book is angry .
the picture says that your teacher 's daughter 's mother 's sister 's teacher 's friend 's wife 's chair is wrong .	the picture talks to your teacher 's daughter 's mother 's sister 's teacher 's friend 's wife 's chair is wrong .
the fork knows that your brother 's teacher 's friend 's dentist 's grandmother 's husband 's son 's bowl is wrong .	the fork works with your brother 's teacher 's friend 's dentist 's grandmother 's husband 's son 's bowl is wrong .
the truck thinks that your dentist 's doctor 's friend 's doctor 's father 's dad 's sister 's boat is wrong .	the truck helps your dentist 's doctor 's friend 's doctor 's father 's dad 's sister 's boat is wrong .
the fork thinks that my dentist 's wife 's father 's cousin 's daughter 's teacher 's grandmother 's toy is gentle .	the fork works with my dentist 's wife 's father 's cousin 's daughter 's teacher 's grandmother 's toy is gentle .
the book knows that my husband 's daughter 's friend 's dentist 's wife 's brother 's husband 's spoon is young .	the book works with my husband 's daughter 's friend 's dentist 's wife 's brother 's husband 's spoon is young .
the ship knows that your daughter 's cousin 's wife 's friend 's doctor 's dad 's cousin 's mirror is excited .	the ship scares your daughter 's cousin 's wife 's friend 's doctor 's dad 's cousin 's mirror is excited .
the door says that my husband 's sister 's son 's brother 's dad 's doctor 's friend 's candle is wrong .	the door works with my husband 's sister 's son 's brother 's dad 's doctor 's friend 's candle is wrong .
the toy thinks that your grandmother 's mom 's grandmother 's grandmother 's brother 's cousin 's dentist 's mirror is confused .	the toy talks to your grandmother 's mom 's grandmother 's grandmother 's brother 's cousin 's dentist 's mirror is confused .
the shirt knows that your teacher 's teacher 's wife 's brother 's mom 's dad 's father 's dish is smart .	the shirt scares your teacher 's teacher 's wife 's brother 's mom 's dad 's father 's dish is smart .
the shoe thinks that my wife 's son 's husband 's cousin 's mom 's mother 's cousin 's car is quiet .	the shoe scares my wife 's son 's husband 's cousin 's mom 's mother 's cousin 's car is quiet .
the dish knows that your daughter 's husband 's mother 's dentist 's husband 's boss 's doctor 's rocket is excited .	the dish scares your daughter 's husband 's mother 's dentist 's husband 's boss 's doctor 's rocket is excited .
the car thinks that your dad 's father 's brother 's brother 's teacher 's doctor 's doctor 's car is excited .	the car scares your dad 's father 's brother 's brother 's teacher 's doctor 's doctor 's car is excited .
the crayon knows that your cousin 's sister 's grandmother 's boss 's daughter 's son 's son 's shoe is happy .	the crayon talks to your cousin 's sister 's grandmother 's boss 's daughter 's son 's son 's shoe is happy .
the ring says that your grandmother 's teacher 's father 's cousin 's father 's grandmother 's doctor 's dish is important .	the ring works with your grandmother 's teacher 's father 's cousin 's father 's grandmother 's doctor 's dish is important .
the crayon knows that my daughter 's father 's father 's boss 's brother 's dentist 's husband 's doll is excited .	the crayon works with my daughter 's father 's father 's boss 's brother 's dentist 's husband 's doll is excited .
the bowl thinks that my doctor 's boss 's dad 's daughter 's brother 's grandmother 's husband 's mirror is busy .	the bowl works with my doctor 's boss 's dad 's daughter 's brother 's grandmother 's husband 's mirror is busy .
the spoon thinks that your brother 's boss 's father 's dad 's son 's son 's cousin 's rug is young .	the spoon scares your brother 's boss 's father 's dad 's son 's son 's cousin 's rug is young .
the chair knows that my husband 's teacher 's father 's husband 's sister 's father 's sister 's couch is bored .	the chair talks to my husband 's teacher 's father 's husband 's sister 's father 's sister 's couch is bored .
the spoon knows that my dad 's teacher 's teacher 's mother 's father 's teacher 's father 's hat is nice .	the spoon talks to my dad 's teacher 's teacher 's mother 's father 's teacher 's father 's hat is nice .
the car thinks that your father 's dad 's dentist 's grandmother 's friend 's teacher 's mother 's plate is boring .	the car works with your father 's dad 's dentist 's grandmother 's friend 's teacher 's mother 's plate is boring .
the chair knows that your daughter 's father 's brother 's daughter 's mother 's husband 's boss 's bowl is excited .	the chair helps your daughter 's father 's brother 's daughter 's mother 's husband 's boss 's bowl is excited .
the car says that your sister 's brother 's son 's wife 's mother 's sister 's son 's cup is smart .	the car scares your sister 's brother 's son 's wife 's mother 's sister 's son 's cup is smart .
the plate knows that my mother 's father 's teacher 's mom 's brother 's husband 's wife 's window is tired .	the plate works with my mother 's father 's teacher 's mom 's brother 's husband 's wife 's window is tired .
the bowl thinks that your friend 's cousin 's grandmother 's husband 's dad 's son 's dad 's bottle is angry .	the bowl works with your friend 's cousin 's grandmother 's husband 's dad 's son 's dad 's bottle is angry .
the car thinks that your daughter 's dentist 's husband 's grandmother 's husband 's boss 's son 's shoe is sleepy .	the car works with your daughter 's dentist 's husband 's grandmother 's husband 's boss 's son 's shoe is sleepy .
the shirt says that your sister 's father 's daughter 's dad 's doctor 's dentist 's daughter 's doll is friendly .	the shirt works with your sister 's father 's daughter 's dad 's doctor 's dentist 's daughter 's doll is friendly .
the cup says that my dad 's grandmother 's friend 's wife 's sister 's daughter 's teacher 's spoon is curious .	the cup works with my dad 's grandmother 's friend 's wife 's sister 's daughter 's teacher 's spoon is curious .
the mirror says that my friend 's son 's dentist 's dentist 's dentist 's friend 's mom 's picture is happy .	the mirror helps my friend 's son 's dentist 's dentist 's dentist 's friend 's mom 's picture is happy .
the car thinks that my father 's husband 's dentist 's mother 's wife 's mother 's dad 's spoon is happy .	the car works with my father 's husband 's dentist 's mother 's wife 's mother 's dad 's spoon is happy .
the door says that your sister 's grandmother 's boss 's dad 's cousin 's mom 's mom 's plate is careful .	the door talks to your sister 's grandmother 's boss 's dad 's cousin 's mom 's mom 's plate is careful .
the bag thinks that your son 's brother 's doctor 's wife 's teacher 's grandmother 's sister 's window is busy .	the bag talks to your son 's brother 's doctor 's wife 's teacher 's grandmother 's sister 's window is busy .
the doll thinks that your dad 's sister 's teacher 's teacher 's sister 's cousin 's wife 's car is excited .	the doll helps your dad 's sister 's teacher 's teacher 's sister 's cousin 's wife 's car is excited .
the bottle thinks that your son 's son 's cousin 's mom 's cousin 's boss 's wife 's car is busy .	the bottle scares your son 's son 's cousin 's mom 's cousin 's boss 's wife 's car is busy .
the picture says that your dad 's father 's father 's father 's husband 's teacher 's daughter 's book is gentle .	the picture talks to your dad 's father 's father 's father 's husband 's teacher 's daughter 's book is gentle .
the window says that your daughter 's cousin 's sister 's mom 's wife 's boss 's son 's spoon is angry .	the window talks to your daughter 's cousin 's sister 's mom 's wife 's boss 's son 's spoon is angry .
the doll thinks that my dentist 's son 's daughter 's sister 's wife 's wife 's cousin 's dish is excited .	the doll works with my dentist 's son 's daughter 's sister 's wife 's wife 's cousin 's dish is excited .
the shoe says that my dad 's dentist 's brother 's husband 's teacher 's dad 's wife 's book is curious .	the shoe talks to my dad 's dentist 's brother 's husband 's teacher 's dad 's wife 's book is curious .
the cup knows that my doctor 's sister 's doctor 's daughter 's dad 's grandmother 's husband 's bowl is helpful .	the cup helps my doctor 's sister 's doctor 's daughter 's dad 's grandmother 's husband 's bowl is helpful .
the toy thinks that my dentist 's doctor 's dentist 's grandmother 's mother 's dad 's boss 's door is young .	the toy talks to my dentist 's doctor 's dentist 's grandmother 's mother 's dad 's boss 's door is young .
the chair thinks that my son 's wife 's friend 's sister 's daughter 's brother 's teacher 's hat is quiet .	the chair scares my son 's wife 's friend 's sister 's daughter 's brother 's teacher 's hat is quiet .
the candle says that your son 's dentist 's daughter 's doctor 's brother 's sister 's daughter 's car is strong .	the candle scares your son 's dentist 's daughter 's doctor 's brother 's sister 's daughter 's car is strong .
the car says that your sister 's doctor 's cousin 's daughter 's sister 's wife 's mother 's spoon is excited .	the car scares your sister 's doctor 's cousin 's daughter 's sister 's wife 's mother 's spoon is excited .
the candle knows that your friend 's mom 's teacher 's friend 's mom 's cousin 's brother 's shirt is busy .	the candle scares your friend 's mom 's teacher 's friend 's mom 's cousin 's brother 's shirt is busy .
the couch says that your doctor 's father 's cousin 's wife 's teacher 's boss 's husband 's car is wrong .	the couch works with your doctor 's father 's cousin 's wife 's teacher 's boss 's husband 's car is wrong .
the button knows that your son 's brother 's sister 's doctor 's dentist 's sister 's dad 's fork is happy .	the button works with your son 's brother 's sister 's doctor 's dentist 's sister 's dad 's fork is happy .
the bowl says that my husband 's brother 's dad 's dad 's mom 's friend 's mom 's boat is upset .	the bowl scares my husband 's brother 's dad 's dad 's mom 's friend 's mom 's boat is upset .
the picture thinks that your son 's mom 's wife 's mom 's mother 's cousin 's father 's window is sleepy .	the picture scares your son 's mom 's wife 's mom 's mother 's cousin 's father 's window is sleepy .
the picture says that your dentist 's dentist 's doctor 's wife 's cousin 's cousin 's son 's book is gentle .	the picture talks to your dentist 's dentist 's doctor 's wife 's cousin 's cousin 's son 's book is gentle .
the glass says that your wife 's mom 's doctor 's wife 's mom 's wife 's brother 's hat is confused .	the glass talks to your wife 's mom 's doctor 's wife 's mom 's wife 's brother 's hat is confused .
the book thinks that your son 's mother 's mom 's daughter 's grandmother 's teacher 's son 's bicycle is wrong .	the book works with your son 's mother 's mom 's daughter 's grandmother 's teacher 's son 's bicycle is wrong .
the door thinks that your boss 's wife 's grandmother 's father 's son 's boss 's son 's couch is helpful .	the door works with your boss 's wife 's grandmother 's father 's son 's boss 's son 's couch is helpful .
the bag says that your father 's brother 's doctor 's doctor 's husband 's dentist 's doctor 's shoe is important .	the bag helps your father 's brother 's doctor 's doctor 's husband 's dentist 's doctor 's shoe is important .
