Stephanie thinks that your mother 's sister 's boss 's friend 's cousin 's father is upset .	Stephanie helps your mother 's sister 's boss 's friend 's cousin 's father is upset .
my teacher knows that my teacher 's mom 's sister 's boss 's teacher 's doctor is friendly .	my teacher talks to my teacher 's mom 's sister 's boss 's teacher 's doctor is friendly .
Liam says that your cousin 's cousin 's son 's father 's cousin 's dentist is helpful .	Liam talks to your cousin 's cousin 's son 's father 's cousin 's dentist is helpful .
Nancy thinks that my teacher 's brother 's husband 's wife 's boss 's husband is careful .	Nancy scares my teacher 's brother 's husband 's wife 's boss 's husband is careful .
the patient says that my dentist 's wife 's dad 's brother 's husband 's boss is happy .	the patient helps my dentist 's wife 's dad 's brother 's husband 's boss is happy .
Jill knows that my teacher 's father 's grandmother 's wife 's brother 's husband is angry .	Jill scares my teacher 's father 's grandmother 's wife 's brother 's husband is angry .
your cousin thinks that my brother 's wife 's husband 's father 's son 's doctor is friendly .	your cousin works with my brother 's wife 's husband 's father 's son 's doctor is friendly .
Deborah knows that my doctor 's brother 's son 's boss 's dad 's dad is young .	Deborah works with my doctor 's brother 's son 's boss 's dad 's dad is young .
Jennifer thinks that my son 's husband 's mom 's cousin 's mom 's teacher is excited .	Jennifer works with my son 's husband 's mom 's cousin 's mom 's teacher is excited .
your dentist says that my teacher 's grandmother 's sister 's brother 's grandmother 's mom is nice .	your dentist works with my teacher 's grandmother 's sister 's brother 's grandmother 's mom is nice .
Todd says that your boss 's father 's father 's son 's husband 's son is boring .	Todd works with your boss 's father 's father 's son 's husband 's son is boring .
my friend thinks that my husband 's husband 's brother 's daughter 's mother 's daughter is curious .	my friend talks to my husband 's husband 's brother 's daughter 's mother 's daughter is curious .
Joseph thinks that my dad 's grandmother 's friend 's cousin 's father 's doctor is healthy .	Joseph talks to my dad 's grandmother 's friend 's cousin 's father 's doctor is healthy .
your doctor knows that your son 's mom 's dentist 's friend 's teacher 's friend is important .	your doctor talks to your son 's mom 's dentist 's friend 's teacher 's friend is important .
your cousin thinks that my friend 's wife 's boss 's teacher 's sister 's mother is busy .	your cousin works with my friend 's wife 's boss 's teacher 's sister 's mother is busy .
Jennifer thinks that my mom 's grandmother 's sister 's mom 's sister 's father is nice .	Jennifer helps my mom 's grandmother 's sister 's mom 's sister 's father is nice .
Robert says that my husband 's wife 's mom 's wife 's friend 's father is excited .	Robert helps my husband 's wife 's mom 's wife 's friend 's father is excited .
Thomas thinks that your son 's teacher 's doctor 's daughter 's mom 's dentist is healthy .	Thomas works with your son 's teacher 's doctor 's daughter 's mom 's dentist is healthy .
the child says that your cousin 's brother 's grandmother 's father 's dentist 's brother is smart .	the child talks to your cousin 's brother 's grandmother 's father 's dentist 's brother is smart .
the person thinks that your father 's cousin 's cousin 's husband 's sister 's son is wrong .	the person talks to your father 's cousin 's cousin 's husband 's sister 's son is wrong .
my cousin thinks that my doctor 's doctor 's boss 's cousin 's son 's daughter is careful .	my cousin talks to my doctor 's doctor 's boss 's cousin 's son 's daughter is careful .
your cousin says that my daughter 's father 's sister 's son 's grandmother 's father is wrong .	your cousin helps my daughter 's father 's sister 's son 's grandmother 's father is wrong .
my friend knows that my brother 's sister 's dad 's wife 's cousin 's dad is tired .	my friend talks to my brother 's sister 's dad 's wife 's cousin 's dad is tired .
the driver says that my dentist 's cousin 's son 's son 's mother 's grandmother is busy .	the driver talks to my dentist 's cousin 's son 's son 's mother 's grandmother is busy .
your teacher knows that my friend 's dad 's friend 's son 's boss 's father is nice .	your teacher works with my friend 's dad 's friend 's son 's boss 's father is nice .
my friend says that your boss 's father 's mother 's cousin 's mom 's boss is important .	my friend helps your boss 's father 's mother 's cousin 's mom 's boss is important .
the dentist says that my dentist 's boss 's friend 's dentist 's dentist 's husband is bored .	the dentist works with my dentist 's boss 's friend 's dentist 's dentist 's husband is bored .
James says that my mom 's son 's dentist 's dad 's brother 's dentist is gentle .	James talks to my mom 's son 's dentist 's dad 's brother 's dentist is gentle .
the customer thinks that your teacher 's brother 's husband 's friend 's dad 's doctor is careful .	the customer scares your teacher 's brother 's husband 's friend 's dad 's doctor is careful .
your boss says that my teacher 's cousin 's brother 's boss 's dentist 's doctor is strong .	your boss helps my teacher 's cousin 's brother 's boss 's dentist 's doctor is strong .
the patient says that your mom 's dad 's husband 's wife 's mom 's sister is confused .	the patient works with your mom 's dad 's husband 's wife 's mom 's sister is confused .
your friend says that your doctor 's mom 's mom 's son 's son 's friend is surprised .	your friend works with your doctor 's mom 's mom 's son 's son 's friend is surprised .
the driver thinks that my mother 's wife 's daughter 's son 's dentist 's cousin is careful .	the driver works with my mother 's wife 's daughter 's son 's dentist 's cousin is careful .
Samantha knows that my cousin 's son 's grandmother 's husband 's son 's son is important .	Samantha helps my cousin 's son 's grandmother 's husband 's son 's son is important .
the driver knows that my doctor 's brother 's dad 's sister 's boss 's grandmother is surprised .	the driver helps my doctor 's brother 's dad 's sister 's boss 's grandmother is surprised .
Paul says that your father 's brother 's husband 's friend 's friend 's friend is angry .	Paul scares your father 's brother 's husband 's friend 's friend 's friend is angry .
Paul thinks that your wife 's sister 's cousin 's wife 's husband 's sister is upset .	Paul talks to your wife 's sister 's cousin 's wife 's husband 's sister is upset .
the customer thinks that your mom 's mom 's cousin 's teacher 's son 's sister is curious .	the customer works with your mom 's mom 's cousin 's teacher 's son 's sister is curious .
my dentist says that your mom 's cousin 's doctor 's doctor 's brother 's mother is busy .	my dentist talks to your mom 's cousin 's doctor 's doctor 's brother 's mother is busy .
Judy knows that my brother 's husband 's cousin 's brother 's boss 's grandmother is quiet .	Judy helps my brother 's husband 's cousin 's brother 's boss 's grandmother is quiet .
the child says that your doctor 's daughter 's grandmother 's son 's cousin 's mother is upset .	the child scares your doctor 's daughter 's grandmother 's son 's cousin 's mother is upset .
Marie thinks that your daughter 's mother 's mom 's wife 's father 's dad is friendly .	Marie helps your daughter 's mother 's mom 's wife 's father 's dad is friendly .
the doctor says that my teacher 's dentist 's wife 's son 's wife 's sister is strong .	the doctor talks to my teacher 's dentist 's wife 's son 's wife 's sister is strong .
Sarah knows that your doctor 's dentist 's teacher 's sister 's mom 's dad is young .	Sarah talks to your doctor 's dentist 's teacher 's sister 's mom 's dad is young .
the driver knows that your wife 's husband 's mom 's friend 's wife 's father is upset .	the driver helps your wife 's husband 's mom 's friend 's wife 's father is upset .
your teacher says that my daughter 's grandmother 's mother 's daughter 's mom 's husband is surprised .	your teacher works with my daughter 's grandmother 's mother 's daughter 's mom 's husband is surprised .
Julie thinks that my teacher 's wife 's son 's son 's mother 's grandmother is clever .	Julie helps my teacher 's wife 's son 's son 's mother 's grandmother is clever .
the customer knows that my cousin 's dentist 's dentist 's teacher 's mom 's brother is curious .	the customer talks to my cousin 's dentist 's dentist 's teacher 's mom 's brother is curious .
the adult says that my son 's dad 's father 's doctor 's mother 's boss is bored .	the adult helps my son 's dad 's father 's doctor 's mother 's boss is bored .
Jane says that your father 's sister 's sister 's dad 's son 's teacher is smart .	Jane helps your father 's sister 's sister 's dad 's son 's teacher is smart .
the dentist says that my father 's boss 's mother 's brother 's teacher 's husband is bored .	the dentist scares my father 's boss 's mother 's brother 's teacher 's husband is bored .
your boss knows that my wife 's husband 's wife 's husband 's grandmother 's daughter is angry .	your boss talks to my wife 's husband 's wife 's husband 's grandmother 's daughter is angry .
Noah thinks that your cousin 's teacher 's mom 's mother 's father 's son is curious .	Noah talks to your cousin 's teacher 's mom 's mother 's father 's son is curious .
my boss says that my sister 's wife 's dentist 's father 's boss 's daughter is gentle .	my boss works with my sister 's wife 's dentist 's father 's boss 's daughter is gentle .
James says that your mother 's brother 's doctor 's brother 's father 's cousin is healthy .	James helps your mother 's brother 's doctor 's brother 's father 's cousin is healthy .
my boss thinks that my dad 's boss 's cousin 's grandmother 's cousin 's grandmother is careful .	my boss talks to my dad 's boss 's cousin 's grandmother 's cousin 's grandmother is careful .
Timothy thinks that my mom 's dad 's teacher 's dad 's wife 's grandmother is strong .	Timothy works with my mom 's dad 's teacher 's dad 's wife 's grandmother is strong .
Judy thinks that your son 's husband 's sister 's husband 's dad 's cousin is bored .	Judy scares your son 's husband 's sister 's husband 's dad 's cousin is bored .
your doctor knows that my dad 's teacher 's mother 's doctor 's cousin 's teacher is hungry .	your doctor helps my dad 's teacher 's mother 's doctor 's cousin 's teacher is hungry .
my cousin thinks that my sister 's brother 's dad 's son 's dentist 's grandmother is excited .	my cousin talks to my sister 's brother 's dad 's son 's dentist 's grandmother is excited .
Lisa knows that your mother 's father 's teacher 's son 's father 's father is wrong .	Lisa works with your mother 's father 's teacher 's son 's father 's father is wrong .
Denise says that my boss 's father 's teacher 's wife 's dad 's grandmother is happy .	Denise talks to my boss 's father 's teacher 's wife 's dad 's grandmother is happy .
Kevin says that your sister 's teacher 's wife 's daughter 's cousin 's dentist is curious .	Kevin works with your sister 's teacher 's wife 's daughter 's cousin 's dentist is curious .
Mary knows that my wife 's cousin 's grandmother 's cousin 's friend 's cousin is boring .	Mary helps my wife 's cousin 's grandmother 's cousin 's friend 's cousin is boring .
my dentist says that your brother 's husband 's father 's boss 's boss 's dad is lucky .	my dentist talks to your brother 's husband 's father 's boss 's boss 's dad is lucky .
Karen knows that my dentist 's father 's brother 's grandmother 's dentist 's dentist is tired .	Karen works with my dentist 's father 's brother 's grandmother 's dentist 's dentist is tired .
your doctor says that my teacher 's grandmother 's friend 's wife 's mom 's daughter is wrong .	your doctor works with my teacher 's grandmother 's friend 's wife 's mom 's daughter is wrong .
my boss knows that my doctor 's doctor 's son 's son 's wife 's daughter is kind .	my boss scares my doctor 's doctor 's son 's son 's wife 's daughter is kind .
Donald says that my teacher 's dentist 's sister 's daughter 's doctor 's mom is happy .	Donald scares my teacher 's dentist 's sister 's daughter 's doctor 's mom is happy .
Catherine thinks that your mom 's cousin 's dad 's doctor 's doctor 's brother is young .	Catherine helps your mom 's cousin 's dad 's doctor 's doctor 's brother is young .
the child says that my brother 's father 's grandmother 's doctor 's son 's dad is clever .	the child talks to my brother 's father 's grandmother 's doctor 's son 's dad is clever .
my dentist says that your dentist 's sister 's dentist 's husband 's teacher 's daughter is confused .	my dentist scares your dentist 's sister 's dentist 's husband 's teacher 's daughter is confused .
the doctor knows that my brother 's husband 's daughter 's daughter 's son 's son is bored .	the doctor talks to my brother 's husband 's daughter 's daughter 's son 's son is bored .
your friend thinks that your husband 's teacher 's daughter 's dentist 's dentist 's son is smart .	your friend helps your husband 's teacher 's daughter 's dentist 's dentist 's son is smart .
the teacher knows that my cousin 's son 's daughter 's boss 's boss 's sister is boring .	the teacher scares my cousin 's son 's daughter 's boss 's boss 's sister is boring .
the driver thinks that your dad 's husband 's cousin 's daughter 's daughter 's daughter is confused .	the driver talks to your dad 's husband 's cousin 's daughter 's daughter 's daughter is confused .
the patient thinks that your husband 's dad 's dad 's brother 's husband 's wife is curious .	the patient helps your husband 's dad 's dad 's brother 's husband 's wife is curious .
the customer knows that my dad 's brother 's daughter 's dentist 's wife 's brother is busy .	the customer scares my dad 's brother 's daughter 's dentist 's wife 's brother is busy .
my doctor thinks that your boss 's boss 's grandmother 's brother 's teacher 's friend is sleepy .	my doctor talks to your boss 's boss 's grandmother 's brother 's teacher 's friend is sleepy .
Ronald says that your boss 's mother 's doctor 's dentist 's cousin 's doctor is important .	Ronald works with your boss 's mother 's doctor 's dentist 's cousin 's doctor is important .
Christopher thinks that your dad 's wife 's sister 's mom 's father 's mother is young .	Christopher talks to your dad 's wife 's sister 's mom 's father 's mother is young .
the patient says that my boss 's cousin 's teacher 's dad 's daughter 's boss is boring .	the patient helps my boss 's cousin 's teacher 's dad 's daughter 's boss is boring .
your boss knows that my daughter 's teacher 's daughter 's wife 's mother 's grandmother is lucky .	your boss helps my daughter 's teacher 's daughter 's wife 's mother 's grandmother is lucky .
your friend knows that your daughter 's dad 's teacher 's mother 's dad 's grandmother is hungry .	your friend works with your daughter 's dad 's teacher 's mother 's dad 's grandmother is hungry .
your friend knows that my boss 's dad 's boss 's daughter 's boss 's dad is strong .	your friend works with my boss 's dad 's boss 's daughter 's boss 's dad is strong .
the driver says that your mom 's doctor 's husband 's brother 's doctor 's sister is excited .	the driver scares your mom 's doctor 's husband 's brother 's doctor 's sister is excited .
Michelle says that your dentist 's wife 's daughter 's daughter 's grandmother 's father is strong .	Michelle works with your dentist 's wife 's daughter 's daughter 's grandmother 's father is strong .
Deborah knows that your mom 's cousin 's teacher 's doctor 's wife 's daughter is excited .	Deborah talks to your mom 's cousin 's teacher 's doctor 's wife 's daughter is excited .
the customer says that my dad 's daughter 's teacher 's friend 's brother 's grandmother is curious .	the customer talks to my dad 's daughter 's teacher 's friend 's brother 's grandmother is curious .
Laura knows that your teacher 's mom 's dad 's grandmother 's father 's dad is important .	Laura works with your teacher 's mom 's dad 's grandmother 's father 's dad is important .
Michael thinks that my brother 's mom 's dad 's son 's wife 's sister is surprised .	Michael talks to my brother 's mom 's dad 's son 's wife 's sister is surprised .
the driver thinks that your mother 's grandmother 's daughter 's boss 's wife 's mom is angry .	the driver scares your mother 's grandmother 's daughter 's boss 's wife 's mom is angry .
Barbara says that your mother 's husband 's father 's friend 's friend 's sister is nice .	Barbara works with your mother 's husband 's father 's friend 's friend 's sister is nice .
the teacher says that my grandmother 's friend 's brother 's mother 's daughter 's father is nice .	the teacher works with my grandmother 's friend 's brother 's mother 's daughter 's father is nice .
my teacher says that my daughter 's cousin 's teacher 's daughter 's son 's doctor is wrong .	my teacher works with my daughter 's cousin 's teacher 's daughter 's son 's doctor is wrong .
the adult says that my doctor 's teacher 's dentist 's son 's teacher 's doctor is angry .	the adult helps my doctor 's teacher 's dentist 's son 's teacher 's doctor is angry .
Judy thinks that my dad 's grandmother 's mother 's daughter 's wife 's teacher is upset .	Judy scares my dad 's grandmother 's mother 's daughter 's wife 's teacher is upset .
Adam thinks that my husband 's brother 's daughter 's husband 's father 's dentist is important .	Adam scares my husband 's brother 's daughter 's husband 's father 's dentist is important .
Bill thinks that my son 's cousin 's wife 's husband 's sister 's dentist is curious .	Bill works with my son 's cousin 's wife 's husband 's sister 's dentist is curious .
your boss thinks that your doctor 's dad 's father 's son 's grandmother 's boss is tired .	your boss scares your doctor 's dad 's father 's son 's grandmother 's boss is tired .
your dentist knows that my daughter 's dad 's cousin 's grandmother 's dad 's husband is nice .	your dentist talks to my daughter 's dad 's cousin 's grandmother 's dad 's husband is nice .
the dancer knows that your dentist 's grandmother 's cousin 's dad 's father 's brother is tired .	the dancer works with your dentist 's grandmother 's cousin 's dad 's father 's brother is tired .
my boss thinks that my boss 's father 's doctor 's grandmother 's son 's mother is excited .	my boss works with my boss 's father 's doctor 's grandmother 's son 's mother is excited .
Julie knows that your sister 's daughter 's son 's mother 's dentist 's mom is surprised .	Julie scares your sister 's daughter 's son 's mother 's dentist 's mom is surprised .
Wendy says that my dad 's father 's mother 's cousin 's husband 's son is important .	Wendy scares my dad 's father 's mother 's cousin 's husband 's son is important .
Erin says that my father 's friend 's mom 's teacher 's mother 's daughter is excited .	Erin helps my father 's friend 's mom 's teacher 's mother 's daughter is excited .
your cousin knows that your brother 's cousin 's friend 's husband 's brother 's mom is gentle .	your cousin helps your brother 's cousin 's friend 's husband 's brother 's mom is gentle .
your boss knows that my boss 's dentist 's sister 's friend 's sister 's brother is surprised .	your boss talks to my boss 's dentist 's sister 's friend 's sister 's brother is surprised .
your doctor says that my wife 's cousin 's sister 's doctor 's doctor 's daughter is surprised .	your doctor talks to my wife 's cousin 's sister 's doctor 's doctor 's daughter is surprised .
the teacher says that your son 's son 's teacher 's wife 's daughter 's mom is young .	the teacher scares your son 's son 's teacher 's wife 's daughter 's mom is young .
the patient thinks that your boss 's grandmother 's wife 's dad 's son 's mother is friendly .	the patient works with your boss 's grandmother 's wife 's dad 's son 's mother is friendly .
the teacher thinks that your cousin 's father 's daughter 's dad 's teacher 's teacher is smart .	the teacher helps your cousin 's father 's daughter 's dad 's teacher 's teacher is smart .
Ann thinks that my doctor 's brother 's teacher 's cousin 's dad 's father is helpful .	Ann helps my doctor 's brother 's teacher 's cousin 's dad 's father is helpful .
Todd thinks that my mother 's dad 's wife 's daughter 's mother 's father is wrong .	Todd helps my mother 's dad 's wife 's daughter 's mother 's father is wrong .
your cousin says that your dentist 's mother 's teacher 's father 's dad 's mom is young .	your cousin talks to your dentist 's mother 's teacher 's father 's dad 's mom is young .
Bill says that your friend 's cousin 's boss 's son 's teacher 's dad is smart .	Bill talks to your friend 's cousin 's boss 's son 's teacher 's dad is smart .
your cousin thinks that your mother 's brother 's friend 's brother 's mom 's dad is strong .	your cousin scares your mother 's brother 's friend 's brother 's mom 's dad is strong .
Travis says that your friend 's wife 's grandmother 's boss 's teacher 's father is healthy .	Travis talks to your friend 's wife 's grandmother 's boss 's teacher 's father is healthy .
Daniel knows that my mother 's brother 's dad 's wife 's husband 's sister is boring .	Daniel talks to my mother 's brother 's dad 's wife 's husband 's sister is boring .
Kristen thinks that my boss 's sister 's father 's friend 's mother 's husband is lucky .	Kristen scares my boss 's sister 's father 's friend 's mother 's husband is lucky .
my boss thinks that my dad 's daughter 's son 's dentist 's friend 's teacher is tired .	my boss scares my dad 's daughter 's son 's dentist 's friend 's teacher is tired .
the person knows that my boss 's doctor 's brother 's brother 's daughter 's father is busy .	the person works with my boss 's doctor 's brother 's brother 's daughter 's father is busy .
the dentist knows that your brother 's teacher 's cousin 's doctor 's son 's husband is kind .	the dentist scares your brother 's teacher 's cousin 's doctor 's son 's husband is kind .
David thinks that your dentist 's dentist 's dentist 's boss 's teacher 's cousin is excited .	David scares your dentist 's dentist 's dentist 's boss 's teacher 's cousin is excited .
the customer knows that my doctor 's grandmother 's son 's sister 's doctor 's dentist is young .	the customer helps my doctor 's grandmother 's son 's sister 's doctor 's dentist is young .
your dentist thinks that your cousin 's wife 's mother 's boss 's son 's teacher is hungry .	your dentist helps your cousin 's wife 's mother 's boss 's son 's teacher is hungry .
the adult thinks that your husband 's son 's boss 's doctor 's dad 's sister is nice .	the adult helps your husband 's son 's boss 's doctor 's dad 's sister is nice .
Jerry says that my husband 's daughter 's boss 's cousin 's boss 's dad is excited .	Jerry works with my husband 's daughter 's boss 's cousin 's boss 's dad is excited .
your dentist thinks that my friend 's friend 's sister 's dentist 's mother 's dentist is clever .	your dentist talks to my friend 's friend 's sister 's dentist 's mother 's dentist is clever .
my friend says that my boss 's boss 's dentist 's husband 's brother 's friend is boring .	my friend helps my boss 's boss 's dentist 's husband 's brother 's friend is boring .
Christopher says that my mom 's doctor 's daughter 's mother 's doctor 's wife is quiet .	Christopher scares my mom 's doctor 's daughter 's mother 's doctor 's wife is quiet .
Aaron thinks that my dentist 's sister 's wife 's friend 's brother 's doctor is kind .	Aaron works with my dentist 's sister 's wife 's friend 's brother 's doctor is kind .
Brett thinks that my doctor 's dad 's grandmother 's brother 's wife 's son is boring .	Brett helps my doctor 's dad 's grandmother 's brother 's wife 's son is boring .
the doctor says that my cousin 's sister 's son 's mother 's wife 's husband is busy .	the doctor talks to my cousin 's sister 's son 's mother 's wife 's husband is busy .
the dentist knows that your boss 's husband 's friend 's boss 's wife 's mom is careful .	the dentist helps your boss 's husband 's friend 's boss 's wife 's mom is careful .
Nancy thinks that your teacher 's dentist 's brother 's husband 's husband 's father is sleepy .	Nancy works with your teacher 's dentist 's brother 's husband 's husband 's father is sleepy .
Thomas thinks that your boss 's friend 's husband 's husband 's boss 's friend is boring .	Thomas helps your boss 's friend 's husband 's husband 's boss 's friend is boring .
Samantha says that my doctor 's father 's son 's dad 's daughter 's teacher is wrong .	Samantha talks to my doctor 's father 's son 's dad 's daughter 's teacher is wrong .
Kristen thinks that your dad 's sister 's dentist 's daughter 's brother 's daughter is happy .	Kristen scares your dad 's sister 's dentist 's daughter 's brother 's daughter is happy .
the teacher says that your cousin 's mom 's friend 's grandmother 's grandmother 's mom is busy .	the teacher helps your cousin 's mom 's friend 's grandmother 's grandmother 's mom is busy .
the adult thinks that my father 's boss 's father 's dad 's mother 's sister is kind .	the adult works with my father 's boss 's father 's dad 's mother 's sister is kind .
my cousin says that your teacher 's brother 's teacher 's wife 's mother 's wife is excited .	my cousin helps your teacher 's brother 's teacher 's wife 's mother 's wife is excited .
my dentist says that your mother 's boss 's son 's dentist 's father 's brother is nice .	my dentist helps your mother 's boss 's son 's dentist 's father 's brother is nice .
