the door says that my grandmother 's friend 's daughter 's teacher 's sister 's cousin 's cousin 's mom 's brother 's hat is confused .	the door helps my grandmother 's friend 's daughter 's teacher 's sister 's cousin 's cousin 's mom 's brother 's hat is confused .
the button says that your doctor 's friend 's cousin 's son 's friend 's brother 's father 's father 's grandmother 's glass is confused .	the button helps your doctor 's friend 's cousin 's son 's friend 's brother 's father 's father 's grandmother 's glass is confused .
the plane knows that my daughter 's cousin 's grandmother 's grandmother 's brother 's cousin 's dad 's dentist 's son 's fork is sleepy .	the plane works with my daughter 's cousin 's grandmother 's grandmother 's brother 's cousin 's dad 's dentist 's son 's fork is sleepy .
the window says that your cousin 's mom 's boss 's dad 's mom 's dad 's grandmother 's grandmother 's daughter 's car is important .	the window scares your cousin 's mom 's boss 's dad 's mom 's dad 's grandmother 's grandmother 's daughter 's car is important .
the doll knows that your cousin 's doctor 's daughter 's cousin 's teacher 's brother 's daughter 's brother 's father 's ring is hungry .	the doll scares your cousin 's doctor 's daughter 's cousin 's teacher 's brother 's daughter 's brother 's father 's ring is hungry .
the plane knows that your wife 's dentist 's dad 's dentist 's husband 's husband 's boss 's teacher 's doctor 's chair is clever .	the plane helps your wife 's dentist 's dad 's dentist 's husband 's husband 's boss 's teacher 's doctor 's chair is clever .
the window says that your teacher 's friend 's mom 's wife 's teacher 's dentist 's dentist 's daughter 's father 's cup is curious .	the window talks to your teacher 's friend 's mom 's wife 's teacher 's dentist 's dentist 's daughter 's father 's cup is curious .
the box knows that your mother 's wife 's dad 's daughter 's son 's husband 's sister 's husband 's grandmother 's book is surprised .	the box works with your mother 's wife 's dad 's daughter 's son 's husband 's sister 's husband 's grandmother 's book is surprised .
the bag says that my husband 's mom 's father 's father 's father 's teacher 's doctor 's husband 's dad 's box is smart .	the bag helps my husband 's mom 's father 's father 's father 's teacher 's doctor 's husband 's dad 's box is smart .
the spoon thinks that your wife 's doctor 's dentist 's mother 's son 's cousin 's daughter 's mother 's cousin 's candle is angry .	the spoon talks to your wife 's doctor 's dentist 's mother 's son 's cousin 's daughter 's mother 's cousin 's candle is angry .
the car knows that your father 's son 's dad 's brother 's sister 's grandmother 's father 's father 's boss 's ring is surprised .	the car helps your father 's son 's dad 's brother 's sister 's grandmother 's father 's father 's boss 's ring is surprised .
the plate knows that your dad 's daughter 's boss 's daughter 's grandmother 's boss 's father 's wife 's husband 's book is tall .	the plate scares your dad 's daughter 's boss 's daughter 's grandmother 's boss 's father 's wife 's husband 's book is tall .
the hat knows that your father 's sister 's daughter 's dentist 's mother 's mom 's dentist 's boss 's son 's shoe is important .	the hat scares your father 's sister 's daughter 's dentist 's mother 's mom 's dentist 's boss 's son 's shoe is important .
the candle says that my grandmother 's friend 's sister 's son 's dad 's teacher 's son 's cousin 's teacher 's truck is friendly .	the candle talks to my grandmother 's friend 's sister 's son 's dad 's teacher 's son 's cousin 's teacher 's truck is friendly .
the doll says that your wife 's mother 's teacher 's friend 's friend 's dad 's father 's sister 's mother 's truck is happy .	the doll scares your wife 's mother 's teacher 's friend 's friend 's dad 's father 's sister 's mother 's truck is happy .
the rug thinks that my son 's daughter 's son 's son 's teacher 's husband 's father 's dad 's husband 's fork is gentle .	the rug helps my son 's daughter 's son 's son 's teacher 's husband 's father 's dad 's husband 's fork is gentle .
the car says that your sister 's daughter 's friend 's cousin 's wife 's doctor 's doctor 's teacher 's sister 's candle is angry .	the car works with your sister 's daughter 's friend 's cousin 's wife 's doctor 's doctor 's teacher 's sister 's candle is angry .
the bag thinks that my teacher 's father 's doctor 's dentist 's wife 's dentist 's wife 's son 's brother 's car is nice .	the bag scares my teacher 's father 's doctor 's dentist 's wife 's dentist 's wife 's son 's brother 's car is nice .
the bed thinks that my mom 's son 's boss 's sister 's dentist 's daughter 's wife 's teacher 's friend 's door is excited .	the bed works with my mom 's son 's boss 's sister 's dentist 's daughter 's wife 's teacher 's friend 's door is excited .
the bottle thinks that your grandmother 's boss 's wife 's sister 's daughter 's son 's dentist 's doctor 's brother 's toy is tired .	the bottle helps your grandmother 's boss 's wife 's sister 's daughter 's son 's dentist 's doctor 's brother 's toy is tired .
the box thinks that my son 's father 's mother 's son 's father 's sister 's brother 's brother 's boss 's shirt is helpful .	the box helps my son 's father 's mother 's son 's father 's sister 's brother 's brother 's boss 's shirt is helpful .
the truck thinks that your brother 's dad 's son 's son 's cousin 's dentist 's husband 's dentist 's grandmother 's bed is friendly .	the truck talks to your brother 's dad 's son 's son 's cousin 's dentist 's husband 's dentist 's grandmother 's bed is friendly .
the toy knows that your son 's sister 's mother 's brother 's son 's husband 's friend 's wife 's grandmother 's ship is surprised .	the toy scares your son 's sister 's mother 's brother 's son 's husband 's friend 's wife 's grandmother 's ship is surprised .
the truck knows that my dad 's friend 's grandmother 's son 's teacher 's wife 's husband 's mother 's husband 's bowl is hungry .	the truck works with my dad 's friend 's grandmother 's son 's teacher 's wife 's husband 's mother 's husband 's bowl is hungry .
the rug knows that your wife 's doctor 's daughter 's friend 's sister 's doctor 's cousin 's mother 's father 's bottle is sleepy .	the rug scares your wife 's doctor 's daughter 's friend 's sister 's doctor 's cousin 's mother 's father 's bottle is sleepy .
the car says that my brother 's mother 's boss 's dad 's husband 's cousin 's husband 's daughter 's daughter 's picture is gentle .	the car helps my brother 's mother 's boss 's dad 's husband 's cousin 's husband 's daughter 's daughter 's picture is gentle .
the bicycle knows that your cousin 's wife 's father 's mother 's mom 's father 's friend 's husband 's sister 's bed is young .	the bicycle works with your cousin 's wife 's father 's mother 's mom 's father 's friend 's husband 's sister 's bed is young .
the book says that your brother 's teacher 's husband 's son 's daughter 's daughter 's cousin 's dentist 's father 's car is helpful .	the book helps your brother 's teacher 's husband 's son 's daughter 's daughter 's cousin 's dentist 's father 's car is helpful .
the picture thinks that your mother 's father 's son 's brother 's mom 's friend 's boss 's husband 's brother 's plane is excited .	the picture works with your mother 's father 's son 's brother 's mom 's friend 's boss 's husband 's brother 's plane is excited .
the boat knows that your father 's friend 's sister 's teacher 's mother 's dad 's dad 's wife 's teacher 's window is excited .	the boat talks to your father 's friend 's sister 's teacher 's mother 's dad 's dad 's wife 's teacher 's window is excited .
the car knows that my boss 's sister 's doctor 's dad 's son 's teacher 's dad 's teacher 's brother 's bed is surprised .	the car helps my boss 's sister 's doctor 's dad 's son 's teacher 's dad 's teacher 's brother 's bed is surprised .
the plate says that my boss 's son 's dad 's brother 's mom 's friend 's father 's son 's mom 's shirt is strong .	the plate scares my boss 's son 's dad 's brother 's mom 's friend 's father 's son 's mom 's shirt is strong .
the plane says that my mom 's friend 's cousin 's doctor 's grandmother 's son 's daughter 's dentist 's mother 's bed is boring .	the plane talks to my mom 's friend 's cousin 's doctor 's grandmother 's son 's daughter 's dentist 's mother 's bed is boring .
the car thinks that my teacher 's mother 's son 's dentist 's doctor 's doctor 's brother 's husband 's teacher 's cup is hungry .	the car helps my teacher 's mother 's son 's dentist 's doctor 's doctor 's brother 's husband 's teacher 's cup is hungry .
the fork says that your dentist 's sister 's father 's friend 's cousin 's doctor 's sister 's dad 's husband 's bottle is boring .	the fork talks to your dentist 's sister 's father 's friend 's cousin 's doctor 's sister 's dad 's husband 's bottle is boring .
the candle knows that your grandmother 's friend 's daughter 's teacher 's sister 's mother 's mother 's boss 's teacher 's plate is upset .	the candle talks to your grandmother 's friend 's daughter 's teacher 's sister 's mother 's mother 's boss 's teacher 's plate is upset .
the chair says that my wife 's daughter 's mother 's boss 's mother 's cousin 's dad 's brother 's cousin 's bed is strong .	the chair works with my wife 's daughter 's mother 's boss 's mother 's cousin 's dad 's brother 's cousin 's bed is strong .
the bed says that your grandmother 's son 's cousin 's daughter 's sister 's teacher 's mother 's friend 's wife 's plate is strong .	the bed helps your grandmother 's son 's cousin 's daughter 's sister 's teacher 's mother 's friend 's wife 's plate is strong .
the fork thinks that my teacher 's wife 's boss 's boss 's father 's grandmother 's boss 's mother 's grandmother 's candle is tall .	the fork helps my teacher 's wife 's boss 's boss 's father 's grandmother 's boss 's mother 's grandmother 's candle is tall .
the doll says that my father 's dad 's father 's doctor 's mom 's mom 's sister 's dad 's boss 's rug is smart .	the doll helps my father 's dad 's father 's doctor 's mom 's mom 's sister 's dad 's boss 's rug is smart .
the glass says that my sister 's sister 's friend 's wife 's father 's daughter 's father 's husband 's husband 's candle is boring .	the glass helps my sister 's sister 's friend 's wife 's father 's daughter 's father 's husband 's husband 's candle is boring .
the spoon knows that your wife 's son 's brother 's wife 's friend 's sister 's brother 's father 's boss 's window is smart .	the spoon works with your wife 's son 's brother 's wife 's friend 's sister 's brother 's father 's boss 's window is smart .
the ship thinks that my dad 's mother 's daughter 's boss 's husband 's mom 's dad 's grandmother 's husband 's book is bored .	the ship helps my dad 's mother 's daughter 's boss 's husband 's mom 's dad 's grandmother 's husband 's book is bored .
the doll says that my boss 's mother 's father 's grandmother 's husband 's mom 's teacher 's dentist 's wife 's mirror is healthy .	the doll helps my boss 's mother 's father 's grandmother 's husband 's mom 's teacher 's dentist 's wife 's mirror is healthy .
the candle thinks that my cousin 's teacher 's mother 's mom 's husband 's teacher 's wife 's grandmother 's mother 's door is friendly .	the candle scares my cousin 's teacher 's mother 's mom 's husband 's teacher 's wife 's grandmother 's mother 's door is friendly .
the shoe says that your brother 's cousin 's father 's wife 's boss 's mom 's brother 's mother 's friend 's shoe is quiet .	the shoe talks to your brother 's cousin 's father 's wife 's boss 's mom 's brother 's mother 's friend 's shoe is quiet .
the car thinks that your sister 's daughter 's cousin 's sister 's mom 's husband 's son 's sister 's wife 's boat is gentle .	the car scares your sister 's daughter 's cousin 's sister 's mom 's husband 's son 's sister 's wife 's boat is gentle .
the door says that my teacher 's sister 's wife 's dad 's husband 's mother 's husband 's doctor 's friend 's glass is tall .	the door scares my teacher 's sister 's wife 's dad 's husband 's mother 's husband 's doctor 's friend 's glass is tall .
the plane knows that your cousin 's daughter 's sister 's boss 's sister 's friend 's friend 's mother 's sister 's spoon is careful .	the plane scares your cousin 's daughter 's sister 's boss 's sister 's friend 's friend 's mother 's sister 's spoon is careful .
the ship says that my doctor 's son 's cousin 's daughter 's cousin 's dad 's father 's boss 's mom 's bed is smart .	the ship works with my doctor 's son 's cousin 's daughter 's cousin 's dad 's father 's boss 's mom 's bed is smart .
the bag knows that my brother 's daughter 's mother 's friend 's cousin 's father 's doctor 's cousin 's mother 's couch is young .	the bag works with my brother 's daughter 's mother 's friend 's cousin 's father 's doctor 's cousin 's mother 's couch is young .
the bowl knows that your teacher 's doctor 's sister 's teacher 's mom 's mom 's mother 's doctor 's dad 's rug is confused .	the bowl talks to your teacher 's doctor 's sister 's teacher 's mom 's mom 's mother 's doctor 's dad 's rug is confused .
the bed thinks that your doctor 's grandmother 's husband 's boss 's dentist 's brother 's dad 's wife 's dad 's boat is kind .	the bed helps your doctor 's grandmother 's husband 's boss 's dentist 's brother 's dad 's wife 's dad 's boat is kind .
the car thinks that your boss 's brother 's daughter 's brother 's dad 's cousin 's doctor 's boss 's dentist 's chair is helpful .	the car scares your boss 's brother 's daughter 's brother 's dad 's cousin 's doctor 's boss 's dentist 's chair is helpful .
the bicycle thinks that your dad 's grandmother 's dad 's friend 's father 's husband 's brother 's husband 's cousin 's car is lucky .	the bicycle talks to your dad 's grandmother 's dad 's friend 's father 's husband 's brother 's husband 's cousin 's car is lucky .
the fork knows that your sister 's doctor 's cousin 's doctor 's wife 's teacher 's daughter 's dad 's son 's book is friendly .	the fork works with your sister 's doctor 's cousin 's doctor 's wife 's teacher 's daughter 's dad 's son 's book is friendly .
the truck says that your friend 's husband 's dentist 's mother 's grandmother 's father 's sister 's father 's son 's fork is boring .	the truck talks to your friend 's husband 's dentist 's mother 's grandmother 's father 's sister 's father 's son 's fork is boring .
the hat thinks that your teacher 's son 's daughter 's sister 's wife 's brother 's dad 's brother 's sister 's car is tired .	the hat works with your teacher 's son 's daughter 's sister 's wife 's brother 's dad 's brother 's sister 's car is tired .
the candle thinks that my friend 's dentist 's sister 's sister 's brother 's daughter 's brother 's son 's dad 's candle is kind .	the candle works with my friend 's dentist 's sister 's sister 's brother 's daughter 's brother 's son 's dad 's candle is kind .
the door thinks that your sister 's husband 's doctor 's boss 's doctor 's mom 's boss 's grandmother 's friend 's book is strong .	the door talks to your sister 's husband 's doctor 's boss 's doctor 's mom 's boss 's grandmother 's friend 's book is strong .
the car thinks that your teacher 's teacher 's dentist 's teacher 's mom 's teacher 's mother 's cousin 's dentist 's picture is healthy .	the car works with your teacher 's teacher 's dentist 's teacher 's mom 's teacher 's mother 's cousin 's dentist 's picture is healthy .
the bowl thinks that your daughter 's mother 's teacher 's sister 's boss 's husband 's husband 's friend 's wife 's mirror is important .	the bowl works with your daughter 's mother 's teacher 's sister 's boss 's husband 's husband 's friend 's wife 's mirror is important .
the chair knows that my brother 's boss 's boss 's brother 's dentist 's teacher 's teacher 's cousin 's doctor 's bowl is smart .	the chair talks to my brother 's boss 's boss 's brother 's dentist 's teacher 's teacher 's cousin 's doctor 's bowl is smart .
the crayon thinks that your son 's dentist 's son 's dentist 's brother 's son 's wife 's dad 's dentist 's book is upset .	the crayon talks to your son 's dentist 's son 's dentist 's brother 's son 's wife 's dad 's dentist 's book is upset .
the book says that my cousin 's teacher 's sister 's teacher 's sister 's friend 's mom 's grandmother 's doctor 's mirror is healthy .	the book scares my cousin 's teacher 's sister 's teacher 's sister 's friend 's mom 's grandmother 's doctor 's mirror is healthy .
the bottle knows that your son 's wife 's doctor 's brother 's doctor 's son 's doctor 's doctor 's cousin 's mirror is surprised .	the bottle scares your son 's wife 's doctor 's brother 's doctor 's son 's doctor 's doctor 's cousin 's mirror is surprised .
the rocket knows that your wife 's mom 's son 's dentist 's brother 's cousin 's cousin 's mother 's dentist 's bag is boring .	the rocket works with your wife 's mom 's son 's dentist 's brother 's cousin 's cousin 's mother 's dentist 's bag is boring .
the cup thinks that your mother 's grandmother 's wife 's boss 's son 's cousin 's grandmother 's father 's dad 's dish is upset .	the cup works with your mother 's grandmother 's wife 's boss 's son 's cousin 's grandmother 's father 's dad 's dish is upset .
the dish thinks that your father 's mom 's mother 's teacher 's brother 's dad 's boss 's grandmother 's husband 's car is sleepy .	the dish talks to your father 's mom 's mother 's teacher 's brother 's dad 's boss 's grandmother 's husband 's car is sleepy .
the bed thinks that my sister 's teacher 's friend 's father 's grandmother 's son 's husband 's friend 's wife 's bicycle is busy .	the bed works with my sister 's teacher 's friend 's father 's grandmother 's son 's husband 's friend 's wife 's bicycle is busy .
the bowl knows that your teacher 's sister 's dad 's teacher 's friend 's mom 's boss 's mom 's friend 's bottle is quiet .	the bowl helps your teacher 's sister 's dad 's teacher 's friend 's mom 's boss 's mom 's friend 's bottle is quiet .
the dish thinks that my doctor 's wife 's doctor 's mother 's cousin 's son 's mom 's daughter 's teacher 's book is healthy .	the dish talks to my doctor 's wife 's doctor 's mother 's cousin 's son 's mom 's daughter 's teacher 's book is healthy .
the plate thinks that your teacher 's cousin 's cousin 's cousin 's friend 's dentist 's dentist 's sister 's dentist 's ring is clever .	the plate talks to your teacher 's cousin 's cousin 's cousin 's friend 's dentist 's dentist 's sister 's dentist 's ring is clever .
the shoe says that your father 's wife 's grandmother 's mom 's dentist 's grandmother 's grandmother 's brother 's dentist 's chair is kind .	the shoe scares your father 's wife 's grandmother 's mom 's dentist 's grandmother 's grandmother 's brother 's dentist 's chair is kind .
the cup says that your son 's brother 's brother 's dad 's dad 's father 's mother 's mother 's daughter 's truck is kind .	the cup talks to your son 's brother 's brother 's dad 's dad 's father 's mother 's mother 's daughter 's truck is kind .
the rocket says that my teacher 's brother 's grandmother 's son 's brother 's daughter 's teacher 's dentist 's dad 's ship is sleepy .	the rocket scares my teacher 's brother 's grandmother 's son 's brother 's daughter 's teacher 's dentist 's dad 's ship is sleepy .
the cup thinks that your mother 's brother 's cousin 's wife 's friend 's brother 's friend 's dad 's son 's crayon is quiet .	the cup talks to your mother 's brother 's cousin 's wife 's friend 's brother 's friend 's dad 's son 's crayon is quiet .
the ship knows that my son 's daughter 's daughter 's father 's boss 's dentist 's grandmother 's daughter 's boss 's bicycle is busy .	the ship talks to my son 's daughter 's daughter 's father 's boss 's dentist 's grandmother 's daughter 's boss 's bicycle is busy .
the doll thinks that my dentist 's mother 's sister 's dentist 's grandmother 's mother 's mom 's friend 's doctor 's ring is careful .	the doll talks to my dentist 's mother 's sister 's dentist 's grandmother 's mother 's mom 's friend 's doctor 's ring is careful .
the shirt knows that your grandmother 's father 's friend 's mom 's teacher 's mom 's brother 's cousin 's teacher 's shoe is nice .	the shirt scares your grandmother 's father 's friend 's mom 's teacher 's mom 's brother 's cousin 's teacher 's shoe is nice .
the picture knows that your teacher 's dad 's daughter 's mother 's wife 's father 's mom 's son 's dentist 's bed is surprised .	the picture talks to your teacher 's dad 's daughter 's mother 's wife 's father 's mom 's son 's dentist 's bed is surprised .
the door says that my mom 's sister 's grandmother 's boss 's son 's mom 's boss 's doctor 's daughter 's mirror is young .	the door helps my mom 's sister 's grandmother 's boss 's son 's mom 's boss 's doctor 's daughter 's mirror is young .
the shirt knows that my doctor 's father 's mother 's dentist 's dentist 's son 's daughter 's friend 's father 's chair is upset .	the shirt helps my doctor 's father 's mother 's dentist 's dentist 's son 's daughter 's friend 's father 's chair is upset .
the car says that my mother 's wife 's cousin 's teacher 's mother 's doctor 's father 's grandmother 's boss 's bag is excited .	the car scares my mother 's wife 's cousin 's teacher 's mother 's doctor 's father 's grandmother 's boss 's bag is excited .
the plane says that my mom 's daughter 's dentist 's husband 's teacher 's dad 's friend 's dad 's dentist 's dish is surprised .	the plane helps my mom 's daughter 's dentist 's husband 's teacher 's dad 's friend 's dad 's dentist 's dish is surprised .
the door says that my teacher 's boss 's wife 's friend 's dad 's dentist 's dad 's father 's mom 's boat is bored .	the door talks to my teacher 's boss 's wife 's friend 's dad 's dentist 's dad 's father 's mom 's boat is bored .
the doll thinks that my daughter 's sister 's friend 's mother 's doctor 's husband 's teacher 's brother 's brother 's glass is upset .	the doll scares my daughter 's sister 's friend 's mother 's doctor 's husband 's teacher 's brother 's brother 's glass is upset .
the bicycle thinks that your husband 's sister 's father 's son 's mom 's dad 's dad 's grandmother 's friend 's shirt is important .	the bicycle helps your husband 's sister 's father 's son 's mom 's dad 's dad 's grandmother 's friend 's shirt is important .
the spoon says that my teacher 's doctor 's mother 's daughter 's brother 's doctor 's boss 's cousin 's son 's bed is gentle .	the spoon talks to my teacher 's doctor 's mother 's daughter 's brother 's doctor 's boss 's cousin 's son 's bed is gentle .
the bed thinks that your sister 's husband 's wife 's sister 's mom 's friend 's dad 's daughter 's mom 's crayon is lucky .	the bed helps your sister 's husband 's wife 's sister 's mom 's friend 's dad 's daughter 's mom 's crayon is lucky .
the door knows that your husband 's son 's friend 's cousin 's boss 's boss 's cousin 's daughter 's boss 's ship is curious .	the door helps your husband 's son 's friend 's cousin 's boss 's boss 's cousin 's daughter 's boss 's ship is curious .
the car knows that your mother 's mom 's dentist 's sister 's doctor 's daughter 's mom 's cousin 's doctor 's hat is bored .	the car helps your mother 's mom 's dentist 's sister 's doctor 's daughter 's mom 's cousin 's doctor 's hat is bored .
the picture says that your dentist 's teacher 's boss 's dad 's teacher 's grandmother 's dad 's grandmother 's dad 's book is nice .	the picture scares your dentist 's teacher 's boss 's dad 's teacher 's grandmother 's dad 's grandmother 's dad 's book is nice .
the button thinks that your father 's sister 's mother 's brother 's brother 's dentist 's son 's mom 's brother 's mirror is friendly .	the button scares your father 's sister 's mother 's brother 's brother 's dentist 's son 's mom 's brother 's mirror is friendly .
the boat says that my mom 's friend 's grandmother 's wife 's teacher 's mom 's friend 's father 's mom 's candle is curious .	the boat talks to my mom 's friend 's grandmother 's wife 's teacher 's mom 's friend 's father 's mom 's candle is curious .
the book says that your mother 's son 's husband 's friend 's wife 's brother 's friend 's brother 's son 's hat is curious .	the book works with your mother 's son 's husband 's friend 's wife 's brother 's friend 's brother 's son 's hat is curious .
the dish says that my son 's father 's husband 's boss 's teacher 's son 's doctor 's teacher 's friend 's car is important .	the dish scares my son 's father 's husband 's boss 's teacher 's son 's doctor 's teacher 's friend 's car is important .
the plane knows that your daughter 's mother 's son 's wife 's teacher 's daughter 's brother 's dentist 's dad 's truck is confused .	the plane works with your daughter 's mother 's son 's wife 's teacher 's daughter 's brother 's dentist 's dad 's truck is confused .
the crayon thinks that your daughter 's wife 's wife 's mom 's mom 's father 's husband 's husband 's cousin 's boat is upset .	the crayon talks to your daughter 's wife 's wife 's mom 's mom 's father 's husband 's husband 's cousin 's boat is upset .
the hat thinks that my dad 's friend 's grandmother 's mom 's teacher 's daughter 's daughter 's mom 's sister 's spoon is bored .	the hat talks to my dad 's friend 's grandmother 's mom 's teacher 's daughter 's daughter 's mom 's sister 's spoon is bored .
