the bag says that my friend 's husband 's dentist 's boss 's sister 's father 's boss 's book is wrong .	the bag works with my friend 's husband 's dentist 's boss 's sister 's father 's boss 's book is wrong .
the book says that your dad 's father 's wife 's teacher 's friend 's dentist 's boss 's bed is clever .	the book scares your dad 's father 's wife 's teacher 's friend 's dentist 's boss 's bed is clever .
the candle thinks that my husband 's teacher 's dad 's husband 's dad 's brother 's dentist 's rocket is quiet .	the candle talks to my husband 's teacher 's dad 's husband 's dad 's brother 's dentist 's rocket is quiet .
the cup thinks that my mother 's boss 's friend 's daughter 's daughter 's mom 's boss 's button is kind .	the cup scares my mother 's boss 's friend 's daughter 's daughter 's mom 's boss 's button is kind .
the book says that your father 's husband 's mom 's mom 's mother 's boss 's sister 's shirt is busy .	the book works with your father 's husband 's mom 's mom 's mother 's boss 's sister 's shirt is busy .
the shirt says that my doctor 's husband 's son 's husband 's friend 's dentist 's sister 's window is nice .	the shirt works with my doctor 's husband 's son 's husband 's friend 's dentist 's sister 's window is nice .
the rocket knows that your father 's sister 's teacher 's teacher 's daughter 's brother 's wife 's candle is lucky .	the rocket talks to your father 's sister 's teacher 's teacher 's daughter 's brother 's wife 's candle is lucky .
the ring thinks that your grandmother 's grandmother 's daughter 's dad 's wife 's cousin 's grandmother 's button is clever .	the ring scares your grandmother 's grandmother 's daughter 's dad 's wife 's cousin 's grandmother 's button is clever .
the truck thinks that my grandmother 's grandmother 's boss 's husband 's husband 's mother 's father 's car is quiet .	the truck helps my grandmother 's grandmother 's boss 's husband 's husband 's mother 's father 's car is quiet .
the plate knows that your son 's father 's teacher 's wife 's father 's sister 's dad 's fork is strong .	the plate works with your son 's father 's teacher 's wife 's father 's sister 's dad 's fork is strong .
the glass thinks that my friend 's daughter 's dentist 's father 's dentist 's dad 's dad 's cup is healthy .	the glass works with my friend 's daughter 's dentist 's father 's dentist 's dad 's dad 's cup is healthy .
the bed thinks that your brother 's mom 's cousin 's son 's son 's daughter 's sister 's toy is surprised .	the bed helps your brother 's mom 's cousin 's son 's son 's daughter 's sister 's toy is surprised .
the car knows that my son 's husband 's wife 's teacher 's friend 's son 's doctor 's spoon is confused .	the car works with my son 's husband 's wife 's teacher 's friend 's son 's doctor 's spoon is confused .
the picture thinks that your brother 's daughter 's cousin 's husband 's grandmother 's husband 's grandmother 's rocket is quiet .	the picture talks to your brother 's daughter 's cousin 's husband 's grandmother 's husband 's grandmother 's rocket is quiet .
the bicycle says that your daughter 's sister 's son 's father 's dentist 's mom 's brother 's cup is upset .	the bicycle talks to your daughter 's sister 's son 's father 's dentist 's mom 's brother 's cup is upset .
the ship knows that my mother 's husband 's cousin 's boss 's mom 's wife 's father 's ring is clever .	the ship scares my mother 's husband 's cousin 's boss 's mom 's wife 's father 's ring is clever .
the bottle thinks that your boss 's teacher 's father 's boss 's brother 's wife 's doctor 's rocket is bored .	the bottle helps your boss 's teacher 's father 's boss 's brother 's wife 's doctor 's rocket is bored .
the car knows that your daughter 's mom 's wife 's dentist 's mother 's wife 's husband 's dish is curious .	the car talks to your daughter 's mom 's wife 's dentist 's mother 's wife 's husband 's dish is curious .
the book knows that my boss 's doctor 's husband 's cousin 's doctor 's father 's daughter 's picture is angry .	the book scares my boss 's doctor 's husband 's cousin 's doctor 's father 's daughter 's picture is angry .
the ship knows that my dentist 's son 's grandmother 's dad 's wife 's doctor 's husband 's mirror is happy .	the ship scares my dentist 's son 's grandmother 's dad 's wife 's doctor 's husband 's mirror is happy .
the chair thinks that your son 's father 's mom 's dentist 's teacher 's father 's mother 's cup is happy .	the chair talks to your son 's father 's mom 's dentist 's teacher 's father 's mother 's cup is happy .
the bicycle says that my wife 's boss 's brother 's friend 's daughter 's grandmother 's teacher 's plate is young .	the bicycle works with my wife 's boss 's brother 's friend 's daughter 's grandmother 's teacher 's plate is young .
the truck knows that my dentist 's father 's dentist 's sister 's mom 's grandmother 's brother 's bottle is happy .	the truck scares my dentist 's father 's dentist 's sister 's mom 's grandmother 's brother 's bottle is happy .
the picture thinks that my grandmother 's husband 's teacher 's teacher 's doctor 's son 's brother 's plate is quiet .	the picture works with my grandmother 's husband 's teacher 's teacher 's doctor 's son 's brother 's plate is quiet .
the fork knows that my friend 's father 's wife 's cousin 's cousin 's friend 's doctor 's rug is quiet .	the fork talks to my friend 's father 's wife 's cousin 's cousin 's friend 's doctor 's rug is quiet .
the book thinks that my brother 's daughter 's sister 's daughter 's doctor 's teacher 's dentist 's dish is bored .	the book talks to my brother 's daughter 's sister 's daughter 's doctor 's teacher 's dentist 's dish is bored .
the ship says that my teacher 's cousin 's dentist 's sister 's wife 's grandmother 's mother 's fork is upset .	the ship talks to my teacher 's cousin 's dentist 's sister 's wife 's grandmother 's mother 's fork is upset .
the rug knows that my daughter 's mom 's friend 's friend 's husband 's dad 's boss 's dish is healthy .	the rug helps my daughter 's mom 's friend 's friend 's husband 's dad 's boss 's dish is healthy .
the car thinks that my doctor 's daughter 's grandmother 's husband 's sister 's grandmother 's mother 's rug is healthy .	the car helps my doctor 's daughter 's grandmother 's husband 's sister 's grandmother 's mother 's rug is healthy .
the crayon says that your mother 's mother 's dentist 's grandmother 's daughter 's teacher 's daughter 's ship is surprised .	the crayon talks to your mother 's mother 's dentist 's grandmother 's daughter 's teacher 's daughter 's ship is surprised .
the bed knows that my mom 's cousin 's teacher 's boss 's boss 's friend 's friend 's car is clever .	the bed talks to my mom 's cousin 's teacher 's boss 's boss 's friend 's friend 's car is clever .
the couch thinks that my dad 's boss 's father 's sister 's son 's cousin 's sister 's ship is tired .	the couch works with my dad 's boss 's father 's sister 's son 's cousin 's sister 's ship is tired .
the mirror knows that your cousin 's mom 's dentist 's boss 's wife 's doctor 's dentist 's book is wrong .	the mirror talks to your cousin 's mom 's dentist 's boss 's wife 's doctor 's dentist 's book is wrong .
the cup knows that your brother 's boss 's teacher 's friend 's son 's father 's father 's doll is lucky .	the cup works with your brother 's boss 's teacher 's friend 's son 's father 's father 's doll is lucky .
the crayon says that my teacher 's cousin 's cousin 's doctor 's doctor 's mother 's mother 's picture is kind .	the crayon helps my teacher 's cousin 's cousin 's doctor 's doctor 's mother 's mother 's picture is kind .
the bowl thinks that your grandmother 's doctor 's boss 's sister 's friend 's wife 's boss 's window is kind .	the bowl helps your grandmother 's doctor 's boss 's sister 's friend 's wife 's boss 's window is kind .
the boat thinks that your mom 's mother 's sister 's husband 's boss 's father 's sister 's bed is angry .	the boat scares your mom 's mother 's sister 's husband 's boss 's father 's sister 's bed is angry .
the glass knows that my boss 's daughter 's doctor 's brother 's brother 's mom 's mother 's window is strong .	the glass works with my boss 's daughter 's doctor 's brother 's brother 's mom 's mother 's window is strong .
the plate thinks that your mother 's dad 's cousin 's boss 's dentist 's cousin 's teacher 's crayon is careful .	the plate scares your mother 's dad 's cousin 's boss 's dentist 's cousin 's teacher 's crayon is careful .
the shoe knows that your dentist 's mom 's son 's brother 's grandmother 's son 's dentist 's picture is important .	the shoe talks to your dentist 's mom 's son 's brother 's grandmother 's son 's dentist 's picture is important .
the car knows that my friend 's cousin 's mother 's dad 's wife 's friend 's grandmother 's rug is excited .	the car works with my friend 's cousin 's mother 's dad 's wife 's friend 's grandmother 's rug is excited .
the doll says that your friend 's doctor 's doctor 's teacher 's dad 's cousin 's brother 's button is excited .	the doll talks to your friend 's doctor 's doctor 's teacher 's dad 's cousin 's brother 's button is excited .
the spoon says that my cousin 's friend 's wife 's boss 's husband 's son 's teacher 's spoon is excited .	the spoon works with my cousin 's friend 's wife 's boss 's husband 's son 's teacher 's spoon is excited .
the toy says that my wife 's teacher 's husband 's wife 's father 's friend 's mom 's crayon is boring .	the toy works with my wife 's teacher 's husband 's wife 's father 's friend 's mom 's crayon is boring .
the plane says that your wife 's cousin 's cousin 's brother 's father 's dad 's grandmother 's box is helpful .	the plane works with your wife 's cousin 's cousin 's brother 's father 's dad 's grandmother 's box is helpful .
the bed knows that my brother 's brother 's boss 's friend 's mother 's teacher 's friend 's car is tired .	the bed works with my brother 's brother 's boss 's friend 's mother 's teacher 's friend 's car is tired .
the fork says that my cousin 's wife 's teacher 's brother 's sister 's son 's wife 's plane is nice .	the fork works with my cousin 's wife 's teacher 's brother 's sister 's son 's wife 's plane is nice .
the chair says that my friend 's dentist 's husband 's daughter 's dentist 's boss 's husband 's plane is hungry .	the chair scares my friend 's dentist 's husband 's daughter 's dentist 's boss 's husband 's plane is hungry .
the book says that my cousin 's doctor 's father 's dentist 's friend 's mother 's daughter 's book is boring .	the book helps my cousin 's doctor 's father 's dentist 's friend 's mother 's daughter 's book is boring .
the window knows that my mom 's friend 's cousin 's teacher 's wife 's wife 's mom 's ship is confused .	the window works with my mom 's friend 's cousin 's teacher 's wife 's wife 's mom 's ship is confused .
the shoe says that my daughter 's dentist 's brother 's grandmother 's daughter 's son 's mom 's shoe is important .	the shoe helps my daughter 's dentist 's brother 's grandmother 's daughter 's son 's mom 's shoe is important .
the book says that your teacher 's daughter 's husband 's son 's mother 's doctor 's son 's window is lucky .	the book works with your teacher 's daughter 's husband 's son 's mother 's doctor 's son 's window is lucky .
the dish says that my husband 's boss 's husband 's teacher 's cousin 's friend 's grandmother 's bicycle is important .	the dish helps my husband 's boss 's husband 's teacher 's cousin 's friend 's grandmother 's bicycle is important .
the rocket knows that my teacher 's son 's wife 's dentist 's mother 's husband 's son 's doll is smart .	the rocket works with my teacher 's son 's wife 's dentist 's mother 's husband 's son 's doll is smart .
the book knows that your teacher 's sister 's cousin 's dentist 's husband 's son 's husband 's shirt is hungry .	the book scares your teacher 's sister 's cousin 's dentist 's husband 's son 's husband 's shirt is hungry .
the doll knows that my friend 's husband 's mother 's cousin 's grandmother 's mom 's dad 's book is gentle .	the doll works with my friend 's husband 's mother 's cousin 's grandmother 's mom 's dad 's book is gentle .
the rug thinks that my father 's brother 's mom 's father 's friend 's sister 's dentist 's truck is important .	the rug helps my father 's brother 's mom 's father 's friend 's sister 's dentist 's truck is important .
the plate says that your daughter 's dentist 's son 's husband 's son 's son 's daughter 's truck is nice .	the plate talks to your daughter 's dentist 's son 's husband 's son 's son 's daughter 's truck is nice .
the ship says that your friend 's wife 's husband 's mother 's cousin 's daughter 's daughter 's shoe is curious .	the ship talks to your friend 's wife 's husband 's mother 's cousin 's daughter 's daughter 's shoe is curious .
the bag says that your husband 's cousin 's cousin 's dentist 's grandmother 's brother 's sister 's boat is clever .	the bag helps your husband 's cousin 's cousin 's dentist 's grandmother 's brother 's sister 's boat is clever .
the couch knows that my father 's mother 's teacher 's sister 's dentist 's friend 's dentist 's shoe is angry .	the couch talks to my father 's mother 's teacher 's sister 's dentist 's friend 's dentist 's shoe is angry .
the plate knows that your mom 's sister 's teacher 's boss 's mom 's dad 's boss 's doll is careful .	the plate talks to your mom 's sister 's teacher 's boss 's mom 's dad 's boss 's doll is careful .
the chair thinks that my friend 's friend 's daughter 's mom 's grandmother 's mom 's mother 's bowl is kind .	the chair works with my friend 's friend 's daughter 's mom 's grandmother 's mom 's mother 's bowl is kind .
the button says that your boss 's son 's dad 's brother 's friend 's daughter 's brother 's bicycle is kind .	the button works with your boss 's son 's dad 's brother 's friend 's daughter 's brother 's bicycle is kind .
the ship knows that my brother 's daughter 's friend 's father 's friend 's daughter 's dad 's ring is happy .	the ship scares my brother 's daughter 's friend 's father 's friend 's daughter 's dad 's ring is happy .
the mirror knows that my grandmother 's wife 's mom 's cousin 's dad 's cousin 's father 's truck is tired .	the mirror scares my grandmother 's wife 's mom 's cousin 's dad 's cousin 's father 's truck is tired .
the couch knows that your wife 's cousin 's brother 's cousin 's mother 's boss 's husband 's mirror is sleepy .	the couch helps your wife 's cousin 's brother 's cousin 's mother 's boss 's husband 's mirror is sleepy .
the book knows that my doctor 's teacher 's sister 's grandmother 's brother 's wife 's cousin 's candle is helpful .	the book talks to my doctor 's teacher 's sister 's grandmother 's brother 's wife 's cousin 's candle is helpful .
the cup says that my dentist 's son 's teacher 's friend 's son 's cousin 's husband 's couch is hungry .	the cup helps my dentist 's son 's teacher 's friend 's son 's cousin 's husband 's couch is hungry .
the button knows that your mom 's grandmother 's boss 's mother 's cousin 's cousin 's teacher 's car is hungry .	the button scares your mom 's grandmother 's boss 's mother 's cousin 's cousin 's teacher 's car is hungry .
the spoon thinks that your dad 's daughter 's friend 's boss 's friend 's mother 's daughter 's door is angry .	the spoon works with your dad 's daughter 's friend 's boss 's friend 's mother 's daughter 's door is angry .
the toy knows that your doctor 's father 's mom 's grandmother 's mom 's sister 's son 's shoe is tired .	the toy works with your doctor 's father 's mom 's grandmother 's mom 's sister 's son 's shoe is tired .
the plane thinks that my father 's son 's mother 's daughter 's grandmother 's father 's mom 's ring is surprised .	the plane helps my father 's son 's mother 's daughter 's grandmother 's father 's mom 's ring is surprised .
the rocket knows that my boss 's doctor 's dad 's mom 's sister 's son 's dentist 's dish is tall .	the rocket helps my boss 's doctor 's dad 's mom 's sister 's son 's dentist 's dish is tall .
the glass says that your boss 's wife 's grandmother 's dentist 's friend 's doctor 's mother 's book is strong .	the glass talks to your boss 's wife 's grandmother 's dentist 's friend 's doctor 's mother 's book is strong .
the car says that your friend 's father 's daughter 's mom 's husband 's daughter 's brother 's doll is lucky .	the car scares your friend 's father 's daughter 's mom 's husband 's daughter 's brother 's doll is lucky .
the dish knows that my wife 's father 's husband 's mother 's brother 's cousin 's son 's bowl is tall .	the dish scares my wife 's father 's husband 's mother 's brother 's cousin 's son 's bowl is tall .
the dish knows that your son 's daughter 's husband 's brother 's dentist 's son 's cousin 's plane is hungry .	the dish works with your son 's daughter 's husband 's brother 's dentist 's son 's cousin 's plane is hungry .
the plane says that my cousin 's brother 's sister 's daughter 's dad 's daughter 's husband 's crayon is strong .	the plane works with my cousin 's brother 's sister 's daughter 's dad 's daughter 's husband 's crayon is strong .
the mirror knows that your father 's brother 's husband 's mother 's mother 's wife 's son 's spoon is tall .	the mirror scares your father 's brother 's husband 's mother 's mother 's wife 's son 's spoon is tall .
the dish knows that my sister 's doctor 's wife 's father 's boss 's boss 's husband 's ship is surprised .	the dish scares my sister 's doctor 's wife 's father 's boss 's boss 's husband 's ship is surprised .
the plate says that my doctor 's dad 's mother 's doctor 's grandmother 's dad 's grandmother 's cup is tall .	the plate helps my doctor 's dad 's mother 's doctor 's grandmother 's dad 's grandmother 's cup is tall .
the bicycle knows that your cousin 's friend 's mom 's wife 's daughter 's grandmother 's doctor 's door is bored .	the bicycle helps your cousin 's friend 's mom 's wife 's daughter 's grandmother 's doctor 's door is bored .
the toy knows that my friend 's sister 's teacher 's cousin 's husband 's brother 's dentist 's book is tall .	the toy works with my friend 's sister 's teacher 's cousin 's husband 's brother 's dentist 's book is tall .
the shirt knows that my brother 's teacher 's son 's father 's grandmother 's brother 's friend 's shoe is excited .	the shirt talks to my brother 's teacher 's son 's father 's grandmother 's brother 's friend 's shoe is excited .
the fork says that your mom 's brother 's daughter 's grandmother 's husband 's teacher 's boss 's picture is excited .	the fork works with your mom 's brother 's daughter 's grandmother 's husband 's teacher 's boss 's picture is excited .
the button knows that my brother 's grandmother 's husband 's dad 's mother 's doctor 's mom 's box is friendly .	the button scares my brother 's grandmother 's husband 's dad 's mother 's doctor 's mom 's box is friendly .
the button says that your boss 's cousin 's dad 's teacher 's brother 's boss 's father 's boat is young .	the button scares your boss 's cousin 's dad 's teacher 's brother 's boss 's father 's boat is young .
the dish says that your wife 's father 's son 's dentist 's grandmother 's doctor 's husband 's button is important .	the dish works with your wife 's father 's son 's dentist 's grandmother 's doctor 's husband 's button is important .
the rug says that your wife 's grandmother 's grandmother 's son 's father 's dad 's boss 's fork is careful .	the rug talks to your wife 's grandmother 's grandmother 's son 's father 's dad 's boss 's fork is careful .
the car says that my brother 's wife 's mother 's grandmother 's sister 's mom 's son 's fork is careful .	the car scares my brother 's wife 's mother 's grandmother 's sister 's mom 's son 's fork is careful .
the book knows that your son 's brother 's friend 's father 's dentist 's mom 's father 's fork is tired .	the book helps your son 's brother 's friend 's father 's dentist 's mom 's father 's fork is tired .
the ring thinks that my doctor 's teacher 's wife 's teacher 's father 's wife 's father 's window is surprised .	the ring works with my doctor 's teacher 's wife 's teacher 's father 's wife 's father 's window is surprised .
the couch knows that my teacher 's dad 's cousin 's dentist 's teacher 's mother 's father 's door is healthy .	the couch helps my teacher 's dad 's cousin 's dentist 's teacher 's mother 's father 's door is healthy .
the book knows that my mom 's teacher 's teacher 's father 's sister 's dentist 's sister 's bottle is sleepy .	the book helps my mom 's teacher 's teacher 's father 's sister 's dentist 's sister 's bottle is sleepy .
the window thinks that your brother 's mom 's grandmother 's friend 's dad 's friend 's sister 's door is strong .	the window talks to your brother 's mom 's grandmother 's friend 's dad 's friend 's sister 's door is strong .
the rocket says that your dentist 's daughter 's friend 's cousin 's son 's mom 's dentist 's truck is wrong .	the rocket scares your dentist 's daughter 's friend 's cousin 's son 's mom 's dentist 's truck is wrong .
the chair says that your son 's dad 's teacher 's son 's brother 's cousin 's dad 's spoon is nice .	the chair works with your son 's dad 's teacher 's son 's brother 's cousin 's dad 's spoon is nice .
the box says that your sister 's teacher 's dentist 's wife 's teacher 's friend 's grandmother 's ship is young .	the box talks to your sister 's teacher 's dentist 's wife 's teacher 's friend 's grandmother 's ship is young .
the doll knows that your brother 's sister 's teacher 's teacher 's husband 's dentist 's grandmother 's bed is excited .	the doll talks to your brother 's sister 's teacher 's teacher 's husband 's dentist 's grandmother 's bed is excited .
the bed knows that my husband 's dentist 's boss 's friend 's son 's sister 's husband 's rug is tall .	the bed works with my husband 's dentist 's boss 's friend 's son 's sister 's husband 's rug is tall .
the shirt says that your boss 's brother 's dad 's grandmother 's mom 's dad 's doctor 's candle is tired .	the shirt talks to your boss 's brother 's dad 's grandmother 's mom 's dad 's doctor 's candle is tired .
the cup thinks that your friend 's husband 's teacher 's daughter 's daughter 's grandmother 's mother 's car is quiet .	the cup scares your friend 's husband 's teacher 's daughter 's daughter 's grandmother 's mother 's car is quiet .
the door knows that your husband 's mother 's father 's mother 's cousin 's husband 's boss 's shoe is wrong .	the door scares your husband 's mother 's father 's mother 's cousin 's husband 's boss 's shoe is wrong .
the bottle says that your dentist 's cousin 's cousin 's doctor 's sister 's wife 's son 's button is excited .	the bottle scares your dentist 's cousin 's cousin 's doctor 's sister 's wife 's son 's button is excited .
the rocket says that your son 's son 's cousin 's son 's friend 's husband 's daughter 's bag is curious .	the rocket works with your son 's son 's cousin 's son 's friend 's husband 's daughter 's bag is curious .
the boat says that my husband 's sister 's doctor 's cousin 's dad 's son 's mom 's box is busy .	the boat works with my husband 's sister 's doctor 's cousin 's dad 's son 's mom 's box is busy .
the ship knows that my daughter 's son 's wife 's daughter 's friend 's dentist 's mom 's bottle is curious .	the ship scares my daughter 's son 's wife 's daughter 's friend 's dentist 's mom 's bottle is curious .
the bottle thinks that my mom 's dentist 's husband 's cousin 's son 's sister 's husband 's book is tall .	the bottle works with my mom 's dentist 's husband 's cousin 's son 's sister 's husband 's book is tall .
the fork says that your dentist 's daughter 's teacher 's husband 's husband 's grandmother 's teacher 's shirt is tired .	the fork scares your dentist 's daughter 's teacher 's husband 's husband 's grandmother 's teacher 's shirt is tired .
the plate says that your son 's dentist 's friend 's friend 's mother 's husband 's boss 's rocket is helpful .	the plate scares your son 's dentist 's friend 's friend 's mother 's husband 's boss 's rocket is helpful .
the dish thinks that your boss 's doctor 's grandmother 's dentist 's mother 's dentist 's teacher 's hat is excited .	the dish talks to your boss 's doctor 's grandmother 's dentist 's mother 's dentist 's teacher 's hat is excited .
the spoon says that my teacher 's mom 's son 's brother 's husband 's brother 's dad 's shirt is boring .	the spoon talks to my teacher 's mom 's son 's brother 's husband 's brother 's dad 's shirt is boring .
the window knows that your dentist 's father 's mom 's cousin 's brother 's friend 's mom 's car is careful .	the window talks to your dentist 's father 's mom 's cousin 's brother 's friend 's mom 's car is careful .
the couch says that my wife 's father 's teacher 's doctor 's friend 's son 's father 's dish is important .	the couch talks to my wife 's father 's teacher 's doctor 's friend 's son 's father 's dish is important .
the bag says that your daughter 's grandmother 's mother 's wife 's grandmother 's brother 's wife 's truck is happy .	the bag works with your daughter 's grandmother 's mother 's wife 's grandmother 's brother 's wife 's truck is happy .
the ring thinks that my sister 's daughter 's boss 's wife 's father 's husband 's grandmother 's door is tall .	the ring helps my sister 's daughter 's boss 's wife 's father 's husband 's grandmother 's door is tall .
