Travis thinks that your friend 's cousin 's husband 's father 's doctor 's husband is upset .	Travis works with your friend 's cousin 's husband 's father 's doctor 's husband is upset .
Alice knows that your dad 's cousin 's grandmother 's mom 's mom 's grandmother is wrong .	Alice talks to your dad 's cousin 's grandmother 's mom 's mom 's grandmother is wrong .
Noah says that your teacher 's friend 's friend 's cousin 's husband 's sister is careful .	Noah works with your teacher 's friend 's friend 's cousin 's husband 's sister is careful .
Amy thinks that your boss 's mother 's mom 's son 's friend 's brother is nice .	Amy talks to your boss 's mother 's mom 's son 's friend 's brother is nice .
your cousin knows that your teacher 's husband 's husband 's husband 's sister 's mom is boring .	your cousin helps your teacher 's husband 's husband 's husband 's sister 's mom is boring .
the teacher thinks that my mother 's doctor 's grandmother 's boss 's grandmother 's brother is healthy .	the teacher talks to my mother 's doctor 's grandmother 's boss 's grandmother 's brother is healthy .
my teacher thinks that your son 's dad 's doctor 's mom 's friend 's boss is helpful .	my teacher helps your son 's dad 's doctor 's mom 's friend 's boss is helpful .
the person knows that my father 's dentist 's boss 's husband 's boss 's sister is nice .	the person talks to my father 's dentist 's boss 's husband 's boss 's sister is nice .
the dentist says that your mother 's brother 's husband 's daughter 's cousin 's dentist is important .	the dentist talks to your mother 's brother 's husband 's daughter 's cousin 's dentist is important .
the doctor knows that your brother 's grandmother 's mother 's son 's daughter 's dad is quiet .	the doctor talks to your brother 's grandmother 's mother 's son 's daughter 's dad is quiet .
the patient says that your father 's mother 's grandmother 's son 's father 's son is lucky .	the patient works with your father 's mother 's grandmother 's son 's father 's son is lucky .
Kevin says that your doctor 's mother 's cousin 's daughter 's dad 's dad is helpful .	Kevin helps your doctor 's mother 's cousin 's daughter 's dad 's dad is helpful .
Gregory says that your friend 's brother 's mom 's sister 's friend 's mom is curious .	Gregory scares your friend 's brother 's mom 's sister 's friend 's mom is curious .
your dentist thinks that your dentist 's dentist 's husband 's dentist 's cousin 's dad is sleepy .	your dentist helps your dentist 's dentist 's husband 's dentist 's cousin 's dad is sleepy .
my cousin knows that your teacher 's mom 's cousin 's doctor 's father 's husband is bored .	my cousin helps your teacher 's mom 's cousin 's doctor 's father 's husband is bored .
my teacher knows that your brother 's friend 's dentist 's friend 's cousin 's husband is helpful .	my teacher helps your brother 's friend 's dentist 's friend 's cousin 's husband is helpful .
my boss thinks that your son 's boss 's mother 's dentist 's teacher 's daughter is curious .	my boss works with your son 's boss 's mother 's dentist 's teacher 's daughter is curious .
your cousin knows that your son 's sister 's friend 's boss 's boss 's daughter is clever .	your cousin scares your son 's sister 's friend 's boss 's boss 's daughter is clever .
Renee knows that my cousin 's son 's dad 's brother 's dad 's daughter is bored .	Renee helps my cousin 's son 's dad 's brother 's dad 's daughter is bored .
the doctor knows that your boss 's dad 's friend 's mom 's doctor 's mom is sleepy .	the doctor talks to your boss 's dad 's friend 's mom 's doctor 's mom is sleepy .
your cousin knows that my husband 's wife 's brother 's cousin 's daughter 's friend is nice .	your cousin works with my husband 's wife 's brother 's cousin 's daughter 's friend is nice .
your boss says that your daughter 's grandmother 's brother 's mom 's sister 's wife is boring .	your boss talks to your daughter 's grandmother 's brother 's mom 's sister 's wife is boring .
my doctor knows that my mother 's teacher 's sister 's husband 's grandmother 's friend is tall .	my doctor scares my mother 's teacher 's sister 's husband 's grandmother 's friend is tall .
Judy says that my teacher 's friend 's mother 's teacher 's cousin 's brother is friendly .	Judy scares my teacher 's friend 's mother 's teacher 's cousin 's brother is friendly .
Noah thinks that your cousin 's daughter 's mother 's dentist 's father 's mother is bored .	Noah talks to your cousin 's daughter 's mother 's dentist 's father 's mother is bored .
the person says that my wife 's grandmother 's son 's doctor 's doctor 's daughter is clever .	the person scares my wife 's grandmother 's son 's doctor 's doctor 's daughter is clever .
Naomi thinks that your mother 's mother 's father 's dad 's wife 's father is sleepy .	Naomi scares your mother 's mother 's father 's dad 's wife 's father is sleepy .
the patient says that my mom 's friend 's dentist 's cousin 's father 's son is tall .	the patient helps my mom 's friend 's dentist 's cousin 's father 's son is tall .
the person thinks that my teacher 's mom 's doctor 's dentist 's grandmother 's dentist is wrong .	the person scares my teacher 's mom 's doctor 's dentist 's grandmother 's dentist is wrong .
Melissa knows that your dad 's doctor 's grandmother 's mother 's dentist 's grandmother is helpful .	Melissa works with your dad 's doctor 's grandmother 's mother 's dentist 's grandmother is helpful .
my boss thinks that my grandmother 's sister 's daughter 's husband 's sister 's mother is surprised .	my boss scares my grandmother 's sister 's daughter 's husband 's sister 's mother is surprised .
the customer thinks that your sister 's dentist 's grandmother 's dad 's dad 's daughter is bored .	the customer scares your sister 's dentist 's grandmother 's dad 's dad 's daughter is bored .
my cousin knows that your grandmother 's daughter 's friend 's son 's husband 's dentist is tired .	my cousin talks to your grandmother 's daughter 's friend 's son 's husband 's dentist is tired .
your friend knows that your sister 's grandmother 's brother 's sister 's doctor 's grandmother is tired .	your friend works with your sister 's grandmother 's brother 's sister 's doctor 's grandmother is tired .
Deborah knows that my father 's son 's father 's friend 's sister 's boss is upset .	Deborah scares my father 's son 's father 's friend 's sister 's boss is upset .
the teacher thinks that my brother 's son 's daughter 's doctor 's grandmother 's grandmother is tired .	the teacher talks to my brother 's son 's daughter 's doctor 's grandmother 's grandmother is tired .
the customer thinks that your grandmother 's dentist 's doctor 's wife 's sister 's dentist is lucky .	the customer helps your grandmother 's dentist 's doctor 's wife 's sister 's dentist is lucky .
your dentist says that my cousin 's husband 's cousin 's mom 's teacher 's mom is surprised .	your dentist helps my cousin 's husband 's cousin 's mom 's teacher 's mom is surprised .
your boss knows that my father 's cousin 's husband 's wife 's sister 's friend is smart .	your boss helps my father 's cousin 's husband 's wife 's sister 's friend is smart .
Naomi knows that my father 's son 's dad 's dad 's doctor 's son is sleepy .	Naomi works with my father 's son 's dad 's dad 's doctor 's son is sleepy .
the adult says that your husband 's friend 's son 's daughter 's brother 's daughter is tall .	the adult scares your husband 's friend 's son 's daughter 's brother 's daughter is tall .
Scott knows that your sister 's father 's son 's doctor 's son 's dentist is bored .	Scott works with your sister 's father 's son 's doctor 's son 's dentist is bored .
Travis says that your dentist 's wife 's brother 's sister 's brother 's teacher is strong .	Travis helps your dentist 's wife 's brother 's sister 's brother 's teacher is strong .
your doctor thinks that my dad 's brother 's daughter 's wife 's father 's son is curious .	your doctor scares my dad 's brother 's daughter 's wife 's father 's son is curious .
the doctor says that my mom 's wife 's dad 's friend 's dentist 's dad is upset .	the doctor works with my mom 's wife 's dad 's friend 's dentist 's dad is upset .
the doctor says that my daughter 's wife 's father 's mother 's friend 's son is careful .	the doctor talks to my daughter 's wife 's father 's mother 's friend 's son is careful .
your cousin knows that my friend 's wife 's sister 's wife 's grandmother 's husband is important .	your cousin scares my friend 's wife 's sister 's wife 's grandmother 's husband is important .
my boss thinks that my friend 's father 's doctor 's brother 's doctor 's teacher is confused .	my boss helps my friend 's father 's doctor 's brother 's doctor 's teacher is confused .
Kevin knows that your dad 's mom 's dad 's brother 's dentist 's doctor is wrong .	Kevin talks to your dad 's mom 's dad 's brother 's dentist 's doctor is wrong .
the patient knows that your husband 's father 's wife 's friend 's cousin 's son is upset .	the patient scares your husband 's father 's wife 's friend 's cousin 's son is upset .
my cousin thinks that my sister 's husband 's daughter 's dentist 's doctor 's friend is bored .	my cousin scares my sister 's husband 's daughter 's dentist 's doctor 's friend is bored .
the dancer thinks that my dad 's boss 's husband 's wife 's doctor 's mom is careful .	the dancer talks to my dad 's boss 's husband 's wife 's doctor 's mom is careful .
the adult says that your mom 's doctor 's dad 's dentist 's friend 's father is excited .	the adult talks to your mom 's doctor 's dad 's dentist 's friend 's father is excited .
your friend knows that my wife 's mother 's friend 's boss 's father 's wife is smart .	your friend talks to my wife 's mother 's friend 's boss 's father 's wife is smart .
the teacher thinks that my wife 's mom 's mom 's dad 's brother 's doctor is important .	the teacher works with my wife 's mom 's mom 's dad 's brother 's doctor is important .
my dentist thinks that my son 's mom 's teacher 's grandmother 's husband 's son is young .	my dentist helps my son 's mom 's teacher 's grandmother 's husband 's son is young .
the driver thinks that your brother 's father 's brother 's mother 's wife 's mom is hungry .	the driver talks to your brother 's father 's brother 's mother 's wife 's mom is hungry .
the patient says that your teacher 's sister 's cousin 's cousin 's mom 's grandmother is clever .	the patient works with your teacher 's sister 's cousin 's cousin 's mom 's grandmother is clever .
my boss knows that your grandmother 's dad 's wife 's husband 's cousin 's doctor is upset .	my boss scares your grandmother 's dad 's wife 's husband 's cousin 's doctor is upset .
the customer says that your mother 's dad 's mother 's doctor 's dentist 's dentist is happy .	the customer scares your mother 's dad 's mother 's doctor 's dentist 's dentist is happy .
the doctor thinks that your mom 's son 's dad 's father 's son 's son is tall .	the doctor works with your mom 's son 's dad 's father 's son 's son is tall .
the doctor says that your sister 's grandmother 's dad 's mom 's friend 's dad is happy .	the doctor helps your sister 's grandmother 's dad 's mom 's friend 's dad is happy .
the doctor knows that my daughter 's boss 's cousin 's dentist 's dentist 's friend is smart .	the doctor helps my daughter 's boss 's cousin 's dentist 's dentist 's friend is smart .
your dentist thinks that my dad 's cousin 's mom 's doctor 's brother 's boss is tall .	your dentist works with my dad 's cousin 's mom 's doctor 's brother 's boss is tall .
my cousin knows that my dad 's daughter 's daughter 's doctor 's mom 's cousin is confused .	my cousin helps my dad 's daughter 's daughter 's doctor 's mom 's cousin is confused .
your friend thinks that your boss 's mom 's doctor 's mom 's grandmother 's cousin is clever .	your friend talks to your boss 's mom 's doctor 's mom 's grandmother 's cousin is clever .
your doctor knows that my dentist 's husband 's wife 's doctor 's boss 's father is busy .	your doctor scares my dentist 's husband 's wife 's doctor 's boss 's father is busy .
the dentist knows that your cousin 's mother 's doctor 's friend 's father 's dentist is upset .	the dentist scares your cousin 's mother 's doctor 's friend 's father 's dentist is upset .
your teacher says that your mother 's dad 's teacher 's friend 's brother 's friend is gentle .	your teacher helps your mother 's dad 's teacher 's friend 's brother 's friend is gentle .
my teacher knows that my friend 's brother 's son 's mom 's mother 's son is quiet .	my teacher works with my friend 's brother 's son 's mom 's mother 's son is quiet .
Timothy thinks that your dad 's sister 's doctor 's friend 's son 's mom is lucky .	Timothy helps your dad 's sister 's doctor 's friend 's son 's mom is lucky .
your cousin knows that your sister 's father 's mom 's sister 's brother 's doctor is strong .	your cousin works with your sister 's father 's mom 's sister 's brother 's doctor is strong .
Sally thinks that your friend 's teacher 's boss 's cousin 's dad 's sister is upset .	Sally works with your friend 's teacher 's boss 's cousin 's dad 's sister is upset .
your doctor thinks that my brother 's daughter 's friend 's friend 's dentist 's friend is confused .	your doctor helps my brother 's daughter 's friend 's friend 's dentist 's friend is confused .
the patient thinks that my father 's son 's dad 's cousin 's teacher 's father is excited .	the patient works with my father 's son 's dad 's cousin 's teacher 's father is excited .
the driver thinks that your teacher 's cousin 's cousin 's mother 's cousin 's son is kind .	the driver helps your teacher 's cousin 's cousin 's mother 's cousin 's son is kind .
my teacher thinks that your husband 's father 's doctor 's brother 's doctor 's daughter is friendly .	my teacher works with your husband 's father 's doctor 's brother 's doctor 's daughter is friendly .
the person says that your daughter 's mom 's mother 's teacher 's son 's boss is quiet .	the person talks to your daughter 's mom 's mother 's teacher 's son 's boss is quiet .
the dentist knows that my dentist 's father 's grandmother 's cousin 's dad 's dad is strong .	the dentist helps my dentist 's father 's grandmother 's cousin 's dad 's dad is strong .
James says that your boss 's cousin 's friend 's father 's daughter 's dad is wrong .	James helps your boss 's cousin 's friend 's father 's daughter 's dad is wrong .
my cousin knows that your father 's son 's teacher 's son 's boss 's dad is busy .	my cousin works with your father 's son 's teacher 's son 's boss 's dad is busy .
Julia says that your mom 's brother 's grandmother 's husband 's boss 's brother is upset .	Julia helps your mom 's brother 's grandmother 's husband 's boss 's brother is upset .
Steven thinks that your wife 's father 's friend 's daughter 's mother 's grandmother is angry .	Steven talks to your wife 's father 's friend 's daughter 's mother 's grandmother is angry .
my teacher thinks that my doctor 's friend 's doctor 's husband 's doctor 's daughter is tall .	my teacher scares my doctor 's friend 's doctor 's husband 's doctor 's daughter is tall .
the patient knows that your friend 's grandmother 's teacher 's brother 's dad 's grandmother is busy .	the patient helps your friend 's grandmother 's teacher 's brother 's dad 's grandmother is busy .
your dentist thinks that your teacher 's cousin 's brother 's dentist 's husband 's mom is friendly .	your dentist scares your teacher 's cousin 's brother 's dentist 's husband 's mom is friendly .
your friend knows that my friend 's mom 's dad 's mom 's grandmother 's mother is smart .	your friend works with my friend 's mom 's dad 's mom 's grandmother 's mother is smart .
your doctor thinks that my wife 's mother 's dentist 's dad 's mom 's friend is bored .	your doctor works with my wife 's mother 's dentist 's dad 's mom 's friend is bored .
the driver says that your dad 's dentist 's husband 's doctor 's husband 's brother is surprised .	the driver talks to your dad 's dentist 's husband 's doctor 's husband 's brother is surprised .
Becca knows that my mom 's father 's sister 's friend 's teacher 's sister is smart .	Becca helps my mom 's father 's sister 's friend 's teacher 's sister is smart .
my boss says that my husband 's sister 's friend 's wife 's friend 's dentist is angry .	my boss talks to my husband 's sister 's friend 's wife 's friend 's dentist is angry .
the customer knows that your daughter 's daughter 's wife 's husband 's friend 's father is wrong .	the customer works with your daughter 's daughter 's wife 's husband 's friend 's father is wrong .
my doctor thinks that your daughter 's dentist 's cousin 's daughter 's boss 's husband is smart .	my doctor helps your daughter 's dentist 's cousin 's daughter 's boss 's husband is smart .
the customer thinks that my doctor 's sister 's dentist 's doctor 's father 's daughter is kind .	the customer works with my doctor 's sister 's dentist 's doctor 's father 's daughter is kind .
Catherine knows that your father 's daughter 's wife 's dentist 's wife 's dentist is important .	Catherine talks to your father 's daughter 's wife 's dentist 's wife 's dentist is important .
Amy thinks that my mother 's husband 's daughter 's daughter 's father 's dad is hungry .	Amy talks to my mother 's husband 's daughter 's daughter 's father 's dad is hungry .
Lisa knows that my son 's dentist 's dentist 's mom 's brother 's boss is bored .	Lisa talks to my son 's dentist 's dentist 's mom 's brother 's boss is bored .
Mary says that your boss 's dentist 's dad 's father 's boss 's dentist is important .	Mary talks to your boss 's dentist 's dad 's father 's boss 's dentist is important .
Alexander knows that your grandmother 's husband 's mother 's friend 's teacher 's teacher is excited .	Alexander scares your grandmother 's husband 's mother 's friend 's teacher 's teacher is excited .
Julia says that my brother 's son 's son 's dentist 's brother 's wife is careful .	Julia works with my brother 's son 's son 's dentist 's brother 's wife is careful .
your teacher thinks that my teacher 's father 's wife 's daughter 's friend 's dad is hungry .	your teacher works with my teacher 's father 's wife 's daughter 's friend 's dad is hungry .
the teacher thinks that your daughter 's dentist 's dad 's teacher 's husband 's grandmother is wrong .	the teacher helps your daughter 's dentist 's dad 's teacher 's husband 's grandmother is wrong .
Emily knows that your son 's sister 's son 's boss 's mom 's mom is friendly .	Emily works with your son 's sister 's son 's boss 's mom 's mom is friendly .
your dentist thinks that your grandmother 's son 's mom 's husband 's friend 's friend is boring .	your dentist works with your grandmother 's son 's mom 's husband 's friend 's friend is boring .
your cousin thinks that your husband 's mom 's doctor 's father 's husband 's daughter is happy .	your cousin scares your husband 's mom 's doctor 's father 's husband 's daughter is happy .
your dentist thinks that your mom 's brother 's grandmother 's friend 's boss 's sister is friendly .	your dentist helps your mom 's brother 's grandmother 's friend 's boss 's sister is friendly .
the teacher says that my husband 's doctor 's daughter 's wife 's daughter 's brother is bored .	the teacher talks to my husband 's doctor 's daughter 's wife 's daughter 's brother is bored .
the doctor thinks that my wife 's wife 's sister 's cousin 's brother 's dad is tall .	the doctor helps my wife 's wife 's sister 's cousin 's brother 's dad is tall .
the customer says that your daughter 's dad 's dentist 's father 's boss 's cousin is lucky .	the customer works with your daughter 's dad 's dentist 's father 's boss 's cousin is lucky .
Anna knows that your mom 's husband 's wife 's dentist 's mom 's teacher is important .	Anna scares your mom 's husband 's wife 's dentist 's mom 's teacher is important .
the doctor thinks that my daughter 's friend 's wife 's doctor 's friend 's cousin is hungry .	the doctor helps my daughter 's friend 's wife 's doctor 's friend 's cousin is hungry .
Laura says that my father 's daughter 's mother 's grandmother 's wife 's grandmother is sleepy .	Laura scares my father 's daughter 's mother 's grandmother 's wife 's grandmother is sleepy .
Deborah knows that your grandmother 's father 's dad 's boss 's sister 's father is tired .	Deborah talks to your grandmother 's father 's dad 's boss 's sister 's father is tired .
Susan knows that your teacher 's daughter 's teacher 's daughter 's mother 's sister is hungry .	Susan helps your teacher 's daughter 's teacher 's daughter 's mother 's sister is hungry .
the person thinks that your sister 's grandmother 's father 's doctor 's mom 's sister is kind .	the person talks to your sister 's grandmother 's father 's doctor 's mom 's sister is kind .
your friend says that my husband 's friend 's teacher 's grandmother 's brother 's father is hungry .	your friend talks to my husband 's friend 's teacher 's grandmother 's brother 's father is hungry .
the teacher thinks that my cousin 's grandmother 's mom 's mom 's boss 's mother is friendly .	the teacher works with my cousin 's grandmother 's mom 's mom 's boss 's mother is friendly .
my teacher knows that my grandmother 's grandmother 's sister 's mother 's father 's teacher is bored .	my teacher helps my grandmother 's grandmother 's sister 's mother 's father 's teacher is bored .
your doctor knows that your mother 's mother 's brother 's mom 's sister 's son is tired .	your doctor talks to your mother 's mother 's brother 's mom 's sister 's son is tired .
your friend thinks that my friend 's cousin 's husband 's friend 's doctor 's brother is smart .	your friend works with my friend 's cousin 's husband 's friend 's doctor 's brother is smart .
Anna says that your dentist 's sister 's brother 's husband 's brother 's doctor is friendly .	Anna talks to your dentist 's sister 's brother 's husband 's brother 's doctor is friendly .
Bill says that my daughter 's cousin 's sister 's dentist 's friend 's mother is smart .	Bill works with my daughter 's cousin 's sister 's dentist 's friend 's mother is smart .
the driver thinks that my husband 's cousin 's husband 's father 's teacher 's doctor is angry .	the driver talks to my husband 's cousin 's husband 's father 's teacher 's doctor is angry .
David says that my dentist 's doctor 's grandmother 's brother 's grandmother 's husband is surprised .	David talks to my dentist 's doctor 's grandmother 's brother 's grandmother 's husband is surprised .
the person says that your friend 's mom 's daughter 's dentist 's teacher 's doctor is wrong .	the person scares your friend 's mom 's daughter 's dentist 's teacher 's doctor is wrong .
your cousin thinks that your father 's boss 's husband 's grandmother 's husband 's cousin is kind .	your cousin helps your father 's boss 's husband 's grandmother 's husband 's cousin is kind .
the teacher knows that your dentist 's daughter 's daughter 's daughter 's dad 's husband is important .	the teacher helps your dentist 's daughter 's daughter 's daughter 's dad 's husband is important .
Patrick says that my brother 's dentist 's sister 's son 's boss 's husband is wrong .	Patrick scares my brother 's dentist 's sister 's son 's boss 's husband is wrong .
Kevin thinks that your grandmother 's boss 's father 's mom 's daughter 's boss is angry .	Kevin talks to your grandmother 's boss 's father 's mom 's daughter 's boss is angry .
April says that your doctor 's dad 's mother 's husband 's friend 's father is angry .	April scares your doctor 's dad 's mother 's husband 's friend 's father is angry .
my dentist thinks that my boss 's dad 's brother 's doctor 's daughter 's doctor is young .	my dentist talks to my boss 's dad 's brother 's doctor 's daughter 's doctor is young .
my doctor knows that your son 's boss 's mother 's boss 's mother 's doctor is bored .	my doctor scares your son 's boss 's mother 's boss 's mother 's doctor is bored .
your dentist thinks that your grandmother 's husband 's cousin 's doctor 's daughter 's mother is careful .	your dentist helps your grandmother 's husband 's cousin 's doctor 's daughter 's mother is careful .
the person knows that your daughter 's friend 's dad 's cousin 's friend 's dentist is angry .	the person helps your daughter 's friend 's dad 's cousin 's friend 's dentist is angry .
Rebecca knows that my dad 's dad 's cousin 's wife 's mom 's grandmother is strong .	Rebecca scares my dad 's dad 's cousin 's wife 's mom 's grandmother is strong .
your friend thinks that your mom 's son 's son 's mother 's brother 's sister is clever .	your friend talks to your mom 's son 's son 's mother 's brother 's sister is clever .
your cousin says that your friend 's daughter 's brother 's daughter 's husband 's husband is wrong .	your cousin works with your friend 's daughter 's brother 's daughter 's husband 's husband is wrong .
the driver thinks that your sister 's brother 's brother 's husband 's teacher 's son is healthy .	the driver talks to your sister 's brother 's brother 's husband 's teacher 's son is healthy .
Mark knows that your son 's father 's friend 's boss 's boss 's son is sleepy .	Mark works with your son 's father 's friend 's boss 's boss 's son is sleepy .
Elizabeth thinks that your boss 's dentist 's wife 's father 's dentist 's daughter is lucky .	Elizabeth works with your boss 's dentist 's wife 's father 's dentist 's daughter is lucky .
my cousin knows that your friend 's brother 's brother 's dad 's mother 's cousin is tired .	my cousin talks to your friend 's brother 's brother 's dad 's mother 's cousin is tired .
