the car knows that my daughter 's wife 's sister 's dad 's wife 's doctor 's sister 's brother 's shirt is hungry .	the car helps my daughter 's wife 's sister 's dad 's wife 's doctor 's sister 's brother 's shirt is hungry .
the boat thinks that my daughter 's daughter 's wife 's teacher 's cousin 's friend 's wife 's grandmother 's plate is upset .	the boat talks to my daughter 's daughter 's wife 's teacher 's cousin 's friend 's wife 's grandmother 's plate is upset .
the book thinks that your grandmother 's doctor 's cousin 's cousin 's son 's dentist 's son 's friend 's couch is helpful .	the book scares your grandmother 's doctor 's cousin 's cousin 's son 's dentist 's son 's friend 's couch is helpful .
the bed says that your brother 's husband 's father 's cousin 's wife 's daughter 's daughter 's wife 's boat is bored .	the bed talks to your brother 's husband 's father 's cousin 's wife 's daughter 's daughter 's wife 's boat is bored .
the truck knows that my grandmother 's son 's husband 's grandmother 's friend 's daughter 's brother 's friend 's rug is careful .	the truck helps my grandmother 's son 's husband 's grandmother 's friend 's daughter 's brother 's friend 's rug is careful .
the crayon says that your grandmother 's doctor 's teacher 's mom 's doctor 's doctor 's husband 's son 's rug is tired .	the crayon helps your grandmother 's doctor 's teacher 's mom 's doctor 's doctor 's husband 's son 's rug is tired .
the dish says that your father 's sister 's mother 's wife 's doctor 's cousin 's cousin 's son 's fork is young .	the dish works with your father 's sister 's mother 's wife 's doctor 's cousin 's cousin 's son 's fork is young .
the plane thinks that your mother 's son 's wife 's mom 's sister 's cousin 's doctor 's boss 's couch is happy .	the plane scares your mother 's son 's wife 's mom 's sister 's cousin 's doctor 's boss 's couch is happy .
the rug knows that your cousin 's dentist 's sister 's mom 's friend 's dad 's son 's father 's box is nice .	the rug helps your cousin 's dentist 's sister 's mom 's friend 's dad 's son 's father 's box is nice .
the candle thinks that my grandmother 's husband 's son 's son 's cousin 's dentist 's mom 's brother 's rug is gentle .	the candle works with my grandmother 's husband 's son 's son 's cousin 's dentist 's mom 's brother 's rug is gentle .
the bag says that my father 's friend 's boss 's sister 's brother 's wife 's son 's daughter 's book is lucky .	the bag helps my father 's friend 's boss 's sister 's brother 's wife 's son 's daughter 's book is lucky .
the couch says that my cousin 's brother 's brother 's boss 's father 's cousin 's teacher 's wife 's ship is bored .	the couch works with my cousin 's brother 's brother 's boss 's father 's cousin 's teacher 's wife 's ship is bored .
the shoe knows that my husband 's daughter 's mother 's grandmother 's son 's mom 's wife 's husband 's glass is clever .	the shoe talks to my husband 's daughter 's mother 's grandmother 's son 's mom 's wife 's husband 's glass is clever .
the crayon thinks that your teacher 's friend 's friend 's cousin 's son 's friend 's grandmother 's cousin 's shirt is excited .	the crayon talks to your teacher 's friend 's friend 's cousin 's son 's friend 's grandmother 's cousin 's shirt is excited .
the toy thinks that my father 's boss 's cousin 's wife 's dentist 's doctor 's dentist 's son 's book is hungry .	the toy talks to my father 's boss 's cousin 's wife 's dentist 's doctor 's dentist 's son 's book is hungry .
the bottle thinks that your brother 's friend 's sister 's mother 's friend 's mother 's teacher 's dentist 's dish is important .	the bottle helps your brother 's friend 's sister 's mother 's friend 's mother 's teacher 's dentist 's dish is important .
the book thinks that your brother 's husband 's doctor 's grandmother 's grandmother 's son 's husband 's teacher 's candle is excited .	the book helps your brother 's husband 's doctor 's grandmother 's grandmother 's son 's husband 's teacher 's candle is excited .
the cup thinks that my husband 's father 's daughter 's son 's dentist 's teacher 's sister 's doctor 's mirror is young .	the cup talks to my husband 's father 's daughter 's son 's dentist 's teacher 's sister 's doctor 's mirror is young .
the mirror thinks that your mom 's father 's brother 's boss 's brother 's daughter 's grandmother 's son 's boat is smart .	the mirror scares your mom 's father 's brother 's boss 's brother 's daughter 's grandmother 's son 's boat is smart .
the bowl knows that my son 's friend 's friend 's brother 's doctor 's grandmother 's doctor 's sister 's car is wrong .	the bowl scares my son 's friend 's friend 's brother 's doctor 's grandmother 's doctor 's sister 's car is wrong .
the car says that your mother 's wife 's cousin 's doctor 's daughter 's mom 's father 's cousin 's boat is smart .	the car scares your mother 's wife 's cousin 's doctor 's daughter 's mom 's father 's cousin 's boat is smart .
the rocket says that my teacher 's grandmother 's friend 's husband 's boss 's boss 's sister 's father 's car is boring .	the rocket helps my teacher 's grandmother 's friend 's husband 's boss 's boss 's sister 's father 's car is boring .
the crayon thinks that your dentist 's cousin 's dentist 's friend 's son 's dentist 's husband 's doctor 's plate is helpful .	the crayon scares your dentist 's cousin 's dentist 's friend 's son 's dentist 's husband 's doctor 's plate is helpful .
the fork says that my mom 's dentist 's father 's mom 's dentist 's husband 's friend 's friend 's button is helpful .	the fork scares my mom 's dentist 's father 's mom 's dentist 's husband 's friend 's friend 's button is helpful .
the window knows that your husband 's brother 's boss 's wife 's boss 's teacher 's cousin 's son 's boat is gentle .	the window talks to your husband 's brother 's boss 's wife 's boss 's teacher 's cousin 's son 's boat is gentle .
the bed thinks that your son 's dad 's wife 's mom 's daughter 's brother 's son 's boss 's bowl is kind .	the bed works with your son 's dad 's wife 's mom 's daughter 's brother 's son 's boss 's bowl is kind .
the chair thinks that my mom 's teacher 's mother 's mom 's mom 's grandmother 's daughter 's mother 's dish is happy .	the chair scares my mom 's teacher 's mother 's mom 's mom 's grandmother 's daughter 's mother 's dish is happy .
the doll thinks that my mother 's grandmother 's son 's daughter 's boss 's sister 's dentist 's boss 's door is excited .	the doll works with my mother 's grandmother 's son 's daughter 's boss 's sister 's dentist 's boss 's door is excited .
the cup knows that your friend 's dentist 's doctor 's doctor 's grandmother 's dentist 's grandmother 's teacher 's car is kind .	the cup scares your friend 's dentist 's doctor 's doctor 's grandmother 's dentist 's grandmother 's teacher 's car is kind .
the box says that your mother 's sister 's daughter 's husband 's friend 's father 's daughter 's friend 's picture is happy .	the box helps your mother 's sister 's daughter 's husband 's friend 's father 's daughter 's friend 's picture is happy .
the rug says that your cousin 's son 's wife 's doctor 's teacher 's sister 's dentist 's mom 's shirt is angry .	the rug helps your cousin 's son 's wife 's doctor 's teacher 's sister 's dentist 's mom 's shirt is angry .
the bottle thinks that your mom 's mom 's teacher 's teacher 's friend 's sister 's mother 's wife 's bicycle is strong .	the bottle works with your mom 's mom 's teacher 's teacher 's friend 's sister 's mother 's wife 's bicycle is strong .
the truck says that my brother 's daughter 's father 's dad 's son 's boss 's boss 's boss 's ring is surprised .	the truck talks to my brother 's daughter 's father 's dad 's son 's boss 's boss 's boss 's ring is surprised .
the fork says that your husband 's cousin 's son 's son 's sister 's cousin 's sister 's dentist 's mirror is helpful .	the fork talks to your husband 's cousin 's son 's son 's sister 's cousin 's sister 's dentist 's mirror is helpful .
the plane says that my son 's brother 's friend 's son 's teacher 's daughter 's father 's mom 's ship is angry .	the plane talks to my son 's brother 's friend 's son 's teacher 's daughter 's father 's mom 's ship is angry .
the spoon thinks that my sister 's friend 's wife 's brother 's daughter 's father 's cousin 's father 's bowl is sleepy .	the spoon works with my sister 's friend 's wife 's brother 's daughter 's father 's cousin 's father 's bowl is sleepy .
the rug knows that your sister 's grandmother 's teacher 's dad 's cousin 's father 's brother 's friend 's truck is strong .	the rug helps your sister 's grandmother 's teacher 's dad 's cousin 's father 's brother 's friend 's truck is strong .
the bowl knows that my friend 's mom 's son 's friend 's wife 's brother 's dentist 's boss 's ring is nice .	the bowl scares my friend 's mom 's son 's friend 's wife 's brother 's dentist 's boss 's ring is nice .
the truck says that your doctor 's mother 's cousin 's brother 's daughter 's friend 's husband 's boss 's doll is clever .	the truck helps your doctor 's mother 's cousin 's brother 's daughter 's friend 's husband 's boss 's doll is clever .
the glass thinks that my cousin 's teacher 's cousin 's cousin 's dad 's son 's boss 's cousin 's bowl is helpful .	the glass works with my cousin 's teacher 's cousin 's cousin 's dad 's son 's boss 's cousin 's bowl is helpful .
the dish knows that my doctor 's daughter 's mom 's boss 's mother 's friend 's grandmother 's brother 's crayon is bored .	the dish helps my doctor 's daughter 's mom 's boss 's mother 's friend 's grandmother 's brother 's crayon is bored .
the hat knows that your grandmother 's grandmother 's sister 's brother 's son 's husband 's doctor 's mother 's bed is busy .	the hat helps your grandmother 's grandmother 's sister 's brother 's son 's husband 's doctor 's mother 's bed is busy .
the bowl thinks that your mother 's boss 's teacher 's mother 's daughter 's wife 's son 's wife 's fork is strong .	the bowl scares your mother 's boss 's teacher 's mother 's daughter 's wife 's son 's wife 's fork is strong .
the shoe says that your daughter 's grandmother 's daughter 's father 's mother 's dad 's dentist 's son 's car is important .	the shoe works with your daughter 's grandmother 's daughter 's father 's mother 's dad 's dentist 's son 's car is important .
the bicycle thinks that my teacher 's dad 's daughter 's dentist 's doctor 's mother 's mother 's husband 's bottle is upset .	the bicycle talks to my teacher 's dad 's daughter 's dentist 's doctor 's mother 's mother 's husband 's bottle is upset .
the car says that my dentist 's son 's brother 's brother 's daughter 's brother 's husband 's son 's bed is upset .	the car works with my dentist 's son 's brother 's brother 's daughter 's brother 's husband 's son 's bed is upset .
the rocket says that your mother 's teacher 's son 's husband 's teacher 's friend 's mother 's mother 's box is important .	the rocket talks to your mother 's teacher 's son 's husband 's teacher 's friend 's mother 's mother 's box is important .
the plane knows that your mother 's father 's son 's dad 's dad 's teacher 's daughter 's boss 's door is boring .	the plane helps your mother 's father 's son 's dad 's dad 's teacher 's daughter 's boss 's door is boring .
the ship says that my son 's dentist 's boss 's daughter 's boss 's wife 's grandmother 's mother 's hat is lucky .	the ship works with my son 's dentist 's boss 's daughter 's boss 's wife 's grandmother 's mother 's hat is lucky .
the plane knows that my dentist 's sister 's daughter 's teacher 's doctor 's wife 's doctor 's friend 's chair is helpful .	the plane helps my dentist 's sister 's daughter 's teacher 's doctor 's wife 's doctor 's friend 's chair is helpful .
the ring says that your boss 's brother 's sister 's husband 's mother 's dentist 's boss 's grandmother 's box is lucky .	the ring scares your boss 's brother 's sister 's husband 's mother 's dentist 's boss 's grandmother 's box is lucky .
the box says that your dad 's doctor 's teacher 's sister 's mother 's mom 's doctor 's brother 's car is healthy .	the box works with your dad 's doctor 's teacher 's sister 's mother 's mom 's doctor 's brother 's car is healthy .
the ship thinks that your wife 's son 's dentist 's mother 's mother 's dad 's son 's doctor 's button is happy .	the ship works with your wife 's son 's dentist 's mother 's mother 's dad 's son 's doctor 's button is happy .
the bowl says that your grandmother 's cousin 's daughter 's dentist 's son 's dentist 's friend 's doctor 's plane is tired .	the bowl talks to your grandmother 's cousin 's daughter 's dentist 's son 's dentist 's friend 's doctor 's plane is tired .
the bed knows that your wife 's wife 's husband 's wife 's son 's father 's grandmother 's dentist 's rug is confused .	the bed talks to your wife 's wife 's husband 's wife 's son 's father 's grandmother 's dentist 's rug is confused .
the book thinks that my teacher 's brother 's teacher 's brother 's boss 's daughter 's boss 's dentist 's window is nice .	the book scares my teacher 's brother 's teacher 's brother 's boss 's daughter 's boss 's dentist 's window is nice .
the rocket thinks that your dentist 's wife 's father 's mom 's mom 's father 's cousin 's mom 's candle is surprised .	the rocket talks to your dentist 's wife 's father 's mom 's mom 's father 's cousin 's mom 's candle is surprised .
the hat knows that your teacher 's father 's dentist 's boss 's teacher 's friend 's daughter 's boss 's book is boring .	the hat scares your teacher 's father 's dentist 's boss 's teacher 's friend 's daughter 's boss 's book is boring .
the bag thinks that your mom 's grandmother 's dad 's wife 's friend 's sister 's teacher 's husband 's dish is gentle .	the bag helps your mom 's grandmother 's dad 's wife 's friend 's sister 's teacher 's husband 's dish is gentle .
the window thinks that my dad 's brother 's father 's wife 's dad 's brother 's husband 's mother 's plate is healthy .	the window works with my dad 's brother 's father 's wife 's dad 's brother 's husband 's mother 's plate is healthy .
the dish knows that my grandmother 's doctor 's mother 's cousin 's boss 's son 's wife 's friend 's glass is bored .	the dish scares my grandmother 's doctor 's mother 's cousin 's boss 's son 's wife 's friend 's glass is bored .
the ship thinks that your mother 's doctor 's dad 's dad 's friend 's cousin 's daughter 's husband 's window is busy .	the ship helps your mother 's doctor 's dad 's dad 's friend 's cousin 's daughter 's husband 's window is busy .
the dish thinks that your daughter 's husband 's son 's daughter 's dentist 's daughter 's doctor 's doctor 's rocket is helpful .	the dish works with your daughter 's husband 's son 's daughter 's dentist 's daughter 's doctor 's doctor 's rocket is helpful .
the toy thinks that your wife 's dentist 's dentist 's boss 's boss 's mom 's cousin 's sister 's bed is confused .	the toy works with your wife 's dentist 's dentist 's boss 's boss 's mom 's cousin 's sister 's bed is confused .
the hat says that my cousin 's friend 's father 's friend 's dad 's son 's boss 's cousin 's truck is boring .	the hat works with my cousin 's friend 's father 's friend 's dad 's son 's boss 's cousin 's truck is boring .
the fork says that your doctor 's dad 's grandmother 's son 's son 's friend 's mother 's doctor 's car is busy .	the fork talks to your doctor 's dad 's grandmother 's son 's son 's friend 's mother 's doctor 's car is busy .
the bowl knows that my sister 's mom 's dentist 's boss 's sister 's dad 's grandmother 's mother 's rocket is wrong .	the bowl helps my sister 's mom 's dentist 's boss 's sister 's dad 's grandmother 's mother 's rocket is wrong .
the dish says that my son 's dentist 's daughter 's dad 's teacher 's cousin 's grandmother 's grandmother 's car is busy .	the dish works with my son 's dentist 's daughter 's dad 's teacher 's cousin 's grandmother 's grandmother 's car is busy .
the fork knows that my daughter 's dad 's dentist 's father 's grandmother 's wife 's wife 's friend 's bicycle is angry .	the fork scares my daughter 's dad 's dentist 's father 's grandmother 's wife 's wife 's friend 's bicycle is angry .
the box says that your friend 's boss 's daughter 's grandmother 's daughter 's daughter 's mom 's boss 's chair is tired .	the box talks to your friend 's boss 's daughter 's grandmother 's daughter 's daughter 's mom 's boss 's chair is tired .
the book thinks that your dentist 's teacher 's brother 's cousin 's doctor 's son 's mom 's father 's bowl is bored .	the book works with your dentist 's teacher 's brother 's cousin 's doctor 's son 's mom 's father 's bowl is bored .
the ship thinks that my brother 's husband 's husband 's friend 's doctor 's teacher 's grandmother 's grandmother 's chair is upset .	the ship scares my brother 's husband 's husband 's friend 's doctor 's teacher 's grandmother 's grandmother 's chair is upset .
the plate thinks that your dentist 's sister 's wife 's grandmother 's mom 's boss 's doctor 's husband 's box is important .	the plate helps your dentist 's sister 's wife 's grandmother 's mom 's boss 's doctor 's husband 's box is important .
the picture thinks that your friend 's dad 's doctor 's daughter 's father 's friend 's brother 's mother 's window is wrong .	the picture works with your friend 's dad 's doctor 's daughter 's father 's friend 's brother 's mother 's window is wrong .
the crayon says that my boss 's sister 's friend 's teacher 's wife 's sister 's teacher 's doctor 's chair is excited .	the crayon helps my boss 's sister 's friend 's teacher 's wife 's sister 's teacher 's doctor 's chair is excited .
the mirror says that my friend 's wife 's grandmother 's boss 's sister 's boss 's mom 's teacher 's bowl is boring .	the mirror helps my friend 's wife 's grandmother 's boss 's sister 's boss 's mom 's teacher 's bowl is boring .
the rocket thinks that your cousin 's mom 's cousin 's dad 's dad 's wife 's mother 's brother 's glass is gentle .	the rocket works with your cousin 's mom 's cousin 's dad 's dad 's wife 's mother 's brother 's glass is gentle .
the spoon thinks that your brother 's husband 's dentist 's son 's teacher 's friend 's cousin 's mom 's rocket is strong .	the spoon talks to your brother 's husband 's dentist 's son 's teacher 's friend 's cousin 's mom 's rocket is strong .
the boat thinks that my son 's friend 's wife 's friend 's dentist 's cousin 's wife 's wife 's fork is gentle .	the boat works with my son 's friend 's wife 's friend 's dentist 's cousin 's wife 's wife 's fork is gentle .
the box knows that my boss 's daughter 's mom 's grandmother 's cousin 's mom 's cousin 's teacher 's book is sleepy .	the box works with my boss 's daughter 's mom 's grandmother 's cousin 's mom 's cousin 's teacher 's book is sleepy .
the cup says that my dad 's wife 's wife 's brother 's dentist 's son 's son 's dentist 's picture is excited .	the cup helps my dad 's wife 's wife 's brother 's dentist 's son 's son 's dentist 's picture is excited .
the plane knows that your daughter 's mom 's wife 's doctor 's grandmother 's father 's doctor 's son 's rocket is boring .	the plane works with your daughter 's mom 's wife 's doctor 's grandmother 's father 's doctor 's son 's rocket is boring .
the shoe says that my teacher 's mom 's dad 's wife 's mother 's friend 's brother 's husband 's ring is wrong .	the shoe helps my teacher 's mom 's dad 's wife 's mother 's friend 's brother 's husband 's ring is wrong .
the candle thinks that your friend 's boss 's doctor 's father 's boss 's dentist 's dad 's mom 's chair is smart .	the candle scares your friend 's boss 's doctor 's father 's boss 's dentist 's dad 's mom 's chair is smart .
the crayon says that your mother 's teacher 's father 's doctor 's brother 's father 's mother 's sister 's boat is curious .	the crayon works with your mother 's teacher 's father 's doctor 's brother 's father 's mother 's sister 's boat is curious .
the ring knows that my son 's daughter 's grandmother 's mom 's husband 's mom 's grandmother 's daughter 's boat is friendly .	the ring scares my son 's daughter 's grandmother 's mom 's husband 's mom 's grandmother 's daughter 's boat is friendly .
the cup knows that my cousin 's brother 's cousin 's friend 's friend 's teacher 's father 's son 's truck is busy .	the cup works with my cousin 's brother 's cousin 's friend 's friend 's teacher 's father 's son 's truck is busy .
the car says that my teacher 's mother 's father 's boss 's mom 's sister 's mom 's boss 's bottle is important .	the car works with my teacher 's mother 's father 's boss 's mom 's sister 's mom 's boss 's bottle is important .
the crayon knows that my grandmother 's mom 's wife 's brother 's mom 's daughter 's doctor 's father 's ship is young .	the crayon works with my grandmother 's mom 's wife 's brother 's mom 's daughter 's doctor 's father 's ship is young .
the candle says that my doctor 's teacher 's dad 's friend 's daughter 's teacher 's sister 's sister 's mirror is helpful .	the candle helps my doctor 's teacher 's dad 's friend 's daughter 's teacher 's sister 's sister 's mirror is helpful .
the window thinks that my sister 's mother 's brother 's doctor 's sister 's doctor 's dentist 's friend 's crayon is busy .	the window helps my sister 's mother 's brother 's doctor 's sister 's doctor 's dentist 's friend 's crayon is busy .
the book thinks that my doctor 's friend 's cousin 's husband 's brother 's teacher 's son 's husband 's candle is smart .	the book talks to my doctor 's friend 's cousin 's husband 's brother 's teacher 's son 's husband 's candle is smart .
the plate says that your mom 's brother 's boss 's boss 's husband 's teacher 's wife 's dad 's crayon is gentle .	the plate works with your mom 's brother 's boss 's boss 's husband 's teacher 's wife 's dad 's crayon is gentle .
the couch thinks that my grandmother 's friend 's sister 's brother 's dad 's husband 's friend 's mother 's bottle is important .	the couch helps my grandmother 's friend 's sister 's brother 's dad 's husband 's friend 's mother 's bottle is important .
the hat knows that your son 's sister 's teacher 's daughter 's daughter 's husband 's mother 's father 's book is careful .	the hat talks to your son 's sister 's teacher 's daughter 's daughter 's husband 's mother 's father 's book is careful .
the hat says that your grandmother 's doctor 's cousin 's grandmother 's grandmother 's cousin 's friend 's teacher 's plate is healthy .	the hat works with your grandmother 's doctor 's cousin 's grandmother 's grandmother 's cousin 's friend 's teacher 's plate is healthy .
the bowl knows that your daughter 's dentist 's grandmother 's mother 's daughter 's daughter 's dentist 's mom 's ship is gentle .	the bowl talks to your daughter 's dentist 's grandmother 's mother 's daughter 's daughter 's dentist 's mom 's ship is gentle .
the button knows that my mother 's sister 's grandmother 's brother 's dad 's daughter 's doctor 's dad 's car is angry .	the button talks to my mother 's sister 's grandmother 's brother 's dad 's daughter 's doctor 's dad 's car is angry .
the plane knows that my son 's teacher 's father 's daughter 's brother 's friend 's father 's cousin 's cup is important .	the plane helps my son 's teacher 's father 's daughter 's brother 's friend 's father 's cousin 's cup is important .
the spoon thinks that my brother 's mom 's dentist 's friend 's wife 's daughter 's grandmother 's mother 's hat is important .	the spoon helps my brother 's mom 's dentist 's friend 's wife 's daughter 's grandmother 's mother 's hat is important .
the toy knows that my cousin 's husband 's dentist 's friend 's husband 's dentist 's doctor 's father 's button is excited .	the toy works with my cousin 's husband 's dentist 's friend 's husband 's dentist 's doctor 's father 's button is excited .
the toy says that my teacher 's grandmother 's teacher 's mother 's husband 's sister 's dentist 's brother 's bottle is important .	the toy works with my teacher 's grandmother 's teacher 's mother 's husband 's sister 's dentist 's brother 's bottle is important .
the ring thinks that your boss 's dentist 's teacher 's daughter 's grandmother 's doctor 's dad 's mom 's box is tired .	the ring works with your boss 's dentist 's teacher 's daughter 's grandmother 's doctor 's dad 's mom 's box is tired .
the mirror says that your dad 's daughter 's dad 's wife 's son 's sister 's husband 's dentist 's plane is healthy .	the mirror helps your dad 's daughter 's dad 's wife 's son 's sister 's husband 's dentist 's plane is healthy .
the cup says that my father 's brother 's brother 's friend 's father 's sister 's son 's teacher 's bottle is upset .	the cup scares my father 's brother 's brother 's friend 's father 's sister 's son 's teacher 's bottle is upset .
the shoe knows that your sister 's mom 's daughter 's mother 's brother 's dad 's friend 's doctor 's plate is excited .	the shoe helps your sister 's mom 's daughter 's mother 's brother 's dad 's friend 's doctor 's plate is excited .
the bowl says that my cousin 's cousin 's father 's mom 's cousin 's sister 's brother 's teacher 's bottle is strong .	the bowl scares my cousin 's cousin 's father 's mom 's cousin 's sister 's brother 's teacher 's bottle is strong .
the cup knows that your boss 's sister 's doctor 's grandmother 's grandmother 's sister 's wife 's mom 's bed is helpful .	the cup talks to your boss 's sister 's doctor 's grandmother 's grandmother 's sister 's wife 's mom 's bed is helpful .
