Joseph says that your mother 's mother 's father 's doctor 's mom 's mother is strong .	Joseph talks to your mother 's mother 's father 's doctor 's mom 's mother is strong .
Anna thinks that my husband 's grandmother 's husband 's dentist 's dad 's cousin is angry .	Anna talks to my husband 's grandmother 's husband 's dentist 's dad 's cousin is angry .
the person knows that my grandmother 's dentist 's grandmother 's sister 's dentist 's boss is bored .	the person works with my grandmother 's dentist 's grandmother 's sister 's dentist 's boss is bored .
Judy says that your boss 's husband 's mother 's brother 's cousin 's brother is smart .	Judy scares your boss 's husband 's mother 's brother 's cousin 's brother is smart .
your boss thinks that my husband 's wife 's teacher 's husband 's husband 's mother is hungry .	your boss scares my husband 's wife 's teacher 's husband 's husband 's mother is hungry .
your cousin thinks that my cousin 's dad 's son 's wife 's teacher 's mother is careful .	your cousin talks to my cousin 's dad 's son 's wife 's teacher 's mother is careful .
Jennifer knows that my boss 's doctor 's mother 's son 's boss 's daughter is healthy .	Jennifer scares my boss 's doctor 's mother 's son 's boss 's daughter is healthy .
the teacher says that my mother 's brother 's sister 's mother 's grandmother 's wife is wrong .	the teacher scares my mother 's brother 's sister 's mother 's grandmother 's wife is wrong .
Sarah knows that your daughter 's brother 's husband 's dentist 's doctor 's son is careful .	Sarah helps your daughter 's brother 's husband 's dentist 's doctor 's son is careful .
your dentist says that my wife 's grandmother 's dad 's mom 's mother 's boss is quiet .	your dentist talks to my wife 's grandmother 's dad 's mom 's mother 's boss is quiet .
your boss knows that my sister 's dentist 's teacher 's husband 's husband 's dad is quiet .	your boss helps my sister 's dentist 's teacher 's husband 's husband 's dad is quiet .
Nina says that your sister 's boss 's boss 's wife 's mother 's friend is smart .	Nina works with your sister 's boss 's boss 's wife 's mother 's friend is smart .
Christopher says that my dentist 's cousin 's husband 's mother 's boss 's friend is upset .	Christopher helps my dentist 's cousin 's husband 's mother 's boss 's friend is upset .
the patient thinks that my grandmother 's mother 's wife 's wife 's grandmother 's dentist is smart .	the patient scares my grandmother 's mother 's wife 's wife 's grandmother 's dentist is smart .
Laura says that your boss 's grandmother 's grandmother 's father 's dad 's wife is tired .	Laura helps your boss 's grandmother 's grandmother 's father 's dad 's wife is tired .
Robert knows that my son 's friend 's son 's father 's friend 's father is excited .	Robert scares my son 's friend 's son 's father 's friend 's father is excited .
the dancer knows that my mother 's son 's teacher 's dentist 's dentist 's sister is healthy .	the dancer helps my mother 's son 's teacher 's dentist 's dentist 's sister is healthy .
the person thinks that your mom 's brother 's friend 's daughter 's cousin 's father is tall .	the person helps your mom 's brother 's friend 's daughter 's cousin 's father is tall .
the driver knows that your wife 's doctor 's brother 's friend 's husband 's husband is young .	the driver talks to your wife 's doctor 's brother 's friend 's husband 's husband is young .
the child knows that my father 's dad 's mother 's doctor 's boss 's sister is friendly .	the child scares my father 's dad 's mother 's doctor 's boss 's sister is friendly .
Peter thinks that your mom 's brother 's brother 's cousin 's mom 's mom is hungry .	Peter scares your mom 's brother 's brother 's cousin 's mom 's mom is hungry .
the dancer says that my mom 's mother 's husband 's father 's father 's daughter is careful .	the dancer talks to my mom 's mother 's husband 's father 's father 's daughter is careful .
Catherine thinks that your doctor 's sister 's dad 's son 's father 's mother is wrong .	Catherine talks to your doctor 's sister 's dad 's son 's father 's mother is wrong .
the doctor knows that your daughter 's wife 's grandmother 's father 's husband 's friend is friendly .	the doctor works with your daughter 's wife 's grandmother 's father 's husband 's friend is friendly .
your doctor thinks that my mother 's sister 's cousin 's doctor 's teacher 's son is clever .	your doctor works with my mother 's sister 's cousin 's doctor 's teacher 's son is clever .
my doctor thinks that your daughter 's daughter 's husband 's teacher 's doctor 's father is clever .	my doctor scares your daughter 's daughter 's husband 's teacher 's doctor 's father is clever .
your boss says that your son 's teacher 's sister 's father 's grandmother 's sister is friendly .	your boss talks to your son 's teacher 's sister 's father 's grandmother 's sister is friendly .
the teacher knows that your father 's wife 's father 's dad 's teacher 's doctor is careful .	the teacher talks to your father 's wife 's father 's dad 's teacher 's doctor is careful .
my cousin knows that my doctor 's father 's doctor 's dentist 's dentist 's boss is gentle .	my cousin scares my doctor 's father 's doctor 's dentist 's dentist 's boss is gentle .
my teacher says that my teacher 's dad 's boss 's doctor 's mother 's mom is bored .	my teacher helps my teacher 's dad 's boss 's doctor 's mother 's mom is bored .
the patient says that your mom 's brother 's daughter 's dad 's boss 's teacher is friendly .	the patient talks to your mom 's brother 's daughter 's dad 's boss 's teacher is friendly .
Anne says that your son 's mom 's cousin 's wife 's doctor 's brother is nice .	Anne works with your son 's mom 's cousin 's wife 's doctor 's brother is nice .
Rachel thinks that your friend 's mom 's dad 's dentist 's son 's daughter is friendly .	Rachel talks to your friend 's mom 's dad 's dentist 's son 's daughter is friendly .
the adult knows that your teacher 's son 's mother 's teacher 's dad 's daughter is lucky .	the adult helps your teacher 's son 's mother 's teacher 's dad 's daughter is lucky .
the patient knows that my teacher 's daughter 's sister 's boss 's grandmother 's brother is curious .	the patient scares my teacher 's daughter 's sister 's boss 's grandmother 's brother is curious .
Michelle knows that your boss 's father 's sister 's son 's son 's cousin is strong .	Michelle helps your boss 's father 's sister 's son 's son 's cousin is strong .
my cousin knows that your dad 's doctor 's father 's father 's teacher 's cousin is friendly .	my cousin helps your dad 's doctor 's father 's father 's teacher 's cousin is friendly .
the person knows that my sister 's teacher 's brother 's husband 's wife 's dentist is strong .	the person scares my sister 's teacher 's brother 's husband 's wife 's dentist is strong .
the dentist knows that my husband 's boss 's sister 's cousin 's boss 's father is smart .	the dentist talks to my husband 's boss 's sister 's cousin 's boss 's father is smart .
my boss knows that your teacher 's brother 's grandmother 's father 's mom 's cousin is boring .	my boss works with your teacher 's brother 's grandmother 's father 's mom 's cousin is boring .
David says that my wife 's boss 's grandmother 's son 's friend 's cousin is healthy .	David helps my wife 's boss 's grandmother 's son 's friend 's cousin is healthy .
Elizabeth thinks that my mom 's mom 's sister 's wife 's father 's teacher is tired .	Elizabeth works with my mom 's mom 's sister 's wife 's father 's teacher is tired .
the dentist thinks that your friend 's cousin 's cousin 's wife 's doctor 's mom is bored .	the dentist works with your friend 's cousin 's cousin 's wife 's doctor 's mom is bored .
my doctor thinks that my daughter 's brother 's sister 's father 's dad 's cousin is hungry .	my doctor scares my daughter 's brother 's sister 's father 's dad 's cousin is hungry .
my boss knows that my doctor 's wife 's friend 's doctor 's daughter 's daughter is tall .	my boss works with my doctor 's wife 's friend 's doctor 's daughter 's daughter is tall .
Gregory says that your daughter 's father 's son 's teacher 's brother 's son is wrong .	Gregory helps your daughter 's father 's son 's teacher 's brother 's son is wrong .
the patient says that your cousin 's brother 's boss 's teacher 's grandmother 's wife is tall .	the patient helps your cousin 's brother 's boss 's teacher 's grandmother 's wife is tall .
John thinks that my wife 's teacher 's doctor 's grandmother 's cousin 's cousin is happy .	John helps my wife 's teacher 's doctor 's grandmother 's cousin 's cousin is happy .
the doctor says that your grandmother 's doctor 's cousin 's sister 's mom 's teacher is clever .	the doctor talks to your grandmother 's doctor 's cousin 's sister 's mom 's teacher is clever .
the dancer thinks that your dad 's daughter 's cousin 's wife 's teacher 's father is curious .	the dancer scares your dad 's daughter 's cousin 's wife 's teacher 's father is curious .
the dancer thinks that my mother 's doctor 's father 's teacher 's father 's wife is gentle .	the dancer works with my mother 's doctor 's father 's teacher 's father 's wife is gentle .
Allison thinks that my friend 's brother 's sister 's daughter 's husband 's friend is wrong .	Allison scares my friend 's brother 's sister 's daughter 's husband 's friend is wrong .
the patient knows that your brother 's daughter 's son 's son 's mom 's wife is hungry .	the patient helps your brother 's daughter 's son 's son 's mom 's wife is hungry .
Jessica says that my wife 's mother 's wife 's boss 's dentist 's boss is lucky .	Jessica scares my wife 's mother 's wife 's boss 's dentist 's boss is lucky .
the driver thinks that my daughter 's dad 's doctor 's boss 's wife 's cousin is kind .	the driver works with my daughter 's dad 's doctor 's boss 's wife 's cousin is kind .
Karen says that your daughter 's dentist 's mother 's friend 's doctor 's friend is excited .	Karen scares your daughter 's dentist 's mother 's friend 's doctor 's friend is excited .
Laura says that my grandmother 's grandmother 's sister 's dad 's brother 's daughter is friendly .	Laura talks to my grandmother 's grandmother 's sister 's dad 's brother 's daughter is friendly .
the teacher thinks that my teacher 's teacher 's dentist 's doctor 's grandmother 's sister is friendly .	the teacher scares my teacher 's teacher 's dentist 's doctor 's grandmother 's sister is friendly .
Julia says that my mother 's brother 's sister 's son 's mother 's doctor is hungry .	Julia helps my mother 's brother 's sister 's son 's mother 's doctor is hungry .
your cousin knows that your husband 's wife 's son 's friend 's sister 's cousin is careful .	your cousin works with your husband 's wife 's son 's friend 's sister 's cousin is careful .
your friend thinks that your dentist 's grandmother 's brother 's mother 's cousin 's sister is kind .	your friend works with your dentist 's grandmother 's brother 's mother 's cousin 's sister is kind .
the dancer knows that my mom 's grandmother 's wife 's dentist 's father 's husband is bored .	the dancer talks to my mom 's grandmother 's wife 's dentist 's father 's husband is bored .
the driver says that my sister 's father 's husband 's dad 's doctor 's dad is hungry .	the driver works with my sister 's father 's husband 's dad 's doctor 's dad is hungry .
your doctor knows that your wife 's teacher 's cousin 's sister 's father 's sister is tired .	your doctor scares your wife 's teacher 's cousin 's sister 's father 's sister is tired .
the dancer knows that my daughter 's cousin 's boss 's doctor 's daughter 's sister is important .	the dancer scares my daughter 's cousin 's boss 's doctor 's daughter 's sister is important .
your cousin thinks that your dentist 's mother 's grandmother 's cousin 's husband 's boss is lucky .	your cousin helps your dentist 's mother 's grandmother 's cousin 's husband 's boss is lucky .
your boss knows that my daughter 's mother 's friend 's mom 's mother 's dentist is bored .	your boss talks to my daughter 's mother 's friend 's mom 's mother 's dentist is bored .
the dancer thinks that your dentist 's doctor 's son 's husband 's cousin 's mother is young .	the dancer helps your dentist 's doctor 's son 's husband 's cousin 's mother is young .
the person thinks that your teacher 's cousin 's friend 's son 's daughter 's boss is wrong .	the person helps your teacher 's cousin 's friend 's son 's daughter 's boss is wrong .
David says that my grandmother 's boss 's grandmother 's mother 's dad 's mom is healthy .	David talks to my grandmother 's boss 's grandmother 's mother 's dad 's mom is healthy .
the driver knows that my mom 's friend 's dad 's cousin 's dentist 's son is friendly .	the driver works with my mom 's friend 's dad 's cousin 's dentist 's son is friendly .
your cousin thinks that my mom 's mom 's dentist 's dentist 's brother 's daughter is smart .	your cousin scares my mom 's mom 's dentist 's dentist 's brother 's daughter is smart .
my friend thinks that my boss 's sister 's friend 's husband 's friend 's wife is excited .	my friend helps my boss 's sister 's friend 's husband 's friend 's wife is excited .
Amy says that your cousin 's daughter 's sister 's son 's son 's cousin is smart .	Amy works with your cousin 's daughter 's sister 's son 's son 's cousin is smart .
my friend says that my brother 's cousin 's mom 's grandmother 's dad 's mother is surprised .	my friend talks to my brother 's cousin 's mom 's grandmother 's dad 's mother is surprised .
Erin knows that your friend 's teacher 's doctor 's cousin 's husband 's doctor is young .	Erin works with your friend 's teacher 's doctor 's cousin 's husband 's doctor is young .
the dentist thinks that my grandmother 's husband 's teacher 's grandmother 's boss 's brother is helpful .	the dentist scares my grandmother 's husband 's teacher 's grandmother 's boss 's brother is helpful .
my doctor thinks that your brother 's husband 's mother 's wife 's cousin 's mother is happy .	my doctor works with your brother 's husband 's mother 's wife 's cousin 's mother is happy .
my doctor knows that your doctor 's wife 's teacher 's dentist 's son 's father is kind .	my doctor works with your doctor 's wife 's teacher 's dentist 's son 's father is kind .
your boss thinks that your sister 's father 's husband 's boss 's teacher 's wife is tired .	your boss works with your sister 's father 's husband 's boss 's teacher 's wife is tired .
Wendy thinks that my cousin 's cousin 's husband 's father 's friend 's wife is bored .	Wendy scares my cousin 's cousin 's husband 's father 's friend 's wife is bored .
my friend says that my father 's cousin 's doctor 's boss 's father 's father is smart .	my friend talks to my father 's cousin 's doctor 's boss 's father 's father is smart .
Laurie says that my husband 's daughter 's sister 's friend 's dad 's dad is careful .	Laurie works with my husband 's daughter 's sister 's friend 's dad 's dad is careful .
my boss thinks that my brother 's boss 's friend 's friend 's wife 's cousin is quiet .	my boss talks to my brother 's boss 's friend 's friend 's wife 's cousin is quiet .
Gregory knows that my friend 's friend 's wife 's teacher 's brother 's sister is sleepy .	Gregory helps my friend 's friend 's wife 's teacher 's brother 's sister is sleepy .
the person knows that your son 's brother 's dad 's dentist 's friend 's daughter is helpful .	the person scares your son 's brother 's dad 's dentist 's friend 's daughter is helpful .
your teacher says that your friend 's dentist 's son 's cousin 's wife 's cousin is careful .	your teacher scares your friend 's dentist 's son 's cousin 's wife 's cousin is careful .
Mark thinks that your teacher 's brother 's father 's friend 's teacher 's wife is gentle .	Mark talks to your teacher 's brother 's father 's friend 's teacher 's wife is gentle .
your boss says that your sister 's teacher 's teacher 's sister 's brother 's son is happy .	your boss talks to your sister 's teacher 's teacher 's sister 's brother 's son is happy .
my boss thinks that my mom 's teacher 's mother 's cousin 's brother 's grandmother is gentle .	my boss works with my mom 's teacher 's mother 's cousin 's brother 's grandmother is gentle .
April knows that your dad 's dad 's friend 's mother 's boss 's grandmother is excited .	April scares your dad 's dad 's friend 's mother 's boss 's grandmother is excited .
the adult thinks that your dad 's teacher 's son 's dad 's dad 's teacher is excited .	the adult talks to your dad 's teacher 's son 's dad 's dad 's teacher is excited .
Dan says that your doctor 's friend 's cousin 's grandmother 's wife 's cousin is tall .	Dan talks to your doctor 's friend 's cousin 's grandmother 's wife 's cousin is tall .
Jessica says that my teacher 's mom 's father 's mother 's dad 's son is careful .	Jessica works with my teacher 's mom 's father 's mother 's dad 's son is careful .
my boss thinks that your dad 's cousin 's son 's husband 's friend 's daughter is careful .	my boss scares your dad 's cousin 's son 's husband 's friend 's daughter is careful .
the child knows that my wife 's daughter 's husband 's brother 's teacher 's brother is nice .	the child scares my wife 's daughter 's husband 's brother 's teacher 's brother is nice .
Melissa says that my mother 's doctor 's boss 's boss 's father 's father is helpful .	Melissa helps my mother 's doctor 's boss 's boss 's father 's father is helpful .
the doctor knows that your son 's doctor 's sister 's brother 's son 's brother is tired .	the doctor helps your son 's doctor 's sister 's brother 's son 's brother is tired .
the doctor knows that my brother 's cousin 's teacher 's grandmother 's cousin 's doctor is healthy .	the doctor talks to my brother 's cousin 's teacher 's grandmother 's cousin 's doctor is healthy .
your cousin says that my mother 's father 's father 's sister 's boss 's teacher is sleepy .	your cousin talks to my mother 's father 's father 's sister 's boss 's teacher is sleepy .
your teacher says that my mother 's husband 's boss 's daughter 's brother 's cousin is lucky .	your teacher works with my mother 's husband 's boss 's daughter 's brother 's cousin is lucky .
Aaron thinks that my father 's sister 's dad 's doctor 's grandmother 's grandmother is strong .	Aaron helps my father 's sister 's dad 's doctor 's grandmother 's grandmother is strong .
Jill knows that your mother 's dentist 's grandmother 's son 's dentist 's doctor is tired .	Jill talks to your mother 's dentist 's grandmother 's son 's dentist 's doctor is tired .
the dentist says that your mom 's brother 's cousin 's husband 's dentist 's father is confused .	the dentist works with your mom 's brother 's cousin 's husband 's dentist 's father is confused .
the doctor says that my grandmother 's son 's dentist 's mother 's husband 's mom is smart .	the doctor helps my grandmother 's son 's dentist 's mother 's husband 's mom is smart .
John says that your son 's sister 's dad 's friend 's friend 's husband is friendly .	John helps your son 's sister 's dad 's friend 's friend 's husband is friendly .
my cousin knows that my dentist 's son 's father 's son 's mom 's boss is bored .	my cousin helps my dentist 's son 's father 's son 's mom 's boss is bored .
Marie says that my grandmother 's son 's doctor 's grandmother 's doctor 's doctor is busy .	Marie scares my grandmother 's son 's doctor 's grandmother 's doctor 's doctor is busy .
the adult says that your mother 's sister 's dad 's dad 's husband 's wife is confused .	the adult works with your mother 's sister 's dad 's dad 's husband 's wife is confused .
Frank knows that your mom 's boss 's father 's mom 's mom 's cousin is boring .	Frank scares your mom 's boss 's father 's mom 's mom 's cousin is boring .
your dentist thinks that your boss 's cousin 's brother 's daughter 's husband 's daughter is careful .	your dentist helps your boss 's cousin 's brother 's daughter 's husband 's daughter is careful .
my dentist says that your grandmother 's husband 's mother 's dad 's wife 's boss is nice .	my dentist scares your grandmother 's husband 's mother 's dad 's wife 's boss is nice .
my doctor says that my brother 's brother 's wife 's husband 's mom 's teacher is lucky .	my doctor talks to my brother 's brother 's wife 's husband 's mom 's teacher is lucky .
the child says that my friend 's daughter 's doctor 's son 's grandmother 's daughter is important .	the child works with my friend 's daughter 's doctor 's son 's grandmother 's daughter is important .
your cousin says that my cousin 's husband 's mother 's doctor 's son 's teacher is clever .	your cousin talks to my cousin 's husband 's mother 's doctor 's son 's teacher is clever .
the child says that your mother 's husband 's father 's boss 's friend 's mom is happy .	the child scares your mother 's husband 's father 's boss 's friend 's mom is happy .
the customer thinks that your wife 's teacher 's son 's brother 's husband 's sister is smart .	the customer talks to your wife 's teacher 's son 's brother 's husband 's sister is smart .
my boss says that your sister 's friend 's dentist 's mom 's wife 's son is angry .	my boss scares your sister 's friend 's dentist 's mom 's wife 's son is angry .
my boss knows that your friend 's grandmother 's brother 's friend 's dad 's brother is hungry .	my boss helps your friend 's grandmother 's brother 's friend 's dad 's brother is hungry .
your friend knows that my doctor 's cousin 's doctor 's dad 's father 's sister is strong .	your friend talks to my doctor 's cousin 's doctor 's dad 's father 's sister is strong .
the teacher knows that your teacher 's grandmother 's dentist 's brother 's dentist 's mother is lucky .	the teacher works with your teacher 's grandmother 's dentist 's brother 's dentist 's mother is lucky .
Anne knows that your dentist 's mom 's daughter 's dad 's son 's wife is happy .	Anne works with your dentist 's mom 's daughter 's dad 's son 's wife is happy .
the dentist knows that my wife 's brother 's cousin 's husband 's sister 's father is friendly .	the dentist helps my wife 's brother 's cousin 's husband 's sister 's father is friendly .
your cousin says that your friend 's wife 's husband 's cousin 's mother 's doctor is clever .	your cousin talks to your friend 's wife 's husband 's cousin 's mother 's doctor is clever .
your teacher thinks that your dentist 's teacher 's wife 's friend 's dentist 's teacher is healthy .	your teacher works with your dentist 's teacher 's wife 's friend 's dentist 's teacher is healthy .
Erin thinks that my grandmother 's dad 's boss 's doctor 's daughter 's cousin is gentle .	Erin scares my grandmother 's dad 's boss 's doctor 's daughter 's cousin is gentle .
Jane knows that my husband 's dad 's husband 's brother 's dad 's doctor is wrong .	Jane talks to my husband 's dad 's husband 's brother 's dad 's doctor is wrong .
your friend knows that my grandmother 's father 's doctor 's son 's doctor 's father is surprised .	your friend talks to my grandmother 's father 's doctor 's son 's doctor 's father is surprised .
Jessica knows that your mom 's friend 's mother 's wife 's teacher 's sister is sleepy .	Jessica scares your mom 's friend 's mother 's wife 's teacher 's sister is sleepy .
my teacher knows that my friend 's father 's wife 's wife 's mother 's teacher is curious .	my teacher works with my friend 's father 's wife 's wife 's mother 's teacher is curious .
Gregory thinks that my mom 's mom 's cousin 's teacher 's dad 's dentist is excited .	Gregory scares my mom 's mom 's cousin 's teacher 's dad 's dentist is excited .
the adult knows that my cousin 's grandmother 's boss 's friend 's boss 's husband is smart .	the adult works with my cousin 's grandmother 's boss 's friend 's boss 's husband is smart .
the dancer knows that my friend 's grandmother 's husband 's husband 's dentist 's father is surprised .	the dancer works with my friend 's grandmother 's husband 's husband 's dentist 's father is surprised .
my friend thinks that my friend 's doctor 's dentist 's son 's dentist 's mother is friendly .	my friend helps my friend 's doctor 's dentist 's son 's dentist 's mother is friendly .
Janet knows that my doctor 's dentist 's grandmother 's cousin 's brother 's cousin is sleepy .	Janet works with my doctor 's dentist 's grandmother 's cousin 's brother 's cousin is sleepy .
your boss knows that your dentist 's cousin 's sister 's brother 's mom 's dad is careful .	your boss scares your dentist 's cousin 's sister 's brother 's mom 's dad is careful .
the person thinks that my brother 's dentist 's daughter 's daughter 's boss 's teacher is kind .	the person talks to my brother 's dentist 's daughter 's daughter 's boss 's teacher is kind .
your boss knows that my mother 's husband 's teacher 's daughter 's teacher 's mom is hungry .	your boss scares my mother 's husband 's teacher 's daughter 's teacher 's mom is hungry .
Ann knows that your brother 's mom 's grandmother 's mom 's cousin 's dad is kind .	Ann helps your brother 's mom 's grandmother 's mom 's cousin 's dad is kind .
Denise thinks that your teacher 's cousin 's doctor 's mom 's mom 's wife is friendly .	Denise works with your teacher 's cousin 's doctor 's mom 's mom 's wife is friendly .
Sandra knows that your son 's teacher 's son 's dad 's brother 's daughter is excited .	Sandra scares your son 's teacher 's son 's dad 's brother 's daughter is excited .
my doctor thinks that your daughter 's mom 's brother 's brother 's mom 's cousin is clever .	my doctor works with your daughter 's mom 's brother 's brother 's mom 's cousin is clever .
