the car gave my grandmother 's son 's husband 's glass the rug .	the car cleaned my grandmother 's son 's husband 's glass the rug .
the hat gave your dentist 's friend 's friend 's plate the bag .	the hat moved your dentist 's friend 's friend 's plate the bag .
the mirror showed your mother 's sister 's doctor 's cup the spoon .	the mirror dropped your mother 's sister 's doctor 's cup the spoon .
the book showed your brother 's doctor 's teacher 's glass the book .	the book moved your brother 's doctor 's teacher 's glass the book .
the fork gave your wife 's wife 's daughter 's mirror the car .	the fork cleaned your wife 's wife 's daughter 's mirror the car .
the car sent my brother 's teacher 's daughter 's fork the book .	the car cleaned my brother 's teacher 's daughter 's fork the book .
the couch sent my dentist 's dad 's sister 's glass the shoe .	the couch shook my dentist 's dad 's sister 's glass the shoe .
the hat gave my cousin 's dentist 's son 's cup the mirror .	the hat moved my cousin 's dentist 's son 's cup the mirror .
the book showed my boss 's teacher 's teacher 's car the boat .	the book moved my boss 's teacher 's teacher 's car the boat .
the hat gave my grandmother 's doctor 's son 's bicycle the bed .	the hat moved my grandmother 's doctor 's son 's bicycle the bed .
the dish showed my sister 's doctor 's son 's bed the doll .	the dish shook my sister 's doctor 's son 's bed the doll .
the box sent your husband 's sister 's dad 's rocket the book .	the box dropped your husband 's sister 's dad 's rocket the book .
the car sent my son 's boss 's friend 's mirror the book .	the car kept my son 's boss 's friend 's mirror the book .
the button sent your father 's son 's brother 's door the cup .	the button shook your father 's son 's brother 's door the cup .
the shoe bought your mother 's boss 's friend 's bicycle the book .	the shoe lost your mother 's boss 's friend 's bicycle the book .
the car sent your dad 's teacher 's dad 's shoe the bowl .	the car kept your dad 's teacher 's dad 's shoe the bowl .
the book showed your doctor 's friend 's friend 's hat the truck .	the book dropped your doctor 's friend 's friend 's hat the truck .
the hat sent your boss 's cousin 's brother 's bowl the dish .	the hat kept your boss 's cousin 's brother 's bowl the dish .
the box showed your boss 's mother 's mother 's hat the mirror .	the box shook your boss 's mother 's mother 's hat the mirror .
the candle bought my husband 's grandmother 's dad 's couch the book .	the candle lost my husband 's grandmother 's dad 's couch the book .
the crayon gave my father 's mom 's daughter 's bicycle the doll .	the crayon moved my father 's mom 's daughter 's bicycle the doll .
the bottle sent my boss 's cousin 's father 's crayon the car .	the bottle dropped my boss 's cousin 's father 's crayon the car .
the spoon bought my mom 's teacher 's cousin 's rocket the doll .	the spoon lost my mom 's teacher 's cousin 's rocket the doll .
the chair gave your grandmother 's friend 's wife 's cup the cup .	the chair held your grandmother 's friend 's wife 's cup the cup .
the rocket showed my mother 's daughter 's daughter 's book the fork .	the rocket kept my mother 's daughter 's daughter 's book the fork .
the mirror gave my son 's doctor 's son 's rug the ring .	the mirror moved my son 's doctor 's son 's rug the ring .
the window bought my mom 's sister 's doctor 's book the car .	the window cleaned my mom 's sister 's doctor 's book the car .
the car gave my teacher 's grandmother 's friend 's doll the rocket .	the car cleaned my teacher 's grandmother 's friend 's doll the rocket .
the bottle gave my teacher 's friend 's brother 's cup the car .	the bottle cleaned my teacher 's friend 's brother 's cup the car .
the glass showed your sister 's dentist 's friend 's shirt the shoe .	the glass cleaned your sister 's dentist 's friend 's shirt the shoe .
the spoon sent your daughter 's son 's friend 's cup the bag .	the spoon cleaned your daughter 's son 's friend 's cup the bag .
the plate bought your boss 's mom 's cousin 's bag the bottle .	the plate dropped your boss 's mom 's cousin 's bag the bottle .
the bed showed your cousin 's daughter 's teacher 's rocket the truck .	the bed cleaned your cousin 's daughter 's teacher 's rocket the truck .
the window bought your wife 's friend 's father 's plane the chair .	the window kept your wife 's friend 's father 's plane the chair .
the door gave my brother 's grandmother 's grandmother 's rug the boat .	the door cleaned my brother 's grandmother 's grandmother 's rug the boat .
the button gave my friend 's father 's brother 's crayon the car .	the button dropped my friend 's father 's brother 's crayon the car .
the car showed my grandmother 's brother 's mother 's couch the shirt .	the car shook my grandmother 's brother 's mother 's couch the shirt .
the boat sent my grandmother 's cousin 's son 's bag the bed .	the boat dropped my grandmother 's cousin 's son 's bag the bed .
the truck gave your sister 's dentist 's brother 's car the box .	the truck dropped your sister 's dentist 's brother 's car the box .
the dish bought your doctor 's mother 's dad 's door the glass .	the dish dropped your doctor 's mother 's dad 's door the glass .
the picture sent your dentist 's dentist 's brother 's rug the shoe .	the picture moved your dentist 's dentist 's brother 's rug the shoe .
the bed bought your dentist 's dentist 's father 's bed the shirt .	the bed moved your dentist 's dentist 's father 's bed the shirt .
the book sent your husband 's dentist 's dad 's chair the ring .	the book lost your husband 's dentist 's dad 's chair the ring .
the bowl gave your son 's brother 's dentist 's ship the crayon .	the bowl cleaned your son 's brother 's dentist 's ship the crayon .
the toy bought your husband 's grandmother 's wife 's spoon the mirror .	the toy held your husband 's grandmother 's wife 's spoon the mirror .
the book gave your mother 's dad 's teacher 's cup the bed .	the book moved your mother 's dad 's teacher 's cup the bed .
the door bought my husband 's boss 's doctor 's plate the box .	the door dropped my husband 's boss 's doctor 's plate the box .
the dish bought your mother 's boss 's father 's bag the box .	the dish lost your mother 's boss 's father 's bag the box .
the window showed my dad 's doctor 's grandmother 's bicycle the picture .	the window held my dad 's doctor 's grandmother 's bicycle the picture .
the window sent my mom 's doctor 's dad 's door the truck .	the window lost my mom 's doctor 's dad 's door the truck .
the bottle bought my friend 's grandmother 's daughter 's spoon the bottle .	the bottle lost my friend 's grandmother 's daughter 's spoon the bottle .
the ring showed your grandmother 's boss 's mom 's box the door .	the ring shook your grandmother 's boss 's mom 's box the door .
the bed sent your sister 's son 's wife 's hat the plane .	the bed dropped your sister 's son 's wife 's hat the plane .
the plate gave my father 's doctor 's boss 's truck the picture .	the plate cleaned my father 's doctor 's boss 's truck the picture .
the plate showed your dad 's dad 's husband 's car the crayon .	the plate moved your dad 's dad 's husband 's car the crayon .
the window bought your dentist 's husband 's son 's plate the fork .	the window cleaned your dentist 's husband 's son 's plate the fork .
the bowl sent my cousin 's friend 's mother 's bed the bowl .	the bowl dropped my cousin 's friend 's mother 's bed the bowl .
the door showed my dentist 's boss 's mom 's cup the rocket .	the door moved my dentist 's boss 's mom 's cup the rocket .
the book bought my grandmother 's father 's boss 's car the button .	the book lost my grandmother 's father 's boss 's car the button .
the candle sent your sister 's wife 's brother 's truck the couch .	the candle moved your sister 's wife 's brother 's truck the couch .
the rocket gave my boss 's dad 's brother 's couch the plane .	the rocket held my boss 's dad 's brother 's couch the plane .
the truck gave your daughter 's cousin 's grandmother 's picture the box .	the truck shook your daughter 's cousin 's grandmother 's picture the box .
the shoe showed your mother 's brother 's sister 's dish the shoe .	the shoe dropped your mother 's brother 's sister 's dish the shoe .
the door bought my son 's mom 's mother 's plane the candle .	the door shook my son 's mom 's mother 's plane the candle .
the ring gave my grandmother 's wife 's boss 's dish the shirt .	the ring moved my grandmother 's wife 's boss 's dish the shirt .
the couch sent my friend 's daughter 's son 's car the doll .	the couch dropped my friend 's daughter 's son 's car the doll .
the bed sent my son 's husband 's doctor 's glass the car .	the bed cleaned my son 's husband 's doctor 's glass the car .
the book bought your sister 's dentist 's teacher 's hat the bowl .	the book shook your sister 's dentist 's teacher 's hat the bowl .
the fork sent my mother 's brother 's mother 's car the chair .	the fork held my mother 's brother 's mother 's car the chair .
the chair bought your doctor 's wife 's grandmother 's ring the bowl .	the chair kept your doctor 's wife 's grandmother 's ring the bowl .
the cup showed my daughter 's brother 's dad 's book the hat .	the cup dropped my daughter 's brother 's dad 's book the hat .
the rocket gave my doctor 's dad 's boss 's toy the chair .	the rocket shook my doctor 's dad 's boss 's toy the chair .
the hat bought my dad 's cousin 's cousin 's cup the car .	the hat kept my dad 's cousin 's cousin 's cup the car .
the fork bought your mom 's dentist 's wife 's bicycle the box .	the fork lost your mom 's dentist 's wife 's bicycle the box .
the boat bought my boss 's husband 's cousin 's plate the spoon .	the boat moved my boss 's husband 's cousin 's plate the spoon .
the hat sent my dentist 's teacher 's dentist 's window the toy .	the hat held my dentist 's teacher 's dentist 's window the toy .
the toy showed your son 's dad 's cousin 's hat the glass .	the toy shook your son 's dad 's cousin 's hat the glass .
the book showed my grandmother 's doctor 's wife 's couch the toy .	the book dropped my grandmother 's doctor 's wife 's couch the toy .
the rug showed your cousin 's teacher 's friend 's book the bed .	the rug moved your cousin 's teacher 's friend 's book the bed .
the plate showed your cousin 's doctor 's son 's shoe the rocket .	the plate moved your cousin 's doctor 's son 's shoe the rocket .
the toy showed your husband 's cousin 's mom 's bowl the couch .	the toy lost your husband 's cousin 's mom 's bowl the couch .
the bag sent my brother 's teacher 's brother 's shoe the crayon .	the bag dropped my brother 's teacher 's brother 's shoe the crayon .
the bottle bought your doctor 's dentist 's cousin 's toy the hat .	the bottle lost your doctor 's dentist 's cousin 's toy the hat .
the rocket sent your mother 's father 's husband 's doll the mirror .	the rocket held your mother 's father 's husband 's doll the mirror .
the button sent my son 's cousin 's doctor 's car the glass .	the button held my son 's cousin 's doctor 's car the glass .
the bicycle bought my friend 's wife 's son 's button the ring .	the bicycle moved my friend 's wife 's son 's button the ring .
the candle gave my sister 's sister 's doctor 's spoon the mirror .	the candle kept my sister 's sister 's doctor 's spoon the mirror .
the picture gave my daughter 's doctor 's son 's fork the chair .	the picture held my daughter 's doctor 's son 's fork the chair .
the couch gave your sister 's cousin 's father 's car the rug .	the couch dropped your sister 's cousin 's father 's car the rug .
the door showed my dad 's teacher 's dad 's book the book .	the door cleaned my dad 's teacher 's dad 's book the book .
the mirror bought my doctor 's cousin 's grandmother 's spoon the button .	the mirror kept my doctor 's cousin 's grandmother 's spoon the button .
the truck sent your son 's grandmother 's doctor 's shoe the shoe .	the truck dropped your son 's grandmother 's doctor 's shoe the shoe .
the window bought my daughter 's husband 's dad 's fork the dish .	the window lost my daughter 's husband 's dad 's fork the dish .
the toy gave your teacher 's dentist 's grandmother 's bowl the ring .	the toy shook your teacher 's dentist 's grandmother 's bowl the ring .
the picture sent your mother 's sister 's sister 's candle the window .	the picture kept your mother 's sister 's sister 's candle the window .
the ship showed my boss 's dad 's daughter 's plate the door .	the ship moved my boss 's dad 's daughter 's plate the door .
the hat gave your dad 's daughter 's teacher 's ship the ship .	the hat kept your dad 's daughter 's teacher 's ship the ship .
the truck gave my friend 's sister 's brother 's glass the shirt .	the truck cleaned my friend 's sister 's brother 's glass the shirt .
the truck showed my mom 's grandmother 's grandmother 's car the shoe .	the truck shook my mom 's grandmother 's grandmother 's car the shoe .
the car bought your father 's cousin 's boss 's chair the couch .	the car dropped your father 's cousin 's boss 's chair the couch .
the crayon gave my mother 's daughter 's boss 's ship the bicycle .	the crayon held my mother 's daughter 's boss 's ship the bicycle .
the chair showed your dad 's husband 's grandmother 's chair the mirror .	the chair cleaned your dad 's husband 's grandmother 's chair the mirror .
the plate showed my mother 's dad 's friend 's truck the hat .	the plate moved my mother 's dad 's friend 's truck the hat .
the bag gave your brother 's father 's wife 's box the shirt .	the bag shook your brother 's father 's wife 's box the shirt .
the rocket gave your boss 's father 's boss 's picture the truck .	the rocket moved your boss 's father 's boss 's picture the truck .
the ship showed my son 's cousin 's doctor 's picture the candle .	the ship moved my son 's cousin 's doctor 's picture the candle .
the car showed your father 's doctor 's doctor 's picture the plane .	the car kept your father 's doctor 's doctor 's picture the plane .
the box gave your brother 's son 's wife 's shirt the rug .	the box cleaned your brother 's son 's wife 's shirt the rug .
the bowl showed my mother 's teacher 's sister 's car the toy .	the bowl shook my mother 's teacher 's sister 's car the toy .
the chair sent my teacher 's teacher 's son 's book the door .	the chair moved my teacher 's teacher 's son 's book the door .
the cup gave my dentist 's boss 's daughter 's glass the book .	the cup lost my dentist 's boss 's daughter 's glass the book .
the picture sent your son 's doctor 's doctor 's car the rocket .	the picture shook your son 's doctor 's doctor 's car the rocket .
the ship gave your grandmother 's wife 's friend 's mirror the rocket .	the ship moved your grandmother 's wife 's friend 's mirror the rocket .
the book sent your teacher 's mother 's father 's cup the window .	the book dropped your teacher 's mother 's father 's cup the window .
the bottle bought your mom 's wife 's mother 's shoe the car .	the bottle cleaned your mom 's wife 's mother 's shoe the car .
the rocket showed my cousin 's brother 's friend 's bowl the doll .	the rocket shook my cousin 's brother 's friend 's bowl the doll .
the truck showed your dad 's boss 's grandmother 's plane the bag .	the truck kept your dad 's boss 's grandmother 's plane the bag .
the picture bought my brother 's friend 's teacher 's car the picture .	the picture shook my brother 's friend 's teacher 's car the picture .
the ring gave your son 's daughter 's boss 's box the spoon .	the ring kept your son 's daughter 's boss 's box the spoon .
the hat bought my father 's teacher 's grandmother 's book the candle .	the hat lost my father 's teacher 's grandmother 's book the candle .
the glass showed my husband 's husband 's cousin 's crayon the truck .	the glass held my husband 's husband 's cousin 's crayon the truck .
the plate showed my friend 's dentist 's wife 's car the chair .	the plate shook my friend 's dentist 's wife 's car the chair .
the plate bought your daughter 's mom 's cousin 's rocket the ring .	the plate shook your daughter 's mom 's cousin 's rocket the ring .
the rocket gave your sister 's daughter 's brother 's glass the plate .	the rocket moved your sister 's daughter 's brother 's glass the plate .
the bicycle sent your brother 's daughter 's mother 's picture the shoe .	the bicycle shook your brother 's daughter 's mother 's picture the shoe .
the car showed your cousin 's dad 's wife 's ring the window .	the car dropped your cousin 's dad 's wife 's ring the window .
the doll bought your father 's mom 's dentist 's picture the chair .	the doll held your father 's mom 's dentist 's picture the chair .
the plane bought your dad 's dad 's boss 's ring the bottle .	the plane cleaned your dad 's dad 's boss 's ring the bottle .
the picture showed your mom 's grandmother 's boss 's hat the fork .	the picture dropped your mom 's grandmother 's boss 's hat the fork .
the rocket sent my husband 's mom 's brother 's book the fork .	the rocket moved my husband 's mom 's brother 's book the fork .
the bed gave your teacher 's father 's dad 's cup the dish .	the bed moved your teacher 's father 's dad 's cup the dish .
the fork sent my father 's friend 's teacher 's bag the book .	the fork held my father 's friend 's teacher 's bag the book .
the shoe showed your father 's son 's husband 's spoon the box .	the shoe held your father 's son 's husband 's spoon the box .
the dish showed my father 's friend 's brother 's bottle the shirt .	the dish shook my father 's friend 's brother 's bottle the shirt .
the car showed your wife 's mom 's sister 's dish the mirror .	the car dropped your wife 's mom 's sister 's dish the mirror .
the window gave my friend 's father 's father 's door the crayon .	the window lost my friend 's father 's father 's door the crayon .
the hat bought your daughter 's husband 's mom 's chair the fork .	the hat dropped your daughter 's husband 's mom 's chair the fork .
the cup gave your cousin 's grandmother 's doctor 's chair the boat .	the cup moved your cousin 's grandmother 's doctor 's chair the boat .
the bag bought my cousin 's friend 's wife 's bicycle the doll .	the bag shook my cousin 's friend 's wife 's bicycle the doll .
the book bought your grandmother 's mother 's teacher 's crayon the spoon .	the book moved your grandmother 's mother 's teacher 's crayon the spoon .
the door bought your mom 's mom 's wife 's couch the bed .	the door kept your mom 's mom 's wife 's couch the bed .
the doll bought my sister 's grandmother 's cousin 's car the book .	the doll lost my sister 's grandmother 's cousin 's car the book .
the window gave your doctor 's brother 's son 's mirror the shirt .	the window cleaned your doctor 's brother 's son 's mirror the shirt .
the glass sent your friend 's teacher 's doctor 's picture the box .	the glass shook your friend 's teacher 's doctor 's picture the box .
the doll gave your father 's doctor 's father 's truck the ring .	the doll held your father 's doctor 's father 's truck the ring .
the cup sent your brother 's dentist 's father 's spoon the picture .	the cup lost your brother 's dentist 's father 's spoon the picture .
the bag showed my boss 's sister 's friend 's couch the box .	the bag shook my boss 's sister 's friend 's couch the box .
the book sent my boss 's boss 's son 's bed the spoon .	the book kept my boss 's boss 's son 's bed the spoon .
the chair sent my brother 's dad 's grandmother 's plane the bed .	the chair lost my brother 's dad 's grandmother 's plane the bed .
the plate bought my son 's teacher 's dentist 's ship the bed .	the plate kept my son 's teacher 's dentist 's ship the bed .
the window gave my dad 's daughter 's mom 's ship the mirror .	the window moved my dad 's daughter 's mom 's ship the mirror .
the book bought my father 's daughter 's father 's bed the shirt .	the book kept my father 's daughter 's father 's bed the shirt .
the fork bought your husband 's mom 's friend 's truck the ring .	the fork shook your husband 's mom 's friend 's truck the ring .
the candle sent my daughter 's brother 's daughter 's bicycle the rocket .	the candle shook my daughter 's brother 's daughter 's bicycle the rocket .
the glass bought my son 's cousin 's father 's truck the book .	the glass dropped my son 's cousin 's father 's truck the book .
the truck sent my dad 's teacher 's mother 's toy the picture .	the truck dropped my dad 's teacher 's mother 's toy the picture .
the toy bought your son 's dentist 's doctor 's picture the shoe .	the toy dropped your son 's dentist 's doctor 's picture the shoe .
the plane bought your daughter 's husband 's doctor 's dish the chair .	the plane held your daughter 's husband 's doctor 's dish the chair .
the bed sent your friend 's sister 's husband 's door the bicycle .	the bed cleaned your friend 's sister 's husband 's door the bicycle .
the dish bought your grandmother 's daughter 's teacher 's ship the ring .	the dish kept your grandmother 's daughter 's teacher 's ship the ring .
the button sent your mother 's sister 's father 's shirt the door .	the button dropped your mother 's sister 's father 's shirt the door .
the chair bought your dentist 's friend 's brother 's rug the box .	the chair lost your dentist 's friend 's brother 's rug the box .
the rug sent my husband 's dad 's son 's car the boat .	the rug dropped my husband 's dad 's son 's car the boat .
the rug gave your husband 's dentist 's son 's cup the bicycle .	the rug moved your husband 's dentist 's son 's cup the bicycle .
the rocket sent my father 's father 's teacher 's bottle the hat .	the rocket dropped my father 's father 's teacher 's bottle the hat .
the couch showed my mom 's cousin 's mother 's car the plane .	the couch kept my mom 's cousin 's mother 's car the plane .
the picture showed your son 's doctor 's boss 's glass the crayon .	the picture cleaned your son 's doctor 's boss 's glass the crayon .
the shirt sent my daughter 's mom 's teacher 's car the crayon .	the shirt shook my daughter 's mom 's teacher 's car the crayon .
the button bought your wife 's dentist 's wife 's doll the glass .	the button held your wife 's dentist 's wife 's doll the glass .
the shoe bought your wife 's mother 's doctor 's picture the fork .	the shoe dropped your wife 's mother 's doctor 's picture the fork .
the dish gave my mom 's friend 's doctor 's rocket the spoon .	the dish kept my mom 's friend 's doctor 's rocket the spoon .
the box bought your dad 's grandmother 's daughter 's couch the bowl .	the box held your dad 's grandmother 's daughter 's couch the bowl .
the chair sent my boss 's dad 's wife 's ring the button .	the chair cleaned my boss 's dad 's wife 's ring the button .
the bag bought your grandmother 's father 's friend 's ring the spoon .	the bag moved your grandmother 's father 's friend 's ring the spoon .
the bowl sent your wife 's doctor 's friend 's candle the button .	the bowl lost your wife 's doctor 's friend 's candle the button .
the bottle sent my doctor 's father 's boss 's bag the ship .	the bottle kept my doctor 's father 's boss 's bag the ship .
the dish showed my brother 's dentist 's mom 's fork the spoon .	the dish lost my brother 's dentist 's mom 's fork the spoon .
the plate sent my sister 's friend 's grandmother 's plate the book .	the plate held my sister 's friend 's grandmother 's plate the book .
the plane bought your dentist 's mother 's mother 's hat the book .	the plane dropped your dentist 's mother 's mother 's hat the book .
the ring bought your sister 's dentist 's teacher 's chair the box .	the ring shook your sister 's dentist 's teacher 's chair the box .
the shoe sent your wife 's dentist 's brother 's rug the ring .	the shoe cleaned your wife 's dentist 's brother 's rug the ring .
the rocket gave my dad 's boss 's husband 's candle the plate .	the rocket moved my dad 's boss 's husband 's candle the plate .
the shoe sent your wife 's grandmother 's mother 's bed the bag .	the shoe held your wife 's grandmother 's mother 's bed the bag .
the hat gave my cousin 's daughter 's daughter 's rug the book .	the hat dropped my cousin 's daughter 's daughter 's rug the book .
the book bought your sister 's dentist 's mother 's couch the cup .	the book moved your sister 's dentist 's mother 's couch the cup .
the glass showed your sister 's mother 's friend 's shirt the picture .	the glass kept your sister 's mother 's friend 's shirt the picture .
the cup gave your mom 's grandmother 's mom 's door the rug .	the cup moved your mom 's grandmother 's mom 's door the rug .
the candle bought your cousin 's mother 's mother 's book the box .	the candle cleaned your cousin 's mother 's mother 's book the box .
the chair showed my grandmother 's cousin 's brother 's cup the fork .	the chair cleaned my grandmother 's cousin 's brother 's cup the fork .
the mirror gave my dad 's teacher 's teacher 's rug the bottle .	the mirror dropped my dad 's teacher 's teacher 's rug the bottle .
the plate sent your son 's wife 's boss 's box the ring .	the plate held your son 's wife 's boss 's box the ring .
the ship bought my friend 's son 's teacher 's rug the plate .	the ship kept my friend 's son 's teacher 's rug the plate .
the couch showed my husband 's grandmother 's boss 's car the car .	the couch shook my husband 's grandmother 's boss 's car the car .
the hat bought my dentist 's dad 's father 's rocket the cup .	the hat shook my dentist 's dad 's father 's rocket the cup .
the box bought my teacher 's cousin 's mother 's plate the bottle .	the box moved my teacher 's cousin 's mother 's plate the bottle .
the boat gave my friend 's daughter 's mother 's toy the spoon .	the boat shook my friend 's daughter 's mother 's toy the spoon .
