the driver says that my mom 's mom 's dentist 's father 's teacher is angry .	the driver works with my mom 's mom 's dentist 's father 's teacher is angry .
my boss thinks that your teacher 's wife 's son 's cousin 's son is lucky .	my boss works with your teacher 's wife 's son 's cousin 's son is lucky .
the dentist knows that my sister 's boss 's dentist 's boss 's father is friendly .	the dentist talks to my sister 's boss 's dentist 's boss 's father is friendly .
my dentist says that your husband 's teacher 's mom 's dad 's mother is friendly .	my dentist works with your husband 's teacher 's mom 's dad 's mother is friendly .
the dancer says that your teacher 's grandmother 's son 's wife 's sister is confused .	the dancer scares your teacher 's grandmother 's son 's wife 's sister is confused .
my doctor thinks that my mom 's boss 's mother 's mother 's daughter is important .	my doctor helps my mom 's boss 's mother 's mother 's daughter is important .
your boss thinks that your daughter 's boss 's sister 's sister 's mother is kind .	your boss talks to your daughter 's boss 's sister 's sister 's mother is kind .
your doctor says that my grandmother 's boss 's father 's friend 's cousin is tall .	your doctor works with my grandmother 's boss 's father 's friend 's cousin is tall .
your teacher thinks that my mom 's friend 's wife 's son 's doctor is strong .	your teacher helps my mom 's friend 's wife 's son 's doctor is strong .
your friend thinks that your cousin 's sister 's daughter 's doctor 's father is happy .	your friend works with your cousin 's sister 's daughter 's doctor 's father is happy .
the customer knows that my husband 's doctor 's father 's son 's dad is sleepy .	the customer talks to my husband 's doctor 's father 's son 's dad is sleepy .
the patient thinks that your grandmother 's sister 's doctor 's mother 's dad is strong .	the patient talks to your grandmother 's sister 's doctor 's mother 's dad is strong .
the patient says that my brother 's dad 's dentist 's daughter 's friend is excited .	the patient works with my brother 's dad 's dentist 's daughter 's friend is excited .
the dentist says that your son 's cousin 's friend 's mother 's son is confused .	the dentist works with your son 's cousin 's friend 's mother 's son is confused .
your teacher thinks that your mother 's boss 's mom 's husband 's daughter is lucky .	your teacher helps your mother 's boss 's mom 's husband 's daughter is lucky .
the person says that your doctor 's husband 's daughter 's teacher 's father is busy .	the person talks to your doctor 's husband 's daughter 's teacher 's father is busy .
Paul thinks that my teacher 's daughter 's teacher 's brother 's father is curious .	Paul scares my teacher 's daughter 's teacher 's brother 's father is curious .
the teacher knows that my father 's friend 's daughter 's teacher 's mother is clever .	the teacher helps my father 's friend 's daughter 's teacher 's mother is clever .
the dentist knows that my sister 's wife 's brother 's sister 's friend is angry .	the dentist scares my sister 's wife 's brother 's sister 's friend is angry .
my boss thinks that my brother 's father 's dentist 's doctor 's father is gentle .	my boss works with my brother 's father 's dentist 's doctor 's father is gentle .
Aaron knows that my father 's friend 's brother 's mother 's mother is tall .	Aaron scares my father 's friend 's brother 's mother 's mother is tall .
the patient knows that your dad 's boss 's wife 's cousin 's brother is friendly .	the patient helps your dad 's boss 's wife 's cousin 's brother is friendly .
Christopher knows that your brother 's boss 's mom 's grandmother 's mother is busy .	Christopher scares your brother 's boss 's mom 's grandmother 's mother is busy .
Timothy says that my cousin 's son 's boss 's sister 's cousin is helpful .	Timothy talks to my cousin 's son 's boss 's sister 's cousin is helpful .
the teacher thinks that your husband 's sister 's daughter 's teacher 's friend is wrong .	the teacher helps your husband 's sister 's daughter 's teacher 's friend is wrong .
your teacher thinks that your daughter 's wife 's wife 's cousin 's sister is surprised .	your teacher works with your daughter 's wife 's wife 's cousin 's sister is surprised .
Wendy knows that my teacher 's brother 's son 's husband 's doctor is kind .	Wendy works with my teacher 's brother 's son 's husband 's doctor is kind .
Todd says that your father 's son 's sister 's dentist 's husband is nice .	Todd scares your father 's son 's sister 's dentist 's husband is nice .
the dancer says that my son 's daughter 's boss 's daughter 's father is important .	the dancer works with my son 's daughter 's boss 's daughter 's father is important .
the driver knows that your friend 's boss 's sister 's dentist 's dad is surprised .	the driver scares your friend 's boss 's sister 's dentist 's dad is surprised .
Wendy says that your daughter 's mom 's husband 's brother 's dentist is tall .	Wendy talks to your daughter 's mom 's husband 's brother 's dentist is tall .
the doctor thinks that your wife 's husband 's dentist 's father 's husband is smart .	the doctor scares your wife 's husband 's dentist 's father 's husband is smart .
the dancer knows that your mother 's husband 's dentist 's doctor 's dad is curious .	the dancer helps your mother 's husband 's dentist 's doctor 's dad is curious .
my friend knows that your boss 's dad 's sister 's dad 's husband is happy .	my friend scares your boss 's dad 's sister 's dad 's husband is happy .
Julie says that your brother 's sister 's father 's husband 's teacher is healthy .	Julie helps your brother 's sister 's father 's husband 's teacher is healthy .
the teacher knows that my grandmother 's teacher 's boss 's teacher 's brother is busy .	the teacher scares my grandmother 's teacher 's boss 's teacher 's brother is busy .
the dentist thinks that your cousin 's wife 's brother 's father 's father is tired .	the dentist works with your cousin 's wife 's brother 's father 's father is tired .
my boss knows that your sister 's mother 's friend 's father 's son is nice .	my boss talks to your sister 's mother 's friend 's father 's son is nice .
my doctor thinks that my son 's son 's son 's boss 's sister is important .	my doctor talks to my son 's son 's son 's boss 's sister is important .
the doctor knows that my daughter 's dentist 's son 's boss 's grandmother is excited .	the doctor talks to my daughter 's dentist 's son 's boss 's grandmother is excited .
the patient knows that your father 's husband 's friend 's son 's doctor is clever .	the patient scares your father 's husband 's friend 's son 's doctor is clever .
the adult knows that my grandmother 's teacher 's boss 's son 's brother is clever .	the adult talks to my grandmother 's teacher 's boss 's son 's brother is clever .
the customer thinks that your mother 's grandmother 's boss 's husband 's wife is angry .	the customer helps your mother 's grandmother 's boss 's husband 's wife is angry .
your friend says that your son 's brother 's wife 's wife 's cousin is curious .	your friend works with your son 's brother 's wife 's wife 's cousin is curious .
your doctor knows that your sister 's teacher 's father 's husband 's son is strong .	your doctor works with your sister 's teacher 's father 's husband 's son is strong .
Denise knows that your dad 's daughter 's mother 's dad 's teacher is clever .	Denise talks to your dad 's daughter 's mother 's dad 's teacher is clever .
my doctor says that your dentist 's dentist 's boss 's dad 's mom is surprised .	my doctor works with your dentist 's dentist 's boss 's dad 's mom is surprised .
my friend says that your dad 's sister 's cousin 's cousin 's son is hungry .	my friend helps your dad 's sister 's cousin 's cousin 's son is hungry .
the teacher knows that your son 's sister 's dad 's father 's daughter is nice .	the teacher helps your son 's sister 's dad 's father 's daughter is nice .
Melissa says that your friend 's mom 's grandmother 's father 's son is nice .	Melissa helps your friend 's mom 's grandmother 's father 's son is nice .
William knows that my teacher 's mother 's dad 's mom 's cousin is important .	William helps my teacher 's mother 's dad 's mom 's cousin is important .
the teacher says that your brother 's father 's teacher 's doctor 's doctor is young .	the teacher helps your brother 's father 's teacher 's doctor 's doctor is young .
Becky knows that your dad 's mom 's brother 's mom 's brother is hungry .	Becky works with your dad 's mom 's brother 's mom 's brother is hungry .
the doctor says that my husband 's doctor 's brother 's dentist 's wife is tall .	the doctor scares my husband 's doctor 's brother 's dentist 's wife is tall .
your cousin knows that my friend 's husband 's boss 's friend 's dentist is friendly .	your cousin helps my friend 's husband 's boss 's friend 's dentist is friendly .
the dentist knows that my daughter 's sister 's grandmother 's teacher 's boss is curious .	the dentist scares my daughter 's sister 's grandmother 's teacher 's boss is curious .
your dentist knows that my brother 's doctor 's cousin 's friend 's brother is upset .	your dentist talks to my brother 's doctor 's cousin 's friend 's brother is upset .
the patient knows that my dentist 's brother 's husband 's dad 's mother is busy .	the patient scares my dentist 's brother 's husband 's dad 's mother is busy .
the adult thinks that my cousin 's mother 's boss 's cousin 's dentist is confused .	the adult talks to my cousin 's mother 's boss 's cousin 's dentist is confused .
the driver knows that your mother 's sister 's wife 's wife 's friend is busy .	the driver scares your mother 's sister 's wife 's wife 's friend is busy .
Melissa says that your teacher 's son 's grandmother 's father 's son is quiet .	Melissa talks to your teacher 's son 's grandmother 's father 's son is quiet .
my doctor thinks that your boss 's grandmother 's grandmother 's dad 's mom is hungry .	my doctor scares your boss 's grandmother 's grandmother 's dad 's mom is hungry .
your friend knows that my cousin 's teacher 's friend 's grandmother 's sister is careful .	your friend works with my cousin 's teacher 's friend 's grandmother 's sister is careful .
the dancer thinks that your friend 's mom 's grandmother 's father 's cousin is sleepy .	the dancer helps your friend 's mom 's grandmother 's father 's cousin is sleepy .
my dentist thinks that my boss 's dad 's doctor 's husband 's brother is wrong .	my dentist talks to my boss 's dad 's doctor 's husband 's brother is wrong .
the driver thinks that your mother 's doctor 's teacher 's mom 's brother is friendly .	the driver works with your mother 's doctor 's teacher 's mom 's brother is friendly .
Anne says that your husband 's father 's father 's dad 's cousin is strong .	Anne works with your husband 's father 's father 's dad 's cousin is strong .
my friend says that your son 's daughter 's dentist 's daughter 's teacher is friendly .	my friend talks to your son 's daughter 's dentist 's daughter 's teacher is friendly .
the customer knows that my brother 's dad 's boss 's husband 's dad is friendly .	the customer scares my brother 's dad 's boss 's husband 's dad is friendly .
the dancer knows that your dentist 's mother 's boss 's cousin 's doctor is boring .	the dancer talks to your dentist 's mother 's boss 's cousin 's doctor is boring .
Anna thinks that your brother 's daughter 's son 's daughter 's dad is busy .	Anna helps your brother 's daughter 's son 's daughter 's dad is busy .
Ann knows that your wife 's brother 's teacher 's sister 's wife is nice .	Ann works with your wife 's brother 's teacher 's sister 's wife is nice .
Daniel knows that your cousin 's husband 's sister 's dentist 's boss is confused .	Daniel talks to your cousin 's husband 's sister 's dentist 's boss is confused .
your teacher says that my mother 's cousin 's boss 's son 's sister is tall .	your teacher helps my mother 's cousin 's boss 's son 's sister is tall .
Eric knows that your daughter 's friend 's daughter 's father 's dentist is busy .	Eric talks to your daughter 's friend 's daughter 's father 's dentist is busy .
Amy says that my dentist 's father 's doctor 's daughter 's mother is quiet .	Amy works with my dentist 's father 's doctor 's daughter 's mother is quiet .
the person knows that your friend 's daughter 's grandmother 's teacher 's boss is excited .	the person works with your friend 's daughter 's grandmother 's teacher 's boss is excited .
my doctor says that your dentist 's wife 's friend 's cousin 's dad is kind .	my doctor scares your dentist 's wife 's friend 's cousin 's dad is kind .
Barbara says that your wife 's daughter 's friend 's mom 's dad is tall .	Barbara scares your wife 's daughter 's friend 's mom 's dad is tall .
the patient says that your father 's brother 's doctor 's grandmother 's cousin is boring .	the patient scares your father 's brother 's doctor 's grandmother 's cousin is boring .
Linda says that your cousin 's dad 's friend 's son 's mother is important .	Linda helps your cousin 's dad 's friend 's son 's mother is important .
Sara says that my friend 's sister 's boss 's father 's sister is surprised .	Sara talks to my friend 's sister 's boss 's father 's sister is surprised .
Adam thinks that your sister 's dad 's doctor 's cousin 's grandmother is tall .	Adam works with your sister 's dad 's doctor 's cousin 's grandmother is tall .
Donald knows that my cousin 's teacher 's brother 's doctor 's mom is happy .	Donald works with my cousin 's teacher 's brother 's doctor 's mom is happy .
Steve says that your mother 's boss 's son 's dentist 's wife is young .	Steve works with your mother 's boss 's son 's dentist 's wife is young .
your cousin knows that your teacher 's husband 's boss 's father 's son is quiet .	your cousin talks to your teacher 's husband 's boss 's father 's son is quiet .
my boss knows that my husband 's doctor 's teacher 's friend 's friend is smart .	my boss works with my husband 's doctor 's teacher 's friend 's friend is smart .
the child knows that my doctor 's father 's mom 's brother 's teacher is helpful .	the child works with my doctor 's father 's mom 's brother 's teacher is helpful .
Samantha thinks that my sister 's brother 's cousin 's teacher 's daughter is quiet .	Samantha scares my sister 's brother 's cousin 's teacher 's daughter is quiet .
the teacher says that my boss 's mom 's father 's mother 's cousin is helpful .	the teacher scares my boss 's mom 's father 's mother 's cousin is helpful .
my dentist thinks that your teacher 's cousin 's dad 's dad 's cousin is confused .	my dentist scares your teacher 's cousin 's dad 's dad 's cousin is confused .
my dentist says that my husband 's brother 's dentist 's brother 's sister is quiet .	my dentist works with my husband 's brother 's dentist 's brother 's sister is quiet .
Amelia knows that your doctor 's mother 's father 's brother 's father is lucky .	Amelia helps your doctor 's mother 's father 's brother 's father is lucky .
Travis knows that my doctor 's grandmother 's brother 's grandmother 's brother is confused .	Travis scares my doctor 's grandmother 's brother 's grandmother 's brother is confused .
your cousin knows that your teacher 's grandmother 's sister 's sister 's friend is strong .	your cousin helps your teacher 's grandmother 's sister 's sister 's friend is strong .
my dentist thinks that your father 's doctor 's wife 's mother 's son is happy .	my dentist helps your father 's doctor 's wife 's mother 's son is happy .
Dan says that my boss 's sister 's father 's brother 's cousin is clever .	Dan scares my boss 's sister 's father 's brother 's cousin is clever .
your cousin knows that your friend 's boss 's mother 's wife 's sister is bored .	your cousin works with your friend 's boss 's mother 's wife 's sister is bored .
my cousin says that my grandmother 's son 's father 's dad 's doctor is important .	my cousin works with my grandmother 's son 's father 's dad 's doctor is important .
the dentist thinks that my wife 's dad 's doctor 's grandmother 's mom is friendly .	the dentist works with my wife 's dad 's doctor 's grandmother 's mom is friendly .
the dancer thinks that my sister 's grandmother 's dad 's father 's teacher is strong .	the dancer talks to my sister 's grandmother 's dad 's father 's teacher is strong .
Karen says that your teacher 's friend 's dad 's cousin 's boss is curious .	Karen works with your teacher 's friend 's dad 's cousin 's boss is curious .
the person says that my cousin 's daughter 's husband 's teacher 's daughter is happy .	the person helps my cousin 's daughter 's husband 's teacher 's daughter is happy .
Dan says that my friend 's daughter 's dentist 's father 's dad is wrong .	Dan helps my friend 's daughter 's dentist 's father 's dad is wrong .
the person knows that your teacher 's doctor 's teacher 's cousin 's brother is gentle .	the person scares your teacher 's doctor 's teacher 's cousin 's brother is gentle .
my cousin says that your friend 's grandmother 's father 's father 's friend is busy .	my cousin scares your friend 's grandmother 's father 's father 's friend is busy .
the child says that my wife 's teacher 's dentist 's daughter 's dad is clever .	the child helps my wife 's teacher 's dentist 's daughter 's dad is clever .
the driver thinks that my grandmother 's grandmother 's brother 's mother 's wife is strong .	the driver talks to my grandmother 's grandmother 's brother 's mother 's wife is strong .
Linda thinks that my son 's dad 's mom 's mother 's mom is smart .	Linda scares my son 's dad 's mom 's mother 's mom is smart .
your boss thinks that my teacher 's mother 's boss 's cousin 's cousin is bored .	your boss helps my teacher 's mother 's boss 's cousin 's cousin is bored .
Anne thinks that my brother 's boss 's father 's wife 's cousin is curious .	Anne helps my brother 's boss 's father 's wife 's cousin is curious .
the driver says that your sister 's wife 's brother 's boss 's dad is quiet .	the driver helps your sister 's wife 's brother 's boss 's dad is quiet .
my teacher knows that your dentist 's cousin 's doctor 's dentist 's son is friendly .	my teacher scares your dentist 's cousin 's doctor 's dentist 's son is friendly .
Janet says that my husband 's dentist 's teacher 's mom 's mom is important .	Janet helps my husband 's dentist 's teacher 's mom 's mom is important .
the teacher knows that your boss 's boss 's daughter 's mom 's teacher is tired .	the teacher works with your boss 's boss 's daughter 's mom 's teacher is tired .
your teacher thinks that my mother 's mom 's dad 's doctor 's son is boring .	your teacher helps my mother 's mom 's dad 's doctor 's son is boring .
Dan thinks that my friend 's dad 's brother 's boss 's daughter is tall .	Dan works with my friend 's dad 's brother 's boss 's daughter is tall .
Rachel says that my dentist 's cousin 's dentist 's dad 's boss is lucky .	Rachel scares my dentist 's cousin 's dentist 's dad 's boss is lucky .
your teacher says that my sister 's sister 's mother 's husband 's grandmother is smart .	your teacher helps my sister 's sister 's mother 's husband 's grandmother is smart .
Kevin knows that my dad 's grandmother 's son 's son 's dentist is busy .	Kevin talks to my dad 's grandmother 's son 's son 's dentist is busy .
Ronald says that your brother 's daughter 's daughter 's dad 's son is quiet .	Ronald helps your brother 's daughter 's daughter 's dad 's son is quiet .
Carol knows that my mother 's doctor 's grandmother 's cousin 's cousin is sleepy .	Carol talks to my mother 's doctor 's grandmother 's cousin 's cousin is sleepy .
Dan knows that my sister 's daughter 's mom 's brother 's father is careful .	Dan helps my sister 's daughter 's mom 's brother 's father is careful .
Frank knows that your doctor 's dentist 's daughter 's husband 's daughter is clever .	Frank scares your doctor 's dentist 's daughter 's husband 's daughter is clever .
the patient says that my mother 's teacher 's mother 's friend 's dentist is happy .	the patient helps my mother 's teacher 's mother 's friend 's dentist is happy .
the driver knows that my boss 's teacher 's doctor 's doctor 's dad is wrong .	the driver helps my boss 's teacher 's doctor 's doctor 's dad is wrong .
Ann knows that your wife 's father 's dad 's brother 's daughter is lucky .	Ann talks to your wife 's father 's dad 's brother 's daughter is lucky .
April says that my son 's grandmother 's father 's friend 's father is healthy .	April works with my son 's grandmother 's father 's friend 's father is healthy .
your dentist thinks that my teacher 's father 's dad 's brother 's friend is nice .	your dentist helps my teacher 's father 's dad 's brother 's friend is nice .
Erin knows that my doctor 's daughter 's sister 's father 's mother is smart .	Erin helps my doctor 's daughter 's sister 's father 's mother is smart .
Richard knows that my grandmother 's son 's daughter 's father 's grandmother is careful .	Richard talks to my grandmother 's son 's daughter 's father 's grandmother is careful .
the dentist knows that my brother 's teacher 's son 's husband 's brother is surprised .	the dentist scares my brother 's teacher 's son 's husband 's brother is surprised .
my dentist says that my dentist 's boss 's cousin 's wife 's sister is hungry .	my dentist helps my dentist 's boss 's cousin 's wife 's sister is hungry .
the teacher knows that my grandmother 's dad 's husband 's friend 's father is friendly .	the teacher scares my grandmother 's dad 's husband 's friend 's father is friendly .
my teacher thinks that my father 's sister 's friend 's grandmother 's friend is kind .	my teacher talks to my father 's sister 's friend 's grandmother 's friend is kind .
my boss thinks that your father 's cousin 's doctor 's father 's husband is important .	my boss works with your father 's cousin 's doctor 's father 's husband is important .
my dentist knows that your boss 's son 's daughter 's mother 's daughter is smart .	my dentist helps your boss 's son 's daughter 's mother 's daughter is smart .
the patient says that my husband 's doctor 's boss 's dentist 's wife is lucky .	the patient works with my husband 's doctor 's boss 's dentist 's wife is lucky .
your teacher thinks that your mother 's teacher 's dad 's wife 's brother is angry .	your teacher helps your mother 's teacher 's dad 's wife 's brother is angry .
Christopher knows that my mom 's son 's dentist 's sister 's father is nice .	Christopher scares my mom 's son 's dentist 's sister 's father is nice .
the child says that your father 's doctor 's mom 's boss 's mother is healthy .	the child helps your father 's doctor 's mom 's boss 's mother is healthy .
Carol knows that your teacher 's grandmother 's wife 's father 's cousin is excited .	Carol scares your teacher 's grandmother 's wife 's father 's cousin is excited .
Renee knows that my brother 's sister 's mother 's grandmother 's son is careful .	Renee scares my brother 's sister 's mother 's grandmother 's son is careful .
Kevin knows that my father 's sister 's sister 's dad 's dad is busy .	Kevin works with my father 's sister 's sister 's dad 's dad is busy .
the dancer thinks that my daughter 's father 's cousin 's boss 's teacher is friendly .	the dancer talks to my daughter 's father 's cousin 's boss 's teacher is friendly .
my dentist thinks that your dad 's teacher 's dad 's mom 's son is healthy .	my dentist scares your dad 's teacher 's dad 's mom 's son is healthy .
Marie says that your dad 's daughter 's teacher 's mom 's boss is strong .	Marie works with your dad 's daughter 's teacher 's mom 's boss is strong .
the doctor knows that my daughter 's friend 's mother 's cousin 's husband is nice .	the doctor scares my daughter 's friend 's mother 's cousin 's husband is nice .
your boss knows that my wife 's son 's son 's brother 's teacher is upset .	your boss helps my wife 's son 's son 's brother 's teacher is upset .
my cousin thinks that your mother 's cousin 's friend 's dentist 's friend is sleepy .	my cousin helps your mother 's cousin 's friend 's dentist 's friend is sleepy .
Cindy says that your brother 's mother 's brother 's father 's boss is careful .	Cindy helps your brother 's mother 's brother 's father 's boss is careful .
Eric thinks that my son 's cousin 's brother 's mother 's boss is helpful .	Eric scares my son 's cousin 's brother 's mother 's boss is helpful .
the person says that your dentist 's sister 's friend 's dad 's grandmother is tall .	the person talks to your dentist 's sister 's friend 's dad 's grandmother is tall .
the child says that my sister 's teacher 's cousin 's cousin 's doctor is upset .	the child talks to my sister 's teacher 's cousin 's cousin 's doctor is upset .
your doctor says that my sister 's boss 's teacher 's friend 's sister is bored .	your doctor talks to my sister 's boss 's teacher 's friend 's sister is bored .
the customer thinks that your doctor 's dentist 's teacher 's cousin 's sister is careful .	the customer talks to your doctor 's dentist 's teacher 's cousin 's sister is careful .
Todd knows that my friend 's teacher 's cousin 's mother 's daughter is helpful .	Todd scares my friend 's teacher 's cousin 's mother 's daughter is helpful .
your boss says that your sister 's grandmother 's sister 's dad 's sister is angry .	your boss helps your sister 's grandmother 's sister 's dad 's sister is angry .
Dan says that your wife 's doctor 's doctor 's grandmother 's dad is important .	Dan works with your wife 's doctor 's doctor 's grandmother 's dad is important .
