the candle says that my son 's dentist 's friend 's father 's son 's doctor 's dentist 's hat is young .	the candle works with my son 's dentist 's friend 's father 's son 's doctor 's dentist 's hat is young .
the boat says that your wife 's wife 's boss 's dad 's grandmother 's friend 's friend 's button is curious .	the boat works with your wife 's wife 's boss 's dad 's grandmother 's friend 's friend 's button is curious .
the bed thinks that your daughter 's cousin 's mother 's boss 's cousin 's cousin 's son 's rug is important .	the bed helps your daughter 's cousin 's mother 's boss 's cousin 's cousin 's son 's rug is important .
the car thinks that my cousin 's doctor 's father 's doctor 's grandmother 's brother 's mom 's picture is upset .	the car talks to my cousin 's doctor 's father 's doctor 's grandmother 's brother 's mom 's picture is upset .
the picture says that my brother 's dad 's dentist 's daughter 's daughter 's friend 's mom 's truck is gentle .	the picture talks to my brother 's dad 's dentist 's daughter 's daughter 's friend 's mom 's truck is gentle .
the bag says that your wife 's wife 's boss 's sister 's father 's doctor 's sister 's couch is quiet .	the bag works with your wife 's wife 's boss 's sister 's father 's doctor 's sister 's couch is quiet .
the shirt says that your son 's husband 's daughter 's friend 's friend 's sister 's husband 's book is bored .	the shirt scares your son 's husband 's daughter 's friend 's friend 's sister 's husband 's book is bored .
the bottle says that my father 's mother 's daughter 's grandmother 's sister 's wife 's brother 's couch is clever .	the bottle helps my father 's mother 's daughter 's grandmother 's sister 's wife 's brother 's couch is clever .
the bicycle thinks that your father 's mother 's brother 's dentist 's teacher 's mother 's dentist 's book is young .	the bicycle talks to your father 's mother 's brother 's dentist 's teacher 's mother 's dentist 's book is young .
the button knows that your father 's friend 's mom 's dad 's cousin 's sister 's mother 's ship is clever .	the button works with your father 's friend 's mom 's dad 's cousin 's sister 's mother 's ship is clever .
the bed says that my teacher 's doctor 's sister 's friend 's mom 's wife 's teacher 's book is smart .	the bed talks to my teacher 's doctor 's sister 's friend 's mom 's wife 's teacher 's book is smart .
the book says that my doctor 's husband 's brother 's teacher 's son 's teacher 's brother 's boat is angry .	the book helps my doctor 's husband 's brother 's teacher 's son 's teacher 's brother 's boat is angry .
the crayon knows that your son 's boss 's daughter 's mom 's grandmother 's wife 's brother 's bag is excited .	the crayon talks to your son 's boss 's daughter 's mom 's grandmother 's wife 's brother 's bag is excited .
the candle knows that your sister 's wife 's brother 's grandmother 's teacher 's brother 's teacher 's candle is surprised .	the candle works with your sister 's wife 's brother 's grandmother 's teacher 's brother 's teacher 's candle is surprised .
the doll thinks that your father 's mother 's grandmother 's husband 's mother 's dentist 's doctor 's candle is helpful .	the doll talks to your father 's mother 's grandmother 's husband 's mother 's dentist 's doctor 's candle is helpful .
the toy knows that your dad 's cousin 's father 's sister 's sister 's doctor 's wife 's picture is curious .	the toy helps your dad 's cousin 's father 's sister 's sister 's doctor 's wife 's picture is curious .
the bottle says that your brother 's mother 's doctor 's sister 's wife 's daughter 's mom 's book is happy .	the bottle scares your brother 's mother 's doctor 's sister 's wife 's daughter 's mom 's book is happy .
the fork says that my dad 's mom 's doctor 's sister 's mom 's cousin 's cousin 's toy is lucky .	the fork helps my dad 's mom 's doctor 's sister 's mom 's cousin 's cousin 's toy is lucky .
the glass thinks that your husband 's brother 's cousin 's mom 's husband 's boss 's sister 's shoe is lucky .	the glass talks to your husband 's brother 's cousin 's mom 's husband 's boss 's sister 's shoe is lucky .
the candle thinks that your mom 's daughter 's grandmother 's sister 's wife 's dad 's dentist 's cup is wrong .	the candle scares your mom 's daughter 's grandmother 's sister 's wife 's dad 's dentist 's cup is wrong .
the picture says that your mom 's husband 's son 's sister 's doctor 's father 's dad 's door is bored .	the picture talks to your mom 's husband 's son 's sister 's doctor 's father 's dad 's door is bored .
the candle thinks that your brother 's mother 's teacher 's teacher 's mother 's dad 's brother 's book is lucky .	the candle helps your brother 's mother 's teacher 's teacher 's mother 's dad 's brother 's book is lucky .
the fork says that your wife 's daughter 's mother 's mom 's teacher 's father 's doctor 's ring is bored .	the fork scares your wife 's daughter 's mother 's mom 's teacher 's father 's doctor 's ring is bored .
the book says that your teacher 's mom 's teacher 's husband 's mother 's boss 's cousin 's shoe is young .	the book works with your teacher 's mom 's teacher 's husband 's mother 's boss 's cousin 's shoe is young .
the spoon knows that your sister 's doctor 's mom 's son 's grandmother 's mom 's daughter 's ship is bored .	the spoon helps your sister 's doctor 's mom 's son 's grandmother 's mom 's daughter 's ship is bored .
the bicycle says that my wife 's dad 's friend 's husband 's sister 's cousin 's dad 's plate is smart .	the bicycle helps my wife 's dad 's friend 's husband 's sister 's cousin 's dad 's plate is smart .
the cup says that my friend 's daughter 's cousin 's boss 's son 's grandmother 's dentist 's glass is gentle .	the cup works with my friend 's daughter 's cousin 's boss 's son 's grandmother 's dentist 's glass is gentle .
the chair thinks that my teacher 's father 's friend 's mom 's mom 's wife 's doctor 's car is upset .	the chair helps my teacher 's father 's friend 's mom 's mom 's wife 's doctor 's car is upset .
the truck says that my doctor 's doctor 's son 's husband 's brother 's grandmother 's sister 's candle is friendly .	the truck helps my doctor 's doctor 's son 's husband 's brother 's grandmother 's sister 's candle is friendly .
the plane thinks that your dentist 's dentist 's wife 's mom 's husband 's brother 's sister 's rug is gentle .	the plane helps your dentist 's dentist 's wife 's mom 's husband 's brother 's sister 's rug is gentle .
the dish knows that your boss 's cousin 's sister 's mom 's mother 's cousin 's grandmother 's door is tired .	the dish works with your boss 's cousin 's sister 's mom 's mother 's cousin 's grandmother 's door is tired .
the book knows that your son 's dad 's doctor 's brother 's brother 's cousin 's daughter 's shoe is kind .	the book scares your son 's dad 's doctor 's brother 's brother 's cousin 's daughter 's shoe is kind .
the fork thinks that my friend 's mother 's cousin 's mom 's boss 's dentist 's brother 's glass is angry .	the fork scares my friend 's mother 's cousin 's mom 's boss 's dentist 's brother 's glass is angry .
the cup says that your husband 's friend 's dentist 's wife 's daughter 's wife 's father 's glass is boring .	the cup scares your husband 's friend 's dentist 's wife 's daughter 's wife 's father 's glass is boring .
the dish says that your friend 's daughter 's friend 's dad 's husband 's wife 's mother 's door is kind .	the dish scares your friend 's daughter 's friend 's dad 's husband 's wife 's mother 's door is kind .
the ring thinks that your mom 's boss 's doctor 's daughter 's husband 's wife 's doctor 's box is clever .	the ring works with your mom 's boss 's doctor 's daughter 's husband 's wife 's doctor 's box is clever .
the truck knows that my dad 's husband 's friend 's mom 's dad 's grandmother 's wife 's plane is wrong .	the truck talks to my dad 's husband 's friend 's mom 's dad 's grandmother 's wife 's plane is wrong .
the cup says that your sister 's brother 's dad 's mom 's brother 's husband 's teacher 's bottle is angry .	the cup talks to your sister 's brother 's dad 's mom 's brother 's husband 's teacher 's bottle is angry .
the cup says that my friend 's friend 's husband 's dentist 's father 's brother 's grandmother 's bag is upset .	the cup helps my friend 's friend 's husband 's dentist 's father 's brother 's grandmother 's bag is upset .
the rocket knows that my grandmother 's wife 's son 's daughter 's doctor 's friend 's wife 's doll is surprised .	the rocket scares my grandmother 's wife 's son 's daughter 's doctor 's friend 's wife 's doll is surprised .
the ship thinks that your wife 's father 's grandmother 's sister 's mother 's sister 's grandmother 's car is clever .	the ship scares your wife 's father 's grandmother 's sister 's mother 's sister 's grandmother 's car is clever .
the mirror knows that your mother 's mother 's doctor 's daughter 's friend 's son 's son 's crayon is quiet .	the mirror helps your mother 's mother 's doctor 's daughter 's friend 's son 's son 's crayon is quiet .
the book says that my son 's wife 's dentist 's cousin 's doctor 's boss 's mom 's crayon is happy .	the book works with my son 's wife 's dentist 's cousin 's doctor 's boss 's mom 's crayon is happy .
the window knows that my son 's grandmother 's mom 's doctor 's mother 's brother 's dentist 's dish is confused .	the window scares my son 's grandmother 's mom 's doctor 's mother 's brother 's dentist 's dish is confused .
the shirt says that my boss 's father 's teacher 's teacher 's cousin 's mom 's son 's box is tired .	the shirt scares my boss 's father 's teacher 's teacher 's cousin 's mom 's son 's box is tired .
the shirt says that your mom 's friend 's daughter 's son 's cousin 's friend 's wife 's car is sleepy .	the shirt helps your mom 's friend 's daughter 's son 's cousin 's friend 's wife 's car is sleepy .
the bed knows that my teacher 's teacher 's cousin 's grandmother 's friend 's husband 's daughter 's candle is gentle .	the bed talks to my teacher 's teacher 's cousin 's grandmother 's friend 's husband 's daughter 's candle is gentle .
the dish says that your brother 's cousin 's wife 's mom 's wife 's dad 's cousin 's shoe is sleepy .	the dish talks to your brother 's cousin 's wife 's mom 's wife 's dad 's cousin 's shoe is sleepy .
the shirt knows that my husband 's dad 's teacher 's wife 's teacher 's dentist 's father 's bicycle is young .	the shirt works with my husband 's dad 's teacher 's wife 's teacher 's dentist 's father 's bicycle is young .
the couch thinks that my mother 's doctor 's brother 's boss 's dad 's boss 's friend 's bottle is angry .	the couch scares my mother 's doctor 's brother 's boss 's dad 's boss 's friend 's bottle is angry .
the fork thinks that your wife 's grandmother 's friend 's sister 's doctor 's friend 's brother 's ring is quiet .	the fork talks to your wife 's grandmother 's friend 's sister 's doctor 's friend 's brother 's ring is quiet .
the truck knows that your teacher 's wife 's dad 's mother 's wife 's doctor 's sister 's doll is surprised .	the truck works with your teacher 's wife 's dad 's mother 's wife 's doctor 's sister 's doll is surprised .
the ring thinks that my husband 's father 's doctor 's mom 's dentist 's mother 's friend 's bowl is important .	the ring helps my husband 's father 's doctor 's mom 's dentist 's mother 's friend 's bowl is important .
the glass knows that my friend 's wife 's mother 's teacher 's dad 's son 's teacher 's spoon is lucky .	the glass talks to my friend 's wife 's mother 's teacher 's dad 's son 's teacher 's spoon is lucky .
the bowl says that your daughter 's mom 's son 's cousin 's dentist 's teacher 's father 's hat is young .	the bowl talks to your daughter 's mom 's son 's cousin 's dentist 's teacher 's father 's hat is young .
the cup says that your friend 's mother 's brother 's son 's boss 's friend 's brother 's chair is boring .	the cup helps your friend 's mother 's brother 's son 's boss 's friend 's brother 's chair is boring .
the box says that your mother 's sister 's dad 's teacher 's brother 's mom 's father 's cup is bored .	the box works with your mother 's sister 's dad 's teacher 's brother 's mom 's father 's cup is bored .
the car knows that your husband 's brother 's son 's daughter 's father 's mom 's grandmother 's rug is upset .	the car talks to your husband 's brother 's son 's daughter 's father 's mom 's grandmother 's rug is upset .
the spoon says that your cousin 's cousin 's mother 's dentist 's doctor 's doctor 's mother 's button is strong .	the spoon talks to your cousin 's cousin 's mother 's dentist 's doctor 's doctor 's mother 's button is strong .
the crayon thinks that your friend 's doctor 's daughter 's grandmother 's mom 's boss 's dad 's car is surprised .	the crayon scares your friend 's doctor 's daughter 's grandmother 's mom 's boss 's dad 's car is surprised .
the book says that your husband 's mom 's mom 's dentist 's mom 's teacher 's sister 's box is boring .	the book helps your husband 's mom 's mom 's dentist 's mom 's teacher 's sister 's box is boring .
the crayon knows that your friend 's husband 's cousin 's dentist 's boss 's friend 's mom 's plate is happy .	the crayon scares your friend 's husband 's cousin 's dentist 's boss 's friend 's mom 's plate is happy .
the cup says that my husband 's sister 's teacher 's teacher 's grandmother 's dad 's father 's rocket is careful .	the cup scares my husband 's sister 's teacher 's teacher 's grandmother 's dad 's father 's rocket is careful .
the plate thinks that my brother 's doctor 's mom 's wife 's brother 's friend 's friend 's spoon is kind .	the plate works with my brother 's doctor 's mom 's wife 's brother 's friend 's friend 's spoon is kind .
the bag says that your dentist 's friend 's wife 's dentist 's mom 's mother 's sister 's couch is busy .	the bag scares your dentist 's friend 's wife 's dentist 's mom 's mother 's sister 's couch is busy .
the mirror thinks that my husband 's mother 's father 's friend 's mother 's cousin 's teacher 's doll is confused .	the mirror talks to my husband 's mother 's father 's friend 's mother 's cousin 's teacher 's doll is confused .
the plate knows that my father 's friend 's wife 's brother 's boss 's daughter 's boss 's hat is bored .	the plate talks to my father 's friend 's wife 's brother 's boss 's daughter 's boss 's hat is bored .
the book says that your son 's sister 's husband 's brother 's sister 's daughter 's teacher 's plane is busy .	the book talks to your son 's sister 's husband 's brother 's sister 's daughter 's teacher 's plane is busy .
the candle thinks that your sister 's father 's sister 's brother 's son 's sister 's mother 's cup is surprised .	the candle helps your sister 's father 's sister 's brother 's son 's sister 's mother 's cup is surprised .
the dish says that my father 's grandmother 's daughter 's brother 's mother 's wife 's cousin 's fork is wrong .	the dish talks to my father 's grandmother 's daughter 's brother 's mother 's wife 's cousin 's fork is wrong .
the car says that my teacher 's brother 's mother 's friend 's teacher 's teacher 's mom 's couch is surprised .	the car scares my teacher 's brother 's mother 's friend 's teacher 's teacher 's mom 's couch is surprised .
the ship knows that my doctor 's husband 's doctor 's son 's friend 's doctor 's dentist 's book is bored .	the ship helps my doctor 's husband 's doctor 's son 's friend 's doctor 's dentist 's book is bored .
the picture thinks that my mother 's boss 's daughter 's dad 's doctor 's teacher 's mother 's spoon is clever .	the picture talks to my mother 's boss 's daughter 's dad 's doctor 's teacher 's mother 's spoon is clever .
the box knows that my mother 's mom 's cousin 's son 's teacher 's son 's friend 's bicycle is angry .	the box works with my mother 's mom 's cousin 's son 's teacher 's son 's friend 's bicycle is angry .
the picture says that my mother 's father 's mother 's dentist 's cousin 's daughter 's mom 's hat is excited .	the picture works with my mother 's father 's mother 's dentist 's cousin 's daughter 's mom 's hat is excited .
the hat says that your son 's father 's daughter 's grandmother 's cousin 's cousin 's son 's ship is important .	the hat helps your son 's father 's daughter 's grandmother 's cousin 's cousin 's son 's ship is important .
the chair knows that my brother 's daughter 's friend 's daughter 's grandmother 's brother 's dad 's crayon is careful .	the chair talks to my brother 's daughter 's friend 's daughter 's grandmother 's brother 's dad 's crayon is careful .
the door knows that your friend 's sister 's teacher 's father 's dad 's daughter 's sister 's shoe is sleepy .	the door talks to your friend 's sister 's teacher 's father 's dad 's daughter 's sister 's shoe is sleepy .
the bed thinks that my brother 's cousin 's friend 's doctor 's teacher 's daughter 's brother 's bottle is nice .	the bed helps my brother 's cousin 's friend 's doctor 's teacher 's daughter 's brother 's bottle is nice .
the book says that your boss 's doctor 's teacher 's boss 's sister 's mother 's cousin 's ring is curious .	the book helps your boss 's doctor 's teacher 's boss 's sister 's mother 's cousin 's ring is curious .
the truck thinks that my mother 's wife 's grandmother 's boss 's teacher 's wife 's dad 's bottle is upset .	the truck scares my mother 's wife 's grandmother 's boss 's teacher 's wife 's dad 's bottle is upset .
the bottle says that your daughter 's son 's dentist 's cousin 's dentist 's mother 's brother 's car is young .	the bottle helps your daughter 's son 's dentist 's cousin 's dentist 's mother 's brother 's car is young .
the book thinks that my friend 's sister 's dad 's cousin 's sister 's grandmother 's doctor 's couch is excited .	the book scares my friend 's sister 's dad 's cousin 's sister 's grandmother 's doctor 's couch is excited .
the fork thinks that your dentist 's husband 's boss 's grandmother 's grandmother 's dad 's wife 's picture is important .	the fork scares your dentist 's husband 's boss 's grandmother 's grandmother 's dad 's wife 's picture is important .
the couch says that your brother 's friend 's friend 's mom 's boss 's husband 's friend 's ship is smart .	the couch talks to your brother 's friend 's friend 's mom 's boss 's husband 's friend 's ship is smart .
the chair says that my son 's sister 's wife 's cousin 's brother 's friend 's husband 's dish is helpful .	the chair talks to my son 's sister 's wife 's cousin 's brother 's friend 's husband 's dish is helpful .
the plane says that your mother 's doctor 's cousin 's mother 's mother 's father 's mother 's rug is hungry .	the plane helps your mother 's doctor 's cousin 's mother 's mother 's father 's mother 's rug is hungry .
the ship knows that your mom 's son 's husband 's brother 's dad 's friend 's grandmother 's book is sleepy .	the ship talks to your mom 's son 's husband 's brother 's dad 's friend 's grandmother 's book is sleepy .
the box knows that my friend 's mom 's brother 's father 's father 's friend 's boss 's picture is excited .	the box scares my friend 's mom 's brother 's father 's father 's friend 's boss 's picture is excited .
the plane knows that my son 's daughter 's sister 's mom 's daughter 's wife 's dentist 's truck is quiet .	the plane works with my son 's daughter 's sister 's mom 's daughter 's wife 's dentist 's truck is quiet .
the hat says that my dad 's friend 's daughter 's boss 's sister 's father 's sister 's chair is angry .	the hat works with my dad 's friend 's daughter 's boss 's sister 's father 's sister 's chair is angry .
the rug thinks that your friend 's son 's grandmother 's friend 's boss 's son 's doctor 's candle is helpful .	the rug scares your friend 's son 's grandmother 's friend 's boss 's son 's doctor 's candle is helpful .
the toy knows that my wife 's dad 's son 's dentist 's teacher 's boss 's doctor 's car is lucky .	the toy works with my wife 's dad 's son 's dentist 's teacher 's boss 's doctor 's car is lucky .
the mirror knows that your friend 's daughter 's friend 's father 's boss 's dentist 's sister 's toy is angry .	the mirror talks to your friend 's daughter 's friend 's father 's boss 's dentist 's sister 's toy is angry .
the book thinks that my brother 's mother 's dentist 's dentist 's cousin 's dad 's wife 's spoon is bored .	the book works with my brother 's mother 's dentist 's dentist 's cousin 's dad 's wife 's spoon is bored .
the box says that my boss 's brother 's daughter 's mother 's father 's sister 's friend 's window is excited .	the box helps my boss 's brother 's daughter 's mother 's father 's sister 's friend 's window is excited .
the candle knows that your brother 's sister 's dad 's dad 's mother 's wife 's wife 's bottle is bored .	the candle works with your brother 's sister 's dad 's dad 's mother 's wife 's wife 's bottle is bored .
the cup says that your cousin 's dentist 's doctor 's wife 's father 's grandmother 's doctor 's door is hungry .	the cup works with your cousin 's dentist 's doctor 's wife 's father 's grandmother 's doctor 's door is hungry .
the button thinks that your mom 's cousin 's daughter 's son 's doctor 's friend 's mom 's book is sleepy .	the button helps your mom 's cousin 's daughter 's son 's doctor 's friend 's mom 's book is sleepy .
the car thinks that your brother 's dad 's wife 's son 's dad 's son 's daughter 's shirt is wrong .	the car helps your brother 's dad 's wife 's son 's dad 's son 's daughter 's shirt is wrong .
the plate thinks that my dentist 's wife 's father 's husband 's sister 's brother 's friend 's car is happy .	the plate works with my dentist 's wife 's father 's husband 's sister 's brother 's friend 's car is happy .
the car says that my teacher 's teacher 's teacher 's teacher 's son 's brother 's father 's plane is boring .	the car scares my teacher 's teacher 's teacher 's teacher 's son 's brother 's father 's plane is boring .
the window says that my grandmother 's daughter 's mother 's son 's mother 's dad 's brother 's button is wrong .	the window helps my grandmother 's daughter 's mother 's son 's mother 's dad 's brother 's button is wrong .
the crayon knows that my dad 's sister 's son 's brother 's doctor 's dentist 's doctor 's car is confused .	the crayon helps my dad 's sister 's son 's brother 's doctor 's dentist 's doctor 's car is confused .
the shirt says that your father 's husband 's father 's father 's father 's mother 's mother 's hat is kind .	the shirt works with your father 's husband 's father 's father 's father 's mother 's mother 's hat is kind .
the bicycle knows that your friend 's boss 's cousin 's friend 's grandmother 's doctor 's mom 's fork is surprised .	the bicycle talks to your friend 's boss 's cousin 's friend 's grandmother 's doctor 's mom 's fork is surprised .
the truck says that my sister 's friend 's wife 's son 's dad 's grandmother 's dentist 's cup is young .	the truck talks to my sister 's friend 's wife 's son 's dad 's grandmother 's dentist 's cup is young .
the plane thinks that my father 's dentist 's sister 's daughter 's brother 's mother 's mom 's picture is wrong .	the plane helps my father 's dentist 's sister 's daughter 's brother 's mother 's mom 's picture is wrong .
the chair thinks that your father 's doctor 's son 's sister 's boss 's husband 's mom 's crayon is nice .	the chair talks to your father 's doctor 's son 's sister 's boss 's husband 's mom 's crayon is nice .
the rocket thinks that your wife 's husband 's cousin 's friend 's teacher 's boss 's teacher 's car is young .	the rocket talks to your wife 's husband 's cousin 's friend 's teacher 's boss 's teacher 's car is young .
the plate knows that my grandmother 's boss 's teacher 's husband 's friend 's father 's cousin 's ship is surprised .	the plate talks to my grandmother 's boss 's teacher 's husband 's friend 's father 's cousin 's ship is surprised .
the cup knows that my son 's doctor 's sister 's dentist 's dentist 's mom 's sister 's truck is gentle .	the cup scares my son 's doctor 's sister 's dentist 's dentist 's mom 's sister 's truck is gentle .
the car knows that your grandmother 's sister 's grandmother 's boss 's mother 's daughter 's father 's rocket is kind .	the car talks to your grandmother 's sister 's grandmother 's boss 's mother 's daughter 's father 's rocket is kind .
the book knows that your friend 's grandmother 's boss 's doctor 's grandmother 's daughter 's mom 's toy is busy .	the book helps your friend 's grandmother 's boss 's doctor 's grandmother 's daughter 's mom 's toy is busy .
the box thinks that my husband 's wife 's wife 's mother 's friend 's wife 's grandmother 's toy is clever .	the box scares my husband 's wife 's wife 's mother 's friend 's wife 's grandmother 's toy is clever .
the book knows that your daughter 's grandmother 's friend 's son 's son 's dad 's wife 's ring is helpful .	the book works with your daughter 's grandmother 's friend 's son 's son 's dad 's wife 's ring is helpful .
the plane thinks that your wife 's doctor 's doctor 's wife 's father 's sister 's brother 's boat is important .	the plane scares your wife 's doctor 's doctor 's wife 's father 's sister 's brother 's boat is important .
the candle says that my brother 's son 's mother 's grandmother 's friend 's mother 's teacher 's ring is smart .	the candle scares my brother 's son 's mother 's grandmother 's friend 's mother 's teacher 's ring is smart .
