the ring sent your father 's husband 's sister 's book the ring .	the ring held your father 's husband 's sister 's book the ring .
the candle gave my son 's boss 's mom 's bicycle the couch .	the candle cleaned my son 's boss 's mom 's bicycle the couch .
the boat showed my cousin 's sister 's cousin 's picture the box .	the boat held my cousin 's sister 's cousin 's picture the box .
the picture showed my sister 's mom 's boss 's book the picture .	the picture lost my sister 's mom 's boss 's book the picture .
the car bought your brother 's daughter 's daughter 's rocket the candle .	the car moved your brother 's daughter 's daughter 's rocket the candle .
the truck showed my dad 's mom 's sister 's cup the rocket .	the truck held my dad 's mom 's sister 's cup the rocket .
the boat sent your dentist 's doctor 's doctor 's car the rocket .	the boat moved your dentist 's doctor 's doctor 's car the rocket .
the truck showed your wife 's doctor 's father 's doll the couch .	the truck dropped your wife 's doctor 's father 's doll the couch .
the crayon sent your husband 's brother 's doctor 's box the bottle .	the crayon dropped your husband 's brother 's doctor 's box the bottle .
the rug sent your mother 's boss 's father 's book the boat .	the rug lost your mother 's boss 's father 's book the boat .
the ring sent your teacher 's friend 's mom 's crayon the bed .	the ring moved your teacher 's friend 's mom 's crayon the bed .
the button sent my husband 's brother 's doctor 's button the fork .	the button cleaned my husband 's brother 's doctor 's button the fork .
the dish sent your mother 's boss 's dad 's box the ring .	the dish held your mother 's boss 's dad 's box the ring .
the rug gave your sister 's dad 's dentist 's rocket the cup .	the rug cleaned your sister 's dad 's dentist 's rocket the cup .
the ship bought your doctor 's grandmother 's friend 's cup the book .	the ship dropped your doctor 's grandmother 's friend 's cup the book .
the door bought your boss 's mom 's sister 's plane the rug .	the door dropped your boss 's mom 's sister 's plane the rug .
the picture gave your wife 's boss 's grandmother 's book the shirt .	the picture moved your wife 's boss 's grandmother 's book the shirt .
the crayon gave my brother 's dentist 's mom 's car the button .	the crayon moved my brother 's dentist 's mom 's car the button .
the book sent your friend 's teacher 's son 's window the bag .	the book dropped your friend 's teacher 's son 's window the bag .
the ring gave your teacher 's mother 's husband 's crayon the bicycle .	the ring kept your teacher 's mother 's husband 's crayon the bicycle .
the shoe sent my father 's sister 's daughter 's box the plane .	the shoe held my father 's sister 's daughter 's box the plane .
the rug gave my cousin 's father 's mother 's ring the cup .	the rug moved my cousin 's father 's mother 's ring the cup .
the ship showed my grandmother 's brother 's father 's rocket the glass .	the ship moved my grandmother 's brother 's father 's rocket the glass .
the book showed my brother 's daughter 's father 's ring the rocket .	the book held my brother 's daughter 's father 's ring the rocket .
the car bought your doctor 's grandmother 's wife 's bowl the box .	the car lost your doctor 's grandmother 's wife 's bowl the box .
the box gave my doctor 's dentist 's dad 's shirt the door .	the box cleaned my doctor 's dentist 's dad 's shirt the door .
the plate gave your mother 's husband 's mom 's car the chair .	the plate cleaned your mother 's husband 's mom 's car the chair .
the truck sent your grandmother 's daughter 's daughter 's hat the doll .	the truck moved your grandmother 's daughter 's daughter 's hat the doll .
the bag showed my teacher 's boss 's father 's bag the door .	the bag held my teacher 's boss 's father 's bag the door .
the ship showed your father 's daughter 's mother 's box the car .	the ship shook your father 's daughter 's mother 's box the car .
the rug sent your mom 's father 's boss 's ship the shirt .	the rug dropped your mom 's father 's boss 's ship the shirt .
the chair gave your doctor 's sister 's mother 's plate the candle .	the chair lost your doctor 's sister 's mother 's plate the candle .
the ship gave your boss 's boss 's father 's toy the candle .	the ship kept your boss 's boss 's father 's toy the candle .
the fork sent your boss 's sister 's grandmother 's bicycle the door .	the fork shook your boss 's sister 's grandmother 's bicycle the door .
the bowl sent your sister 's friend 's sister 's shirt the crayon .	the bowl shook your sister 's friend 's sister 's shirt the crayon .
the rug gave my boss 's husband 's cousin 's couch the book .	the rug moved my boss 's husband 's cousin 's couch the book .
the button sent my boss 's boss 's sister 's mirror the button .	the button cleaned my boss 's boss 's sister 's mirror the button .
the hat sent your mom 's son 's grandmother 's truck the dish .	the hat shook your mom 's son 's grandmother 's truck the dish .
the crayon bought your mom 's sister 's mother 's boat the bag .	the crayon shook your mom 's sister 's mother 's boat the bag .
the couch showed your grandmother 's teacher 's boss 's car the box .	the couch kept your grandmother 's teacher 's boss 's car the box .
the dish sent my daughter 's dentist 's wife 's bag the chair .	the dish dropped my daughter 's dentist 's wife 's bag the chair .
the window gave my brother 's doctor 's friend 's crayon the glass .	the window lost my brother 's doctor 's friend 's crayon the glass .
the rocket gave your dad 's husband 's boss 's candle the fork .	the rocket dropped your dad 's husband 's boss 's candle the fork .
the plate gave your doctor 's son 's husband 's rug the spoon .	the plate dropped your doctor 's son 's husband 's rug the spoon .
the plate bought my boss 's teacher 's father 's fork the dish .	the plate moved my boss 's teacher 's father 's fork the dish .
the spoon showed your cousin 's father 's sister 's rocket the rocket .	the spoon moved your cousin 's father 's sister 's rocket the rocket .
the plate bought my sister 's son 's brother 's door the toy .	the plate moved my sister 's son 's brother 's door the toy .
the bed bought my boss 's husband 's husband 's door the ship .	the bed held my boss 's husband 's husband 's door the ship .
the window gave my mom 's daughter 's son 's plane the book .	the window shook my mom 's daughter 's son 's plane the book .
the mirror bought my brother 's dad 's daughter 's bicycle the boat .	the mirror shook my brother 's dad 's daughter 's bicycle the boat .
the shoe showed your son 's cousin 's wife 's crayon the chair .	the shoe held your son 's cousin 's wife 's crayon the chair .
the toy bought your friend 's boss 's grandmother 's couch the book .	the toy cleaned your friend 's boss 's grandmother 's couch the book .
the hat sent your son 's sister 's wife 's ship the car .	the hat cleaned your son 's sister 's wife 's ship the car .
the book showed your mom 's husband 's brother 's window the car .	the book cleaned your mom 's husband 's brother 's window the car .
the bed gave my teacher 's wife 's friend 's shoe the car .	the bed moved my teacher 's wife 's friend 's shoe the car .
the button sent my brother 's husband 's friend 's plate the picture .	the button dropped my brother 's husband 's friend 's plate the picture .
the glass sent your mother 's son 's wife 's bed the truck .	the glass moved your mother 's son 's wife 's bed the truck .
the bed gave your husband 's daughter 's brother 's window the window .	the bed cleaned your husband 's daughter 's brother 's window the window .
the glass bought your husband 's father 's father 's shirt the ring .	the glass held your husband 's father 's father 's shirt the ring .
the car gave my brother 's sister 's mother 's ring the rug .	the car shook my brother 's sister 's mother 's ring the rug .
the plane gave my husband 's husband 's grandmother 's spoon the spoon .	the plane shook my husband 's husband 's grandmother 's spoon the spoon .
the picture showed my husband 's father 's cousin 's box the bowl .	the picture shook my husband 's father 's cousin 's box the bowl .
the rocket showed my mother 's cousin 's cousin 's crayon the plate .	the rocket dropped my mother 's cousin 's cousin 's crayon the plate .
the plane sent my son 's mother 's teacher 's cup the car .	the plane kept my son 's mother 's teacher 's cup the car .
the ship showed your brother 's mother 's mom 's picture the box .	the ship held your brother 's mother 's mom 's picture the box .
the bed bought my grandmother 's mom 's mom 's car the glass .	the bed kept my grandmother 's mom 's mom 's car the glass .
the truck showed my mom 's boss 's dad 's bowl the bottle .	the truck shook my mom 's boss 's dad 's bowl the bottle .
the button showed your son 's son 's grandmother 's toy the boat .	the button kept your son 's son 's grandmother 's toy the boat .
the toy bought my cousin 's dad 's dad 's bed the shoe .	the toy held my cousin 's dad 's dad 's bed the shoe .
the ring bought my dad 's boss 's son 's car the picture .	the ring cleaned my dad 's boss 's son 's car the picture .
the car sent your brother 's cousin 's wife 's plane the ship .	the car lost your brother 's cousin 's wife 's plane the ship .
the bicycle showed your daughter 's mom 's doctor 's button the shirt .	the bicycle shook your daughter 's mom 's doctor 's button the shirt .
the couch sent your mother 's boss 's brother 's rug the shoe .	the couch shook your mother 's boss 's brother 's rug the shoe .
the candle gave your friend 's friend 's mom 's couch the car .	the candle held your friend 's friend 's mom 's couch the car .
the bicycle bought my brother 's teacher 's father 's bag the button .	the bicycle shook my brother 's teacher 's father 's bag the button .
the bottle gave your boss 's father 's teacher 's bag the plane .	the bottle cleaned your boss 's father 's teacher 's bag the plane .
the mirror bought your husband 's teacher 's husband 's candle the bottle .	the mirror kept your husband 's teacher 's husband 's candle the bottle .
the plane sent my cousin 's wife 's cousin 's chair the door .	the plane held my cousin 's wife 's cousin 's chair the door .
the shoe showed your grandmother 's dentist 's dad 's window the spoon .	the shoe dropped your grandmother 's dentist 's dad 's window the spoon .
the ring gave my grandmother 's teacher 's brother 's boat the door .	the ring cleaned my grandmother 's teacher 's brother 's boat the door .
the dish showed your husband 's doctor 's teacher 's box the ship .	the dish moved your husband 's doctor 's teacher 's box the ship .
the glass showed my mom 's doctor 's father 's mirror the shoe .	the glass cleaned my mom 's doctor 's father 's mirror the shoe .
the rocket sent my sister 's grandmother 's friend 's glass the car .	the rocket dropped my sister 's grandmother 's friend 's glass the car .
the book showed my cousin 's son 's teacher 's couch the toy .	the book moved my cousin 's son 's teacher 's couch the toy .
the chair sent your daughter 's mom 's mom 's plane the dish .	the chair held your daughter 's mom 's mom 's plane the dish .
the picture showed your cousin 's sister 's son 's button the car .	the picture shook your cousin 's sister 's son 's button the car .
the button gave your cousin 's grandmother 's sister 's cup the dish .	the button dropped your cousin 's grandmother 's sister 's cup the dish .
the plate sent my mother 's husband 's husband 's car the rug .	the plate kept my mother 's husband 's husband 's car the rug .
the picture gave my daughter 's friend 's mother 's book the button .	the picture kept my daughter 's friend 's mother 's book the button .
the bowl bought your teacher 's mom 's sister 's mirror the hat .	the bowl cleaned your teacher 's mom 's sister 's mirror the hat .
the rug bought my mom 's mother 's father 's mirror the bag .	the rug held my mom 's mother 's father 's mirror the bag .
the picture sent your cousin 's mom 's friend 's spoon the candle .	the picture moved your cousin 's mom 's friend 's spoon the candle .
the candle bought my teacher 's teacher 's grandmother 's doll the ring .	the candle lost my teacher 's teacher 's grandmother 's doll the ring .
the crayon gave your father 's mother 's father 's ship the chair .	the crayon kept your father 's mother 's father 's ship the chair .
the car bought my grandmother 's mom 's dentist 's truck the box .	the car dropped my grandmother 's mom 's dentist 's truck the box .
the car sent your husband 's grandmother 's sister 's hat the book .	the car shook your husband 's grandmother 's sister 's hat the book .
the crayon showed your sister 's grandmother 's cousin 's book the cup .	the crayon kept your sister 's grandmother 's cousin 's book the cup .
the box gave your husband 's daughter 's friend 's candle the plate .	the box kept your husband 's daughter 's friend 's candle the plate .
the fork bought your son 's dentist 's grandmother 's plate the bicycle .	the fork shook your son 's dentist 's grandmother 's plate the bicycle .
the window showed my boss 's grandmother 's friend 's candle the mirror .	the window moved my boss 's grandmother 's friend 's candle the mirror .
the bowl sent my wife 's mom 's doctor 's fork the boat .	the bowl held my wife 's mom 's doctor 's fork the boat .
the picture bought your husband 's husband 's boss 's hat the window .	the picture cleaned your husband 's husband 's boss 's hat the window .
the hat showed your cousin 's dentist 's friend 's car the dish .	the hat lost your cousin 's dentist 's friend 's car the dish .
the toy showed your wife 's brother 's son 's candle the boat .	the toy moved your wife 's brother 's son 's candle the boat .
the dish showed your friend 's dad 's son 's bicycle the spoon .	the dish held your friend 's dad 's son 's bicycle the spoon .
the shoe bought your sister 's teacher 's doctor 's truck the ring .	the shoe kept your sister 's teacher 's doctor 's truck the ring .
the plane showed my grandmother 's dentist 's mom 's picture the shirt .	the plane shook my grandmother 's dentist 's mom 's picture the shirt .
the spoon showed my friend 's friend 's dad 's button the toy .	the spoon dropped my friend 's friend 's dad 's button the toy .
the ship bought my brother 's teacher 's daughter 's rocket the car .	the ship moved my brother 's teacher 's daughter 's rocket the car .
the bottle gave my friend 's brother 's dentist 's doll the rug .	the bottle dropped my friend 's brother 's dentist 's doll the rug .
the shirt sent my doctor 's dad 's son 's book the cup .	the shirt cleaned my doctor 's dad 's son 's book the cup .
the bowl gave your daughter 's brother 's dentist 's boat the couch .	the bowl kept your daughter 's brother 's dentist 's boat the couch .
the bowl sent my husband 's father 's husband 's ship the book .	the bowl dropped my husband 's father 's husband 's ship the book .
the plate gave your dad 's son 's mother 's bag the picture .	the plate moved your dad 's son 's mother 's bag the picture .
the button bought my daughter 's friend 's father 's dish the candle .	the button held my daughter 's friend 's father 's dish the candle .
the book sent my mom 's teacher 's dentist 's glass the picture .	the book cleaned my mom 's teacher 's dentist 's glass the picture .
the boat bought your wife 's friend 's doctor 's button the rug .	the boat dropped your wife 's friend 's doctor 's button the rug .
the rocket showed your wife 's brother 's mother 's window the plane .	the rocket kept your wife 's brother 's mother 's window the plane .
the bed bought your cousin 's dad 's daughter 's plate the spoon .	the bed moved your cousin 's dad 's daughter 's plate the spoon .
the button showed your doctor 's dentist 's father 's fork the crayon .	the button cleaned your doctor 's dentist 's father 's fork the crayon .
the hat bought your sister 's father 's mom 's picture the ship .	the hat held your sister 's father 's mom 's picture the ship .
the ring showed my husband 's cousin 's boss 's bowl the plate .	the ring moved my husband 's cousin 's boss 's bowl the plate .
the rug gave my grandmother 's mom 's dad 's ship the window .	the rug moved my grandmother 's mom 's dad 's ship the window .
the rocket showed your brother 's brother 's dentist 's hat the car .	the rocket cleaned your brother 's brother 's dentist 's hat the car .
the book sent your brother 's teacher 's dad 's box the dish .	the book held your brother 's teacher 's dad 's box the dish .
the couch showed your dad 's dad 's brother 's shoe the crayon .	the couch held your dad 's dad 's brother 's shoe the crayon .
the box sent my dad 's doctor 's boss 's car the shoe .	the box shook my dad 's doctor 's boss 's car the shoe .
the doll sent my son 's dentist 's son 's cup the cup .	the doll kept my son 's dentist 's son 's cup the cup .
the shirt sent my grandmother 's wife 's dentist 's glass the mirror .	the shirt held my grandmother 's wife 's dentist 's glass the mirror .
the truck showed my sister 's boss 's husband 's toy the doll .	the truck kept my sister 's boss 's husband 's toy the doll .
the dish bought my son 's dad 's friend 's rug the shoe .	the dish kept my son 's dad 's friend 's rug the shoe .
the cup gave my grandmother 's dentist 's brother 's car the couch .	the cup dropped my grandmother 's dentist 's brother 's car the couch .
the book sent my boss 's grandmother 's brother 's dish the bag .	the book held my boss 's grandmother 's brother 's dish the bag .
the bottle showed my mother 's mom 's doctor 's crayon the hat .	the bottle lost my mother 's mom 's doctor 's crayon the hat .
the candle sent my wife 's dad 's dad 's bowl the bottle .	the candle dropped my wife 's dad 's dad 's bowl the bottle .
the rug gave my mom 's father 's boss 's bowl the truck .	the rug kept my mom 's father 's boss 's bowl the truck .
the bicycle gave my boss 's grandmother 's son 's plane the candle .	the bicycle lost my boss 's grandmother 's son 's plane the candle .
the ring sent my brother 's doctor 's brother 's plate the box .	the ring lost my brother 's doctor 's brother 's plate the box .
the boat gave my mom 's mom 's doctor 's truck the shoe .	the boat dropped my mom 's mom 's doctor 's truck the shoe .
the dish showed your husband 's father 's dad 's window the cup .	the dish shook your husband 's father 's dad 's window the cup .
the truck gave my sister 's friend 's dad 's bowl the toy .	the truck held my sister 's friend 's dad 's bowl the toy .
the ship gave my husband 's dad 's mom 's fork the glass .	the ship held my husband 's dad 's mom 's fork the glass .
the bowl sent your boss 's brother 's cousin 's book the ring .	the bowl held your boss 's brother 's cousin 's book the ring .
the bicycle bought my boss 's brother 's boss 's doll the chair .	the bicycle cleaned my boss 's brother 's boss 's doll the chair .
the bag showed your dentist 's husband 's boss 's bed the glass .	the bag cleaned your dentist 's husband 's boss 's bed the glass .
the doll sent my boss 's dad 's grandmother 's bicycle the mirror .	the doll kept my boss 's dad 's grandmother 's bicycle the mirror .
the shirt showed your friend 's cousin 's dad 's bed the bottle .	the shirt moved your friend 's cousin 's dad 's bed the bottle .
the doll gave your father 's doctor 's grandmother 's hat the picture .	the doll dropped your father 's doctor 's grandmother 's hat the picture .
the car showed my brother 's boss 's wife 's box the hat .	the car dropped my brother 's boss 's wife 's box the hat .
the window sent your teacher 's teacher 's dad 's bag the doll .	the window cleaned your teacher 's teacher 's dad 's bag the doll .
the bed gave my friend 's dad 's husband 's book the bottle .	the bed cleaned my friend 's dad 's husband 's book the bottle .
the truck sent your brother 's dentist 's dentist 's car the doll .	the truck kept your brother 's dentist 's dentist 's car the doll .
the ring sent my wife 's mom 's doctor 's chair the couch .	the ring shook my wife 's mom 's doctor 's chair the couch .
the box showed my cousin 's boss 's brother 's glass the glass .	the box cleaned my cousin 's boss 's brother 's glass the glass .
the bowl showed your mother 's husband 's teacher 's window the car .	the bowl dropped your mother 's husband 's teacher 's window the car .
the spoon gave your sister 's cousin 's dentist 's glass the chair .	the spoon cleaned your sister 's cousin 's dentist 's glass the chair .
the candle gave your dentist 's daughter 's son 's ring the truck .	the candle moved your dentist 's daughter 's son 's ring the truck .
the book gave my daughter 's dad 's sister 's truck the plate .	the book shook my daughter 's dad 's sister 's truck the plate .
the doll sent your son 's daughter 's dentist 's spoon the hat .	the doll dropped your son 's daughter 's dentist 's spoon the hat .
the book bought your wife 's dad 's dentist 's spoon the book .	the book moved your wife 's dad 's dentist 's spoon the book .
the plate bought my doctor 's boss 's sister 's couch the ring .	the plate moved my doctor 's boss 's sister 's couch the ring .
the dish gave your cousin 's mom 's sister 's candle the dish .	the dish cleaned your cousin 's mom 's sister 's candle the dish .
the candle sent your father 's father 's cousin 's shirt the chair .	the candle moved your father 's father 's cousin 's shirt the chair .
the rug sent my mother 's teacher 's teacher 's truck the plane .	the rug dropped my mother 's teacher 's teacher 's truck the plane .
the ship gave your friend 's sister 's friend 's bicycle the fork .	the ship kept your friend 's sister 's friend 's bicycle the fork .
the button sent my cousin 's husband 's dad 's chair the couch .	the button lost my cousin 's husband 's dad 's chair the couch .
the ring sent my daughter 's dentist 's mom 's car the fork .	the ring held my daughter 's dentist 's mom 's car the fork .
the candle bought your brother 's sister 's daughter 's mirror the car .	the candle moved your brother 's sister 's daughter 's mirror the car .
the book sent my cousin 's sister 's wife 's book the book .	the book kept my cousin 's sister 's wife 's book the book .
the bicycle showed my wife 's mom 's teacher 's crayon the bicycle .	the bicycle shook my wife 's mom 's teacher 's crayon the bicycle .
the crayon showed my boss 's grandmother 's husband 's book the car .	the crayon dropped my boss 's grandmother 's husband 's book the car .
the window sent your teacher 's dentist 's brother 's toy the spoon .	the window shook your teacher 's dentist 's brother 's toy the spoon .
the hat bought your sister 's doctor 's friend 's spoon the crayon .	the hat shook your sister 's doctor 's friend 's spoon the crayon .
the bed gave your father 's brother 's husband 's box the doll .	the bed lost your father 's brother 's husband 's box the doll .
the couch gave my daughter 's brother 's cousin 's window the cup .	the couch held my daughter 's brother 's cousin 's window the cup .
the box gave your doctor 's dad 's mother 's window the car .	the box lost your doctor 's dad 's mother 's window the car .
the book gave my brother 's doctor 's dad 's mirror the shirt .	the book cleaned my brother 's doctor 's dad 's mirror the shirt .
the ship showed my dentist 's grandmother 's mother 's button the dish .	the ship shook my dentist 's grandmother 's mother 's button the dish .
the hat sent your husband 's daughter 's wife 's ring the button .	the hat shook your husband 's daughter 's wife 's ring the button .
the toy showed your mother 's cousin 's mom 's rocket the candle .	the toy kept your mother 's cousin 's mom 's rocket the candle .
the rocket gave your dad 's brother 's cousin 's shirt the bed .	the rocket cleaned your dad 's brother 's cousin 's shirt the bed .
the bowl sent my dad 's teacher 's grandmother 's plate the doll .	the bowl moved my dad 's teacher 's grandmother 's plate the doll .
the plane sent my grandmother 's wife 's father 's car the ship .	the plane kept my grandmother 's wife 's father 's car the ship .
the bottle showed your grandmother 's grandmother 's dentist 's doll the truck .	the bottle dropped your grandmother 's grandmother 's dentist 's doll the truck .
the hat showed my grandmother 's mom 's friend 's mirror the button .	the hat shook my grandmother 's mom 's friend 's mirror the button .
the rocket gave your mother 's doctor 's sister 's bowl the bed .	the rocket moved your mother 's doctor 's sister 's bowl the bed .
the ring bought my son 's friend 's dad 's spoon the truck .	the ring shook my son 's friend 's dad 's spoon the truck .
the hat showed your teacher 's boss 's husband 's plane the bed .	the hat lost your teacher 's boss 's husband 's plane the bed .
the bicycle bought my father 's mom 's grandmother 's cup the hat .	the bicycle shook my father 's mom 's grandmother 's cup the hat .
the bicycle sent your son 's wife 's dentist 's plate the shirt .	the bicycle moved your son 's wife 's dentist 's plate the shirt .
the box sent my son 's wife 's cousin 's glass the hat .	the box cleaned my son 's wife 's cousin 's glass the hat .
the rocket bought my dentist 's teacher 's doctor 's button the doll .	the rocket dropped my dentist 's teacher 's doctor 's button the doll .
the shoe showed your dad 's mom 's cousin 's door the cup .	the shoe kept your dad 's mom 's cousin 's door the cup .
the chair showed my mother 's boss 's husband 's spoon the hat .	the chair dropped my mother 's boss 's husband 's spoon the hat .
the ring gave your wife 's teacher 's wife 's bicycle the candle .	the ring moved your wife 's teacher 's wife 's bicycle the candle .
the car sent my brother 's mom 's friend 's rug the plane .	the car kept my brother 's mom 's friend 's rug the plane .
