the book says that your son 's sister 's daughter 's wife 's brother 's friend 's dad 's dentist 's ring is hungry .	the book scares your son 's sister 's daughter 's wife 's brother 's friend 's dad 's dentist 's ring is hungry .
the toy knows that my doctor 's dentist 's dentist 's father 's husband 's grandmother 's daughter 's wife 's boat is angry .	the toy helps my doctor 's dentist 's dentist 's father 's husband 's grandmother 's daughter 's wife 's boat is angry .
the boat says that my dad 's mom 's cousin 's father 's friend 's mom 's mom 's father 's ship is boring .	the boat helps my dad 's mom 's cousin 's father 's friend 's mom 's mom 's father 's ship is boring .
the car says that my friend 's daughter 's brother 's sister 's boss 's daughter 's husband 's cousin 's ring is happy .	the car works with my friend 's daughter 's brother 's sister 's boss 's daughter 's husband 's cousin 's ring is happy .
the window thinks that my friend 's brother 's sister 's grandmother 's dentist 's boss 's friend 's grandmother 's rug is curious .	the window scares my friend 's brother 's sister 's grandmother 's dentist 's boss 's friend 's grandmother 's rug is curious .
the plane thinks that my father 's brother 's cousin 's cousin 's boss 's grandmother 's husband 's dentist 's bowl is upset .	the plane talks to my father 's brother 's cousin 's cousin 's boss 's grandmother 's husband 's dentist 's bowl is upset .
the spoon thinks that your daughter 's doctor 's dad 's boss 's grandmother 's son 's wife 's sister 's toy is healthy .	the spoon talks to your daughter 's doctor 's dad 's boss 's grandmother 's son 's wife 's sister 's toy is healthy .
the picture thinks that my doctor 's father 's dentist 's father 's mother 's husband 's teacher 's husband 's bowl is nice .	the picture helps my doctor 's father 's dentist 's father 's mother 's husband 's teacher 's husband 's bowl is nice .
the bottle thinks that my dentist 's dad 's son 's friend 's cousin 's mom 's son 's mother 's truck is wrong .	the bottle works with my dentist 's dad 's son 's friend 's cousin 's mom 's son 's mother 's truck is wrong .
the shirt knows that your husband 's boss 's teacher 's husband 's cousin 's sister 's friend 's mother 's door is busy .	the shirt works with your husband 's boss 's teacher 's husband 's cousin 's sister 's friend 's mother 's door is busy .
the fork says that your mom 's boss 's daughter 's daughter 's teacher 's boss 's cousin 's husband 's glass is bored .	the fork helps your mom 's boss 's daughter 's daughter 's teacher 's boss 's cousin 's husband 's glass is bored .
the car thinks that my mother 's wife 's friend 's daughter 's husband 's wife 's mother 's wife 's rocket is friendly .	the car works with my mother 's wife 's friend 's daughter 's husband 's wife 's mother 's wife 's rocket is friendly .
the dish thinks that your grandmother 's daughter 's boss 's dentist 's son 's friend 's dentist 's grandmother 's bed is angry .	the dish works with your grandmother 's daughter 's boss 's dentist 's son 's friend 's dentist 's grandmother 's bed is angry .
the book thinks that my friend 's daughter 's doctor 's wife 's boss 's mother 's mother 's cousin 's dish is busy .	the book helps my friend 's daughter 's doctor 's wife 's boss 's mother 's mother 's cousin 's dish is busy .
the mirror knows that my brother 's doctor 's sister 's dad 's doctor 's brother 's cousin 's boss 's truck is angry .	the mirror scares my brother 's doctor 's sister 's dad 's doctor 's brother 's cousin 's boss 's truck is angry .
the plate thinks that my father 's mother 's brother 's sister 's grandmother 's father 's sister 's mom 's rug is quiet .	the plate helps my father 's mother 's brother 's sister 's grandmother 's father 's sister 's mom 's rug is quiet .
the bag knows that your dad 's teacher 's son 's daughter 's grandmother 's father 's wife 's sister 's shirt is friendly .	the bag works with your dad 's teacher 's son 's daughter 's grandmother 's father 's wife 's sister 's shirt is friendly .
the picture knows that your grandmother 's brother 's wife 's boss 's doctor 's teacher 's mom 's father 's car is quiet .	the picture talks to your grandmother 's brother 's wife 's boss 's doctor 's teacher 's mom 's father 's car is quiet .
the crayon knows that my brother 's cousin 's son 's cousin 's son 's daughter 's friend 's husband 's glass is upset .	the crayon scares my brother 's cousin 's son 's cousin 's son 's daughter 's friend 's husband 's glass is upset .
the mirror knows that your dentist 's husband 's dad 's wife 's dad 's wife 's boss 's mother 's mirror is young .	the mirror talks to your dentist 's husband 's dad 's wife 's dad 's wife 's boss 's mother 's mirror is young .
the picture says that my husband 's mom 's sister 's mother 's dentist 's dentist 's grandmother 's cousin 's bag is gentle .	the picture scares my husband 's mom 's sister 's mother 's dentist 's dentist 's grandmother 's cousin 's bag is gentle .
the button thinks that my dad 's mother 's sister 's dentist 's boss 's husband 's boss 's husband 's crayon is boring .	the button works with my dad 's mother 's sister 's dentist 's boss 's husband 's boss 's husband 's crayon is boring .
the door knows that your husband 's mom 's sister 's teacher 's father 's husband 's dad 's friend 's spoon is angry .	the door scares your husband 's mom 's sister 's teacher 's father 's husband 's dad 's friend 's spoon is angry .
the rocket says that my brother 's daughter 's dad 's doctor 's friend 's father 's cousin 's husband 's doll is tired .	the rocket helps my brother 's daughter 's dad 's doctor 's friend 's father 's cousin 's husband 's doll is tired .
the bag thinks that your doctor 's son 's son 's boss 's sister 's father 's daughter 's doctor 's spoon is confused .	the bag talks to your doctor 's son 's son 's boss 's sister 's father 's daughter 's doctor 's spoon is confused .
the bed knows that your daughter 's brother 's teacher 's dentist 's boss 's cousin 's cousin 's cousin 's bicycle is gentle .	the bed scares your daughter 's brother 's teacher 's dentist 's boss 's cousin 's cousin 's cousin 's bicycle is gentle .
the candle knows that your doctor 's brother 's husband 's mother 's doctor 's teacher 's father 's grandmother 's car is busy .	the candle helps your doctor 's brother 's husband 's mother 's doctor 's teacher 's father 's grandmother 's car is busy .
the car thinks that your daughter 's doctor 's boss 's wife 's doctor 's sister 's sister 's sister 's ring is lucky .	the car works with your daughter 's doctor 's boss 's wife 's doctor 's sister 's sister 's sister 's ring is lucky .
the chair knows that your boss 's daughter 's grandmother 's mother 's daughter 's dad 's grandmother 's boss 's shoe is kind .	the chair scares your boss 's daughter 's grandmother 's mother 's daughter 's dad 's grandmother 's boss 's shoe is kind .
the mirror knows that your teacher 's mom 's mom 's son 's son 's husband 's husband 's cousin 's button is smart .	the mirror helps your teacher 's mom 's mom 's son 's son 's husband 's husband 's cousin 's button is smart .
the car knows that my boss 's dentist 's grandmother 's daughter 's mom 's doctor 's brother 's mother 's bag is gentle .	the car works with my boss 's dentist 's grandmother 's daughter 's mom 's doctor 's brother 's mother 's bag is gentle .
the shirt says that your mother 's mother 's dad 's mom 's dentist 's doctor 's grandmother 's father 's door is surprised .	the shirt talks to your mother 's mother 's dad 's mom 's dentist 's doctor 's grandmother 's father 's door is surprised .
the doll knows that my cousin 's doctor 's friend 's mom 's mother 's sister 's teacher 's mother 's bottle is friendly .	the doll works with my cousin 's doctor 's friend 's mom 's mother 's sister 's teacher 's mother 's bottle is friendly .
the bottle thinks that my father 's sister 's friend 's mom 's wife 's doctor 's cousin 's mother 's door is busy .	the bottle scares my father 's sister 's friend 's mom 's wife 's doctor 's cousin 's mother 's door is busy .
the truck knows that your friend 's brother 's friend 's grandmother 's sister 's mother 's sister 's grandmother 's book is wrong .	the truck scares your friend 's brother 's friend 's grandmother 's sister 's mother 's sister 's grandmother 's book is wrong .
the couch knows that your brother 's friend 's friend 's dentist 's mother 's wife 's doctor 's brother 's picture is sleepy .	the couch talks to your brother 's friend 's friend 's dentist 's mother 's wife 's doctor 's brother 's picture is sleepy .
the mirror knows that my sister 's doctor 's cousin 's boss 's grandmother 's mom 's sister 's father 's shoe is helpful .	the mirror talks to my sister 's doctor 's cousin 's boss 's grandmother 's mom 's sister 's father 's shoe is helpful .
the rocket knows that my grandmother 's father 's brother 's sister 's boss 's friend 's boss 's doctor 's ring is healthy .	the rocket works with my grandmother 's father 's brother 's sister 's boss 's friend 's boss 's doctor 's ring is healthy .
the bed says that your father 's friend 's husband 's dad 's daughter 's father 's husband 's dad 's candle is upset .	the bed scares your father 's friend 's husband 's dad 's daughter 's father 's husband 's dad 's candle is upset .
the plate thinks that your teacher 's brother 's brother 's mother 's mom 's mother 's dad 's brother 's crayon is tired .	the plate works with your teacher 's brother 's brother 's mother 's mom 's mother 's dad 's brother 's crayon is tired .
the candle says that my cousin 's dad 's father 's mother 's teacher 's doctor 's dad 's mom 's bed is hungry .	the candle helps my cousin 's dad 's father 's mother 's teacher 's doctor 's dad 's mom 's bed is hungry .
the plate says that my sister 's wife 's friend 's grandmother 's mother 's friend 's dentist 's daughter 's ring is tall .	the plate talks to my sister 's wife 's friend 's grandmother 's mother 's friend 's dentist 's daughter 's ring is tall .
the box knows that your husband 's teacher 's mother 's wife 's doctor 's dad 's grandmother 's boss 's bicycle is boring .	the box works with your husband 's teacher 's mother 's wife 's doctor 's dad 's grandmother 's boss 's bicycle is boring .
the door thinks that my doctor 's wife 's boss 's daughter 's dad 's sister 's sister 's dentist 's hat is bored .	the door scares my doctor 's wife 's boss 's daughter 's dad 's sister 's sister 's dentist 's hat is bored .
the ring says that my husband 's mom 's doctor 's wife 's wife 's boss 's mother 's daughter 's book is bored .	the ring works with my husband 's mom 's doctor 's wife 's wife 's boss 's mother 's daughter 's book is bored .
the ring says that your wife 's dentist 's boss 's teacher 's sister 's dentist 's boss 's doctor 's window is confused .	the ring talks to your wife 's dentist 's boss 's teacher 's sister 's dentist 's boss 's doctor 's window is confused .
the mirror thinks that your father 's dad 's doctor 's dad 's doctor 's grandmother 's father 's mother 's boat is young .	the mirror works with your father 's dad 's doctor 's dad 's doctor 's grandmother 's father 's mother 's boat is young .
the rocket knows that my teacher 's wife 's sister 's husband 's sister 's grandmother 's wife 's husband 's car is busy .	the rocket talks to my teacher 's wife 's sister 's husband 's sister 's grandmother 's wife 's husband 's car is busy .
the truck says that your mom 's teacher 's son 's daughter 's teacher 's friend 's brother 's brother 's boat is boring .	the truck talks to your mom 's teacher 's son 's daughter 's teacher 's friend 's brother 's brother 's boat is boring .
the hat knows that my daughter 's teacher 's boss 's dad 's son 's grandmother 's daughter 's friend 's glass is quiet .	the hat talks to my daughter 's teacher 's boss 's dad 's son 's grandmother 's daughter 's friend 's glass is quiet .
the shoe knows that your husband 's grandmother 's doctor 's daughter 's son 's grandmother 's dentist 's mother 's plane is confused .	the shoe works with your husband 's grandmother 's doctor 's daughter 's son 's grandmother 's dentist 's mother 's plane is confused .
the toy says that my daughter 's cousin 's cousin 's cousin 's wife 's husband 's dentist 's wife 's mirror is curious .	the toy talks to my daughter 's cousin 's cousin 's cousin 's wife 's husband 's dentist 's wife 's mirror is curious .
the car says that my wife 's mother 's husband 's brother 's father 's daughter 's mom 's daughter 's bicycle is boring .	the car helps my wife 's mother 's husband 's brother 's father 's daughter 's mom 's daughter 's bicycle is boring .
the car says that my cousin 's sister 's wife 's friend 's brother 's dentist 's son 's daughter 's door is boring .	the car talks to my cousin 's sister 's wife 's friend 's brother 's dentist 's son 's daughter 's door is boring .
the dish says that your friend 's dad 's grandmother 's father 's teacher 's boss 's husband 's teacher 's rug is nice .	the dish works with your friend 's dad 's grandmother 's father 's teacher 's boss 's husband 's teacher 's rug is nice .
the shoe thinks that my father 's boss 's sister 's mother 's mother 's cousin 's sister 's mom 's truck is careful .	the shoe scares my father 's boss 's sister 's mother 's mother 's cousin 's sister 's mom 's truck is careful .
the picture thinks that your grandmother 's father 's mom 's sister 's brother 's mom 's mom 's brother 's fork is friendly .	the picture talks to your grandmother 's father 's mom 's sister 's brother 's mom 's mom 's brother 's fork is friendly .
the door knows that your grandmother 's doctor 's friend 's teacher 's mother 's mother 's mom 's wife 's candle is curious .	the door talks to your grandmother 's doctor 's friend 's teacher 's mother 's mother 's mom 's wife 's candle is curious .
the spoon thinks that your son 's sister 's brother 's husband 's brother 's mom 's son 's boss 's fork is young .	the spoon scares your son 's sister 's brother 's husband 's brother 's mom 's son 's boss 's fork is young .
the dish says that your friend 's father 's brother 's friend 's father 's cousin 's teacher 's father 's ship is hungry .	the dish talks to your friend 's father 's brother 's friend 's father 's cousin 's teacher 's father 's ship is hungry .
the book knows that my boss 's son 's brother 's doctor 's friend 's sister 's cousin 's dentist 's cup is lucky .	the book scares my boss 's son 's brother 's doctor 's friend 's sister 's cousin 's dentist 's cup is lucky .
the hat says that your friend 's mother 's son 's grandmother 's mother 's dad 's mom 's sister 's picture is nice .	the hat works with your friend 's mother 's son 's grandmother 's mother 's dad 's mom 's sister 's picture is nice .
the button says that my cousin 's dentist 's dad 's friend 's cousin 's father 's sister 's dentist 's box is curious .	the button works with my cousin 's dentist 's dad 's friend 's cousin 's father 's sister 's dentist 's box is curious .
the doll knows that my husband 's boss 's dad 's dentist 's brother 's grandmother 's mom 's cousin 's door is helpful .	the doll helps my husband 's boss 's dad 's dentist 's brother 's grandmother 's mom 's cousin 's door is helpful .
the book knows that your father 's mom 's doctor 's cousin 's son 's dentist 's teacher 's mother 's car is sleepy .	the book helps your father 's mom 's doctor 's cousin 's son 's dentist 's teacher 's mother 's car is sleepy .
the box thinks that my mother 's brother 's boss 's sister 's grandmother 's mom 's dad 's grandmother 's rug is hungry .	the box talks to my mother 's brother 's boss 's sister 's grandmother 's mom 's dad 's grandmother 's rug is hungry .
the rocket knows that my cousin 's boss 's son 's wife 's father 's mom 's wife 's grandmother 's chair is surprised .	the rocket works with my cousin 's boss 's son 's wife 's father 's mom 's wife 's grandmother 's chair is surprised .
the hat knows that your teacher 's cousin 's husband 's teacher 's mother 's cousin 's boss 's mother 's window is nice .	the hat works with your teacher 's cousin 's husband 's teacher 's mother 's cousin 's boss 's mother 's window is nice .
the chair says that my dentist 's boss 's cousin 's mother 's cousin 's teacher 's grandmother 's teacher 's rocket is bored .	the chair works with my dentist 's boss 's cousin 's mother 's cousin 's teacher 's grandmother 's teacher 's rocket is bored .
the spoon knows that your wife 's friend 's husband 's grandmother 's wife 's brother 's daughter 's dentist 's ring is boring .	the spoon talks to your wife 's friend 's husband 's grandmother 's wife 's brother 's daughter 's dentist 's ring is boring .
the mirror knows that my mom 's grandmother 's father 's dentist 's mom 's mother 's son 's brother 's couch is happy .	the mirror works with my mom 's grandmother 's father 's dentist 's mom 's mother 's son 's brother 's couch is happy .
the spoon says that my mom 's dentist 's dad 's grandmother 's doctor 's husband 's son 's son 's spoon is quiet .	the spoon scares my mom 's dentist 's dad 's grandmother 's doctor 's husband 's son 's son 's spoon is quiet .
the plate thinks that your daughter 's husband 's dad 's grandmother 's father 's dentist 's mom 's boss 's hat is upset .	the plate talks to your daughter 's husband 's dad 's grandmother 's father 's dentist 's mom 's boss 's hat is upset .
the bed says that your cousin 's wife 's grandmother 's doctor 's dad 's dad 's daughter 's grandmother 's mirror is excited .	the bed talks to your cousin 's wife 's grandmother 's doctor 's dad 's dad 's daughter 's grandmother 's mirror is excited .
the bottle thinks that my mother 's cousin 's teacher 's wife 's daughter 's cousin 's brother 's grandmother 's mirror is angry .	the bottle helps my mother 's cousin 's teacher 's wife 's daughter 's cousin 's brother 's grandmother 's mirror is angry .
the toy knows that my son 's boss 's father 's dentist 's mom 's mother 's friend 's daughter 's bowl is upset .	the toy talks to my son 's boss 's father 's dentist 's mom 's mother 's friend 's daughter 's bowl is upset .
the rocket knows that my sister 's mother 's teacher 's daughter 's sister 's grandmother 's dentist 's sister 's doll is lucky .	the rocket works with my sister 's mother 's teacher 's daughter 's sister 's grandmother 's dentist 's sister 's doll is lucky .
the mirror thinks that your boss 's brother 's friend 's doctor 's mom 's husband 's brother 's mother 's couch is tired .	the mirror helps your boss 's brother 's friend 's doctor 's mom 's husband 's brother 's mother 's couch is tired .
the book knows that your daughter 's husband 's son 's mother 's dad 's son 's boss 's wife 's door is hungry .	the book talks to your daughter 's husband 's son 's mother 's dad 's son 's boss 's wife 's door is hungry .
the bowl says that my husband 's sister 's grandmother 's teacher 's daughter 's mother 's son 's daughter 's rug is kind .	the bowl talks to my husband 's sister 's grandmother 's teacher 's daughter 's mother 's son 's daughter 's rug is kind .
the bowl says that my doctor 's teacher 's sister 's friend 's husband 's friend 's grandmother 's mom 's glass is healthy .	the bowl helps my doctor 's teacher 's sister 's friend 's husband 's friend 's grandmother 's mom 's glass is healthy .
the couch thinks that my mother 's wife 's father 's father 's son 's father 's teacher 's mom 's glass is sleepy .	the couch scares my mother 's wife 's father 's father 's son 's father 's teacher 's mom 's glass is sleepy .
the picture thinks that your dad 's grandmother 's daughter 's son 's friend 's daughter 's father 's teacher 's hat is important .	the picture works with your dad 's grandmother 's daughter 's son 's friend 's daughter 's father 's teacher 's hat is important .
the toy thinks that your teacher 's dad 's grandmother 's wife 's sister 's mother 's boss 's friend 's book is curious .	the toy works with your teacher 's dad 's grandmother 's wife 's sister 's mother 's boss 's friend 's book is curious .
the door knows that my dad 's doctor 's son 's son 's brother 's friend 's dad 's wife 's shoe is tall .	the door talks to my dad 's doctor 's son 's son 's brother 's friend 's dad 's wife 's shoe is tall .
the bicycle thinks that your boss 's husband 's friend 's dad 's husband 's sister 's daughter 's son 's window is upset .	the bicycle works with your boss 's husband 's friend 's dad 's husband 's sister 's daughter 's son 's window is upset .
the button knows that my wife 's friend 's wife 's boss 's brother 's teacher 's daughter 's brother 's toy is quiet .	the button talks to my wife 's friend 's wife 's boss 's brother 's teacher 's daughter 's brother 's toy is quiet .
the rocket thinks that your daughter 's sister 's husband 's mom 's mother 's cousin 's wife 's daughter 's spoon is surprised .	the rocket helps your daughter 's sister 's husband 's mom 's mother 's cousin 's wife 's daughter 's spoon is surprised .
the shirt thinks that my husband 's dad 's brother 's friend 's brother 's boss 's wife 's dentist 's dish is tall .	the shirt talks to my husband 's dad 's brother 's friend 's brother 's boss 's wife 's dentist 's dish is tall .
the chair knows that your daughter 's dentist 's sister 's friend 's son 's friend 's grandmother 's grandmother 's ship is sleepy .	the chair helps your daughter 's dentist 's sister 's friend 's son 's friend 's grandmother 's grandmother 's ship is sleepy .
the dish says that your father 's boss 's dad 's teacher 's dad 's husband 's wife 's wife 's glass is confused .	the dish works with your father 's boss 's dad 's teacher 's dad 's husband 's wife 's wife 's glass is confused .
the book knows that your wife 's doctor 's friend 's father 's husband 's mother 's mom 's sister 's rug is busy .	the book helps your wife 's doctor 's friend 's father 's husband 's mother 's mom 's sister 's rug is busy .
the spoon thinks that my mom 's dad 's boss 's father 's grandmother 's friend 's teacher 's son 's bed is curious .	the spoon helps my mom 's dad 's boss 's father 's grandmother 's friend 's teacher 's son 's bed is curious .
the button thinks that my dad 's daughter 's boss 's mom 's mother 's wife 's grandmother 's mother 's doll is boring .	the button scares my dad 's daughter 's boss 's mom 's mother 's wife 's grandmother 's mother 's doll is boring .
the mirror thinks that my father 's wife 's mom 's cousin 's dentist 's boss 's grandmother 's mother 's plane is friendly .	the mirror helps my father 's wife 's mom 's cousin 's dentist 's boss 's grandmother 's mother 's plane is friendly .
the rocket thinks that your grandmother 's son 's brother 's wife 's wife 's friend 's sister 's grandmother 's cup is wrong .	the rocket talks to your grandmother 's son 's brother 's wife 's wife 's friend 's sister 's grandmother 's cup is wrong .
the rug knows that my doctor 's grandmother 's sister 's mother 's wife 's son 's sister 's mother 's box is wrong .	the rug scares my doctor 's grandmother 's sister 's mother 's wife 's son 's sister 's mother 's box is wrong .
the shirt says that your sister 's doctor 's sister 's boss 's dentist 's wife 's brother 's teacher 's shoe is tall .	the shirt works with your sister 's doctor 's sister 's boss 's dentist 's wife 's brother 's teacher 's shoe is tall .
the bowl says that your son 's daughter 's boss 's daughter 's mom 's dad 's father 's grandmother 's toy is tired .	the bowl talks to your son 's daughter 's boss 's daughter 's mom 's dad 's father 's grandmother 's toy is tired .
the ring says that your teacher 's wife 's cousin 's dad 's boss 's cousin 's friend 's father 's shirt is young .	the ring helps your teacher 's wife 's cousin 's dad 's boss 's cousin 's friend 's father 's shirt is young .
the window knows that my mother 's husband 's doctor 's wife 's boss 's doctor 's boss 's friend 's boat is strong .	the window works with my mother 's husband 's doctor 's wife 's boss 's doctor 's boss 's friend 's boat is strong .
the ring knows that my wife 's mom 's boss 's mom 's father 's dentist 's son 's son 's car is kind .	the ring helps my wife 's mom 's boss 's mom 's father 's dentist 's son 's son 's car is kind .
the dish thinks that my mother 's boss 's friend 's cousin 's husband 's cousin 's doctor 's teacher 's shoe is smart .	the dish scares my mother 's boss 's friend 's cousin 's husband 's cousin 's doctor 's teacher 's shoe is smart .
the candle knows that your doctor 's daughter 's friend 's cousin 's sister 's brother 's mom 's dad 's chair is surprised .	the candle talks to your doctor 's daughter 's friend 's cousin 's sister 's brother 's mom 's dad 's chair is surprised .
the crayon knows that my mother 's son 's son 's grandmother 's husband 's father 's teacher 's teacher 's boat is sleepy .	the crayon scares my mother 's son 's son 's grandmother 's husband 's father 's teacher 's teacher 's boat is sleepy .
the bottle knows that your grandmother 's son 's wife 's wife 's father 's mom 's doctor 's husband 's ring is young .	the bottle helps your grandmother 's son 's wife 's wife 's father 's mom 's doctor 's husband 's ring is young .
the ring knows that your friend 's boss 's brother 's teacher 's friend 's grandmother 's boss 's grandmother 's shirt is tall .	the ring talks to your friend 's boss 's brother 's teacher 's friend 's grandmother 's boss 's grandmother 's shirt is tall .
the crayon says that your boss 's mother 's husband 's doctor 's father 's cousin 's mom 's wife 's book is excited .	the crayon talks to your boss 's mother 's husband 's doctor 's father 's cousin 's mom 's wife 's book is excited .
